0,,"おぉ、持ってきてくれたか！
良かった――
これで何とか当分しのげそうだよ",,ui\00_message\quest\q20000009.gmd,\quest\q20000009.arc,q20000009.arc,20,Henry
0,,"あなたが来てくれなかったらと思うと
とても恐ろしい
本当に感謝する",,ui\00_message\quest\q20000009.gmd,\quest\q20000009.arc,q20000009.arc,21,Henry
0,,"すまないが、できれば急いで
もらいたいんだ",,ui\00_message\quest\q20000009.gmd,\quest\q20000009.arc,q20000009.arc,22,Henry
0,,強く言えた立場じゃないんだが――,,ui\00_message\quest\q20000009.gmd,\quest\q20000009.arc,q20000009.arc,23,Henry
0,,"ジンゲンまで届け物があるんだけど
道中が物騒で困ってるのよ",,ui\00_message\quest\q20000010.gmd,\quest\q20000010.arc,q20000010.arc,0,Woman
0,,"悪いんだけど、厄介そうなのを
退治してくれないかしら？",,ui\00_message\quest\q20000010.gmd,\quest\q20000010.arc,q20000010.arc,1,Woman
0,,"ジンゲンまで届け物があるんだけど
あまりに道中が不安で足止めをくってたの",,ui\00_message\quest\q20000010.gmd,\quest\q20000010.arc,q20000010.arc,2,Woman
0,,"なんだか、かなり危なそうなのがいてね
このままじゃさすがに通れそうにないの
お願い、退治してくれないかしら",,ui\00_message\quest\q20000010.gmd,\quest\q20000010.arc,q20000010.arc,3,Woman
0,,でも、怪我だけはしないようにね,,ui\00_message\quest\q20000010.gmd,\quest\q20000010.arc,q20000010.arc,4,Woman
0,,"ジンゲンまで届け物があるんだけど――
どうしよう――！",,ui\00_message\quest\q20000010.gmd,\quest\q20000010.arc,q20000010.arc,5,Woman
0,,"ここにあんな化け物が出るなんて聞いてない
っていうか、このままじゃ誰もこの道を
通れないんじゃないかしら",,ui\00_message\quest\q20000010.gmd,\quest\q20000010.arc,q20000010.arc,6,Woman
0,,"ねぇ、なんとか退治してもらえないかしら
この通り困ってるの",,ui\00_message\quest\q20000010.gmd,\quest\q20000010.arc,q20000010.arc,7,Woman
0,,"でも、無理ならあきらめて戻ってくるのよ？
命かけろなんて言ってないからね",,ui\00_message\quest\q20000010.gmd,\quest\q20000010.arc,q20000010.arc,8,Woman
0,,"あ、無事だった？　良かったわ
これで何とかジンゲンまで行けそう",,ui\00_message\quest\q20000010.gmd,\quest\q20000010.arc,q20000010.arc,9,Woman
0,,"この辺りは、特に物取りや魔物が
集まりやすいの
また何かあったらヨロシクね",,ui\00_message\quest\q20000010.gmd,\quest\q20000010.arc,q20000010.arc,10,Woman
0,,"あ、無事だった？　良かったわ
いかにも危なそうだったから心配だったの
これで何とかジンゲンまで行けそう",,ui\00_message\quest\q20000010.gmd,\quest\q20000010.arc,q20000010.arc,11,Woman
0,,"この辺りは、特に物取りや魔物が
集まりやすいの
また何かあったらヨロシクね",,ui\00_message\quest\q20000010.gmd,\quest\q20000010.arc,q20000010.arc,12,Woman
0,,"あ、無事だった？　良かったわ
あんな魔物を倒せるなんてスゴいじゃない
これで何とかジンゲンまで行けそう",,ui\00_message\quest\q20000010.gmd,\quest\q20000010.arc,q20000010.arc,13,Woman
0,,"この辺り、たまにああいう危ないのが出るみたい
もしまた何かあったらヨロシクね",,ui\00_message\quest\q20000010.gmd,\quest\q20000010.arc,q20000010.arc,14,Woman
0,,"どう？　何とかなりそう？
無理ならミスリウの方から行くしかないけど
ずいぶん遠回りなのよね",,ui\00_message\quest\q20000010.gmd,\quest\q20000010.arc,q20000010.arc,15,Woman
0,,"ちょっとお願いがあるんだけど
聞くだけ聞く？",,ui\00_message\quest\q20000011.gmd,\quest\q20000011.arc,q20000011.arc,0,Klaus
0,,"実は半ば趣味なんだけど読めないくらい
ボロい資料や、今じゃ使い方も
わからないような道具とかを集めていてさ",,ui\00_message\quest\q20000011.gmd,\quest\q20000011.arc,q20000011.arc,1,Klaus
0,,"最近も近くの遺跡で見つかったらしいんだけど
忙しくて取りにいけないんだ
代わりに行ってくれないかな？",,ui\00_message\quest\q20000011.gmd,\quest\q20000011.arc,q20000011.arc,2,Klaus
0,,"頼む――このとおり！
気になって仕事が手につかないんだ
宝箱に入ってるから、それをヒョイって
持ってきてくれればいいんだ",,ui\00_message\quest\q20000011.gmd,\quest\q20000011.arc,q20000011.arc,3,Klaus
0,,"ちょっとお願いがあるんだけど
聞くだけ聞く？",,ui\00_message\quest\q20000011.gmd,\quest\q20000011.arc,q20000011.arc,4,Klaus
0,,"実は半ば趣味なんだけど読めないくらい
ボロい資料や、今じゃ使い方も
わからないような道具とかを集めていてさ",,ui\00_message\quest\q20000011.gmd,\quest\q20000011.arc,q20000011.arc,5,Klaus
0,,"最近も近くの遺跡で見つかったらしいんだけど
忙しくて取りにいけないんだ
代わりに行ってくれないかな？",,ui\00_message\quest\q20000011.gmd,\quest\q20000011.arc,q20000011.arc,6,Klaus
0,,"頼む――このとおり！
気になって仕事が手につかないんだ",,ui\00_message\quest\q20000011.gmd,\quest\q20000011.arc,q20000011.arc,7,Klaus
0,,"男が物々交換を持ちかけてくるはずだから
言うことをきいてやってほしい
面倒くさくてごめんよ",,ui\00_message\quest\q20000011.gmd,\quest\q20000011.arc,q20000011.arc,8,Klaus
0,,"ちょっとお願いがあるんだけど
聞くだけ聞く？",,ui\00_message\quest\q20000011.gmd,\quest\q20000011.arc,q20000011.arc,9,Klaus
0,,"実は半ば趣味なんだけど読めないくらい
ボロい資料や、今じゃ使い方も
わからないような道具とかを集めていてさ",,ui\00_message\quest\q20000011.gmd,\quest\q20000011.arc,q20000011.arc,10,Klaus
0,,"最近も近くの遺跡で見つかったらしいんだけど
忙しくて取りにいけないんだ
代わりに行ってくれないかな？",,ui\00_message\quest\q20000011.gmd,\quest\q20000011.arc,q20000011.arc,11,Klaus
0,,"頼む――このとおり！
気になって仕事が手につかないんだ",,ui\00_message\quest\q20000011.gmd,\quest\q20000011.arc,q20000011.arc,12,Klaus
0,,"お宝は魔物が体内に取り込んでいるらしいから
そいつを倒せば手に入るはず
魔物退治は喜ばれるし一石二鳥だね！",,ui\00_message\quest\q20000011.gmd,\quest\q20000011.arc,q20000011.arc,13,Klaus
0,,"ふん、クラウスの使いか
奴も偉くなったもんだな",,ui\00_message\quest\q20000011.gmd,\quest\q20000011.arc,q20000011.arc,14,Bandit
0,,"このお宝を手に入れるために
随分と苦労したんだ――
どうしてもというなら、礼を先払いしてもらいたいね",,ui\00_message\quest\q20000011.gmd,\quest\q20000011.arc,q20000011.arc,15,Bandit
0,,"ほう、本当に持ってくるとはな
ってことはこのお宝は本物のお宝かよ
そういうことなら、これは渡せないな――",,ui\00_message\quest\q20000011.gmd,\quest\q20000011.arc,q20000011.arc,16,Bandit
0,,"って冗談だって！
ほら、持っていけ――クラウスによろしくな",,ui\00_message\quest\q20000011.gmd,\quest\q20000011.arc,q20000011.arc,17,Bandit
0,,"へえ――掘り出し物ってこれだったのか！
うーん、調べがいがあるよ
ありがとう、また頼むね",,ui\00_message\quest\q20000011.gmd,\quest\q20000011.arc,q20000011.arc,18,Klaus
0,,"ふーん、これかあ！
確かにこれは素晴らしい――
こんなに完全な形で出るのは珍しいんだ",,ui\00_message\quest\q20000011.gmd,\quest\q20000011.arc,q20000011.arc,19,Klaus
0,,"うん、ありがとう
また頼むよ",,ui\00_message\quest\q20000011.gmd,\quest\q20000011.arc,q20000011.arc,20,Klaus
0,,"うわ！　これ！？
これは本当に珍しくて凄いものだよ！
手に入れるのは大変だったろう？",,ui\00_message\quest\q20000011.gmd,\quest\q20000011.arc,q20000011.arc,21,Klaus
0,,"君は本当に頼りになるね
これからも、ここぞって時は君に頼ませてよ
もちろんお礼はするからね",,ui\00_message\quest\q20000011.gmd,\quest\q20000011.arc,q20000011.arc,22,Klaus
0,,"忙しい時は断ってもらった方が
僕も気が楽だな",,ui\00_message\quest\q20000011.gmd,\quest\q20000011.arc,q20000011.arc,23,Klaus
0,,"嘆願書がたまっているのだが――
また頼めないだろうか",,ui\00_message\quest\q20000012.gmd,\quest\q20000012.arc,q20000012.arc,0,Joseph
0,,"少々遠い村からの依頼でな――
そういう場所の実状を知っておくのも
大切なことだ",,ui\00_message\quest\q20000012.gmd,\quest\q20000012.arc,q20000012.arc,1,Joseph
0,,"誓願の内容は魔物退治と陳情だ
しっかり話を聞いてくるんだな",,ui\00_message\quest\q20000012.gmd,\quest\q20000012.arc,q20000012.arc,2,Joseph
0,,"嘆願書がたまっているのだが――
また頼めないだろうか",,ui\00_message\quest\q20000012.gmd,\quest\q20000012.arc,q20000012.arc,3,Joseph
0,,"少々遠い村からの依頼でな――
そういう場所の実状を知っておくのも
大切なことだ",,ui\00_message\quest\q20000012.gmd,\quest\q20000012.arc,q20000012.arc,4,Joseph
0,,"誓願の内容は魔物退治と陳情だ
しっかり話を聞いてくるんだな",,ui\00_message\quest\q20000012.gmd,\quest\q20000012.arc,q20000012.arc,5,Joseph
0,,"魔物はそこそこ強く、数も多いらしい
油断は禁物だぞ",,ui\00_message\quest\q20000012.gmd,\quest\q20000012.arc,q20000012.arc,6,Joseph
0,,"嘆願書がたまっているのだが――
また頼めないだろうか",,ui\00_message\quest\q20000012.gmd,\quest\q20000012.arc,q20000012.arc,7,Joseph
0,,"少々遠い村からの依頼でな――
そういう場所の実状を知っておくのも
大切なことだ",,ui\00_message\quest\q20000012.gmd,\quest\q20000012.arc,q20000012.arc,8,Joseph
0,,"誓願の内容は魔物退治と陳情だ
しっかり話を聞いてくるんだな",,ui\00_message\quest\q20000012.gmd,\quest\q20000012.arc,q20000012.arc,9,Joseph
0,,"魔物はかなり数が多いらしく――
しかも、どちらかと言えば強い部類らしい
心して、戦ってくれ",,ui\00_message\quest\q20000012.gmd,\quest\q20000012.arc,q20000012.arc,10,Joseph
0,,"おいおい、神殿から来た覚者さんかよ
嘆願書ってこっからでも届くんだな",,ui\00_message\quest\q20000012.gmd,\quest\q20000012.arc,q20000012.arc,11,Jordan
0,,"でも――ふん、正直今さらって感じだぜ
あんたが来るまでに何人死んだと思う？",,ui\00_message\quest\q20000012.gmd,\quest\q20000012.arc,q20000012.arc,12,Jordan
0,,"来てくれたのはありがたいが、それよりも
常駐の騎士団部隊を配備してもらえんかね
もちろん覚者でも構わないよ",,ui\00_message\quest\q20000012.gmd,\quest\q20000012.arc,q20000012.arc,13,Lifeless Villager
0,,"こんな辺境――神殿から離れた土地じゃあ
竜力がまったく届かなくてね",,ui\00_message\quest\q20000012.gmd,\quest\q20000012.arc,q20000012.arc,14,Lifeless Villager
0,,"白竜さまが守ってくれないなら
せめて騎士団くらい置いてもらわないと",,ui\00_message\quest\q20000012.gmd,\quest\q20000012.arc,q20000012.arc,15,Lifeless Villager
0,,"このあたりに住んでいると
神殿から見捨てられたような気になる
どうして移住しないのか――
のんきな連中はそう思うのだろうな",,ui\00_message\quest\q20000012.gmd,\quest\q20000012.arc,q20000012.arc,16,Brandon
0,,"忘れないでほしいのは
ここはずっと人間の土地だったってことだ
俺達にとっては先祖伝来の土地よ",,ui\00_message\quest\q20000012.gmd,\quest\q20000012.arc,q20000012.arc,17,Brandon
0,,"つまり、俺たちは相当頑張って
ここに人間ありってことを魔物どもに
知らしめているってわけだ",,ui\00_message\quest\q20000012.gmd,\quest\q20000012.arc,q20000012.arc,18,Brandon
0,,"神殿のあんたらも、少しは協力してくれよ
明け渡すのなんか、簡単だぞ？",,ui\00_message\quest\q20000012.gmd,\quest\q20000012.arc,q20000012.arc,19,Brandon
0,,"はぁああ、嘆願にはもっと早く
反応してもらえると嬉しいんだがね",,ui\00_message\quest\q20000012.gmd,\quest\q20000012.arc,q20000012.arc,20,Emporio
0,,"我々がいなくなったら、このあたりは
未開の地と同じだろう？
完全にオークの天下というわけだ",,ui\00_message\quest\q20000012.gmd,\quest\q20000012.arc,q20000012.arc,21,Emporio
0,,"そうなったら何が起こっても
情報は入らないんだが、そこをもう少しばかり
解ってもらえないかね――ふうう",,ui\00_message\quest\q20000012.gmd,\quest\q20000012.arc,q20000012.arc,22,Emporio
0,,"ご苦労さんだったね
お茶でも飲んでいくかい？",,ui\00_message\quest\q20000012.gmd,\quest\q20000012.arc,q20000012.arc,23,Sunny
0,,"あっははは、とは言ってもろくな葉っぱ
は取れないし、水も泥臭いけどね
一番いいのを出すから、我慢しておくれよ！",,ui\00_message\quest\q20000012.gmd,\quest\q20000012.arc,q20000012.arc,24,Sunny
0,,"ご苦労さまです
あなたはきちんとした人みたいで
安心しました",,ui\00_message\quest\q20000012.gmd,\quest\q20000012.arc,q20000012.arc,25,Johann
0,,"前に来た騎士団の方々は
この村を辺鄙だの廃村だのおっしゃった
挙句、オークを見て逃げ帰ってしまいまして",,ui\00_message\quest\q20000012.gmd,\quest\q20000012.arc,q20000012.arc,26,Johann
0,,"とてもではありませんが、誠意ある行い
ではありませんでした
臆病な私ですら言葉を失いましたから",,ui\00_message\quest\q20000012.gmd,\quest\q20000012.arc,q20000012.arc,27,Johann
0,,"こんなところにはね――夢も希望もないよ
どうして住んでいるのかって聞かれても
困っちゃうけどね
新しい生活に踏み出すのが億劫で――",,ui\00_message\quest\q20000012.gmd,\quest\q20000012.arc,q20000012.arc,28,Lifeless Villager
0,,"ふむ――浮かない顔だな
まあ、わからないでもない",,ui\00_message\quest\q20000012.gmd,\quest\q20000012.arc,q20000012.arc,29,Joseph
0,,"辺境の様子はわたしが若い頃でさえ
あまり良いものではなかった
残念なことだが――現実だ",,ui\00_message\quest\q20000012.gmd,\quest\q20000012.arc,q20000012.arc,30,Joseph
0,,"ふむ――浮かない顔だな
まあ、わからないでもない",,ui\00_message\quest\q20000012.gmd,\quest\q20000012.arc,q20000012.arc,31,Joseph
0,,"辺境の様子はわたしが若い頃でさえ
あまり良いものではなかった",,ui\00_message\quest\q20000012.gmd,\quest\q20000012.arc,q20000012.arc,32,Joseph
0,,"覚者や騎士団を送れば
少しは改善されるだろうが
やはり竜力が届かないことには
豊かな村の再生は難しいのだ",,ui\00_message\quest\q20000012.gmd,\quest\q20000012.arc,q20000012.arc,33,Joseph
0,,"あんな村はレスタニア全土にたくさんある
我々が彼らに報いるのは目先の利益ではなく
白竜の早い回復に貢献すること――
わたしはそう信じているのだ",,ui\00_message\quest\q20000012.gmd,\quest\q20000012.arc,q20000012.arc,34,Joseph
0,,"ふむ――浮かない顔だな
まあ、わからないでもない",,ui\00_message\quest\q20000012.gmd,\quest\q20000012.arc,q20000012.arc,35,Joseph
0,,"辺境の様子はわたしが若い頃でさえ
あまり良いものではなかった",,ui\00_message\quest\q20000012.gmd,\quest\q20000012.arc,q20000012.arc,36,Joseph
0,,"覚者や騎士団を送れば
少しは改善されるだろうが
やはり竜力が届かないことには
豊かな村の再生は難しいのだ",,ui\00_message\quest\q20000012.gmd,\quest\q20000012.arc,q20000012.arc,37,Joseph
0,,"あんな村はレスタニア全土にたくさんある
我々が彼らに報いるのは目先の利益ではなく
白竜の早い回復に貢献すること――
わたしはそう信じているのだ",,ui\00_message\quest\q20000012.gmd,\quest\q20000012.arc,q20000012.arc,38,Joseph
0,,"ともあれ、ご苦労だった
おまえがあの村を訪ねることは
もうないかもしれないが――けして忘れるな",,ui\00_message\quest\q20000012.gmd,\quest\q20000012.arc,q20000012.arc,39,Joseph
0,,"こんな時代も悪くない――
神殿にはそんなことを思って軽薄に暮らす
者たちが多いが、彼らは、辺境の苦しみなど
何も知らないのだ",,ui\00_message\quest\q20000012.gmd,\quest\q20000012.arc,q20000012.arc,40,Joseph
0,,おまえにはそうはなって欲しくないからな,,ui\00_message\quest\q20000012.gmd,\quest\q20000012.arc,q20000012.arc,41,Joseph
0,,どうした――村人が首を長くして待っているぞ？,,ui\00_message\quest\q20000012.gmd,\quest\q20000012.arc,q20000012.arc,42,Joseph
0,,"あのね――
森の、わたしの大好きな場所に
魔物が集まっているみたいなの
荒らされたら悲しいから退治してくれる？",,ui\00_message\quest\q20000013.gmd,\quest\q20000013.arc,q20000013.arc,0,Mayleaf
0,,"覚者さんなら、きっと簡単だと思うな
お願い！",,ui\00_message\quest\q20000013.gmd,\quest\q20000013.arc,q20000013.arc,1,Mayleaf
0,,"あのね――
森の、わたしの大好きな場所に
魔物が集まっているみたいなの
荒らされたら切ないから退治してくれる？",,ui\00_message\quest\q20000013.gmd,\quest\q20000013.arc,q20000013.arc,2,Mayleaf
0,,"覚者さんなら、きっと簡単だと思うな
ううん、ちょっと大変かも
でも、お願い！",,ui\00_message\quest\q20000013.gmd,\quest\q20000013.arc,q20000013.arc,3,Mayleaf
0,,"あのね――
森の、わたしの大好きな場所に
魔物が集まっているみたいなの
荒らされたら悔しいから退治してくれる？",,ui\00_message\quest\q20000013.gmd,\quest\q20000013.arc,q20000013.arc,4,Mayleaf
0,,"覚者さんなら、きっと簡単だと思うな
ううん、ちょっと大変かも
どうかな――すっごく大変だったらごめんさない
でも、お願い！",,ui\00_message\quest\q20000013.gmd,\quest\q20000013.arc,q20000013.arc,5,Mayleaf
0,,"退治してくれたの！？
ありがとう！
お願いをきいてくれて、とってもうれしいよ",,ui\00_message\quest\q20000013.gmd,\quest\q20000013.arc,q20000013.arc,6,Mayleaf
0,,"退治してくれたの！？
ありがとう！
お願いをきいてくれて、とってもうれしいよ",,ui\00_message\quest\q20000013.gmd,\quest\q20000013.arc,q20000013.arc,7,Mayleaf
0,,きっと森も喜んでいると思うな,,ui\00_message\quest\q20000013.gmd,\quest\q20000013.arc,q20000013.arc,8,Mayleaf
0,,"退治してくれたの！？
ありがとう！
お願いをきいてくれて、とってもうれしいよ",,ui\00_message\quest\q20000013.gmd,\quest\q20000013.arc,q20000013.arc,9,Mayleaf
0,,きっと森も喜んでいると思うな,,ui\00_message\quest\q20000013.gmd,\quest\q20000013.arc,q20000013.arc,10,Mayleaf
0,,"ううん、森だけじゃなくて――
森の動物たちもねっ！",,ui\00_message\quest\q20000013.gmd,\quest\q20000013.arc,q20000013.arc,11,Mayleaf
0,,"覚者さん、お願い――
森を助けてね",,ui\00_message\quest\q20000013.gmd,\quest\q20000013.arc,q20000013.arc,12,Mayleaf
0,,"あのね――前にわたしのために指輪を
作ってくれたの、覚えてる？",,ui\00_message\quest\q20000014.gmd,\quest\q20000014.arc,q20000014.arc,0,Mayleaf
0,,"またね、欲しいなぁ――と思うのがあるんだけど
欲張っちゃダメかな？
でも、欲しいんだもの――仕方がないよね？",,ui\00_message\quest\q20000014.gmd,\quest\q20000014.arc,q20000014.arc,1,Mayleaf
0,,"あのね――前にわたしのために指輪を
作ってくれたの、覚えてる？",,ui\00_message\quest\q20000014.gmd,\quest\q20000014.arc,q20000014.arc,2,Mayleaf
0,,"またね、欲しいなぁ――と思うのがあるんだけど
欲張っちゃダメかな？
みんなのとは違う、珍しいのがいいなって
思っているんだけど",,ui\00_message\quest\q20000014.gmd,\quest\q20000014.arc,q20000014.arc,3,Mayleaf
0,,"あのね――前にわたしのために指輪を
作ってくれたの、覚えてる？",,ui\00_message\quest\q20000014.gmd,\quest\q20000014.arc,q20000014.arc,4,Mayleaf
0,,"またね、欲しいなぁ――と思うのがあるんだけど
欲張っちゃダメかな？",,ui\00_message\quest\q20000014.gmd,\quest\q20000014.arc,q20000014.arc,5,Mayleaf
0,,"ほとんど誰も見たことがなくて
お店にもないような、綺麗で珍しいのが
欲しいなあって思っちゃったの",,ui\00_message\quest\q20000014.gmd,\quest\q20000014.arc,q20000014.arc,6,Mayleaf
0,,"メイリーフが何かわがままを言ったみたいですね
あなたに装飾品をもらったのが
とってもうれしかったみたい",,ui\00_message\quest\q20000014.gmd,\quest\q20000014.arc,q20000014.arc,7,Pamela
0,,"わあ！　これ――
本当にもらっていいの？
うれしいなあ",,ui\00_message\quest\q20000014.gmd,\quest\q20000014.arc,q20000014.arc,8,Mayleaf
0,,"これ、すごい！　すっごくきれい！
え！？　わたしがもらっていいの？
お願いを聞いてくれたの？",,ui\00_message\quest\q20000014.gmd,\quest\q20000014.arc,q20000014.arc,9,Mayleaf
0,,"うわ――うれしいよぉ
すっごくうれしいよ――ありがとう",,ui\00_message\quest\q20000014.gmd,\quest\q20000014.arc,q20000014.arc,10,Mayleaf
0,,"うわ――きれい――あ、かわいい――
ううん、光にかざすと、ほら、虹色！
え？　これをわたしにくれるの？
お願いをきいてくれたの！？",,ui\00_message\quest\q20000014.gmd,\quest\q20000014.arc,q20000014.arc,11,Mayleaf
0,,"うわ――うれしいよぉ
すっごくうれしいよ――ありがとう
あなたのこと、だーいすき！",,ui\00_message\quest\q20000014.gmd,\quest\q20000014.arc,q20000014.arc,12,Mayleaf
0,,"わたしね、装飾品が大好きなの
綺麗な細工、見てるだけでたのしくて――",,ui\00_message\quest\q20000014.gmd,\quest\q20000014.arc,q20000014.arc,13,Mayleaf
0,,"申し訳ありません
ご無理のない範囲でお願いできれば――",,ui\00_message\quest\q20000014.gmd,\quest\q20000014.arc,q20000014.arc,14,Pamela
0,,"こう言っては悪いが――ひまそうだな
もし時間があるなら、魔物討伐に行ってこないか？
覚者ならこんな依頼は日常茶飯事――だろう？",,ui\00_message\quest\q20000015.gmd,\quest\q20000015.arc,q20000015.arc,0,Heinz
0,,"こう言っては悪いが――ひまそうだな
もし時間があるなら、魔物討伐に行ってこないか？
覚者ならこんな依頼は日常茶飯事――だろう？",,ui\00_message\quest\q20000015.gmd,\quest\q20000015.arc,q20000015.arc,1,Heinz
0,,"まあ、魔物はそこそこ強いらしいから
準備はきちんとしておけよ
舐めてかかると酷い目にあうぞ",,ui\00_message\quest\q20000015.gmd,\quest\q20000015.arc,q20000015.arc,2,Heinz
0,,"こう言っては悪いが――ひまそうだな
もし時間があるなら、魔物討伐に行ってこないか？
覚者ならこんな依頼は日常茶飯事――だろう？",,ui\00_message\quest\q20000015.gmd,\quest\q20000015.arc,q20000015.arc,3,Heinz
0,,"まあ、魔物はかなり凶暴かつ強力らしい
準備はきちんとしておけよ
慎重にいかないとここへは帰って来られないぞ",,ui\00_message\quest\q20000015.gmd,\quest\q20000015.arc,q20000015.arc,4,Heinz
0,,"ほう、腕は確かなようだな
では、これからもよろしく頼む
レスタニアの平和を守ることは
騎士と覚者が分かち合った義務だ",,ui\00_message\quest\q20000015.gmd,\quest\q20000015.arc,q20000015.arc,5,Heinz
0,,"ほう、腕は確かなようだな
では、これからもよろしく頼む
レスタニアの平和を守ることは
騎士と覚者が分かち合った義務だ",,ui\00_message\quest\q20000015.gmd,\quest\q20000015.arc,q20000015.arc,6,Heinz
0,,"――とは言うものの、やはり覚者の方が強い
今回ほどの魔物だと、覚者に頼らねば
――騎士団では犠牲者が出てしまう",,ui\00_message\quest\q20000015.gmd,\quest\q20000015.arc,q20000015.arc,7,Heinz
0,,"悔しいが、それが現実だ
甘んじて受け入れるよ",,ui\00_message\quest\q20000015.gmd,\quest\q20000015.arc,q20000015.arc,8,Heinz
0,,"ほう、腕は確かなようだな
では、これからもよろしく頼む
レスタニアの平和を守ることは
騎士と覚者が分かち合った義務だ",,ui\00_message\quest\q20000015.gmd,\quest\q20000015.arc,q20000015.arc,9,Heinz
0,,"――とは言うものの、やはり覚者の方が強い
いや、おまえが強いというべきか
勇猛な戦いぶりが伝わってきたぞ？",,ui\00_message\quest\q20000015.gmd,\quest\q20000015.arc,q20000015.arc,10,Heinz
0,,"騎士団ではとうてい敵わない相手の時は
また、力を貸してくれ",,ui\00_message\quest\q20000015.gmd,\quest\q20000015.arc,q20000015.arc,11,Heinz
0,,"怖じ気づいたのか？
無理に引き受けることなどないんだぞ？",,ui\00_message\quest\q20000015.gmd,\quest\q20000015.arc,q20000015.arc,12,Heinz
