0,,"あんたに騎士団として正式に頼みたいことがある
魔物討伐に派遣した騎士の部隊が戻らない
新たな部隊を派遣する余裕がなくてな――",,ui\00_message\quest\q20000016.gmd,\quest\q20000016.arc,q20000016.arc,0,Heinz
0,,"現地に行って状況を確認してほしい
もちろん、騎士団から謝礼が出るはずだ",,ui\00_message\quest\q20000016.gmd,\quest\q20000016.arc,q20000016.arc,1,Heinz
0,,"あんたに騎士団として正式に頼みたいことがある
魔物討伐に派遣した騎士の部隊が戻らない
新たな部隊を派遣する余裕がなくてな――",,ui\00_message\quest\q20000016.gmd,\quest\q20000016.arc,q20000016.arc,2,Heinz
0,,"現地に行って状況を確認してほしい
魔物は相当手強いらしいから気をつけてくれ
もちろん、騎士団から相応の謝礼が出るはずだ",,ui\00_message\quest\q20000016.gmd,\quest\q20000016.arc,q20000016.arc,3,Heinz
0,,"あんたに騎士団として正式に頼みたいことがある
魔物討伐に派遣した騎士の部隊が戻らない
新たな部隊を派遣する余裕がなくてな――",,ui\00_message\quest\q20000016.gmd,\quest\q20000016.arc,q20000016.arc,4,Heinz
0,,"現地に行って状況を確認してほしい
もし最悪の事態に陥っているとすれば
とてつもなく強大な魔物がいるということだ
注意して事にあたってくれ",,ui\00_message\quest\q20000016.gmd,\quest\q20000016.arc,q20000016.arc,5,Heinz
0,,"もちろん、騎士団から働きに応じた
謝礼が出るはずだ",,ui\00_message\quest\q20000016.gmd,\quest\q20000016.arc,q20000016.arc,6,Heinz
0,,そうか――やはり全滅か――,,ui\00_message\quest\q20000016.gmd,\quest\q20000016.arc,q20000016.arc,7,Heinz
0,,"しかし、命令に殉じたのであれば
それは彼らの本懐――くっ――くそっ！
おれが行っていればこんなことには――",,ui\00_message\quest\q20000016.gmd,\quest\q20000016.arc,q20000016.arc,8,Heinz
0,,そうか――やはり全滅か――,,ui\00_message\quest\q20000016.gmd,\quest\q20000016.arc,q20000016.arc,9,Heinz
0,,"しかし、命令に殉じたのであれば
それは彼らの本懐――くっ――くそっ！
おれが行っていればこんなことには――",,ui\00_message\quest\q20000016.gmd,\quest\q20000016.arc,q20000016.arc,10,Heinz
0,,"いや――おれが行っても同じ事か――
おまえだからこそ倒せたのだろうな――
我が身の無力が恨めしいぞ",,ui\00_message\quest\q20000016.gmd,\quest\q20000016.arc,q20000016.arc,11,Heinz
0,,そうか――やはり全滅か――,,ui\00_message\quest\q20000016.gmd,\quest\q20000016.arc,q20000016.arc,12,Heinz
0,,"しかし、命令に殉じたのであれば
それは彼らの本懐――くっ――くそっ！
おれが行っていればこんなことには――",,ui\00_message\quest\q20000016.gmd,\quest\q20000016.arc,q20000016.arc,13,Heinz
0,,"いや――おれが行っても同じ事か――
おまえも苦労して倒したのだろう？",,ui\00_message\quest\q20000016.gmd,\quest\q20000016.arc,q20000016.arc,14,Heinz
0,,"なあ、いったいどうして魔物はこんなに
力をつけているんだ？
まどろんでいる白竜が恨めしいぞ",,ui\00_message\quest\q20000016.gmd,\quest\q20000016.arc,q20000016.arc,15,Heinz
0,,相応の手練れを送り込んだのだが――,,ui\00_message\quest\q20000016.gmd,\quest\q20000016.arc,q20000016.arc,16,Heinz
0,,"おっと――いいところで会った
あんたは結構あちこちへ行くだろう？
その時に、ちょっと気にしてほしいものがあるんだ",,ui\00_message\quest\q20000017.gmd,\quest\q20000017.arc,q20000017.arc,0,Fabio
0,,"俺が今集めているもの――
それをだな、手に入れてほしいわけ
頼んだよ",,ui\00_message\quest\q20000017.gmd,\quest\q20000017.arc,q20000017.arc,1,Fabio
0,,"おっと――いいところで会った
あんたは結構あちこちへ行くだろう？
その時に、ちょっと気にしてほしいものがあるんだ",,ui\00_message\quest\q20000017.gmd,\quest\q20000017.arc,q20000017.arc,2,Fabio
0,,"俺が今集めているもの――
それをだな、手に入れてほしいわけ
ちょっと面倒だけどお礼はするよ
頼んだよ",,ui\00_message\quest\q20000017.gmd,\quest\q20000017.arc,q20000017.arc,3,Fabio
0,,"おっと――いいところで会った
あんたは結構あちこちへ行くだろう？
その時に、ちょっと気にしてほしいものがあるんだ",,ui\00_message\quest\q20000017.gmd,\quest\q20000017.arc,q20000017.arc,4,Fabio
0,,"俺が今集めているもの――
それをだな、手に入れてほしいわけ",,ui\00_message\quest\q20000017.gmd,\quest\q20000017.arc,q20000017.arc,5,Fabio
0,,"なかなか難しいと思うけど
俺としては絶対にそれがほしいんだ
心の底からほしくてさ――だから、頼んだ！",,ui\00_message\quest\q20000017.gmd,\quest\q20000017.arc,q20000017.arc,6,Fabio
0,,"そうだよ、これこれ！
じゃあ、ついでに、これも頼むよ",,ui\00_message\quest\q20000017.gmd,\quest\q20000017.arc,q20000017.arc,7,Fabio
0,,"おっと、意外と早かったな
じゃあ、次はこれも頼むよ！",,ui\00_message\quest\q20000017.gmd,\quest\q20000017.arc,q20000017.arc,8,Fabio
0,,"おお、さすが！　これだよこれ！
ということは、これも簡単だよな？",,ui\00_message\quest\q20000017.gmd,\quest\q20000017.arc,q20000017.arc,9,Fabio
0,,"お疲れさま
これでだいたい集まったから
あとは自分でなんとかするよ",,ui\00_message\quest\q20000017.gmd,\quest\q20000017.arc,q20000017.arc,10,Fabio
0,,"ありがとうな
謝礼は期待しないで待ってくれ",,ui\00_message\quest\q20000017.gmd,\quest\q20000017.arc,q20000017.arc,11,Fabio
0,,"お疲れさま
おかげで結構集まった",,ui\00_message\quest\q20000017.gmd,\quest\q20000017.arc,q20000017.arc,12,Fabio
0,,"こき使って悪かったな
謝礼はちょっと期待して待ってくれ",,ui\00_message\quest\q20000017.gmd,\quest\q20000017.arc,q20000017.arc,13,Fabio
0,,"お疲れさま
あんた凄いよ！　あんたに頼んで良かった！
完全なる収集ってやつだな",,ui\00_message\quest\q20000017.gmd,\quest\q20000017.arc,q20000017.arc,14,Fabio
0,,"いやー、感謝するよ
謝礼は期待して待ってくれ",,ui\00_message\quest\q20000017.gmd,\quest\q20000017.arc,q20000017.arc,15,Fabio
0,,"なかなか手に入らない？
そう、だから収集は燃えるんだよな",,ui\00_message\quest\q20000017.gmd,\quest\q20000017.arc,q20000017.arc,16,Fabio
0,,"なんという幸運だろうね
こんなに困っている時にあんたに会えるなんて！",,ui\00_message\quest\q20000018.gmd,\quest\q20000018.arc,q20000018.arc,0,Fabio
0,,"今、倒した魔物の数を仲間と競ってるんだ
でも、俺、負けそうでな
というわけで、力を貸してほしい",,ui\00_message\quest\q20000018.gmd,\quest\q20000018.arc,q20000018.arc,1,Fabio
0,,"このあたりの敵はたいしたことないから
ガンガンぶっ倒してくれ
じゃあ、あとで",,ui\00_message\quest\q20000018.gmd,\quest\q20000018.arc,q20000018.arc,2,Fabio
0,,"なんという幸運だろうね
こんなに困っている時にあんたに会えるなんて！",,ui\00_message\quest\q20000018.gmd,\quest\q20000018.arc,q20000018.arc,3,Fabio
0,,"今、倒した魔物の数を仲間と競ってるんだ
でも、俺、負けそうでな
というわけで、力を貸してほしい",,ui\00_message\quest\q20000018.gmd,\quest\q20000018.arc,q20000018.arc,4,Fabio
0,,"敵は別に弱くも少なくもないけど
あんたならきっとやれる！
じゃあ、あとで",,ui\00_message\quest\q20000018.gmd,\quest\q20000018.arc,q20000018.arc,5,Fabio
0,,"なんという幸運だろうね
こんなに困っている時にあんたに会えるなんて！",,ui\00_message\quest\q20000018.gmd,\quest\q20000018.arc,q20000018.arc,6,Fabio
0,,"今、倒した魔物の数を仲間と競ってるんだ
でも、俺、負けそうでな
というわけで、力を貸してほしい",,ui\00_message\quest\q20000018.gmd,\quest\q20000018.arc,q20000018.arc,7,Fabio
0,,"魔物はおそろしく強いし数も多い
でも、あんたならきっとやれる！
根拠はないが、そんな気がする
じゃあ、あとで",,ui\00_message\quest\q20000018.gmd,\quest\q20000018.arc,q20000018.arc,8,Fabio
0,,"よお！　頑張ってくれたみたいだな
でも、なかなか魔物は減らないな
え？　競争相手の仲間？
そりゃあ、あんた――あんただよ",,ui\00_message\quest\q20000018.gmd,\quest\q20000018.arc,q20000018.arc,9,Fabio
0,,"こんな感じで、魔物退治ができたら
楽しいと思ってな
まあ、今回は俺の勝ちってことで！",,ui\00_message\quest\q20000018.gmd,\quest\q20000018.arc,q20000018.arc,10,Fabio
0,,じゃあ、またな,,ui\00_message\quest\q20000018.gmd,\quest\q20000018.arc,q20000018.arc,11,Fabio
0,,"よお！　頑張ってくれたみたいだな
でも、なかなか魔物は減らないな
え？　競争相手の仲間？
そりゃあ、あんた――あんただよ",,ui\00_message\quest\q20000018.gmd,\quest\q20000018.arc,q20000018.arc,12,Fabio
0,,"こんな感じで、魔物退治ができたら
楽しいと思ってよ
というか、ずいぶん頑張って倒したみたいだな
よし、じゃあ、今回は引き分けにしよう",,ui\00_message\quest\q20000018.gmd,\quest\q20000018.arc,q20000018.arc,13,Fabio
0,,じゃあ、またな,,ui\00_message\quest\q20000018.gmd,\quest\q20000018.arc,q20000018.arc,14,Fabio
0,,"よお！　頑張ってくれたみたいだな
でも、なかなか魔物は減らないな
え？　競争相手の仲間？
そりゃあ、あんた――あんただよ",,ui\00_message\quest\q20000018.gmd,\quest\q20000018.arc,q20000018.arc,15,Fabio
0,,"こんな感じで、魔物退治ができたら
楽しいと思ってよ
というか、あんた強いのとばかり戦ってたな
よし、じゃあ、今回はあんたの勝ちだ！",,ui\00_message\quest\q20000018.gmd,\quest\q20000018.arc,q20000018.arc,16,Fabio
0,,じゃあ、またな,,ui\00_message\quest\q20000018.gmd,\quest\q20000018.arc,q20000018.arc,17,Fabio
0,,"あら？　ずいぶん手こずっているみたいだな
調子でも悪いのか？",,ui\00_message\quest\q20000018.gmd,\quest\q20000018.arc,q20000018.arc,18,Fabio
0,,"ああ、 ちょうど良いところに
キミ、言わずとも判るよ―――覚者だろう
お願いがあるんだ",,ui\00_message\quest\q20005012.gmd,\quest\q20005012.arc,q20005012.arc,0,Ludovika
0,,"私、見ちゃったんだ
《平原の廃墟地下室》にオーク達が隠れているのを！
ね、これって覚者としては放っておけないよね",,ui\00_message\quest\q20005012.gmd,\quest\q20005012.arc,q20005012.arc,1,Ludovika
0,,"そういうわけで、討伐してきて欲しいんだ
やってくれるね？
皆のためになる事なんだから―――",,ui\00_message\quest\q20005012.gmd,\quest\q20005012.arc,q20005012.arc,2,Ludovika
0,,"へぇ、本当にやっつけたんだ？
これで安心して仕事ができるよ、ありがとう
あ――私はいわゆるトレジャーハンターなんだ",,ui\00_message\quest\q20005012.gmd,\quest\q20005012.arc,q20005012.arc,3,Ludovika
0,,"騙してごめんよ
でも皆のためになる事だろう？
旅で見つけたお宝あげるから許してよ――",,ui\00_message\quest\q20005012.gmd,\quest\q20005012.arc,q20005012.arc,4,Ludovika
0,,"キミが来るまで、ここで思案してたのさ――
高所は、頭が冴えて考え事にぴったりだからね
私はまだここで待ってるから、よろしく頼んだよ",,ui\00_message\quest\q20005012.gmd,\quest\q20005012.arc,q20005012.arc,5,Ludovika
0,,"ああ、 ちょうど良いところに
キミ、言わずとも判るよ―――覚者だろう
お願いがあるんだ",,ui\00_message\quest\q20005012.gmd,\quest\q20005012.arc,q20005012.arc,6,Ludovika
0,,"私、見ちゃったんだ
《テルの枯れ井戸》にオーク達が隠れているのを！
ね、これって覚者としては放っておけないよね",,ui\00_message\quest\q20005012.gmd,\quest\q20005012.arc,q20005012.arc,7,Ludovika
0,,"そういうわけで、討伐してきて欲しいんだ
やってくれるね？
皆のためになる事なんだから―――",,ui\00_message\quest\q20005012.gmd,\quest\q20005012.arc,q20005012.arc,8,Ludovika
0,,"ねぇねぇ――知ってる？
""怪盗団""が現れたんだって！
あたしたちの間じゃ、その噂でもちきりなの",,ui\00_message\quest\q20005013.gmd,\quest\q20005013.arc,q20005013.arc,0,Marisa
0,,"実はね、あたし――怪盗に会った事あるんだ
それどころか、助けてもらったの
気が付いたら、このカードを握っていた――
よく覚えてないけど、きっとそれが証拠よね？",,ui\00_message\quest\q20005013.gmd,\quest\q20005013.arc,q20005013.arc,1,Marisa
0,,"なに、これが欲しいって――
ちょっと、本気で言ってるの？
――そうね、じゃああたしのお願い聞いてくれたら
考えてあげてもいいわよ",,ui\00_message\quest\q20005013.gmd,\quest\q20005013.arc,q20005013.arc,2,Marisa
0,,"彼氏と度胸試しに《血すすぎ河原》へ行く予定なの
だけど、万一何かあると嫌だから――
あなた腕が立ちそうだし、掃除してきてほしいの
魔物一匹残らずよ！　よろしくね",,ui\00_message\quest\q20005013.gmd,\quest\q20005013.arc,q20005013.arc,3,Marisa
0,,"そんなもの欲しそうな目で見られたって
このカードはあげないわよ――タダでは、ね",,ui\00_message\quest\q20005013.gmd,\quest\q20005013.arc,q20005013.arc,4,Marisa
0,,"さぁ、さっさと《血すすぎ河原》へ行って
あたしと彼のために、危険な魔物を
掃除してきてちょうだいな",,ui\00_message\quest\q20005013.gmd,\quest\q20005013.arc,q20005013.arc,5,Marisa
0,,"やだ――本当に行ってきたの？
しかも、ちゃんと魔物も片づけてきてくれたんだ――
諦めると思ったのに、結構根性あるのね",,ui\00_message\quest\q20005013.gmd,\quest\q20005013.arc,q20005013.arc,6,Marisa
0,,"ホント――あなたの事、見直しちゃった
ねぇ――こんなカードより
もっとイイものあげよっか――？",,ui\00_message\quest\q20005013.gmd,\quest\q20005013.arc,q20005013.arc,7,Marisa
0,,"うそうそ――冗談よ、冗談
そんなに怖い顔しないでよ
危ない目に遭わせちゃったんだし、
お礼はちゃんとするってば",,ui\00_message\quest\q20005013.gmd,\quest\q20005013.arc,q20005013.arc,8,Marisa
0,,"こんな小さな村だから、あたしの噂はすぐに広まって
今まで話した事もない輩まで押しかけて来るの――
そんな奴らを煙に巻く癖が、つい出ちゃったみたい
――とにかく、デート楽しんでくるわ！　ありがとね",,ui\00_message\quest\q20005013.gmd,\quest\q20005013.arc,q20005013.arc,9,Marisa
0,,"怪盗が姿を現したって噂の場所は、
《廃屋の地下室》よ――",,ui\00_message\quest\q20005013.gmd,\quest\q20005013.arc,q20005013.arc,10,Marisa
0,,"え？　彼氏はどうしたって？
相手は怪盗よ！
つまんない彼氏なんかと比べないでよ",,ui\00_message\quest\q20005013.gmd,\quest\q20005013.arc,q20005013.arc,11,Marisa
0,,"ああ、覚者さん！　
本当に行ってきてくれたのね――
どうだった？",,ui\00_message\quest\q20005013.gmd,\quest\q20005013.arc,q20005013.arc,12,Marisa
0,,"いたのは魔物だけで、怪盗の痕跡は特に無し――
そう、残念だわ
だけど、行ってきてくれてありがとう",,ui\00_message\quest\q20005013.gmd,\quest\q20005013.arc,q20005013.arc,13,Marisa
0,,"――正直言うと、怪盗の記憶はほとんど無いの
何を言っていたかわからなかったし、
顔もぼんやりとしか――
だけど、あの頼もしい腕の感触だけは覚えてるわ",,ui\00_message\quest\q20005013.gmd,\quest\q20005013.arc,q20005013.arc,14,Marisa
0,,"ちょっと謎めいた感じだったけど――
彼氏――ルキーノとは逆のタイプだったから、
久しぶりにときめいちゃったの
ああ、ルキーノにも、そんな所があればいいのに――",,ui\00_message\quest\q20005013.gmd,\quest\q20005013.arc,q20005013.arc,15,Marisa
0,,"ねぇねぇ――知ってる？
今話題の""怪盗団""の噂！
実はね、あたし――怪盗に会った事あるんだ",,ui\00_message\quest\q20005013.gmd,\quest\q20005013.arc,q20005013.arc,16,Marisa
0,,"それどころか、助けてもらったの
あの日から、あの人の事が忘れられなくて――
顔は分からなかったけど、ワイルドで素敵な人だった
このレスタニアでは見ないタイプね",,ui\00_message\quest\q20005013.gmd,\quest\q20005013.arc,q20005013.arc,17,Marisa
0,,"ねぇ、あなたこのカードが欲しいんでしょう？
この怪盗のマークが書かれたカード――
だったら、見てきてほしい場所があるの
最近怪盗が姿を見せたって噂の場所――",,ui\00_message\quest\q20005013.gmd,\quest\q20005013.arc,q20005013.arc,18,Marisa
0,,"《廃屋の地下室》ってところ
危険があるかもしれないから――
怪盗が本当にそこにいたのか、
見て来てもらえる？",,ui\00_message\quest\q20005013.gmd,\quest\q20005013.arc,q20005013.arc,19,Marisa
0,,"《狩人の抜け穴》へ行って、様子を見て来てほしいの
そこが、あたしが怪盗に助けてもらった場所――
え？　怪盗に出会えたらどうするかって？
そうね――怪盗団に入れてもらおうかな",,ui\00_message\quest\q20005013.gmd,\quest\q20005013.arc,q20005013.arc,20,Marisa
0,,"ああ、覚者さん！　
本当に行ってきてくれたのね――
どんな場所だった？",,ui\00_message\quest\q20005013.gmd,\quest\q20005013.arc,q20005013.arc,21,Marisa
0,,"――普通の洞窟？
そんな馬鹿な――いいえ、よくは覚えてないんだけど
もっと、特徴的な場所だったような――
レスタニアで、見た事も聞いた事もない所だったの",,ui\00_message\quest\q20005013.gmd,\quest\q20005013.arc,q20005013.arc,22,Marisa
0,,"一体どうなっているの――
夢でも見ていたのかしら？
このカードも、もしかしたら
誰かのイタズラだったのかも――",,ui\00_message\quest\q20005013.gmd,\quest\q20005013.arc,q20005013.arc,23,Marisa
0,,"――とにかく、行ってきてくれてありがとね
お礼はちゃんとするつもりよ
ほら、これが欲しいのよね？
もう何のカードか定かじゃないけど――もらってよ",,ui\00_message\quest\q20005013.gmd,\quest\q20005013.arc,q20005013.arc,24,Marisa
0,,"ねぇねぇ――知ってる？
""怪盗団""が現れたんだって！
今じゃ、その噂でもちきりよ",,ui\00_message\quest\q20005013.gmd,\quest\q20005013.arc,q20005013.arc,25,Marisa
0,,"実はね、あたし――怪盗に会った事あるんだ
それどころか、助けてもらったの
よく覚えてないんだけど――
どこかに迷い込んで、そこから助けてもらったような",,ui\00_message\quest\q20005013.gmd,\quest\q20005013.arc,q20005013.arc,26,Marisa
0,,"それで、いつの間にかこのカードを握っていたの
――言わなくても分かるわ、これが欲しいんでしょ？
最近そういう人ばかりなの、あたしの周り
そうね――じゃあ、あたしのお願い聞いてくれる？",,ui\00_message\quest\q20005013.gmd,\quest\q20005013.arc,q20005013.arc,27,Marisa
0,,"《狩人の抜け穴》へ行って、様子を見て来てほしいの
あたしが怪盗と会った場所――
覚えている特徴を挙げると、そこが怪しいみたいなの
もし怪盗を見かけたら、すぐに教えてね",,ui\00_message\quest\q20005013.gmd,\quest\q20005013.arc,q20005013.arc,28,Marisa
0,,"《死者の小窟》で怪盗捜索中の騎士団が
集まっていたから、あなたに見て来てほしいの
――もし何も無かったら、縁が無かったんだと思って
すっぱり諦めるわ",,ui\00_message\quest\q20005013.gmd,\quest\q20005013.arc,q20005013.arc,29,Julia
0,,"ああ、覚者さん！　
本当に行ってきてくれたのね――
そこには何があったの？",,ui\00_message\quest\q20005013.gmd,\quest\q20005013.arc,q20005013.arc,30,Marisa
0,,"――魔物だけ、か
騎士団が集まっていたのは、魔物のせいだったのね
これで完全に万策尽きたわ――",,ui\00_message\quest\q20005013.gmd,\quest\q20005013.arc,q20005013.arc,31,Marisa
0,,"ええ、分かってる
もう怪盗を追いかけるのはこれっきり！
あーあ、つまんない――
平凡な毎日が、何か変わると思ってたのに",,ui\00_message\quest\q20005013.gmd,\quest\q20005013.arc,q20005013.arc,32,Marisa
0,,"ほら、このカードが欲しかったんでしょ？
お礼にあげるわ――もうあたしには必要ないから
明日からは――心に仮面をつけてでも
退屈に向き合っていかなきゃね",,ui\00_message\quest\q20005013.gmd,\quest\q20005013.arc,q20005013.arc,33,Marisa
0,,"ねぇねぇ――知ってる？
""怪盗団""が現れた、って噂！
実は、あたし怪盗に助けてもらったことが
あるんだけど――",,ui\00_message\quest\q20005013.gmd,\quest\q20005013.arc,q20005013.arc,34,Marisa
0,,"これだけ一生懸命探してるのに、尻尾も掴めないのよ
――ま、当然か
騎士団が必死になって探してるものを
あたしがそう簡単に見つけられるはずないわよね――",,ui\00_message\quest\q20005013.gmd,\quest\q20005013.arc,q20005013.arc,35,Marisa
0,,"だけど、助けてもらったときに
いつの間にか握っていたこのカード――
きっとこれは何かの意味があると思うのよね
――ねぇ、あなたにお願いがあるの",,ui\00_message\quest\q20005013.gmd,\quest\q20005013.arc,q20005013.arc,36,Marisa
0,,"怪盗捜索中の騎士団が《死者の小窟》に
集まっていたのをさっき見たわ
あそこにはきっと何かある――
危険かもしれないけど、様子を見て来てほしいの！",,ui\00_message\quest\q20005013.gmd,\quest\q20005013.arc,q20005013.arc,37,Marisa
0,,"ああ、覚者様――
盗賊たちに追われてるの！
どうか――どうかお願い、助けて！",,ui\00_message\quest\q20010000.gmd,\quest\q20010000.arc,q20010000.arc,0,Yuni
0,,"ああ、覚者様――
盗賊たちに追われてるの！
どうか――どうかお願い、助けて！",,ui\00_message\quest\q20010000.gmd,\quest\q20010000.arc,q20010000.arc,1,Yuni
0,,"血も涙もない奴らなの！
心おきなく、やっつけて！",,ui\00_message\quest\q20010000.gmd,\quest\q20010000.arc,q20010000.arc,2,Yuni
0,,"ああ、覚者様――
盗賊たちに追われてるの！
どうか――どうかお願い、助けて！",,ui\00_message\quest\q20010000.gmd,\quest\q20010000.arc,q20010000.arc,3,Yuni
0,,"わたしだけじゃないの！
このままだったらあいつら村に来ちゃう！！
家が焼かれたり、みんなが殺されたりしたら――！",,ui\00_message\quest\q20010000.gmd,\quest\q20010000.arc,q20010000.arc,4,Yuni
0,,ありがとう、覚者さま！,,ui\00_message\quest\q20010000.gmd,\quest\q20010000.arc,q20010000.arc,5,Yuni
0,,"ありがとうございました、覚者さま！
怪我は大丈夫？",,ui\00_message\quest\q20010000.gmd,\quest\q20010000.arc,q20010000.arc,6,Yuni
0,,"ありがとうございました、覚者さま！
本当に強いですね！　素敵です！
うん、すっごく――！",,ui\00_message\quest\q20010000.gmd,\quest\q20010000.arc,q20010000.arc,7,Yuni
0,,"大丈夫？　無理はしないでね
あいつらほんとにひどいから――",,ui\00_message\quest\q20010000.gmd,\quest\q20010000.arc,q20010000.arc,8,Yuni
0,,"まずいことになった
浜に魔物が集まってるそうじゃないか",,ui\00_message\quest\q20010001.gmd,\quest\q20010001.arc,q20010001.arc,0,Walter
0,,"あの辺りには船があるんだ
あれが壊されたりしたら――！
頼む、何とかできないか！？",,ui\00_message\quest\q20010001.gmd,\quest\q20010001.arc,q20010001.arc,1,Walter
0,,"たっ、大変だ！
浜に魔物が集まってるらしいんだ
それも厄介そうなのが！",,ui\00_message\quest\q20010001.gmd,\quest\q20010001.arc,q20010001.arc,2,Walter
0,,"あの辺りには船があるんだ
あれが壊されたりしたら――！
頼む、何とかできないか！？",,ui\00_message\quest\q20010001.gmd,\quest\q20010001.arc,q20010001.arc,3,Walter
0,,"ああ――、なんてこった！
浜に魔物が集まってるらしいんだ！
滅多にここらじゃ見ないような奴が！",,ui\00_message\quest\q20010001.gmd,\quest\q20010001.arc,q20010001.arc,4,Walter
0,,"あの辺りには船があるんだ
あれが壊されたりしたら――！
頼む、何とかできないか！？",,ui\00_message\quest\q20010001.gmd,\quest\q20010001.arc,q20010001.arc,5,Walter
0,,どうだった！？　船は無事かい？,,ui\00_message\quest\q20010001.gmd,\quest\q20010001.arc,q20010001.arc,6,Walter
0,,"そうか――助かったよ、アンタのおかげだ
うん？　おかしいかい？
遠出もできないボロ船を大事にしてるのが",,ui\00_message\quest\q20010001.gmd,\quest\q20010001.arc,q20010001.arc,7,Walter
