key,old,new
q00000025_00_25,紅の結晶,The Crimson Crystal
q00000025_00_25,"レオの使いとしてグリッテン砦に向かい
覚者ヴァネッサに補給物資を届ける",
q00000025_00_1058,グリッテン砦のヴァネッサのもとに向かう,Head to Vanessa's location in Gritten Fort
q00000025_00_1059,死者の小窟内で魔物を探す,Search for monsters within the Small Cave Tombs
q00000025_00_1060,遭遇した魔物を討伐する,Defeat the encountered demons
q00000025_00_1061,グリッテン砦のヴァネッサに戦果を報告する,Report back to Vanessa at Gritten Fort
q00000025_00_1062,謁見の間のレオに経緯を報告する,Report back to Leo in the Audience Chamber
q00000025_00_1245,謁見の間のミシアルに報告する,Report to Mysial in the Audience Chamber
q00000025_00_1202,白竜に＜竜力の継承＞を行いブラッドオーブを捧げる,Present the Blood Orb to obtain the power of the White Dragon
