key,old,new
q20020009_00_238,暗がりの住民達,The Residents of Darkness
q20020009_00_238,"依頼者の願いを聞き入れ
対象の敵を討伐する",
q20020009_00_238,"<NAME AREA>から
何者かが助けを請うているらしいと報告があった","From <NAME AREA>,
There are reports of someone who is begging for help"
q20020009_00_238,"ところで君、墓地は好きかい？
静かで、不気味で、物悲しくて、ペシミスティック！
まさに最高のロケーションさ
なのに時々、無粋な輩が魔物を狩るためだけに
やってきて、無用な血で汚すんだ
あんな連中とは、死んでも同じ墓地に入りたくないね",
q20020009_00_913,墓地奥の敵を探す,Seek out the enemy in the depths of the cemetery
q20020009_00_828,発見した敵を討伐する,Defeat the found enemy
q20020009_00_804,依頼者に報告する,Report to the requester
