key,old,new
q20040008_00_249,ボルド毒泉調査,Volden Poisonous Springs Investigation
q20040008_00_249,"依頼者の願いを聞き入れ
該当場所を調査し物品を収集する",
q20040008_00_249,"<NAME AREA>から
悩みを解決したいという相談の声が届いている",
q20040008_00_249,"覚者全員に通達がある
ボルド鉱山で周期的に発生している毒沼の範囲が
著しい拡大傾向にある
現場を通行の際は充分に気をつけるように
また原因解決への協力要請があれば、積極的に
応えるように",
q20040008_00_991,汚染沼の周辺を調査する（残り３）,Investigate the polluted spring (3 left)
q20040008_00_1129,汚染沼の周辺を調査する（残り２）,Investigate the polluted spring (2 left)
q20040008_00_1130,汚染沼の周辺を調査する（残り１）,Investigate the polluted spring (1 left)
q20040008_00_1045,襲いかかる敵を討伐する,Defeat the attacking enemy
q20040008_00_804,依頼者に報告する,Report to the requester
