key,old,new
q20000009_00_218,薬を求めて,Request for Medicine
q20000009_00_218,"依頼者の願いを聞き入れ
望む物品を集める",
q20000009_00_218,"<NAME AREA>の何処かに
覚者の探索能力を見込み、相談したい者がいるという",
q20000009_00_218,"テルに身を寄せるのは１年ぶりですが
少々雰囲気が変わった感じがしますね
村人はあいかわらず親切で、料理も酒も旨いんですが
何かこう、全体的に元気がないというか――
ヘンリーという方にそれとなく聞いてみたんですが
いろいろあるんですよ、としか言わなくて",
q20000009_00_887,白竜神殿の道具屋ヴァイスロットを訪ねる,Visit Vicelot's item shop in the White Dragon Temple
q20000009_00_888,神殿の外で薬の材料を入手する（残り２）,Collect the materials needed in Hidell Plains (2 left)
q20000009_00_1125,神殿の外で薬の材料を入手する（残り１）,Collect the materials needed in Hidell Plains (1 left)
q20000009_00_890,ヴァイスロットに届ける,Deliver the materials to Vicelot
q20000009_00_891,薬をヘンリーに届ける,Deliver the medicine to Henry
