key,old,new
q20070001_00_164,妖しき秘薬,A Dubious Remedy
q20070001_00_164,"依頼者の願いを聞き入れ
望む物品を集める",
q20070001_00_164,"<NAME AREA>の何処かに
覚者の探索能力を見込み、相談したい者がいるという",
q20070001_00_164,"このあたりの墓地にはよ
昔の時代に作られた、隠された秘宝が眠っている
という、まことしやかな噂だが
ま、大体はガラクタなんだよな
そういや、さっきもそんな噂を当てにしてきた
胡散臭い男を見かけたな",
q20070001_00_1024,＜地下納骨堂＞に隠された品を探す,Search for the treasure hidden within the Underground Crypt
q20070001_00_806,遭遇した敵を討伐する,Defeat the encountered enemy
q20070001_00_1024,＜地下納骨堂＞に隠された品を探す,Search for the treasure hidden within the Underground Crypt
q20070001_00_804,依頼者に報告する,Report to the requester
