key,old,new
q21000002_00_314,郷想う気持ち,Hometown Concerns
q21000002_00_314,"【納品討伐クエスト】
依頼者に高価なアイテムを渡し
珍しい敵の居場所を聞き出す",
q21000002_00_314,"<NAME AREA>にいる何者かが
エリア内で取得できる珍しいアイテムを求めている",
q21000002_00_314,"最近、ブリア海岸一帯に元気がないというかさぁ――
物騒な連中がウロウロしてるし、住民に笑顔は少ない
なんかこう、ブリアの皆を笑顔にしてくれる人
現れないかねぇ――",
q21000002_00_1166,＜<SQDI NAME>＞を＜<SQDI NUM>＞個、依頼者に渡す（残り:<SQDI DNUM>）,Deliver <SQDI NAME> x<SQDI NUM> to the requester (need: <SQDI DNUM>)
q21000002_00_1167,指定された場所へ魔物を探しに行く,
q21000002_00_1168,発見した魔物を討伐する,Defeat the found demons
q21000002_00_1169,依頼者に報告する,Report to the requester
