key,old,new
q21000084_00_364,放浪の果てに,
q21000084_00_364,"【納品討伐クエスト】
依頼者に高価なアイテムを渡し
珍しい敵の居場所を聞き出す",
q21000084_00_364,"<NAME AREA>にいる何者かが
エリア内で取得できる珍しいアイテムを求めている",
q21000084_00_364,"本だの何かの器具だのが散らばってる気味の悪い
場所があるだろ？　少し前、あの辺りで金属音が
響く夜が続いたんだが、それがぴたりと収まったんだ
音の主はどこかに移動したのか、それともあの穴に
降りていったのか――",
q21000084_00_1166,＜<SQDI NAME>＞を＜<SQDI NUM>＞個、依頼者に渡す（残り:<SQDI DNUM>）,Deliver <SQDI NAME> x<SQDI NUM> to the requester (need: <SQDI DNUM>)
q21000084_00_1167,指定された場所へ魔物を探しに行く,
q21000084_00_1168,発見した魔物を討伐する,Defeat the found demons
q21000084_00_1169,依頼者に報告する,Report to the requester
