key,old,new
q22018052_00_705,石拾うにも苦難の道程,
q22018052_00_705,"【納品討伐クエスト】
依頼者に高価なアイテムを渡し
珍しい敵の居場所を聞き出す",
q22018052_00_705,"<NAME AREA>にいる何者かが
エリア内で取得できる珍しいアイテムを求めている",
q22018052_00_705,"ここウルテカ山岳地方の岩場で採れる石が
魔物のせいでなかなか手に入んなくってよ
手配を依頼されても、そうすぐには
どうにもなんないんだよなぁ
俺の努力不足ってわけじゃねぇんだぞ",
q22018052_00_1166,＜<SQDI NAME>＞を＜<SQDI NUM>＞個、依頼者に渡す（残り:<SQDI DNUM>）,Deliver <SQDI NAME> x<SQDI NUM> to the requester (need: <SQDI DNUM>)
q22018052_00_1167,指定された場所へ魔物を探しに行く,
q22018052_00_1168,発見した魔物を討伐する,Defeat the found demons
q22018052_00_1169,依頼者に報告する,Report to the requester
