key,old,new
q22018022_00_662,【時限採取】晴天の採取道,Time Restriction: 晴天の採取道
q22018022_00_662,"【時限採取クエスト：晴天】
エリアマスターから話を聞き
特定条件の間に採取を行い納品する",
q22018022_00_662,"<NAME AREA>のエリアマスターは
覚者へ相談したい事があるらしい",
q22018022_00_662,"あの火山から出る煙で、アッカ―シェランは
完全な快晴というのがあまり無くてね
だけど、少ない晴れの時にたくましく
多くの命が育まれるようなの
その証拠にほら、戦火及ばぬ地は自然豊かでしょ",
q22018022_00_1295,＜晴天＞時にパーティメンバーを拠点内に集める,"Gather party members in the camp during ""Fine"" weather"
q22018022_00_1296,＜晴天＞時に依頼者から詳細を聞く,"Inquire details from the requester during ""Fine"" weather"
q22018022_00_1297,＜晴天＞の間に<AREA 19>で《<SQDI NAME>》を採取し＜<SQDI NUM>＞つ納品する,"Obtain <SQDI NAME> x<SQDI NUM> at <AREA 19> during ""Fine"" weather"
q22018022_00_1233,エリアマスターに《<SQDI NAME>》を＜<SQDI NUM>＞つ納品する,Deliver <SQDI NAME> x<SQDI NUM> to the Area Master
