key,old,new
q22018036_00_688,やるかたなき宿怨,
q22018036_00_688,"【納品討伐クエスト】
依頼者に高価なアイテムを渡し
珍しい敵の居場所を聞き出す",
q22018036_00_688,"<NAME AREA>にいる何者かが
エリア内で取得できる珍しいアイテムを求めている",
q22018036_00_688,"この前、行商の帰り道で偶然オークどもが
何やら抱えて走り去っていくのを見たんだ
ありゃあ、人間から奪ったものに違いないよ
ちょっと後を追ってみようとしたんだが――
やつらに見つかってあえなく退散、というわけさ",
q22018036_00_1124,＜<SQDI NAME>＞を＜<SQDI NUM>＞個、依頼者に渡す（残り:<SQDI DNUM>）,Deliver <SQDI NAME> x<SQDI NUM> to the requester (need: <SQDI DNUM>)
q22018036_00_1167,指定された場所へ魔物を探しに行く,
q22018036_00_1168,発見した魔物を討伐する,Defeat the found demons
q22018036_00_1169,依頼者に報告する,Report to the requester
