key,old,new
q60200029_00_221,ホワイトデーのお返し・リズとメイリーフ,White Day Gift Return: Lise and Mayleaf
q60200029_00_221,リズとメイリーフからのお返しをもらう,Receive a gift in return from Lise and Mayleaf
q60200029_00_2926,メイリーフから詳細を聞く,Inquire details from Mayleaf
q60200029_00_2927,リンウッドのミランダにsayで「森の妖精マカロン」と話かける,"Say ""森の妖精マカロン"" (""Forest Fairy Macaron"") to Miranda in Lynwood"
q60200029_00_2928,ミランダと話をする,Speak to Miranda
q60200029_00_2929,酒場のいるリズに報告する,Report to Lise in the Tavern
q60200029_00_2783,森(ﾉ|ノ|の)妖精(ﾏ|マ|ま)(ｶ|カ|か)(ﾛ|ロ|ろ)(ﾝ|ン|ん),
