key,old,new
q60300405_00_242,ジョブエンブレム試練　シールドセージ,Vocation Emblem Trial: Shield Sage
q60300405_00_242,"ギルスタンからエンブレムストーンを
譲り受ける試練に挑む",
q60300405_00_2974,<STG 550>に行き<NPC 2004>と話す,Head to <STG 550> and speak with <NPC 2004>
q60300405_00_2975,最奥に向かい試練を開始する,
q60300405_00_3269,時間内に死なずに全ての敵を討伐する,Defeat all enemies within time without dying
q60300405_00_3270,祠内にいる<NPC 2004>に報告する,Report to <NPC 2004> within the chapel
q60300405_00_3271,<STG 510>の<NPC 2000>からエンブレムストーンをもらう,Receive Emblem Stone from <NPC 2000> in <STG 510>
q60300405_00_3422,<STG 200>の<NPC 1029>に報告する,Report to <NPC 1029> in <STG 200>
