key,old,new
q90000121_00_100,グリッテン砦攻防戦　戦況：ラストバトル,Battle for Gritten Fort: Last Battle
q90000121_00_100,"オーク軍も全ての兵力を使って砦へ攻め込んできた
現状、砦のいたる所が魔物で溢れかえっている
この大規模戦闘に勝利する術はあるのか、
覚者の誰もが知る由もないだろう
全員の力を最大限に発揮し、グリッテン砦最大の
危機を突破せよ！",
q90000121_00_2995,目的地の敵を殲滅せよ,Defeat the enemy at the target locations
q90000121_00_2996,大挙襲来した魔物を全て撃退せよ,
q90000121_00_2997,総大将を撃破し、砦防衛を完遂せよ,
q90000121_00_2998,新たに現れた魔物を討伐し、戦功ボーナスを得よ,
q90000121_00_100,グリッテン砦攻防戦：奪回戦《リザルト報酬》,Battle for Gritten Fort: Recapture Battle (Result Reward)
q90000121_00_100,"オーク軍に砦の全てが占領された大規模戦闘だ
己の技量だけで全魔物を退けることは叶わない
力と知の限りを尽くし、グリッテン砦最大の
危機を突破せよ！",
