#Index,Key,MsgJp,MsgEn,GmdPath,ArcPath,ArcName,ReadIndex
0,,はぁい、あたしに何か用？,,ui\00_message\npc\base\n1012.gmd,\npc\n1012.arc,n1012.arc,3
0,,"いらっしゃーい！
さぁ、今日は何にする？",,ui\00_message\npc\base\n1012.gmd,\npc\n1012.arc,n1012.arc,4
0,,"この世が滅ぶ、なんて
あたしは信じないんだから！",,ui\00_message\npc\base\n1012.gmd,\npc\n1012.arc,n1012.arc,5
0,,"覚者さんたちも、騎士さんたちもいる
レスタニアは白竜さまの国なのよ！
大丈夫に決まってるわ！",,ui\00_message\npc\base\n1012.gmd,\npc\n1012.arc,n1012.arc,6
0,,"都合の悪いものは
見ない主義なの、あたし",,ui\00_message\npc\base\n1012.gmd,\npc\n1012.arc,n1012.arc,7
0,,"魔物の出現や事件は、この頃増える一方です
でも、めげないでください覚者さま！
応援してますから！",,ui\00_message\npc\base\n1013.gmd,\npc\n1013.arc,n1013.arc,0
0,,覚者さま、今度、冒険譚を聞かせて下さいね,,ui\00_message\npc\base\n1013.gmd,\npc\n1013.arc,n1013.arc,1
0,,"今日も大陸のあちこちでは
いろいろな事が起こってるみたいですよ",,ui\00_message\npc\base\n1013.gmd,\npc\n1013.arc,n1013.arc,2
0,,"あら？　でも覚者さまはすでに他の
ミッションにエントリーされているみたいです
そちらを済ませるか、辞退されてから
あらためて申請してくださいね",,ui\00_message\npc\base\n1013.gmd,\npc\n1013.arc,n1013.arc,3
0,,本日のニュースをお届けしますね！,,ui\00_message\npc\base\n1013.gmd,\npc\n1013.arc,n1013.arc,4
0,,"あれから火球の話は届かないけど
もうそれどころじゃないよね",,ui\00_message\npc\base\n1013.gmd,\npc\n1013.arc,n1013.arc,5
0,,"あとは覚者さんたちに任せて、わたしは
いつもの仕事に戻るね",,ui\00_message\npc\base\n1013.gmd,\npc\n1013.arc,n1013.arc,6
0,,"覚者さま、納品ありがとうございます！
まだまだ受け付けていますので
どんどん持ってきてくださいね",,ui\00_message\npc\base\n1013.gmd,\npc\n1013.arc,n1013.arc,7
0,,"えっ――
忘れちゃったんですね！
《白竜祭》の奉納期間中に持ってきてくださいね ",,ui\00_message\npc\base\n1013.gmd,\npc\n1013.arc,n1013.arc,8
0,,"覚者さま、納品ありがとうございます！
みんなでレスタニアの豊穣を願う
《白竜祭》の奉納期間になりました",,ui\00_message\npc\base\n1013.gmd,\npc\n1013.arc,n1013.arc,9
0,,"白竜さまにお納めする品物を
どんどん持ってきてくださいね",,ui\00_message\npc\base\n1013.gmd,\npc\n1013.arc,n1013.arc,10
0,,見たい情報を選択してくださいね,,ui\00_message\npc\base\n1013.gmd,\npc\n1013.arc,n1013.arc,11
0,,個別納品報酬確認,,ui\00_message\npc\base\n1013.gmd,\npc\n1013.arc,n1013.arc,12
0,,ランキング報酬確認,,ui\00_message\npc\base\n1013.gmd,\npc\n1013.arc,n1013.arc,13
0,,"本日のニュースは
えぇっと――《滅びの渦》以外の
ニュースがいいですよね？",,ui\00_message\npc\base\n1013.gmd,\npc\n1013.arc,n1013.arc,14
0,,"みんな、今は《滅びの渦》のことしか
頭に無いみたいです
私も、ですけど――",,ui\00_message\npc\base\n1013.gmd,\npc\n1013.arc,n1013.arc,15
0,,"覚者さまほどの方になると
ああいったものを見ても
怖くはないのですか？",,ui\00_message\npc\base\n1013.gmd,\npc\n1013.arc,n1013.arc,16
0,,"ううん、レスタニアには
白竜さまのご加護があるから
大丈夫――大丈夫です",,ui\00_message\npc\base\n1013.gmd,\npc\n1013.arc,n1013.arc,17
0,,"覚者さま、その《クエストボード》にて
本日の任務、民の依頼をご確認ください",,ui\00_message\npc\base\n1014.gmd,\npc\n1014.arc,n1014.arc,0
0,,"達成すると、成果に応じた報酬が
依頼主より支払われますので
覚者さま自身の身支度に利用されるのも
良いかと思います",,ui\00_message\npc\base\n1014.gmd,\npc\n1014.arc,n1014.arc,1
0,,"《クエストボード》で受けた納品依頼の
対応には、併設の《納品ボックス》を
ご利用ください",,ui\00_message\npc\base\n1014.gmd,\npc\n1014.arc,n1014.arc,2
0,,"《クエストボード》は、地域ごとに管理され
現地で起こった問題や住民の依頼が
上がっています",,ui\00_message\npc\base\n1014.gmd,\npc\n1014.arc,n1014.arc,3
0,,"どうか、任地で民の助けとなってください
そうすることが、覚者さまの地域での
名声にもつながるでしょう",,ui\00_message\npc\base\n1014.gmd,\npc\n1014.arc,n1014.arc,4
0,,"お勤めご苦労さまでございます、覚者さま
本日もさまざまな依頼と任務が
《クエストボード》に寄せられております",,ui\00_message\npc\base\n1014.gmd,\npc\n1014.arc,n1014.arc,5
0,,覚者さま、何なりと,,ui\00_message\npc\base\n1014.gmd,\npc\n1014.arc,n1014.arc,6
0,,"ご存知です？
あのニュースの件
ほんと、心配ですわね",,ui\00_message\npc\base\n1015.gmd,\npc\n1015.arc,n1015.arc,0
0,,"噂というのはすぐに立つものですわ
そして、事件と共に移り変わるものですのよ",,ui\00_message\npc\base\n1015.gmd,\npc\n1015.arc,n1015.arc,1
0,,"覚者さま！　少し前、巨大な何かが
炎に包まれながら落下したそうなのです",,ui\00_message\npc\base\n1015.gmd,\npc\n1015.arc,n1015.arc,2
0,,"たしか、南の村――テルの方でしたわ
巨大な流れ星が地面に落ちるのを
見た者もいるとか",,ui\00_message\npc\base\n1015.gmd,\npc\n1015.arc,n1015.arc,3
0,,"もし調査に行かれるのでしたら
こっそり教えてくださらない？
私、口は堅いですわよ",,ui\00_message\npc\base\n1015.gmd,\npc\n1015.arc,n1015.arc,4
0,,ご機嫌いかがです？,,ui\00_message\npc\base\n1015.gmd,\npc\n1015.arc,n1015.arc,5
0,,"《滅びの渦》について――
きっと、私よりも覚者さまの方が
お詳しいでしょうね",,ui\00_message\npc\base\n1015.gmd,\npc\n1015.arc,n1015.arc,6
0,,"砦の方はどうなっているのでしょう
実は、弟が砦に勤めているのです
呼び戻した方がよろしいのかしら",,ui\00_message\npc\base\n1015.gmd,\npc\n1015.arc,n1015.arc,7
0,,"覚者の方々も、騎士団の方々も
顔色を変えて出てゆかれましたわ
ええ、私にも事の大きさはわかりますとも",,ui\00_message\npc\base\n1015.gmd,\npc\n1015.arc,n1015.arc,8
0,,"レスタニアですらこの有様なのですから
小さな村の混乱は計り知れませんわね",,ui\00_message\npc\base\n1015.gmd,\npc\n1015.arc,n1015.arc,9
0,,"なんだ？
神殿からの任務なら表の《クエストボード》
で発布されているだろう",,ui\00_message\npc\base\n1016.gmd,\npc\n1016.arc,n1016.arc,0
0,,"手助けはできないな
ハインツ副団長の許可がないからな",,ui\00_message\npc\base\n1016.gmd,\npc\n1016.arc,n1016.arc,1
0,,"ここは白衛騎士団司令部だ
覚者が何か用か？",,ui\00_message\npc\base\n1016.gmd,\npc\n1016.arc,n1016.arc,2
0,,"２つ以上のミッションには
エントリーできないぞ",,ui\00_message\npc\base\n1016.gmd,\npc\n1016.arc,n1016.arc,3
0,,"先にエントリーしている方のミッションを
終わらせるか、エントリーを取り消して
再度こちらに戻るんだ",,ui\00_message\npc\base\n1016.gmd,\npc\n1016.arc,n1016.arc,4
0,,覚者が俺に何か用か？,,ui\00_message\npc\base\n1016.gmd,\npc\n1016.arc,n1016.arc,5
0,,"為すべき時に為すべき事を
俺のモットーだ",,ui\00_message\npc\base\n1016.gmd,\npc\n1016.arc,n1016.arc,6
0,,つまり――無駄話は好まない,,ui\00_message\npc\base\n1016.gmd,\npc\n1016.arc,n1016.arc,7
0,,"あんたに含むところは何もないが
覚者と話すといい具合にイライラしてな
俺の性分だと思って、気にしないでくれ",,ui\00_message\npc\base\n1016.gmd,\npc\n1016.arc,n1016.arc,8
0,,"ん？　もう報酬は受け取っただろう？
また次回の任務でな",,ui\00_message\npc\base\n1017.gmd,\npc\n1017.arc,n1017.arc,0
0,,"先の森の魔物討伐における報酬を
支給している
まだ受け取っていないなら
保管ボックスから受け取るといい",,ui\00_message\npc\base\n1017.gmd,\npc\n1017.arc,n1017.arc,1
0,,"先の戦闘の評価でお前の活躍は相当のものだった
追加報酬として
シークレットアビリティが送られることになった
これがその報酬だ",,ui\00_message\npc\base\n1017.gmd,\npc\n1017.arc,n1017.arc,2
0,,"解決してもすぐまた次の問題が湧いて出る
困ったものだ",,ui\00_message\npc\base\n1017.gmd,\npc\n1017.arc,n1017.arc,3
0,,"――それにしても
少し前から《古の祭祀場》での魔物報告が
相次いでいる",,ui\00_message\npc\base\n1017.gmd,\npc\n1017.arc,n1017.arc,4
0,,"竜力が淀みやすい場所だとは聞いていたが
こうも続くとは――
お互い気が抜けんな",,ui\00_message\npc\base\n1017.gmd,\npc\n1017.arc,n1017.arc,5
0,,"あまり話しかけてくれるなよ？
団には覚者を良く思わない者が多いからな",,ui\00_message\npc\base\n1017.gmd,\npc\n1017.arc,n1017.arc,6
0,,"夜や雨天は、普段とは違う魔物が現れる
ま、外に出る時は天候も気をつけることだ",,ui\00_message\npc\base\n1017.gmd,\npc\n1017.arc,n1017.arc,7
0,,"エントリーは歓迎するが、お前は先になすべき
ミッションがあるみたいだな
そちらを終わらせるか、取り消してから
あらためて顔を出してくれ",,ui\00_message\npc\base\n1017.gmd,\npc\n1017.arc,n1017.arc,8
0,,"さきほど入った《古の祭祀場》最新情報に
よれば魔物は今姿を晦ましているようだ
出現情報が入り次第、エントリー受付を再開する",,ui\00_message\npc\base\n1017.gmd,\npc\n1017.arc,n1017.arc,9
0,,"どうにか《古の祭祀場》の件は事なきを得た
――お前への報酬は今回出ていないが
エントの確認など、協力の噂は聞いていたぞ
次は力を借りることになりそうだな",,ui\00_message\npc\base\n1017.gmd,\npc\n1017.arc,n1017.arc,10
0,,ん、どうした？,,ui\00_message\npc\base\n1017.gmd,\npc\n1017.arc,n1017.arc,11
0,,"ふん――
レオが姿を消したと聞いてどうなることかと
思っていたが――",,ui\00_message\npc\base\n1017.gmd,\npc\n1017.arc,n1017.arc,12
0,,せいぜい、仲良くしようではないか,,ui\00_message\npc\base\n1017.gmd,\npc\n1017.arc,n1017.arc,13
0,,"覚者になりたいと思うこともあったが
おまえを見ていてわかったよ",,ui\00_message\npc\base\n1017.gmd,\npc\n1017.arc,n1017.arc,14
0,,"集団の力を信じ、その一部であることに
喜びを感じるわたしは
覚者には向いていないようだ",,ui\00_message\npc\base\n1017.gmd,\npc\n1017.arc,n1017.arc,15
0,,"ゲルト騎士団長は義に厚く寛大な御方だ
我々は白竜様とあの方に仕えることに
誇りを感じている",,ui\00_message\npc\base\n1018.gmd,\npc\n1018.arc,n1018.arc,0
0,,"白竜様の加護があるのは
お前達だけではないぞ、覚者",,ui\00_message\npc\base\n1018.gmd,\npc\n1018.arc,n1018.arc,1
0,,"まったく、ジョゼフ神官は騎士団ではなく
なぜいつも覚者隊ばかり――",,ui\00_message\npc\base\n1018.gmd,\npc\n1018.arc,n1018.arc,2
0,,"覚者隊の者か
なにか用か",,ui\00_message\npc\base\n1018.gmd,\npc\n1018.arc,n1018.arc,3
0,,"白竜神殿は我々白衛騎士団が
全力を持ってお守りする
竜の盾たる我々がな",,ui\00_message\npc\base\n1019.gmd,\npc\n1019.arc,n1019.arc,0
0,,"この神殿は、白竜様に仕える者が集い
守り続けてきた由緒ある尊い場所",,ui\00_message\npc\base\n1019.gmd,\npc\n1019.arc,n1019.arc,1
0,,"我々白騎団、お前たち覚者隊
双方にとってそれは変わらん",,ui\00_message\npc\base\n1019.gmd,\npc\n1019.arc,n1019.arc,2
0,,特に異常はない,,ui\00_message\npc\base\n1019.gmd,\npc\n1019.arc,n1019.arc,3
0,,"何やら空から光の玉が降ってきたと
いうじゃないか",,ui\00_message\npc\base\n1019.gmd,\npc\n1019.arc,n1019.arc,4
0,,"つい最近のオーク共の攻撃といい
面倒なことが続くな",,ui\00_message\npc\base\n1019.gmd,\npc\n1019.arc,n1019.arc,5
0,,"覚者隊からも見張りの担当を
立てて貰いたいものだ",,ui\00_message\npc\base\n1019.gmd,\npc\n1019.arc,n1019.arc,6
0,,聞きたい事でもあるのか？,,ui\00_message\npc\base\n1019.gmd,\npc\n1019.arc,n1019.arc,7
0,,"おお！！　黄金竜討伐の重要任務
お疲れ様でございます！
保管ボックスに報酬が納められております
どうぞお受け取りを！",,ui\00_message\npc\base\n1020.gmd,\npc\n1020.arc,n1020.arc,0
0,,"そういえば！
覚者殿に、黄金竜討伐任務の戦果に対して
特別報酬が出ております！",,ui\00_message\npc\base\n1020.gmd,\npc\n1020.arc,n1020.arc,1
0,,"こちらがその、秘伝のアビリティだそうです！
どうぞお受け取りを！",,ui\00_message\npc\base\n1020.gmd,\npc\n1020.arc,n1020.arc,2
0,,"今回の任務、お疲れ様でございます！
報酬はもうお受け取りになられた
ようですね。次回もぜひ――！",,ui\00_message\npc\base\n1020.gmd,\npc\n1020.arc,n1020.arc,3
0,,自分、どんな任務でも頑張ります！,,ui\00_message\npc\base\n1020.gmd,\npc\n1020.arc,n1020.arc,4
0,,神殿と白竜様のためなら命を賭ける覚悟です！,,ui\00_message\npc\base\n1020.gmd,\npc\n1020.arc,n1020.arc,5
0,,自分はこの《謎の礎》の守番なのです,,ui\00_message\npc\base\n1020.gmd,\npc\n1020.arc,n1020.arc,6
0,,"これは、神殿がこの地にできる前からすでに
あったものだと言われておりますが
正確なところは分かっておりません",,ui\00_message\npc\base\n1020.gmd,\npc\n1020.arc,n1020.arc,7
0,,"ただ、必ず白騎団か覚者隊のものが
目を離さず番をしておかなければならぬと
言われているそうです",,ui\00_message\npc\base\n1020.gmd,\npc\n1020.arc,n1020.arc,8
0,,"覚者殿、しかしあなたはどうやら他の
重要ミッションを受けておられるようです
現在参加予定のミッションを終了するか
辞退された方がよろしいかと――",,ui\00_message\npc\base\n1020.gmd,\npc\n1020.arc,n1020.arc,9
0,,"覚者殿、現在入っている情報によりますと
かの黄金竜は礎の先から姿を消している様子
次の討伐隊派遣まで、もうしばらくお待ちください",,ui\00_message\npc\base\n1020.gmd,\npc\n1020.arc,n1020.arc,10
0,,"ああ、覚者さま！
なんとか此度の危機を乗り切ったようです
――聞くところによると、大戦果をおさめた方は
かなりの報酬がでるとか。ぜひ覚者殿も、次回は！",,ui\00_message\npc\base\n1020.gmd,\npc\n1020.arc,n1020.arc,11
0,,ハイ、自分に用ですか,,ui\00_message\npc\base\n1020.gmd,\npc\n1020.arc,n1020.arc,12
0,,"覚者さま、仲間と旅をする上で
最も重要なこと――
それは、協力そして意思疎通",,ui\00_message\npc\base\n1021.gmd,\npc\n1021.arc,n1021.arc,0
0,,"それには、《チャット》そして《エモート》
という二つの大きな手段がございます",,ui\00_message\npc\base\n1021.gmd,\npc\n1021.arc,n1021.arc,1
0,,"言葉を介する、《チャット》は
欠かせぬコミュニケーション手段です
声かけによってのみなし得る協力もありましょう",,ui\00_message\npc\base\n1021.gmd,\npc\n1021.arc,n1021.arc,2
0,,"《エモート》は、相手と言葉を越え解り合い
絆を育む良き手段
使うことで親睦も深まりましょう",,ui\00_message\npc\base\n1021.gmd,\npc\n1021.arc,n1021.arc,3
0,,"この神殿は多くの騎士様、そして
あなたがた覚者様によって支えられています
白竜様のご加護がありますように",,ui\00_message\npc\base\n1021.gmd,\npc\n1021.arc,n1021.arc,4
0,,"言葉を伝える《チャット》と
身振りで伝える《エモート》――
この二つをお忘れなきよう",,ui\00_message\npc\base\n1021.gmd,\npc\n1021.arc,n1021.arc,5
0,,覚者さま、何かご用でしょうか,,ui\00_message\npc\base\n1021.gmd,\npc\n1021.arc,n1021.arc,6
0,,"レスタニアニュース以外にも
日々の小さな事件は《クエストボード》に
多く寄せられておりますぞ",,ui\00_message\npc\base\n1022.gmd,\npc\n1022.arc,n1022.arc,0
0,,"《レスタニアニュース》は
読んで頂いておりますかな？
私が集めた情報の粋を！",,ui\00_message\npc\base\n1022.gmd,\npc\n1022.arc,n1022.arc,1
0,,"いやぁ、こうして覚者さまの役に
立てることが私の生き甲斐でしてね！
ペンで剣を動かすなんて――おっと失礼！",,ui\00_message\npc\base\n1022.gmd,\npc\n1022.arc,n1022.arc,2
0,,おお、これは覚者さま！,,ui\00_message\npc\base\n1022.gmd,\npc\n1022.arc,n1022.arc,3
0,,"これは覚者さま！
一大事ですな、ほら――《滅びの渦》です",,ui\00_message\npc\base\n1022.gmd,\npc\n1022.arc,n1022.arc,4
0,,"《滅びの渦》の真下には
《黒剣》というものが突き刺さっていて
大地から竜力を吸い上げているのだとか――",,ui\00_message\npc\base\n1022.gmd,\npc\n1022.arc,n1022.arc,5
0,,"我々一般人には、詳細が知らされておりません
目にした天変地異に怯えるばかりなのですよ
そこで、少しでも不安を軽減できればと――",,ui\00_message\npc\base\n1022.gmd,\npc\n1022.arc,n1022.arc,6
0,,"しかし、こんな情報を伝えたところで
より不安になることは目に見えていますからな
結局、記事にはしていないのです",,ui\00_message\npc\base\n1022.gmd,\npc\n1022.arc,n1022.arc,7
0,,"覚者さまのご活躍を
また記事にできる日を楽しみにしておりますぞ！",,ui\00_message\npc\base\n1022.gmd,\npc\n1022.arc,n1022.arc,8
0,,いい男、どっかにいないかな～,,ui\00_message\npc\base\n1023.gmd,\npc\n1023.arc,n1023.arc,0
0,,"逞しくってワイルドな戦士もいいけど
知的で紳士な術士もいいわよね
悩むなぁ～",,ui\00_message\npc\base\n1023.gmd,\npc\n1023.arc,n1023.arc,1
0,,"うーん
でもやっぱり、お金持ちがいいかしら",,ui\00_message\npc\base\n1023.gmd,\npc\n1023.arc,n1023.arc,2
0,,うふふ、あらなぁに？,,ui\00_message\npc\base\n1023.gmd,\npc\n1023.arc,n1023.arc,3
0,,"お休みでしたら、一泊
<VAL PRICE_INN>になります
すっかり疲れは取れますぞ
泊まっていかれますかな？","お休みでしたら、一泊
<VAL PRICE_INN>になります
すっかり疲れは取れますぞ
泊まっていかれますかな？",ui\00_message\npc\base\n1024.gmd,\npc\n1024.arc,n1024.arc,0
0,,はい,Yes,ui\00_message\npc\base\n1024.gmd,\npc\n1024.arc,n1024.arc,1
0,,いいえ,No,ui\00_message\npc\base\n1024.gmd,\npc\n1024.arc,n1024.arc,2
0,,"おお、《弱化の治療》ですかな、では
<VAL PRICE_WEAK>ほど必要となりますが
よろしいですかな？","おお、《弱化の治療》ですかな、では
<VAL PRICE_WEAK>ほど必要となりますが
よろしいですかな？",ui\00_message\npc\base\n1024.gmd,\npc\n1024.arc,n1024.arc,3
0,,はい,Yes,ui\00_message\npc\base\n1024.gmd,\npc\n1024.arc,n1024.arc,4
0,,いいえ,No,ui\00_message\npc\base\n1024.gmd,\npc\n1024.arc,n1024.arc,5
0,,"おや、《弱化》には掛っていないようですぞ
治療の必要はないようですな","おや、《弱化》には掛っていないようですぞ
治療の必要はないようですな",ui\00_message\npc\base\n1024.gmd,\npc\n1024.arc,n1024.arc,6
0,,"長旅前にはゆっくりお休みを取り
万全の状態になされませ","長旅前にはゆっくりお休みを取り
万全の状態になされませ",ui\00_message\npc\base\n1024.gmd,\npc\n1024.arc,n1024.arc,7
0,,"体調不安は旅に響きますぞ
覚者さまとて人間、無理はなさいますな","体調不安は旅に響きますぞ
覚者さまとて人間、無理はなさいますな",ui\00_message\npc\base\n1024.gmd,\npc\n1024.arc,n1024.arc,8
0,,"ようこそおいでくださいました
お部屋のご用意はすぐにできますぞ","ようこそおいでくださいました
お部屋のご用意はすぐにできますぞ",ui\00_message\npc\base\n1024.gmd,\npc\n1024.arc,n1024.arc,9
0,,"おお、これはこれは覚者さま
ジョゼフ神官から事情は聞いておりますぞ
ささ、我が家と思いご自由にお休み下され","おお、これはこれは覚者さま
ジョゼフ神官から事情は聞いておりますぞ
ささ、我が家と思いご自由にお休み下され",ui\00_message\npc\base\n1024.gmd,\npc\n1024.arc,n1024.arc,10
0,,はい,Yes,ui\00_message\npc\base\n1024.gmd,\npc\n1024.arc,n1024.arc,11
0,,いいえ,No,ui\00_message\npc\base\n1024.gmd,\npc\n1024.arc,n1024.arc,12
0,,"旅先で疲れがたまると、回復魔法だけでは
疲労は取り切れなくなりますぞ","旅先で疲れがたまると、回復魔法だけでは
疲労は取り切れなくなりますぞ",ui\00_message\npc\base\n1024.gmd,\npc\n1024.arc,n1024.arc,13
0,,"薬でも疲れはとれますが、やはり本調子に
戻るには快眠がいちばんでしょうな","薬でも疲れはとれますが、やはり本調子に
戻るには快眠がいちばんでしょうな",ui\00_message\npc\base\n1024.gmd,\npc\n1024.arc,n1024.arc,14
0,,"ジュリアのことですか
いつかはこの宿屋の跡を継ぐというものですから
まずは覚者様を自室へご案内するよう頼んだところ
あのように張り切ってしまいましてな――","ジュリアのことですか
いつかはこの宿屋の跡を継ぐというものですから
まずは覚者様を自室へご案内するよう頼んだところ
あのように張り切ってしまいましてな――",ui\00_message\npc\base\n1024.gmd,\npc\n1024.arc,n1024.arc,15
0,,"ご迷惑をおかけしていないでしょうか？
良い子なのですが、たまに一生懸命に
なりすぎるきらいがあるもので――","ご迷惑をおかけしていないでしょうか？
良い子なのですが、たまに一生懸命に
なりすぎるきらいがあるもので――",ui\00_message\npc\base\n1024.gmd,\npc\n1024.arc,n1024.arc,16
0,,お疲れでしたら、ぜひわが宿で休息を,お疲れでしたら、ぜひわが宿で休息を,ui\00_message\npc\base\n1024.gmd,\npc\n1024.arc,n1024.arc,17
0,,"パーティーメンバーの方の部屋を
ご訪問されるのでしたら
手配をお手伝いいたしましょう","パーティーメンバーの方の部屋を
ご訪問されるのでしたら
手配をお手伝いいたしましょう",ui\00_message\npc\base\n1024.gmd,\npc\n1024.arc,n1024.arc,18
0,,"パーティーメンバーの参加を待ちましょう
お相手のあることですから
少々時間がかかるかもしれませんな","パーティーメンバーの参加を待ちましょう
お相手のあることですから
少々時間がかかるかもしれませんな",ui\00_message\npc\base\n1024.gmd,\npc\n1024.arc,n1024.arc,19
0,,パーティーリーダーの部屋に行かれるのですかな？,パーティーリーダーの部屋に行かれるのですかな？,ui\00_message\npc\base\n1024.gmd,\npc\n1024.arc,n1024.arc,20
0,,はい,Yes,ui\00_message\npc\base\n1024.gmd,\npc\n1024.arc,n1024.arc,21
0,,いいえ,No,ui\00_message\npc\base\n1024.gmd,\npc\n1024.arc,n1024.arc,22
0,,"パーティーリーダーが
部屋への訪問を募集していないようです
――勝手に上がりこむわけにはゆきませんからな","パーティーリーダーが
部屋への訪問を募集していないようです
――勝手に上がりこむわけにはゆきませんからな",ui\00_message\npc\base\n1024.gmd,\npc\n1024.arc,n1024.arc,23
0,,"おや、覚者さま
パーティーメンバーの部屋を訪問するには
まずパーティーを組まねばなりません
でないと、ご案内できませんからな――","おや、覚者さま
パーティーメンバーの部屋を訪問するには
まずパーティーを組まねばなりません
でないと、ご案内できませんからな――",ui\00_message\npc\base\n1024.gmd,\npc\n1024.arc,n1024.arc,24
0,,"――これは失礼いたしました
覚者さまにはまだ《自室》を
ご案内していなかったようです","――これは失礼いたしました
覚者さまにはまだ《自室》を
ご案内していなかったようです",ui\00_message\npc\base\n1024.gmd,\npc\n1024.arc,n1024.arc,25
0,,"そこにおります娘のジュリアが
覚者さまを《自室》へとご案内いたします
まずは自室で一息つかれるとよいでしょう","そこにおります娘のジュリアが
覚者さまを《自室》へとご案内いたします
まずは自室で一息つかれるとよいでしょう",ui\00_message\npc\base\n1024.gmd,\npc\n1024.arc,n1024.arc,26
0,,"現在、パーティーメンバーの皆さまに対して
<COL b92828><VAL></COL>
と公表しています
変更をご希望ですかな？","現在、パーティーメンバーの皆さまに対して
<COL b92828><VAL></COL>
と公表しています
変更をご希望ですかな？",ui\00_message\npc\base\n1024.gmd,\npc\n1024.arc,n1024.arc,27
0,,変更しない,Do not change,ui\00_message\npc\base\n1024.gmd,\npc\n1024.arc,n1024.arc,28
0,,設定を変更：訪問を許可する,Change setting: Visit Allowed,ui\00_message\npc\base\n1024.gmd,\npc\n1024.arc,n1024.arc,29
