#Index,Key,MsgJp,MsgEn,GmdPath,ArcPath,ArcName,ReadIndex
0,,"神殿にも救援要請を出しているんだけど
覚者隊はオークとの戦いでなかなか
手が回らないらしくて",,ui\00_message\npc\base\n1412.gmd,\npc\n1412.arc,n1412.arc,65
0,,"そこで、相談なんだけど
貴方に確認を頼めないかしら
お願い――、力を貸してちょうだい",,ui\00_message\npc\base\n1412.gmd,\npc\n1412.arc,n1412.arc,66
0,,"リンウッドの皆がこうしていられるのも
貴方のお陰よね",,ui\00_message\npc\base\n1412.gmd,\npc\n1412.arc,n1412.arc,67
0,,"私にできることなんてたかだか
知れてるだろうけど、何とか恩返しするわ
補給支援の仕入れ、張り込んだんだから！",,ui\00_message\npc\base\n1412.gmd,\npc\n1412.arc,n1412.arc,68
0,,"今後ともよろしくね
ミスリウの勇者さん",,ui\00_message\npc\base\n1412.gmd,\npc\n1412.arc,n1412.arc,69
0,,貴方にお願いしたいことがあるの,,ui\00_message\npc\base\n1412.gmd,\npc\n1412.arc,n1412.arc,70
0,,"――《古の祭祀場》
あの遺跡に、森にいるのとは異なる
エントが出るようになったらしいの",,ui\00_message\npc\base\n1412.gmd,\npc\n1412.arc,n1412.arc,71
0,,"――悪いことの前兆でなければ
いいんだけど",,ui\00_message\npc\base\n1412.gmd,\npc\n1412.arc,n1412.arc,72
0,,"少し気になることがあるの
あなたに詳しい調査を頼めないかしら
準備ができたら、もう一度声をかけてちょうだい",,ui\00_message\npc\base\n1412.gmd,\npc\n1412.arc,n1412.arc,73
0,,"小さな村だが、旅の準備くらいは整えられる
必要なことがあれば言ってくれ","小さな村だが、旅の準備くらいは整えられる
必要なことがあれば言ってくれ",ui\00_message\npc\base\n1500.gmd,\npc\n1500.arc,n1500.arc,0
0,,"休んでいくか？
谷道は慣れないうちは堪えるだろう","休んでいくか？
谷道は慣れないうちは堪えるだろう",ui\00_message\npc\base\n1500.gmd,\npc\n1500.arc,n1500.arc,1
0,,"ここは他の村との行き来が厳しくてな
物資の補給も思うようにいっていない","ここは他の村との行き来が厳しくてな
物資の補給も思うようにいっていない",ui\00_message\npc\base\n1500.gmd,\npc\n1500.arc,n1500.arc,2
0,,"もし手伝ってもらえるなら、奥にいる
ヘイデンに話を聞いてみてくれ","もし手伝ってもらえるなら、奥にいる
ヘイデンに話を聞いてみてくれ",ui\00_message\npc\base\n1500.gmd,\npc\n1500.arc,n1500.arc,3
0,,"休憩なら
<VAL PRICE_INN>いただくが、どうする？
疲れは溜めないほうがいいぞ","休憩なら
<VAL PRICE_INN>いただくが、どうする？
疲れは溜めないほうがいいぞ",ui\00_message\npc\base\n1500.gmd,\npc\n1500.arc,n1500.arc,4
0,,はい,Yes,ui\00_message\npc\base\n1500.gmd,\npc\n1500.arc,n1500.arc,5
0,,いいえ,No,ui\00_message\npc\base\n1500.gmd,\npc\n1500.arc,n1500.arc,6
0,,"《弱化の治療》なら
<VAL PRICE_WEAK>いただこう、どうかね？","《弱化の治療》なら
<VAL PRICE_WEAK>いただこう、どうかね？",ui\00_message\npc\base\n1500.gmd,\npc\n1500.arc,n1500.arc,7
0,,はい,Yes,ui\00_message\npc\base\n1500.gmd,\npc\n1500.arc,n1500.arc,8
0,,いいえ,No,ui\00_message\npc\base\n1500.gmd,\npc\n1500.arc,n1500.arc,9
0,,"うむ、《弱化の治療》は不要のようだな
必要になればまた言ってくれ","うむ、《弱化の治療》は不要のようだな
必要になればまた言ってくれ",ui\00_message\npc\base\n1500.gmd,\npc\n1500.arc,n1500.arc,10
0,,ジンゲンへようこそ、旅の方,ジンゲンへようこそ、旅の方,ui\00_message\npc\base\n1500.gmd,\npc\n1500.arc,n1500.arc,11
0,,"ああ、休憩なら空いてるベッドを好きに使うといい
ここが何とかやれているのもお前さんの
おかげだからな、休むかね？","ああ、休憩なら空いてるベッドを好きに使うといい
ここが何とかやれているのもお前さんの
おかげだからな、休むかね？",ui\00_message\npc\base\n1500.gmd,\npc\n1500.arc,n1500.arc,12
0,,はい,Yes,ui\00_message\npc\base\n1500.gmd,\npc\n1500.arc,n1500.arc,13
0,,いいえ,No,ui\00_message\npc\base\n1500.gmd,\npc\n1500.arc,n1500.arc,14
0,,"ジンゲンへようこそ
――こんな状況になっても
ここを気にかけてくれるとは","ジンゲンへようこそ
――こんな状況になっても
ここを気にかけてくれるとは",ui\00_message\npc\base\n1500.gmd,\npc\n1500.arc,n1500.arc,15
0,,"ここは魔物も出るし、何より不便だ
どこか平穏に暮らせる場所に引っ越したい――
そう言い続けて、結局ジンゲンで人生を
終えることになるなんて","ここは魔物も出るし、何より不便だ
どこか平穏に暮らせる場所に引っ越したい――
そう言い続けて、結局ジンゲンで人生を
終えることになるなんて",ui\00_message\npc\base\n1500.gmd,\npc\n1500.arc,n1500.arc,16
0,,"年寄りが騒いだところで
何も変わらんよ
どうなろうと、静かに待つしかない","年寄りが騒いだところで
何も変わらんよ
どうなろうと、静かに待つしかない",ui\00_message\npc\base\n1500.gmd,\npc\n1500.arc,n1500.arc,17
0,,"ここまで来て疲れたろう
せめて旅立ちの時間まで
ゆっくり休んでいくといい","ここまで来て疲れたろう
せめて旅立ちの時間まで
ゆっくり休んでいくといい",ui\00_message\npc\base\n1500.gmd,\npc\n1500.arc,n1500.arc,18
0,,村から見えるドリード城、あなたは行った？,,ui\00_message\npc\base\n1501.gmd,\npc\n1501.arc,n1501.arc,0
0,,"私のいい人もあそこに行ってるんだ
財宝を見つけるまで戻らないって息巻いてね――",,ui\00_message\npc\base\n1501.gmd,\npc\n1501.arc,n1501.arc,1
0,,"しっかりお金を貯めて、店と家を大きくするの！
うーん、でもここ、お客さん少ないのよね",,ui\00_message\npc\base\n1501.gmd,\npc\n1501.arc,n1501.arc,2
0,,"あーあ、あの人早く戻らないかしら
私が稼ぐから、財宝なんかいいのに",,ui\00_message\npc\base\n1501.gmd,\npc\n1501.arc,n1501.arc,3
0,,"はぁい、いい取引をしましょう！
できればなるべくたくさんね",,ui\00_message\npc\base\n1501.gmd,\npc\n1501.arc,n1501.arc,4
0,,"あの空を見た？
――もう時間がないみたい
取引できるかぎり、取引しましょう！",,ui\00_message\npc\base\n1501.gmd,\npc\n1501.arc,n1501.arc,5
0,,"色んな夢があったの
お金を貯めて、この店を大きくして
その頃にはドリード城から
私のいい人も帰ってきて――",,ui\00_message\npc\base\n1501.gmd,\npc\n1501.arc,n1501.arc,6
0,,"ここまできたんだもの
最後まであの人を待ち続けるわ",,ui\00_message\npc\base\n1501.gmd,\npc\n1501.arc,n1501.arc,7
0,,"もしかしたら、お金を集めても
もう意味が無いかも知れないけど――",,ui\00_message\npc\base\n1501.gmd,\npc\n1501.arc,n1501.arc,8
0,,"あんたもモノ好きね
こんなとこ、何しに来たの",,ui\00_message\npc\base\n1502.gmd,\npc\n1502.arc,n1502.arc,0
0,,ふー、だるいわね,,ui\00_message\npc\base\n1502.gmd,\npc\n1502.arc,n1502.arc,1
0,,"散策場所、多いでしょ、ここ
地下墓地とか遺跡とか",,ui\00_message\npc\base\n1502.gmd,\npc\n1502.arc,n1502.arc,2
0,,あんた、全部行くの？,,ui\00_message\npc\base\n1502.gmd,\npc\n1502.arc,n1502.arc,3
0,,うん、何？,,ui\00_message\npc\base\n1502.gmd,\npc\n1502.arc,n1502.arc,4
0,,"そういえばさ、怖い話があったっけ
村の北に《歌姫の崖座》っていう
場所があんの",,ui\00_message\npc\base\n1502.gmd,\npc\n1502.arc,n1502.arc,5
0,,"恐ろしげな女の声が響いた時
外に出てた村人――半分くらいが
「持って行かれた」んだってさ",,ui\00_message\npc\base\n1502.gmd,\npc\n1502.arc,n1502.arc,6
0,,相当前の話らしいけどさ,,ui\00_message\npc\base\n1502.gmd,\npc\n1502.arc,n1502.arc,7
0,,"いたたたた――！　こ、腰がっ！
くそ、キノザの湯にさえ行ければ――",,ui\00_message\npc\base\n1503.gmd,\npc\n1503.arc,n1503.arc,0
0,,"うーむ、どっかにいい薬はないものか
腰さえ治れば谷を降りるんだがなぁ――",,ui\00_message\npc\base\n1503.gmd,\npc\n1503.arc,n1503.arc,1
0,,"景色は良いんだが、いかんせん
ジンゲンは道が険しいだろう
どうにもそれがなぁ",,ui\00_message\npc\base\n1503.gmd,\npc\n1503.arc,n1503.arc,2
0,,あぁ、いたた！　腰に響く,,ui\00_message\npc\base\n1503.gmd,\npc\n1503.arc,n1503.arc,3
0,,"いやぁ、なかなかうまくいかねぇぜ
目当ての品を探すにも、収穫ナシの日が
続くと酒がまずくならぁ",,ui\00_message\npc\base\n1504.gmd,\npc\n1504.arc,n1504.arc,0
0,,"ハーピーの野郎――いや、女ども！
頭の上をギャーギャー飛びまわって
うるさくてかなわねぇや",,ui\00_message\npc\base\n1504.gmd,\npc\n1504.arc,n1504.arc,1
0,,"登ってる時に限って襲って
きやがるしよぉ！",,ui\00_message\npc\base\n1504.gmd,\npc\n1504.arc,n1504.arc,2
0,,"たまーに渓谷で、でかい魔物を見かけるんだよな
さすがに避けて通るが、ぶっ倒したら
見返りもでかそうだよな",,ui\00_message\npc\base\n1504.gmd,\npc\n1504.arc,n1504.arc,3
0,,とはいえ、命あっての物種っつーしな,,ui\00_message\npc\base\n1504.gmd,\npc\n1504.arc,n1504.arc,4
0,,おう！　何か用か,,ui\00_message\npc\base\n1504.gmd,\npc\n1504.arc,n1504.arc,5
0,,"《ドリード監視塔》は知ってっか？
何十年か前、白騎団の駐屯所だったらしいが
完全な廃墟だぜ",,ui\00_message\npc\base\n1504.gmd,\npc\n1504.arc,n1504.arc,6
0,,"ま、それなりに使えるものは残ってそう
だけどな
あの野郎――いや、ギャーギャー喚く
鳥女どもが邪魔しやがるが！",,ui\00_message\npc\base\n1504.gmd,\npc\n1504.arc,n1504.arc,7
0,,"魔物の警戒は白騎団が常に行っている
覚者隊に応援を要請する必要はない",,ui\00_message\npc\base\n1505.gmd,\npc\n1505.arc,n1505.arc,0
0,,今の所はな,,ui\00_message\npc\base\n1505.gmd,\npc\n1505.arc,n1505.arc,1
0,,"北のバートランド平原は、オーク共の根城に近い
このダウ渓谷にも斥候が入り込むかもしれん",,ui\00_message\npc\base\n1505.gmd,\npc\n1505.arc,n1505.arc,2
0,,お前達も気をつけろ,,ui\00_message\npc\base\n1505.gmd,\npc\n1505.arc,n1505.arc,3
0,,"ドリード城は、元は白騎団の本丸だったと聞く
白竜様がお元気で、レスタニアが今よりも
開かれていた時代のことだ",,ui\00_message\npc\base\n1505.gmd,\npc\n1505.arc,n1505.arc,4
0,,今や魔物の巣窟らしいがな,,ui\00_message\npc\base\n1505.gmd,\npc\n1505.arc,n1505.arc,5
0,,特に問題はない,,ui\00_message\npc\base\n1505.gmd,\npc\n1505.arc,n1505.arc,6
0,,"村近くの《白砂河原》には
サルファーリザードが多く棲みついている
お前が覚者なら、軽くまとめて退治しておいて
ほしいものだ",,ui\00_message\npc\base\n1505.gmd,\npc\n1505.arc,n1505.arc,7
0,,白竜様のご加護があらんことを,,ui\00_message\npc\base\n1506.gmd,\npc\n1506.arc,n1506.arc,0
0,,リムの輝きは常に貴方と共に,,ui\00_message\npc\base\n1506.gmd,\npc\n1506.arc,n1506.arc,1
0,,"メンバーの再編でしたら
私にお申し付けください",,ui\00_message\npc\base\n1506.gmd,\npc\n1506.arc,n1506.arc,2
0,,旅の同伴者をお求めでしょうか、覚者殿,,ui\00_message\npc\base\n1506.gmd,\npc\n1506.arc,n1506.arc,3
0,,"この関所から北は《バートランド平原》だ
本関所はグリッテン砦の管理下にあるが
ダウのエリアマスター、ヘイデン殿が認めた者は
通してもよいと言われている",,ui\00_message\npc\base\n1507.gmd,\npc\n1507.arc,n1507.arc,0
0,,"俺は鼻がいいほうでな
オークの臭いが強まればすぐ砦に連絡する",,ui\00_message\npc\base\n1507.gmd,\npc\n1507.arc,n1507.arc,1
0,,"俺は関所番であることに誇りを感じている
砦より薄くとも、ここは北の地に対する
守りの要なのだ",,ui\00_message\npc\base\n1507.gmd,\npc\n1507.arc,n1507.arc,2
0,,ああ、覚者隊の者か,,ui\00_message\npc\base\n1507.gmd,\npc\n1507.arc,n1507.arc,3
0,,"この関所の通行許可を得た隊士は
バートランド平原の任務も行うことに
なるだろう",,ui\00_message\npc\base\n1507.gmd,\npc\n1507.arc,n1507.arc,4
0,,"その際、《グリッテン砦》西側通路の
通行許可も同時に出されるのだ
覚えておくといい",,ui\00_message\npc\base\n1507.gmd,\npc\n1507.arc,n1507.arc,5
0,,"ああ、覚者様！！
あなたのお力をお貸しいただきたい事が――！",,ui\00_message\npc\base\n1508.gmd,\npc\n1508.arc,n1508.arc,0
0,,"ジンゲンの上、崖を登ったダウで最も標高の
高い所に《歌姫の崖座》と呼ばれる場所が
あるのですが――",,ui\00_message\npc\base\n1508.gmd,\npc\n1508.arc,n1508.arc,1
0,,"例の魔鳥、《妖歌のローレライ》が
今度こそ本当に姿を現したのです！！",,ui\00_message\npc\base\n1508.gmd,\npc\n1508.arc,n1508.arc,2
0,,"ジンゲンの民半数を攫い
相当数の覚者と騎士が命を落とし
ようやく撃退した、かの魔物が！",,ui\00_message\npc\base\n1508.gmd,\npc\n1508.arc,n1508.arc,3
0,,"覚者様にばかり頼ることはできませんが
もし可能であれば――どうか！
依頼を引き受けていただきたいのです",,ui\00_message\npc\base\n1508.gmd,\npc\n1508.arc,n1508.arc,4
0,,"あなたさまがジンゲンに掛けて下さる
お心遣いの数々――
感謝してもしきれません",,ui\00_message\npc\base\n1508.gmd,\npc\n1508.arc,n1508.arc,5
0,,"あなたこそまさに
白竜様が我々に遣わして下さった恵みです",,ui\00_message\npc\base\n1508.gmd,\npc\n1508.arc,n1508.arc,6
0,,"比べられるものではありませんが
我々にできる精一杯の礼を用意しました
ジンゲンの民は、あなたと共に",,ui\00_message\npc\base\n1508.gmd,\npc\n1508.arc,n1508.arc,7
0,,"あなたさまが村に滞在されるようになって
民の表情も明るくなったかのようです",,ui\00_message\npc\base\n1508.gmd,\npc\n1508.arc,n1508.arc,8
0,,"どうか、これを――
そして今後もよろしくお願いいたします",,ui\00_message\npc\base\n1508.gmd,\npc\n1508.arc,n1508.arc,9
0,,"村の依頼を引き受けて下さり
ありがとうございます
心ばかりですが、我々からの礼でございます",,ui\00_message\npc\base\n1508.gmd,\npc\n1508.arc,n1508.arc,10
0,,"いつも懇意にして下さるあなたさまに
何かできることはないかと思い
我々でこれを用意いたしました",,ui\00_message\npc\base\n1508.gmd,\npc\n1508.arc,n1508.arc,11
0,,いつでもあなたを歓迎いたします,,ui\00_message\npc\base\n1508.gmd,\npc\n1508.arc,n1508.arc,12
0,,"たびたびご足労をお掛けします
ねぎらいとなるか分かりませんが
これを用意いたしました",,ui\00_message\npc\base\n1508.gmd,\npc\n1508.arc,n1508.arc,13
0,,どうかお受け取りください,,ui\00_message\npc\base\n1508.gmd,\npc\n1508.arc,n1508.arc,14
0,,"谷道は厳しかったでしょう
つまらぬ物ですが、こちらは立ち寄って
いただいたお礼です",,ui\00_message\npc\base\n1508.gmd,\npc\n1508.arc,n1508.arc,15
0,,"遠路はるばるようこそ
ダウ渓谷へはどのような？",,ui\00_message\npc\base\n1508.gmd,\npc\n1508.arc,n1508.arc,16
0,,"美しい渓谷に針葉樹林
ドリード城の佇まい――",,ui\00_message\npc\base\n1508.gmd,\npc\n1508.arc,n1508.arc,17
0,,"ダウ渓谷は美しい土地です
どうかジンゲンのため、あなたさまのお力を
お貸し下さい",,ui\00_message\npc\base\n1508.gmd,\npc\n1508.arc,n1508.arc,18
0,,"谷山の上には、チェスターという青年が
一人で暮らしています",,ui\00_message\npc\base\n1508.gmd,\npc\n1508.arc,n1508.arc,19
0,,"相当の変わり者ですが、軽業の技術で
右に出る者はいません",,ui\00_message\npc\base\n1508.gmd,\npc\n1508.arc,n1508.arc,20
0,,"あなたが渓谷を愛する方であれば
あの者と気が合う事でしょう",,ui\00_message\npc\base\n1508.gmd,\npc\n1508.arc,n1508.arc,21
0,,"滝の水音に薄い雲、豊かな緑
魔物の脅威さえなければ、ここは実に
穏やかな村なのですが",,ui\00_message\npc\base\n1508.gmd,\npc\n1508.arc,n1508.arc,22
0,,"ようこそいらっしゃいました
お伝えすべきことがあるのです",,ui\00_message\npc\base\n1508.gmd,\npc\n1508.arc,n1508.arc,23
0,,"このダウ渓谷に置かれた《辺境の礎》が
全てあなたさまのために解放されました",,ui\00_message\npc\base\n1508.gmd,\npc\n1508.arc,n1508.arc,24
0,,"この辺りでのあなたさまの格別の働きを
神殿が評価しての配慮とのことです",,ui\00_message\npc\base\n1508.gmd,\npc\n1508.arc,n1508.arc,25
0,,"どうぞ、これを機会に
この美しいダウ渓谷の自然を
すみずみまでご覧ください",,ui\00_message\npc\base\n1508.gmd,\npc\n1508.arc,n1508.arc,26
0,,"ああ、覚者様！
どうかお力をお貸しください――
ジンゲンの村の危機なのです",,ui\00_message\npc\base\n1508.gmd,\npc\n1508.arc,n1508.arc,27
0,,"実は、少し前から外で遊んでいた子供が
行方不明になる事件が相次ぎました",,ui\00_message\npc\base\n1508.gmd,\npc\n1508.arc,n1508.arc,28
0,,"たまりかねた親たち、年かさの兄弟たち
さらには居合わせた旅の方までが
何人も連れ立って捜索へと旅立ったのですが
ついに一人も戻らず――",,ui\00_message\npc\base\n1508.gmd,\npc\n1508.arc,n1508.arc,29
0,,"そして先日、カタコンベ近くで
何体もの石像が発見されました
生生しい、何かから逃げ惑うような姿勢のものが――",,ui\00_message\npc\base\n1508.gmd,\npc\n1508.arc,n1508.arc,30
0,,"あれは捜索に出た者たちが
石にされたものではないでしょうか――
この村に大きな脅威が迫っているのではと
気が気ではありません",,ui\00_message\npc\base\n1508.gmd,\npc\n1508.arc,n1508.arc,31
0,,"覚者さま
あの辺りに危険な魔物が潜んでいないか
一度調査していただけないでしょうか
何卒ご一考のほどを――",,ui\00_message\npc\base\n1508.gmd,\npc\n1508.arc,n1508.arc,32
0,,覚者様、実は――,,ui\00_message\npc\base\n1508.gmd,\npc\n1508.arc,n1508.arc,33
0,,"以前、ガーゴイルの群れを討伐してくださった
場所の近くに《見捨てられた井戸》が発見されました",,ui\00_message\npc\base\n1508.gmd,\npc\n1508.arc,n1508.arc,34
0,,"まるで中から逃げ出そうとしているような姿勢の
石像も一緒に見つかったのです",,ui\00_message\npc\base\n1508.gmd,\npc\n1508.arc,n1508.arc,35
0,,"もしかすると、あの辺りの石像はガーゴイルではなく
井戸の中にいる何か恐ろしい魔物から
逃げようとしていたのかも知れません",,ui\00_message\npc\base\n1508.gmd,\npc\n1508.arc,n1508.arc,36
0,,"この村の危機は
まだ去っていないのでは――",,ui\00_message\npc\base\n1508.gmd,\npc\n1508.arc,n1508.arc,37
0,,覚者様、度重なる依頼をお許しください――,,ui\00_message\npc\base\n1508.gmd,\npc\n1508.arc,n1508.arc,38
0,,"実は、《見捨てられた井戸》に近づいた者が
井戸から人の声のような物音が
聞こえた、と申すのです",,ui\00_message\npc\base\n1508.gmd,\npc\n1508.arc,n1508.arc,39
0,,"もちろん魔物の声である可能性も大いにありますが
このままでは我々も諦めがつきません
どうか、井戸の奥を確かめてきては
いただけないでしょうか",,ui\00_message\npc\base\n1508.gmd,\npc\n1508.arc,n1508.arc,40
0,,"引き受けてくださるならば、
あらためて詳しくご説明いたします",,ui\00_message\npc\base\n1508.gmd,\npc\n1508.arc,n1508.arc,41
0,,"あなたこそまさに
白竜様が我々に遣わして下さった恵みです",,ui\00_message\npc\base\n1508.gmd,\npc\n1508.arc,n1508.arc,42
0,,"あなたさまからの数々お心遣いによって
この村は幾度となく救われております
感謝してもしきれません",,ui\00_message\npc\base\n1508.gmd,\npc\n1508.arc,n1508.arc,43
0,,"まだまだ至りませんが
現時点で集めうる限りの支給品をご用意いたします
ジンゲンの民は、これからもあなたさまと共に",,ui\00_message\npc\base\n1508.gmd,\npc\n1508.arc,n1508.arc,44
0,,このあたりはすでにごらん頂けましたか？,,ui\00_message\npc\base\n1508.gmd,\npc\n1508.arc,n1508.arc,45
0,,"ドリード城の城下として栄えたのは
はるか昔――",,ui\00_message\npc\base\n1508.gmd,\npc\n1508.arc,n1508.arc,46
0,,"オークどもの台頭で今や住む者も
ごくわずか――",,ui\00_message\npc\base\n1508.gmd,\npc\n1508.arc,n1508.arc,47
0,,"よって、このジンゲンとその周辺は
見捨てられても仕方のない地区です",,ui\00_message\npc\base\n1508.gmd,\npc\n1508.arc,n1508.arc,48
0,,"しかしながら、突き放すような厳しさ――
そして険しさ故の美が入り混じる風景に心ひかれ
訪ね来る人々も少なくありません",,ui\00_message\npc\base\n1508.gmd,\npc\n1508.arc,n1508.arc,49
0,,"そんな人々に便宜を提供することで
白竜様のお役に立とうと
我々はここに暮らし、精進しております",,ui\00_message\npc\base\n1508.gmd,\npc\n1508.arc,n1508.arc,50
0,,"わたくしはジンゲンの長――
ダウ渓谷のエリアマスター、ヘイデンと申します
どうぞお見知りおきを",,ui\00_message\npc\base\n1508.gmd,\npc\n1508.arc,n1508.arc,51
0,,"村の依頼を引き受けて下さり
ありがとうございます",,ui\00_message\npc\base\n1508.gmd,\npc\n1508.arc,n1508.arc,52
0,,"今後は、覚者様を物資面にて
支援させていただきます",,ui\00_message\npc\base\n1508.gmd,\npc\n1508.arc,n1508.arc,53
0,,"――覚者様にお知らせすべき
ことがあるのです",,ui\00_message\npc\base\n1508.gmd,\npc\n1508.arc,n1508.arc,54
0,,"村から降りた川べり、《白砂河原》で
このところ、凶暴で大きなラージサルファーの
目撃が相次いでおりまして",,ui\00_message\npc\base\n1508.gmd,\npc\n1508.arc,n1508.arc,55
0,,"《タイガーテール・サルファー》と呼び
警戒をしておりました",,ui\00_message\npc\base\n1508.gmd,\npc\n1508.arc,n1508.arc,56
0,,"もし河原へ下りる時は、
十分注意なさることです",,ui\00_message\npc\base\n1508.gmd,\npc\n1508.arc,n1508.arc,57
0,,"――地下墓地、《カタコンベ》
ドリード城近くにある地下墓地は旧時代
罪人を葬る場所であったと言われています",,ui\00_message\npc\base\n1508.gmd,\npc\n1508.arc,n1508.arc,58
0,,"白竜様のお力が弱まり
近年妙に瘴気が溜まりやすくなって
しまっている様子――",,ui\00_message\npc\base\n1508.gmd,\npc\n1508.arc,n1508.arc,59
0,,"そこで、危険ではありますが
一度入り口を開放することにいたしました",,ui\00_message\npc\base\n1508.gmd,\npc\n1508.arc,n1508.arc,60
0,,"もし、探索をされるのでしたらどうぞ
積極的に私から勧めはいたしませんが",,ui\00_message\npc\base\n1508.gmd,\npc\n1508.arc,n1508.arc,61
0,,"ダウの西に、《ドリード監視塔》という
小塔があるのはご存知ですか",,ui\00_message\npc\base\n1508.gmd,\npc\n1508.arc,n1508.arc,62
0,,"一昔前までは、現役の騎士団詰め所でも
あった場所なのですが
今やスノーハーピーが縄張りとする危険地帯",,ui\00_message\npc\base\n1508.gmd,\npc\n1508.arc,n1508.arc,63
0,,"この調子で増えられれば
いずれジンゲンにも彼女らが飛来するのは
明白です",,ui\00_message\npc\base\n1508.gmd,\npc\n1508.arc,n1508.arc,64
0,,"どうか、群れの中核をなす
《スノーグーラー・ハーピー》を討伐して
くださいませんか",,ui\00_message\npc\base\n1508.gmd,\npc\n1508.arc,n1508.arc,65
0,,"あなた様が村に滞在されるようになって
民の表情も明るくなった気がいたします",,ui\00_message\npc\base\n1508.gmd,\npc\n1508.arc,n1508.arc,66
0,,"大した支援品ではありませんが
改善の努力をしますので
今後もよろしくお願いいたします",,ui\00_message\npc\base\n1508.gmd,\npc\n1508.arc,n1508.arc,67
0,,"覚者様は、いまや相当にダウ渓谷を
よく知る方――
以前お話したとおり、ある人物を紹介
したいのです",,ui\00_message\npc\base\n1508.gmd,\npc\n1508.arc,n1508.arc,68
0,,"その者の名はチェスター
神殿では伝えられていない職
《シーカー》の技術に長けた若者です",,ui\00_message\npc\base\n1508.gmd,\npc\n1508.arc,n1508.arc,69
0,,"ダガ―を駆使する素早い身ごなしと
ロープを用いた跳躍術",,ui\00_message\npc\base\n1508.gmd,\npc\n1508.arc,n1508.arc,70
0,,"その特性から、暗殺者や盗賊といった
ならず者が好む技術ではありますが
あなたであれば善く使うことができるはず",,ui\00_message\npc\base\n1508.gmd,\npc\n1508.arc,n1508.arc,71
