"key","old","new"
"TUTORIAL_STEP_475","アチーブメントの達成に応じて
<COL ffdc78>≪家具レシピ≫</COL>を獲得できます

宿場区のジュリアに話しかけ
≪アチーブメント≫から
家具レシピの獲得条件を確認したり
家具レシピを受け取ることができます","You can get<COL ffdc78>≪Furniture Recipes≫</COL>for each achievement.

Talk to Julia in the Relay Station District and choose
≪Achievements≫
to see the conditions for getting furniture recipes and to receive them!"
"TUTORIAL_STEP_476","家具レシピを手に入れることができたら
クラフトルームで家具を作成してみましょう

作成した家具は
≪覚者の自室≫でパートナーポーンに
話しかけることで設置、変更ができます

お気に入りの家具を設置して自室を彩りましょう","Once you have the furniture recipe, go and create your own furniture in the craft room.

You can install or change the furniture you created by talking to your partner pawn in the ""Arisen's Room"".


Set up your favorite furniture and decorate your room!"
