"key","old","new"
"TUTORIAL_STEP_460","<COL 78f5ff>《ポーン遠征隊》が解放されました！</COL>

<COL ffdc78>《ポーン遠征隊》</COL>は、
クラン拠点から１日１回パートナーポーンを
指定したスポットに派遣できるコンテンツです

派遣したポーンは翌日まで戻ってこないため
冒険の終わりに派遣させるとよいでしょう

※スポットに採取物が無い場合、
　ゴールドを持ち帰ります","<COL 78f5ff>""Pawn Expeditions"" have been unlocked!</COL>

<COL 78f5ff>""Pawn Expeditions""</COL> is a content where you can dispatch a partner pawn to a designated spot once a day from the clan hall.

The dispatched pawn will not return until the next day, so it is recommended to send them on an adventure at the end of your session.

※ If there are no collectible items at the spot, they will bring back gold."
"TUTORIAL_STEP_504","ポーン遠征隊に派遣したポーンは、
《ホットスポット》と呼ばれる
特殊な状態のスポットを発見することがあります

ポーン隊帰還後の報告で知ることができ、
スポットリストにホットスポットが登録されます

ホットスポットでは《発掘武器》と呼ばれる
未知のお宝を入手する事ができるため
積極的に参加しましょう","Pawns dispatched to the Pawn Expeditions may discover special spots called ""Hotspots"". 

This information can be learned from the reports upon the return of the Pawn, and the Hotspots will be registered in the Spot List. 

Hotspots are where you can obtain unknown treasures called ""Excavation Weapons"", so be sure to actively participate."
"TUTORIAL_STEP_505","※《発掘武器》とは
ホットスポットで入手する事ができる
特殊な鑑定素材です
鑑定することで特殊な武器として生まれ変わります","※""Excavated Weapons"" 
are special appraisal materials that can be obtained at hotspots. 
By appraising them, they will be reborn as special weapons."
