"key","old","new"
"q00020200_00_52","心の闇","The Darkness of the Heart"
"q00020200_00_52","目覚めたガラダと会い
事のあらましを伺う","Meet Gearóid, who has woken up,
and inquire about the situation."
"q00020200_00_2109","モルフォールへ行きガラダと会う","Go to Morfaul and meet Gearóid."
"q00020200_00_2110","ファーラナ平原にある精霊の地への入り口へ向かう","Head to the entrance to the Spirit Land in the Farana Plains"
"q00020200_00_2111","ロイグの放った魔物を倒す","Defeat the demons released by Loeg"
"q00020200_00_2112","セシリーと話す","Speak with Cecily"
"q00020200_00_2113","モルフォールへ戻りガラダに報告する","Return to Morfaul and report to Gearóid"
"q00020200_00_2114","ファーラナ平原で開かれる会談の場へ向かう","Head to the open meeting place in the Farana Plains"
"q00020200_00_2125","謁見の間に戻りジョゼフに報告する","Return to the Audience Chamber and report to Joseph"
