old,new
新しい《証拠》を手に入れたぞ！,
"<NPC 691>を完全に落とすためには
まだまだ《証拠》が足りない――",
"メガドの中で得られる証拠はまだまだ
あるはずだ
さぁ、《諜報活動》にでかけよう",
"<COL ff2600>調査できそうな場所が無くなったり
《諜報活動》を終えたいときは
俺に声をかけてくれ</COL>",
"よし、それじゃあ出発の準備ができたら
もう一度俺に声をかけてくれ",
それじゃあ、メガドでの《諜報活動》を始めるか？,
はい,Yes
いいえ,No
今日はもう終わりにするか？,
まだ続ける,Continue on
終わりにする,End
無駄な戦闘は、できるだけ避けたいんだがな,
騒ぎになると面倒だな――,
チッ、雑魚どもめ――,
"夜のメガドは危険だ
しっかり準備していけよ",
"もうすぐ夜が明けるな
帰るぞ――",
"憲兵が見張ってやがる――
くそ、大通りは通行止めってわけか",
"おい覚者、気をつけろ！
危うく憲兵に見つかるところだったぞ",
"だれ――？
みんなのお友達？",
"あ、覚者さん
僕の話、覚えててくれたのかな",
"<NPC 691>――だっけ？
彼が何か知っているみたいだよ
聞いてみて",
"こんばんは！
ぼくたちの集会にようこそ",
"えぇと――話はきいているよ
ぼくに何か聞きたいことがあるんでしょ？",
<NPC 691>のことを聞く,
なんでもない,Nothing
"うーんと――名前はわかんないけど
たぶん、ぼくその人知ってるよ
何度か、話しかけたことがあるんだ
よくメフィスさんの後をついていってたから",
"そのときのことが知りたいんだね？
うーん、教えてあげてもいいけど――",
"――――そうだ！
いっしょに遊んでくれたら教えてあげる！
ね、いいでしょ",
"あのねー、ぼくと鬼ごっこして捕まえられたら
あなたの勝ち！",
それじゃ――準備はいい？,
はい,Yes
いいえ,No
"すごいすごーい！
足が速いんだね！
でも、ぼくも負けないよ",
"彼はわたしたちの中で一番足がはやいの
きっとおいつけないよ！",
"僕たち、ここで暮らしていると
追いかけられることが多いから――
自然と足も速くなるんだよね",
彼は僕らの中で一番のランナーなのさ,
あのガキを捕まえて、<NPC 691>の情報をもらうぞ！,
"すごい――！
まさか、本当に勝っちゃうなんて",
"へぇ、すごいじゃん覚者さん
彼に勝てた人なんて初めて見た",
"うーん、負けちゃったよ！
鬼ごっこ、つよいんだね――",
"それじゃ――約束だもんね！
あなたとメフィスさんを
こっそり追いかけてた人のことを
知りたいんだよね？",
"――えーと
最近ぼくらの縄張りに来るようになったんだ
それで、見て回りながら
いろいろなことをメモしているみたい",
"あの日も、メフィスさんとあなたの後を
こっそりついていって、ずーっと何か書いてたよ
メフィスさんが、あの人を捕まえるまで！
――ぼく見てたもん、まちがいないよ！",
"いったい何を書いていたのかな？
似顔絵とか――？",
"あのお兄さん、わるい人なの？
ぼくの話、役に立てたかな――？",
"<NPC 691>のメモが落ちているとすれば
　　　　　この辺りだ――探してみろ",
"あら、覚者さんとメフィスさん！
舐めるように地面を見て、一体どうしたの？",
"“メモの落し物”――ですって？
本当にこの辺りで<NPC 691>さんと
争った時に、落としたの？",
"もしかして、誰かが拾っちゃったのかしら
この辺りはあんまり治安が良くないから
落し物が次の日もそのまま残ってるってことは
あんまりないかも――",
"そうだ、もしかしたら<NPC 698>さんが
何か知っているかもしれないわ！
ガラクタや、盗品なんかも扱ってるそうなの
聞いてみて！",
"“メモの落し物”――
本当にこの辺りで<NPC 691>さんと
争った時に、落としたの？",
"もしかして、誰かが拾っちゃったのかしら
この辺りはあんまり治安が良くないから
落し物が次の日もそのまま残ってるってことは
あんまりないかも――",
"そうだ、もしかしたら<NPC 698>さんが
何か知っているかもしれないわ！
ガラクタや、盗品なんかも扱ってるそうなの
聞いてみて！",
話が早くて助かるね――,
"実は、掘り出し物の花瓶を手に入れたんだけど
運ぶ途中、助手がどこかに落としちまったんだよ
それを探してきてほしいんだ",
"心当たりのある場所の印を
マップにつけておいたやったからね",
"かなり良い品だからね――
見つけたら気を付けて扱ってくれよ
あんたたちの欲しいメモはそれと交換だ",
<NPC 698>め、そんな副業があったとは,
探し物とは厄介だが、仕方ない,
これ――ではないらしいな,
"これがその探し物か――
　　　　　<NPC 698>に報告しよう",
"フン、気が利かないねえ
それともそういうフリをしてんのかい？",
"――まぁどっちでもいいさ
気が向いたらまた来ておくれよ",
"実は、掘り出し物の花瓶を手に入れたんだけど
運ぶ途中、助手がどこかに落としちまったんだよ
それを探してきてほしいんだ",
"心当たりのある場所の印を
マップにつけておいたやったから
探してきておくれよ",
"戦時下じゃ見向きもされない品だがね
芸術ってのは平和になってから
価値がどんどん上がっていくものなのさ
くれぐれもくすねたりするんじゃないよ！",
"おやおや、また来たんだね――
仕事の話かい？",
"ガラクタ集めぇ？
あぁ――確かに副業でやってるよ
拾ったガラクタやら盗品を買い取ってるんだ",
"鉄くずなんかは結構金になってねえ――
英雄サマはゴミに興味があるのかい？",
"メモの書き付けられたノート？
あぁ、ちょうど入りたてのヤツがあるねぇ
確かに、特徴はあんたの話と一致しているヤツさ",
"だがね――タダって訳にはいかないよねぇ
こっちも商売でやってるから
わかるよねぇ",
困りごとを解決する,
わからない,
これだよこれ――ありがとよ,
さてと――次はあたしの番だね,
"はい、これがあんたの欲しいノートだよ
どこからか子供が拾ってきたから
小遣いを渡して買い取ったのさ――感謝しとくれよ",
"それにしても、誰のか分からないメモなんて
ずいぶんと趣味の悪い物を欲しがるんだねぇ
でも、この文体――
どこかで見たことがあるような気もするんだけど",
"ま、いいさ――
また何か落し物を探したいときはおいで
だいたいあたしの所に集まってるから",
"まだ何かあるのかい？
仕事の話なら明日来てくれないかい
今日は疲れた――店仕舞いさ",
おい、奴らが何か落としたぞ――？,
"覚者さん、諜報お疲れ様です！
何か気付いたことあったかな――
あ、そういえば",
"この間、憲兵と大衝突しちゃったんですよ！
ラッキーなことに、相手が姉さんの知り合い
だったみたいで何事も無かったんですけど――",
"その時に、憲兵隊の報告書――のような物を
落としていたんです！
あれに、日々の活動報告が書かれているなら
何かの役に立ちそうじゃないですか？",
"その場は返しちゃったんですけど――
もし、いつも持ち歩いているのなら
奪えるかもしれないですよ！
たまには憲兵とぶつかってみるのはどうです？",
うう――た、助けてくれ,
"<NPC 3273>を知ってるか？
メガドで武具屋をやっている男だ――
そいつを呼んできてくれないか",
"こいつはお前が会ったという脱獄囚か？
　　　　　急いで<NPC 3273>を呼んでやれ！",
<NPC 3273>を呼んだぞ――戻ってみよう,
くそ、憲兵どもめ――！,
奴らを許すな――,
"憲兵の奴らは、仲間だろうと反抗や失敗には
容赦がないって話は聞いたことがある
きっと、何かやらかして
逃げ出してきたんだな――",
"――あ、あぁ覚者さんすみませんね
こいつは、幼馴染だったんです
会ったのは数年ぶりだが――
最期を悟って私を呼んでくれたんですね",
"その手記は、きっとあなたなら
有効活用してくれると思って
託したのでしょう
――無駄にはしないでください",
おや――こんな時間にどうしました？,
"え？
わたしを連れて来てほしいと
傷だらけの男に頼まれた？
はて、奇妙ですね",
"――まさか
場所はどこなんです！？",
"――――
わかりました
すぐに向かいましょう！",
"う、うぅ
あんた――そこのあんた",
"<NPC 3273>を知ってるか？
メガドで武具屋をやっている男だ――
そいつを呼んできてくれないか",
"ちょ、ちょっと怪我しちまってるだけだ
アンタを巻き込むわけにはいかねぇ
頼む――<NPC 3273>を呼んでくれ",
だ、だれか助けてくれぇぇぇぇ！！,
"うう――覚者さん、俺はもうだめだ――
これを受け取ってくれ――",
"憲兵隊に入れば、一生安泰だと思ったのに
あんなちょっとしたミスで投獄されて――
頼む、それを公表して憲兵隊の実態を
知らしめてくれ",
"そ、そんな
どうしてこんな酷い目に――
お袋さんのため憲兵隊に入ったはずじゃ――",
"覚者さん、どうやら憲兵隊が
バタバタしているらしい――
使えそうな情報を聞いたぜ",
"なんでも、憲兵が捕えた奴らの中から
脱獄囚が出たらしい
――しかも、そいつが逃げ出したのは
二度目らしいぞ",
"――おい、もしかしてあんた
そいつに心当たりがあるのかい？
まだ逃走中だそうだから
探してみれば会えるかもなぁ？",
"まぁ、俺が脱獄囚なら――
人気の少ない廃墟や、路地に隠れるかな
ま、今も憲兵が捜索中だそうだから
奴らには気を付けろよ",
"ここに座っているとな――
息子が暗闇の中に見える気がするんじゃ",
"――こんなことしていたら
憲兵さんに怪しまれてしまうんじゃがなぁ
ぼちぼち戻るとするかのう",
"おや、あなたは――覚者さんじゃないかね
こんな時間にウロウロしていては
いくら覚者さんと言えど
憲兵さんに逮捕されてしまいますぞ",
"ワシは――亡くした息子のことを考えていたんじゃ
男手一つで立派に育て上げて
憲兵隊に送り出したんじゃが――",
"それから連絡が取れなくなってしまってのう
――半ば諦めておる",
"いつまでも過去にすがっていては
いけないと分かってはいるんじゃがな
ろくな形見も無いのが悔しゅうて――",
"覚者さん、よければこの<COL ff2600>お守り</COL>を受け取ってくだされ
息子が発つ時、渡し損ねたものなんじゃが――
話を聞いてくださったお礼として――",
"お守り、まだ持っていてくださっておるかの？
きっと覚者さんを護ってくださるじゃろうて
――それに、あの子も喜ぶはずじゃ",
"あ、あのさ――
俺のこと、覚えてるか？
昼間助けてもらった<NPC 3259>っていうんだけど",
"――ちょっと噂で聞いたんだけど
あんたたち、裏で侯爵を潰すための
活動をしてるって？",
"いや、脅そうってんじゃねえよ
逆だよ――俺も力になれねえかな？
オークの次は人間にビクビクしなきゃ
いけない状況に、うんざりしてるんだ",
"それに、昼間あんたに助けられて――
本当に“人を助ける人”なんだって感じたんだ
相手がどう見えるかなんて関わらず、さ",
"だから、そんなあんたに協力することが
メガドのためになるはずだ
帰る家の無い子供たちのためにも、だ
そう心から思えた",
"情報収集や潜入、もちろん腕っぷしにも
そこそこ自信はある
――どうだ？",
<NPC 3259>を仲間に迎える,Accept <NPC 3259> as a friend
少し考えさせてくれ,I will think a bit
――――！,
"ありがとう――
俺にできることなら何でも言ってくれ",
"おう、覚者さん
諜報活動中か？",
"俺の方も、周りの奴らに
探りを入れたりしてるんだが――
今の所、有力な情報は無いな",
"引き続き、聞き込みしてみるぜ
何かあったら伝えるよ",
"あら、覚者さんにメフィスさん
諜報中なの？
ご苦労様！",
"私は今、集会所に備蓄しておく
食料を買ってきたところなのよ
この先、何があるかわからないでしょ？",
"私の方でも、何か情報を手に入れたら
一番に知らせるわね！",
"あ、覚者さん！
もしかして今、諜報中ですか？
憲兵には気を付けてくださいね",
"僕も、一応周りの知り合いに
探りを入れたりして調べてるんです",
"何か、使えそうなことを聞いたら
覚者さんにお知らせしますね！",
"よし、尋問に必要な証拠は揃ったな
　　　　　早いところ戻るとしよう",
さぁ、今日もやるか,
