"key","old","new"
"TUTORIAL_STEP_762","《潜入調査》とは、<NPC 681>侯爵の懐に潜り込み
尋問時に利用できる情報や、侯爵の言動を
探っていく任務のことです

<COL ffdc78>※任務中は、リム転移の使用ができません
　リム転移で別の場所へ移動すると
　任務範囲外となり、クエスト失敗になります</COL>","Undercover Investigation is a mission to infiltrate <NPC 681> the Marquis's inner circle and gather information that can be used during interrogation, as well as to investigate the Marquis's words and actions.

<COL ffdc78>※During the mission, Rift Teleport cannot be used. 
Moving to a different location via Rift Teleport will result in going out of the mission area and failing the quest.</COL>"
"TUTORIAL_STEP_771","また、この任務中に取った行動は
《諜報活動》に影響を及ぼすことがあります

<COL ffdc78>アナウンスが表示されたら
チャットログに注目しましょう</COL>","Also, the actions taken during this mission may have an impact on ""Intelligence Assessment"".

<COL ffdc78>When the announcement appears, let's pay attention to the Chat Log</COL>."
