"key","old","new"
"TUTORIAL_STEP_97","【<KC UI_GAME_MENU>】ゲームメニュー《キャラクター》の
<COL ffdc78>《ステータス・装備》</COL>から
装備品の付け替えや詳細確認ができます

装備品は頭や腕、胴など部位ごとに装着でき、
あなたの強さや体力に大きく影響します

《武具屋》などのショップで購入できます","【<KC UI_GAME_MENU>】Game Menu《Character》

From <COL ffdc78>Status/Equipment</COL> in the Character menu,
you can switch equipment and check its details.

Equipment can be equipped on different body parts such as the head, arms, and torso,
and it greatly affects your strength and health.

You can purchase equipment at shops like the Equipment Shop."
"TUTORIAL_STEP_235","装備できる品はジョブやレベル、性別により
制限があります

<COL ffdc78>ジョブとレベルに見合った武器や防具を
身に付けることが重要です</COL>

各品のパラメータをよく確認し
万全の装備で冒険に出かけましょう","You are limited in the items you can equip based on your job, level, and gender.

<COL ffdc78>It is important to equip weapons and armor that match your job and level.</COL>

Make sure to carefully check the parameters of each item and go on an adventure with the best equipment."
