"key","old","new"
"TUTORIAL_STEP_174","プリーストは、自身の周囲に展開した
ヒールオーラやセイントオーラを、
味方全員へ転送することもできます

　【<KC SKILL_NORMAL2>】フィールドシフト（味方に陣を転送）","Priests can also transfer the Heal Aura and Holy Aura that they have deployed around themselves to all allies.

【<KC SKILL_NORMAL2>】Field Shift (transfers the formation to allies)."
"TUTORIAL_STEP_326","ヒールオーラやセイントオーラなど、周囲に
展開した陣を個別に解除することができます

　【発動したスキルと同じコマンド】
　　　　　　個別の展開陣解除

また全ての展開陣を一斉に解除することもできます

　【<KC WEAPON_SUB>】＋【<KC WEAPON_MAIN>】＋【<KC JUMP>】
　　　　　　展開している陣の一斉解除","You are able to individually release the auras that have been activated, such as the Heal Aura and Holy Aura, as separate actions.

【Use the same command as the activated skill】
Release individual deployed auras

You can also simultaneously release all deployed auras.

【<KC WEAPON_SUB>】+【<KC WEAPON_MAIN>】+【<KC JUMP>】
Simultaneously release all deployed auras."
