"key","old","new"
"TUTORIAL_STEP_801","ボルトアイなどが使用する特殊な攻撃
の一つとして、接触すると対象に付着し
一定時間後にダメージを受けるなどの
デメリットを受ける攻撃があります

<COL ffdc78>このようなデメリットを受けてしまった場合
味方から攻撃を受けることで救済してもらえます</COL>","One of the special attacks used by characters like Volt Eye is an attack that attaches to the target upon contact and causes damage after a certain amount of time, resulting in disadvantages for the target. 

<COL ffdc78>If you receive such a disadvantage, you can be relieved by receiving an attack from an ally.</COL>"
"TUTORIAL_STEP_802","<COL ffdc78>救済が可能な仲間の頭上には
特殊なアイコンが表示されます</COL>

被害を最小限に抑えるために
救済行動を行いやすい立ち回りを意識しましょう","<COL ffdc78>A special icon will be displayed on the heads of teammates who can be assisted.</COL>

To minimize damage, let us be conscious of maneuvering that allows for easy assistance."
