"key","old","new"
"TUTORIAL_STEP_760","メフィスからの様々な依頼をこなしていくと
<COL ffdc78>使命の達成度</COL>が上がっていきます

達成度が最大になると、使命クリアとなります

またその過程で<COL ffdc78>新たなクエスト</COL>が
出現することもあります","By completing various requests from Mephis, the <COL ffdc78>mission completion level</COL> will increase.

When the completion level reaches its maximum, the mission is cleared.

Additionally, during this process, <COL ffdc78>new quests</COL> may appear."
"TUTORIAL_STEP_767","<COL ffdc78>《サブストーリーログ》</COL>では
現在の使命の達成状況や、クエストのログを
確認することができます","In the <COL ffdc78>""Substory Log,""</COL> you can check the current achievement status of your missions and the quest logs."
