"key","old","new"
"TUTORIAL_STEP_160","敵の攻撃や高所落下など、旅に危険はつきものです
体力の回復手段は常に用意しておきましょう

プリーストなどの回復魔法が主な回復手段に
なりますが、<COL ffdc78>回復魔法では減少した体力のうち
《治癒上限値》（白いゲージ）分までしか
回復できません</COL>

体力回復用アイテム、宿も活用し
より万全の状態に整えてください","Traveling is always dangerous, with enemy attacks, falling from heights, etc.
Always have a way to recover your health.

Priests and other recovery magic is the main means of recovery, but<COL ffdc78>recovery magic can only recover up to ""Healable Limit"" (white gauge) of the reduced health.</COL>

Please make sure you are in good shape!"
"TUTORIAL_STEP_294","また、敵の特殊攻撃や地形の影響で
<COL ffdc78>《状態異常》</COL>と呼ばれるペナルティーを
受ける場合があります

その場合も、治療魔法や異常治療効果のある
アイテム、宿を利用して状態異常の解消を
行ってください","Additionally, there may be instances where you receive penalties, known as <COL ffdc78>""debilitations""</COL>, due to special attacks from enemies or the effects of the terrain.

In such cases, please use healing magic, items with debilitation treatment effects, or stay at an inn to resolve the debilitation."
