"key","old","new"
"TUTORIAL_STEP_603","<COL ffdc78>《ダクレイム砦奪還戦》</COL>は
最大８人のパーティーを結成して
悪しき竜軍に占領された砦を
奪還するウォーミッションです

５ヶ所ある敵陣を示す旗を破壊し、そのエリアの
リーダー格を討伐して敵陣を奪還しましょう

敵陣を奪還した場所には、自軍の旗が設置されます","""<COL ffdc78>Dacreim Fortress Recapture Battle</COL>"" 
is a War Mission where you form a party of up to 8 people to recapture a fortress that has been occupied by the evil dragon army. 

Destroy the flags indicating the 5 enemy camps and defeat the leaders in those areas to recapture the enemy camp. 

Once the enemy camp is recaptured, our flag will be placed in that location."
