"key","old","new"
"TUTORIAL_STEP_737","<COL 78f5ff>パーティーメンバーの
自室へ訪問できるようになりました！</COL>

パーティーメンバーがいる状態で
白竜神殿にいる宿屋のバートンに話しかけ
<COL ffdc78>《他人の自室訪問》</COL>を選択することで訪問できます

また、<COL ffdc78>《自室訪問設定》</COL>を選択すると
自室への訪問を許可するかどうかの設定を
行うことができます","<COL 78f5ff>You can now visit Party members rooms!</COL>

While party members are present, speak to Barton at the inn in the White Dragon Temple, and select <COL ffdc78>""Visit Another's Room""</COL> to visit their rooms.

Alternatively, you can select <COL ffdc78>""My Room Visit Setup""</COL> to determine whether visits to your own room are allowed."
