"key","old","new"
"TUTORIAL_STEP_849","<COL 78f5ff>《精霊竜》《火竜》《白竜》《黄金竜》《対黒竜》</COL>
上記のドラゴンアビリティは装備強化により
<COL ffdc78>防具が★4になった際、性能が上昇します</COL>

防具に付与されているドラゴンアビリティの
ポイントが<COL ffdc78>""3以下""</COL>だった場合は
該当するドラゴンアビリティのポイントが上昇します

ドラゴンアビリティのポイントが<COL ffdc78>""4以上""</COL>の場合は
《理力》のアビリティポイントが上昇します","<COL 78f5ff>""Spirit Dragon"" ""Fire Dragon"" ""White Dragon"" ""Golden Dragon"" ""Anti-Black Dragon""</COL>
The Dragon Abilities mentioned above will have their performance enhanced when <COL 78f5ff>the armor reaches ★4 through equipment strengthening.</COL>

If the points of the Dragon Abilities attached to the armor are <COL ffdc78>""3 or less""</COL>, the corresponding Dragon Ability points will increase.

If the points of the Dragon Abilities are <COL ffdc78>""4 or above""</COL>, the Ability Points for ""Force"" will increase."
