"key","old","new"
"TUTORIAL_STEP_377","《ウォーミッション》は各コンテンツの
累計取得DPによる<COL ffdc78>ランキング</COL>に対応しています。
参加するとリザルト時に得られる<COL ffdc78>《スコア》</COL>によって
他の覚者と順位を競うことができます

１度でもスコアが獲得できていれば、
本作戦期間中の中間集計時と、戦果分析期間後に
<COL ffdc78>神殿の《ランキングボード》と
《レスタニアニュース》にその名が記され、
自身の順位を確認できます</COL>","""War Missions"" supports a <COL ffdc78>ranking</COL> based on the cumulative DP acquired in each content. 

By participating, you can compete with other Arisen for rankings based on the <COL ffdc78>""Score""</COL> obtained during the result announcement. 

If you have acquired a score even once, your name will be listed on the <COL ffdc78>Temple's ""Ranking Board"" and in the Lestania News</COL> during the tally in the mission period and after the battle analysis period. Look there to check your ranking."
"TUTORIAL_STEP_378","戦果分析期間後に発表されるランキングで
見事上位ランクインを果たした覚者には
<COL ffdc78>特別なアイテム</COL>がDPショップで
購入できるようになります。

ウォーミッションは、本作戦期間中なら
何度でも挑むことができますので
より効率的な攻略や、大物の討伐を狙って
上位ランクインを目指しましょう","After the battle analysis period, the accomplished Arisen who have achieved a remarkable rank will be able to purchase a <COL ffdc78>special item</COL> at the DP Shop.

You can challenge War Missions as many times as you want during this operation period, so aim for a higher rank to efficiently conquer and subdue formidable enemies."
