"key","old","new"
"TUTORIAL_STEP_820","<COL 78f5ff>《ハイオーブショップ》が追加されました！</COL>

ハイオーブと引き換えに、強力なクレストや
ユニークな見た目の装備品を作るための
クラフト用素材などが得られます","<COL 78f5ff>《High Orb Shop》 has been added!</COL>

By exchanging High Orbs, you can obtain crafting materials for creating powerful crests and unique-looking equipment."
"TUTORIAL_STEP_865","ハイオーブショップで交換できる
<COL 78f5ff>《<ITEM 24821>》</COL>を利用するクラフトレシピは
様々なアチーブメントを取得することで解放されます

<COL ffdc78>黒呪の迷宮、ウォーミッション、大竜晶破壊戦など
コンテンツを複数回クリアすることで
アチーブメントは取得できます</COL>

まだ見ぬ装備を目指して、様々なコンテンツを攻略しましょう","You can exchange <COL 78f5ff>《<ITEM 24821>》</COL> at the High Orb Shop. Crafting recipes using it will be unlocked by obtaining various achievements.

<COL ffdc78>You can obtain achievements by clearing various contents such as Bitterblack Maze, War Missions, and Great Dragon Crystal Destruction Battle multiple times.</COL>

Let's conquer various contents to aim for equipment that has yet to be seen."
