"key","old","new"
"HISTORY_STEP_98","　セシリーの容態は一進一退ということだろうか。こ
のような事態に陥った顛末を記しておく

　ロイグの赤色病は快癒したが、旧知との対話も、セ
シリーの記憶を呼び戻すことはなかった。しかし、ロ
イグは、侵食魔の島に関する新たな情報をもたらした

　記憶が戻らず焦るセシリーは、わたしの反対意見を
退け覚者たちとともに島に渡った

　島はセシリーをつけ狙う黒騎士の本拠地だ、そこへ
乗り込もうなどとは、罠に飛び込むゴブリンのような
もの

　案の定、黒騎士が現れ、セシリーは生死の境を彷徨
うことになった

　セシリーの回復を祈る気持ちに偽りはないが、もっ
と強く引き止めるべきだったという思いと、これで黒
騎士は目的を果たしたのではないかという、淡い期待
の両方が我が胸中にある","I wonder if Cecily's condition is in a state of fluctuation. I will record the details of the situation she has fallen into.

Loeg's Red Blight has been cured, but it did not bring back Cecily's memories of her past acquaintances. However, Loeg brought new information regarding the Island of the Corruption.

Unable to regain her memories and feeling anxious, Cecily disregarded my objections and went to the island with the Arisen.

The island is the base of the Black Knight who is targeting Cecily. It is like jumpin straight into a trap, like a goblin.

As expected, the Black Knight appeared, and Cecily found herself on the verge of life and death.

I truly pray for Cecily's recovery, but I have both the feeling that I should have held her back more strongly and the faint hope that the Black Knight has achieved its objective within me."
