"key","old","new"
"HISTORY_STEP_107","　意識を取り戻したガラダが語ったところによると、
原始の雫を奪ったのは、あのロイグと、ロイグが使役
する魔物だったとのこと

　行動を予想し、その結果、目的地で再会できたもの
の、半ば覚悟していたとおり話し合いで解決というわ
けにはいかず、戦闘と相成った

　自分の親の病気と、死を見て見ぬふりでやり過ごし
たフィンダムの風潮と、人々を恨んだロイグのその憎
しみを黒騎士に利用されたというのがおおよその経緯
らしい

　ともあれ、原始の雫はセシリーたちの手に戻った。
事変の終結まであと少し――そろそろ期待してもいい
だろう","According to Gearóid, who regained consciousness, it was Loeg and the enemies he commanded who stole the Primeval Drops. Despite predicting their actions and hoping for a peaceful resolution upon reaching their destination, it ended up escalating into a battle.

The approximate background was that Loegs's resentment towards the people of Phindym, who ignored his parent's illness and death, was exploited by the Black Knight. In any case, the Primeval Drops have been returned to Cecily and her companions.

With just a little more time until the end of the incident, it may be safe to start hoping."
