"old","new"
"レスタニア西部の海岸地帯
白い砂浜が続く景色は美しいが、時には思いも
よらぬものが浜辺に流れ着くことも。温暖で湿った
気候から、乾燥しがちのハイデル平原とは植生や
生息する魔物も異なる","A coastal zone in western Lestania.
The view of the white sandy beach is beautiful.
With its dry climate, the fauna and flora living
in the Hidell Plains is different."
"ブリア海岸地域の漁村
比較的おだやかな環境に恵まれ、海が近く人々も
おおらか。しかし、海が村にもたらすものは魚や貝
だけではない。座礁船や、時には海竜といった脅威
が姿を現すこともある","Breya Coast region's fishing village.
It is blessed with a relatively calm environment and a close proximity to the sea, making the people easy-going. 
However, what the sea brings to the village is not just fish and shellfish.
There are also threats such as stranded ships and sometimes even sea dragons that appear."
"ブリア海岸の岬に立つ古い灯台
洋撃船や漁船の標として、レスタニアの海を
照らし続けてきた。灯台守は代々、退役騎士が
務める習わしとなっており、現在の守番は高名な
《シールドセージ》、ルドルフォである","The old lighthouse on the cape of Breya Coast.
Shining over the sea of Lestania as a beacon for foreign ships and fishing boats. It is a tradition for retired knights to serve as lighthouse keepers, and the current guardian is the renowned Shield Sage, Rudolfo."
"ブリア海岸のはずれ、断崖の中腹に入り口を
もつ自然洞窟。絶えず水音が聞こえることから
潮騒洞窟と呼ばれ、奥の滝は霊験あらたかとの
噂だが、ある事件をきっかけに封鎖されていた","Natural Cave on the edge of Breya coast.
Along a cliff's midsection, lies an entrance to a natural cave. It is known as the Roaring Tide Cave due to the constant sound of water. There are rumors that the waterfall deep inside possesses supernatural power. However, following an incident, it has been sealed off."
"<COL ffdc78>【竜力】の扉あり</COL>
ブリア海岸傍の灯台下の井戸の中に入口が発見された
忘れられた古代の水路遺跡。長く閉鎖され未踏の地
であったため、独自の生態系を保持した環境と
なっているようだ","<COL ffdc78>【Dragon Force】Door</COL>
An entrance has been discovered within a well beneath the lighthouse near the Breya Coast. It is a forgotten ancient aqueduct relic that has long been closed off and unexplored. It appears to have maintained its own unique ecosystem."
