"old","new"
"レスタニア最北の《禁じられた地》
かつて黄金都市と謳われたメルゴダは大地ごと
消失しており、深く抉れた大穴だけがその痕跡を
示している。錬金技術で造られた歪な半生物は
大地に残され、今なお徘徊し続けているという","North of Lestania lies the Forbidden Land, known as Mergoda, which was once hailed as the Golden City.
However, it has completely disappeared, leaving only a deep, gouged hole as its trace. 
Twisted, semi-living creatures created through alchemy remain on the land, still wandering to this day."
"ザンドラ禁域北端、地上に残った外周部
メルゴダ入り口にあたる区画であり、政治と深く
関わる錬金術研究の中心地であった。そのため
最も警戒すべき場所として、神殿により禁域と
して秘匿されてきた","Located at the northern border of Zandora Wastelands, this is the section that corresponds to the entrance of Mergoda. 
It was the hub of alchemized research closely intertwined with politics. 
As a result, it has been concealed as a forbidden area by the temple, making it the most guarded of places."
"ザンドラ禁域を東西に結ぶ大地下水路
セラー湖の水をメルゴダへ送るため整備された
水路であったが、現在は恐ろしい魔物の潜む
大迷路と化している","The Underground Waterway that connects the Zandora Wastelands from east to west.
Was originally constructed to transport water from Lake Cera to Mergoda. 
However, it has now transformed into a terrifying labyrinth infested with dangerous enemies."
"旧時代、各地に祭られた白竜の祭壇
白竜神殿に人が集ったことで祠の多くは廃墟化
しているが、中には管理され本来とは異なる用途で
機能しているものもある","In the olden days, altars dedicated to the White Dragon were celebrated all over the land. 
Due to people gathering at the White Dragon Temple, many shrines have fallen into ruins. 
However, there are some that are still maintained and used for purposes different from their original intention."
"<COL ffdc78>【財宝】の扉あり</COL>
《南ザンドラ遺跡群》の一角にある旧時代の井戸
これまではその存在すら忘れられていたが
恐ろしい咆哮が奥から遺跡群一帯に響くようになった","<COL ffdc78>【Treasure】Door</COL>
An ancient well in a corner of the ""South Zandora Ruins"".
Its existence had been forgotten until now, but a terrifying roar began to echo throughout the entire ruins."
