0,,"どんな感じなんだ？
原因らしきものは見つかったかな？",,ui\00_message\quest\q20000000.gmd,\quest\q20000000.arc,q20000000.arc,23,Gordon
0,,"わたしは旅の行商人でね――
ごらんの通りの男前で
ご婦人に大人気",,ui\00_message\quest\q20000001.gmd,\quest\q20000001.arc,q20000001.arc,0,Peddler
0,,"連日売り上げ記録を更新中だが
慢性的な商品不足が悩ましい",,ui\00_message\quest\q20000001.gmd,\quest\q20000001.arc,q20000001.arc,1,Peddler
0,,"そこであんたに頼みたい
まあ、仕入れ代行みたいなものだ",,ui\00_message\quest\q20000001.gmd,\quest\q20000001.arc,q20000001.arc,2,Peddler
0,,考えてくれないだろうか,,ui\00_message\quest\q20000001.gmd,\quest\q20000001.arc,q20000001.arc,3,Peddler
0,,"わたしは旅の行商人でね――
ごらんの通りの男前で
ご婦人に大人気",,ui\00_message\quest\q20000001.gmd,\quest\q20000001.arc,q20000001.arc,4,Peddler
0,,"連日売り上げ記録を更新中だが
慢性的な商品不足が悩ましい",,ui\00_message\quest\q20000001.gmd,\quest\q20000001.arc,q20000001.arc,5,Peddler
0,,"そこであんたに頼みたい
まあ、仕入れ代行みたいなものだ",,ui\00_message\quest\q20000001.gmd,\quest\q20000001.arc,q20000001.arc,6,Peddler
0,,"ちょっと面倒かもしれないが
考えてくれないだろうか",,ui\00_message\quest\q20000001.gmd,\quest\q20000001.arc,q20000001.arc,7,Peddler
0,,"わたしは旅の行商人でね――
ごらんの通りの男前で
ご婦人に大人気",,ui\00_message\quest\q20000001.gmd,\quest\q20000001.arc,q20000001.arc,8,Peddler
0,,"連日売り上げ記録を更新中だが
慢性的な商品不足が悩ましい",,ui\00_message\quest\q20000001.gmd,\quest\q20000001.arc,q20000001.arc,9,Peddler
0,,"そこであんたに頼みたい
まあ、仕入れ代行みたいなものだ",,ui\00_message\quest\q20000001.gmd,\quest\q20000001.arc,q20000001.arc,10,Peddler
0,,"そう簡単に手に入るものでもないが――
考えてくれないだろうか",,ui\00_message\quest\q20000001.gmd,\quest\q20000001.arc,q20000001.arc,11,Peddler
0,,"おお、ありがとう！
これで商売が続けられるよ",,ui\00_message\quest\q20000001.gmd,\quest\q20000001.arc,q20000001.arc,12,Peddler
0,,"なかなか大変だっただろう？
おかげで商売が続けられるよ
ありがとう――感謝するよ",,ui\00_message\quest\q20000001.gmd,\quest\q20000001.arc,q20000001.arc,13,Peddler
0,,"これを手に入れるには
かなり骨が折れたんじゃないか？",,ui\00_message\quest\q20000001.gmd,\quest\q20000001.arc,q20000001.arc,14,Peddler
0,,"おかげで商売が続けられるよ
ありがとう――感謝するよ",,ui\00_message\quest\q20000001.gmd,\quest\q20000001.arc,q20000001.arc,15,Peddler
0,,"できれば急いで欲しいんだ
商機を逃したくはないからね",,ui\00_message\quest\q20000001.gmd,\quest\q20000001.arc,q20000001.arc,16,Peddler
0,,"参った――いやぁ、参った
神殿に運ぶはずの装備品を
落としてしまったようだ",,ui\00_message\quest\q20000002.gmd,\quest\q20000002.arc,q20000002.arc,0,White Knight
0,,"魔物どもに襲われて我が身を守るのが
精一杯――とても荷物なんて
かまっていられなかった――",,ui\00_message\quest\q20000002.gmd,\quest\q20000002.arc,q20000002.arc,1,White Knight
0,,"なんてことがバレたら俺のメンツは
丸つぶれだ",,ui\00_message\quest\q20000002.gmd,\quest\q20000002.arc,q20000002.arc,2,White Knight
0,,どうだろう――手伝ってくれないか？,,ui\00_message\quest\q20000002.gmd,\quest\q20000002.arc,q20000002.arc,3,White Knight
0,,"参った――いやぁ、参った
神殿に運ぶはずの装備品を
落としてしまったようだ",,ui\00_message\quest\q20000002.gmd,\quest\q20000002.arc,q20000002.arc,4,White Knight
0,,"魔物どもに襲われて我が身を守るのが
精一杯――とても荷物なんて
かまっていられなかった――",,ui\00_message\quest\q20000002.gmd,\quest\q20000002.arc,q20000002.arc,5,White Knight
0,,"なんてことがバレたら俺のメンツは
丸つぶれだ",,ui\00_message\quest\q20000002.gmd,\quest\q20000002.arc,q20000002.arc,6,White Knight
0,,"どうだろう――手伝ってくれないか？
荷物はひとつじゃないし
魔物もいるだろうが――なあ、頼む！",,ui\00_message\quest\q20000002.gmd,\quest\q20000002.arc,q20000002.arc,7,White Knight
0,,"参った――いやぁ、参った
神殿に運ぶはずの装備品を
落としてしまったようだ",,ui\00_message\quest\q20000002.gmd,\quest\q20000002.arc,q20000002.arc,8,White Knight
0,,"魔物どもに襲われて我が身を守るのが
精一杯――とても荷物なんて
かまっていられなかった――",,ui\00_message\quest\q20000002.gmd,\quest\q20000002.arc,q20000002.arc,9,White Knight
0,,"なんてことがバレたら俺のメンツは
丸つぶれだ",,ui\00_message\quest\q20000002.gmd,\quest\q20000002.arc,q20000002.arc,10,White Knight
0,,どうだろう――手伝ってくれないか？,,ui\00_message\quest\q20000002.gmd,\quest\q20000002.arc,q20000002.arc,11,White Knight
0,,"荷物はひとつじゃないし
しかも、えらい強い奴もいる",,ui\00_message\quest\q20000002.gmd,\quest\q20000002.arc,q20000002.arc,12,White Knight
0,,"加えて、あんたは俺なんかに
なんの義理もない",,ui\00_message\quest\q20000002.gmd,\quest\q20000002.arc,q20000002.arc,13,White Knight
0,,"わかってる、わかってるんだ！
でも、騎士仲間には頼めないんだ
頼む、この通りだ！",,ui\00_message\quest\q20000002.gmd,\quest\q20000002.arc,q20000002.arc,14,White Knight
0,,"あ？　装備品？
――これは違うだろ？
――あ？　コレだってのか",,ui\00_message\quest\q20000002.gmd,\quest\q20000002.arc,q20000002.arc,15,Bob
0,,"回収すんのかよ――けっ
せっかく飲み代になると思ったのによ――
ほら、持ってきな！",,ui\00_message\quest\q20000002.gmd,\quest\q20000002.arc,q20000002.arc,16,Bob
0,,"おお！　ありがたい！
これで俺の面目も保てるよ
ありがとうな！",,ui\00_message\quest\q20000002.gmd,\quest\q20000002.arc,q20000002.arc,17,White Knight
0,,"おお！　集めてくれたのか！
そう、これだ、これだよ",,ui\00_message\quest\q20000002.gmd,\quest\q20000002.arc,q20000002.arc,18,White Knight
0,,"ケガもしていないようだな――
うん、ありがとう",,ui\00_message\quest\q20000002.gmd,\quest\q20000002.arc,q20000002.arc,19,White Knight
0,,これで俺の面目も保てるよ！,,ui\00_message\quest\q20000002.gmd,\quest\q20000002.arc,q20000002.arc,20,White Knight
0,,"おお！　集めてくれたのか！
そう、これだ、これだよ",,ui\00_message\quest\q20000002.gmd,\quest\q20000002.arc,q20000002.arc,21,White Knight
0,,"頼んでおいて今さらだが
厄介な魔物もいただろう？",,ui\00_message\quest\q20000002.gmd,\quest\q20000002.arc,q20000002.arc,22,White Knight
0,,"無茶な頼みを聞いてくれて
本当に感謝しているよ",,ui\00_message\quest\q20000002.gmd,\quest\q20000002.arc,q20000002.arc,23,White Knight
0,,"これで面目も保てるしな
いや、ありがとう",,ui\00_message\quest\q20000002.gmd,\quest\q20000002.arc,q20000002.arc,24,White Knight
0,,"おお、ご苦労さん
俺はこのあたりを探してみるよ",,ui\00_message\quest\q20000002.gmd,\quest\q20000002.arc,q20000002.arc,25,White Knight
0,,"ねえ、頼まれてくれないかな
大丈夫、簡単なことだから","Hey, could you do me a favor?
Don't worry, it's easy.",ui\00_message\quest\q20000003.gmd,\quest\q20000003.arc,q20000003.arc,0,Klaus
0,,"この神殿の中でお店を続けるには
営業許可証が必要なんだ
定期的に審査があって
通れば許可証が発行される仕組み","To keep your store in this temple, you need a
business permit.
There is a periodic review process
and if you pass, a permit is issued.",ui\00_message\quest\q20000003.gmd,\quest\q20000003.arc,q20000003.arc,1,Klaus
0,,"で、審査官の報告を受けて
許可証を発行するのが僕の仕事なんだけど
配達が間に合いそうにないんだ
それで、君に許可証の配達を頼みたいってわけ","So, I get the examiner's report
and it's my job to issue the permit
but I can't seem to get it delivered in time...
So, I'm asking you to deliver the permit.",ui\00_message\quest\q20000003.gmd,\quest\q20000003.arc,q20000003.arc,2,Klaus
0,,"悪いんだけど頼まれてくれないかな
大丈夫、簡単なことだから","I'm sorry, but could you do me a favor?
Don't worry, it's easy.",ui\00_message\quest\q20000003.gmd,\quest\q20000003.arc,q20000003.arc,3,Klaus
0,,"この神殿の中でお店を続けるには
営業許可証が必要なんだ
定期的に審査があって
通れば許可証が発行される仕組み","To keep your store in this temple, you need a
business permit.
There is a periodic review process
and if you pass, a permit is issued.",ui\00_message\quest\q20000003.gmd,\quest\q20000003.arc,q20000003.arc,4,Klaus
0,,"で、審査官の報告を受けて
許可証を発行するのが僕の仕事なんだけど
配達が間に合いそうにないんだ","So, my job is to get the examiner's report and
issue the permit, but
I'm not going to be able to deliver it in time.",ui\00_message\quest\q20000003.gmd,\quest\q20000003.arc,q20000003.arc,5,Klaus
0,,"だから、君に頼みたいのは許可証の配達
ちょっと配達先が多いんだけど――","So, what I'm asking you to do is deliver the permits.
I have a little too many places to deliver to--",ui\00_message\quest\q20000003.gmd,\quest\q20000003.arc,q20000003.arc,6,Klaus
0,,"あのさ――頼みがあるんだけど――
大丈夫、簡単なことだから","You know--I need a favor--
Don't worry, it's easy.",ui\00_message\quest\q20000003.gmd,\quest\q20000003.arc,q20000003.arc,7,Klaus
0,,"この神殿の中でお店を続けるには
営業許可証が必要なんだ
定期的に審査があって
通れば許可証が発行される仕組み","To keep your store in this temple, you need a
business permit.
There is a periodic review process
and if you pass, a permit is issued.",ui\00_message\quest\q20000003.gmd,\quest\q20000003.arc,q20000003.arc,8,Klaus
0,,"で、審査官の報告を受けて
許可証を発行するのが僕の仕事なんだけど
配達が間に合いそうにないんだ
だから、君に頼みたいのは許可証の配達","So, I get the examiner's report and
it's my job to issue the permit, but
I'm not going to be able to deliver it in time.
So, what I'm asking you to do is to deliver the permit.",ui\00_message\quest\q20000003.gmd,\quest\q20000003.arc,q20000003.arc,9,Klaus
0,,"すっごく簡単なことだと思うんだけど
ええと、申し訳ない！
配達先がすっごく多いんだ","I think it's pretty simple.
Ah, sorry!
I just have so many places to deliver to.",ui\00_message\quest\q20000003.gmd,\quest\q20000003.arc,q20000003.arc,10,Klaus
0,,"はっきり言って大変だと思う
でも、君にしか頼めないんだ――この通り！","To be clear, I know it's a lot of work,
but you're the only one I can ask this way--!",ui\00_message\quest\q20000003.gmd,\quest\q20000003.arc,q20000003.arc,11,Klaus
0,,"ああ、お待ちしていましたよ
配達ご苦労さまです","Oh, we've been expecting you.
Thanks for the delivery.",ui\00_message\quest\q20000003.gmd,\quest\q20000003.arc,q20000003.arc,12,Ferguson
0,,"わあ、やっと届いたね
これがないとご婦人たちをお迎えできないからね
危ない危ない","Wow, it finally arrived.
Without this, we can't welcome the ladies.
That was close.",ui\00_message\quest\q20000003.gmd,\quest\q20000003.arc,q20000003.arc,13,Morris
0,,"まったく――クラウスさん、どうせまた本に
のめり込んで仕事を忘れたんでしょうね","Good grief—Klaus probably got lost in a book
and forgot about work again.",ui\00_message\quest\q20000003.gmd,\quest\q20000003.arc,q20000003.arc,14,Kittredge
0,,"困るんですよ
覚者さんからも、しっかりしろと言って
やって下さい","I'm at my wit's end.
Please tell me to get my act together,
even if it's just from Ser Arisen.",ui\00_message\quest\q20000003.gmd,\quest\q20000003.arc,q20000003.arc,15,Kittredge
0,,"くそ、遅いんだよ！
てめえのせいで商機を逃すとこだったじゃねえか！
礼なんか言わねえよ！　ふん！","Damn, you're late!
We almost missed a business opportunity
because of you!
I'm not thanking you! Hmph!",ui\00_message\quest\q20000003.gmd,\quest\q20000003.arc,q20000003.arc,16,Vicelot
0,,"はぁ――なかなか許可証が来ないから
今度こそダメだと思ったぞ
どうやって家族を養おうか――なんてな
まだ胃がキリキリする","Sigh—since the permit didn't come for so long,
I thought it was over this time.
How would I support my family—my goodness...
My stomach is still in knots.",ui\00_message\quest\q20000003.gmd,\quest\q20000003.arc,q20000003.arc,17,Tonio
0,,"助かったー！
なかなか届かないからこっちから取りに行こうと
思っていたところさ","Phew, saved!
Since it was taking so long to arrive,
I was thinking of going to get it myself.",ui\00_message\quest\q20000003.gmd,\quest\q20000003.arc,q20000003.arc,18,Colette
0,,"クラウスに、次からはもっと早くしろって
伝えてくれよな",Tell Klaus to be faster next time.,ui\00_message\quest\q20000003.gmd,\quest\q20000003.arc,q20000003.arc,19,Colette
0,,"えー、なにコレ？　営業許可証？
じゃあ、店主に渡しておくわ
それでいいのよね","Huh, what's this? A business permit?
I'll give it to the shopkeeper.
That's fine, right?",ui\00_message\quest\q20000003.gmd,\quest\q20000003.arc,q20000003.arc,20,Nancy
0,,"ああ、営業許可証ね
配達ご苦労さま――あれ！？
もしかして、覚者さま？","Ah, a business license.
Thanks for the delivery--oh, hey!
Are you an Arisen, by any chance?",ui\00_message\quest\q20000003.gmd,\quest\q20000003.arc,q20000003.arc,21,Cameron
0,,"覚者さまがこんなのを配達してるんですか？
うーん、さすがにもうちょっとお仕事を
選ばれた方が――","You're delivering this kind of thing, Master Arisen?
Hmm, it would be better if they chose
a more suitable job—",ui\00_message\quest\q20000003.gmd,\quest\q20000003.arc,q20000003.arc,22,Cameron
0,,"ありがとう、助かった！
そして、ごめん！
まだ配達が残っているんだ
もう少しだけ頼むよ","Thanks, that helped!
And sorry!
I still have a delivery to make.
Just a little more, please.",ui\00_message\quest\q20000003.gmd,\quest\q20000003.arc,q20000003.arc,23,Klaus
0,,"その――神殿内じゃなくて
グリッテン砦宛なんだけどさ
ごめん、この通り！","Um, it's actually addressed to
Fort Gritten, not the temple.
Sorry, here it is!",ui\00_message\quest\q20000003.gmd,\quest\q20000003.arc,q20000003.arc,24,Klaus
0,,"ありがとう
楽な仕事だっただろ？
こういうの、これからも頼ませてほしいんだ
持ちつ持たれつさ！","Thank you.
That was an easy job, right?
I want to keep relying on you for this kind of thing
in the future!
Let's help each other out!",ui\00_message\quest\q20000003.gmd,\quest\q20000003.arc,q20000003.arc,25,Klaus
0,,"お疲れさま！
ちょっと多かったよね――
本当に助かったよ","Thanks for your help!
It was a bit much--
I really appreciate the help.",ui\00_message\quest\q20000003.gmd,\quest\q20000003.arc,q20000003.arc,26,Klaus
0,,"これからは、こんなことにならないように
気をつけなくちゃ","I'll have to be careful
not to let this happen to me in the future.",ui\00_message\quest\q20000003.gmd,\quest\q20000003.arc,q20000003.arc,27,Klaus
0,,"――申し訳ない――本当に助かった
いや、助かりました
君がいてくれなかったら――そう考えたら
本当にゾッとするよ","I'm sorry—really, thank you.
No, thank you.
If you hadn't been there--
I really shudder to think of it.",ui\00_message\quest\q20000003.gmd,\quest\q20000003.arc,q20000003.arc,28,Klaus
0,,"店を開けなかった店主たちに
どんなことをされるか――
ああ、怖っ！","What might happen to the shopkeepers
who didn't open their shops—
Oh, the horror!",ui\00_message\quest\q20000003.gmd,\quest\q20000003.arc,q20000003.arc,29,Klaus
0,,"でも、そうなっても自業自得だからね
次からは気をつけるよ","But, if it happens, it's my own fault.
I'll be more careful next time.",ui\00_message\quest\q20000003.gmd,\quest\q20000003.arc,q20000003.arc,30,Klaus
0,,"あの――悪いけど急いでくれるかな？
許可証がないとみんな困るからね
うん、僕が悪い――それはわかってるよ――うん","Um—sorry, but could you hurry?
Everyone's in trouble without the permit.
Yeah, it's my fault—I know that—yeah.",ui\00_message\quest\q20000003.gmd,\quest\q20000003.arc,q20000003.arc,31,Klaus
0,,"クラウスからの使いだと？
覚者のお前が配達とは、
奴もずいぶん偉くなったものだな","Is this from Klaus?
For the Arisen like you to make deliveries,
he must have become quite important.",ui\00_message\quest\q20000003.gmd,\quest\q20000003.arc,q20000003.arc,32,Talcott
0,,"ともかく許可証は受け取った
わざわざすまないな","Anyway, I've received the permit. 
No need to apologize.",ui\00_message\quest\q20000003.gmd,\quest\q20000003.arc,q20000003.arc,33,Talcott
0,,"ふむ――今日はおまえに頼もう
すでに聞き及んでいるかもしれないが
覚者には重要な仕事がある",,ui\00_message\quest\q20000004.gmd,\quest\q20000004.arc,q20000004.arc,0,Joseph
0,,"各地から届く嘆願に応えて現地へ赴き
問題を処理する仕事だ",,ui\00_message\quest\q20000004.gmd,\quest\q20000004.arc,q20000004.arc,1,Joseph