0,,"ちょっとばかりマズい状況になってきてな
“侵食”の進行スピードがこちらの予想を
上回っているようだ――",,ui\00_message\npc\base\n0549.gmd,\npc\n0549.arc,n0549.arc,47
0,,"《翼風高原》に
侵食ゴアサイクロプスが現れたんだが
こいつがまた派手に侵食が進んだ個体だ",,ui\00_message\npc\base\n0549.gmd,\npc\n0549.arc,n0549.arc,48
0,,"“侵食核”って呼び名らしいが、とにかく頭に
イバラみたいなものを２本も生やしてやがる
あれは体に回りきった毒が
行き場を失って噴きだしたような状態だ",,ui\00_message\npc\base\n0549.gmd,\npc\n0549.arc,n0549.arc,49
0,,"侵食が進んだ魔物は凶暴性が増すのは
前に説明した通りだが
あそこまで侵食が進んでしまうと
もう別種の魔物と考えた方がいいだろうな――",,ui\00_message\npc\base\n0549.gmd,\npc\n0549.arc,n0549.arc,50
0,,"ともかく、あれは並の隊士に任せるわけにはいかない
かと言って、調査の妨げになる恐れから
放置するのも気がかりだ",,ui\00_message\npc\base\n0549.gmd,\npc\n0549.arc,n0549.arc,51
0,,"頼めるのであれば、お前に討伐を
任せたいんだが――
引き受けてくれるのであれば
あらためて詳細を説明しよう",,ui\00_message\npc\base\n0549.gmd,\npc\n0549.arc,n0549.arc,52
0,,"お前の隊の目覚ましい働きには
まったく舌を巻くばかりだ！
さすがはレオの後任と期待されるだけあるな！",,ui\00_message\npc\base\n0549.gmd,\npc\n0549.arc,n0549.arc,53
0,,"本当はもっときちんと報いてやりたいものだが
この島では手に入るものに限りがあるからな――
その中でも一際良い物が
お前の隊に回るよう手配しよう",,ui\00_message\npc\base\n0549.gmd,\npc\n0549.arc,n0549.arc,54
0,,"これからもその調子で調査を進めてくれ
頼りにしているぞ！",,ui\00_message\npc\base\n0549.gmd,\npc\n0549.arc,n0549.arc,55
0,,"橋を渡ったところに大きな坑道跡があるのは
もう知っているか？",,ui\00_message\npc\base\n0549.gmd,\npc\n0549.arc,n0549.arc,56
0,,"古い坑道は崩落が怖いからな
安全確保のために今まで封鎖していたが
地盤もそう脆くはないようだから
封鎖を解くことにした",,ui\00_message\npc\base\n0549.gmd,\npc\n0549.arc,n0549.arc,57
0,,"お前には一足先に教えておこう
前人未踏の場所を探索してみたければ
今が絶好の機会だぞ！",,ui\00_message\npc\base\n0549.gmd,\npc\n0549.arc,n0549.arc,58
0,,"西の方に水量の多い洞窟があってな
恐らくあそこが辺り一帯の
水源になってるんだろう",,ui\00_message\npc\base\n0549.gmd,\npc\n0549.arc,n0549.arc,59
0,,"中に入ると四方八方から滝の音が聞こえて
方向感覚を失いそうになるくらいだ
調査隊では《滝鳴洞穴》と呼んでいる",,ui\00_message\npc\base\n0549.gmd,\npc\n0549.arc,n0549.arc,60
0,,"この島は全体的に水が豊富な印象だが
《滝鳴洞穴》は別格だぞ",,ui\00_message\npc\base\n0549.gmd,\npc\n0549.arc,n0549.arc,61
0,,"暗い洞窟内で流される危険性や
滝の存在を考慮して封鎖していたが、
お前にはそんな心配は要らんな",,ui\00_message\npc\base\n0549.gmd,\npc\n0549.arc,n0549.arc,62
0,,"封鎖を解いておこう
一度行ってみてくれ",,ui\00_message\npc\base\n0549.gmd,\npc\n0549.arc,n0549.arc,63
0,,"ふむ――
最近は侵食のペースが以前にも増して
早まっているように思わないか？",,ui\00_message\npc\base\n0549.gmd,\npc\n0549.arc,n0549.arc,64
0,,"この間、《菌糸の襲窟》と呼んでいる洞窟の
初期調査が終わったんだが
内部もかなり侵食が進んでいて
そこらへん菌胞だらけになってやがってな",,ui\00_message\npc\base\n0549.gmd,\npc\n0549.arc,n0549.arc,65
0,,"斥候に行った隊士も
あらかじめ抗侵薬を飲んでから向かったそうだ",,ui\00_message\npc\base\n0549.gmd,\npc\n0549.arc,n0549.arc,66
0,,"実際はそこまでするほどではないんだが
気持ちはわからんでもない有様だ――",,ui\00_message\npc\base\n0549.gmd,\npc\n0549.arc,n0549.arc,67
0,,"当然、侵食魔もウヨウヨしている
お前も《菌糸の襲窟》に向かう時は
抗侵薬を忘れずに持っていくようにな",,ui\00_message\npc\base\n0549.gmd,\npc\n0549.arc,n0549.arc,68
0,,"ううむ――
いや、少しばかり悩ましい事態になってな",,ui\00_message\npc\base\n0549.gmd,\npc\n0549.arc,n0549.arc,69
0,,"《菌糸の襲窟》の奥に、侵食ベヘモットが
潜んでいることがわかったんだが
こいつが厄介で――
すでに３人の隊士が負傷して帰ったほどだ",,ui\00_message\npc\base\n0549.gmd,\npc\n0549.arc,n0549.arc,70
0,,"本来であれば俺が向かいたいところだが
ストックしてある医療物資が
底を尽きかけていることもあって、
物資の確保が何よりの急務になってしまった",,ui\00_message\npc\base\n0549.gmd,\npc\n0549.arc,n0549.arc,71
0,,"医療物資の確保も無しに
隊士を討伐に送り出したり、
まして一人討伐に飛び出したとなっては
間違いなくクラリッサに文句を言われるからな――",,ui\00_message\npc\base\n0549.gmd,\npc\n0549.arc,n0549.arc,72
0,,"そうだ
お前、クラリッサに内緒で
あの侵食ベヘモットを
討伐してきてくれないか？",,ui\00_message\npc\base\n0549.gmd,\npc\n0549.arc,n0549.arc,73
0,,"今までも大型の侵食魔を何体も
相手にしてきたお前なら、きっと倒せるはずだ！
こんな大物とやり合う機会もそう無いぞ！
どうだ？　気になったらあらためて声をかけてくれ",,ui\00_message\npc\base\n0549.gmd,\npc\n0549.arc,n0549.arc,74
0,,"良いニュースがあるぞ！
調査が進んだことで
レスタニアからの物資を運ぶルートの整備も
ずいぶんと捗ってな！",,ui\00_message\npc\base\n0549.gmd,\npc\n0549.arc,n0549.arc,75
0,,"今後はより良い支援物資が安定して
送られてくるそうだ
これで、お前の隊も少しは楽になるだろう",,ui\00_message\npc\base\n0549.gmd,\npc\n0549.arc,n0549.arc,76
0,,"それにしても、お前がいなければ
今頃この島の調査もここまでは進んで
いなかっただろう！",,ui\00_message\npc\base\n0549.gmd,\npc\n0549.arc,n0549.arc,77
0,,"魔赤島調査にかける熱意、そして実力――
どれをとっても抜きんでた働きだ！
今後も期待しているぞ！",,ui\00_message\npc\base\n0549.gmd,\npc\n0549.arc,n0549.arc,78
0,,"俺のところに来るとはな――
話を聞こうじゃないか",,ui\00_message\npc\base\n0550.gmd,\npc\n0550.arc,n0550.arc,0
0,,"自分が無知であることを知るのは難しいことだ
「己の無知を知っている」と思うこと自体が
そうでないことの証明かも知れないだろう",,ui\00_message\npc\base\n0550.gmd,\npc\n0550.arc,n0550.arc,1
0,,"世界は一つではない――
こう聞いた時、お前は何を思う？",,ui\00_message\npc\base\n0550.gmd,\npc\n0550.arc,n0550.arc,2
0,,"自分の知らない国があるかも知れないと思うか？
それとも人々の相互理解の難しさを考えるか？
あるいは自分には見えない何かの存在を信じるか？",,ui\00_message\npc\base\n0550.gmd,\npc\n0550.arc,n0550.arc,3
0,,"お前の見ている世界と
俺の見ている世界は違うかもしれないぜ",,ui\00_message\npc\base\n0550.gmd,\npc\n0550.arc,n0550.arc,4
0,,"それを見ている人間が違うんだから
目に映る世界自体が違うと言えなくもないだろう",,ui\00_message\npc\base\n0550.gmd,\npc\n0550.arc,n0550.arc,5
0,,"お前はもっとたくさんのことを
知るようになるだろう――",,ui\00_message\npc\base\n0550.gmd,\npc\n0550.arc,n0550.arc,6
0,,"知識が増える、といったことじゃない
お前の目はたくさんの世界を見ることになる――
そう、何かを追い求める限りな",,ui\00_message\npc\base\n0550.gmd,\npc\n0550.arc,n0550.arc,7
0,,"お前の身体はひとつだ――
いかな勇者とてそれは変わらない",,ui\00_message\npc\base\n0550.gmd,\npc\n0550.arc,n0550.arc,8
0,,"まずは、挑むべき試練に集中するべきだ
慌てる事はない",,ui\00_message\npc\base\n0550.gmd,\npc\n0550.arc,n0550.arc,9
0,,これはこれは、レスタニアの覚者様,,ui\00_message\npc\base\n0554.gmd,\npc\n0554.arc,n0554.arc,0
0,,"レスタニアの方の目には
フィンダムはどのように映るのですか？",,ui\00_message\npc\base\n0554.gmd,\npc\n0554.arc,n0554.arc,1
0,,"私はフィンダムが気に入っていますよ
いえ、他の地に赴いたことはありませんが――",,ui\00_message\npc\base\n0554.gmd,\npc\n0554.arc,n0554.arc,2
0,,"ここを離れることはおろか
フィンダム以外の地があることすら知りませんでした
私にとっての唯一の場所なのです",,ui\00_message\npc\base\n0554.gmd,\npc\n0554.arc,n0554.arc,3
0,,"視線が気になりますか？
何せ我々はレスタニアの人々を初めて見るもので――",,ui\00_message\npc\base\n0554.gmd,\npc\n0554.arc,n0554.arc,4
0,,ん？　何か用かな？,,ui\00_message\npc\base\n0555.gmd,\npc\n0555.arc,n0555.arc,0
0,,"レスタニア――
不思議な響きだな
新鮮な感じがするよ",,ui\00_message\npc\base\n0555.gmd,\npc\n0555.arc,n0555.arc,1
0,,"僕は旅好きでね
親には良い顔をされなかったけど
しばらくダナを離れて色んなところを回ったんだ",,ui\00_message\npc\base\n0555.gmd,\npc\n0555.arc,n0555.arc,2
0,,"いつかレスタニアにも行ってみたいものだな
自分の知らない場所があると思うと
それだけでワクワクしてくるよ",,ui\00_message\npc\base\n0555.gmd,\npc\n0555.arc,n0555.arc,3
0,,"いつか、レスタニアの話を
ゆっくり聞かせてくれ
君らの手が空いた時でいい",,ui\00_message\npc\base\n0555.gmd,\npc\n0555.arc,n0555.arc,4
0,,あっ、レスタニアの覚者さん！,,ui\00_message\npc\base\n0556.gmd,\npc\n0556.arc,n0556.arc,0
0,,"ボク、鳥を飼ってたんだ
でも連れてこられなくて――
元気にしてるかなぁ――",,ui\00_message\npc\base\n0556.gmd,\npc\n0556.arc,n0556.arc,1
0,,"ボクもおばあちゃんも、別の村に住んでたんだ
侵食のせいで住めなくなっちゃって――
それでここに逃げてきたんだよ",,ui\00_message\npc\base\n0556.gmd,\npc\n0556.arc,n0556.arc,2
0,,"おばあちゃんはいつか帰れるっていうけど
ホントかな――",,ui\00_message\npc\base\n0556.gmd,\npc\n0556.arc,n0556.arc,3
0,,"角が珍しい？
触ってもいいよ",,ui\00_message\npc\base\n0556.gmd,\npc\n0556.arc,n0556.arc,4
0,,"――レスタニアの人って
角が無くて困らないの？
何かスカスカした感じ、しない？",,ui\00_message\npc\base\n0556.gmd,\npc\n0556.arc,n0556.arc,5
0,,"最近は変なことばかり――
これから一体どうなるんだろうね――",,ui\00_message\npc\base\n0557.gmd,\npc\n0557.arc,n0557.arc,0
0,,"おぞましい魔物が現れたり、
異世界の覚者が来たり――
一体どうなっているのやら",,ui\00_message\npc\base\n0557.gmd,\npc\n0557.arc,n0557.arc,1
0,,"いえ、あなた方を悪く言うつもりはなくてね
ただ、心配なだけで――",,ui\00_message\npc\base\n0557.gmd,\npc\n0557.arc,n0557.arc,2
0,,"私はね、私の家族を守りたいんだよ
孫を守るためならなんだってするし
孫を連れてどこまでも逃げるよ",,ui\00_message\npc\base\n0557.gmd,\npc\n0557.arc,n0557.arc,3
0,,"心配性かも知れないけど、
何よりも孫が大切なんだ――
誰にだってそういうもの、あるだろ？",,ui\00_message\npc\base\n0557.gmd,\npc\n0557.arc,n0557.arc,4
0,,"大切なものを守りたいっていう気持ちは
誰にだってあるものさ
失ってしまったら自分がどうなるかわからない
そんな大切なものが――",,ui\00_message\npc\base\n0557.gmd,\npc\n0557.arc,n0557.arc,5
0,,"あら、レスタニアの方
河を渡りたいのかしら？",,ui\00_message\npc\base\n0558.gmd,\npc\n0558.arc,n0558.arc,0
0,,"トレアサにはもうお会いになった？
彼女、少し人見知りなんだけど
本当はとっても良い人なのよ
真面目で、温厚で、仕事熱心で――",,ui\00_message\npc\base\n0558.gmd,\npc\n0558.arc,n0558.arc,1
0,,"ここ、エラン水林は
綺麗なところでしょう？
空気も清浄で――",,ui\00_message\npc\base\n0558.gmd,\npc\n0558.arc,n0558.arc,2
0,,"やっぱり水が多いからなのかしら？
ね、船の上で深呼吸してみて
きっと気持ちがいいわ",,ui\00_message\npc\base\n0558.gmd,\npc\n0558.arc,n0558.arc,3
0,,"はぁ、何だかお腹減ってきちゃった――
結構力仕事なのよねぇ",,ui\00_message\npc\base\n0558.gmd,\npc\n0558.arc,n0558.arc,4
0,,何か御用？,何か御用？,ui\00_message\npc\base\n0559.gmd,\npc\n0559.arc,n0559.arc,0
0,,"ミューセルお姉様は、その、ちょっと――
考え事や調べ物に熱中されがちだから
わたしができることはお手伝いしてるの","ミューセルお姉様は、その、ちょっと――
考え事や調べ物に熱中されがちだから
わたしができることはお手伝いしてるの",ui\00_message\npc\base\n0559.gmd,\npc\n0559.arc,n0559.arc,1
0,,"あまりミューセルお姉様の手を
煩わせることはしないでね","あまりミューセルお姉様の手を
煩わせることはしないでね",ui\00_message\npc\base\n0559.gmd,\npc\n0559.arc,n0559.arc,2
0,,"わたしがミューセルお姉様の弟子なのかって？
違うわ
――そうなれたらいいんだけど","わたしがミューセルお姉様の弟子なのかって？
違うわ
――そうなれたらいいんだけど",ui\00_message\npc\base\n0559.gmd,\npc\n0559.arc,n0559.arc,3
0,,"狭いところだけど、旅人さん用の寝床もあるの
お代として<VAL PRICE_INN>もらうけど
いいかしら？","狭いところだけど、旅人さん用の寝床もあるの
お代として<VAL PRICE_INN>もらうけど
いいかしら？",ui\00_message\npc\base\n0559.gmd,\npc\n0559.arc,n0559.arc,4
0,,はい,Yes,ui\00_message\npc\base\n0559.gmd,\npc\n0559.arc,n0559.arc,5
0,,いいえ,No,ui\00_message\npc\base\n0559.gmd,\npc\n0559.arc,n0559.arc,6
0,,"旅人さん用の寝床も
毎日ちゃんと整えてるのよ
泊まっていくの？","旅人さん用の寝床も
毎日ちゃんと整えてるのよ
泊まっていくの？",ui\00_message\npc\base\n0559.gmd,\npc\n0559.arc,n0559.arc,7
0,,はい,Yes,ui\00_message\npc\base\n0559.gmd,\npc\n0559.arc,n0559.arc,8
0,,いいえ,No,ui\00_message\npc\base\n0559.gmd,\npc\n0559.arc,n0559.arc,9
0,,"《弱化の治療》、ね！
ミューセルお姉様に教えてもらったから
ちゃんとできるはず――！
お代は<VAL PRICE_WEAK>よ、どうする？","《弱化の治療》、ね！
ミューセルお姉様に教えてもらったから
ちゃんとできるはず――！
お代は<VAL PRICE_WEAK>よ、どうする？",ui\00_message\npc\base\n0559.gmd,\npc\n0559.arc,n0559.arc,10
0,,はい,Yes,ui\00_message\npc\base\n0559.gmd,\npc\n0559.arc,n0559.arc,11
0,,いいえ,No,ui\00_message\npc\base\n0559.gmd,\npc\n0559.arc,n0559.arc,12
0,,"うーん？
弱化してないみたいだけど――
気分が優れないなら
少し休んでいくのはどうかしら","うーん？
弱化してないみたいだけど――
気分が優れないなら
少し休んでいくのはどうかしら",ui\00_message\npc\base\n0559.gmd,\npc\n0559.arc,n0559.arc,13
0,,"レスタニアの覚者か
どうかしたか？",,ui\00_message\npc\base\n0560.gmd,\npc\n0560.arc,n0560.arc,0
0,,"レスタニアには覚者がたくさんいるって？
――レスタニアの竜は、覚者を一人に
選びきれなかったのか？",,ui\00_message\npc\base\n0560.gmd,\npc\n0560.arc,n0560.arc,1
0,,"俺は覚者ではないが、
精霊竜とフィンダムを守るための
鍛練は欠かしたことがない",,ui\00_message\npc\base\n0560.gmd,\npc\n0560.arc,n0560.arc,2
0,,"覚者こそは竜に選ばれし者だが、
選ばれなくたって竜を敬う気持ちに
変わりはないからな",,ui\00_message\npc\base\n0560.gmd,\npc\n0560.arc,n0560.arc,3
0,,"何だ？　俺が珍しいのか？
ここではお前たちの方がよっぽど珍しいが――",,ui\00_message\npc\base\n0560.gmd,\npc\n0560.arc,n0560.arc,4
0,,よぉ！　何か用かね？,,ui\00_message\npc\base\n0561.gmd,\npc\n0561.arc,n0561.arc,0
0,,"フィンダムの飯はどうだ？
口に合うといいんだがな",,ui\00_message\npc\base\n0561.gmd,\npc\n0561.arc,n0561.arc,1
0,,腹減ったな――,,ui\00_message\npc\base\n0561.gmd,\npc\n0561.arc,n0561.arc,2
0,,"ダナ村ってところがあってな、
そこらへんで採れる野菜は味が濃くてウマイ！
なんというか、力強い味だ",,ui\00_message\npc\base\n0561.gmd,\npc\n0561.arc,n0561.arc,3
0,,"腹いっぱい食ってこそ、
この筋肉も仕事する気になってくれるってもんよ",,ui\00_message\npc\base\n0561.gmd,\npc\n0561.arc,n0561.arc,4
0,,レスタニアの覚者か――,,ui\00_message\npc\base\n0562.gmd,\npc\n0562.arc,n0562.arc,0
0,,"何か用か？
手合せしたいというなら、手加減はしない",,ui\00_message\npc\base\n0562.gmd,\npc\n0562.arc,n0562.arc,1
0,,"魔物にできた腫れ物のような、
寄生植物のような――
あの気持ちが悪いものを見たか？",,ui\00_message\npc\base\n0562.gmd,\npc\n0562.arc,n0562.arc,2
0,,"どうやら、ああなると正気を失ってしまうようだ
気を付けたいものだな",,ui\00_message\npc\base\n0562.gmd,\npc\n0562.arc,n0562.arc,3
0,,"魔物を異形化させるアレ――
実は、我々もアレを発症する可能性があるらしい
あんな惨い姿にはなりたくないな――",,ui\00_message\npc\base\n0562.gmd,\npc\n0562.arc,n0562.arc,4
0,,あら、レスタニアの方ね？,,ui\00_message\npc\base\n0563.gmd,\npc\n0563.arc,n0563.arc,0
0,,"実は、侵食魔のあの腫れ物のようなアレ――
プリーストの祈りによって治らないか
試してみたことがあるのよ",,ui\00_message\npc\base\n0563.gmd,\npc\n0563.arc,n0563.arc,1
0,,まぁ、治らなかったわね,,ui\00_message\npc\base\n0563.gmd,\npc\n0563.arc,n0563.arc,2
0,,"侵食魔にばかり目をとられがちだけど
植物や土の状態もひどいものよ",,ui\00_message\npc\base\n0563.gmd,\npc\n0563.arc,n0563.arc,3
0,,"侵食魔が噴き出しているあの“胞子”――
あまり吸い込まないようにした方がいいわ",,ui\00_message\npc\base\n0563.gmd,\npc\n0563.arc,n0563.arc,4
0,,"――レスタニアの覚者ですね
船に乗りたいのですか？",,ui\00_message\npc\base\n0564.gmd,\npc\n0564.arc,n0564.arc,0
0,,"モルは少し変わったところがあるでしょう？
人の話をあまり聞いていないように見えたり
なぜかいつもお腹を空かせていたり――",,ui\00_message\npc\base\n0564.gmd,\npc\n0564.arc,n0564.arc,1
0,,"良い子なんですけどね
あれで中々しっかりしているんですよ",,ui\00_message\npc\base\n0564.gmd,\npc\n0564.arc,n0564.arc,2
0,,"――なんですか
あまりジロジロ見ても
いいことはないですよ",,ui\00_message\npc\base\n0564.gmd,\npc\n0564.arc,n0564.arc,3
0,,"川のそばだから、この辺りはひんやりするでしょう
涼むにはぴったりなんです",,ui\00_message\npc\base\n0564.gmd,\npc\n0564.arc,n0564.arc,4
0,,"あっ、覚者さま！？
自分にご用でしょうか？",,ui\00_message\npc\base\n0565.gmd,\npc\n0565.arc,n0565.arc,0
0,,"本日はお日柄もよく――
って、何を言っているんだ、俺は",,ui\00_message\npc\base\n0565.gmd,\npc\n0565.arc,n0565.arc,1
0,,"い、いえいえ！
ちょっと緊張してしまいまして！",,ui\00_message\npc\base\n0565.gmd,\npc\n0565.arc,n0565.arc,2
0,,すみません、何をお話すれば良いのやら――,,ui\00_message\npc\base\n0565.gmd,\npc\n0565.arc,n0565.arc,3
0,,ん？　ああ、覚者さまじゃないですか,,ui\00_message\npc\base\n0566.gmd,\npc\n0566.arc,n0566.arc,0
0,,"アッカーシェランに力を貸してくださり
ありがとうございます",,ui\00_message\npc\base\n0566.gmd,\npc\n0566.arc,n0566.arc,1
0,,"この先平和になったらでいいんです
いつか、レスタニアのことを教えてください",,ui\00_message\npc\base\n0566.gmd,\npc\n0566.arc,n0566.arc,2
0,,――そろそろ動く頃でしょうか,,ui\00_message\npc\base\n0566.gmd,\npc\n0566.arc,n0566.arc,3
0,,やあ、元気かい？,,ui\00_message\npc\base\n0567.gmd,\npc\n0567.arc,n0567.arc,0
0,,"堅苦しいことは嫌いでね
なんでこの任務に呼ばれたんだろう",,ui\00_message\npc\base\n0567.gmd,\npc\n0567.arc,n0567.arc,1
0,,そろそろ一息つきたいもんだ,,ui\00_message\npc\base\n0567.gmd,\npc\n0567.arc,n0567.arc,2
0,,"覚者さんも疲れたら
ちょっと休みなよ",,ui\00_message\npc\base\n0567.gmd,\npc\n0567.arc,n0567.arc,3
0,,よう、どうした？,,ui\00_message\npc\base\n0576.gmd,\npc\n0576.arc,n0576.arc,0
0,,"自分から盗賊に話しかけて
アンタにマズいことは無いのか？",,ui\00_message\npc\base\n0576.gmd,\npc\n0576.arc,n0576.arc,1
0,,"覚者サマってのは
意外と気取らないもんなんだな",,ui\00_message\npc\base\n0576.gmd,\npc\n0576.arc,n0576.arc,2
0,,"さすがにこの状況だ
アッカーシェランが無くなっちゃ
困るからな",,ui\00_message\npc\base\n0576.gmd,\npc\n0576.arc,n0576.arc,3
0,,悪くいいたくはないが――,,ui\00_message\npc\base\n0576.gmd,\npc\n0576.arc,n0576.arc,4
0,,"王子は結局のところ
甘やかされて育ったお坊ちゃま――
そんなところかね",,ui\00_message\npc\base\n0576.gmd,\npc\n0576.arc,n0576.arc,5
0,,"今まで多くの者たちがその行方を追っていたが
――サマラの指輪はおまえを選んだ",,ui\00_message\npc\base\n0576.gmd,\npc\n0576.arc,n0576.arc,6
0,,"俺たちがおまえに協力することになったのも
何かの力が働いてのことかもしれんな",,ui\00_message\npc\base\n0576.gmd,\npc\n0576.arc,n0576.arc,7
0,,ああ、何かあったのか？,,ui\00_message\npc\base\n0577.gmd,\npc\n0577.arc,n0577.arc,0
0,,盗賊ってのはどこにでもいるからな,,ui\00_message\npc\base\n0577.gmd,\npc\n0577.arc,n0577.arc,1
0,,"俺はさ――別に何でもよかったんだよな
生きるために畑耕すのも
盗みに入るのもおんなじだったんだ",,ui\00_message\npc\base\n0577.gmd,\npc\n0577.arc,n0577.arc,2
0,,"アンタも覚者が嫌ンなって
行き場が無くなったら盗賊団に来なよ",,ui\00_message\npc\base\n0577.gmd,\npc\n0577.arc,n0577.arc,3
0,,ふん――,,ui\00_message\npc\base\n0578.gmd,\npc\n0578.arc,n0578.arc,0
0,,"あまり気安く話しかけるな
俺たちは盗賊だ、あんたらとは違う",,ui\00_message\npc\base\n0578.gmd,\npc\n0578.arc,n0578.arc,1
0,,どうしてこんなことになったんだかな,,ui\00_message\npc\base\n0578.gmd,\npc\n0578.arc,n0578.arc,2
0,,――楽しくお喋りしてやる気はない,,ui\00_message\npc\base\n0578.gmd,\npc\n0578.arc,n0578.arc,3
0,,"うん？
あ、俺？　俺に話しかけてんのか？",,ui\00_message\npc\base\n0579.gmd,\npc\n0579.arc,n0579.arc,0
0,,"話してやれることなんか
特に無いんだよな――",,ui\00_message\npc\base\n0579.gmd,\npc\n0579.arc,n0579.arc,1
0,,"やめろ、何かを期待して
何度も話しかけるのは",,ui\00_message\npc\base\n0579.gmd,\npc\n0579.arc,n0579.arc,2
0,,"む――
頭領に、よそものと
あんまり馴れ合うなって言われてるからよ",,ui\00_message\npc\base\n0579.gmd,\npc\n0579.arc,n0579.arc,3
0,,"いやぁ――勘弁してくれ
俺、ユーモアってやつが無くてよ
あんたを笑かしてやれたらよかったんだがなぁ",,ui\00_message\npc\base\n0579.gmd,\npc\n0579.arc,n0579.arc,4
0,,"あっ、いらっしゃい！
何か食べていってよ！",,ui\00_message\npc\base\n0580.gmd,\npc\n0580.arc,n0580.arc,0
0,,"みんなのために食料――
なんとかしないと――",,ui\00_message\npc\base\n0580.gmd,\npc\n0580.arc,n0580.arc,1
0,,なんだかおなか空いてきちゃった,,ui\00_message\npc\base\n0580.gmd,\npc\n0580.arc,n0580.arc,2
0,,"あ――
でも勢いだけの拾い食いは危険だからね～",,ui\00_message\npc\base\n0580.gmd,\npc\n0580.arc,n0580.arc,3
0,,"瓦礫だらけでホコリっぽいし
できたら空気、入れ替えたいけど――",,ui\00_message\npc\base\n0580.gmd,\npc\n0580.arc,n0580.arc,4
0,,"よく考えたらこの部屋――
窓ないよね？",,ui\00_message\npc\base\n0580.gmd,\npc\n0580.arc,n0580.arc,5
0,,"ここで一人火を眺めてると
色々と思い出しちゃうな――",,ui\00_message\npc\base\n0580.gmd,\npc\n0580.arc,n0580.arc,6
0,,"なんかさ――
火ってすごいよね",,ui\00_message\npc\base\n0580.gmd,\npc\n0580.arc,n0580.arc,7
0,,"おいしいごはん作ってくれることもあれば――
大事なもの何もかも奪ってくことだってあるし",,ui\00_message\npc\base\n0580.gmd,\npc\n0580.arc,n0580.arc,8
0,,ははは！,,ui\00_message\npc\base\n0580.gmd,\npc\n0580.arc,n0580.arc,9
0,,ちょっと！,,ui\00_message\npc\base\n0580.gmd,\npc\n0580.arc,n0580.arc,10
0,,えぇ！？,,ui\00_message\npc\base\n0580.gmd,\npc\n0580.arc,n0580.arc,11
0,,うーん,,ui\00_message\npc\base\n0580.gmd,\npc\n0580.arc,n0580.arc,12
