#Index,Key,MsgJp,MsgEn,GmdPath,ArcPath,ArcName,ReadIndex
0,,"裏を返せば、ここまで闇が濃く入り込むってのは
もしかすると、ここに空の渦と繋がる場所があるって
ことじゃないかって","裏を返せば、ここまで闇が濃く入り込むってのは
もしかすると、ここに空の渦と繋がる場所があるって
ことじゃないかって",ui\00_message\quest\q00030410.gmd,\quest\q00030410.arc,q00030410.arc,81
0,,"俺たちはここに残り、空の渦と繋がる場所が
ないかを探ります","俺たちはここに残り、空の渦と繋がる場所が
ないかを探ります",ui\00_message\quest\q00030410.gmd,\quest\q00030410.arc,q00030410.arc,82
0,,"ですが、シェドレアン大神殿をこのまま
闇に呑ませていては、周辺の被害は増すばかりです","ですが、シェドレアン大神殿をこのまま
闇に呑ませていては、周辺の被害は増すばかりです",ui\00_message\quest\q00030410.gmd,\quest\q00030410.arc,q00030410.arc,83
0,,"隊長は、急ぎレスタニアに戻り、この状況をみんなに
伝えてください","隊長は、急ぎレスタニアに戻り、この状況をみんなに
伝えてください",ui\00_message\quest\q00030410.gmd,\quest\q00030410.arc,q00030410.arc,84
0,,"ええ、フィンダムを救うには、レスタニアの支援が
必要でしょうから","ええ、フィンダムを救うには、レスタニアの支援が
必要でしょうから",ui\00_message\quest\q00030410.gmd,\quest\q00030410.arc,q00030410.arc,85
0,,"大丈夫ですって！
ここは俺たちに任せて下さい！","大丈夫ですって！
ここは俺たちに任せて下さい！",ui\00_message\quest\q00030410.gmd,\quest\q00030410.arc,q00030410.arc,86
0,,さあ、レスタニアへ行ってください,さあ、レスタニアへ行ってください,ui\00_message\quest\q00030410.gmd,\quest\q00030410.arc,q00030410.arc,87
0,,"あーあ、黒剣は破壊できたってのによ
ことはそう簡単にはいかねえらしい","あーあ、黒剣は破壊できたってのによ
ことはそう簡単にはいかねえらしい",ui\00_message\quest\q00030410.gmd,\quest\q00030410.arc,q00030410.arc,88
0,,"隊長、この神殿が完全に闇に呑まれちゃったら――
峡谷にある集落の人達が危ないかも！","隊長、この神殿が完全に闇に呑まれちゃったら――
峡谷にある集落の人達が危ないかも！",ui\00_message\quest\q00030410.gmd,\quest\q00030410.arc,q00030410.arc,89
0,,おお、全ての黒剣を破壊してくれたようだな,おお、全ての黒剣を破壊してくれたようだな,ui\00_message\quest\q00030410.gmd,\quest\q00030410.arc,q00030410.arc,90
0,,"だが、空の渦は未だ消えず、黒剣を失った今
さらに神殿を呑み込まんと近づいて
来ているようだ","だが、空の渦は未だ消えず、黒剣を失った今
さらに神殿を呑み込まんと近づいて
来ているようだ",ui\00_message\quest\q00030410.gmd,\quest\q00030410.arc,q00030410.arc,91
0,,"もはや、この闇の場所と化した神殿にこそ
空の渦を退ける方法があらんことを願うばかりだ","もはや、この闇の場所と化した神殿にこそ
空の渦を退ける方法があらんことを願うばかりだ",ui\00_message\quest\q00030410.gmd,\quest\q00030410.arc,q00030410.arc,92
0,,"今、神殿は闇の結界に覆われ、誰も中へと
入ることは出来ない","今、神殿は闇の結界に覆われ、誰も中へと
入ることは出来ない",ui\00_message\quest\q00030410.gmd,\quest\q00030410.arc,q00030410.arc,93
0,,"しかし、レスタニアの白竜なら
この闇の結界を打ち払う事ができるやも知れぬと
エリオットが教えてくれた","しかし、レスタニアの白竜なら
この闇の結界を打ち払う事ができるやも知れぬと
エリオットが教えてくれた",ui\00_message\quest\q00030410.gmd,\quest\q00030410.arc,q00030410.arc,94
0,,"どうかレスタニアへ戻り、あなたがたの白竜へ
このフィンダムに救いの手を差し伸べて頂けるよう
お願い出来ないだろうか？","どうかレスタニアへ戻り、あなたがたの白竜へ
このフィンダムに救いの手を差し伸べて頂けるよう
お願い出来ないだろうか？",ui\00_message\quest\q00030410.gmd,\quest\q00030410.arc,q00030410.arc,95
0,,レスタニアの覚者殿、よろしく頼む,レスタニアの覚者殿、よろしく頼む,ui\00_message\quest\q00030410.gmd,\quest\q00030410.arc,q00030410.arc,96
0,,精霊竜セシリーは、未だ眠りの中――,精霊竜セシリーは、未だ眠りの中――,ui\00_message\quest\q00030410.gmd,\quest\q00030410.arc,q00030410.arc,97
0,,"もはや、フィンダムの力のみで
望みを繋ぎ続けることは難しい","もはや、フィンダムの力のみで
望みを繋ぎ続けることは難しい",ui\00_message\quest\q00030410.gmd,\quest\q00030410.arc,q00030410.arc,98
0,,今しがた、フィンダムからも急使が参ってな,今しがた、フィンダムからも急使が参ってな,ui\00_message\quest\q00030410.gmd,\quest\q00030410.arc,q00030410.arc,99
0,,さあ、白竜と話すがいい,さあ、白竜と話すがいい,ui\00_message\quest\q00030410.gmd,\quest\q00030410.arc,q00030410.arc,100
0,,"うん、お帰り！　
話しは白竜様の後で、たっぷりと聞かせてもらうよ","うん、お帰り！
話しは白竜様の後で、たっぷりと聞かせてもらうよ",ui\00_message\quest\q00030410.gmd,\quest\q00030410.arc,q00030410.arc,101
0,,我が覚者よ――,我が覚者よ――,ui\00_message\quest\q00030410.gmd,\quest\q00030410.arc,q00030410.arc,102
0,,"黒竜は、もっとも抵抗の弱いフィンダムから
全てを滅ぼし、我ら理を守る竜の力を削ぐつもりだ","黒竜は、もっとも抵抗の弱いフィンダムから
全てを滅ぼし、我ら理を守る竜の力を削ぐつもりだ",ui\00_message\quest\q00030410.gmd,\quest\q00030410.arc,q00030410.arc,103
0,,"さあ、これでシェドレアンを覆う闇の結界は
打ち払われた","さあ、これでシェドレアンを覆う闇の結界は
打ち払われた",ui\00_message\quest\q00030410.gmd,\quest\q00030410.arc,q00030410.arc,104
0,,"レスタニアの人々と力を合わせ
フィンダムを――救うのだ――","レスタニアの人々と力を合わせ
フィンダムを――救うのだ――",ui\00_message\quest\q00030410.gmd,\quest\q00030410.arc,q00030410.arc,105
0,,精霊竜を闇に呑み込ませてはならない――,精霊竜を闇に呑み込ませてはならない――,ui\00_message\quest\q00030410.gmd,\quest\q00030410.arc,q00030410.arc,106
0,,"フィンダムが滅びれば――
我らは残された希望を見失うことになるだろう","フィンダムが滅びれば――
我らは残された希望を見失うことになるだろう",ui\00_message\quest\q00030410.gmd,\quest\q00030410.arc,q00030410.arc,107
0,,"君たちがフィンダムに渡ってから、ゲルト団長率いる
白衛騎士団が、レスタニアをくまなく警戒して
いたんだけれど――","君たちがフィンダムに渡ってから、ゲルト団長率いる
白衛騎士団が、レスタニアをくまなく警戒して
いたんだけれど――",ui\00_message\quest\q00030410.gmd,\quest\q00030410.arc,q00030410.arc,108
0,,"フィンダムからの火急の救援要請を受けて
団長は瞬く間にフィンダムへ渡っていったんだ","フィンダムからの火急の救援要請を受けて
団長は瞬く間にフィンダムへ渡っていったんだ",ui\00_message\quest\q00030410.gmd,\quest\q00030410.arc,q00030410.arc,109
0,,"僕もフィンダムへの同行を願い出たんだけどね
団長は、このレスタニアで、僕にしか出来ない
大事な役割が起きるかもしれないって言うんだ","僕もフィンダムへの同行を願い出たんだけどね
団長は、このレスタニアで、僕にしか出来ない
大事な役割が起きるかもしれないって言うんだ",ui\00_message\quest\q00030410.gmd,\quest\q00030410.arc,q00030410.arc,110
0,,"そりゃあ、いざとなったら神殿のみんなを上手く
まとめて避難させるつもりさ
特に最後まで残りたがる頑固な老人も含めてね","そりゃあ、いざとなったら神殿のみんなを上手く
まとめて避難させるつもりさ
特に最後まで残りたがる頑固な老人も含めてね",ui\00_message\quest\q00030410.gmd,\quest\q00030410.arc,q00030410.arc,111
0,,状況は聞いた,状況は聞いた,ui\00_message\quest\q00030410.gmd,\quest\q00030410.arc,q00030410.arc,112
0,,"もちろんレスタニアも総力を挙げて
フィンダムが闇に呑まれぬよう、手を尽くすつもりだ","もちろんレスタニアも総力を挙げて
フィンダムが闇に呑まれぬよう、手を尽くすつもりだ",ui\00_message\quest\q00030410.gmd,\quest\q00030410.arc,q00030410.arc,113
0,,すでに白衛騎士団に動いて貰っている――,すでに白衛騎士団に動いて貰っている――,ui\00_message\quest\q00030410.gmd,\quest\q00030410.arc,q00030410.arc,114
0,,"ゲルトがフィンダムの滅びの渦の情報を
まとめあげ、広場にてトラバースが
支援の指揮を執っている","ゲルトがフィンダムの滅びの渦の情報を
まとめあげ、広場にてトラバースが
支援の指揮を執っている",ui\00_message\quest\q00030410.gmd,\quest\q00030410.arc,q00030410.arc,115
0,,さあさあ、トラバースの元へ向かい詳細を聞いてくれ,さあさあ、トラバースの元へ向かい詳細を聞いてくれ,ui\00_message\quest\q00030410.gmd,\quest\q00030410.arc,q00030410.arc,116
0,,"今もレスタニアがこうしてあるのは
フィンダムの竜の支えがあったからこそ――","今もレスタニアがこうしてあるのは
フィンダムの竜の支えがあったからこそ――",ui\00_message\quest\q00030410.gmd,\quest\q00030410.arc,q00030410.arc,117
0,,"わたしは常にレスタニアと白竜を守ることを
第一としてきたが――
このような事態を前に、その信奉は少々
恥ずべきことだったようだ","わたしは常にレスタニアと白竜を守ることを
第一としてきたが――
このような事態を前に、その信奉は少々
恥ずべきことだったようだ",ui\00_message\quest\q00030410.gmd,\quest\q00030410.arc,q00030410.arc,118
0,,"ゲルト団長は、貴君が必ず来るだろうと言っていたが
その通りになったな","ゲルト団長は、貴君が必ず来るだろうと言っていたが
その通りになったな",ui\00_message\quest\q00030410.gmd,\quest\q00030410.arc,q00030410.arc,119
0,,"おっと、挨拶をしている時間も惜しい
よく聞くんだ","おっと、挨拶をしている時間も惜しい
よく聞くんだ",ui\00_message\quest\q00030410.gmd,\quest\q00030410.arc,q00030410.arc,120
0,,"フィンダムに飛んだ団長の情報によると
貴君の黒剣の破壊の後、フィンダムのあらゆる魔物が
闇の力に誘われ、シェドレアン大神殿に集結しつつ
あるそうだ","フィンダムに飛んだ団長の情報によると
貴君の黒剣の破壊の後、フィンダムのあらゆる魔物が
闇の力に誘われ、シェドレアン大神殿に集結しつつ
あるそうだ",ui\00_message\quest\q00030410.gmd,\quest\q00030410.arc,q00030410.arc,121
0,,"団長以下、白衛騎士団はフィンダムの民を
守りつつ、シェドレアンへの魔物の集結を阻むため
各地で遊撃戦を展開している","団長以下、白衛騎士団はフィンダムの民を
守りつつ、シェドレアンへの魔物の集結を阻むため
各地で遊撃戦を展開している",ui\00_message\quest\q00030410.gmd,\quest\q00030410.arc,q00030410.arc,122
0,,"同時にエリオット達の覚者隊が
渦へと繋がる場所を、探しに動こうとしていることは
貴君も承知の通りだろう","同時にエリオット達の覚者隊が
渦へと繋がる場所を、探しに動こうとしていることは
貴君も承知の通りだろう",ui\00_message\quest\q00030410.gmd,\quest\q00030410.arc,q00030410.arc,123
0,,"さあ、貴君はシェドレアンをこれ以上
闇化させないように防ぎつつ、その時が来る準備を
整えてくれ","さあ、貴君はシェドレアンをこれ以上
闇化させないように防ぎつつ、その時が来る準備を
整えてくれ",ui\00_message\quest\q00030410.gmd,\quest\q00030410.arc,q00030410.arc,124
0,,"シェドレアンをこれ以上、闇に呑ませてはならない
さあ、ミッションを受けてくれ","シェドレアンをこれ以上、闇に呑ませてはならない
さあ、ミッションを受けてくれ",ui\00_message\quest\q00030410.gmd,\quest\q00030410.arc,q00030410.arc,125
0,,エリオットから今しがた、連絡が来たところだ,エリオットから今しがた、連絡が来たところだ,ui\00_message\quest\q00030410.gmd,\quest\q00030410.arc,q00030410.arc,126
0,,"どうやら空の渦と密に関係がある場所を
発見したらしい","どうやら空の渦と密に関係がある場所を
発見したらしい",ui\00_message\quest\q00030410.gmd,\quest\q00030410.arc,q00030410.arc,127
0,,"彼らは、シェドレアン大神殿の前にいる
だがその前に、今一度白竜様の元へ行ってくれ","彼らは、シェドレアン大神殿の前にいる
だがその前に、今一度白竜様の元へ行ってくれ",ui\00_message\quest\q00030410.gmd,\quest\q00030410.arc,q00030410.arc,128
0,,"突入への準備が出来ているか否か
しかと見極めて貰うと良い","突入への準備が出来ているか否か
しかと見極めて貰うと良い",ui\00_message\quest\q00030410.gmd,\quest\q00030410.arc,q00030410.arc,129
0,,"ハインツ副団長も人が悪いぜ
歴戦のこの俺を、神殿に残すんだからな","ハインツ副団長も人が悪いぜ
歴戦のこの俺を、神殿に残すんだからな",ui\00_message\quest\q00030410.gmd,\quest\q00030410.arc,q00030410.arc,130
0,,我が覚者よ、あらかたの準備を整えたようだな,我が覚者よ、あらかたの準備を整えたようだな,ui\00_message\quest\q00030410.gmd,\quest\q00030410.arc,q00030410.arc,131
0,,おまえのその、内より聞こえし竜力の脈動――,おまえのその、内より聞こえし竜力の脈動――,ui\00_message\quest\q00030410.gmd,\quest\q00030410.arc,q00030410.arc,132
0,,我は常におまえと共に存在する,我は常におまえと共に存在する,ui\00_message\quest\q00030410.gmd,\quest\q00030410.arc,q00030410.arc,133
0,,"いや、この脈動――
我ひとりではないかも知れぬな――","いや、この脈動――
我ひとりではないかも知れぬな――",ui\00_message\quest\q00030410.gmd,\quest\q00030410.arc,q00030410.arc,134
0,,"この世界を憂う
すべての竜がおまえと共にあらんことを願おう","この世界を憂う
すべての竜がおまえと共にあらんことを願おう",ui\00_message\quest\q00030410.gmd,\quest\q00030410.arc,q00030410.arc,135
0,,"さあ
シェドレアンで待つ、おまえの仲間の元へ急ぐがいい","さあ
シェドレアンで待つ、おまえの仲間の元へ急ぐがいい",ui\00_message\quest\q00030410.gmd,\quest\q00030410.arc,q00030410.arc,136
0,,隊長、闇の波動に変化が表れました,隊長、闇の波動に変化が表れました,ui\00_message\quest\q00030410.gmd,\quest\q00030410.arc,q00030410.arc,137
0,,"シェドレアン大神殿のこの場所――
ここに何かが隠されているみたいなんです","シェドレアン大神殿のこの場所――
ここに何かが隠されているみたいなんです",ui\00_message\quest\q00030410.gmd,\quest\q00030410.arc,q00030410.arc,138
0,,"神殿内の闇が払われると
この場所から、再び闇が流れ込んでいるんです","神殿内の闇が払われると
この場所から、再び闇が流れ込んでいるんです",ui\00_message\quest\q00030410.gmd,\quest\q00030410.arc,q00030410.arc,139
0,,"ここが、もしかしたらその場所かも知れません
行きましょう、隊長！","ここが、もしかしたらその場所かも知れません
行きましょう、隊長！",ui\00_message\quest\q00030410.gmd,\quest\q00030410.arc,q00030410.arc,140
0,,急ぎましょう,急ぎましょう,ui\00_message\quest\q00030410.gmd,\quest\q00030410.arc,q00030410.arc,141
0,,"この機会を逃したら、空の渦を退ける方法は
二度と見つからないかも知れません","この機会を逃したら、空の渦を退ける方法は
二度と見つからないかも知れません",ui\00_message\quest\q00030410.gmd,\quest\q00030410.arc,q00030410.arc,142
0,,"どうやら、準備はできてるみてえだな
派手に暴れてやろうぜ","どうやら、準備はできてるみてえだな
派手に暴れてやろうぜ",ui\00_message\quest\q00030410.gmd,\quest\q00030410.arc,q00030410.arc,143
0,,間に合ったみたいだね、隊長！,間に合ったみたいだね、隊長！,ui\00_message\quest\q00030410.gmd,\quest\q00030410.arc,q00030410.arc,144
0,,レオめ、気でも狂ったのかよっ！,レオめ、気でも狂ったのかよっ！,ui\00_message\quest\q00030410.gmd,\quest\q00030410.arc,q00030410.arc,145
0,,あいつが敵だってことだけは、はっきりしたぜ！,あいつが敵だってことだけは、はっきりしたぜ！,ui\00_message\quest\q00030410.gmd,\quest\q00030410.arc,q00030410.arc,146
0,,こいつは手強いぞ,こいつは手強いぞ,ui\00_message\quest\q00030410.gmd,\quest\q00030410.arc,q00030410.arc,147
0,,エリオット、もっと攻めろ！,エリオット、もっと攻めろ！,ui\00_message\quest\q00030410.gmd,\quest\q00030410.arc,q00030410.arc,148
0,,痛えじゃねえか！,痛えじゃねえか！,ui\00_message\quest\q00030410.gmd,\quest\q00030410.arc,q00030410.arc,149
0,,くそっ――,くそっ――,ui\00_message\quest\q00030410.gmd,\quest\q00030410.arc,q00030410.arc,150
0,,ここどこ！？　何が起きたの！？,ここどこ！？　何が起きたの！？,ui\00_message\quest\q00030410.gmd,\quest\q00030410.arc,q00030410.arc,151
0,,あんたに用はないの！,あんたに用はないの！,ui\00_message\quest\q00030410.gmd,\quest\q00030410.arc,q00030410.arc,152
0,,結構手強いっ！,結構手強いっ！,ui\00_message\quest\q00030410.gmd,\quest\q00030410.arc,q00030410.arc,153
0,,いったい何がしたいのよ、レオは！,いったい何がしたいのよ、レオは！,ui\00_message\quest\q00030410.gmd,\quest\q00030410.arc,q00030410.arc,154
0,,寒いし――息が詰まる――,寒いし――息が詰まる――,ui\00_message\quest\q00030410.gmd,\quest\q00030410.arc,q00030410.arc,155
0,,隊長、早く終わらせよう,隊長、早く終わらせよう,ui\00_message\quest\q00030410.gmd,\quest\q00030410.arc,q00030410.arc,156
0,,レオ統率、どこかで見てるんですか！？,レオ統率、どこかで見てるんですか！？,ui\00_message\quest\q00030410.gmd,\quest\q00030410.arc,q00030410.arc,157
0,,隊長、目の前の敵に集中しましょう！,隊長、目の前の敵に集中しましょう！,ui\00_message\quest\q00030410.gmd,\quest\q00030410.arc,q00030410.arc,158
0,,みんな、しっかり！,みんな、しっかり！,ui\00_message\quest\q00030410.gmd,\quest\q00030410.arc,q00030410.arc,159
0,,ここ、フィンダムじゃないですよね！？,ここ、フィンダムじゃないですよね！？,ui\00_message\quest\q00030410.gmd,\quest\q00030410.arc,q00030410.arc,160
0,,空気が――重い――,空気が――重い――,ui\00_message\quest\q00030410.gmd,\quest\q00030410.arc,q00030410.arc,161
0,,くっ――負けるものか――,くっ――負けるものか――,ui\00_message\quest\q00030410.gmd,\quest\q00030410.arc,q00030410.arc,162
0,,レオめ――,レオめ――,ui\00_message\quest\q00030410.gmd,\quest\q00030410.arc,q00030410.arc,163
0,,"おい、隊長さんよ
レオのことは、ここの連中には秘密にしようぜ
俺たちまで信頼を失いかねないぞ","おい、隊長さんよ
レオのことは、ここの連中には秘密にしようぜ
俺たちまで信頼を失いかねないぞ",ui\00_message\quest\q00030410.gmd,\quest\q00030410.arc,q00030410.arc,164
0,,レオは結局わたしたちに何を伝えたいの？,レオは結局わたしたちに何を伝えたいの？,ui\00_message\quest\q00030410.gmd,\quest\q00030410.arc,q00030410.arc,165
0,,"竜力を集めろってこと？
騙したり、罠だったりしない？","竜力を集めろってこと？
騙したり、罠だったりしない？",ui\00_message\quest\q00030410.gmd,\quest\q00030410.arc,q00030410.arc,166
0,,もう一度話す機会があればいいんですけどね,もう一度話す機会があればいいんですけどね,ui\00_message\quest\q00030410.gmd,\quest\q00030410.arc,q00030410.arc,167
0,,"隊長、俺、今になっても信じられませんよ
だってレオ統率は――","隊長、俺、今になっても信じられませんよ
だってレオ統率は――",ui\00_message\quest\q00030410.gmd,\quest\q00030410.arc,q00030410.arc,168
0,,"あの渦の中に黒騎士がいるのだな？
なぜ我らに姿を見せない――
今度はどんな策略があるのだ――","あの渦の中に黒騎士がいるのだな？
なぜ我らに姿を見せない――
今度はどんな策略があるのだ――",ui\00_message\quest\q00030410.gmd,\quest\q00030410.arc,q00030410.arc,169
0,,そうか――,そうか――,ui\00_message\quest\q00030410.gmd,\quest\q00030410.arc,q00030410.arc,170
0,,"黒剣を破壊し、敵を押し戻したが
危機はまだ去らず、渦も未だ消える気配はない","黒剣を破壊し、敵を押し戻したが
危機はまだ去らず、渦も未だ消える気配はない",ui\00_message\quest\q00030410.gmd,\quest\q00030410.arc,q00030410.arc,171
0,,"あなたがたが倒した、空の渦の恐ろしい魔物も
完全に消え去ってはいないということだろう","あなたがたが倒した、空の渦の恐ろしい魔物も
完全に消え去ってはいないということだろう",ui\00_message\quest\q00030410.gmd,\quest\q00030410.arc,q00030410.arc,172
0,,"実は――
このフィンダムの多くの者が
精霊竜セシリーの声を聞いたのだ
もちろん、わたしもな","実は――
このフィンダムの多くの者が
精霊竜セシリーの声を聞いたのだ
もちろん、わたしもな",ui\00_message\quest\q00030410.gmd,\quest\q00030410.arc,q00030410.arc,173
0,,"頭の中で響いたその声は
自らの力をあなたに与え――
あなたの力となり、黒騎士と戦うと言った","頭の中で響いたその声は
自らの力をあなたに与え――
あなたの力となり、黒騎士と戦うと言った",ui\00_message\quest\q00030410.gmd,\quest\q00030410.arc,q00030410.arc,174
0,,"となれば、我々の気持ちは決まっている
白竜の覚者よ、私たちの未来を託そう","となれば、我々の気持ちは決まっている
白竜の覚者よ、私たちの未来を託そう",ui\00_message\quest\q00030410.gmd,\quest\q00030410.arc,q00030410.arc,175
0,,精霊竜セシリーの力をあなたに――,精霊竜セシリーの力をあなたに――,ui\00_message\quest\q00030410.gmd,\quest\q00030410.arc,q00030410.arc,176
0,,精霊竜セシリーの力を感じているだろう？,精霊竜セシリーの力を感じているだろう？,ui\00_message\quest\q00030410.gmd,\quest\q00030410.arc,q00030410.arc,177
0,,"セシリーだけではないぞ
我らすべてのフィンダムの民は
あなたとともに戦う覚悟だ！","セシリーだけではないぞ
我らすべてのフィンダムの民は
あなたとともに戦う覚悟だ！",ui\00_message\quest\q00030410.gmd,\quest\q00030410.arc,q00030410.arc,178
0,,"渦との戦いは、まだ始まったばかりかも知れないな
今はしばし、休息を取られるが良い","渦との戦いは、まだ始まったばかりかも知れないな
今はしばし、休息を取られるが良い",ui\00_message\quest\q00030410.gmd,\quest\q00030410.arc,q00030410.arc,179
0,,"レオは最早我が覚者ではない
竜と人との契りが反故になるとはな","レオは最早我が覚者ではない
竜と人との契りが反故になるとはな",ui\00_message\quest\q00030410.gmd,\quest\q00030410.arc,q00030410.arc,180
0,,"これが数多の覚者を持つということか
これが我が理の結末か――","これが数多の覚者を持つということか
これが我が理の結末か――",ui\00_message\quest\q00030410.gmd,\quest\q00030410.arc,q00030410.arc,181
0,,"エリオットから聞いたよ
水竜以外の竜力がこの先どうなるか
言い換えれば、誰のものになるのか――
レオはそういう話をしたんだね？","エリオットから聞いたよ
水竜以外の竜力がこの先どうなるか
言い換えれば、誰のものになるのか――
レオはそういう話をしたんだね？",ui\00_message\quest\q00030410.gmd,\quest\q00030410.arc,q00030410.arc,182
0,,"それは――
竜力の争奪戦ということだろうか","それは――
竜力の争奪戦ということだろうか",ui\00_message\quest\q00030410.gmd,\quest\q00030410.arc,q00030410.arc,183
