#Index,Key,MsgJp,MsgEn,GmdPath,ArcPath,ArcName,ReadIndex
0,,わたしはここで君たちの帰りを待つよ,,ui\00_message\quest\q00020140.gmd,\quest\q00020140.arc,q00020140.arc,15
0,,"一緒に行ったところで、足手まといになるのは
わかっているからね",,ui\00_message\quest\q00020140.gmd,\quest\q00020140.arc,q00020140.arc,16
0,,"こういう時の留守番は本当に忸怩たる思いだよ
でも、学究肌の宿命だね",,ui\00_message\quest\q00020140.gmd,\quest\q00020140.arc,q00020140.arc,17
0,,いよいよ黒騎士との決戦だな？,,ui\00_message\quest\q00020140.gmd,\quest\q00020140.arc,q00020140.arc,18
0,,"さあ、船ン中で、きっちり休んでくれ
もっとも、すぐに到着させちまうけどよ",,ui\00_message\quest\q00020140.gmd,\quest\q00020140.arc,q00020140.arc,19
0,,この先の、奥の扉を解放してある――,,ui\00_message\quest\q00020140.gmd,\quest\q00020140.arc,q00020140.arc,20
0,,"扉の先は魔赤島の山頂部
あの忌まわしい赤い光のお膝元だ
決して気を抜くなよ",,ui\00_message\quest\q00020140.gmd,\quest\q00020140.arc,q00020140.arc,21
0,,ガリュリュリュ！,,ui\00_message\quest\q00020140.gmd,\quest\q00020140.arc,q00020140.arc,22
0,,キキキキキ――,,ui\00_message\quest\q00020140.gmd,\quest\q00020140.arc,q00020140.arc,23
0,,グギギギギ――,,ui\00_message\quest\q00020140.gmd,\quest\q00020140.arc,q00020140.arc,24
0,,く――ろ――き――キキキキ――,,ui\00_message\quest\q00020140.gmd,\quest\q00020140.arc,q00020140.arc,25
0,,ぢから――ぢからを――ぐで――,,ui\00_message\quest\q00020140.gmd,\quest\q00020140.arc,q00020140.arc,26
0,,お――まーいーらーーー！,,ui\00_message\quest\q00020140.gmd,\quest\q00020140.arc,q00020140.arc,27
0,,ギニュー――,,ui\00_message\quest\q00020140.gmd,\quest\q00020140.arc,q00020140.arc,28
0,,ぶっころリュリュリュ――,,ui\00_message\quest\q00020140.gmd,\quest\q00020140.arc,q00020140.arc,29
0,,オマイロアァァァ――,,ui\00_message\quest\q00020140.gmd,\quest\q00020140.arc,q00020140.arc,30
0,,ズール――狙いはセシリーひとり,,ui\00_message\quest\q00020140.gmd,\quest\q00020140.arc,q00020140.arc,31
0,,ズールよ！　もう、届かぬか――,,ui\00_message\quest\q00020140.gmd,\quest\q00020140.arc,q00020140.arc,32
0,,勝利など――夢と知るがいい――,,ui\00_message\quest\q00020140.gmd,\quest\q00020140.arc,q00020140.arc,33
0,,覚者どもめ――こしゃくな,,ui\00_message\quest\q00020140.gmd,\quest\q00020140.arc,q00020140.arc,34
0,,半端覚者に手こずるな！,,ui\00_message\quest\q00020140.gmd,\quest\q00020140.arc,q00020140.arc,35
0,,ズール！　聞こえぬか、ズール！,,ui\00_message\quest\q00020140.gmd,\quest\q00020140.arc,q00020140.arc,36
0,,みなさん、よろしくお願いします,,ui\00_message\quest\q00020140.gmd,\quest\q00020140.arc,q00020140.arc,37
0,,手強いけど、勝てます！,,ui\00_message\quest\q00020140.gmd,\quest\q00020140.arc,q00020140.arc,38
0,,隊長、さすがです！,,ui\00_message\quest\q00020140.gmd,\quest\q00020140.arc,q00020140.arc,39
0,,声をかけあって！,,ui\00_message\quest\q00020140.gmd,\quest\q00020140.arc,q00020140.arc,40
0,,まだいけます！,,ui\00_message\quest\q00020140.gmd,\quest\q00020140.arc,q00020140.arc,41
0,,わたしが！,,ui\00_message\quest\q00020140.gmd,\quest\q00020140.arc,q00020140.arc,42
0,,くっ――みなさん、大丈夫ですか！？,,ui\00_message\quest\q00020140.gmd,\quest\q00020140.arc,q00020140.arc,43
0,,ここで倒れるわけにはいかない！,,ui\00_message\quest\q00020140.gmd,\quest\q00020140.arc,q00020140.arc,44
0,,ウィルミア――力を――！,,ui\00_message\quest\q00020140.gmd,\quest\q00020140.arc,q00020140.arc,45
0,,ふん、哀れなズールめ,,ui\00_message\quest\q00020140.gmd,\quest\q00020140.arc,q00020140.arc,46
0,,オレが眠らせてやる,,ui\00_message\quest\q00020140.gmd,\quest\q00020140.arc,q00020140.arc,47
0,,おら！　どっか行け！,,ui\00_message\quest\q00020140.gmd,\quest\q00020140.arc,q00020140.arc,48
0,,ズール、目を覚ませ！,,ui\00_message\quest\q00020140.gmd,\quest\q00020140.arc,q00020140.arc,49
0,,隊長、生きてっか！？,,ui\00_message\quest\q00020140.gmd,\quest\q00020140.arc,q00020140.arc,50
0,,俺は俺の勝利に賭けるぜ！,,ui\00_message\quest\q00020140.gmd,\quest\q00020140.arc,q00020140.arc,51
0,,ああこの感じ――侵食魔と同じ,,ui\00_message\quest\q00020140.gmd,\quest\q00020140.arc,q00020140.arc,52
0,,前のズールが懐かしいよ,,ui\00_message\quest\q00020140.gmd,\quest\q00020140.arc,q00020140.arc,53
0,,オマイ、おとなしくしな！,,ui\00_message\quest\q00020140.gmd,\quest\q00020140.arc,q00020140.arc,54
0,,黒騎士、出てこい！,,ui\00_message\quest\q00020140.gmd,\quest\q00020140.arc,q00020140.arc,55
0,,くう――意外と強い！,,ui\00_message\quest\q00020140.gmd,\quest\q00020140.arc,q00020140.arc,56
0,,嫌い、嫌い、嫌い！,,ui\00_message\quest\q00020140.gmd,\quest\q00020140.arc,q00020140.arc,57
0,,さっさと終わらせましょう！,,ui\00_message\quest\q00020140.gmd,\quest\q00020140.arc,q00020140.arc,58
0,,油断しちゃダメですよ！,,ui\00_message\quest\q00020140.gmd,\quest\q00020140.arc,q00020140.arc,59
0,,余力残してください！,,ui\00_message\quest\q00020140.gmd,\quest\q00020140.arc,q00020140.arc,60
0,,よく見て行きましょう！,,ui\00_message\quest\q00020140.gmd,\quest\q00020140.arc,q00020140.arc,61
0,,俺だってやってます！,,ui\00_message\quest\q00020140.gmd,\quest\q00020140.arc,q00020140.arc,62
0,,とどめだ！,,ui\00_message\quest\q00020140.gmd,\quest\q00020140.arc,q00020140.arc,63
0,,"黒騎士が消えればすべてが好転する――
今はただ、そう祈るほかありません",,ui\00_message\quest\q00020140.gmd,\quest\q00020140.arc,q00020140.arc,64
0,,"チッ――レオの奴、恰好つけやがって
バカでかい借りができちまったようだな
さっさと返してやろうぜ",,ui\00_message\quest\q00020140.gmd,\quest\q00020140.arc,q00020140.arc,65
0,,"レスタニアとフィンダムを繋ぐこの島は
侵食魔の巣窟でもあります",,ui\00_message\quest\q00020140.gmd,\quest\q00020140.arc,q00020140.arc,66
0,,"最終的には――
フィンダムから来る侵食魔を止めないと
問題は解決しませんよね",,ui\00_message\quest\q00020140.gmd,\quest\q00020140.arc,q00020140.arc,67
0,,隊長、一度神殿に戻ろうよ,,ui\00_message\quest\q00020140.gmd,\quest\q00020140.arc,q00020140.arc,68
0,,"この目で見たこと、この耳で聞いたこと――
レオの最期の叫び――全部伝えないと",,ui\00_message\quest\q00020140.gmd,\quest\q00020140.arc,q00020140.arc,69
0,,レオは――,,ui\00_message\quest\q00020140.gmd,\quest\q00020140.arc,q00020140.arc,70
0,,"ふん、変わった奴だった
生涯、忘れることはないだろう",,ui\00_message\quest\q00020140.gmd,\quest\q00020140.arc,q00020140.arc,71
0,,レオ――,,ui\00_message\quest\q00020140.gmd,\quest\q00020140.arc,q00020140.arc,72
0,,"さっさと酔ってしまいたいが
こんな時に限ってまったく酔えないんだ",,ui\00_message\quest\q00020140.gmd,\quest\q00020140.arc,q00020140.arc,73
0,,"レオのことは残念だったな
気を落とすなよ",,ui\00_message\quest\q00020140.gmd,\quest\q00020140.arc,q00020140.arc,74
0,,"レオが亡くなったと聞きました
その顔を見ると――ああ、本当なんですね",,ui\00_message\quest\q00020140.gmd,\quest\q00020140.arc,q00020140.arc,75
0,,レオとは、いつかまた会えるって思っていたのに――,,ui\00_message\quest\q00020140.gmd,\quest\q00020140.arc,q00020140.arc,76
0,,"レオの、言葉に憂いがなく――
澄んだ目で遠くを見ていたあの姿――",,ui\00_message\quest\q00020140.gmd,\quest\q00020140.arc,q00020140.arc,77
0,,"最期の瞬間まで覚者らしくあろうという
覚悟の賜物だったのかもしれないね",,ui\00_message\quest\q00020140.gmd,\quest\q00020140.arc,q00020140.arc,78
0,,"皆、レオのことを話しているが
誰もわたしに話そうとしない
まあ、察しは付くよ",,ui\00_message\quest\q00020140.gmd,\quest\q00020140.arc,q00020140.arc,79
0,,"――おかえり
レオのこと、聞いてるよ――",,ui\00_message\quest\q00020140.gmd,\quest\q00020140.arc,q00020140.arc,80
0,,"本当に、レオらしいっていうか、あはは――
うん――大変だったね",,ui\00_message\quest\q00020140.gmd,\quest\q00020140.arc,q00020140.arc,81
0,,"聞いたぞ
黒騎士はもういない",,ui\00_message\quest\q00020140.gmd,\quest\q00020140.arc,q00020140.arc,82
0,,"払った代償を嘆くより、強敵がいなくなったこと――
まず、その喜びを分かち合おうではないか",,ui\00_message\quest\q00020140.gmd,\quest\q00020140.arc,q00020140.arc,83
0,,"黒騎士が消えてもなお
レスタニアへの悪意は腐臭のごとく漂っている",,ui\00_message\quest\q00020140.gmd,\quest\q00020140.arc,q00020140.arc,84
0,,"覚者よ――
悪意の原泉はレスタニアの外にある
その正体、しかと見極めよ",,ui\00_message\quest\q00020140.gmd,\quest\q00020140.arc,q00020140.arc,85
0,,"今しがた島のゲートが開通したと
使者が伝えてきた",,ui\00_message\quest\q00020150.gmd,\quest\q00020150.arc,q00020150.arc,0
0,,"懸念されたセシリーの消耗は
さほどではないとのことだ
だが、ゲートが安定し続ける保証はない",,ui\00_message\quest\q00020150.gmd,\quest\q00020150.arc,q00020150.arc,1
0,,"セシリーはすぐにでもフィンダムへ
渡りたいと主張しているらしいが
向こうで万が一のことが起これば
我々への影響は計り知れない",,ui\00_message\quest\q00020150.gmd,\quest\q00020150.arc,q00020150.arc,2
0,,"そこで――
セシリーたちとフィンダムへ渡り、護衛し
状況の把握――実地の調査を行う者が必要だ
もちろん、おまえ以上の適任はいない",,ui\00_message\quest\q00020150.gmd,\quest\q00020150.arc,q00020150.arc,3
0,,"すでに第一次調査隊――おまえの部下たちは
ゲートの前で待っている",,ui\00_message\quest\q00020150.gmd,\quest\q00020150.arc,q00020150.arc,4
0,,"幾多の危機を乗り越えたレスタニア育ちの目で
状況を見極めてくれ",,ui\00_message\quest\q00020150.gmd,\quest\q00020150.arc,q00020150.arc,5
0,,"向こうがどんなところで、何が起こっているのか
よく見てくるのだぞ",,ui\00_message\quest\q00020150.gmd,\quest\q00020150.arc,q00020150.arc,6
0,,"セシリーやロイグにとっては馴れたことでも
君たちにとっては危険だってことが
少なからずあると思う",,ui\00_message\quest\q00020150.gmd,\quest\q00020150.arc,q00020150.arc,7
0,,目を凝らして、耳を澄まして――いいね？,,ui\00_message\quest\q00020150.gmd,\quest\q00020150.arc,q00020150.arc,8
0,,"友の家に初めて招かれた時――
未知の果実を口にする時――",,ui\00_message\quest\q00020150.gmd,\quest\q00020150.arc,q00020150.arc,9
0,,"評判の詩人の朗読を聞く時――
こりゃ、全部、冒険だ",,ui\00_message\quest\q00020150.gmd,\quest\q00020150.arc,q00020150.arc,10
0,,"もちろん、まだ見ぬ世界に乗り込むのは
とびきりの大冒険",,ui\00_message\quest\q00020150.gmd,\quest\q00020150.arc,q00020150.arc,11
0,,"困難もあるだろうが、怖れるな
目一杯楽しんでやれ",,ui\00_message\quest\q00020150.gmd,\quest\q00020150.arc,q00020150.arc,12
0,,冒険なんて、誰もができることじゃないからな,,ui\00_message\quest\q00020150.gmd,\quest\q00020150.arc,q00020150.arc,13
0,,"見てください
ゲートは安定しています",,ui\00_message\quest\q00020150.gmd,\quest\q00020150.arc,q00020150.arc,14
0,,いよいよだね,,ui\00_message\quest\q00020150.gmd,\quest\q00020150.arc,q00020150.arc,15
0,,"スー――
ハー――",,ui\00_message\quest\q00020150.gmd,\quest\q00020150.arc,q00020150.arc,16
0,,"気にするな
単なる深呼吸だ",,ui\00_message\quest\q00020150.gmd,\quest\q00020150.arc,q00020150.arc,17
0,,やば――ワクワクが止まらない！,,ui\00_message\quest\q00020150.gmd,\quest\q00020150.arc,q00020150.arc,18
0,,うう――みぞおちのあたりがキリキリします,,ui\00_message\quest\q00020150.gmd,\quest\q00020150.arc,q00020150.arc,19
0,,"わたしがいた時より状況は悪化している――
その可能性はかなり高い",,ui\00_message\quest\q00020150.gmd,\quest\q00020150.arc,q00020150.arc,20
0,,まず、このあたりの安全を確認しないか？,,ui\00_message\quest\q00020150.gmd,\quest\q00020150.arc,q00020150.arc,21
0,,"やはりレスタニアよりも空気が濃いですね？
みなさんは大丈夫ですか？",,ui\00_message\quest\q00020150.gmd,\quest\q00020150.arc,q00020150.arc,22
0,,"人間を怖いと思ったことはねえが
むき出しの自然てのは、どうも落ち着かねえな",,ui\00_message\quest\q00020150.gmd,\quest\q00020150.arc,q00020150.arc,23
0,,"大歓迎を期待していたわけじゃないけど
ちょっとサビシイかも？",,ui\00_message\quest\q00020150.gmd,\quest\q00020150.arc,q00020150.arc,24
0,,"何が潜んでいるかわかったもんじゃありません
慎重に行きましょう、慎重に！",,ui\00_message\quest\q00020150.gmd,\quest\q00020150.arc,q00020150.arc,25
0,,まずは、礎を解放しちまうか――,,ui\00_message\quest\q00020150.gmd,\quest\q00020150.arc,q00020150.arc,26
0,,ここを拠点にして、あちこちに足を伸ばそうぜ,,ui\00_message\quest\q00020150.gmd,\quest\q00020150.arc,q00020150.arc,27
0,,"おまえはリム転移の具合を確認しがてら
レスタニアへ戻れ
ジョゼフに首尾を報告してこいよ",,ui\00_message\quest\q00020150.gmd,\quest\q00020150.arc,q00020150.arc,28
0,,"ゲートが開通した結果、リム転移も可能になった
――おそらく、そういうことですよね",,ui\00_message\quest\q00020150.gmd,\quest\q00020150.arc,q00020150.arc,29
0,,"やっぱり竜の世界だから
基本のルールは同じみたいだね",,ui\00_message\quest\q00020150.gmd,\quest\q00020150.arc,q00020150.arc,30
0,,そうそう、ここの横手の奥の方――,,ui\00_message\quest\q00020150.gmd,\quest\q00020150.arc,q00020150.arc,31
0,,"家があるみたいなんだけど
ご挨拶しといた方がいいかな？",,ui\00_message\quest\q00020150.gmd,\quest\q00020150.arc,q00020150.arc,32
0,,"これ、内緒ですけど――
ここがレスタニア以上に進んだ世界じゃなくて
良かったと、ホッとしてます",,ui\00_message\quest\q00020150.gmd,\quest\q00020150.arc,q00020150.arc,33
0,,"君たちが来てくれたのだから
問題は解決したも同然",,ui\00_message\quest\q00020150.gmd,\quest\q00020150.arc,q00020150.arc,34
0,,"――なんて言ったら重荷になるかな？
でも、これが本心なんだ",,ui\00_message\quest\q00020150.gmd,\quest\q00020150.arc,q00020150.arc,35
0,,"ああ、ノドから手が出るほど土産話が欲しい！
でも、忙しいんだろ？
我慢するよ――ああ、我慢我慢！",,ui\00_message\quest\q00020150.gmd,\quest\q00020150.arc,q00020150.arc,36
0,,"無事の帰還、何よりだ
さて、向こうでの出来事を――",,ui\00_message\quest\q00020150.gmd,\quest\q00020150.arc,q00020150.arc,37
0,,そうか――“芯なる樹”を中心とする世界,,ui\00_message\quest\q00020150.gmd,\quest\q00020150.arc,q00020150.arc,38
0,,"竜が司る世界と言っても、勝手が違うようだな
ふむ――興味深い",,ui\00_message\quest\q00020150.gmd,\quest\q00020150.arc,q00020150.arc,39
0,,"して、その、病んだ芯なる樹を治さねば
この事態は収まらないというわけか――",,ui\00_message\quest\q00020150.gmd,\quest\q00020150.arc,q00020150.arc,40
0,,"侵食魔はまだ各地で暴れているが
ゲルト団長指揮の元、騎士団が対処している",,ui\00_message\quest\q00020160.gmd,\quest\q00020160.arc,q00020160.arc,0
0,,"こちらのことは気にせず
フィンダムの連中に手を貸してやるんだ",,ui\00_message\quest\q00020160.gmd,\quest\q00020160.arc,q00020160.arc,1
0,,"かの大陸は我らにとって、未だ謎に満ちた場所だ
そこで暮らす人々の考えも、安易に計る事はできん",,ui\00_message\quest\q00020160.gmd,\quest\q00020160.arc,q00020160.arc,2
0,,"今後の両大陸の関係のためにも
彼らを助け、恩を売っておいてほしい",,ui\00_message\quest\q00020160.gmd,\quest\q00020160.arc,q00020160.arc,3
0,,"ジョゼフ様はすでに、フィンダムの問題が
解決したあとのことを考えているらしい",,ui\00_message\quest\q00020160.gmd,\quest\q00020160.arc,q00020160.arc,4
0,,"向こうとの、あらゆる交渉を有利に進めようとね
立派というか、なんというか――すごい人だよ",,ui\00_message\quest\q00020160.gmd,\quest\q00020160.arc,q00020160.arc,5
0,,よし、では出発しようか,,ui\00_message\quest\q00020160.gmd,\quest\q00020160.arc,q00020160.arc,6
0,,"この森を北に抜けると、ふたたび平原を望む
丘上に出る、そこに村が――",,ui\00_message\quest\q00020160.gmd,\quest\q00020160.arc,q00020160.arc,7
0,,いや、かつて村だった場所があるんだ,,ui\00_message\quest\q00020160.gmd,\quest\q00020160.arc,q00020160.arc,8
0,,"拠点としても使えるかもしれない
案内するよ",,ui\00_message\quest\q00020160.gmd,\quest\q00020160.arc,q00020160.arc,9
0,,"道中、魔物はいるだろうけど
特に危険な場所は、わたしの知る限り、ない",,ui\00_message\quest\q00020160.gmd,\quest\q00020160.arc,q00020160.arc,10
0,,ちょっときつめの散歩という感じかな,,ui\00_message\quest\q00020160.gmd,\quest\q00020160.arc,q00020160.arc,11
0,,早く人と話したいですね,,ui\00_message\quest\q00020160.gmd,\quest\q00020160.arc,q00020160.arc,12
0,,"人というのは、このフィンダムの住民という
意味ですけど",,ui\00_message\quest\q00020160.gmd,\quest\q00020160.arc,q00020160.arc,13
0,,"森はもう飽きたぜ
早く賑やかなところへ行こうぜ",,ui\00_message\quest\q00020160.gmd,\quest\q00020160.arc,q00020160.arc,14
0,,"もっとあちこち見て回らないと――
森の話を聞いて喜ぶのは
メイリーフくらいだよ？",,ui\00_message\quest\q00020160.gmd,\quest\q00020160.arc,q00020160.arc,15
0,,隊長――,,ui\00_message\quest\q00020160.gmd,\quest\q00020160.arc,q00020160.arc,16
0,,"していることはレスタニアと変わらないのに
こんなに緊張するのはナゼでしょうね――
おれ、ビビってるってことでしょうかね――",,ui\00_message\quest\q00020160.gmd,\quest\q00020160.arc,q00020160.arc,17
0,,"隊長――無事で良かった！
みんな散り散りになっちゃって――",,ui\00_message\quest\q00020160.gmd,\quest\q00020160.arc,q00020160.arc,18
0,,"ガルドリンとロイグはまだ戻らないんだけれど
隊長は一度、神殿に帰還してくる？",,ui\00_message\quest\q00020160.gmd,\quest\q00020160.arc,q00020160.arc,19
0,,"竜に襲われたことは大事件だから
報告しておいた方がいいと思う",,ui\00_message\quest\q00020160.gmd,\quest\q00020160.arc,q00020160.arc,20
0,,ガルドリン、無事ですよねえ？,,ui\00_message\quest\q00020160.gmd,\quest\q00020160.arc,q00020160.arc,21
0,,混乱しています――,,ui\00_message\quest\q00020160.gmd,\quest\q00020160.arc,q00020160.arc,22
0,,"わたしたちを襲ったのは確かに精霊竜――
ウィルミアがわたしを襲うなんて――",,ui\00_message\quest\q00020160.gmd,\quest\q00020160.arc,q00020160.arc,23
0,,"しかも、一瞬たりとも心がつながらないんです――
そう――まるで侵食魔と対峙しているようでした",,ui\00_message\quest\q00020160.gmd,\quest\q00020160.arc,q00020160.arc,24
0,,おう、貴殿か――,,ui\00_message\quest\q00020160.gmd,\quest\q00020160.arc,q00020160.arc,25
0,,"こちらの侵食魔のことは
我ら白衛騎士団に任せてくれていい",,ui\00_message\quest\q00020160.gmd,\quest\q00020160.arc,q00020160.arc,26
0,,"それより、一刻も早く、ガルドリンとロイグを
見つけだしてやってくれ",,ui\00_message\quest\q00020160.gmd,\quest\q00020160.arc,q00020160.arc,27
0,,"奴がいなくなると、それはそれで
張り合いを無くす輩もいるみたいでな",,ui\00_message\quest\q00020160.gmd,\quest\q00020160.arc,q00020160.arc,28
0,,"我らは団長と共に、侵食魔を根絶させるまで
戦う覚悟だ",,ui\00_message\quest\q00020160.gmd,\quest\q00020160.arc,q00020160.arc,29
0,,ふん、白衛騎士団に油断は無い――,,ui\00_message\quest\q00020160.gmd,\quest\q00020160.arc,q00020160.arc,30
0,,フィンダムの精霊竜に襲われた？,,ui\00_message\quest\q00020160.gmd,\quest\q00020160.arc,q00020160.arc,31
0,,"うーん――
こっちの黄金竜の例があるから
まるっきりない話じゃないけど――",,ui\00_message\quest\q00020160.gmd,\quest\q00020160.arc,q00020160.arc,32
0,,"フィンダム全体が侵食されているという
ことなのかな
精霊竜の乱心は、その象徴というか――",,ui\00_message\quest\q00020160.gmd,\quest\q00020160.arc,q00020160.arc,33
0,,"なんとまあ――
セシリーを覚者にした竜が、侵食魔の如く
襲いかかったとな――",,ui\00_message\quest\q00020160.gmd,\quest\q00020160.arc,q00020160.arc,34
0,,"いったいどういうことだ？
ふむ――
セシリーはさぞ不安に思っていることだろう",,ui\00_message\quest\q00020160.gmd,\quest\q00020160.arc,q00020160.arc,35
0,,"こっちのことは我々に任せて
おまえは早く戻ってやるといい",,ui\00_message\quest\q00020160.gmd,\quest\q00020160.arc,q00020160.arc,36
0,,さあ、フィンダムへ行ってやりなさい,,ui\00_message\quest\q00020170.gmd,\quest\q00020170.arc,q00020170.arc,0
0,,"ガルドリンの安否が気になるが――
部下たちも指示を待っているのではないか？",,ui\00_message\quest\q00020170.gmd,\quest\q00020170.arc,q00020170.arc,1
0,,フィンダムでは竜までが変調をきたしている――,,ui\00_message\quest\q00020170.gmd,\quest\q00020170.arc,q00020170.arc,2
0,,"これはもう、フィンダムをフィンダムたらしめている
均衡が崩れているということだから
原因を見極めるのは難しいかもしれないなあ",,ui\00_message\quest\q00020170.gmd,\quest\q00020170.arc,q00020170.arc,3
0,,"わたしたち、ここじゃ右も左もわからないから
セシリーの意見に従うのが一番かもね",,ui\00_message\quest\q00020170.gmd,\quest\q00020170.arc,q00020170.arc,4
0,,隊長！,,ui\00_message\quest\q00020170.gmd,\quest\q00020170.arc,q00020170.arc,5
0,,ガルドリンとロイグを探しに行きましょう,,ui\00_message\quest\q00020170.gmd,\quest\q00020170.arc,q00020170.arc,6
0,,"先の廃村から、さらに北へ行ったところに
ダナという村があります",,ui\00_message\quest\q00020170.gmd,\quest\q00020170.arc,q00020170.arc,7
0,,"そこで保護されているかもしれないし――
何か情報があるかもしれません",,ui\00_message\quest\q00020170.gmd,\quest\q00020170.arc,q00020170.arc,8
0,,"ダナ村の人たちは少し気むずかしいのですが
けして悪い人たちではありません",,ui\00_message\quest\q00020170.gmd,\quest\q00020170.arc,q00020170.arc,9
0,,"どんなに腹立たしいことがあっても
それだけは忘れないでくださいね",,ui\00_message\quest\q00020170.gmd,\quest\q00020170.arc,q00020170.arc,10
0,,"わたしとエリオットは、村以外を探すよ
そのあたりで倒れてるかもしれないしね",,ui\00_message\quest\q00020170.gmd,\quest\q00020170.arc,q00020170.arc,11
0,,"フィンダムの旅は始まったばかり
これくらいのことは起こりますよ",,ui\00_message\quest\q00020170.gmd,\quest\q00020170.arc,q00020170.arc,12
0,,今度は俺が、あの人を助ける番です,,ui\00_message\quest\q00020170.gmd,\quest\q00020170.arc,q00020170.arc,13
0,,また異国の客か――,,ui\00_message\quest\q00020170.gmd,\quest\q00020170.arc,q00020170.arc,14
0,,"気をつけろ
この村の連中――すぐ怒りやがる",,ui\00_message\quest\q00020170.gmd,\quest\q00020170.arc,q00020170.arc,15
0,,客人はまず我らの族長ピサルと話してもらう,,ui\00_message\quest\q00020170.gmd,\quest\q00020170.arc,q00020170.arc,16
0,,――不思議な服だな,,ui\00_message\quest\q00020170.gmd,\quest\q00020170.arc,q00020170.arc,17
0,,"我らのダナ村は戦士の村
おかしな真似をすると、全身に槍が突き刺さる
それを忘れるなよ",,ui\00_message\quest\q00020170.gmd,\quest\q00020170.arc,q00020170.arc,18
0,,"ダナの村では古くから、信頼が必要とされる際
それに見合う、証を示さねばならないのです",,ui\00_message\quest\q00020170.gmd,\quest\q00020170.arc,q00020170.arc,19
0,,"証についてですが――
この村のエリアマスターであるラザネイルなら
何か手掛かりを教えてくれるかも知れません",,ui\00_message\quest\q00020170.gmd,\quest\q00020170.arc,q00020170.arc,20
0,,"ラザネイルはこの村の中心となる建物
セントラムにいるはずです",,ui\00_message\quest\q00020170.gmd,\quest\q00020170.arc,q00020170.arc,21
0,,"なんだか知らねえが、この石頭どもの
言うとおりにしてくれ",,ui\00_message\quest\q00020170.gmd,\quest\q00020170.arc,q00020170.arc,22
