0,,"""甘い愛のささやき""！
""優雅でさり気ない愛のアピール""！
す、すごいな！
何だか大人っぽいぞ！",,ui\00_message\quest\q60301042.gmd,\quest\q60301042.arc,q60301042.arc,41
0,,襲撃計画について,,ui\00_message\quest\q60318010.gmd,\quest\q60318010.arc,q60318010.arc,4
0,,――後でもう一度聞かせてほしい,,ui\00_message\quest\q60318010.gmd,\quest\q60318010.arc,q60318010.arc,5
0,,"敵はついにあの
""魔軍戦車""を率いて侵攻してくるらしい",,ui\00_message\quest\q60318010.gmd,\quest\q60318010.arc,q60318010.arc,6
0,,"ティネス砦は奪還したばかりで
まだ体制が整い切っていない――
ここへ大軍で攻め込まれては
今の我々では守りきれないかもしれん",,ui\00_message\quest\q60318010.gmd,\quest\q60318010.arc,q60318010.arc,7
0,,"解放軍の情報網はまだ盗賊のそれには及ばない
――頼む、是が非でも
確かな情報を集めてきてくれ",,ui\00_message\quest\q60318010.gmd,\quest\q60318010.arc,q60318010.arc,8
0,,"魔軍は戦力再編のため、各地のオーク共に
指令を出しているとの事だ",,ui\00_message\quest\q60318010.gmd,\quest\q60318010.arc,q60318010.arc,9
0,,"盗賊の持つ情報のなかに、必ず――
魔軍のティネス砦襲撃に関する計画があるはずだ
頼む、確かな情報を探ってきてくれ",,ui\00_message\quest\q60318010.gmd,\quest\q60318010.arc,q60318010.arc,10
0,,"魔軍の襲撃計画についてだって？
確かに、それらしい話を
聞いたことはあるが――",,ui\00_message\quest\q60318010.gmd,\quest\q60318010.arc,q60318010.arc,11
0,,"そうだな――
俺らもネド王子に協力しているとはいえ
武具の在庫に困っててな",,ui\00_message\quest\q60318010.gmd,\quest\q60318010.arc,q60318010.arc,12
0,,"だが、そう易々と情報をくれてやっちゃ
盗賊の名折れってもんだ
この情報を掴むのに、俺らもそれなりの
代償を払ってるんだからな",,ui\00_message\quest\q60318010.gmd,\quest\q60318010.arc,q60318010.arc,13
0,,"<QDEL NAME 0 6>を
よろしく頼むぜ――レスタニアの覚者さん",,ui\00_message\quest\q60318010.gmd,\quest\q60318010.arc,q60318010.arc,14
0,,"――足りないな
ちまちま運ばれるより
まとめて持ってきてくれる方が
ありがたいんだが――",,ui\00_message\quest\q60318010.gmd,\quest\q60318010.arc,q60318010.arc,15
0,,"ああ、きっちりもらってくよ
――よし、こっちも取り引きだからな
誠実にいくさ",,ui\00_message\quest\q60318010.gmd,\quest\q60318010.arc,q60318010.arc,16
0,,"魔軍の襲撃計画について
こっちの持ってる情報を教えてやるよ
なんでも聞いてくれ",,ui\00_message\quest\q60318010.gmd,\quest\q60318010.arc,q60318010.arc,17
0,,"今、魔軍では襲撃部隊の再編成のために
手下となる連中が戦地を駆け回って
指示を出して回ってるらしい",,ui\00_message\quest\q60318010.gmd,\quest\q60318010.arc,q60318010.arc,18
0,,"そいつを見つけて指令書を手に入れたなら――
どこで軍備の再編が行われるかが分かるはずだ",,ui\00_message\quest\q60318010.gmd,\quest\q60318010.arc,q60318010.arc,19
0,,"ただ、どこを駆け回ってるかまでは
俺らも掴めていない――
あたりをつけている場所なら教えてやれるけどな",,ui\00_message\quest\q60318010.gmd,\quest\q60318010.arc,q60318010.arc,20
0,,敵の指令書について,,ui\00_message\quest\q60318010.gmd,\quest\q60318010.arc,q60318010.arc,21
0,,魔軍の脅威について,,ui\00_message\quest\q60318010.gmd,\quest\q60318010.arc,q60318010.arc,22
0,,"魔軍の指令書をここまで持ってくるんなら
俺が解読してやれるぜ",,ui\00_message\quest\q60318010.gmd,\quest\q60318010.arc,q60318010.arc,23
0,,"――魔軍の文書は
ややこしいだけの図解みたいなもんだからな
コツさえわかりゃ何となくわかる",,ui\00_message\quest\q60318010.gmd,\quest\q60318010.arc,q60318010.arc,24
0,,"脅威、か――
今までと同じ戦い方では
太刀打ちできないかもしれないな",,ui\00_message\quest\q60318010.gmd,\quest\q60318010.arc,q60318010.arc,25
0,,"くれぐれも気を付けた方がいい
あの魔軍の最強兵器、""魔軍戦車""カトブレパスが
使われるらしいって話だ――",,ui\00_message\quest\q60318010.gmd,\quest\q60318010.arc,q60318010.arc,26
0,,"――なるほど
魔軍は南西の湖周辺に戦力を結集し
ロスギル、ピレモス周辺を強襲しつつ
ティネス砦へ向かう予定だな",,ui\00_message\quest\q60318010.gmd,\quest\q60318010.arc,q60318010.arc,27
0,,"だったら――
はやめにロスギルにいるヴィクトルって奴に
伝えて、迎撃態勢を配備した方がいいんじゃないか
あそこが落ちると、色々とヤバいぜ",,ui\00_message\quest\q60318010.gmd,\quest\q60318010.arc,q60318010.arc,28
0,,"魔軍はまずロスギル辺りに戦力を集めるようだ
はやめにロスギルにいるヴィクトルって奴に
伝えて、迎撃態勢を配備した方がいいんじゃないか
あそこが落ちると、色々とヤバいぜ",,ui\00_message\quest\q60318010.gmd,\quest\q60318010.arc,q60318010.arc,29
0,,"おい、その話は本当か！？
魔軍が南西の湖周辺に
戦力を結集しつつあるだと！？",,ui\00_message\quest\q60318010.gmd,\quest\q60318010.arc,q60318010.arc,30
0,,"ロスギルへの襲撃計画を阻止せねば――
すぐさま作戦を練り、戦闘準備に
かからせていただこう",,ui\00_message\quest\q60318010.gmd,\quest\q60318010.arc,q60318010.arc,31
0,,"準備が整い次第、貴方にも連絡するつもりだ
――此度は貴重な情報を感謝する",,ui\00_message\quest\q60318010.gmd,\quest\q60318010.arc,q60318010.arc,32
0,,"ん？
この話より気になることでもあるのか？",,ui\00_message\quest\q60318010.gmd,\quest\q60318010.arc,q60318010.arc,33
0,,"まずは魔軍の計画を詳しく調べる必要がある
耳ざといベルタ盗賊団の連中なら――
何かしら魔軍についての計画を掴んでいるかもしれん
行って、情報を引き出してきてくれんか",,ui\00_message\quest\q60318010.gmd,\quest\q60318010.arc,q60318010.arc,34
0,,"ロスギルの<NPC 2900>より伝令がきている
敵陣への戦闘準備が完了したとの事だ
さっそくだが――
ロスギルに向かい仲間と合流してくれ",,ui\00_message\quest\q60318011.gmd,\quest\q60318011.arc,q60318011.arc,0
0,,"ロスギルにおいて
敵陣への戦闘準備が完了したとの事だ
ロスギルに向かい仲間と合流してくれ",,ui\00_message\quest\q60318011.gmd,\quest\q60318011.arc,q60318011.arc,1
0,,"良いタイミングで来てくれたな
こちらの戦闘準備は完了した――
敵陣がまだ編成を整えているこの機を狙い
少数精鋭での奇襲でいく",,ui\00_message\quest\q60318011.gmd,\quest\q60318011.arc,q60318011.arc,2
0,,"こちらの戦力については<NPC 2904>と
確認して欲しい",,ui\00_message\quest\q60318011.gmd,\quest\q60318011.arc,q60318011.arc,3
0,,"いよいよ攻撃がはじまりますね――
今回、敵陣を少数精鋭で奇襲するとのことですが
もうお一人ほど、援軍要請を出そうかと
考えているのです",,ui\00_message\quest\q60318011.gmd,\quest\q60318011.arc,q60318011.arc,4
0,,"何名かに打診させていただいたところ
解放軍総大将であるメイロワ将軍か
覚者様の隊にいらっしゃるリズ様が
参加できそうだということです",,ui\00_message\quest\q60318011.gmd,\quest\q60318011.arc,q60318011.arc,5
0,,どちらに援軍要請をお出ししましょうか？,,ui\00_message\quest\q60318011.gmd,\quest\q60318011.arc,q60318011.arc,6
0,,メイロワ将軍（ウォリアー）,,ui\00_message\quest\q60318011.gmd,\quest\q60318011.arc,q60318011.arc,7
0,,リズ（ソーサラー）,,ui\00_message\quest\q60318011.gmd,\quest\q60318011.arc,q60318011.arc,8
0,,――少し考えさせてほしい,...I want to think a bit,ui\00_message\quest\q60318011.gmd,\quest\q60318011.arc,q60318011.arc,9
0,,"では――メイロワ将軍に
要請を出しておきますので、戦地に向かってください
敵軍は強力との報告を受けております
奇襲が功を奏するよう、十分にご注意を――",,ui\00_message\quest\q60318011.gmd,\quest\q60318011.arc,q60318011.arc,10
0,,"では――リズ様に
要請を出しておきますので、戦地に向かってください
敵軍は強力との報告を受けております
奇襲が功を奏するよう、十分にご注意を――",,ui\00_message\quest\q60318011.gmd,\quest\q60318011.arc,q60318011.arc,11
0,,"よくお考えください
しかし、時は迫っておりますぞ",,ui\00_message\quest\q60318011.gmd,\quest\q60318011.arc,q60318011.arc,12
0,,"援軍要請を出しておきますので
覚者様は戦地に向かってください
奇襲が功を奏するよう、十分にご注意を――",,ui\00_message\quest\q60318011.gmd,\quest\q60318011.arc,q60318011.arc,13
0,,到着したぞ！　この剣、魔軍に存分に味わわせてやろう！,,ui\00_message\quest\q60318011.gmd,\quest\q60318011.arc,q60318011.arc,14
0,,お待たせ！　ガンガン行くからね！,,ui\00_message\quest\q60318011.gmd,\quest\q60318011.arc,q60318011.arc,15
0,,すでに始めておるな、腕が鳴るわ,,ui\00_message\quest\q60318011.gmd,\quest\q60318011.arc,q60318011.arc,16
0,,ん？　敵はビビってる？　ほーらやっちゃうよ！,,ui\00_message\quest\q60318011.gmd,\quest\q60318011.arc,q60318011.arc,17
0,,敵の増援がきたようだ――抜かるなよ！,,ui\00_message\quest\q60318011.gmd,\quest\q60318011.arc,q60318011.arc,18
0,,戦いが始まってるってこと――ようやくばれたようね,,ui\00_message\quest\q60318011.gmd,\quest\q60318011.arc,q60318011.arc,19
0,,まだ敵軍は油断しておる――先に向かうぞ！,,ui\00_message\quest\q60318011.gmd,\quest\q60318011.arc,q60318011.arc,20
0,,敵がもっと来る前に――先に進もう、隊長！,,ui\00_message\quest\q60318011.gmd,\quest\q60318011.arc,q60318011.arc,21
0,,最奥には、敵の本隊がいるはずだ！　行くぞ！,,ui\00_message\quest\q60318011.gmd,\quest\q60318011.arc,q60318011.arc,22
0,,いよいよ敵の本隊ね――気合入れていっちゃおう！,,ui\00_message\quest\q60318011.gmd,\quest\q60318011.arc,q60318011.arc,23
0,,よし――無事、敵陣の制圧完了だ！,,ui\00_message\quest\q60318011.gmd,\quest\q60318011.arc,q60318011.arc,24
0,,はい終わりっと！　まあ、こんなもんだよね,,ui\00_message\quest\q60318011.gmd,\quest\q60318011.arc,q60318011.arc,25
0,,"魔軍による襲撃計画、阻止できて何よりだ！
これで敵もしばらくは
大人しくしていることだろう",,ui\00_message\quest\q60318011.gmd,\quest\q60318011.arc,q60318011.arc,26
0,,"襲撃計画を立てた敵の将は一体誰なのか？
この辺りは、今後も探ってゆく必要が
ありそうだな",,ui\00_message\quest\q60318011.gmd,\quest\q60318011.arc,q60318011.arc,27
0,,"おお、無事に戻られましたな
しばらくは蹴散らされた敵の残党が
うろつきましょうが、そこは解放軍や
ここロスギルの兵士でどうにかできるでしょう",,ui\00_message\quest\q60318011.gmd,\quest\q60318011.arc,q60318011.arc,28
0,,"これでロスギル、ひいてはティネス砦も
当面の危機は回避できたはずだ",,ui\00_message\quest\q60318011.gmd,\quest\q60318011.arc,q60318011.arc,29
0,,"後は残党の始末か――
我らロスギルの兵が任されよう",,ui\00_message\quest\q60318011.gmd,\quest\q60318011.arc,q60318011.arc,30
0,,"作戦が成功してなにより
これでしばらくは砦も安泰だろう",,ui\00_message\quest\q60318011.gmd,\quest\q60318011.arc,q60318011.arc,31
0,,"うん、やったね！
さっすが隊長！　さっすがわたし！
盛大に褒めてくれてもいいんだよ
ほらほら、ここにはエリオットもいないしさ",,ui\00_message\quest\q60318011.gmd,\quest\q60318011.arc,q60318011.arc,32
0,,"覚者様――
一つ、そのお力をお借りできないでしょうか",,ui\00_message\quest\q60319000.gmd,\quest\q60319000.arc,q60319000.arc,0
0,,"実は、ここでの生活を維持するだけの
物資の確保が難航しております
――ええ、物資調達をお願いしたいのです",,ui\00_message\quest\q60319000.gmd,\quest\q60319000.arc,q60319000.arc,1
0,,"物資調達と一言で言っても
道中が危険なものになることは明白――
覚者様のお手伝いに向きそうな方を
ご紹介いたします",,ui\00_message\quest\q60319000.gmd,\quest\q60319000.arc,q60319000.arc,2
0,,"ここに避難してきた方々の暮らしを守るため
どうかお願いいたします",,ui\00_message\quest\q60319000.gmd,\quest\q60319000.arc,q60319000.arc,3
0,,"覚者様とともに物資調達に向かうとなると
それなりの戦闘経験が無いと厳しいでしょう",,ui\00_message\quest\q60319000.gmd,\quest\q60319000.arc,q60319000.arc,4
0,,"覚者様ご自身の戦闘を
的確にサポートできそうな方を
同行者としてお選びください",,ui\00_message\quest\q60319000.gmd,\quest\q60319000.arc,q60319000.arc,5
0,,人員情報１（ハンター）,,ui\00_message\quest\q60319000.gmd,\quest\q60319000.arc,q60319000.arc,6
0,,人員情報２（シーカー）,,ui\00_message\quest\q60319000.gmd,\quest\q60319000.arc,q60319000.arc,7
0,,"ああ、ナヤジークさんからお話は聞いています
私はハンターですので、遠距離から
弓矢で覚者様を援護することになりますが
お力になれるでしょうか？",,ui\00_message\quest\q60319000.gmd,\quest\q60319000.arc,q60319000.arc,8
0,,ドルーに同行を頼む,,ui\00_message\quest\q60319000.gmd,\quest\q60319000.arc,q60319000.arc,9
0,,――少し考えさせてくれ,...I will think a bit,ui\00_message\quest\q60319000.gmd,\quest\q60319000.arc,q60319000.arc,10
0,,"ええ、もちろんです
では、一度メフィテに戻りましょう
物資調達任務についての
くわしい話もお聞きしたいですね",,ui\00_message\quest\q60319000.gmd,\quest\q60319000.arc,q60319000.arc,11
0,,"無事――初めての調達任務に
お手伝いしてもらい感謝いたします
これで物資補給が強化できると思います",,ui\00_message\quest\q60319000.gmd,\quest\q60319000.arc,q60319000.arc,12
0,,"はっ、了解いたしました
――いえ、気にしてはおりません
戦い方にも相性がありますから",,ui\00_message\quest\q60319000.gmd,\quest\q60319000.arc,q60319000.arc,13
0,,"んー、物資調達の任務に協力しろって言うんでしょ？
確かに頼まれはしたけどさぁ――
あのエリアマスターさん、結構人づかい荒くない？",,ui\00_message\quest\q60319000.gmd,\quest\q60319000.arc,q60319000.arc,14
0,,"この前ちょっと世話になったのは確かだけど
盗賊のあたしに気軽に頼みごとが
通ると思われるのもなぁって",,ui\00_message\quest\q60319000.gmd,\quest\q60319000.arc,q60319000.arc,15
0,,"あたしのシーカーとしての腕を借りたいんなら
相応の対価をもらわないとね～
――どう、それでもあたしでいいの？",,ui\00_message\quest\q60319000.gmd,\quest\q60319000.arc,q60319000.arc,16
0,,アンナに同行を頼む,,ui\00_message\quest\q60319000.gmd,\quest\q60319000.arc,q60319000.arc,17
0,,――少し考えさせてくれ,...I will think a bit,ui\00_message\quest\q60319000.gmd,\quest\q60319000.arc,q60319000.arc,18
0,,"あんたも風変わりな覚者だよね
わざわざ対価を払ってまで
あたしに同行を頼むなんて",,ui\00_message\quest\q60319000.gmd,\quest\q60319000.arc,q60319000.arc,19
0,,"えっと、それじゃ――どうしようかな
とりあえず――あたしが言うものを
持ってきてくれればいいよ",,ui\00_message\quest\q60319000.gmd,\quest\q60319000.arc,q60319000.arc,20
0,,"ま、そうだろうね
どっちにせよ、よく考えた方がいいよ",,ui\00_message\quest\q60319000.gmd,\quest\q60319000.arc,q60319000.arc,21
0,,"そんな大したものじゃないでしょ？
人を危険な道中に付き合わせようっていうんだから
相応のものはいただかないとね",,ui\00_message\quest\q60319000.gmd,\quest\q60319000.arc,q60319000.arc,22
0,,"本当に持ってきてくれるなんて
思ってもみなかった――
エラい覚者様なのに、盗賊相手に真面目だね",,ui\00_message\quest\q60319000.gmd,\quest\q60319000.arc,q60319000.arc,23
0,,"あ、もちろん、これに見合う働きはするからさ！
――メフィテの村に向かえばいいんだよね？
そこで任務について詳しく聞かせてもらおうかな",,ui\00_message\quest\q60319000.gmd,\quest\q60319000.arc,q60319000.arc,24
0,,"ふふ――あたしが""任務""なんて変なの
でも、まぁ――敬意を払われたら
その分の義理はきっちり返すよ
これ、姐さんの受け売りだけど",,ui\00_message\quest\q60319000.gmd,\quest\q60319000.arc,q60319000.arc,25
0,,"ナヤジークさんから物資調達について聞きましたよ
――さっそく最初の任務ですね
それでは、現地でお待ちしております！",,ui\00_message\quest\q60319000.gmd,\quest\q60319000.arc,q60319000.arc,26
0,,"""任務""についてはエリアマスターさんから聞いたよ
それじゃ、現地集合といこうか
あんたも準備ができたら向かってね",,ui\00_message\quest\q60319000.gmd,\quest\q60319000.arc,q60319000.arc,27
0,,"――さっそく最初の任務ですね
それでは、現地でお待ちしております！",,ui\00_message\quest\q60319000.gmd,\quest\q60319000.arc,q60319000.arc,28
0,,"それじゃ、現地集合といこうか
あんたも準備ができたら向かってね",,ui\00_message\quest\q60319000.gmd,\quest\q60319000.arc,q60319000.arc,29
0,,"覚者様、お待ちしておりました
それでは物資が調達できる場所へ向かいましょう",,ui\00_message\quest\q60319000.gmd,\quest\q60319000.arc,q60319000.arc,30
0,,"それじゃ、物資が調達できる場所に行こう
この道中が危険って話だから
あんたも気を付けてね",,ui\00_message\quest\q60319000.gmd,\quest\q60319000.arc,q60319000.arc,31
0,,"ふぅ、ここからは私一人でも何とかなりそうです
覚者様はお忙しいことでしょう
あとは私がやっておきますので、先にお戻りください",,ui\00_message\quest\q60319000.gmd,\quest\q60319000.arc,q60319000.arc,32
0,,"ああ、ナヤジークさんへの連絡だけ
お願いします",,ui\00_message\quest\q60319000.gmd,\quest\q60319000.arc,q60319000.arc,33
0,,"これで""任務""は完了したようなものだね
あとはあたしがやっとくよ！
――対価ももらっちゃったからさ
このくらい当然でしょ",,ui\00_message\quest\q60319000.gmd,\quest\q60319000.arc,q60319000.arc,34
0,,"エリアマスターさんへの
報告だけ、よろしくね",,ui\00_message\quest\q60319000.gmd,\quest\q60319000.arc,q60319000.arc,35
0,,"覚者様とともに戦えて
物資調達をお願いできそうな方に
わたしからお話しをしておきました",,ui\00_message\quest\q60319000.gmd,\quest\q60319000.arc,q60319000.arc,36
0,,"外で警備をされている方ですから
腕は確かなはずですわ",,ui\00_message\quest\q60319000.gmd,\quest\q60319000.arc,q60319000.arc,37
0,,"覚者様とともに
荒野を駆け抜けることができる方に
わたしからお話しをしておきました",,ui\00_message\quest\q60319000.gmd,\quest\q60319000.arc,q60319000.arc,38
0,,"驚かれるかもしれませんが――
《ベルタ盗賊団のアジト》にいらっしゃる方です
どうぞお会いになってみてください",,ui\00_message\quest\q60319000.gmd,\quest\q60319000.arc,q60319000.arc,39
0,,"さぁ、一度メフィテに戻りましょう
物資調達任務についての
くわしい話もお聞きしたいですね",,ui\00_message\quest\q60319000.gmd,\quest\q60319000.arc,q60319000.arc,40
0,,"――メフィテの村に向かえばいいんだよね？
そこで任務について詳しく聞かせてもらおうかな",,ui\00_message\quest\q60319000.gmd,\quest\q60319000.arc,q60319000.arc,41
0,,"物資調達の協力者と
無事に合流できたようで、何よりです",,ui\00_message\quest\q60319000.gmd,\quest\q60319000.arc,q60319000.arc,42
0,,"それでは、＜<STG 1093>＞へお急ぎください
協力者の方も、一足先に
現地で待っているはずですわ",,ui\00_message\quest\q60319000.gmd,\quest\q60319000.arc,q60319000.arc,43
0,,"今何をしているか、ですか
実はですな、メイロワ将軍からの指令を受け
ある敵を討伐するために追跡中なのです",,ui\00_message\quest\q60319001.gmd,\quest\q60319001.arc,q60319001.arc,0
0,,"しかし、なかなか思うように進んでおらず――
もしや、ご助力いただけるのですか！？",,ui\00_message\quest\q60319001.gmd,\quest\q60319001.arc,q60319001.arc,1
0,,"なんとありがたい！
ええ、すぐにでも追跡方法をお伝えしましょう",,ui\00_message\quest\q60319001.gmd,\quest\q60319001.arc,q60319001.arc,2
0,,"私が追跡している敵ですが
現状、どこにいるのかが
はっきりとはわかっておりません",,ui\00_message\quest\q60319001.gmd,\quest\q60319001.arc,q60319001.arc,3
0,,"ですが、その痕跡はすでに発見しています
痕跡を追った先で遭遇できるはずなのです",,ui\00_message\quest\q60319001.gmd,\quest\q60319001.arc,q60319001.arc,4
0,,追跡を開始する,,ui\00_message\quest\q60319001.gmd,\quest\q60319001.arc,q60319001.arc,5
0,,――少し待ってほしい,...I want to wait awhile,ui\00_message\quest\q60319001.gmd,\quest\q60319001.arc,q60319001.arc,6
0,,"敵の痕跡が残っていそうな場所を
地図に書き記しておきました
印のある辺りの探索をお願いいたします",,ui\00_message\quest\q60319001.gmd,\quest\q60319001.arc,q60319001.arc,7
0,,"ただ、一つ問題がありまして
敵もやるもので、こちらが追跡を試みていることに
勘付くと逃げてしまいます",,ui\00_message\quest\q60319001.gmd,\quest\q60319001.arc,q60319001.arc,8
0,,"つまり――
あまり追跡に時間をかけられんのです
これが私たちではなかなか難しいことでしてな",,ui\00_message\quest\q60319001.gmd,\quest\q60319001.arc,q60319001.arc,9
0,,"――いえ、覚者様ならばこの程度
問題にならないかもしれませんが
一応お伝えしておこうかと！",,ui\00_message\quest\q60319001.gmd,\quest\q60319001.arc,q60319001.arc,10
0,,"おおお、さすがは覚者様！
追跡し、敵の居どころを突き止めるばかりか
すでに討伐までしてきてくださったとは――！
何とありがたく、頼もしいことでしょう！",,ui\00_message\quest\q60319001.gmd,\quest\q60319001.arc,q60319001.arc,11
0,,"本件は余すことなく
メイロワ将軍にご報告しておきましょう
ご協力、心より感謝しますぞ",,ui\00_message\quest\q60319001.gmd,\quest\q60319001.arc,q60319001.arc,12
0,,追跡開始します――時間内に痕跡を発見しましょう,,ui\00_message\quest\q60319001.gmd,\quest\q60319001.arc,q60319001.arc,13
0,,魔物は何かに気付き始めたようです――急ぎましょう,,ui\00_message\quest\q60319001.gmd,\quest\q60319001.arc,q60319001.arc,14
0,,魔物を見失いました――再度私にお声がけください,,ui\00_message\quest\q60319001.gmd,\quest\q60319001.arc,q60319001.arc,15
0,,"敵の痕跡が残っていそうな場所を
地図に書き記しておきました
印のある辺りの探索をお願いいたします",,ui\00_message\quest\q60319001.gmd,\quest\q60319001.arc,q60319001.arc,16
0,,"ただ、一つ問題がありまして
敵もやるもので、こちらが追跡を試みていることに
勘付くと逃げてしまいます",,ui\00_message\quest\q60319001.gmd,\quest\q60319001.arc,q60319001.arc,17
0,,"つまり――
あまり追跡に時間をかけられんのです
いえ、追跡に失敗してもまた改めて
再出発すればよいのですがね",,ui\00_message\quest\q60319001.gmd,\quest\q60319001.arc,q60319001.arc,18
0,,"おお、これは失礼をば――
どうも気が急いてしまったようです
覚者様にもご準備がありましょう
もちろんお待ちいたしますとも",,ui\00_message\quest\q60319001.gmd,\quest\q60319001.arc,q60319001.arc,19
0,,"ああ、今ちょっと忙しいのよね
ナヤジークさんに頼まれて
スポットの調査をしてるんだけど
量が多くってさ――",,ui\00_message\quest\q60319002.gmd,\quest\q60319002.arc,q60319002.arc,0
0,,"他に頼める人もいないから、やるしかないけど
私一人でさばき切れるかどうか
ギリギリってところだね",,ui\00_message\quest\q60319002.gmd,\quest\q60319002.arc,q60319002.arc,1
0,,"何？　協力してくれるって？
――ああ、そう言ってくれる人を待ってたの！",,ui\00_message\quest\q60319002.gmd,\quest\q60319002.arc,q60319002.arc,2
0,,"素材として使えそうな物の
サンプル収集をお願いね
これもスポット情報の調査には
欠かせないんだ",,ui\00_message\quest\q60319002.gmd,\quest\q60319002.arc,q60319002.arc,3
