#Index,Key,MsgJp,MsgEn,GmdPath,ArcPath,ArcName,ReadIndex
0,,"おつかれさま！
これでわたしにも遺跡の探索が
できるようになったわ",,ui\00_message\quest\q20100000.gmd,\quest\q20100000.arc,q20100000.arc,19
0,,"結構大変だったでしょ？
ありがとうね！",,ui\00_message\quest\q20100000.gmd,\quest\q20100000.arc,q20100000.arc,20
0,,"おつかれさま！
ずいぶん時間がかかると思ったら
本当に大変だったみたいね",,ui\00_message\quest\q20100000.gmd,\quest\q20100000.arc,q20100000.arc,21
0,,感謝するわ――ありがとう！,,ui\00_message\quest\q20100000.gmd,\quest\q20100000.arc,q20100000.arc,22
0,,"じゃあ、遺跡探索の準備しなくちゃ
忙しいなあ、わたし",,ui\00_message\quest\q20100000.gmd,\quest\q20100000.arc,q20100000.arc,23
0,,"そんなに大変なの？
サボってない？",,ui\00_message\quest\q20100000.gmd,\quest\q20100000.arc,q20100000.arc,24
0,,"リズ様の頼み事――
引き受けて頂けるとありがたいのですが",,ui\00_message\quest\q20100000.gmd,\quest\q20100000.arc,q20100000.arc,25
0,,"このような辺境でお会いできたのも
なにかのご縁――
どうかお願いします",,ui\00_message\quest\q20100000.gmd,\quest\q20100000.arc,q20100000.arc,26
0,,"ありがとうございます――！
くれぐれも気をつけて",,ui\00_message\quest\q20100000.gmd,\quest\q20100000.arc,q20100000.arc,27
0,,"申し訳ありません
リズ様はかなり図々しいお方なのですが
それを自覚されておらず――",,ui\00_message\quest\q20100000.gmd,\quest\q20100000.arc,q20100000.arc,28
0,,どうか見捨てないであげてください,,ui\00_message\quest\q20100000.gmd,\quest\q20100000.arc,q20100000.arc,29
0,,おお、そこの――聞いてくれ,,ui\00_message\quest\q20100001.gmd,\quest\q20100001.arc,q20100001.arc,0
0,,"このあたりは珍しいキノコの産地なのだが
来てみたら、ほれ、魔物がうろついておる",,ui\00_message\quest\q20100001.gmd,\quest\q20100001.arc,q20100001.arc,1
0,,"どうだ、貴殿――
わたしの代わりにキノコを集めてくれんか？",,ui\00_message\quest\q20100001.gmd,\quest\q20100001.arc,q20100001.arc,2
0,,おお、そこの――聞いてくれ,,ui\00_message\quest\q20100001.gmd,\quest\q20100001.arc,q20100001.arc,3
0,,"このあたりは珍しいキノコの産地なのだが
来てみたら、ほれ、魔物がうろついておる",,ui\00_message\quest\q20100001.gmd,\quest\q20100001.arc,q20100001.arc,4
0,,"どうだ、貴殿――
わたしの代わりにキノコを集めてくれんか？
貴殿なら、油断さえしなければ大丈夫だろうて",,ui\00_message\quest\q20100001.gmd,\quest\q20100001.arc,q20100001.arc,5
0,,おお、そこの――聞いてくれ,,ui\00_message\quest\q20100001.gmd,\quest\q20100001.arc,q20100001.arc,6
0,,"このあたりは珍しいキノコの産地なのだが
来てみたら、ほれ、魔物がうろついておる",,ui\00_message\quest\q20100001.gmd,\quest\q20100001.arc,q20100001.arc,7
0,,"どうだ、貴殿――
わたしの代わりにキノコを集めてくれんか？",,ui\00_message\quest\q20100001.gmd,\quest\q20100001.arc,q20100001.arc,8
0,,"魔物はそうとう手強いようだが
その分、謝礼ははずむぞ？",,ui\00_message\quest\q20100001.gmd,\quest\q20100001.arc,q20100001.arc,9
0,,"ほう、これぞまさしく例のキノコ――
ふむ、気に入った！",,ui\00_message\quest\q20100001.gmd,\quest\q20100001.arc,q20100001.arc,10
0,,"ほう、これぞまさしく例のキノコ――
その中でも、なかなかの逸品だ
ふむ、気に入った、礼を言うぞ",,ui\00_message\quest\q20100001.gmd,\quest\q20100001.arc,q20100001.arc,11
0,,"こ、これはまさしく求めていたキノコ――
しかも、極上の品ではないか！",,ui\00_message\quest\q20100001.gmd,\quest\q20100001.arc,q20100001.arc,12
0,,いや、何もかも貴殿のおかげ――礼を言うぞ！,,ui\00_message\quest\q20100001.gmd,\quest\q20100001.arc,q20100001.arc,13
0,,"何をしている？
キノコはどうした？",,ui\00_message\quest\q20100001.gmd,\quest\q20100001.arc,q20100001.arc,14
0,,"ああ、君は覚者の――！
このような所で出会えるとは！
どうか重要研究に協力してくれないか",,ui\00_message\quest\q20100002.gmd,\quest\q20100002.arc,q20100002.arc,0
0,,"ここはエルフの古都、エルテ・ディナン！
そう、約300年前に滅びたエルフ族の
築いた都――",,ui\00_message\quest\q20100002.gmd,\quest\q20100002.arc,q20100002.arc,1
0,,"ここにはおそらく、長寿で神秘的な
彼らの知識、そして現在に伝えるべき
遺物や記録がまだまだあるはずだ",,ui\00_message\quest\q20100002.gmd,\quest\q20100002.arc,q20100002.arc,2
0,,"それを首尾良く手に入れて
ここに持ってきてくれないかな？",,ui\00_message\quest\q20100002.gmd,\quest\q20100002.arc,q20100002.arc,3
0,,"エルフの歴史を紐とくことは、
君たち覚者にとっても重要だろう？",,ui\00_message\quest\q20100002.gmd,\quest\q20100002.arc,q20100002.arc,4
0,,"――うん？　ああ、謝礼か
そうだな――考えておくよ",,ui\00_message\quest\q20100002.gmd,\quest\q20100002.arc,q20100002.arc,5
0,,"ああ、君は覚者の――！
このような所で出会えるとは！
どうか重要研究に協力してくれないか",,ui\00_message\quest\q20100002.gmd,\quest\q20100002.arc,q20100002.arc,6
0,,"ここはエルフの古都、エルテ・ディナン！
そう、約300年前に滅びたエルフ族の
築いた都――",,ui\00_message\quest\q20100002.gmd,\quest\q20100002.arc,q20100002.arc,7
0,,"ここにはおそらく、長寿で神秘的な
彼らの知識、そして現在に伝えるべき
遺物や記録がまだまだあるはずだ",,ui\00_message\quest\q20100002.gmd,\quest\q20100002.arc,q20100002.arc,8
0,,"それを首尾良く手に入れて
ここに持ってきてくれないか？",,ui\00_message\quest\q20100002.gmd,\quest\q20100002.arc,q20100002.arc,9
0,,"エルフの歴史を紐とくことは、
君たち覚者にとっても重要だろう？",,ui\00_message\quest\q20100002.gmd,\quest\q20100002.arc,q20100002.arc,10
0,,"――うん？　ああ、謝礼か
そうだな――考えておくよ
その代わり、多くの資料を持ち帰ってくれよ",,ui\00_message\quest\q20100002.gmd,\quest\q20100002.arc,q20100002.arc,11
0,,"ああ、君は覚者の――！
このような所で出会えるとは！
どうか重要研究に協力してくれないか",,ui\00_message\quest\q20100002.gmd,\quest\q20100002.arc,q20100002.arc,12
0,,"ここはエルフの古都、エルテ・ディナン！
そう、約300年前に滅びたエルフ族の
築いた都――",,ui\00_message\quest\q20100002.gmd,\quest\q20100002.arc,q20100002.arc,13
0,,"ここにはおそらく、長寿で神秘的な
彼らの知識、そして現在に伝えるべき
遺物や記録がまだまだあるはずだ",,ui\00_message\quest\q20100002.gmd,\quest\q20100002.arc,q20100002.arc,14
0,,"それを首尾良く手に入れて
ここに持ってきてくれないか？",,ui\00_message\quest\q20100002.gmd,\quest\q20100002.arc,q20100002.arc,15
0,,"エルフの歴史を紐とくことは、
君たち覚者にとっても重要だろう？",,ui\00_message\quest\q20100002.gmd,\quest\q20100002.arc,q20100002.arc,16
0,,"――うん？　ああ、謝礼か
そうだな――考えておくよ",,ui\00_message\quest\q20100002.gmd,\quest\q20100002.arc,q20100002.arc,17
0,,"その代わり、あらゆる資料を
根こそぎ持ち帰ってくれよ？
なに、私が厳重に保管するから大丈夫だ",,ui\00_message\quest\q20100002.gmd,\quest\q20100002.arc,q20100002.arc,18
0,,"ほう――ほうほう――
うん、まあまあ、興味深い――
よし、ゆるゆると研究するか",,ui\00_message\quest\q20100002.gmd,\quest\q20100002.arc,q20100002.arc,19
0,,協力感謝するよ,,ui\00_message\quest\q20100002.gmd,\quest\q20100002.arc,q20100002.arc,20
0,,"へえ――へえええ！
これはなかなか興味深い品々だ
よし、さっそく研究するか",,ui\00_message\quest\q20100002.gmd,\quest\q20100002.arc,q20100002.arc,21
0,,協力感謝するよ,,ui\00_message\quest\q20100002.gmd,\quest\q20100002.arc,q20100002.arc,22
0,,"おお！？　なんと！？
これは凄い――ああ、想像以上だ！",,ui\00_message\quest\q20100002.gmd,\quest\q20100002.arc,q20100002.arc,23
0,,"いてもたってもいられない！
研究だ！　調べ尽くさねば！",,ui\00_message\quest\q20100002.gmd,\quest\q20100002.arc,q20100002.arc,24
0,,"ほら、約束の謝礼だ
さあさあ、邪魔はしないでおくれ",,ui\00_message\quest\q20100002.gmd,\quest\q20100002.arc,q20100002.arc,25
0,,まだかな？　まだかな？,,ui\00_message\quest\q20100002.gmd,\quest\q20100002.arc,q20100002.arc,26
0,,"覚者よ――手を貸してくれ
魔物の身体が欲しいのだ――
もちろん一部でかまわん",,ui\00_message\quest\q20100003.gmd,\quest\q20100003.arc,q20100003.arc,0
0,,"倒して、むしり取り――
ここに持ってくるのだ――",,ui\00_message\quest\q20100003.gmd,\quest\q20100003.arc,q20100003.arc,1
0,,"わたしの求める魔物は
ほれ――こやつだ",,ui\00_message\quest\q20100003.gmd,\quest\q20100003.arc,q20100003.arc,2
0,,"覚者よ――手を貸してくれ
魔物の身体が欲しいのだ――
もちろん一部でかまわん",,ui\00_message\quest\q20100003.gmd,\quest\q20100003.arc,q20100003.arc,3
0,,"倒して、むしり取り――
ここに持ってくるのだ――",,ui\00_message\quest\q20100003.gmd,\quest\q20100003.arc,q20100003.arc,4
0,,"わたしの求める魔物は
ほれ――こやつだ",,ui\00_message\quest\q20100003.gmd,\quest\q20100003.arc,q20100003.arc,5
0,,"魔物は強いが――
倒し方はまかせる",,ui\00_message\quest\q20100003.gmd,\quest\q20100003.arc,q20100003.arc,6
0,,"覚者よ――手を貸してくれ
魔物の身体が欲しいのだ――
もちろん一部でかまわん",,ui\00_message\quest\q20100003.gmd,\quest\q20100003.arc,q20100003.arc,7
0,,"倒して、むしり取り――
ここに持ってくるのだ――",,ui\00_message\quest\q20100003.gmd,\quest\q20100003.arc,q20100003.arc,8
0,,"わたしの求める魔物は
ほれ――こやつだ",,ui\00_message\quest\q20100003.gmd,\quest\q20100003.arc,q20100003.arc,9
0,,"魔物は強いぞ？
ふふ――お前の身体がむしられんよう
せいぜい注意することだ",,ui\00_message\quest\q20100003.gmd,\quest\q20100003.arc,q20100003.arc,10
0,,"なるほど――ほほぅ
こんな魔物が――ははは――なるほど――
まず、煮てみるか――",,ui\00_message\quest\q20100003.gmd,\quest\q20100003.arc,q20100003.arc,11
0,,"なるほど――ほほぅ
こんな魔物が――なるほどこれは強い――
酸を使ってみるか――",,ui\00_message\quest\q20100003.gmd,\quest\q20100003.arc,q20100003.arc,12
0,,"なるほど――ほほぅ
これは強かろう――よく倒したな――
ほう――活きがいい――痛っ――",,ui\00_message\quest\q20100003.gmd,\quest\q20100003.arc,q20100003.arc,13
0,,"引き受けたからには――いいな？
ここで待っているぞ",,ui\00_message\quest\q20100003.gmd,\quest\q20100003.arc,q20100003.arc,14
0,,受注会話,,ui\00_message\quest\q20105008.gmd,\quest\q20105008.arc,q20105008.arc,0
0,,クリア時会話,,ui\00_message\quest\q20105008.gmd,\quest\q20105008.arc,q20105008.arc,1
0,,繰り返し会話,,ui\00_message\quest\q20105008.gmd,\quest\q20105008.arc,q20105008.arc,2
0,,"君か――
ふむ、覚者の君に頼むとしよう",,ui\00_message\quest\q20990000.gmd,\quest\q20990000.arc,q20990000.arc,0
0,,"このメルゴダには錬金術で
強化された魔物がいることは知っているだろう？",,ui\00_message\quest\q20990000.gmd,\quest\q20990000.arc,q20990000.arc,1
0,,"奴ら錬魔は我々の命を収集するため
ディアマンテスにより生み出された
魔物なのだ",,ui\00_message\quest\q20990000.gmd,\quest\q20990000.arc,q20990000.arc,2
0,,どうか、奴らの駆除に手を貸してもらいたい,,ui\00_message\quest\q20990000.gmd,\quest\q20990000.arc,q20990000.arc,3
0,,"君か――
うん、覚者の君に頼むとしよう",,ui\00_message\quest\q20990000.gmd,\quest\q20990000.arc,q20990000.arc,4
0,,"このメルゴダには錬金術で
強化された魔物がいることは知っているだろう？",,ui\00_message\quest\q20990000.gmd,\quest\q20990000.arc,q20990000.arc,5
0,,"奴ら錬魔は我々の命を収集するために
ディアマンテスにより生み出された
魔物なのだ",,ui\00_message\quest\q20990000.gmd,\quest\q20990000.arc,q20990000.arc,6
0,,その中でもひときわ手ごわい奴がいてな,,ui\00_message\quest\q20990000.gmd,\quest\q20990000.arc,q20990000.arc,7
0,,どうか、奴らの駆除に手を貸してもらいたい,,ui\00_message\quest\q20990000.gmd,\quest\q20990000.arc,q20990000.arc,8
0,,"君か――
良いところにきてくれた
世界を窮地から救えるのは君しかいない",,ui\00_message\quest\q20990000.gmd,\quest\q20990000.arc,q20990000.arc,9
0,,"このメルゴダには錬金術で
強化された魔物がいることは知っているだろう？",,ui\00_message\quest\q20990000.gmd,\quest\q20990000.arc,q20990000.arc,10
0,,"その中に、これまで存在しなかった
強力な魔物が混じっているのが見つかったのだ",,ui\00_message\quest\q20990000.gmd,\quest\q20990000.arc,q20990000.arc,11
0,,"メルゴダが地上と繋がって
豊かな命の気配が流れ込んだ影響か――
それとも他の原因があるのか――",,ui\00_message\quest\q20990000.gmd,\quest\q20990000.arc,q20990000.arc,12
0,,"ともかくこのままではこのメルゴダはおろか
そっちの命まで刈り尽くされてしまうだろう",,ui\00_message\quest\q20990000.gmd,\quest\q20990000.arc,q20990000.arc,13
0,,"この世界から輝きが失われる前に
どうか、速やかに奴らを始末してもらいたい",,ui\00_message\quest\q20990000.gmd,\quest\q20990000.arc,q20990000.arc,14
0,,"さすがは覚者
竜に心臓を捧げた者――
見事なものだ",,ui\00_message\quest\q20990000.gmd,\quest\q20990000.arc,q20990000.arc,15
0,,"君の力をもってすれば
このメルゴダもやがて以前の華やかな姿を
取り戻す事ができるかもしれないな",,ui\00_message\quest\q20990000.gmd,\quest\q20990000.arc,q20990000.arc,16
0,,これからも活躍を期待しているよ,,ui\00_message\quest\q20990000.gmd,\quest\q20990000.arc,q20990000.arc,17
0,,"さすがは覚者
竜に心臓を捧げた者――
見事なものだ",,ui\00_message\quest\q20990000.gmd,\quest\q20990000.arc,q20990000.arc,18
0,,"君が力になってくれれば
歪められた錬金術の未来を
元に戻すことができるかもしれないな",,ui\00_message\quest\q20990000.gmd,\quest\q20990000.arc,q20990000.arc,19
0,,これからも活躍を期待しているよ,,ui\00_message\quest\q20990000.gmd,\quest\q20990000.arc,q20990000.arc,20
0,,"さすがは覚者
竜に心臓を捧げた者よ
君以外では近づくこともできなかっただろうね",,ui\00_message\quest\q20990000.gmd,\quest\q20990000.arc,q20990000.arc,21
0,,"君の活躍は我々の仲間だけではなく
レスタニア全土の民の命も救った
心から礼を言わせてもらおう",,ui\00_message\quest\q20990000.gmd,\quest\q20990000.arc,q20990000.arc,22
0,,"だが、今後も同じようなことが――
いや、もっと厄介なことが起こるかもしれない",,ui\00_message\quest\q20990000.gmd,\quest\q20990000.arc,q20990000.arc,23
0,,"その時にはぜひまた君が力を貸してくれることを
期待しているよ",,ui\00_message\quest\q20990000.gmd,\quest\q20990000.arc,q20990000.arc,24
0,,"力およばず、と感じたなら――
素直に退くことも重要だ",,ui\00_message\quest\q20990000.gmd,\quest\q20990000.arc,q20990000.arc,25
0,,いいところに来てくれた――,,ui\00_message\quest\q20990001.gmd,\quest\q20990001.arc,q20990001.arc,0
0,,"君――ご苦労だが
レスタニアからいろいろな物を
ここへ運んできてほしいんだ",,ui\00_message\quest\q20990001.gmd,\quest\q20990001.arc,q20990001.arc,1
0,,"メルゴダとは違う時を刻んだ地には
どんな物が存在するのか知りたくてね",,ui\00_message\quest\q20990001.gmd,\quest\q20990001.arc,q20990001.arc,2
0,,"ああ――何かのついででも構わない
よろしく頼んだよ",,ui\00_message\quest\q20990001.gmd,\quest\q20990001.arc,q20990001.arc,3
0,,いいところに来てくれた――,,ui\00_message\quest\q20990001.gmd,\quest\q20990001.arc,q20990001.arc,4
0,,"君――ご苦労だが
レスタニアからいろいろな物を
ここへ運んできてほしいんだ",,ui\00_message\quest\q20990001.gmd,\quest\q20990001.arc,q20990001.arc,5
0,,"メルゴダとは違う時を刻んだ地には
どんな物が存在するのか知りたくてね",,ui\00_message\quest\q20990001.gmd,\quest\q20990001.arc,q20990001.arc,6
0,,"ああ――特に急いでいるわけではない
よろしく頼んだよ",,ui\00_message\quest\q20990001.gmd,\quest\q20990001.arc,q20990001.arc,7
0,,いいところに来てくれた――,,ui\00_message\quest\q20990001.gmd,\quest\q20990001.arc,q20990001.arc,8
0,,"君――ご苦労だが
レスタニアからいろいろな物を
ここへ運んできてほしいんだ",,ui\00_message\quest\q20990001.gmd,\quest\q20990001.arc,q20990001.arc,9
0,,"メルゴダとは違う時を刻んだ地には
どんな物が存在するのか知りたくてね",,ui\00_message\quest\q20990001.gmd,\quest\q20990001.arc,q20990001.arc,10
0,,"どれも簡単に手に入る品ではないらしい
時間はかかっても良いから
忘れずに頼むよ",,ui\00_message\quest\q20990001.gmd,\quest\q20990001.arc,q20990001.arc,11
0,,"おぉ、これがそうか
ふむ――なるほど――興味深い",,ui\00_message\quest\q20990001.gmd,\quest\q20990001.arc,q20990001.arc,12
0,,――他の品も見てみたくなったな,,ui\00_message\quest\q20990001.gmd,\quest\q20990001.arc,q20990001.arc,13
0,,"なぁ君――
すまないがこれらも――頼むよ",,ui\00_message\quest\q20990001.gmd,\quest\q20990001.arc,q20990001.arc,14
0,,"おぉ、これがそうか
ふむ――なるほど――興味深い",,ui\00_message\quest\q20990001.gmd,\quest\q20990001.arc,q20990001.arc,15
0,,"これを素材にできれば、錬金の新たな世界が
開けるかもしれない",,ui\00_message\quest\q20990001.gmd,\quest\q20990001.arc,q20990001.arc,16
0,,"ありがとう――
また何かあれば頼らせてもらうよ",,ui\00_message\quest\q20990001.gmd,\quest\q20990001.arc,q20990001.arc,17
0,,"おぉ、これがそうか
ふむ――すごいな――興味深い",,ui\00_message\quest\q20990001.gmd,\quest\q20990001.arc,q20990001.arc,18
0,,"これを素材にできれば、錬金の新たな世界が
開けること間違いなしだな",,ui\00_message\quest\q20990001.gmd,\quest\q20990001.arc,q20990001.arc,19
0,,"ありがとう――
また何かあれば頼らせてもらうよ",,ui\00_message\quest\q20990001.gmd,\quest\q20990001.arc,q20990001.arc,20
0,,おぉ、ありがとう――,,ui\00_message\quest\q20990001.gmd,\quest\q20990001.arc,q20990001.arc,21
0,,"なるほど、これらを見るだけでも
今のレスタニアを感じ取る事ができる――",,ui\00_message\quest\q20990001.gmd,\quest\q20990001.arc,q20990001.arc,22
0,,"興味は尽きないな
君に頼ってよかった、感謝するよ",,ui\00_message\quest\q20990001.gmd,\quest\q20990001.arc,q20990001.arc,23
0,,"どうだい？
何か手に入ったかい？",,ui\00_message\quest\q20990001.gmd,\quest\q20990001.arc,q20990001.arc,24
0,,貴方の力を見込んで、頼みがあるのです,,ui\00_message\quest\q20990002.gmd,\quest\q20990002.arc,q20990002.arc,0
0,,"メルゴダ王宮に残る資料を
回収してきて頂きたいのです",,ui\00_message\quest\q20990002.gmd,\quest\q20990002.arc,q20990002.arc,1
0,,"資料の残されている区画には
今も王宮を守る番人がいます",,ui\00_message\quest\q20990002.gmd,\quest\q20990002.arc,q20990002.arc,2
0,,"私たちの力では、その者たちを
退ける事ができません
どうか、よろしくお願いいたします",,ui\00_message\quest\q20990002.gmd,\quest\q20990002.arc,q20990002.arc,3
0,,貴方の力を見込んで、頼みがあるのです,,ui\00_message\quest\q20990002.gmd,\quest\q20990002.arc,q20990002.arc,4
0,,"メルゴダ王宮に残る資料を
回収してきて頂きたいのです",,ui\00_message\quest\q20990002.gmd,\quest\q20990002.arc,q20990002.arc,5
0,,"資料の残されている区画には
今も王宮を守る手練の番人がいます",,ui\00_message\quest\q20990002.gmd,\quest\q20990002.arc,q20990002.arc,6
0,,"私たちの力では、その者たちを
退ける事ができません
どうか、よろしくお願いいたします",,ui\00_message\quest\q20990002.gmd,\quest\q20990002.arc,q20990002.arc,7
0,,貴方の力を見込んで、頼みがあるのです,,ui\00_message\quest\q20990002.gmd,\quest\q20990002.arc,q20990002.arc,8
0,,"メルゴダ王宮に残る資料を
回収してきて頂きたいのです",,ui\00_message\quest\q20990002.gmd,\quest\q20990002.arc,q20990002.arc,9
0,,"資料の残されている区画には
今も王宮を守る恐ろしい番人がいます",,ui\00_message\quest\q20990002.gmd,\quest\q20990002.arc,q20990002.arc,10
0,,"番人は王の無きあとも
ずっと王宮を守り続けているのです",,ui\00_message\quest\q20990002.gmd,\quest\q20990002.arc,q20990002.arc,11
0,,"私たちの力では、その者たちを
退ける事ができません
どうか、よろしくお願いいたします",,ui\00_message\quest\q20990002.gmd,\quest\q20990002.arc,q20990002.arc,12
0,,あぁ、感謝いたします,,ui\00_message\quest\q20990002.gmd,\quest\q20990002.arc,q20990002.arc,13
0,,"少しでもこのメルゴダに満ちる
錬金が生み出した歪みを正したい――",,ui\00_message\quest\q20990002.gmd,\quest\q20990002.arc,q20990002.arc,14
0,,けして錬金術は、悪しきものではないのです,,ui\00_message\quest\q20990002.gmd,\quest\q20990002.arc,q20990002.arc,15
0,,あぁ、感謝いたします,,ui\00_message\quest\q20990002.gmd,\quest\q20990002.arc,q20990002.arc,16
0,,"少しでもこのメルゴダに満ちる
錬金が生み出した歪みを正したい――",,ui\00_message\quest\q20990002.gmd,\quest\q20990002.arc,q20990002.arc,17
0,,"ここに集う錬金術師、みなの願いです
けして錬金術は、悪しきものではないのです",,ui\00_message\quest\q20990002.gmd,\quest\q20990002.arc,q20990002.arc,18
0,,あぁ、感謝いたします,,ui\00_message\quest\q20990002.gmd,\quest\q20990002.arc,q20990002.arc,19
0,,"少しでもこのメルゴダに満ちる
錬金が生み出した歪みを正したい――",,ui\00_message\quest\q20990002.gmd,\quest\q20990002.arc,q20990002.arc,20
0,,"錬金術師の作り出した歪みは
錬金術師が修復する――",,ui\00_message\quest\q20990002.gmd,\quest\q20990002.arc,q20990002.arc,21
0,,それが残された私たちの覚悟です,,ui\00_message\quest\q20990002.gmd,\quest\q20990002.arc,q20990002.arc,22
0,,どうか無理はなさらぬよう――,,ui\00_message\quest\q20990002.gmd,\quest\q20990002.arc,q20990002.arc,23
0,,"地上の方、もしよければ
力を貸してください",,ui\00_message\quest\q20990003.gmd,\quest\q20990003.arc,q20990003.arc,0
0,,"この地の南、今は廃墟となった地域がありますが
今は亡き住民が残した品があれば
持ち帰って頂きたいのです",,ui\00_message\quest\q20990003.gmd,\quest\q20990003.arc,q20990003.arc,1
0,,"ただ廃墟やそれまでの道すがらには
数多の魔物が潜んでいて
常に危険を伴うのです",,ui\00_message\quest\q20990003.gmd,\quest\q20990003.arc,q20990003.arc,2
0,,"急ぎはしません
頭の片隅にでもとどめておいてください",,ui\00_message\quest\q20990003.gmd,\quest\q20990003.arc,q20990003.arc,3
0,,"地上の方、もしよければ
力を貸してください",,ui\00_message\quest\q20990003.gmd,\quest\q20990003.arc,q20990003.arc,4
0,,"この地の南、今は廃墟となった地域がありますが
今は亡き住民が残した品があれば
持ち帰って頂きたいのです",,ui\00_message\quest\q20990003.gmd,\quest\q20990003.arc,q20990003.arc,5
0,,"ただ廃墟やそれまでの道すがらには
数多の魔物が潜んでいて
大きな危険を伴うのです",,ui\00_message\quest\q20990003.gmd,\quest\q20990003.arc,q20990003.arc,6
0,,"急ぎはしません
頭の片隅にでもとどめておいてください",,ui\00_message\quest\q20990003.gmd,\quest\q20990003.arc,q20990003.arc,7
0,,"地上の方、もしよければ
力を貸してください",,ui\00_message\quest\q20990003.gmd,\quest\q20990003.arc,q20990003.arc,8
0,,"この地の南、今は廃墟となった地域がありますが
今は亡き住民が残した品があれば
持ち帰って頂きたいのです",,ui\00_message\quest\q20990003.gmd,\quest\q20990003.arc,q20990003.arc,9
0,,"ただ廃墟やそれまでの道すがらには
数多の恐ろしい魔物が潜んでいて
非常に大きな危険を伴うのです
それゆえあまり遺品の回収は進んでいません",,ui\00_message\quest\q20990003.gmd,\quest\q20990003.arc,q20990003.arc,10
0,,"急ぎはしません
頭の片隅にでもとどめておいてください",,ui\00_message\quest\q20990003.gmd,\quest\q20990003.arc,q20990003.arc,11
