#Index,Key,MsgJp,MsgEn,GmdPath,ArcPath,ArcName,ReadIndex
0,,"おまえたちの正しさ、身の証が示されるまでは
全てを信じることなど、とても叶わぬことよ",,ui\00_message\quest\q00020170.gmd,\quest\q00020170.arc,q00020170.arc,23
0,,我らが族長ピサルの指示に従うより道はない,,ui\00_message\quest\q00020170.gmd,\quest\q00020170.arc,q00020170.arc,24
0,,――それがおまえたちの戦服なのか？,,ui\00_message\quest\q00020170.gmd,\quest\q00020170.arc,q00020170.arc,25
0,,"我らのダナ村は戦士の村
おかしな真似をすると、全身に槍が突き刺さる
それを忘れるなよ",,ui\00_message\quest\q00020170.gmd,\quest\q00020170.arc,q00020170.arc,26
0,,"古来より伝わる方法とかで
身の証が立つなんて単純な世界だね",,ui\00_message\quest\q00020170.gmd,\quest\q00020170.arc,q00020170.arc,27
0,,"まずはなんにせよ、俺たちのこと
信じて貰うしかないですね",,ui\00_message\quest\q00020170.gmd,\quest\q00020170.arc,q00020170.arc,28
0,,"ガルドリンも囚われのままですし
今、我々が、最優先すべき事案です",,ui\00_message\quest\q00020170.gmd,\quest\q00020170.arc,q00020170.arc,29
0,,"セシリーの友達だね
もう、礎の解放は済んだのかい？",,ui\00_message\quest\q00020170.gmd,\quest\q00020170.arc,q00020170.arc,30
0,,"あたしはね、セシリーがちっちゃい頃から
彼女のチャンバラの相手をしてやってたんだ",,ui\00_message\quest\q00020170.gmd,\quest\q00020170.arc,q00020170.arc,31
0,,"この村の連中は考えがちょっと古臭いけれど
悪い奴はいない
だから恨まないでやってくれ",,ui\00_message\quest\q00020170.gmd,\quest\q00020170.arc,q00020170.arc,32
0,,"ああ、身の証のことだけれど、それに詳しい奴を
紹介するよ、いいって任しときな",,ui\00_message\quest\q00020170.gmd,\quest\q00020170.arc,q00020170.arc,33
0,,"そいつは精霊を呼び込む槍の名手でね
今は村を出て、この先にある丘の上に
住居を構えているよ",,ui\00_message\quest\q00020170.gmd,\quest\q00020170.arc,q00020170.arc,34
0,,"アデルドナハって男さ
槍について、この男の右に出るものはないね",,ui\00_message\quest\q00020170.gmd,\quest\q00020170.arc,q00020170.arc,35
0,,"なに、あんたなら無事、身の証を立てれると
思ってるよ",,ui\00_message\quest\q00020170.gmd,\quest\q00020170.arc,q00020170.arc,36
0,,"それとは別で、あんたには相談したいことが
色々あるんだ、良かったら聞いてくれるかい？",,ui\00_message\quest\q00020170.gmd,\quest\q00020170.arc,q00020170.arc,37
0,,"身の証を示すために、アデルドナハのもとへ
お願いします",,ui\00_message\quest\q00020170.gmd,\quest\q00020170.arc,q00020170.arc,38
0,,"ほう――貴様か
ラザネイルの使いが伝えてきた者とは",,ui\00_message\quest\q00020170.gmd,\quest\q00020170.arc,q00020170.arc,39
0,,"身の証を立てたいそうだな、一向に構わん
如何なる者でも止めはしない
自身を証明するための試練なのだからな",,ui\00_message\quest\q00020170.gmd,\quest\q00020170.arc,q00020170.arc,40
0,,"ここより西にある“ダナウィンの挑堂”に
向かうが良い",,ui\00_message\quest\q00020170.gmd,\quest\q00020170.arc,q00020170.arc,41
0,,"貴様が証に足る器を備えていれば
挑堂にて襲いかかる試練に、打ち勝つことが
できるだろう",,ui\00_message\quest\q00020170.gmd,\quest\q00020170.arc,q00020170.arc,42
0,,ほう――あの魔物を倒したのか！？,,ui\00_message\quest\q00020170.gmd,\quest\q00020170.arc,q00020170.arc,43
0,,"ならばこれより先、おまえたちの言葉は
真実の響きを持つことになるだろう
心して、語るがいい",,ui\00_message\quest\q00020170.gmd,\quest\q00020170.arc,q00020170.arc,44
0,,"疑いは晴れた
数々の無礼を許してくれ
我々の心は少々疲れ、荒んでいたようだ",,ui\00_message\quest\q00020170.gmd,\quest\q00020170.arc,q00020170.arc,45
0,,"我々は竜を崇め“芯なる樹”を守ってきた
その“芯なる樹”が、ある日病気になったのだ",,ui\00_message\quest\q00020170.gmd,\quest\q00020170.arc,q00020170.arc,46
0,,"そしてセシリー、おまえが消えてほどなく
竜も気が触れてしまった",,ui\00_message\quest\q00020170.gmd,\quest\q00020170.arc,q00020170.arc,47
0,,"“芯なる樹”が放つ淀んだ竜力は
我らの竜、ウィルミアをも侵したのだ",,ui\00_message\quest\q00020170.gmd,\quest\q00020170.arc,q00020170.arc,48
0,,"同時に、竜力は大地を巡り
多くの魔物を侵食魔へと変えてしまった",,ui\00_message\quest\q00020170.gmd,\quest\q00020170.arc,q00020170.arc,49
0,,"行き違いがあったが、許して欲しい
よくぞ戻ったと言わせてくれ",,ui\00_message\quest\q00020170.gmd,\quest\q00020170.arc,q00020170.arc,50
0,,"“芯なる樹”の治療のため、この瞬間も
どこかで奮闘しているおまえの父――
ガラダも安心することだろうよ",,ui\00_message\quest\q00020170.gmd,\quest\q00020170.arc,q00020170.arc,51
0,,"我らの幾多の無礼を許し
ガラダとその娘セシリー
そして竜とフィンダムと我々に力を貸してほしい",,ui\00_message\quest\q00020170.gmd,\quest\q00020170.arc,q00020170.arc,52
0,,"やっぱり思った通りだよ
あんたならやれると分かってた",,ui\00_message\quest\q00020170.gmd,\quest\q00020170.arc,q00020170.arc,53
0,,"あんたがこの村に来たことは
あたしは“きっかけ”だと思ってるんだ",,ui\00_message\quest\q00020170.gmd,\quest\q00020170.arc,q00020170.arc,54
0,,"この村が、そしてフィンダムが、もっとずっと
良い方向に舵を切るための“きっかけ”なんだってさ",,ui\00_message\quest\q00020170.gmd,\quest\q00020170.arc,q00020170.arc,55
0,,"族長の無礼を許してくれ
もしも俺の無礼も気になるようなら――
寛大な心で許してほしい",,ui\00_message\quest\q00020170.gmd,\quest\q00020170.arc,q00020170.arc,56
0,,――フン、戦服の美しさは、我々の勝ちだ！,,ui\00_message\quest\q00020170.gmd,\quest\q00020170.arc,q00020170.arc,57
0,,"アデルドナハがあんたたちを認めたんだ
だから、俺も認めるよ
何しろ、アデルドナハが認めたんだからな",,ui\00_message\quest\q00020170.gmd,\quest\q00020170.arc,q00020170.arc,58
0,,"レスタニアでもゾッとしねえのに
こんなところで囚われの身なんてのは
二度とごめんだぜ",,ui\00_message\quest\q00020170.gmd,\quest\q00020170.arc,q00020170.arc,59
0,,"行方のわからないロイグのことは
この人たちに頼んで――
わたしは父を探しに行きます",,ui\00_message\quest\q00020170.gmd,\quest\q00020170.arc,q00020170.arc,60
0,,"だいじょうぶです
連絡は絶やしませんから安心してください",,ui\00_message\quest\q00020170.gmd,\quest\q00020170.arc,q00020170.arc,61
0,,"父は尊敬に値する立派な人ですが
屈強な戦士というわけではありません",,ui\00_message\quest\q00020170.gmd,\quest\q00020170.arc,q00020170.arc,62
0,,"危険な旅をしているなら手助けが
必要なんです",,ui\00_message\quest\q00020170.gmd,\quest\q00020170.arc,q00020170.arc,63
0,,"このフィンダムでも一定の地位というか
身分が確保できったってことかな？
少しは動きやすくなればいいけど",,ui\00_message\quest\q00020170.gmd,\quest\q00020170.arc,q00020170.arc,64
0,,"ガルドリンと一緒ではなかったとなると
ロイグはどこにいるんでしょうね
無事だといいんだけど",,ui\00_message\quest\q00020170.gmd,\quest\q00020170.arc,q00020170.arc,65
0,,"フィンダムの人たちとの交流が
始まったというわけか",,ui\00_message\quest\q00020170.gmd,\quest\q00020170.arc,q00020170.arc,66
0,,"言動には気をつけてくれよ？
今のところ君たちを通じて、彼らは
レスタニアを知ることになるんだ",,ui\00_message\quest\q00020170.gmd,\quest\q00020170.arc,q00020170.arc,67
0,,"なんとまあ――
偏屈な種族がいたものだな",,ui\00_message\quest\q00020170.gmd,\quest\q00020170.arc,q00020170.arc,68
0,,"いや、向こうから見ると、こちらの世界の方が
よほど奇妙に見えるということか",,ui\00_message\quest\q00020170.gmd,\quest\q00020170.arc,q00020170.arc,69
0,,"ともあれ、ひとつの集落と信頼を結び得たのは
何よりの報告だ",,ui\00_message\quest\q00020170.gmd,\quest\q00020170.arc,q00020170.arc,70
0,,"ふむ――
いやいや！
土産話はうれしいが、戻り、フィンダムの
力になってやれ",,ui\00_message\quest\q00020170.gmd,\quest\q00020170.arc,q00020170.arc,71
0,,フィンダムの住民たちはどんな様子だ？,,ui\00_message\quest\q00020180.gmd,\quest\q00020180.arc,q00020180.arc,0
0,,"我々とは歩んできた歴史が違う
よって、生きる上での思想も異なることだろう",,ui\00_message\quest\q00020180.gmd,\quest\q00020180.arc,q00020180.arc,1
0,,"せっかくの機会だから、よく学んで来るといい
しかし、おかしな影響を受けぬようにな
特に、エリオットやリズは心配だ",,ui\00_message\quest\q00020180.gmd,\quest\q00020180.arc,q00020180.arc,2
0,,ロイグの安否はまだわからないのだな？,,ui\00_message\quest\q00020180.gmd,\quest\q00020180.arc,q00020180.arc,3
0,,"世界の存亡という大きな危機の前では
個人の行方など小さな問題かもしれん",,ui\00_message\quest\q00020180.gmd,\quest\q00020180.arc,q00020180.arc,4
0,,"しかし、だからこそ、忘れるな？
常に心に留めておくのだぞ",,ui\00_message\quest\q00020180.gmd,\quest\q00020180.arc,q00020180.arc,5
0,,"フィンダムの問題解決のために
すでに動き出している人たちがいるという
ことだよね？",,ui\00_message\quest\q00020180.gmd,\quest\q00020180.arc,q00020180.arc,6
0,,"それがセシリーのお父さんということは
彼女にも何か役割があったのかもなあ",,ui\00_message\quest\q00020180.gmd,\quest\q00020180.arc,q00020180.arc,7
0,,"村中を訊いて回ったのですが
父の行き先はまだわかりません",,ui\00_message\quest\q00020180.gmd,\quest\q00020180.arc,q00020180.arc,8
0,,"わたしは、故郷のモルフォールへ
帰ろうと思います
道中、父の手がかりを探すつもりですが――",,ui\00_message\quest\q00020180.gmd,\quest\q00020180.arc,q00020180.arc,9
0,,"隊長、お願いです
わたしとは別の道で、モルフォールを
目指してください",,ui\00_message\quest\q00020180.gmd,\quest\q00020180.arc,q00020180.arc,10
0,,"エラン水林一帯の調査に出向いていた
エリアマスターのミューセルが、礎近くの一軒家
“守り人の庵”に戻ってきたそうです",,ui\00_message\quest\q00020180.gmd,\quest\q00020180.arc,q00020180.arc,11
0,,"ミューセルはあの辺りの情報に精通しています
彼女と会い、話しを聞いて頂けませんか？",,ui\00_message\quest\q00020180.gmd,\quest\q00020180.arc,q00020180.arc,12
0,,"父――あるいは父が残した痕跡が
見つかるかもしれません",,ui\00_message\quest\q00020180.gmd,\quest\q00020180.arc,q00020180.arc,13
0,,"我々ダナの者は皆、勇敢な戦士だが
竜と戦うことだけはできないいのだ",,ui\00_message\quest\q00020180.gmd,\quest\q00020180.arc,q00020180.arc,14
0,,"もちろん、恐怖心が原因ではない
竜との戦いなど、想像の外
我らの感情としては禁忌が最も近い",,ui\00_message\quest\q00020180.gmd,\quest\q00020180.arc,q00020180.arc,15
0,,"当面の目的は、セシリーの父親ガラダの
捜索ってことでいいな？",,ui\00_message\quest\q00020180.gmd,\quest\q00020180.arc,q00020180.arc,16
0,,"ここの人たち、勇敢な戦士というのは
ウソじゃないと思うけど――",,ui\00_message\quest\q00020180.gmd,\quest\q00020180.arc,q00020180.arc,17
0,,"考えているのは、武器がぶつかり合う
戦いのことばかりで、相手の素性とか
真相を探るとか、全部、人任せみたい",,ui\00_message\quest\q00020180.gmd,\quest\q00020180.arc,q00020180.arc,18
0,,"ロイグはどこにいるんでしょうねえ
無事だといいなあ",,ui\00_message\quest\q00020180.gmd,\quest\q00020180.arc,q00020180.arc,19
0,,"そうですか
セシリーが無事に帰ってきたのですね",,ui\00_message\quest\q00020180.gmd,\quest\q00020180.arc,q00020180.arc,20
0,,そして、あなたが噂のレスタニアの覚者さま――,,ui\00_message\quest\q00020180.gmd,\quest\q00020180.arc,q00020180.arc,21
0,,"ええ、はい――
残念ですが、エラン水林に族長ガラダが訪れた
形跡はありません",,ui\00_message\quest\q00020180.gmd,\quest\q00020180.arc,q00020180.arc,22
0,,"おそらく、まだ誰も足を踏み入れたことのない地へ
向かわれたのかも知れません",,ui\00_message\quest\q00020180.gmd,\quest\q00020180.arc,q00020180.arc,23
0,,"ひとまずは、あなたもセシリーを追い
モルフォールへ向かわれると良いでしょう",,ui\00_message\quest\q00020180.gmd,\quest\q00020180.arc,q00020180.arc,24
0,,"モルフォールへ向かうには
水林の桟橋に立つ、船頭のトレアサにお会いください",,ui\00_message\quest\q00020180.gmd,\quest\q00020180.arc,q00020180.arc,25
0,,この守り人の庵は、あなたをいつでも歓迎します,,ui\00_message\quest\q00020180.gmd,\quest\q00020180.arc,q00020180.arc,26
0,,"ミューセルの紹介ですね
分かりました、対岸へ渡しましょう",,ui\00_message\quest\q00020180.gmd,\quest\q00020180.arc,q00020180.arc,27
0,,"客人よ、何もないところだが
我が家だと思って寛いでくれ",,ui\00_message\quest\q00020180.gmd,\quest\q00020180.arc,q00020180.arc,28
0,,"ロイグ？　俺はあまり良い印象がないな
ほら、なんだか、暗いだろう？
気づかなかったかい？",,ui\00_message\quest\q00020180.gmd,\quest\q00020180.arc,q00020180.arc,29
0,,"人は“芯なる樹”、精霊竜ウィルミア
そしてこの大地の奉仕者です",,ui\00_message\quest\q00020180.gmd,\quest\q00020180.arc,q00020180.arc,30
0,,"我々は“芯なる樹”を中心とする“精霊の地”を守り
精霊竜の世話をして暮らしてきました",,ui\00_message\quest\q00020180.gmd,\quest\q00020180.arc,q00020180.arc,31
0,,"しかし、今、すべてを失うかもしれないという恐怖に
直面しています",,ui\00_message\quest\q00020180.gmd,\quest\q00020180.arc,q00020180.arc,32
0,,"“芯なる樹”が病に侵されても
豊かな竜力が癒やすだろうと期待していましたが
病はそんな生易しいものではなかった",,ui\00_message\quest\q00020180.gmd,\quest\q00020180.arc,q00020180.arc,33
0,,"そこで精霊竜は、自らの、浄化の力で
“芯なる樹”を癒やそうとしたようです",,ui\00_message\quest\q00020180.gmd,\quest\q00020180.arc,q00020180.arc,34
0,,"しかし竜の力を持ってしてもかなわず――
病は竜の正気まで奪ってしまいました",,ui\00_message\quest\q00020180.gmd,\quest\q00020180.arc,q00020180.arc,35
0,,"――今の我々に残された希望は
古文書の記述の中からガラダが見つけた
《原始の雫》だけなのです",,ui\00_message\quest\q00020180.gmd,\quest\q00020180.arc,q00020180.arc,36
0,,"あらゆる毒素を中和するという
“芯なる樹”が誕生した時代の水――
それが《原始の雫》です",,ui\00_message\quest\q00020180.gmd,\quest\q00020180.arc,q00020180.arc,37
0,,"みなさんも我々と一緒に
ガラダが《原始の雫》を手にして
帰還することを祈って頂ければ――",,ui\00_message\quest\q00020180.gmd,\quest\q00020180.arc,q00020180.arc,38
0,,"《原始の雫》は書物に記述があるだけで
実際にはどうなのか――",,ui\00_message\quest\q00020180.gmd,\quest\q00020180.arc,q00020180.arc,39
0,,"そう不安視する者も多いようですが
わたしは信じています",,ui\00_message\quest\q00020180.gmd,\quest\q00020180.arc,q00020180.arc,40
0,,"出立を止めはしないが
しっかり休んでからにしてくれ",,ui\00_message\quest\q00020180.gmd,\quest\q00020180.arc,q00020180.arc,41
0,,"なかなか――
思い通りに、事は進んでくれませんね",,ui\00_message\quest\q00020180.gmd,\quest\q00020180.arc,q00020180.arc,42
0,,"ここに初めて来た時はまだ子供で――
しかも、迷子になって、たどり着いたんです",,ui\00_message\quest\q00020180.gmd,\quest\q00020180.arc,q00020180.arc,43
0,,"それがいつの間にか――
迷うと、ここに来るようになりました",,ui\00_message\quest\q00020180.gmd,\quest\q00020180.arc,q00020180.arc,44
0,,"ガラダはまだ戻らないというわけか
助けが必要なのかもしれないな",,ui\00_message\quest\q00020180.gmd,\quest\q00020180.arc,q00020180.arc,45
0,,まだ待機か？　気にくわねえな,,ui\00_message\quest\q00020180.gmd,\quest\q00020180.arc,q00020180.arc,46
0,,隊長、わたし、やっと理解できたかも,,ui\00_message\quest\q00020180.gmd,\quest\q00020180.arc,q00020180.arc,47
0,,"わたしたちが協力しているのは
フィンダムを救うための戦いなんだけど
同時に、フィンダムの人たちが自分自身を
変えようとする戦いでもある",,ui\00_message\quest\q00020180.gmd,\quest\q00020180.arc,q00020180.arc,48
0,,"よくないことが起こっても
運命だから仕方がない――
報いだから当然――",,ui\00_message\quest\q00020180.gmd,\quest\q00020180.arc,q00020180.arc,49
0,,"そんな風に考えて受け入れてしまう
流されるような生き方との戦い",,ui\00_message\quest\q00020180.gmd,\quest\q00020180.arc,q00020180.arc,50
0,,これ、わたしとしては応援するしかないな,,ui\00_message\quest\q00020180.gmd,\quest\q00020180.arc,q00020180.arc,51
0,,"族長のガラダは皆からの信頼が厚いようです
早く会ってみたいですね",,ui\00_message\quest\q00020180.gmd,\quest\q00020180.arc,q00020180.arc,52
0,,というか、会えないと最悪の事態ですよね――,,ui\00_message\quest\q00020180.gmd,\quest\q00020180.arc,q00020180.arc,53
0,,"原始の雫――
古代の湧水地でのみ採取可能な物質――",,ui\00_message\quest\q00020180.gmd,\quest\q00020180.arc,q00020180.arc,54
0,,ごめん、僕の知識にはまったくないね,,ui\00_message\quest\q00020180.gmd,\quest\q00020180.arc,q00020180.arc,55
0,,無事で何よりだ,,ui\00_message\quest\q00020180.gmd,\quest\q00020180.arc,q00020180.arc,56
0,,ふむ――なんと――,,ui\00_message\quest\q00020180.gmd,\quest\q00020180.arc,q00020180.arc,57
0,,"大地は病み、竜は正気を失う――
竜力は腐り、毒と化して世界を巡る――
想像を絶する災害だな",,ui\00_message\quest\q00020180.gmd,\quest\q00020180.arc,q00020180.arc,58
0,,"セシリーが我々の下に来たのは――
そのようなことがレスタニアにも起こりうるという
警告なのかもしれんぞ",,ui\00_message\quest\q00020180.gmd,\quest\q00020180.arc,q00020180.arc,59
0,,"だとすれば、我々はフィンダムの竜に
感謝すべきだろうな",,ui\00_message\quest\q00020180.gmd,\quest\q00020180.arc,q00020180.arc,60
0,,時に――,,ui\00_message\quest\q00020190.gmd,\quest\q00020190.arc,q00020190.arc,0
0,,"ガルドリン、エリオット、リズの３人は
ずいぶん頼もしくなったようだな",,ui\00_message\quest\q00020190.gmd,\quest\q00020190.arc,q00020190.arc,1
0,,立場が人を作るとは、よく言ったものだ,,ui\00_message\quest\q00020190.gmd,\quest\q00020190.arc,q00020190.arc,2
0,,"さあ、早く行ってやりなさい
おまえを必要としているのは
部下たちだけではないだろう？",,ui\00_message\quest\q00020190.gmd,\quest\q00020190.arc,q00020190.arc,3
0,,"もちろん、エリオットたちだけではない
誰よりも、おまえ自身の顔つきが変わってきたよ
ああ、いい顔をしているぞ",,ui\00_message\quest\q00020190.gmd,\quest\q00020190.arc,q00020190.arc,4
0,,"セシリーのお父さん、無事だといいね
というか、早く行ってあげた方がよくない？",,ui\00_message\quest\q00020190.gmd,\quest\q00020190.arc,q00020190.arc,5
0,,"隊長、父の行き先がわかったんです！
父はここから遥か東の“キンガル峡谷”へ
向かったそうです",,ui\00_message\quest\q00020190.gmd,\quest\q00020190.arc,q00020190.arc,6
0,,"わたしは父を探しながら先行するつもりですが
東の地で、隊長たちが一緒にいて
くれればどれほど心強いか――",,ui\00_message\quest\q00020190.gmd,\quest\q00020190.arc,q00020190.arc,7
0,,"“キンガル峡谷”への道筋の段取りは
既にアルトフェイルが手配してくれています",,ui\00_message\quest\q00020190.gmd,\quest\q00020190.arc,q00020190.arc,8
0,,"ガラダが向かった“キンガル峡谷”は
ここより遥か東の地
ダナ村のあるファーラナ平原を越えた
その先にあります",,ui\00_message\quest\q00020190.gmd,\quest\q00020190.arc,q00020190.arc,9
0,,"ファーラナ平原よりキンガル峡谷へ通じる
関所の門は、既に開放されました",,ui\00_message\quest\q00020190.gmd,\quest\q00020190.arc,q00020190.arc,10
0,,"“キンガル峡谷”へ辿り着いたならば
まずは峡谷にある水辺の集落“グリンデュア”へ
向かうのです",,ui\00_message\quest\q00020190.gmd,\quest\q00020190.arc,q00020190.arc,11
0,,"そこで“グリンデュア”の族長である
キアランを訪ねると良いでしょう",,ui\00_message\quest\q00020190.gmd,\quest\q00020190.arc,q00020190.arc,12
0,,"みんなと先行して、東の地で待っています
ぜひ、お願いします！",,ui\00_message\quest\q00020190.gmd,\quest\q00020190.arc,q00020190.arc,13
0,,さあ、行こうぜ,,ui\00_message\quest\q00020190.gmd,\quest\q00020190.arc,q00020190.arc,14
0,,"ここの連中、賭け事は嫌いらしい
退屈の極みだ！",,ui\00_message\quest\q00020190.gmd,\quest\q00020190.arc,q00020190.arc,15
0,,"セシリーのお父さんには護衛がついているそうだけど
どんな護衛だって、わたしたち覚者に比べたら
“いないよりマシ”って程度だと思うんだ",,ui\00_message\quest\q00020190.gmd,\quest\q00020190.arc,q00020190.arc,16
0,,ね、隊長、早く行ってあげようよ,,ui\00_message\quest\q00020190.gmd,\quest\q00020190.arc,q00020190.arc,17
0,,"ロイグの捜索には、このモルフォール村から
有志による捜索隊が出ています",,ui\00_message\quest\q00020190.gmd,\quest\q00020190.arc,q00020190.arc,18
0,,"だから、俺たちは東にある“キンガル峡谷”を
目指しましょう",,ui\00_message\quest\q00020190.gmd,\quest\q00020190.arc,q00020190.arc,19
0,,"グリンデュアへようこそ
貴君たちの噂は既にここにも届いている",,ui\00_message\quest\q00020190.gmd,\quest\q00020190.arc,q00020190.arc,20
0,,"この地の礎を解放されたのであれば
我らも貴君達のこの地のエリアの活動に合わせ
準備にかかるとしよう",,ui\00_message\quest\q00020190.gmd,\quest\q00020190.arc,q00020190.arc,21
0,,"そう、モルフォールの族長、ガラダの行方に
ついてだが――",,ui\00_message\quest\q00020190.gmd,\quest\q00020190.arc,q00020190.arc,22
0,,"彼はこの地で様々な調査を重ね
そして数日前、いにしえよりこの地に存在する
古代神殿――
“シェドレアン大神殿”へと向かった",,ui\00_message\quest\q00020190.gmd,\quest\q00020190.arc,q00020190.arc,23
0,,"セシリーと貴君の連れ立ちも既に向かっている
早く行ってあげるといい",,ui\00_message\quest\q00020190.gmd,\quest\q00020190.arc,q00020190.arc,24
0,,"ガラダは実に立派なお人だ
我らもガラダへの協力を惜しむつもりはない",,ui\00_message\quest\q00020190.gmd,\quest\q00020190.arc,q00020190.arc,25
0,,"道中、父の姿はありませんでした
すでに神殿の中に入ってしまったようです",,ui\00_message\quest\q00020190.gmd,\quest\q00020190.arc,q00020190.arc,26
0,,"それに、ひどく胸騒ぎがするんです
急ぎましょう――",,ui\00_message\quest\q00020190.gmd,\quest\q00020190.arc,q00020190.arc,27
0,,"こういう古い土地には、結構ヤバいのが
棲みついている",,ui\00_message\quest\q00020190.gmd,\quest\q00020190.arc,q00020190.arc,28
0,,"古今東西、たぶん、土地が変わっても通用する
生きる知恵だ――いいな？　気張っていけ",,ui\00_message\quest\q00020190.gmd,\quest\q00020190.arc,q00020190.arc,29
0,,"セシリーのお父さんでもあるガラダ族長は
フィンダムに暮らす全ての部族から
信頼されているんだって",,ui\00_message\quest\q00020190.gmd,\quest\q00020190.arc,q00020190.arc,30
0,,"つまり――
もしものことがあったら、大変なことになるよね",,ui\00_message\quest\q00020190.gmd,\quest\q00020190.arc,q00020190.arc,31
0,,"道中にもこのあたりにも、野営の痕跡が
ありませんでした",,ui\00_message\quest\q00020190.gmd,\quest\q00020190.arc,q00020190.arc,32
0,,"つまり、ガラダ族長たちは、かなり急いだわけで
そうなると、疲労の度合いが心配です
隊長、俺たち、急いだ方がいいですよ？",,ui\00_message\quest\q00020190.gmd,\quest\q00020190.arc,q00020190.arc,33
