#Index,Key,MsgJp,MsgEn,GmdPath,ArcPath,ArcName,ReadIndex
0,,"もうあの島では助けてはやれぬ
それを知った上で、己の心に従え",,ui\00_message\quest\q00020110.gmd,\quest\q00020110.arc,q00020110.arc,1
0,,"わたしは、君たちが知らない
あの島の光に近い、上陸場所を知っている",,ui\00_message\quest\q00020110.gmd,\quest\q00020110.arc,q00020110.arc,2
0,,病気治療の礼もある、喜んで案内させて貰うよ,,ui\00_message\quest\q00020110.gmd,\quest\q00020110.arc,q00020110.arc,3
0,,"隊長、ガルドリンの言うとおりだよ？
絶対黒騎士がいるよ
どうするつもり？",,ui\00_message\quest\q00020110.gmd,\quest\q00020110.arc,q00020110.arc,4
0,,隊長、行くだけ、行きませんか？,,ui\00_message\quest\q00020110.gmd,\quest\q00020110.arc,q00020110.arc,5
0,,"様子見というか偵察というか――
進むより、退くことを考えながら行くんです",,ui\00_message\quest\q00020110.gmd,\quest\q00020110.arc,q00020110.arc,6
0,,"あの光に近付くことは
大きな危険を伴う賭けでしかない――",,ui\00_message\quest\q00020110.gmd,\quest\q00020110.arc,q00020110.arc,7
0,,どうも嫌な予感がするぞ,,ui\00_message\quest\q00020110.gmd,\quest\q00020110.arc,q00020110.arc,8
0,,"もし島へ行くことになったら
不思議な光というか光源というか――
それをよく見てきてくれないか？",,ui\00_message\quest\q00020110.gmd,\quest\q00020110.arc,q00020110.arc,9
0,,"セシリーの顔は、ありゃあ覚悟を決めた顔
止めても聞く耳持たねえぞ？
――行くしかねえな",,ui\00_message\quest\q00020110.gmd,\quest\q00020110.arc,q00020110.arc,10
0,,"もし死んだら、セシリーの使命とやらは
その程度ってことなんだろうよ",,ui\00_message\quest\q00020110.gmd,\quest\q00020110.arc,q00020110.arc,11
0,,生き延びる方に賭けてやる,,ui\00_message\quest\q00020110.gmd,\quest\q00020110.arc,q00020110.arc,12
0,,"ロイグに案内させれば
状況も変わるかもしれない",,ui\00_message\quest\q00020110.gmd,\quest\q00020110.arc,q00020110.arc,13
0,,港の船に集合でいいな？,,ui\00_message\quest\q00020110.gmd,\quest\q00020110.arc,q00020110.arc,14
0,,"新たにロイグから聞いた上陸場所は
島の裏手にある絶崖の真下だ
さあ、乗った乗った！",,ui\00_message\quest\q00020110.gmd,\quest\q00020110.arc,q00020110.arc,15
0,,なるほど、このあたりは初めてだな,,ui\00_message\quest\q00020110.gmd,\quest\q00020110.arc,q00020110.arc,16
0,,"よし、ここから島の中心を目指すぞ
あの、うすら明るい場所が目標だ",,ui\00_message\quest\q00020110.gmd,\quest\q00020110.arc,q00020110.arc,17
0,,"ロイグと一緒に隊長の後を行きます
よろしくお願いします",,ui\00_message\quest\q00020110.gmd,\quest\q00020110.arc,q00020110.arc,18
0,,"くれぐれも気をつけて
このあたりはフィンダムの辺境だ",,ui\00_message\quest\q00020110.gmd,\quest\q00020110.arc,q00020110.arc,19
0,,わたしも馴染みのある場所ではないからね,,ui\00_message\quest\q00020110.gmd,\quest\q00020110.arc,q00020110.arc,20
0,,"黒騎士、来ますかね？
来ますよね？",,ui\00_message\quest\q00020110.gmd,\quest\q00020110.arc,q00020110.arc,21
0,,"セシリーたちはわたしにまかせて
隊長は、どんどん先行っちゃって！",,ui\00_message\quest\q00020110.gmd,\quest\q00020110.arc,q00020110.arc,22
0,,"ああ、こんな事になるなんて――
隊長、セシリー、大丈夫ですよね！？　",,ui\00_message\quest\q00020110.gmd,\quest\q00020110.arc,q00020110.arc,23
0,,"きっと助かりますよね！？　
ねえ、そう言って下さい、隊長！！",,ui\00_message\quest\q00020110.gmd,\quest\q00020110.arc,q00020110.arc,24
0,,"セシリーのことはわたしに任せて
隊長さんは、今後のことを考えてくださいな",,ui\00_message\quest\q00020110.gmd,\quest\q00020110.arc,q00020110.arc,25
0,,"セシリーは大丈夫だよ――
ねえ、そう言って？",,ui\00_message\quest\q00020110.gmd,\quest\q00020110.arc,q00020110.arc,26
0,,"わたしは幸い軽傷だから心配はいらないよ
しかしセシリーは――",,ui\00_message\quest\q00020110.gmd,\quest\q00020110.arc,q00020110.arc,27
0,,ああ、わたしのせいかもしれないな,,ui\00_message\quest\q00020110.gmd,\quest\q00020110.arc,q00020110.arc,28
0,,"こうなってみると――
島への訪問は軽率だったということに
なるかもしれませんね",,ui\00_message\quest\q00020110.gmd,\quest\q00020110.arc,q00020110.arc,29
0,,隊長――,,ui\00_message\quest\q00020110.gmd,\quest\q00020110.arc,q00020110.arc,30
0,,"黒騎士を倒すのはやっぱり
今のわたしたちじゃ無理だよ",,ui\00_message\quest\q00020110.gmd,\quest\q00020110.arc,q00020110.arc,31
0,,（弱々しい呼吸の音が聞こえる）,,ui\00_message\quest\q00020110.gmd,\quest\q00020110.arc,q00020110.arc,32
0,,"反省はほどほどにしておかねえと
何もできなくなるぜ",,ui\00_message\quest\q00020110.gmd,\quest\q00020110.arc,q00020110.arc,33
0,,僕たちはセシリーを失ったわけじゃない,,ui\00_message\quest\q00020110.gmd,\quest\q00020110.arc,q00020110.arc,34
0,,"――そうだろ？
回復後のこと、次のことを考えなくちゃ",,ui\00_message\quest\q00020110.gmd,\quest\q00020110.arc,q00020110.arc,35
0,,黒き騎士とて不死身ではない,,ui\00_message\quest\q00020110.gmd,\quest\q00020110.arc,q00020110.arc,36
0,,"セシリーの容態は楽観できないそうだ
しかし――",,ui\00_message\quest\q00020110.gmd,\quest\q00020110.arc,q00020110.arc,37
0,,"これで黒騎士が目的を果たしたのなら
我々には平穏が訪れるのではないか――",,ui\00_message\quest\q00020110.gmd,\quest\q00020110.arc,q00020110.arc,38
0,,"レスタニアの安全が叶うのではないかと
思わずにはいられないのだ",,ui\00_message\quest\q00020110.gmd,\quest\q00020110.arc,q00020110.arc,39
0,,すまない――我ながら嘆かわしい限りだ,,ui\00_message\quest\q00020110.gmd,\quest\q00020110.arc,q00020110.arc,40
0,,"セシリーが島へ行きたいと言い出した時――
なんとも言えず嫌な予感がしたのに
わたしは止めようともしなかった",,ui\00_message\quest\q00020120.gmd,\quest\q00020120.arc,q00020120.arc,0
0,,"心のどこかに、今の状況を望む気持ちが
あったのだろう
いやはや、我ながら浅ましいわ",,ui\00_message\quest\q00020120.gmd,\quest\q00020120.arc,q00020120.arc,1
0,,"なあ――
眠るセシリーを守ってやってくれ
彼女に害を為す者、事があらば
全て追い払ってほしい",,ui\00_message\quest\q00020120.gmd,\quest\q00020120.arc,q00020120.arc,2
0,,"わたしからの頼み――
セシリーへの贖罪だ",,ui\00_message\quest\q00020120.gmd,\quest\q00020120.arc,q00020120.arc,3
0,,"セシリーを見守ってやってほしい
目覚めた時におまえがいれば安心だろう","I want you to watch over Cecily.
It would be best if you were there when she wakes
up.",ui\00_message\quest\q00020120.gmd,\quest\q00020120.arc,q00020120.arc,4
0,,"黒騎士の動向は不明だけど
セシリーのこの状態を知ったらどうするだろうね",,ui\00_message\quest\q00020120.gmd,\quest\q00020120.arc,q00020120.arc,5
0,,"騎士団には声をかけておいたけど
もしもの時は、やっぱり君が頼りだ
用心だけはしておいてよ？",,ui\00_message\quest\q00020120.gmd,\quest\q00020120.arc,q00020120.arc,6
0,,"おい、黒騎士野郎に仕返しだ
さっさと動かねえと
白竜の覚者は腰抜けだと思われるぜ？",,ui\00_message\quest\q00020120.gmd,\quest\q00020120.arc,q00020120.arc,7
0,,"セシリーのところへ行きました？
あんなことになっちゃって――
俺、悔しいですよ――悔しいです！",,ui\00_message\quest\q00020120.gmd,\quest\q00020120.arc,q00020120.arc,8
0,,セシリーの呼吸が深すぎて不安になるでしょう？,,ui\00_message\quest\q00020120.gmd,\quest\q00020120.arc,q00020120.arc,9
0,,"でも、回数――つまり呼吸の間隔は安定しているの
良い兆候だと思うわ",,ui\00_message\quest\q00020120.gmd,\quest\q00020120.arc,q00020120.arc,10
0,,"ロイグのお薬を作ってくれたカミュさんに
診てもらったの",,ui\00_message\quest\q00020120.gmd,\quest\q00020120.arc,q00020120.arc,11
0,,そうしたら、できることは何もないって――,,ui\00_message\quest\q00020120.gmd,\quest\q00020120.arc,q00020120.arc,12
0,,なあ、レオを頼ってみないか？,,ui\00_message\quest\q00020120.gmd,\quest\q00020120.arc,q00020120.arc,13
0,,"新たな――さらなる力を探しているという
レオの話を覚えているだろう？",,ui\00_message\quest\q00020120.gmd,\quest\q00020120.arc,q00020120.arc,14
0,,"その力があれば、君たちは黒騎士に
勝てるはずだ",,ui\00_message\quest\q00020120.gmd,\quest\q00020120.arc,q00020120.arc,15
0,,"もちろん、レオとの間に
わだかまりがあることは知っている",,ui\00_message\quest\q00020120.gmd,\quest\q00020120.arc,q00020120.arc,16
0,,"――さしでがましいようだが
わたしに和解の仲立ちをさせてくれ",,ui\00_message\quest\q00020120.gmd,\quest\q00020120.arc,q00020120.arc,17
0,,"禊の神殿で会えるように手配しておいた
レオは、きっと来るはずだ",,ui\00_message\quest\q00020120.gmd,\quest\q00020120.arc,q00020120.arc,18
0,,"“禊の神殿”で会いたい――
ダウ渓谷へ行く騎士団の人たちに
レオへの親書を預けたんだ",,ui\00_message\quest\q00020120.gmd,\quest\q00020120.arc,q00020120.arc,19
0,,"セシリーはまだあきらめてない
ねえ隊長、わたし絶対にあきらめないから！",,ui\00_message\quest\q00020120.gmd,\quest\q00020120.arc,q00020120.arc,20
0,,（弱々しい呼吸の音が聞こえる）,,ui\00_message\quest\q00020120.gmd,\quest\q00020120.arc,q00020120.arc,21
0,,――冴えない顔だな,,ui\00_message\quest\q00020120.gmd,\quest\q00020120.arc,q00020120.arc,22
0,,竜力の淀みに立ち入るには特別な道具が必要だ,,ui\00_message\quest\q00020120.gmd,\quest\q00020120.arc,q00020120.arc,23
0,,"ポーン郷にある異界の狭間の深層に入り
“竜の泪”と呼ばれるオーブの欠片を
探し集めてくれ",,ui\00_message\quest\q00020120.gmd,\quest\q00020120.arc,q00020120.arc,24
0,,わたしはセシリーのところへ帰るよ,,ui\00_message\quest\q00020120.gmd,\quest\q00020120.arc,q00020120.arc,25
0,,"レオの話をよく聞いて
必要とあらば折り合いをつけてくれ
セシリーのためだ",,ui\00_message\quest\q00020120.gmd,\quest\q00020120.arc,q00020120.arc,26
0,,"異界の狭間、深層への入り口は
既に開かれている――",,ui\00_message\quest\q00020120.gmd,\quest\q00020120.arc,q00020120.arc,27
0,,心迷わぬように進むといい,,ui\00_message\quest\q00020120.gmd,\quest\q00020120.arc,q00020120.arc,28
0,,早かったな,,ui\00_message\quest\q00020120.gmd,\quest\q00020120.arc,q00020120.arc,29
0,,では、竜の泪は預からせてもらう,,ui\00_message\quest\q00020120.gmd,\quest\q00020120.arc,q00020120.arc,30
0,,"そんな顔をするな
持ち逃げなどしない
古文書で調べることが、まだある",,ui\00_message\quest\q00020120.gmd,\quest\q00020120.arc,q00020120.arc,31
0,,"ジョゼフやクラウスに預ければ手際よく調べる
だろうがこれは自分自身で学び、理解したい",,ui\00_message\quest\q00020120.gmd,\quest\q00020120.arc,q00020120.arc,32
0,,"おまえたちの割り込みを受け入れてやるんだ
それくらいの勝手は認めろ",,ui\00_message\quest\q00020120.gmd,\quest\q00020120.arc,q00020120.arc,33
0,,"持ち逃げなど姑息な真似はしない
俺を信じろ",,ui\00_message\quest\q00020120.gmd,\quest\q00020120.arc,q00020120.arc,34
0,,ちゃんと話はつけたんだろうね？,,ui\00_message\quest\q00020120.gmd,\quest\q00020120.arc,q00020120.arc,35
0,,"レオには訊きたいこと――
言いたいことが色々あるけど
今は我慢するよ",,ui\00_message\quest\q00020120.gmd,\quest\q00020120.arc,q00020120.arc,36
0,,セシリーのためだもの！,,ui\00_message\quest\q00020120.gmd,\quest\q00020120.arc,q00020120.arc,37
0,,"レオの野郎を見張ってなくて大丈夫か？
俺が行っとくか？",,ui\00_message\quest\q00020120.gmd,\quest\q00020120.arc,q00020120.arc,38
0,,"レオからの連絡が待ち遠しいですね
ええ、必ず連絡をくれると信じてます",,ui\00_message\quest\q00020120.gmd,\quest\q00020120.arc,q00020120.arc,39
0,,"竜の泪か――
俄然興味が沸いてくるね",,ui\00_message\quest\q00020120.gmd,\quest\q00020120.arc,q00020120.arc,40
0,,"セシリーの容態は一進一退と言ったところだ
そっちの首尾は？",,ui\00_message\quest\q00020120.gmd,\quest\q00020120.arc,q00020120.arc,41
0,,"ふむ――業腹だが、レオが約束を違えぬと
期待するしかないだろうな",,ui\00_message\quest\q00020120.gmd,\quest\q00020120.arc,q00020120.arc,42
0,,レオの使いを名乗る者が来た,"A person who claims to be a messenger for Leo has
come.",ui\00_message\quest\q00020130.gmd,\quest\q00020130.arc,q00020130.arc,0
0,,"準備を整えたレオが待っているから
来てくれとのことだ","They said Leo is ready, and waiting for you to
arrive.",ui\00_message\quest\q00020130.gmd,\quest\q00020130.arc,q00020130.arc,1
0,,"場所は禊の神殿だ
勝手知ったる場所だろうが用心は怠るな？","That place is the Temple of Purification, as you
are
well aware, but yet you are not even a bit
discouraged?",ui\00_message\quest\q00020130.gmd,\quest\q00020130.arc,q00020130.arc,2
0,,"黒騎士の魔手からセシリーを
守る力が得られるのであれば
レオに関してはもう何も言うまい","If you are able, gain the power to protect Cecily
from the Black Knight's evil influence.
As for Leo, I have nothing to say about that
matter.",ui\00_message\quest\q00020130.gmd,\quest\q00020130.arc,q00020130.arc,3
0,,"大急ぎで調べたんだけど、竜の泪のことは
手掛かりすら掴めない――","I quickly examined it, but I have no clue what
these
""Tears of the Dragon"" are...",ui\00_message\quest\q00020130.gmd,\quest\q00020130.arc,q00020130.arc,4
0,,"ああ！　完全にお手上げだ！
いやいや待て待て――","Ah! I give up!
No no no wait...",ui\00_message\quest\q00020130.gmd,\quest\q00020130.arc,q00020130.arc,5
0,,"今、どんな状況？
レオからの連絡はあったの？","Now, what is the situation?
Have you got in contact with Leo?",ui\00_message\quest\q00020130.gmd,\quest\q00020130.arc,q00020130.arc,6
0,,レオは必ずやってくれると信じてますよ、俺,I believe Leo will surely do it.,ui\00_message\quest\q00020130.gmd,\quest\q00020130.arc,q00020130.arc,7
0,,"あなたがセシリーを助けてくれるって
言う人が大勢いるの","There are a lot of people saying you will help
Cecily.",ui\00_message\quest\q00020130.gmd,\quest\q00020130.arc,q00020130.arc,8
0,,"実はわたしもそのひとり
期待が重たいかもしれないけど――
頑張ってね","Actually, I am one of them.
Although my expectations may be a high order,
I wish you good luck.",ui\00_message\quest\q00020130.gmd,\quest\q00020130.arc,q00020130.arc,9
0,,"いつもお願いばかりでごめんなさい
でも、やっぱり、お願いするしかないの","I'm sorry to always ask things of you.
Nevertheless, as expected, all I can do is ask.",ui\00_message\quest\q00020130.gmd,\quest\q00020130.arc,q00020130.arc,10
0,,セシリーを助けてあげて！,Please help Cecily!,ui\00_message\quest\q00020130.gmd,\quest\q00020130.arc,q00020130.arc,11
0,,"これでダメならもう他に方法が――
いや、良い結果だけを考えることにするよ","Although, if there is no way to...
No, I will only hope for the best.",ui\00_message\quest\q00020130.gmd,\quest\q00020130.arc,q00020130.arc,12
0,,"レオの言うとおり、力が手に入るのかもしれんが
わけのわからん力で身を滅ぼすなよ？","As Leo said, it may be an ordeal to acquire that
force.
What if such a force could destroy you?",ui\00_message\quest\q00020130.gmd,\quest\q00020130.arc,q00020130.arc,13
0,,（呼吸がひときわ深くなったようだ）,"(Their breathing seems to have become noticeably
deeper.)",ui\00_message\quest\q00020130.gmd,\quest\q00020130.arc,q00020130.arc,14
0,,気が急くか？　ああ、俺もだ,"Do you feel a need to hurry? Ah, I do as well.",ui\00_message\quest\q00020130.gmd,\quest\q00020130.arc,q00020130.arc,15
0,,俺達の望む力はこの先だ,The force we seek is just ahead of us.,ui\00_message\quest\q00020130.gmd,\quest\q00020130.arc,q00020130.arc,16
0,,"ああ――この時を俺は待ちわびていた
さあ、共に戦い手に入れよう","Ah...I was waiting for this time to come.
Now, let us fight as one.",ui\00_message\quest\q00020130.gmd,\quest\q00020130.arc,q00020130.arc,17
0,,"欲にまみれた愚か者め――
身の程を知るがよい――","Fool who is covered in desire...
Know your place...",ui\00_message\quest\q00020130.gmd,\quest\q00020130.arc,q00020130.arc,18
0,,怯むな――これは白竜ではない！,Do not hesitate...This is not the White Dragon!,ui\00_message\quest\q00020130.gmd,\quest\q00020130.arc,q00020130.arc,19
0,,ふん、ずいぶん腕を上げたな,"Hmm, I raised my arms a fair bit there.",ui\00_message\quest\q00020130.gmd,\quest\q00020130.arc,q00020130.arc,20
0,,おい、少しは遠慮しろ,"Hey, hold on a moment.",ui\00_message\quest\q00020130.gmd,\quest\q00020130.arc,q00020130.arc,21
0,,ほう――見違えたな,Hoho...I hardly recognize you.,ui\00_message\quest\q00020130.gmd,\quest\q00020130.arc,q00020130.arc,22
0,,まだまだ負けないさ,I won't lose just yet.,ui\00_message\quest\q00020130.gmd,\quest\q00020130.arc,q00020130.arc,23
0,,おまえの初陣、思い出したぞ,"Your first battle, I remember it.",ui\00_message\quest\q00020130.gmd,\quest\q00020130.arc,q00020130.arc,24
0,,さあ、竜力を切り取ってやろうではないか！,"Come now, let us cut out the dragon's force!",ui\00_message\quest\q00020130.gmd,\quest\q00020130.arc,q00020130.arc,25
0,,竜力の継承は覚者の正当なる権利だ！,"The inheritance of the dragon force is the
rightful
privilege of the Arisen!",ui\00_message\quest\q00020130.gmd,\quest\q00020130.arc,q00020130.arc,26
0,,竜から得た力で、竜の敵を倒すのだ！,"Vanquish the enemies of the dragon with the power
the dragon has granted you!",ui\00_message\quest\q00020130.gmd,\quest\q00020130.arc,q00020130.arc,27
0,,くっ――オレは思い上がっていたのか？,Ugh...was I so conceited?,ui\00_message\quest\q00020130.gmd,\quest\q00020130.arc,q00020130.arc,28
0,,強い――とてつもなく強いぞ――,Strong...So unbelievably strong...,ui\00_message\quest\q00020130.gmd,\quest\q00020130.arc,q00020130.arc,29
0,,引くな――勝敗を決めるのは意志の力だ,"Pull through...Sheer willpower will decide the
outcome.",ui\00_message\quest\q00020130.gmd,\quest\q00020130.arc,q00020130.arc,30
0,,"おまえが手に入れた力は竜力で
それは癒やしの力――","The power you have acquired is a dragon's force,
and it has a latent healing power...",ui\00_message\quest\q00020130.gmd,\quest\q00020130.arc,q00020130.arc,31
0,,"俺ならセシリーの目を覚ましてやることに使うね
勝てるかどうかわからねえ黒騎士にぶつけて
おまえがやられたら目も当てられねえ","I'll try to use it to awaken Cecily.
I don't know if I can",ui\00_message\quest\q00020130.gmd,\quest\q00020130.arc,q00020130.arc,32
0,,"どうなっているの？
何か進展はあったの？","What's happened?
Have you made any progress?",ui\00_message\quest\q00020130.gmd,\quest\q00020130.arc,q00020130.arc,33
0,,"セシリーの息が遠くなったよ？
大丈夫だよね？","Cecily's breathing is getting worse?
Are they not okay?",ui\00_message\quest\q00020130.gmd,\quest\q00020130.arc,q00020130.arc,34
0,,"セシリーの呼吸の間がひときわ長くなってきている
もうあまり時間がない――","Cecily's breaths are getting longer and longer.
We do not have much time left...",ui\00_message\quest\q00020130.gmd,\quest\q00020130.arc,q00020130.arc,35
0,,おかえり、隊長！,"Welcome back, Captain!",ui\00_message\quest\q00020130.gmd,\quest\q00020130.arc,q00020130.arc,36
0,,隊長――みんな待ちわびてます,Captain...everyone is waiting.,ui\00_message\quest\q00020130.gmd,\quest\q00020130.arc,q00020130.arc,37
0,,"へぇ――
俺の意見が通るとはね","Really...
Pass my opinion on.",ui\00_message\quest\q00020130.gmd,\quest\q00020130.arc,q00020130.arc,38
0,,良かった――ああ、本当に良かった,"It was great...Oh, it was really great.",ui\00_message\quest\q00020130.gmd,\quest\q00020130.arc,q00020130.arc,39
0,,隊長、やったね！,"Captain, you did it!",ui\00_message\quest\q00020130.gmd,\quest\q00020130.arc,q00020130.arc,40
0,,"セシリー、記憶も戻ったって言ってましたよね！？
こりゃ、凄いことですよ！",,ui\00_message\quest\q00020130.gmd,\quest\q00020130.arc,q00020130.arc,41
0,,"元気な若い娘ってのは
やっぱりどうにも苦手だぜ",,ui\00_message\quest\q00020130.gmd,\quest\q00020130.arc,q00020130.arc,42
0,,まあ、死にそうなのよりずっといいけどよ,,ui\00_message\quest\q00020130.gmd,\quest\q00020130.arc,q00020130.arc,43
0,,わたしが死にかけているあいだのこと――,,ui\00_message\quest\q00020130.gmd,\quest\q00020130.arc,q00020130.arc,44
0,,"隊長さんと皆さんがしてくださったことを
聞かせてくださいね",,ui\00_message\quest\q00020130.gmd,\quest\q00020130.arc,q00020130.arc,45
0,,やっぱりあなたはただ者じゃないわね！,,ui\00_message\quest\q00020130.gmd,\quest\q00020130.arc,q00020130.arc,46
0,,"これでわたしも安心して眠れる～！！
あ――眠くなってきちゃった――",,ui\00_message\quest\q00020130.gmd,\quest\q00020130.arc,q00020130.arc,47
0,,"竜の泪について何も分からないなんて
口惜しくてね",,ui\00_message\quest\q00020130.gmd,\quest\q00020130.arc,q00020130.arc,48
0,,"レオの行動から推理して、ドリード城の書庫に籠もり
必死で調べたんだ",,ui\00_message\quest\q00020130.gmd,\quest\q00020130.arc,q00020130.arc,49
0,,"セシリーはフィンダム大陸の覚者――
精霊竜の覚者か――",,ui\00_message\quest\q00020130.gmd,\quest\q00020130.arc,q00020130.arc,50
0,,"我々は、フィンダムの覚者――やがて竜となる
“選ばれし者”を匿っていたというわけか！",,ui\00_message\quest\q00020130.gmd,\quest\q00020130.arc,q00020130.arc,51
0,,"しかしこのレスタニア、今は白竜と黄金竜の
二竜が生きる常ならぬ事態",,ui\00_message\quest\q00020130.gmd,\quest\q00020130.arc,q00020130.arc,52
0,,"そこに新たな竜が加わるとなれば
いったいどうなってしまうのか――",,ui\00_message\quest\q00020130.gmd,\quest\q00020130.arc,q00020130.arc,53
0,,"セシリーには悪いが、フィンダムに
帰ってもらうにはどうしたら良いか
我々も知恵を絞り出さねばならんな",,ui\00_message\quest\q00020130.gmd,\quest\q00020130.arc,q00020130.arc,54
0,,"島へ渡る時は、準備ぬかりなく
――いいな？",,ui\00_message\quest\q00020140.gmd,\quest\q00020140.arc,q00020140.arc,0
0,,"黒騎士はその力がどれほどか
計り知れぬほど恐ろしい相手です",,ui\00_message\quest\q00020140.gmd,\quest\q00020140.arc,q00020140.arc,1
0,,"けれど、私を狙い、そのために人々を襲い
あまつさえ大地を穢さんとする者を
見過ごすわけにはいきません",,ui\00_message\quest\q00020140.gmd,\quest\q00020140.arc,q00020140.arc,2
0,,隊長さん――,,ui\00_message\quest\q00020140.gmd,\quest\q00020140.arc,q00020140.arc,3
0,,"あなたが蘇らせてくれたおかげで
わたしは自らの負う使命を
取り戻すことができました",,ui\00_message\quest\q00020140.gmd,\quest\q00020140.arc,q00020140.arc,4
0,,もう、闇は恐れません,,ui\00_message\quest\q00020140.gmd,\quest\q00020140.arc,q00020140.arc,5
0,,"今度こそ黒騎士を倒すことができる――
そう信じています",,ui\00_message\quest\q00020140.gmd,\quest\q00020140.arc,q00020140.arc,6
0,,"調査隊駐屯地のベルトランから
魔赤島の山頂部に通じる
駐屯地内の扉を解放したと連絡が入った",,ui\00_message\quest\q00020140.gmd,\quest\q00020140.arc,q00020140.arc,7
0,,"光り輝く歪みの場所へ向かうなら
そこを通るのが一番だろう",,ui\00_message\quest\q00020140.gmd,\quest\q00020140.arc,q00020140.arc,8
0,,"黒き騎士は異邦の力の使い手
――あなどるなよ",,ui\00_message\quest\q00020140.gmd,\quest\q00020140.arc,q00020140.arc,9
0,,俺はずっと自分の人生の主だった,,ui\00_message\quest\q00020140.gmd,\quest\q00020140.arc,q00020140.arc,10
0,,"でもよ、面倒な判断を人任せにするのも
悪くねえな",,ui\00_message\quest\q00020140.gmd,\quest\q00020140.arc,q00020140.arc,11
0,,"さあ、行けよ
付いていくぜ",,ui\00_message\quest\q00020140.gmd,\quest\q00020140.arc,q00020140.arc,12
0,,"問題を片づけたらフィンダム旅行かな？
楽しみ～！",,ui\00_message\quest\q00020140.gmd,\quest\q00020140.arc,q00020140.arc,13
0,,"セシリーの面倒は俺が見ますから
隊長は現地状況の見極め、よろしくです！",,ui\00_message\quest\q00020140.gmd,\quest\q00020140.arc,q00020140.arc,14
