0,,"その回収をお願いできないでしょうか？
えっと、かなりその――大変かな、とは思うのですが――
あぁっ！　もちろん見合ったお礼はしますので",,ui\00_message\quest\q20010002.gmd,\quest\q20010002.arc,q20010002.arc,10
0,,"はぁ――
自分で取りに戻る勇気があれば――",,ui\00_message\quest\q20010002.gmd,\quest\q20010002.arc,q20010002.arc,11
0,,"おお、全部見つけてくださったとは！？
ありがとうございました！",,ui\00_message\quest\q20010002.gmd,\quest\q20010002.arc,q20010002.arc,12
0,,"洞窟奥の滝で清めると
効き目が増すと思ったのですが――
うぅ、また失敗するなんて――",,ui\00_message\quest\q20010002.gmd,\quest\q20010002.arc,q20010002.arc,13
0,,"おお、全部見つけてくださったとは！？
さすが覚者様です！
ありがとうございました！",,ui\00_message\quest\q20010002.gmd,\quest\q20010002.arc,q20010002.arc,14
0,,"洞窟奥の滝で清めると
効き目が増すと思ったのですが――
うぅ、また失敗するなんて――",,ui\00_message\quest\q20010002.gmd,\quest\q20010002.arc,q20010002.arc,15
0,,"おお――
実は引き受けていただいたものの
すっかり諦めていまして――",,ui\00_message\quest\q20010002.gmd,\quest\q20010002.arc,q20010002.arc,16
0,,今にして思えばなんと失礼なことを――,,ui\00_message\quest\q20010002.gmd,\quest\q20010002.arc,q20010002.arc,17
0,,"ありがとうございました！
さすがは覚者様でございます！",,ui\00_message\quest\q20010002.gmd,\quest\q20010002.arc,q20010002.arc,18
0,,"洞窟奥の滝で清めると
効き目が増すと思ったのですが――
うぅ、また失敗するなんて――",,ui\00_message\quest\q20010002.gmd,\quest\q20010002.arc,q20010002.arc,19
0,,"あの――
調子はいかがでしょうか？
できれば急いでいただきたいのですが――",,ui\00_message\quest\q20010002.gmd,\quest\q20010002.arc,q20010002.arc,20
0,,"ああ、あんた、いい所に来たね
ちょっと頼まれてくれないかい？",,ui\00_message\quest\q20010003.gmd,\quest\q20010003.arc,q20010003.arc,0
0,,"海岸沿いに灯台があるだろ
守番のルドルフォ爺さんにいつも荷物を
届けてあげるんだけど、今日は普段より
魔物が多いみたいでね",,ui\00_message\quest\q20010003.gmd,\quest\q20010003.arc,q20010003.arc,1
0,,"替わってくれないかね、頼むよ
爺さんには、あんたも世話になるかも
しれないしさ",,ui\00_message\quest\q20010003.gmd,\quest\q20010003.arc,q20010003.arc,2
0,,"ああ、あんた、いい所に来たね
ちょっと頼まれてくれないかい？",,ui\00_message\quest\q20010003.gmd,\quest\q20010003.arc,q20010003.arc,3
0,,"海岸沿いに灯台があるだろ
守番のルドルフォ爺さんにいつも荷物を
届けてあげるんだけど、今日はなんだか
物騒な魔物が出てきたみたいでね",,ui\00_message\quest\q20010003.gmd,\quest\q20010003.arc,q20010003.arc,4
0,,"替わってくれないかね、頼むよ
爺さんには、あんたも世話になるかも
しれないしさ",,ui\00_message\quest\q20010003.gmd,\quest\q20010003.arc,q20010003.arc,5
0,,"ああ、あんた、いい所に来たね
ちょっと頼まれてくれないかい？",,ui\00_message\quest\q20010003.gmd,\quest\q20010003.arc,q20010003.arc,6
0,,"海岸沿いに灯台があるだろ
守番のルドルフォ爺さんにいつも荷物を
届けてあげるんだけど、今日はこのあたりでも
とびきり怖い魔物を見たって人がいてね",,ui\00_message\quest\q20010003.gmd,\quest\q20010003.arc,q20010003.arc,7
0,,"替わってくれないかね、頼むよ
爺さんには、あんたも世話になるかも
しれないしさ",,ui\00_message\quest\q20010003.gmd,\quest\q20010003.arc,q20010003.arc,8
0,,んん？　何じゃお前さん,,ui\00_message\quest\q20010003.gmd,\quest\q20010003.arc,q20010003.arc,9
0,,"――おぉ、そうかそうか
ローザの使いできてくれたのか
それは失礼したの",,ui\00_message\quest\q20010003.gmd,\quest\q20010003.arc,q20010003.arc,10
0,,"時間があるなら灯台にでも登って
海を眺めていくといい",,ui\00_message\quest\q20010003.gmd,\quest\q20010003.arc,q20010003.arc,11
0,,"海は全ての者に公平じゃ、実にいい
広大なるものを感じ、己を見つめ直す
よい機会になろうて",,ui\00_message\quest\q20010003.gmd,\quest\q20010003.arc,q20010003.arc,12
0,,"お疲れさま
大変だったかい？",,ui\00_message\quest\q20010003.gmd,\quest\q20010003.arc,q20010003.arc,13
0,,"ルドルフォ爺さんは元騎士団のすごい人でね
隠居してから何年も灯台守を続けてくれてるのさ
灯台は代々、そうやって守られてきたそうだよ",,ui\00_message\quest\q20010003.gmd,\quest\q20010003.arc,q20010003.arc,14
0,,"大きな魔物がやって来た時とかは
あの人が知らせてくれて、みんなで逃げたんだよ",,ui\00_message\quest\q20010003.gmd,\quest\q20010003.arc,q20010003.arc,15
0,,元気でやっていてほしいね,,ui\00_message\quest\q20010003.gmd,\quest\q20010003.arc,q20010003.arc,16
0,,"お疲れさま
大変だったかい？",,ui\00_message\quest\q20010003.gmd,\quest\q20010003.arc,q20010003.arc,17
0,,"ルドルフォ爺さんは元騎士団のすごい人でね
隠居してから何年も灯台守を続けてくれてるのさ
灯台は代々、そうやって守られてきたそうだよ",,ui\00_message\quest\q20010003.gmd,\quest\q20010003.arc,q20010003.arc,18
0,,"大きな魔物がやって来た時とかは
あの人が知らせてくれて、みんなで逃げたんだよ",,ui\00_message\quest\q20010003.gmd,\quest\q20010003.arc,q20010003.arc,19
0,,元気でやっていてほしいね,,ui\00_message\quest\q20010003.gmd,\quest\q20010003.arc,q20010003.arc,20
0,,"お疲れさま
大変だったかい？",,ui\00_message\quest\q20010003.gmd,\quest\q20010003.arc,q20010003.arc,21
0,,"ルドルフォ爺さんは元騎士団のすごい人でね
隠居してから何年も灯台守を続けてくれてるのさ
灯台は代々、そうやって守られてきたそうだよ",,ui\00_message\quest\q20010003.gmd,\quest\q20010003.arc,q20010003.arc,22
0,,"大きな魔物がやって来た時とかは
あの人が知らせてくれて、みんなで逃げたんだよ",,ui\00_message\quest\q20010003.gmd,\quest\q20010003.arc,q20010003.arc,23
0,,元気でやっていてほしいね,,ui\00_message\quest\q20010003.gmd,\quest\q20010003.arc,q20010003.arc,24
0,,"ちょっと！
あまり遅くならないように届けておくれよ",,ui\00_message\quest\q20010003.gmd,\quest\q20010003.arc,q20010003.arc,25
0,,"ふむ、ちょうどいい
お前さんに頼むとしようか",,ui\00_message\quest\q20010004.gmd,\quest\q20010004.arc,q20010004.arc,0
0,,"近頃、夜になると
妙な気配を感じる事があっての
朝には消えておるんじゃが――",,ui\00_message\quest\q20010004.gmd,\quest\q20010004.arc,q20010004.arc,1
0,,"一度お前さんたちで調べてみてくれんか
まぁ、言うても大した相手じゃなかろうて",,ui\00_message\quest\q20010004.gmd,\quest\q20010004.arc,q20010004.arc,2
0,,"ふむ、ちょうどいい
お前さんに頼むとしようか",,ui\00_message\quest\q20010004.gmd,\quest\q20010004.arc,q20010004.arc,3
0,,"近頃、夜になると
妙な気配を感じる事があっての
朝には消えておるんじゃが――",,ui\00_message\quest\q20010004.gmd,\quest\q20010004.arc,q20010004.arc,4
0,,"一度お前さんたちで調べてみてくれんか
なに、ちょっとした修練代わりじゃよ",,ui\00_message\quest\q20010004.gmd,\quest\q20010004.arc,q20010004.arc,5
0,,"ふむ、ちょうどいい
お前さんに頼むとしようか",,ui\00_message\quest\q20010004.gmd,\quest\q20010004.arc,q20010004.arc,6
0,,"近頃、夜になると
妙な気配を感じる事があっての
朝には消えておるんじゃが――",,ui\00_message\quest\q20010004.gmd,\quest\q20010004.arc,q20010004.arc,7
0,,"一度お前さんたちで調べてみてくれんか
そうじゃの、あの気配の感じだと
ちょっとした腕試しくらいにはなるかもしれんの",,ui\00_message\quest\q20010004.gmd,\quest\q20010004.arc,q20010004.arc,8
0,,"ほうほう、そんな奴がいたとはの
ごくろうさん、手間かけさせたの",,ui\00_message\quest\q20010004.gmd,\quest\q20010004.arc,q20010004.arc,9
0,,"しかし何が目的で現れたのか
――意思の通じぬ魔物の事
推測してもらちがあかんか",,ui\00_message\quest\q20010004.gmd,\quest\q20010004.arc,q20010004.arc,10
0,,"ほうほう、そんな奴がいたとはの
ごくろうさん、手間かけさせたの",,ui\00_message\quest\q20010004.gmd,\quest\q20010004.arc,q20010004.arc,11
0,,"しかし何が目的で現れたのか
――意思の通じぬ魔物の事
推測してもらちがあかんか",,ui\00_message\quest\q20010004.gmd,\quest\q20010004.arc,q20010004.arc,12
0,,厄介なことにならねばよいが,,ui\00_message\quest\q20010004.gmd,\quest\q20010004.arc,q20010004.arc,13
0,,"ほうほう、そんな奴がいたとはの
ごくろうさん、手間かけさせたの",,ui\00_message\quest\q20010004.gmd,\quest\q20010004.arc,q20010004.arc,14
0,,"しかし何が目的で現れたのか
――意思の通じぬ魔物の事
推測してもらちがあかんか",,ui\00_message\quest\q20010004.gmd,\quest\q20010004.arc,q20010004.arc,15
0,,"これ以上強力なのが現れたら
さすがにちと面倒じゃの――",,ui\00_message\quest\q20010004.gmd,\quest\q20010004.arc,q20010004.arc,16
0,,"そうそう
気配を感じるのは夜の間だけでの
昼間は全く問題ないんじゃが",,ui\00_message\quest\q20010004.gmd,\quest\q20010004.arc,q20010004.arc,17
0,,"あ、覚者殿いいところに
ちょっと聞いていただきたいことが！",,ui\00_message\quest\q20010005.gmd,\quest\q20010005.arc,q20010005.arc,0
0,,"住民からの話によるとですね、離れた所に
廃墟があるんですが、その地下室に魔物が
入りこんだそうなんです",,ui\00_message\quest\q20010005.gmd,\quest\q20010005.arc,q20010005.arc,1
0,,"自分、相談されたんですがちょっと手に負えるか
自信がなくって――",,ui\00_message\quest\q20010005.gmd,\quest\q20010005.arc,q20010005.arc,2
0,,"覚者殿この通りであります！
立場を越えてどうか一つ、協力して下さい！",,ui\00_message\quest\q20010005.gmd,\quest\q20010005.arc,q20010005.arc,3
0,,"あぁ、覚者殿いいところに！！
ちょっと聞いていただきたいことが！",,ui\00_message\quest\q20010005.gmd,\quest\q20010005.arc,q20010005.arc,4
0,,"住民からの話によるとですね、離れた所に
廃墟があるんですが、その地下室に魔物が
入りこんだそうなんです",,ui\00_message\quest\q20010005.gmd,\quest\q20010005.arc,q20010005.arc,5
0,,"うーん、自分に相談されても手に負えるか
自信がなくって――
なんでも見るからに危なそうな奴みたいで",,ui\00_message\quest\q20010005.gmd,\quest\q20010005.arc,q20010005.arc,6
0,,"覚者殿この通りであります！！
立場を越えてどうか一つ
人助けと思って協力して下さい！",,ui\00_message\quest\q20010005.gmd,\quest\q20010005.arc,q20010005.arc,7
0,,"あああぁ、か、覚者殿いいところに！！
ちょっと聞いていただきたいことがっ！！",,ui\00_message\quest\q20010005.gmd,\quest\q20010005.arc,q20010005.arc,8
0,,"住民からの話によるとですね、離れた所に
廃墟があるんですが、その地下室に魔物が
入りこんだそうなんです",,ui\00_message\quest\q20010005.gmd,\quest\q20010005.arc,q20010005.arc,9
0,,"でも、正直自分にはとても手に負える
ような感じではなく――
絶対殺される自信があります！！",,ui\00_message\quest\q20010005.gmd,\quest\q20010005.arc,q20010005.arc,10
0,,"覚者殿、どうか！！
この通りであります！
立場を越えてどうか一つ
村人を助けると思って協力して下さい！",,ui\00_message\quest\q20010005.gmd,\quest\q20010005.arc,q20010005.arc,11
0,,"おお、退治してくれたのでありますね
ありがとうございました",,ui\00_message\quest\q20010005.gmd,\quest\q20010005.arc,q20010005.arc,12
0,,"――うう、しかし自分、不甲斐ないです！
精進し、このくらい対処できるよう頑張らねば",,ui\00_message\quest\q20010005.gmd,\quest\q20010005.arc,q20010005.arc,13
0,,"あ、ゲルト団長とハインツ副団長には
その――覚者殿に助けてもらった事
内緒にしてほしいであります",,ui\00_message\quest\q20010005.gmd,\quest\q20010005.arc,q20010005.arc,14
0,,"おおっ、退治してくれたのでありますか！
ご助力ありがとうございました！",,ui\00_message\quest\q20010005.gmd,\quest\q20010005.arc,q20010005.arc,15
0,,"――うう、しかし強力な魔物相手では
今の警備体制はどう考えても不十分
覚者隊の助力を公式にお願いできれば
よいのでありますが",,ui\00_message\quest\q20010005.gmd,\quest\q20010005.arc,q20010005.arc,16
0,,"うーむ、そんな事を言ってると
団長からまた叱られるでありますね",,ui\00_message\quest\q20010005.gmd,\quest\q20010005.arc,q20010005.arc,17
0,,"おおおっ、退治してくれたのでありますか！
さすがです！　ありがとうございました！",,ui\00_message\quest\q20010005.gmd,\quest\q20010005.arc,q20010005.arc,18
0,,"あれほどの魔物相手となると、やはり
騎士団では対処ができないことも――
残念ですが、それが本心であります",,ui\00_message\quest\q20010005.gmd,\quest\q20010005.arc,q20010005.arc,19
0,,"村の常駐警備担当を、覚者隊からも出して
貰えると安心であります
神官殿にもぜひ、そのようにお伝えを",,ui\00_message\quest\q20010005.gmd,\quest\q20010005.arc,q20010005.arc,20
0,,"どうしたでありますか？
自分のことは構わず行って下さい
少し遅れて向かいますので！",,ui\00_message\quest\q20010005.gmd,\quest\q20010005.arc,q20010005.arc,21
0,,"へぇ、こんな所に来るなんて命知らずね
この辺りは危険な魔物もいるし
めったに人なんて来ないのに",,ui\00_message\quest\q20010006.gmd,\quest\q20010006.arc,q20010006.arc,0
0,,"私は、浜辺に流れ着くモノが好きで
色々見て回ってるの
何か見つけたら、私にも教えてね",,ui\00_message\quest\q20010006.gmd,\quest\q20010006.arc,q20010006.arc,1
0,,"へぇ、こんな所に来るなんて命知らずね
この辺りは危険な魔物もいるし
めったに人なんて来ないのに",,ui\00_message\quest\q20010006.gmd,\quest\q20010006.arc,q20010006.arc,2
0,,"私は、浜辺に流れ着くモノが好きで
色々見て回ってるの
何か見つけたら、私にも教えてね",,ui\00_message\quest\q20010006.gmd,\quest\q20010006.arc,q20010006.arc,3
0,,"へぇ、こんな所に来るなんて命知らずね
この辺りは危険な魔物もいるし
めったに人なんて来ないのに",,ui\00_message\quest\q20010006.gmd,\quest\q20010006.arc,q20010006.arc,4
