0,,<COL ff7575><KCT ATTACK1></COL>で前蹴りよ！敵を蹴って距離をとって！,"Use <COL ff7575><KCT ATTACK1></COL> for Front Kick!
Create distance by kicking foes!",ui\00_message\quest\q60000009.gmd,\quest\q60000009.arc,q60000009.arc,15
0,,よし、では祠の奥へ向かい大型敵と対峙よ！大型敵の<COL ff7575>＜怒り状態＞</COL>に注意して！,"Alright! Head deeper into
the shrine and face the
large enemy! Beware its
<COL ff7575>enraged state</COL>!",ui\00_message\quest\q60000009.gmd,\quest\q60000009.arc,q60000009.arc,16
0,,そして<COL ff7575><KCT TOUCH></COL>でヤツにしがみついて！,Now use <COL ff7575><KCT TOUCH></COL> to climb onto it!,ui\00_message\quest\q60000009.gmd,\quest\q60000009.arc,q60000009.arc,17
0,,その状態で<COL ff7575><KCT ATTACK1></COL>で奮わせ直魔矢よ！,"While clinging, use <COL ff7575><KCT ATTACK1></COL>
for Invigorating Magick Arrow!",ui\00_message\quest\q60000009.gmd,\quest\q60000009.arc,q60000009.arc,18
0,,怒り状態の敵を、助真の構えで捉えて！見るだけでシークレットコアを暴きだせるわ！,"Target an enemy in the enraged state with the 
True Aid Stance! 
Just looking at it exposes the Secret Core!",ui\00_message\quest\q60000009.gmd,\quest\q60000009.arc,q60000009.arc,19
0,,では大型敵の<COL ff7575>＜怒り状態＞</COL>に注意してヤツを仕留めるの！,"Be wary of the large enemy's <COL ff7575>enraged state</COL>
and take it out!",ui\00_message\quest\q60000009.gmd,\quest\q60000009.arc,q60000009.arc,20
0,,シークレットコアを攻撃したり、揺さぶり、疲れさせてチャンスを作って！,"Attack the Secret Core, shake them,
or wear them down for openings!",ui\00_message\quest\q60000009.gmd,\quest\q60000009.arc,q60000009.arc,21
0,,試練完了ね！奥にある＜魔弓の証＞を受け取り、神殿のレンテンに報告してね,"Trial complete! 
Take the <Element Archer's Mark> in the back
and report to Renton at the temple.",ui\00_message\quest\q60000009.gmd,\quest\q60000009.arc,q60000009.arc,22
0,,"おめでとうございます
これにて戦術試練は完了ですね！","Congratulations. 
The tactics trial
is now complete!",ui\00_message\quest\q60000009.gmd,\quest\q60000009.arc,q60000009.arc,23
0,,"今覚えたエレメントアーチャ―の戦い方を
振り返りたい時は、《チュートリアルガイド》の
《ジョブの操作と役割》からエレメントアーチャ―の
戦法や戦術的役割を確認してください","To review the Element Archer's combat style
you just learned, check 《Tutorial》→
《Job Roles》for tactics and duties.",ui\00_message\quest\q60000009.gmd,\quest\q60000009.arc,q60000009.arc,24
0,,"エレメントアーチャーは、ヒーラーとアタッカー
二つの面をもつ特異なジョブです
立ち回り方は、私にとっても研究課題です","The Elemental Archer is
a unique job blending both
healer and attacker roles.
Even I'm still researching
optimal strategies.",ui\00_message\quest\q60000009.gmd,\quest\q60000009.arc,q60000009.arc,25
0,,"覚者とは試練に臆することなく立ち向かい
その使命を全うする者のことだ",An Arisen faces trials without fear and fulfills their duty,ui\00_message\quest\q60000009.gmd,\quest\q60000009.arc,q60000009.arc,26
0,,"与えられた試練を全てこなせた者のみ
《魔弓の証》を得ることができる","Only those who complete all trials
may obtain the 《Element Archer's Mark.》",ui\00_message\quest\q60000009.gmd,\quest\q60000009.arc,q60000009.arc,27
0,,"各試練のやり方について
わからなければ、今までに得た知識を
確認しながら臨むがいい","If unsure about any trial, review the knowledge you've gained so far",ui\00_message\quest\q60000009.gmd,\quest\q60000009.arc,q60000009.arc,28
0,,"技や動きの参考のため
一人、共闘の仲間に来てもらってる
課題をこなす中で戦技を身に刻め！","To study techniques and forms,
I brought a comrade for joint
training. Engrave these combat
arts into your body through
practice!",ui\00_message\quest\q60000009.gmd,\quest\q60000009.arc,q60000009.arc,29
0,,"与えられた試練を全てこなせた者のみ
《魔弓の証》を得ることができる","Only those who complete all trials
may obtain the 《Element Archer's Mark.》",ui\00_message\quest\q60000009.gmd,\quest\q60000009.arc,q60000009.arc,30
0,,"各試練のやり方について
わからなければ今までの得た知識を
確認しながら臨むがいい","If unsure about any trial, review the knowledge you've gained so far",ui\00_message\quest\q60000009.gmd,\quest\q60000009.arc,q60000009.arc,31
0,,"また立ちはだかる魔物が
課題中にすべていなくなったら
再度出直してくるがいい","If all fiends in the trial vanish, return and try again later",ui\00_message\quest\q60000009.gmd,\quest\q60000009.arc,q60000009.arc,32
0,,"さあ、《修練の祠》へ行くんだ
案内人は神殿を出て左手を進めば、崖の上さ","Now, go to the Training Chapel.
The guide is on your left as you 
exit the temple, at the top of the cliff.",ui\00_message\quest\q60000009.gmd,\quest\q60000009.arc,q60000009.arc,33
0,,"《魔弓の証》、よくぞ得た！
ジョブについての理解も、さらに深まったようだな
神殿に戻りレンテンに報告するがいい、覚者よ！","You've obtained the Element Archer's Mark! 
Your understanding
of the job has deepened.
Return to the temple and
report to Renton, Arisen!",ui\00_message\quest\q60000009.gmd,\quest\q60000009.arc,q60000009.arc,34
0,,<COL ff7575><KCT ATTACK1></COL>の破斬で敵を攻撃するんだ！,<COL ff7575><KCT ATTACK1></COL> attacks the enemy with Hack!,ui\00_message\quest\q60000010.gmd,\quest\q60000010.arc,q60000010.arc,0
0,,ジャンプ中に<COL ff7575><KCT ATTACK1></COL>で空破斬だ。敵を頭上から攻撃するんだ！,"Press <COL ff7575><KCT ATTACK1></COL> mid-jump for Aerial Hack. 
Strike enemies from above!",ui\00_message\quest\q60000010.gmd,\quest\q60000010.arc,q60000010.arc,1
0,,敵をダウンさせやすいので追撃に効果的だぞ！,"It easily downs enemies, 
making it great for follow-ups!",ui\00_message\quest\q60000010.gmd,\quest\q60000010.arc,q60000010.arc,2
0,,<COL ff7575><KCT ATTACK2></COL>で魔人斬りだ！渾身の一撃を叩きこめ！,"Use <COL ff7575><KCT ATTACK2></COL> for Arc of Might! 
Deliver a mighty blow!",ui\00_message\quest\q60000010.gmd,\quest\q60000010.arc,q60000010.arc,3
0,,空破斬で敵をダウンさせた状態で行うと当てやすいぞ！,"It's easier to hit when you do it while 
the enemy is downed from an Aerial Hack!",ui\00_message\quest\q60000010.gmd,\quest\q60000010.arc,q60000010.arc,4
0,,今度は、魔人斬りをジャストタイミングで叩き込め！ゲージが満ち光る瞬間が、最も破壊力が高まるその時だ！,"Now, time Savage Lash perfectly! 
The gauge glows brightest at peak power!",ui\00_message\quest\q60000010.gmd,\quest\q60000010.arc,q60000010.arc,5
0,,<COL ff7575><KCT AVOID></COL>で耐魔の身構えだ！,Press <COL ff7575><KCT AVOID></COL> for Brace!,ui\00_message\quest\q60000010.gmd,\quest\q60000010.arc,q60000010.arc,6
0,,敵からのダメージを最小限にしつつ、効果的にリベンジゲージを溜めれるぞ！,"Keep enemy damage to a minimum while 
efficiently building up the Revenge gauge!",ui\00_message\quest\q60000010.gmd,\quest\q60000010.arc,q60000010.arc,7
0,,リベンジゲージは左上の体力ゲージ下にあるから蓄積量を確認しろ！,"The Revenge Gauge is in the upper left corner, 
below the health bar, 
so check the amount you've accumulated!",ui\00_message\quest\q60000010.gmd,\quest\q60000010.arc,q60000010.arc,8
0,,リベンジゲージを溜めた後、魔人斬りをもう一度敵に叩き込め！ゲージを消費するが威力が格段に上がるぞ！,"After filling the Revenge gauge, 
unleash Savage Lash again! 
It consumes gauge, but boosts power!",ui\00_message\quest\q60000010.gmd,\quest\q60000010.arc,q60000010.arc,9
0,,よし、では祠の奥へ向かい大型敵と対峙だ！大型敵の<COL ff7575>＜怒り状態＞</COL>に注意しろ！,"Alright, head deeper into the chapel to face a Large enemy! Watch for its <COL ff7575>＜Anger state＞</COL>!",ui\00_message\quest\q60000010.gmd,\quest\q60000010.arc,q60000010.arc,10
0,,そして<COL ff7575><KCT TOUCH></COL>でヤツにしがみつけ！,Now use <COL ff7575><KCT TOUCH></COL> to climb onto it!,ui\00_message\quest\q60000010.gmd,\quest\q60000010.arc,q60000010.arc,11
0,,その状態で<COL ff7575><KCT ATTACK1></COL>で魔倒斬りだ！,"While clinging, use <COL ff7575><KCT ATTACK1></COL>
to perform an Inverse Slash!",ui\00_message\quest\q60000010.gmd,\quest\q60000010.arc,q60000010.arc,12
0,,では大型敵の<COL ff7575>＜怒り状態＞</COL>に注意してヤツを仕留めるんだ！,Now watch the Large enemy's <COL ff7575>＜Anger state＞</COL> and take it down!,ui\00_message\quest\q60000010.gmd,\quest\q60000010.arc,q60000010.arc,13
0,,揺さぶり、疲れさせてチャンスを作るんだぞ！,"Shake it, wear it down, and create an opening!",ui\00_message\quest\q60000010.gmd,\quest\q60000010.arc,q60000010.arc,14
0,,試練完了、よくやったな！奥にある＜剛剣の証＞を受け取り、神殿のレンテンに報告するがいい,"Trial complete, well done! 
Take the <Warrior's Mark> in the back 
and report to Renton at the temple",ui\00_message\quest\q60000010.gmd,\quest\q60000010.arc,q60000010.arc,15
0,,"おめでとう、覚者よ
これにて戦術試練は完了だ！","Congratulations, Arisen.
The tactical trial is now complete!",ui\00_message\quest\q60000010.gmd,\quest\q60000010.arc,q60000010.arc,16
0,,"今覚えたウォリアーの戦い方を
振り返りたい時は、《チュートリアルガイド》の
《ジョブの操作と役割》からウォリアーの戦法や
戦術的役割を確認するんだ","To review the Warrior's combat style
you just learned, check 《Tutorial》→
《Job Roles》for tactics and duties.",ui\00_message\quest\q60000010.gmd,\quest\q60000010.arc,q60000010.arc,17
0,,"ウォリアーの技は己を削り、敵を砕くものだという
くれぐれも無理はしすぎるなよ","Warrior skills grind down both
yourself and enemies.
Don't overdo it, understand?",ui\00_message\quest\q60000010.gmd,\quest\q60000010.arc,q60000010.arc,18
0,,よぉよぉ、また来たな！！,"Hey hey, you're back!!",ui\00_message\quest\q60000010.gmd,\quest\q60000010.arc,q60000010.arc,19
0,,"ウォリアーとはなにか――
この挑戦はその答えを導くものかも知れない！
なんてな！","The warrior's essence -
this trial might uncover it!
...Maybe!",ui\00_message\quest\q60000010.gmd,\quest\q60000010.arc,q60000010.arc,20
0,,"試練は決まりとして
今回も一人で挑んでもらうことになる","As a rule, trials must be faced alone.
This time will be no exception.",ui\00_message\quest\q60000010.gmd,\quest\q60000010.arc,q60000010.arc,21
0,,"準備ができたら神殿を出て、左手の崖を伝って行け
場所はまた《修練の祠》さ
まず祠内の案内人、騎士団員と話すんだぞ","Once prepared, exit the temple
and take the left cliff path.
It's the Training Chapel once again.
Begin by talking to the
knight within.",ui\00_message\quest\q60000010.gmd,\quest\q60000010.arc,q60000010.arc,22
0,,"今回の試練、うまくいったんだって？
やっぱりさすがだなぁ！
ウォリアーか、俺もいつかはやってみたいな","Trial went well? You're
as skilled as ever! Makes
me wanna try the warrior life!",ui\00_message\quest\q60000010.gmd,\quest\q60000010.arc,q60000010.arc,23
0,,"また転職したら、いつでも来いよ
っていうかそのうち俺にも、あんた流
戦いのコツとか教えてくれよな","If you change jobs again, come any time.
Actually, teach me your fighting tips
one of these days, will you?",ui\00_message\quest\q60000010.gmd,\quest\q60000010.arc,q60000010.arc,24
0,,"覚者とは試練に臆することなく立ち向かい
その使命を全うする者のことだ",An Arisen faces trials without fear and fulfills their duty,ui\00_message\quest\q60000010.gmd,\quest\q60000010.arc,q60000010.arc,25
0,,"与えられた試練を全てこなせた者のみ
《剛剣の証》を得ることができる","Only those who finish every
given trial can receive
the 《Warrior's Mark.》",ui\00_message\quest\q60000010.gmd,\quest\q60000010.arc,q60000010.arc,26
0,,"各試練のやり方について
わからなければ、今までに得た知識を
確認しながら臨むがいい","If unsure about any trial, review the knowledge you've gained so far",ui\00_message\quest\q60000010.gmd,\quest\q60000010.arc,q60000010.arc,27
0,,"技や動きの参考のため
一人、共闘の兵をつけておこう
課題をこなす中で戦技を身に刻め！","For reference, I'll assign a Pawn to fight alongside you. Master combat skills during the trial!",ui\00_message\quest\q60000010.gmd,\quest\q60000010.arc,q60000010.arc,28
0,,"与えられた試練を全てこなせた者のみ
《剛剣の証》を得ることができる","Only those who finish every
given trial can receive
the 《Warrior's Mark.》",ui\00_message\quest\q60000010.gmd,\quest\q60000010.arc,q60000010.arc,29
0,,"各試練のやり方について
わからなければ今までの得た知識を
確認しながら臨むがいい","If unsure about any trial, review the knowledge you've gained so far",ui\00_message\quest\q60000010.gmd,\quest\q60000010.arc,q60000010.arc,30
0,,"また立ちはだかる魔物が
課題中にすべていなくなったら
再度出直してくるがいい","If all fiends in the trial vanish, return and try again later",ui\00_message\quest\q60000010.gmd,\quest\q60000010.arc,q60000010.arc,31
0,,"さあ、《修練の祠》へ行くんだ
案内人は神殿を出て左手を進めば、崖の上さ","Now, go to the Training Chapel.
The guide is on your left as you 
exit the temple, at the top of the cliff.",ui\00_message\quest\q60000010.gmd,\quest\q60000010.arc,q60000010.arc,32
0,,"《剛剣の証》、よくぞ得た！
ジョブについての理解も、さらに深まったようだな
神殿に戻りレンテンに報告するがいい、覚者よ！","You've obtained the Warrior's Mark! 
Your understanding of the job has deepened.
Return to the temple and
report to Renton, Arisen!",ui\00_message\quest\q60000010.gmd,\quest\q60000010.arc,q60000010.arc,33
0,,<COL ff7575><KCT ATTACK1></COL>でアルケムだ！錬成物質を付着させた敵は、お前への敵意が上がるぞ！,"<COL ff7575><KCT ATTACK1></COL> is Alchemy! 
Foes imbued with alchemical compounds 
will prioritize you as prey!",ui\00_message\quest\q60000011.gmd,\quest\q60000011.arc,q60000011.arc,0
0,,錬成物質のついていない敵を狙うがいい！,"Focus fire on enemies
without alchemical compounds!",ui\00_message\quest\q60000011.gmd,\quest\q60000011.arc,q60000011.arc,1
0,,<COL ff7575><KCT ATTACK2></COL>でクラスターだ！,<COL ff7575><KCT ATTACK2></COL> is Cluster!,ui\00_message\quest\q60000011.gmd,\quest\q60000011.arc,q60000011.arc,2
0,,錬成物質のついていない敵を狙うがいい！,"Focus fire on enemies
without alchemical compounds!",ui\00_message\quest\q60000011.gmd,\quest\q60000011.arc,q60000011.arc,3
0,,錬成物質は錬金術の攻撃媒体にもなる。覚えておくんだ,"Alchemical compounds can also serve
as an offensive medium. Remember this well.",ui\00_message\quest\q60000011.gmd,\quest\q60000011.arc,q60000011.arc,4
0,,アルケムやクラスターで攻撃するほど、錬成物質は多く付着する！それに応じて敵の注意の強さや、解放時の攻撃力が上がるのだ！,"The more you attack with Alchemy or Cluster, 
the more alchemical compounds attach! 
This increases the enemy's aggression level 
and the power of the Release attack!",ui\00_message\quest\q60000011.gmd,\quest\q60000011.arc,q60000011.arc,5
0,,敵が攻撃する瞬間に<COL ff7575><KCT AVOID></COL>でアルケム・フーガだ！,"Now's the time for Alchemical Fuga! 
Dodge with <COL ff7575><KCT AVOID></COL> when the
enemy attacks!",ui\00_message\quest\q60000011.gmd,\quest\q60000011.arc,q60000011.arc,6
0,,敵の攻撃を回避しつつ、錬成物質を放て！,"Dodge enemy attacks while 
unleashing alchemical compounds!",ui\00_message\quest\q60000011.gmd,\quest\q60000011.arc,q60000011.arc,7
0,,アルケムやクラスターで攻撃し、２体以上の敵へ新たに錬成物質を付着させるのだ！,"Attack with Alchemy or Cluster to attach 
alchemical compounds to two or more enemies!",ui\00_message\quest\q60000011.gmd,\quest\q60000011.arc,q60000011.arc,8
0,,敵に付着した錬成物質は放置してると消えるから注意だ,"Applied alchemical compounds
dissipate over time. Act fast!",ui\00_message\quest\q60000011.gmd,\quest\q60000011.arc,q60000011.arc,9
0,,<COL ff7575><KCT SKILL_NORMAL1></COL>でエリクシル！,<COL ff7575><KCT SKILL_NORMAL1></COL> is Elixir!,ui\00_message\quest\q60000011.gmd,\quest\q60000011.arc,q60000011.arc,10
