0,,"“ベルタの盗賊団”といやぁ
このあたりでは名が知れてるはず","""Bertha's Bandits""—yeah, the name's
known around these parts.",ui\00_message\quest\q10300303.gmd,\quest\q10300303.arc,q10300303.arc,69
0,,"運んできた食料は渡しておくから
“あっしさん”に一声かけてきてね！","I’ve left the supplies here for you.
Please inform Ser Ash of our arrival.",ui\00_message\quest\q10300400.gmd,\quest\q10300400.arc,q10300400.arc,18
0,,"“ナワバリ”ってやつ？
このあたりにもいるんだねー","They're protecting their territory.
So, goblins are here too.",ui\00_message\quest\q10300400.gmd,\quest\q10300400.arc,q10300400.arc,53
0,,"そうねー
“まずまずの食べごろ”ってところね！","Hmm...
""Just about ripe for eating,"" I'd say!",ui\00_message\quest\q10300400.gmd,\quest\q10300400.arc,q10300400.arc,66
0,,"“ブタの鼻占い”によると
運勢は最高ね！
行くっきゃないよ！例の場所！","'Pig Snout Fortune' says we're lucky right now!
Let's go to that place!",ui\00_message\quest\q10300400.gmd,\quest\q10300400.arc,q10300400.arc,68
0,,"ここ――“あっしさん”から聞いた
特別な場所なんだー
たくさん食料見つかるかも！","This place... I heard from
'Mr. Ash' that it's special.
We might find a lot of food here.",ui\00_message\quest\q10300400.gmd,\quest\q10300400.arc,q10300400.arc,76
0,,"盗賊の親分さんに“魚を獲ってくる係”に
任命されたから、身近で水気のある洞窟に
檻を置いたらしいの――","They were assigned as the 'fish
catcher' by the bandit leader,
so they placed a cage in a
damp cave nearby...",ui\00_message\quest\q10300401.gmd,\quest\q10300401.arc,q10300401.arc,1
0,,"今ってさ、湖畔――
つまり、水辺に向かってるんだよね――？
“アイツ”がいるかもしれないよね？","We're headed to the lakeside now…
Specifically, towards the water's edge, right?
There's a chance 'it' is there, isn’t there?",ui\00_message\quest\q10300401.gmd,\quest\q10300401.arc,q10300401.arc,12
0,,"言っておくけど、“アイツ”を見たら
アタシどうなっちゃうかわかんないからね！","Let me warn you, if I encounter 'it'—
I have no idea what I'll do!",ui\00_message\quest\q10300401.gmd,\quest\q10300401.arc,q10300401.arc,18
0,,"“アイツ”――大っ嫌いなの
名前も口に出したくないくらい","'It'—I really despise it.
I hate it so much I won't speak its name.",ui\00_message\quest\q10300401.gmd,\quest\q10300401.arc,q10300401.arc,19
0,,"うっ、腕が鳥肌になっちゃってる――
もうほんとにダメなのよ、“アイツ”だけは！","Ugh, I'm getting goosebumps—
I absolutely can't deal with 'that', not at all!",ui\00_message\quest\q10300401.gmd,\quest\q10300401.arc,q10300401.arc,22
0,,"そうだ！
あの子の名前、“ペコ”ってどう？
会うたびいつも、“腹ペコ”だからね","Ah, right!
That kid's name, 'Peko'—
what do you think?
It's 'cause we always meet
when we're peckish!",ui\00_message\quest\q10300401.gmd,\quest\q10300401.arc,q10300401.arc,32
0,,"《嫌な思い出の湖畔》は――
前に“アイツ”がいたよね？
食料があるとか、そういう問題じゃなく――！","The《Lake of Bitter Memories...》
Remember when “that thing” was there? 
Food isn't the issue here―!",ui\00_message\quest\q10300402.gmd,\quest\q10300402.arc,q10300402.arc,16
0,,"うんうん、実に“賢明な判断”！
気軽にお散歩しながら食料確保できるからね
最高のルートだと思うな","Mhm, that’s what I call a
smart choice!
You can secure provisions
while having a nice walk—
I think it’s the perfect route.",ui\00_message\quest\q10300402.gmd,\quest\q10300402.arc,q10300402.arc,20
0,,"アタシの“ダッシュ食料探し”も
もはや職人の域だね！","My ""Food Hunting Dash"" has reached
the level of a true artisan!",ui\00_message\quest\q10300402.gmd,\quest\q10300402.arc,q10300402.arc,24
0,,"そうだ！
盗賊のスニーカーさんが教えてくれた
“秘密のスポット”行っちゃわない？","That's right!
That bandit, Sunika, told us about
that secret spot. Wanna go?",ui\00_message\quest\q10300402.gmd,\quest\q10300402.arc,q10300402.arc,33
0,,"《嫌な思い出の湖畔》は――
前に“アイツ”がいたよね？
食料があるとか、そういう問題じゃなく――！","The《Lake of Bitter Memories》―― 
remember when “that thing” was there? 
Food isn't the issue here――!",ui\00_message\quest\q10300402.gmd,\quest\q10300402.arc,q10300402.arc,43
0,,"うんうん、実に“賢明な判断”！
気軽にお散歩しながら食料確保できるからね
最高のルートだと思うな","Yes, yes, a very ""wise decision"" indeed! 
It's the best route to secure food while 
taking a casual stroll.",ui\00_message\quest\q10300402.gmd,\quest\q10300402.arc,q10300402.arc,47
0,,"ほら！　ほら！
やっぱり“アイツ”が出たじゃない！","See? Look!
I knew it!",ui\00_message\quest\q10300402.gmd,\quest\q10300402.arc,q10300402.arc,51
0,,"ヒッ――入ってる――
なんか、“尻尾”みたいなものが――","Gah—there’s something in here—
some kind of tail or something...",ui\00_message\quest\q10300402.gmd,\quest\q10300402.arc,q10300402.arc,54
0,,"ねぇ！
これって“アイツ”のだよね！？
アタシ、混乱のあまり――
食料埋めた手で“アイツ”の尻尾を！？","Hey!
This is from that thing, isn’t it!?
In all my confusion—
did I bury its tail with the food!?",ui\00_message\quest\q10300402.gmd,\quest\q10300402.arc,q10300402.arc,55
0,,"ん――？　いない！
“アイツ”らがいない！　やったぁ！","Huh? They're gone!
Those things are gone! Yes!",ui\00_message\quest\q10300402.gmd,\quest\q10300402.arc,q10300402.arc,57
0,,"よ、よし――
最後まで出なかった、“アイツ”
よかった――","O-okay...
That thing never showed up in the end.
Thank goodness...",ui\00_message\quest\q10300402.gmd,\quest\q10300402.arc,q10300402.arc,59
0,,"“秘密のスポット”に到着！
危険と食料が隣り合わせのこの匂い――
何が起きるか分かんないから、全力で行くよ！","Here we are at the 'secret spot!'
I can smell danger and food
right next to each other—
No idea what’s coming,
so I’m going in full force!",ui\00_message\quest\q10300402.gmd,\quest\q10300402.arc,q10300402.arc,61
0,,"では――
“食料大量大作戦”開始！","Well then―― 
let the ""Grand Food Gathering Operation"" 
commence!",ui\00_message\quest\q10300402.gmd,\quest\q10300402.arc,q10300402.arc,64
0,,"キャリーが“盗賊からの変な情報”で
興奮気味だったと聞いたから
嫌な予感がして追いかけてきたんだ","I heard Carrie was getting excited
over some 'weird info from the bandits,'
so I had a bad feeling and came after her.",ui\00_message\quest\q10300402.gmd,\quest\q10300402.arc,q10300402.arc,65
0,,"“幻の食材”の話――
聞きたいよね？","The story of the ""Phantom Ingredient""―
You want to hear it, don't you?",ui\00_message\quest\q10300403.gmd,\quest\q10300403.arc,q10300403.arc,1
0,,"せめてその鍋に入っていた
“フワフワなのに、ワイルドな噛みごたえ”
なお肉の正体を知りたいんだって","At the very least, they
want to know what kind of
meat was in that pot—
the one described as
""Soft and fluffy, but with a toothsome bite.""",ui\00_message\quest\q10300403.gmd,\quest\q10300403.arc,q10300403.arc,6
0,,"よし！
“幻の食材”が逃げちゃわないうちに、出発！","Alright! Let's head out before the
""Phantom Ingredient"" gets away!",ui\00_message\quest\q10300403.gmd,\quest\q10300403.arc,q10300403.arc,13
0,,"ねぇねぇ！
“幻の食材”の正体、何だと思う？","Hey hey! What do you think the true
identity of the ""Phantom Ingredient"" is?",ui\00_message\quest\q10300403.gmd,\quest\q10300403.arc,q10300403.arc,15
0,,"やめてよね
“アイツ”が美味しいわけないじゃない","Come on, stop it—
there's no way that thing
could taste good.",ui\00_message\quest\q10300403.gmd,\quest\q10300403.arc,q10300403.arc,21
0,,"“野生のざわめき”を感じたような――
“幻の食材”と、何か関係があるのかな？","It felt like I sensed some
kind of 'wild stirring'—
maybe it's connected to
the 'phantom ingredient'?",ui\00_message\quest\q10300403.gmd,\quest\q10300403.arc,q10300403.arc,24
0,,"こんなすごいの、今まで見たことないよ
これが“幻”かと思った――
目の前がイノシシで埋め尽くされて――","This is incredible-
I've never seen anything like it!
It felt like a dream-
my whole view just filled with boars!",ui\00_message\quest\q10300403.gmd,\quest\q10300403.arc,q10300403.arc,27
0,,"アタシの野生の勘が“危ない”って言ってるんだ
とにかくここ、離れよ？","My gut's telling me this is seriously bad―
let's just get away from this place, okay?",ui\00_message\quest\q10300403.gmd,\quest\q10300403.arc,q10300403.arc,35
0,,"じ、実は――“幻の食材”が諦められずに
今度はもっと頑丈な檻を仕掛けて
草葉の陰からこっそり見張ってたんですがね","W-well… The truth is—
I just couldn't give up on that 
'Phantom Ingredient,' 
so I set up a sturdier cage this time
and have been hiding in the grass, 
keeping watch…",ui\00_message\quest\q10300403.gmd,\quest\q10300403.arc,q10300403.arc,61
0,,"いや、情けない話で――
だけど“ヤツ”は必ず現れてるはずなんでさ！","Embarrassing to admit, but—
that thing has to appear eventually!",ui\00_message\quest\q10300403.gmd,\quest\q10300403.arc,q10300403.arc,63
0,,"じ、実は――“幻の食材”が諦められずに
今度はもっと頑丈な檻を仕掛けて
草葉の陰からこっそり見張ってたんですがね","Actually, I just couldn't give up on the “Phantom Ingredient.”
So I set up a sturdier cage this time, and I've been 
secretly watching from the grassy knoll.",ui\00_message\quest\q10300403.gmd,\quest\q10300403.arc,q10300403.arc,66
0,,"いや、情けない話で――
だけど“ヤツ”は必ず現れてるはずなんでさ！","I know, it's pathetic.
But I'm sure it's out there!",ui\00_message\quest\q10300403.gmd,\quest\q10300403.arc,q10300403.arc,68
0,,"お願いしますよ――
どうしても“幻の食材”が諦められねぇんです","Please—
I can't let go of that 'Phantom Ingredient'!",ui\00_message\quest\q10300403.gmd,\quest\q10300403.arc,q10300403.arc,70
0,,"今頃、“ヤツ”は必ず現れてるはずなんでさ
そこを覚者さんの腕っぷしで何とか――！","That thing's gotta show up any moment now—
Use your legendary strength, Ser Arisen!",ui\00_message\quest\q10300403.gmd,\quest\q10300403.arc,q10300403.arc,71
0,,"それにしても、やっぱり“幻の食材”は気になるな
さっきはとんでもない目にあったけど――
今度は檻にかかってるかもしれないんだよね？","I still can't forget that Phantom Ingredient.
Sure, last time was rough, but—
Think it might be in our cage this time?",ui\00_message\quest\q10300403.gmd,\quest\q10300403.arc,q10300403.arc,73
0,,“幻の食材”探し、いつでも出発できるよ！,"The hunt for the ""Phantom Ingredient""
can begin whenever you're ready!",ui\00_message\quest\q10300500.gmd,\quest\q10300500.arc,q10300500.arc,1
0,,"せっかく盛り上がったのに――！
早くしないと、“幻の食材”が
幻そのものになっちゃうよ","Just when things were getting exciting—!
If we don't hurry, the ""phantom ingredient""
will vanish into thin air!",ui\00_message\quest\q10300500.gmd,\quest\q10300500.arc,q10300500.arc,10
0,,"スニーカーさんが食べたかった鍋は
作ってあげられないけど
これで“幻の食材”の謎が解けたね！","I can't make the hotpot you wanted, but we solved
the mystery of the ""phantom ingredient""!",ui\00_message\quest\q10300500.gmd,\quest\q10300500.arc,q10300500.arc,16
0,,"え？
“幻の食材”の正体が分かったって？","Eh? 
You figured out the true identity of 
the ""phantom ingredient""?",ui\00_message\quest\q10300500.gmd,\quest\q10300500.arc,q10300500.arc,19
0,,"せめて“どんくさい一匹”だけでも
捕まえられたら良かったんですがね――","Just one slow-footed critter—
Was that too much to ask for?",ui\00_message\quest\q10300500.gmd,\quest\q10300500.arc,q10300500.arc,23
0,,"逃げた方向から察するに――
やつら、きっと“根城”にしてる
遺跡に行ったに違いありませんぜ","Judging from the direction they fled―
they must have gone to the ruins
that serve as their hideout.",ui\00_message\quest\q10300500.gmd,\quest\q10300500.arc,q10300500.arc,25
0,,"さっそく<NPC 4773>に
“幻の食材”の正体を伝えてあげなくっちゃ","I have to tell <NPC 4773> the truth
about the Phantom Ingredient right away.",ui\00_message\quest\q10300500.gmd,\quest\q10300500.arc,q10300500.arc,27
0,,"ゴブリンたちの中にいた
“一匹だけどんくさいの”って
もしかして――","The single slowpoke in the pack—
Don’t tell me…",ui\00_message\quest\q10300500.gmd,\quest\q10300500.arc,q10300500.arc,29
0,,"え？　ええ――
確かに見ましたぜ、“どんくさいゴブリン”","Huh? Yeah—
I definitely saw that ""slow-witted goblin.""",ui\00_message\quest\q10300500.gmd,\quest\q10300500.arc,q10300500.arc,35
0,,"幸い、逃げ遅れたそいつのおかげで
向かった場所が“遺跡”だと分かりやしたから
今となっては、ある意味感謝してますがね","Fortunately, one straggler showed us
they'd gone to the ruins.
In hindsight, I'm almost thankful.",ui\00_message\quest\q10300500.gmd,\quest\q10300500.arc,q10300500.arc,37
0,,"食料も全部取り返してもらったうえに
“幻の食材”の正体まで――","Not only did we get all the food back,
but we even uncovered the truth 
about the ""phantom ingredient""—",ui\00_message\quest\q10300500.gmd,\quest\q10300500.arc,q10300500.arc,48
0,,"食料も無事に取り戻したし！
“幻の食材”の正体も分かったし！
ペコも自由になれたし！","We’ve safely recovered the food! 
The true identity of the “phantom ingredient” 
has been revealed, and Peco is free now!",ui\00_message\quest\q10300500.gmd,\quest\q10300500.arc,q10300500.arc,53
0,,"檻をぶち破って暴れ回る“幻の食材”に――
盗賊から食料を盗むゴブリンたち","From breaking out of their cage and rampaging, 
the ""Phantom Ingredient"", and goblins 
stealing food from bandits.",ui\00_message\quest\q10300500.gmd,\quest\q10300500.arc,q10300500.arc,57
0,,"聞いていない――おかしいですね
“<NPC 3050>さんに＜５＞個納品する”
いつもお伝えしているはずなんですが",,ui\00_message\quest\q22018027.gmd,\quest\q22018027.arc,q22018027.arc,46
0,," “各地で、魔軍による一斉侵攻を確認
　至急各地に向かい、解放軍を援護してください”",,ui\00_message\quest\q22018031.gmd,\quest\q22018031.arc,q22018031.arc,10
0,,"ですが――アッカ―シェランには、古くから
こういう諺がありましてな
“オオカミは、霧深い森で狩りをする”",,ui\00_message\quest\q22018032.gmd,\quest\q22018032.arc,q22018032.arc,1
0,,"“最後まで残る者は、凍え死ぬ”
アッカ―シェランの古い諺です",,ui\00_message\quest\q22018032.gmd,\quest\q22018032.arc,q22018032.arc,4
0,,"ただし俺のモットーは
“生存こそが勝利への最善手”だ
負けようが逃げようが
生きてさえいれば最後には勝利を掴める",,ui\00_message\quest\q22018037.gmd,\quest\q22018037.arc,q22018037.arc,5
0,,"その時に頼まれたんだよ
“南の石塔に向かったはずの母に
　自分は無事に逃げ延びたから安心してくれ”
って伝えてくれってな",,ui\00_message\quest\q22018040.gmd,\quest\q22018040.arc,q22018040.arc,2
0,,"お集まりいただけたようですね
それでは、“興味深い光景”の詳細について
簡単にご説明いたします",,ui\00_message\quest\q22018046.gmd,\quest\q22018046.arc,q22018046.arc,7
0,,"何度やめるように説得しても
“まだ自分自身に納得がいっていない”
などと繰り返すばかりで言うことを聞かん",,ui\00_message\quest\q22018048.gmd,\quest\q22018048.arc,q22018048.arc,3
0,,"“王都に向けてオーク軍の進攻が一斉に開始
　覚者様も至急各地の防衛へと向かわれたし”",,ui\00_message\quest\q22018049.gmd,\quest\q22018049.arc,q22018049.arc,17
0,,"一つ、俺の依頼を聞く気はないか？
最近、目撃情報がたえない
“炎をまとった影”についてだ",,ui\00_message\quest\q22018051.gmd,\quest\q22018051.arc,q22018051.arc,0
0,,"よければ、原因を探してくれないか？
恐らくだが――
ああいったヤツらを引き連れてる
“親分”みたいな魔物がいるハズだ",,ui\00_message\quest\q22018051.gmd,\quest\q22018051.arc,q22018051.arc,3
0,,"それじゃあ、“依頼の礼”を
渡さないとな",,ui\00_message\quest\q22018052.gmd,\quest\q22018052.arc,q22018052.arc,10
0,,"言うまでもないかもしれないけど
挑むのは一人だ
ポーンや仲間の手助けはなしな","It may go without saying, but you
must challenge it alone. 
No help from Pawns or companions",ui\00_message\quest\q60000008.gmd,\quest\q60000008.arc,q60000008.arc,20
0,,"受ける準備ができたら《修練の祠》に
向かってくれよ
神殿を出て左手の崖沿いに進み
崖上にある祠の中に騎士団員がいるからさ","When ready, head to the
Training Chapel. Exit the
temple, follow the left
cliffside - a knight awaits
inside the cliff-top shrine.",ui\00_message\quest\q60000008.gmd,\quest\q60000008.arc,q60000008.arc,21
0,,"今回の試練、うまくいったか？
ソーサラーなんてすごいよなぁ！
訓練案内してる俺も、実は全然知らないんだけど","Did the trial go well?
Sorcerers are amazing, right?
I'm guiding your training,
but honestly, I don't know much!",ui\00_message\quest\q60000008.gmd,\quest\q60000008.arc,q60000008.arc,22
0,,"また転職したら、いつでも来いよ
実戦前にまずは訓練だぜ","If you switch jobs again, drop by whenever. 
Training comes before actual battle.",ui\00_message\quest\q60000008.gmd,\quest\q60000008.arc,q60000008.arc,23
0,,"覚者とは試練に臆することなく立ち向かい
その使命を全うする者のことだ",An Arisen faces trials without fear and fulfills their duty,ui\00_message\quest\q60000008.gmd,\quest\q60000008.arc,q60000008.arc,24
0,,"与えられた試練を全てこなせた者のみ
《魔攻の証》を得ることができる","Only those who complete all trials
may obtain the 《Sorcerer's Mark.》",ui\00_message\quest\q60000008.gmd,\quest\q60000008.arc,q60000008.arc,25
0,,"各試練のやり方について
わからなければ、今までに得た知識を
確認しながら臨むがいい","If unsure about any trial, review the knowledge you've gained so far",ui\00_message\quest\q60000008.gmd,\quest\q60000008.arc,q60000008.arc,26
0,,"技や動きの参考のため
一人、共闘の兵をつけておこう
課題をこなす中で戦技を身に刻め！","For reference, I'll assign a Pawn to fight alongside you. Master combat skills during the trial!",ui\00_message\quest\q60000008.gmd,\quest\q60000008.arc,q60000008.arc,27
0,,"与えられた試練を全てこなせた者のみ
《魔攻の証》を得ることができる","Only those who complete all trials
may obtain the 《Sorcerer's Mark.》",ui\00_message\quest\q60000008.gmd,\quest\q60000008.arc,q60000008.arc,28
0,,"各試練のやり方について
わからなければ今までの得た知識を
確認しながら臨むがいい","If unsure about any trial, review the knowledge you've gained so far",ui\00_message\quest\q60000008.gmd,\quest\q60000008.arc,q60000008.arc,29
0,,"また立ちはだかる魔物が
課題中にすべていなくなったら
再度出直してくるがいい","If all fiends in the trial vanish, return and try again later",ui\00_message\quest\q60000008.gmd,\quest\q60000008.arc,q60000008.arc,30
0,,"さあ、《修練の祠》へ行くんだ
案内人は神殿を出て左手を進めば
崖の上の祠内にいるよ","Now go to the Training Chapel.
Your guide is up the cliff -
leave the temple and head left.",ui\00_message\quest\q60000008.gmd,\quest\q60000008.arc,q60000008.arc,31
0,,"《魔攻の証》、よくぞ得た！
ジョブについての理解も、さらに深まったようだな
神殿に戻りレンテンに報告するがいい、覚者よ！","You've obtained the Sorcerer's Mark's Mark! 
Your understanding
of the job has deepened.
Return to the temple and
report to Renton, Arisen!",ui\00_message\quest\q60000008.gmd,\quest\q60000008.arc,q60000008.arc,32
0,,"よぉ！　珍しい戦術試練を始めたよ
エレメントアーチャーの基礎戦術についてさ","Yo! I've started exclusive trial
on basic tactics for Element Archers.",ui\00_message\quest\q60000009.gmd,\quest\q60000009.arc,q60000009.arc,0
0,,"まだあまり知られてないジョブだからこそ
訓練し甲斐もあるだろ？
もちろん今回も一人で挑戦しなきゃならない","Being a lesser-known job
makes training worthwhile,
right? Of course, you'll
face this trial alone again.",ui\00_message\quest\q60000009.gmd,\quest\q60000009.arc,q60000009.arc,1
0,,"《修練の祠》の場所はわかるよな？
神殿を出て左手、崖沿いさ
その中にいる案内人の騎士団員と話すんだ","You know where the 
《Training Chapel》 is, right?
Leave the temple and head left, 
along the cliff.
Speak with the Knight's Order member inside.",ui\00_message\quest\q60000009.gmd,\quest\q60000009.arc,q60000009.arc,2
0,,"今回の試練、うまくいったんだってな！
いやぁほんと色々なジョブやってるみたいで
尊敬するよホント","Heard your trial went great!
You're sampling every job out there.
Gotta admire that.",ui\00_message\quest\q60000009.gmd,\quest\q60000009.arc,q60000009.arc,3
0,,"また転職したら、いつでも来いよな
なんだかんだで基本は大事だぜ！","Come back anytime you change jobs.
Fundamentals matter more than you'd think!",ui\00_message\quest\q60000009.gmd,\quest\q60000009.arc,q60000009.arc,4
0,,<COL ff7575><PADM><KCT WEAPON_SUB><KEYM><KCT HOLD_BOW></KEYM></COL>で闘波の構えよ！,Use <COL ff7575><PADM><KCT WEAPON_SUB><KEYM><KCT HOLD_BOW></KEYM></COL> for Seeker Stance!,ui\00_message\quest\q60000009.gmd,\quest\q60000009.arc,q60000009.arc,5
0,,構えたまま<COL ff7575><PADM>右スティック<KEYM>マウス移動</KEYM></COL>で闘波の魔眼！複数の敵を狙って！,"Hold and use <COL ff7575><PADM>right stick<KEYM>mouse</KEYM></COL>
for Magick Eye: Seeker. 
Target multiple foes!",ui\00_message\quest\q60000009.gmd,\quest\q60000009.arc,q60000009.arc,6
0,,闘波の魔眼で敵を捉えたら、<COL ff7575><KCT SHOOT></COL>で闘波の矢を撃って！,"Once you've locked the enemy with 
Magick Eye: Seeker, fire a Seeker Arrow with 
<COL ff7575><KCT SHOOT></COL>!",ui\00_message\quest\q60000009.gmd,\quest\q60000009.arc,q60000009.arc,7
0,,闘波の魔眼で最適距離から敵を捉えて。集中力の高まりが早くなる距離があるはずよ,"Use Magick Eye: Seeker to lock
onto enemies from optimal range.
There's a sweet spot where
Concentration builds fastest.",ui\00_message\quest\q60000009.gmd,\quest\q60000009.arc,q60000009.arc,8
0,,その距離から敵を３秒以上補足し、攻撃するのよ！,"From that distance, track the enemy for three
seconds or more and attack!",ui\00_message\quest\q60000009.gmd,\quest\q60000009.arc,q60000009.arc,9
0,,闘波の魔眼で敵を捉え続け、集中力を最大まで高めるの。矢の威力が最大まで高まるわ！,"Keep the enemy in sight with Magick Eye: Seeker 
and maximize your Concentration. 
Your arrows power will reach its peak!",ui\00_message\quest\q60000009.gmd,\quest\q60000009.arc,q60000009.arc,10
0,,<COL ff7575><PADM><KCT WEAPON_MAIN><KEYM>初期設定の場合、<KCT HOLD_BOW>で構え、マウスホイール後</KEYM></COL>で助真の構えよ！,"<COL ff7575><PADM><KCT WEAPON_MAIN><KEYM>With default settings, hold <KCT HOLD_BOW> and use Mouse Wheel</KEYM></COL> to ready the bow!",ui\00_message\quest\q60000009.gmd,\quest\q60000009.arc,q60000009.arc,11
0,,構えたまま<COL ff7575><PADM>右スティック<KEYM>マウス移動</KEYM></COL>で助真の魔眼！複数の味方を捉えられるわ,"Hold and use <COL ff7575><PADM>Right Stick<KEYM>mouse</KEYM></COL>
for Magick Eye: True Aid. 
You can target multiple allies.",ui\00_message\quest\q60000009.gmd,\quest\q60000009.arc,q60000009.arc,12
0,,助真の魔眼で味方を捉えたら、<COL ff7575><KCT SHOOT></COL>で助真の矢を撃ち、回復よ！,"Once you've locked an ally with 
Magick Eye: True Aid, fire a True Aid Arrow with 
<COL ff7575><KCT SHOOT></COL> to heal them!",ui\00_message\quest\q60000009.gmd,\quest\q60000009.arc,q60000009.arc,13
0,,<COL ff7575><KCT CHANGE_ARROW></COL>で癒しの装よ。自分の体力を回復して！,"Use <COL ff7575><KCT CHANGE_ARROW></COL> for Healing Shroud.
Restore your strength!",ui\00_message\quest\q60000009.gmd,\quest\q60000009.arc,q60000009.arc,14
