Type,Japanese,English, ,English description,Vocation,Game
Bow,とどめ射ちEX,Reaper's Arrow,,An advanced form of Deathly Arrow that can be charged an additional level to loose an even mightier arrow.,Ranger,Dragon's Dogma
Augment,速治,Recuperation,,Hastens the speed with which you recover lost Health from curative magic and healing springs | Increases health recovery. | Scroll of Recuperation | 1 and 2,Augments,Dragon's Dogma
Core Skill,シールドカウンター,Reflect,,An advanced form of Repel that deflects attacks at the assailant.,Mystic Knight,Dragon's Dogma
Augment,治癒,Regeneration,,Causes your Health to slowly return with the passage of time | Heal one health every three seconds.,Magick Archer,Dragon's Dogma
Augment,激励,Reinforcement,,Pawns you aid temporarily take less damage from physical and Magick attacks | (verify),Mystic Knight,Dragon's Dogma
Core Skill,,Repel,,Use your Magick Shield to block an enemy's attack.,Mystic Knight,Dragon's Dogma
Dagger,構え直し,Reset,,"Returns the user to a neutral stance, eliminating openings caused by other actions.",Ranger,Dragon's Dogma
Augment,体術,Resilience,,Halves the severity of injuries you sustain from falling | Halves Fall Damage .,Magick Archer,Dragon's Dogma
Augment,抗体,Resistance,,Reduces cumulative damage when you are debilitated by non-Archmagick attacks | Description is misleading; actually greatly increases resistance to many sources debilitations including some from spells - in many cases practical immunity.,Magick Archer,Dragon's Dogma
Augment,助勢,Restoration,,Increases the amount of Health restored when rescuing Pawns | Pawns aided from Unconsciousness are revived with 25% more health . (Stacks with the Wanderlust Ring ).,Mystic Knight,Dragon's Dogma
Augment,鼓舞,Retribution,,Grants Pawns you aid a temporary gain in their Strength and Magick | Pawns you aid from Unconsciousness gain 20% greater Strength and Magick for 1 minute.,Mystic Knight,Dragon's Dogma
Bow,跳弾魔従2,Ricochet Hunter,,An advanced form of Ricochet Seeker that fires three magickal arrows.,Magick Archer,Dragon's Dogma
Bow,跳弾魔従,Ricochet Seeker,,Looses a magickal arrow that increases in power as it ricochets towards its target. Quite effective in cramped quarters.,Magick Archer,Dragon's Dogma
Core Skill,衝斬舞,Roundelay,,An advanced form of Two-Step that appends a whirling slash to victims.,Ranger,Dragon's Dogma
Sword,滅衝陣2,Ruinous Sigil,,An advanced form of Perilous Sigil that affects a larger area for a longer period of time.,Mystic Knight,Dragon's Dogma
Bow,挺身魔槍,Sacrifical Bolt,,Summons forth the ultimate magickal bolt at the cost of one pawn's life. Time slows while the user is aiming.,Magick Archer,Dragon's Dogma
Augment,心力,Sanctuary,,Improves your Defense and Magick Defense when you stand at death's door. | Description is erroneous - reduces physical damage to one health per strike at Critical Health . (no protection from magickal attacks),Mystic Knight,Dragon's Dogma
Augment,羅刹,Sanguinity,,"Increases your Health, but only at nightime | Increases health by 100 at night .",Assassin,Dragon's Dogma
Sword,魔人斬り,Savage Lash,,Channels the user's strength into a devastating hit that grows in power with the amount of time spent preparing.,Warrior,Dragon's Dogma
Sword,魔人突き,Savage Lunge,,"Charges forward with the blade extended, knocking down any caught in its path.",Warrior,Dragon's Dogma
Dagger,百裂斬り,Scarlet Kisses,,"Concentrates a flurry of slashes on a single point, easily shredding foes with meager endurance.",Ranger,Dragon's Dogma
Dagger,魔斬波,Scension,,"Imbues daggers with magick before an upward slash sends forth a shockwave. Saps foes' Health with holy power. Hold the assigned button to incant, release it to deploy.",Magick Archer,Dragon's Dogma
Bow,壁差し射ちEX,Secure Binder,,An advanced form of Body Binder that knocks its target farther back and pins the target for a longer period of time.,Ranger,Dragon's Dogma
Core Skill,,Seeker,,Fire magical arrows with additional properties.,Magick Archer,Dragon's Dogma
Bow,追魔弾,Seeker Bolt,,Fires magickal arrows that seek out their targets. Up to five foes can be targeted at once.,Magick Archer,Dragon's Dogma
Staff,ロックビート,Seism,,"Shakes the earth, sending eruptions of stone high into the air, stunning and damaging foes over a wide area.",Sorcerer,Dragon's Dogma
Dagger,影縫い,Shadowpin,,"Plunges the blades into the ground to form a magick sigil that traps enemies within its confines. Hold the assigned button to incant, release it to deploy.",Magick Archer,Dragon's Dogma
Dagger,影縫い2,Shadowshackle,,An advanced form of Shadowpin that extends the effective range of the sigil and persists for a longer period of time.,Magick Archer,Dragon's Dogma
Dagger,影縫いEX,Shadowsnare,,An advanced form of Shadowshackle that expands both the range and duration of its enemy-trapping sigil.,Magick Archer,Dragon's Dogma
Dagger,かまいたちEX,Shearing Wind,,"An advanced form of Cutting Wind that increase the attack range, the amount of strikes, and the speed of dash.",Ranger,Dragon's Dogma
Shield,盾惹き2,Shield Drum,,"An advanced form of Shield Summons that carries further, drawing the ire of more distant enemies.",Assassin,Dragon's Dogma
Shield,シールドアタックEX,Shield Slam,,An advanced form of Shield Strike that shrinks the user's window of vulnerability with a faster blow that forces the target to drop their guard.,Assassin,Dragon's Dogma
Shield,シールドアタック2,Shield Storm,,"An advanced form of Shield Strike that deploys more quickly, shrinking the user's window of vulnerability.",Assassin,Dragon's Dogma
Shield,シールドアタック,Shield Strike,,Strikes a blow with the shield that causes little damage but forces the target to drop their guard.,Assassin,Dragon's Dogma
Shield,盾惹き,Shield Summons,,Raps the shield loudly to attract the attention of nearby foes.,Assassin,Dragon's Dogma
Dagger,返し蹴りEX,Shirking Offensive,,"An advanced form of Escape Onslaught that adds additional attacks, and lashes out in every direction.",Assassin,Dragon's Dogma
Shield,威武気2,Showdown,,An advanced form of Staredown that greatly boost the user's Strength for a longer period of time.,Assassin,Dragon's Dogma
Bow,矢笛射ち2,Shriek Dart,,An advanced form of Whistle Dart that emits a louder cry to stun more enemies.,Strider,Dragon's Dogma
Staff,スティルネスウォーク,Silentium,,Invokes a magickal aura around the user that silences foes who enter.,Sorcerer,Dragon's Dogma
Staff,スティルネスウォーク,Silentium,,Invokes a magickal sigil around the user that silences foes who enter.,Mage,Dragon's Dogma
Augment,筋力,Sinew,,Grants you the energy to carry additional weight | Increases the maximum weight and encumbrance thresholds by 20kg.,Augments,Dragon's Dogma
Bow,綴れ射ち,Sixfold Arrow,,Fires six arrows in rapid succession.,Ranger,Dragon's Dogma
Bow,連魔弾2,Sixfold Bolt,,An advanced form of Threefold Bolt that fires still more arrows.,Magick Archer,Dragon's Dogma
Bow,貫き射ち2,Skewer Dart,,An advanced form of Puncture Dart that is capable of piercing even more targets and can also cancel a foe's block.,Assassin,Dragon's Dogma
Dagger,断頭台2,Skull Splitter,,An advanced form of Helm Splitter that employs a faster spin to deliver a greater number of slashes during the spinning dive.,Strider,Dragon's Dogma
Sword,空魔突,Sky Dance,,"Kicks at the air into a forward charge, delivering a powerful slash.",Mystic Knight,Dragon's Dogma
Sword,空魔突2,Sky Rapture,,An advanced form of Sky Dance that propels the user over a greater distance.,Mystic Knight,Dragon's Dogma
Dagger,毒針突2,Snakebite,,An advanced form of Spiderbite that knocks down targets after poisoning them with a more deadly venom.,Assassin,Dragon's Dogma
Dagger,蹴り踏みEX,Soaring Stone,,An advanced form of Leaping Stone that also yanks its victims into the air for a follow-up attack.,Strider,Dragon's Dogma
Staff,サイレンズウォーク,Sopor,,Invokes a magickal sigil around the user that lulls foes who enter it into slumber.,Mystic Knight,Dragon's Dogma
Sword,大輪斬,Spark Slash,,"Spins the blade in a swift circle, slashing at foes all around the user.",Warrior,Dragon's Dogma
Staff,マジックシェード,Spellscreen,,Invokes a magickal sigil around the user that enhances attributes. The user may move while the sigil is active.,Mage,Dragon's Dogma
Dagger,毒針突,Spiderbite,,"Halts the target with a swift thrust, then knocks them down after delivering a poison needle's kiss.",Assassin,Dragon's Dogma
Bow,渦巻き射ち2,Spiral Arrow,,An advanced form of Whirling Arrow that appends still more strikes to the barrage.,Ranger,Dragon's Dogma
Bow,爆ぜ射ち,Splinter Dart,,"Sends up an explosive arrow that splits in mid-air, showering the area with smaller missiles.",Strider,Dragon's Dogma
Shield,空舞の盾,Springboard,,Launches allies into the air using the shield. A supporting technique for tandem moves.,Assassin,Dragon's Dogma
Dagger,疾走,Sprint,,"Leans in and dashes forward with blades drawn, ready to perform further feats with additional commands. During Dash press [Jump] to jump, [Heavy Attack] to slide or [Light Attack] to cancel.",Strider,Dragon's Dogma
Augment,耐風,Stability,,Prevents mighty winds from hampering your mobility | Prevents stagger and knockdown from most wind buffets from creatures. (Doesn't improve movement in the Windworn Valley ).,Ranger,Dragon's Dogma
Shield,威武気,Staredown,,"Boosts the user's strength for a time, at the cost of lowered Defenses.",Assassin,Dragon's Dogma
Dagger,姿隠し,Stealth,,"Renders one invisible to enemies for a time, making the user impossible to hit.",Assassin,Dragon's Dogma
Dagger,蹴り踏み,Stepping Stone,,"Leaps forward in a flying kick, then uses the target as a foothold to jump still higher.",Strider,Dragon's Dogma
Sword,魔石柱2,Stone Forest,,An advanced form of Stone Grove that brings a greater number of stone pillars.,Mystic Knight,Dragon's Dogma
Sword,魔石柱,Stone Grove,,"Plunges the blade into the earth and channels magick into it, causing pillars of stone to erupt around the user.",Mystic Knight,Dragon's Dogma
Sword,魔石柱EX,Stone Jungle,,An advanced form of Stone Forest that generates an even greater number of stone pillars.,Mystic Knight,Dragon's Dogma
Augment,談判,Suasion,,Enables you to negotiate higher prices for items and equipment you sell | Items sell for 15% more. (Stacks with the same augment on other party members).,Sorcerer,Dragon's Dogma
Dagger,昇炎斬り,Sunburst,,"Kicking downward, plunges the blades into the earth, channeling magick so that a pillar of flame erupts directly ahead.",Magick Archer,Dragon's Dogma
Dagger,昇炎斬り2,Sunflare,,An advanced form of Sunburst that creates an even larger pillar of flame.,Magick Archer,Dragon's Dogma
Shield,チャリオットムーブ2,Swift Castle,,An advanced form of Moving Castle that advances even further forward while guarding.,Assassin,Dragon's Dogma
Core Skill,強刺し崩し,Takedown,,An advanced form of Empale that appends a tackle to a forceful jab.,Assassin,Dragon's Dogma
Core Skill,強刺し崩し,Takedown,,An advanced form of Empale that appends a tackle to a forceful jab.,Mystic Knight,Dragon's Dogma
Augment,渾身,Temerity,,Halves the damage taken while charging an attack | Works only for charged physical attacks not spells.,Warrior,Dragon's Dogma
Dagger,風まといEX,Tempest Harness,,An advanced form of Gale Harness that hastens the user's movement for an even longer period of time.,Assassin,Dragon's Dogma
Augment,根性,Tenacity,,"Grants a chance that any attack which would reduce your Health to 0 leaves you with 1 Health instead | May prevent being killed outright by attacks, with some exceptions. | Scroll of Tenacity | 2 and 3",Augments,Dragon's Dogma
Bow,綴れ射ち2,Tenfold Flurry,,An advanced form of Sixfold Arrow that fires ten arrows instead of six.,Ranger,Dragon's Dogma
Bow,剛力射ちEX,Terrible Bend,,An advanced form of Mighty Bend that further shortens the time required to nock the arrow.,Assassin,Dragon's Dogma
Dagger,百裂斬りEX,Thousand Kisses,,An advanced form of Hundred Kisses that heightens the speed and number of slashes in the flurry.,Ranger,Dragon's Dogma
Bow,連なり射ち,Threefold Arrow,,Fires Three arrows in rapid succession.,Strider,Dragon's Dogma
Bow,連なり射ち,Threefold Arrow,,Fires Three arrows in rapid succession.,Assassin,Dragon's Dogma
Bow,連魔弾,Threefold Bolt,,Fires three magickal arrows at a single target.,Magick Archer,Dragon's Dogma
Staff,サンダーギフト2,Thunder Affinity,,Lightning | An advanced form of Thunder Boon that augments the enchantment's duration as well as the recipient's Magick.,Sorcerer,Dragon's Dogma
Staff,サンダーギフト,Thunder Boon,,Launches a bolt of magick that enchants an ally's weapon with thunder.,Mage,Dragon's Dogma
Shield,サンダーエンチャント,Thunder Enchanter,,Enchants the weapon of both the user and any nearby pawns with Thunder.,Mystic Knight,Dragon's Dogma
Staff,サンダーギフトEX,Thunder Pact,,"An advanced form of Thunder Affinity that extends its duration and power, and further boosts the recipient's Magick.",Mage,Dragon's Dogma
Shield,サンダーガード2,Thunder Riposte,,An advanced form of Thundercounter that persists for a longer period of time and conjures High Levin .,Mystic Knight,Dragon's Dogma
Shield,サンダーガード,Thundercounter,,Unleashes a knockdown wave when the user blocks an attack. A perfect block conjures Levin .,Mystic Knight,Dragon's Dogma
Dagger,アギト裂き,Toss and Trigger,,Steps in with blade strike that sends the target aloft. Additional button presses throw and detonate a store of powder.,Ranger,Dragon's Dogma
Augment,加毒,Toxicity,,"Sharply increases the cumulative damage wrought by your poison attacks | Description is misleading; actually greatly increases the ability to inflict poison, but poison damage is not increased.",Assassin,Dragon's Dogma
Augment,狙撃,Trajectory,,"Causes your arrows to fly further | Affects bows, longbows, and magick bows. Doesn't improve damage at long range.",Ranger,Dragon's Dogma
Core Skill,,Transfix,,A stabbing strike straight forward.,Warrior,Dragon's Dogma
Bow,扇射ち,Triad Shot,,Fires three arrows in a wedge pattern.,Strider,Dragon's Dogma
Bow,扇射ち,Triad Shot,,Fires three arrows in a wedge pattern.,Assassin,Dragon's Dogma
Core Skill,追尾魔弓,True Seeker,,An advanced form of Seeker that boasts improved seeking capabilities.,Magick Archer,Dragon's Dogma
Sword,刀牙昇斬,Tusk Toss,,"Traces a grand skyward arc with the blade, sending lightweight foes into the air.",Mystic Knight,Dragon's Dogma
Core Skill,,Two Step,,A two-level stabbing strike straight forward.,Ranger,Dragon's Dogma
Sword,突き上げ斬り,Upward Strike,,Stabs foes then fiercely slashes upward. Can send foes flying high into the air.,Warrior,Dragon's Dogma
Core Skill,,Vault,,Executes a jump to a higher location.,Ranger,Dragon's Dogma
Augment,猛攻,Vehemence,,Augments your Strength | Strength is increased by 10%.,Augments,Dragon's Dogma
Augment,活性,Vigilance,,Extends the limit of your Health | Increases Health by 100,Augments,Dragon's Dogma
Staff,ディセーブルミスト,Voidspell,,Invokes a magickal sigil which restores any lowered offensive or defensive attributes of those who enter.,Sorcerer,Dragon's Dogma
Sword,魔吸陣2,Vortex Sigil,,An advanced form of Funnel Sigil that affects a larger area and remains active for a longer period of time.,Mystic Knight,Dragon's Dogma
Bow,吸魔痕2,Vortex Trail,,An advanced form of Funnel Trail that persists for a longer period of time and boasts an expanded range.,Magick Archer,Dragon's Dogma
Sword,獣惹き2,War Cry,,"An advanced form of Battle Cry that gives a roar that carries further, drawing the ire of more distant enemies.",Warrior,Dragon's Dogma
Bow,帯魔防,Ward Arrow,,Looses a magickal arrow that makes an ally impervious to all manner of debilitations for a time.,Magick Archer,Dragon's Dogma
Augment,残身,Watchfulness,,Halves the severity of wounds you sustain whilst your blade is sheathed | Halves damage taken when your blade is sheathed.,Assassin,Dragon's Dogma
Bow,渦巻き射ち,Whirling Arrow,,Looses a spinning arrow that delivers a barrage of hits to an area. Especially effective with Poison or Oil Arrows.,Ranger,Dragon's Dogma
Sword,突き上げ斬り2,Whirlwind Slash,,"An advanced form of Upward Strike. Stabs then slashes upward with greater force, sending foes even higher into the air.",Warrior,Dragon's Dogma
Bow,矢笛射ち,Whistle Dart,,"Looses an arrow that produces a piercing screech, halting foes for a moment's time.",Strider,Dragon's Dogma
Dagger,風まとい,Wind Harness,,"Hastens the user's movement for a time, even while under attack.",Assassin,Dragon's Dogma
Sword,風車斬り,Windmill Slash,,Carves foes to ribbons by spinning the blade while swinging it from side to side.,Assassin,Dragon's Dogma
Staff,ブリザードアローEX,Grand Gicel,,An advanced form of High Gicel that calls an even greater number of twisting ice spikes to thrust up from the ground.,Sorcerer,Dragon's Dogma
Staff,フリージングゾーン2,High Frazil,,An advanced form of Frazil that creates an expanded field of cold around the user that deals ice damage to those it touches.,Mystic Knight,Dragon's Dogma
Core Skill,,Feather Jump,,A light Jump. More effective when grabbing on to platforms and rocks.,Sorcerer,Dragon's Dogma
Core Skill,,Magick Bolt,,Launches a magick bolt from your staff. Press repeatedly for additional effect. Can add elemental effect via enchantments.,Sorcerer,Dragon's Dogma
Core Skill,,Magick Billow,,Emits a shockwave from your palm that sends weaker enemies or staggered stronger enemies flying away. Useful for preventing smaller enemies from swarming you. Can be used mid-air.,Sorcerer,Dragon's Dogma
Core Skill,フローティング,Levitate,,"An advanced form of Feather Jump that mitigates gravity's pull, enabling a gentle landing even from great heights.",Sorcerer,Dragon's Dogma
Core Skill,コレクトショット,Focused Bolt,,An advanced form of Magick Bolt. Focuses the user's active enchantment into a powerful burst that can be fired from the ground or air.,Sorcerer,Dragon's Dogma
Core Skill,マジックビット,Magick Agent,,An advanced form of Magick Billow. Conjures spheres of magickal energy around the user to attack encroaching foes. Also employable from mid-air.,Sorcerer,Dragon's Dogma
Staff,ファイアボール,Ingle,,"Looses a ball of fire that explodes upon contact, engulfing both the target and surrounding foes.",Sorcerer,Dragon's Dogma
Staff,フリージングゾーン,Frazil,,Creates a concentrated field of cold around the user that deals ice damage to whatever foe it touches.,Sorcerer,Dragon's Dogma
Staff,サンダーレイン,Levin,,Smites the enemy from above with tongues of lightning. Especially effective at driving foes out of hiding.,Sorcerer,Dragon's Dogma
Staff,ファイアギフト,Fire Boon,,Launches a bolt of magick that enchants an ally's weapon with fire.,Sorcerer,Dragon's Dogma
Staff,アイスギフト,Ice Boon,,Launches a bolt of magick that enchants an ally's weapon with ice.,Sorcerer,Dragon's Dogma
Staff,サンダーギフト,Thunder Boon,,Launches a bolt of magick that enchants an ally's weapon with thunder.,Sorcerer,Dragon's Dogma
Staff,ホーリーギフト,Holy Boon,,Launches a bolt of magick that enchants an ally's weapon with holy light.,Sorcerer,Dragon's Dogma
Staff,フリージングゾーン2,High Frazil,,An advanced form of Frazil that creates an expanded field of cold around the user that deals ice damage to those it touches.,Sorcerer,Dragon's Dogma
Staff,サンダーレイン2,High Levin,,An advanced form of Levin that smites foes with multiple lighting bolts from above.,Sorcerer,Dragon's Dogma
Staff,ブラインドウォーク,Blearing,,Invokes a magickal aura around the user that blinds foes who enter.,Sorcerer,Dragon's Dogma
Staff,フロストスパイク,Frigor,,Generates a giant spire of ice that can serve as a stepping stone.,Sorcerer,Dragon's Dogma
Staff,ファイアギフト2,Fire Affinity,,An advanced form of Fire Boon that augments the enchantment's duration as well as the recipient's Magick.,Sorcerer,Dragon's Dogma
Staff,アイスギフト2,Ice Affinity,,An advanced form of Ice Boon that augments the enchantment's duration as well as the recipient's Magick.,Sorcerer,Dragon's Dogma
Staff,ブラインドウォーク2,High Blearing,,"An advanced form of Blearing that invokes a larger aura around the user, blinding foes who enter.",Sorcerer,Dragon's Dogma
Staff,フレイムウォール2,High Comestion,,An advanced form of Comestion that invokes an even longer wall of flame easily able to ignite foes.,Sorcerer,Dragon's Dogma
Staff,サンダーウィップ2,High Brontide,,An advanced form of Brontide that calls forth a longer-lasting whip of lightning that drops more bolts when dismissed.,Sorcerer,Dragon's Dogma
Staff,ファイアボールEX,Grand Ingle,,An advanced form of High Ingle that looses a greater number of fiery projectiles that explode on contact.,Sorcerer,Dragon's Dogma
Staff,サンダーレインEX,Grand Levin,,An advanced form of High Levin that smites foe with an even greater number of lightning bolts.,Sorcerer,Dragon's Dogma
Staff,フロストスパイクEX,Grand Frigor,,An advanced form of High Frigor that generates an even greater quantity of icy spires.,Sorcerer,Dragon's Dogma
Staff,ファイアギフトEX,Fire Pact,,"An advanced form of Fire Affinity that extends its duration and power, and further boosts the recipient's Magick.",Sorcerer,Dragon's Dogma
Staff,アイスギフトEX,Ice Pact,,"An advanced form of Ice Affinity that extends its duration and power, and further boosts the recipient's Magick.",Sorcerer,Dragon's Dogma
Staff,サンダーギフトEX,Thunder Pact,,"An advanced form of Thunder Affinity that extends its duration and power, and further boosts the recipient's Magick.",Sorcerer,Dragon's Dogma
Staff,ホーリーギフトEX,Holy Pact,,"An advanced form of Holy Affinity that extends its duration and power, and further boosts the recipient's Magick.",Sorcerer,Dragon's Dogma
Core Skill,,Two Step,,A two-level stabbing strike straight forward.,Strider,Dragon's Dogma
Core Skill,,Vault,,Executes a jump to a higher location.,Strider,Dragon's Dogma
Core Skill,衝斬舞,Roundelay,,An advanced form of Two-Step that appends a whirling slash to victims.,Strider,Dragon's Dogma
Core Skill,連斬撃,Engrave,,An advanced form of a Carve that includes kicks after a flurry of dagger blows to strike at a broader range.,Strider,Dragon's Dogma
Core Skill,弐段跳躍,Double Vault,,An advanced form of Vault that kicks at the air to propel the user in a second leap.,Strider,Dragon's Dogma
Core Skill,転身,Forward Roll,,Curls forward into a tumble effective as an evasive maneuver.,Strider,Dragon's Dogma
Core Skill,,Loose,,Fires equipped bow. Can execute while moving.,Strider,Dragon's Dogma
Core Skill,早弓射ち,Quick-Loose,,Requires less time to notch the next arrow after firing.,Strider,Dragon's Dogma
Dagger,百裂斬り,Scarlet Kisses,,"Concentrates a flurry of slashes on a single point, easily shredding foes with meager endurance.",Strider,Dragon's Dogma
Dagger,アギト裂き,Toss and Trigger,,Steps in with blade strike that sends the target aloft. Additional button presses throw and detonate a store of powder.,Strider,Dragon's Dogma
Dagger,眩ませ縛り,Dazzle Hold,,Casts a firework explosive into the fray that stuns nearby foes.,Strider,Dragon's Dogma
Dagger,構え直し,Reset,,"Returns the user to a neutral stance, eliminating openings caused by other actions.",Strider,Dragon's Dogma
Dagger,百裂斬り2,Hundred Kisses,,"An advanced form of Scarlet Kisses that focuses a quick flurry of slashes on a single point, allowing for more strikes.",Strider,Dragon's Dogma
Dagger,構え直し2,Instant Reset,,"An advanced form of Reset employable even while under attack that returns the user to a neutral stance, eliminating openings caused by other actions.",Strider,Dragon's Dogma
Dagger,かまいたちEX,Shearing Wind,,"An advanced form of Cutting Wind that increases the attack range, the amount of strikes, and the speed of dash.",Strider,Dragon's Dogma
Dagger,百裂斬りEX,Thousand Kisses,,An advanced form of Hundred Kisses that heightens the speed and number of slashes in the flurry.,Strider,Dragon's Dogma
Bow,剛力射ち,Full Bend,,"Draws the bow with all the user's might, then looses a shot straight ahead.",Strider,Dragon's Dogma
Bow,扇討ち2,Pentad Shot,,An advanced form of Triad Shot that fires five arrows in a wedge pattern instead of three.,Strider,Dragon's Dogma
Bow,剛力射ち2,Mighty Bend,,"An advanced form of Full Bend that requires less time to nock the arrow, enabling faster successive firing.",Strider,Dragon's Dogma
Bow,連なり射ち2,Fivefold Flurry,,An advanced form of Threefold Arrow that fires five arrows in rapid succession.,Strider,Dragon's Dogma
Bow,剛力射ちEX,Terrible Bend,,An advanced form of Mighty Bend that further shortens the time required to nock the arrow.,Strider,Dragon's Dogma
Core Skill,,Vault,,Executes a jump to a higher location.,Warrior,Dragon's Dogma
Core Skill,,Vault,,Executes a jump to a higher location.,Assassin,Dragon's Dogma
Core Skill,,Onslaught,,Continuous attacks with one-handed sword.,Assassin,Dragon's Dogma
Core Skill,,Carve,,Continuous attacks with a dagger.,Assassin,Dragon's Dogma
Core Skill,,Two Step,,A two-level stabbing strike straight forward.,Assassin,Dragon's Dogma
Core Skill,,Loose,,Fires equipped bow. Can execute while moving.,Assassin,Dragon's Dogma
Core Skill,強連撃,Dire Onslaught,,An advanced form of Onslaught that strengthens a chain of one-handed sword slashes.,Assassin,Dragon's Dogma
