Type,Japanese,English, ,English description,Vocation,Game
Shield,アビスペイン2,Abyssal Anguish,,An advanced form of Dark Anguish that adds a magickal shockwave and remains active for a longer period of time.,Mystic Knight,Dragon's Dogma
Shield,ダークネスガード2,Abyssal Riposte,,An advanced form of Darkcounter that persists for a longer period of time and conjures more Darkness and has a chance to inflict Torpor.,Mystic Knight,Dragon's Dogma
Shield,ダークネスエンチャント2,Abyssal Trance,,An advanced form of Dark Enchanter that extends and amplifies the enchantment as well as the recipient's magick. Affects entire party.,Mystic Knight,Dragon's Dogma
Augment,速採,Acquisition,,Hastens the speed with which you gather and mine items | Reduces the time to mine and gather items. (Doesn't speed up filling Empty Flasks ) | Scroll of Acquisition | 1 and 2,Augments,Dragon's Dogma
Sword,恨斬,Act of Atonement,,"Damage taken while not defending is stored, lending power to a devastating counterattack. The power of the counterstrike will increase based on the damage taken.",Warrior,Dragon's Dogma
Sword,恨斬2,Act of Vengeance,,"An advanced form of Act of Atonement. The blade is held at the ready, leaving the user vulnerable but damage is channeled into an even greater counter.",Warrior,Dragon's Dogma
Augment,開眼,Acuity,,Greatly augments your Magick | Increases Magick by 20%,Sorcerer,Dragon's Dogma
Augment,巧守,Adamance,,Halves the Stamina consumed when you block attacks with your shield | Halves the stamina drain from blocking attacks with a shield.,Mystic Knight,Dragon's Dogma
Augment,密着,Adhesion,,Makes it harder for an enemy to throw you off whilst you're clinging to it | Prevents most interuption (and resultant stamina loss) whilst climbing monsters. | Scroll of Adhesion | 2 and 3,Augments,Dragon's Dogma
Dagger,アギト裂き2,Advanced Trigger,,An advanced form of Toss and Trigger that both strengthens the upward slash and broadens the subsequent blast.,Strider,Dragon's Dogma
Augment,魅了,Allure,,Doubles the increase in your affinity when you give items to non-pawns | (Probably bugged and has no significant increase in affinity gain from gifts),Magick Archer,Dragon's Dogma
Staff,ヒーリングスポット,Anodyne,,Invokes a magickal sigil which recovers the Health of those who enter.,Mage,Dragon's Dogma
Sword,刀牙昇斬2,Antler Toss,,An advanced form of Tusk Toss able to lift even heavier foes aloft as the blade traces a grand skyward arc. It can strike foes multiple times midair.,Assassin,Dragon's Dogma
Augment,耐魔,Apotropaism,,Reduces damage sustained from Magick attacks | Magick based damage is reduced by 30 Health . (more so in Hard Mode ),Mage,Dragon's Dogma
Sword,退魔剣聖斬2,Arc of Deliverance,,An advanced form of Arc of Might that channels all one's power into an even stronger blow.,Warrior,Dragon's Dogma
Sword,退魔剣聖斬,Arc of Might,,Channels a vast amount of strength into the ultimate blow. Requires the protection of one's allies whilst preparing.,Warrior,Dragon's Dogma
Sword,退魔剣聖斬EX,Arc of Obliteration,,An advanced form of Arc of Deliverance that unleashes an even mightier blow and allows faster movement while channeling.,Warrior,Dragon's Dogma
Augment,腕力,Arm-Strength,,Halves the Stamina consumed when you cling to objects or climb terrain | Halves the stamina drain when climbing . Doesn't affect climbing skill stamina use,Strider,Dragon's Dogma
Augment,速詠,Articulacy,,Diminishes the time required to intone any spell | Shortens all spell incantation time by 10%. (Stacks with Wyrmking's Ring ),Sorcerer,Dragon's Dogma
Augment,快走,Athleticism,,Reduces Stamina consumed whilst running | Reduces stamina use whilst running . | Scroll of Athleticism,Augments,Dragon's Dogma
Augment,攻魔,Attunement,,Augments your Magick | Magick is increased by 10%.,Mage,Dragon's Dogma
Augment,覇気,Audacity,,Makes you harder to knock off your feet while charging an attack | Increases knockdown and stagger resistance when charging attacks.,Warrior,Dragon's Dogma
Augment,孤高,Autonomy,,Grants you additional Strength and Defenses when you venture forth alone | When solo gain 70% Strength and Magick (reduced to 20% in Dark Arisen ). Also reduce Physical and Magick damage. (More so in Hard Mode ).,Assassin,Dragon's Dogma
Augment,覚醒,Awareness,,Greatly reduces damage sustained in Magick attacks | Reduces incoming magic damage by 50 health . (More so in Hard Mode ),Sorcerer,Dragon's Dogma
Dagger,返し蹴り,Back Kick,,Pulls back momentarily afore unleashing a frontal kick.,Assassin,Dragon's Dogma
Dagger,火炎衣,Backfire,,"Sets the user's body ablaze, eroding their own life but also causing harm to all they touch. Press the assigned button to light, press it again to extinguish.",Magick Archer,Dragon's Dogma
Augment,鉄壁,Bastion,,Greatly reduces damage sustained in physical attacks. | Mitigates incoming physical damage by 50 health points. (More so Hard Mode ),Warrior,Dragon's Dogma
Sword,獣惹き,Battle Cry,,Pierces the air with a roar that draws nearby enemies' attention.,Warrior,Dragon's Dogma
Augment,祝福,Beatitude,,Increases the duration of curative magick's effects | The sigils of healing magick such as Halidom or Anodyne lasts 50% longer.,Mage,Dragon's Dogma
Dagger,かまいたち,Biting Wind,,"Dashes past the target with blades extended, delivering slashes that can be followed with further attacks on contacs.",Strider,Dragon's Dogma
Staff,ブラインドウォーク,Blearing,,Invokes a magickal sigil around the user that blinds foes who enter.,Mage,Dragon's Dogma
Shield,ホーリーガード2,Blessed Riposte,,An advanced form of Holycounter that persists for a longer period of time and conjures more beams of Holy light.,Mystic Knight,Dragon's Dogma
Shield,ホーリーエンチャント2,Blessed Trance,,An advanced form of Holy Enchanter that extends and amplifies the enchantment as well as the recipient's magick. Affects entire party.,Mystic Knight,Dragon's Dogma
Sword,一閃突き,Blink Strike,,Rushes the target and visits a powerful blow upon them.,Assassin,Dragon's Dogma
Sword,一閃突きEX,Blitz Strike,,An advanced form of Burst Strike that moves more quickly and travels even greater distances.,Assassin,Dragon's Dogma
Shield,アイスガードEX,Blizzard Feint,,An advanced form of Frost Riposte that further extends the duration and conjures even more shards of ice.,Mystic Knight,Dragon's Dogma
Shield,アイスエンチャントEX,Blizzard Invocation,,"An advanced form of Frost Trance that is stronger, lasts longer, and further boosts the recipient's Magick.",Mystic Knight,Dragon's Dogma
Augment,修羅,Bloodlust,,"Augments your Strength and mitigates damage taken, but only at nighttime | At night gain 70% Strength and Magick . (In Dark Arisen reduced to 20%). Also reduce Physical and Magick damage (More damage reduction in Hard Mode )",Assassin,Dragon's Dogma
Bow,仕込み痺れ矢,Blunting Arrow,,Looses an arrow steeped in paralyzing elixir that induces torpor in the target.,Assassin,Dragon's Dogma
Bow,壁刺し射ち2,Body Binder,,An advanced form of Foot Binder that binds the target for a longer period of time.,Ranger,Dragon's Dogma
Staff,メテオフォール,Bolide,,Calls meteors down from the heavens to land around the user. The user may move after deployment.,Sorcerer,Dragon's Dogma
Shield,サンダーガードEX,Boltstorm Feint,,"An advanced form of Thunder Riposte that is stronger, lasts longer, and further boosts the recipient's Magick.",Mystic Knight,Dragon's Dogma
Shield,サンダーエンチャントEX,Boltstorm Invocation,,"An advanced form of Lightning Trance that is stronger, lasts longer, and further boosts the recipient's Magick.",Mystic Knight,Dragon's Dogma
Bow,帯魔剛,Bracer Arrow,,Looses a magickal arrow that fortifies an ally against reeling from enemy blows for a time.,Magick Archer,Dragon's Dogma
Dagger,断頭台EX,Brain Splitter,,An advanced form of Skull Splitter that hastens the speed of the spin in order to increase the numbers of strikes.,Strider,Dragon's Dogma
Sword,払い斬り,Broad Cut,,Cuts a broad swath with the blade while falling back to avoid attacks.,Assassin,Dragon's Dogma
Sword,払い斬り2,Broad Slash,,An advanced form of Broad Cut that allows the user to fall back in the direction of their choosing while cutting a broad swath with the weapon.,Assassin,Dragon's Dogma
Staff,サンダーウィップ,Brontide,,"Conjures a whip-like bolt of lightning capable of damaging foes. (Attack with [Heavy] and [Light] , press [Jump] to cancel.)",Sorcerer,Dragon's Dogma
Sword,一閃突き2,Burst Strike,,An advanced form of Blink Strike honed to travel greater distances before visiting a powerful blow upon foes.,Assassin,Dragon's Dogma
Sword,魔人斬りEX,Calamitous Lash,,An advanced form of Indomitable Lash that can be charged an additional level to unleash even more destructive power.,Warrior,Dragon's Dogma
Sword,魔人突きEX,Calamitous Lunge,,"An advanced form of Indomitable Lunge that moves even more quickly, and increases the distance traveled.",Warrior,Dragon's Dogma
Core Skill,,Carve,,Continuous attacks with a dagger.,Strider,Dragon's Dogma
Sword,空舞の刀身2,Catapult Blade,,An advanced form of Ladder Blade that offers the flat of the blade to allies to fling them to greater heights.,Warrior,Dragon's Dogma
Sword,無心斬2,Clairvoyance,,"An advanced form of Clarity. Holds the blade in wait, merely deflecting and countering attack from a greater range, pulling more foes into the attack.",Assassin,Dragon's Dogma
Sword,無心斬,Clarity,,"Holds the blade in wait, deflecting and seamlessly countering enemy attacks.",Assassin,Dragon's Dogma
Bow,降らし射ち,Cloudburst Volley,,Sends a wall of arrows skyward to rain down on a broad area.,Strider,Dragon's Dogma
Augment,奮迅,Clout,,Greatly augments your Strength | Increases Strength by 20%.,Warrior,Dragon's Dogma
Staff,フレイムウォール,Comestion,,"Generates a towering wall of flame; though only modest in power, it ignites adversaries with ease.",Sorcerer,Dragon's Dogma
Bow,流星射ち2,Comet Shot,,"An advanced form of Meteor Shot that lets the user adjust the arrow's range, making it easier to strike faraway foes.",Ranger,Dragon's Dogma
Sword,円月斬り,Compass Slash,,"Spins with blade extended, drawing a deadly circle especially effective when surrounded. Employable while under attack.",Assassin,Dragon's Dogma
Augment,制魔,Conservation,,"Reduces the Stamina consumed when you perform a magick weapon skill | Reduces the stamina used for both casting and holding most spells. Spells that require Magick Bows , Magick Shields , Daggers , or Swords generally do not benefit.",Sorcerer,Dragon's Dogma
Core Skill,回り受け身,Controlled Fall,,"Tucks the body into a tight roll when falling, mitigating harm.",Warrior,Dragon's Dogma
Augment,速搬,Conveyance,,Hastens your movement speed whilst carrying a person or object | Increases walking and jogging speed whilst carrying things. | Scroll of Conveyance | 1 and 2,Augments,Dragon's Dogma
Bow,渦巻き射ちEX,Corkscrew Arrow,,An advanced form of Spiral Arrow that shortens the charging time and adds still more strikes to the barrage.,Ranger,Dragon's Dogma
Sword,大輪斬2,Corona Slash,,An advanced form of Spark Slash that carves through foes in a broader radius around the user.,Warrior,Dragon's Dogma
Shield,威武気EX,Crackdown,,An advanced form of Showdown that shortens the charging period but extends the duration of Strength boost.,Assassin,Dragon's Dogma
Bow,仕込み軟体矢2,Crippling Arrow,,An advanced form of Invasive Arrow that weakens the target area for a longer period of time.,Ranger,Dragon's Dogma
Dagger,かまいたち2,Cutting Wind,,"An advanced form of Biting Wind. Slashes past the target, appending more strikes to the onslaught upon connecting with foe.",Strider,Dragon's Dogma
Augment,制動,Damping,,Decreases recoil after firing your bow | No recoil after bow or longbow shots.,Strider,Dragon's Dogma
Staff,ダークネスギフト2,Dark Affinity,,An advanced form of Dark Boon that augments the enchantment's duration as well as the recipient's Magick.,Sorcerer,Dragon's Dogma
Shield,アビスペイン,Dark Anguish,,Uses Dark magic to increase the attack range of the current weapon.,Mystic Knight,Dragon's Dogma
Staff,ダークネスギフト,Dark Boon,,Launches a bolt of magick that enchants an ally's weapon with darkness.,Sorcerer,Dragon's Dogma
Shield,ダークネスエンチャント,Dark Enchanter,,Enchants the weapon of both the user and any nearby pawns with Darkness.,Mystic Knight,Dragon's Dogma
Staff,ダークネスギフトEX,Dark Pact,,"An advanced form of Dark Affinity that extends its duration and power, and further boosts the recipient's Magick.",Sorcerer,Dragon's Dogma
Shield,ダークネスガード,Darkcounter,,Unleashes a knockdown wave when the user blocks an attack. A perfect block conjures a dark fog at the enemy that has a chance to Torpor .,Mystic Knight,Dragon's Dogma
Dagger,眩ませ縛り2,Dazzle Blast,,An advanced form of Dazzle Hold that tosses an explosive crafted to stun foes within a broader radius.,Strider,Dragon's Dogma
Dagger,眩ませ縛り,Dazzle Hold,,Casts a firework explosive into the fray that stuns nearby foes.,Ranger,Dragon's Dogma
Sword,えぐり突きEX,Deadly Gouge,,"An advanced form of Dire Gouge that boosts attack speed and frenquency, and is harder to break free of.",Assassin,Dragon's Dogma
Bow,とどめ射ち2,Deathly Arrow,,An advanced form of a Dire Arrow that increases the attack power with the amount of time spent preparing.,Ranger,Dragon's Dogma
Core Skill,,Defend,,Use your shield to block an enemy's attack.,Assassin,Dragon's Dogma
Core Skill,盾弾き,Deflect,,An advanced form of Defend that deflects attacks back toward the assailant.,Assassin,Dragon's Dogma
Shield,アビスアンガー,Demonspite,,Converts damage sustained while guarding into bolts of Dark magic. A perfect block conjures more bolts.,Mystic Knight,Dragon's Dogma
Shield,アビスアンガー2,Demonswrath,,An advanced form of Demonspite that extends the duration of the effect.,Mystic Knight,Dragon's Dogma
Shield,ダークネスガードEX,Desecration Feint,,An advanced form of Abyssal Riposte that further extends the duration and conjures even more darkness.,Mystic Knight,Dragon's Dogma
Shield,ダークネスエンチャントEX,Desecration Invocation,,"An advanced form of Abyssal Trance that is stronger, lasts longer, and further boosts the recipient's Magick.",Mystic Knight,Dragon's Dogma
Augment,探知,Detection,,"Expands one's field of vision, more easily revealing unknown areas of the map | Removes more of the fog from the map when exploring an area the first time.",Magick Archer,Dragon's Dogma
Core Skill,広角斬,Devastate,,An advanced form of Hack that extends a chain of one-handed sword slashes across a broader range.,Warrior,Dragon's Dogma
Augment,俊敏,Dexterity,,Enables you to clamber up cliffs and other terrain more quickly | No effect when climbing ladders or creatures,Strider,Dragon's Dogma
Bow,とどめ射ち,Dire Arrow,,"Focuses the user's gathered strength into a single, devastating shot that grows in power as it is charged.",Ranger,Dragon's Dogma
Sword,えぐり突き2,Dire Gouge,,An advanced form of Gouge that appends still more strikes to an onslaught on a foe the user is clinging to.,Assassin,Dragon's Dogma
Core Skill,強連撃,Dire Onslaught,,An advanced form of Onslaught that strengthens a chain of one-handed slashes.,Mystic Knight,Dragon's Dogma
Core Skill,弐段跳躍,Double Vault,,An advanced form of Vault that kicks at the air to propel the user in a second leap.,Ranger,Dragon's Dogma
Sword,直下突き2,Downcrack,,An advanced form of Downthrust that strikes twice. It is more powerful and broader in reach.,Assassin,Dragon's Dogma
Sword,直下突きEX,Downcrush,,An advanced form of Downcrack that hits for greater damage and can land additional strikes on withdrawal.,Mystic Knight,Dragon's Dogma
Bow,降らし射ち2,Downpour Volley,,An advanced form of Cloudburst Volley that expands the area of the attack.,Strider,Dragon's Dogma
Sword,直下突き,Downthrust,,"Plants the blade into the earth at one's feet. Though its range is limited, the force behind the thrust is great.",Assassin,Dragon's Dogma
Sword,直下突き,Downthrust,,"Plants the blade into the earth at one's feet. Though its range is limited, the force behind the thrust is great.",Mystic Knight,Dragon's Dogma
Bow,しじま射ちEX,Eagle Sight,,An advanced form of Lyncean Sight that increases sight range level and consumes less of the user's Stamina.,Assassin,Dragon's Dogma
Dagger,流し暗殺,Easy Kill,,"Darts behind the target after parrying their attack, then slits their throat.",Assassin,Dragon's Dogma
Sword,大輪斬EX,Ecliptic Slash,,An advanced form of Corona Slash that further widens the radius of the blade's spin.,Warrior,Dragon's Dogma
Augment,薬効,Efficacy,,Increases the potency of curatives you use | Health and Stamina gain from curatives is increased by 20%. (Doesn't directly benefit Group Curatives ),Augments,Dragon's Dogma
Augment,薬効,Efficacy,,Increases the potency of curatives you use | Health and Stamina gain from curatives is increased by 20%. (Doesn't directly benefit Group Curatives ),Ranger,Dragon's Dogma
Augment,速離,Egression,,Facilitates easier escapes from battle | Halves the L-stick wiggles needed to free yourself from grabs,Augments,Dragon's Dogma
Augment,空撃,Eminence,,Renders your jumping attacks more powerful | Boosts Strength by 30% when jumping .,Strider,Dragon's Dogma
Core Skill,,Empale,,Release a stabbing strike straight forward.,Assassin,Dragon's Dogma
Augment,魔波,Emphasis,,Augments the power of magick attacks designed to knock foes down | Increases knockdown power of most but not all spells.,Sorcerer,Dragon's Dogma
Bow,鳳凰射ち2,Endecad Shot,,An advanced form of Heptad Shot that fires eleven arrows instead of seven.,Ranger,Dragon's Dogma
Augment,練気,Endurance,,Extends the limit of your Stamina | Increases stamina by 100.,Strider,Dragon's Dogma
Core Skill,連斬撃,Engrave,,An advanced form of a Carve that includes kicks after a flurry of dagger blows to strike at a broader range.,Ranger,Dragon's Dogma
Shield,イカロスカタパルト2,Enhanced Response,,An advanced form of Flight Response that uses blocked enemy strikes to launch the user highter into air and out of harm's way.,Assassin,Dragon's Dogma
Dagger,引き寄せ,Ensnare,,"Casts out cords to snare lightweight foes, pulling them to the ground to incapacitate them.",Strider,Dragon's Dogma
Augment,夜叉,Entrancement,,"Increases your Stamina, but only at nightime | Increases stamina by 100 at night .",Assassin,Dragon's Dogma
Augment,霊力,Equanimity,,"Amplifies your Magick when you stand at death's door | At Critical Health , Magick is increased by 50%. (20% in Dark Arisen )",Mage,Dragon's Dogma
Dagger,返し蹴り2,Escape Onslaught,,An adcanced form of Back Kick. The front kick strikes with greater force and makes the user more difficult to hit.,Assassin,Dragon's Dogma
Sword,かわし斬り,Escape Slash,,Steps backward in a swift evasive maneuver while delivering a slashing blow.,Warrior,Dragon's Dogma
Core Skill,大抜き,Eviscerate,,An advances form of Transfix that withdraws the blade with a sweep after stabbing the target.,Warrior,Dragon's Dogma
Staff,インスタントキリング,Exequy,,Invokes a magickal aura capable of destroying outright any foe held within its span for a set length of time.,Sorcerer,Dragon's Dogma
Augment,本領,Exhilaration,,Provides a surge in strength when you stand at death's door | At Critical Health strength is increased by 50%. (35% in Dark Arisen ),Augments,Dragon's Dogma
Sword,かわし斬り2,Exodus Slash,,An advanced form of Escape Slash that delivers a quick evasive slash. Renders the user invulnerable for longer and allows for extra attack blow.,Warrior,Dragon's Dogma
Bow,爆散魔鋲,Explosive Bolt,,"Fires a magickal arrow that remains lodged in the target for a time, which explodes when struck with a blow.",Magick Archer,Dragon's Dogma
Bow,爆散魔鋲2,Explosive Rivet,,An advanced form of Explosive Bolt that remains lodged in its target for a longer period of time and causes more damage.,Magick Archer,Dragon's Dogma
Bow,爆散魔鋲EX,Explosive Volley,,An advanced form of Explosive Rivet that fires additional magickally explosive arrows.,Magick Archer,Dragon's Dogma
Augment,速操,Facility,,"Hastens the reloading process for ballistae, allowing you to loose bolts more quickly | Greatly increases Ballista reloading speed. | Scroll of Facility | 1 and 2",Augments,Dragon's Dogma
Bow,仕込み爆音矢2,Fearful Din,,An advanced form of Flying Din that produces an even louder noise.,Ranger,Dragon's Dogma
Core Skill,,Feather Jump,,A light jump. More effective when grabbing to platforms or rocks.,Mystic Knight,Dragon's Dogma
Augment,闘魂,Ferocity,,Increases the lethality of your Core Skills | Increases the power of all Core Skills by 10%.,Warrior,Dragon's Dogma
Staff,ファイアギフト2,Fire Affinity,,"An advanced form of Fire Boon that extends and amplifies the enchantment, as well as the recipient's Magick.",Mage,Dragon's Dogma
Staff,ファイアギフト,Fire Boon,,Launches a bolt of magick that enchants and ally's weapon with fire.,Mage,Dragon's Dogma
Shield,ファイアエンチャント,Fire Enchanter,,Enchants the weapon of both the user and any nearby pawns with Fire.,Mystic Knight,Dragon's Dogma
Staff,ファイアギフトEX,Fire Pact,,"An advanced form of Fire Affinity that extends its duration and power, and further boosts the recipient's Magick.",Mage,Dragon's Dogma
Shield,ファイアガード,Firecounter,,Unleashes a knockdown wave when the user blocks an attack. A perfect block conjures Ingle to the enemy.,Mystic Knight,Dragon's Dogma
Augment,剛腕,Fitness,,Halves the Stamina consumed when you lift objects or grapple-hold opponents | Does not work when Climbing,Augments,Dragon's Dogma
Bow,連なり射ち2,Fivefold Flurry,,An advanced form of Threefold Arrow that fires five arrows in rapid succession.,Assassin,Dragon's Dogma
Shield,ファイアガード2,Flame Riposte,,An advanced form of Firecounter that persists for a longer period of time and conjures High Ingle .,Mystic Knight,Dragon's Dogma
Shield,ファイアエンチャント2,Flame Trance,,An advanced form of Fire Enchanter that extends and amplifies the enchantment as well as the recipient's magick. Affects entire party.,Mystic Knight,Dragon's Dogma
Dagger,火炎衣EX,Flameshroud,,An advanced form of Immolation that erodes even less of the user's life yet extends the duration of the flames.,Magick Archer,Dragon's Dogma
Shield,イカロスカタパルト,Flight Response,,Uses blocked enemy strikes to launch the user into the air and out of harm's way.,Assassin,Dragon's Dogma
Augment,流断,Flow,,Keeps you from being slowed while fording water or marshland | Increases movement speed through water. | Scroll of Flow,Augments,Dragon's Dogma
Bow,仕込み爆音矢,Flying Din,,"Fires an arrow that produces a deafening blare on impact, stunning the target, through it deals nearly no damage.",Ranger,Dragon's Dogma
Core Skill,コレクトショット,Focused Bolt,,An advanced form of Magick Bolt. Focuses the users active enchantment into a powerful burst that can be fired from the ground or air.,Mystic Knight,Dragon's Dogma
Bow,壁刺し射ち,Foot Binder,,Pins the target to the nearest wall for a time with a well-placed arrow. Quite effective in cramped quarters.,Ranger,Dragon's Dogma
Augment,剛健,Fortitude,,Reduces damage sustained from physical attacks | Physical damage is reduced by 30 health . (More so in Hard Mode ),Mystic Knight,Dragon's Dogma
Augment,輝運,Fortune,,Increases the likelihood enemies will drop Rift Crystals | Increases Rift Crystal drops from foes. (Doesn't work in Hard Mode except on Bitterblack Isle ). | Scroll of Fortune,Augments,Dragon's Dogma
Core Skill,転身,Forward Roll,,Curls forward into a tumble effective as an evasive maneuver.,Ranger,Dragon's Dogma
Bow,爆ぜ射ち2,Fracture Dart,,"An advanced form of Splinter Dart. Sends up an explosive arrow that splits in mid-air, showering an even wider area with smaller missiles.",Strider,Dragon's Dogma
Staff,フリージングゾーン,Frazil,,Creates a concentrated field of cold in front of the user that freezes solid whatever enemies it visits.,Mystic Knight,Dragon's Dogma
Staff,フロストスパイク,Frigor,,Generates a giant chunk of ice that can serve as a stepping stone.,Mystic Knight,Dragon's Dogma
Shield,アイスガード2,Frost Riposte,,An advanced form of Icecounter that persists for a longer period of time and conjures High Frazil range attack.,Mystic Knight,Dragon's Dogma
Shield,アイスエンチャント2,Frost Trance,,An advanced form of Ice Enchanter that extends and amplifies the enchantment as well as the recipient's magick. Affects entire party.,Mystic Knight,Dragon's Dogma
Bow,剛力射ち,Full Bend,,"Draws the bow with all the user's might, then looses a shot straight ahead.",Assassin,Dragon's Dogma
Sword,円月斬り2,Full Moon Slash,,An advanced form of Compass Slash gifted with broader reach and the ability to hit multiple times.,Assassin,Dragon's Dogma
Sword,円月斬り2,Full Moon Slash,,An advanced form of Compass Slash gifted with a broader reach and the ability to hit multiple times.,Mystic Knight,Dragon's Dogma
Staff,サンダーケージ,Fulmination,,"Envelops the user in lightning, enabling them to electrify foes nearby and add a bit of spark to the rest of party. (Attack with [Heavy] and [Light] , press [Jump] to cancel.)",Sorcerer,Dragon's Dogma
Sword,魔吸陣,Funnel Sigil,,"Draws a magick sigil that pulls in nearby lightweight enemies, collecting them together.",Mystic Knight,Dragon's Dogma
