"old",""
"グー！？　むらさきピカピカ、王集メテル
ニンゲン、持ってキタノカ？","Rock!? Shiny purple, gathered together as kings.
Humans, did you bring it?"
"ニンゲン！　王の機嫌損ねるナ！
言ウ事従エ！　イイナ！！","Human! Do not upset the king's mood. 
Obey me! Be nice!!"
"王、ニンゲン嫌イ言ウ
覚者嫌イ言ウ
ケド、オデ知ってル","The king, despise humans.
Despise Arisen.
But, Ode know."
"王、イロイロ集める好キ
ニンゲンの道具モ、集める好キ","King likes to collect all kinds of things.
Likes to collect tools of the Human."
"王、覚者倒ス
ソレ、むらさきピカピカ取るタメ
覚者、むらさきピカピカ渡ス、王、喜ブ！","King, Arisen topples.
Take purple shiny.
Arisen, give shiny purple, king, happy!"
"グー！　コンナとこ、ナゼ来タ？","Goo!　Why are you here?"
