0,,"――だ、そうだ
なんとかこの話を覆せる《証拠》はないものか――","--So.
Is there any way to counter this with 
some evidence?",ui\00_message\event\st0472\ev000.gmd,\event\st0472\st0472ev000.arc,st0472ev000.arc,166
0,,さぁ、何を聞こうか？,"So, what shall I ask?",ui\00_message\event\st0472\ev005.gmd,\event\st0472\st0472ev005.arc,st0472ev005.arc,126
0,,Ａ、メガドに来た目的,A. Purpose of coming to Megado,ui\00_message\event\st0472\ev005.gmd,\event\st0472\st0472ev005.arc,st0472ev005.arc,127
0,,Ｂ、オーク自身について,B. About the orc themselves.,ui\00_message\event\st0472\ev005.gmd,\event\st0472\st0472ev005.arc,st0472ev005.arc,128
0,,Ｅ、悪事の証拠,E. Evidence of wrongdoing,ui\00_message\event\st0472\ev005.gmd,\event\st0472\st0472ev005.arc,st0472ev005.arc,129
0,,《証拠》を確認する,"Check the ""evidence""",ui\00_message\event\st0472\ev005.gmd,\event\st0472\st0472ev005.arc,st0472ev005.arc,130
0,,――今日はやめる,--I'm not doing this today.,ui\00_message\event\st0472\ev005.gmd,\event\st0472\st0472ev005.arc,st0472ev005.arc,131
0,,"良い調子だな――
さて、何を聞く？","You're in good shape—
Well, what to ask?",ui\00_message\event\st0472\ev005.gmd,\event\st0472\st0472ev005.arc,st0472ev005.arc,132
0,,Ａ、メガドに来た目的,A. Purpose of coming to Megado,ui\00_message\event\st0472\ev005.gmd,\event\st0472\st0472ev005.arc,st0472ev005.arc,133
0,,Ｂ、オーク自身について,B. About the orc themselves.,ui\00_message\event\st0472\ev005.gmd,\event\st0472\st0472ev005.arc,st0472ev005.arc,134
0,,Ｃ、メガド占領中の様子,"C, During the occupation of Megado.",ui\00_message\event\st0472\ev005.gmd,\event\st0472\st0472ev005.arc,st0472ev005.arc,135
0,,Ｄ、<NPC 681>とオークの癒着,D. <NPC 681> and the orc's collusion,ui\00_message\event\st0472\ev005.gmd,\event\st0472\st0472ev005.arc,st0472ev005.arc,136
0,,《証拠》を確認する,"Check the ""evidence""",ui\00_message\event\st0472\ev005.gmd,\event\st0472\st0472ev005.arc,st0472ev005.arc,137
0,,――今日はやめる,--I'm not doing this today.,ui\00_message\event\st0472\ev005.gmd,\event\st0472\st0472ev005.arc,st0472ev005.arc,138
0,,"良い調子だな――
さて、何を聞く？","You're in good shape—
Well, what to ask?",ui\00_message\event\st0472\ev005.gmd,\event\st0472\st0472ev005.arc,st0472ev005.arc,139
0,,Ａ、メガドに来た目的,A. Purpose of coming to Megado,ui\00_message\event\st0472\ev005.gmd,\event\st0472\st0472ev005.arc,st0472ev005.arc,140
0,,Ｂ、オーク自身について,B. About the orc themselves.,ui\00_message\event\st0472\ev005.gmd,\event\st0472\st0472ev005.arc,st0472ev005.arc,141
0,,Ｃ、メガド占領中の様子,"C, During the occupation of Megado.",ui\00_message\event\st0472\ev005.gmd,\event\st0472\st0472ev005.arc,st0472ev005.arc,142
0,,Ｅ、悪事の証拠,E. Evidence of wrongdoing,ui\00_message\event\st0472\ev005.gmd,\event\st0472\st0472ev005.arc,st0472ev005.arc,143
0,,《証拠》を確認する,"Check the ""evidence""",ui\00_message\event\st0472\ev005.gmd,\event\st0472\st0472ev005.arc,st0472ev005.arc,144
0,,――今日はやめる,--I'm not doing this today.,ui\00_message\event\st0472\ev005.gmd,\event\st0472\st0472ev005.arc,st0472ev005.arc,145
0,,"あと一歩だな――
よし、頼むぞ","We're just one step away—
Okay, I'll ask.",ui\00_message\event\st0472\ev005.gmd,\event\st0472\st0472ev005.arc,st0472ev005.arc,146
0,,Ａ、メガドに来た目的,A. Purpose of coming to Megado,ui\00_message\event\st0472\ev005.gmd,\event\st0472\st0472ev005.arc,st0472ev005.arc,147
0,,Ｂ、オーク自身について,B. About the orc themselves.,ui\00_message\event\st0472\ev005.gmd,\event\st0472\st0472ev005.arc,st0472ev005.arc,148
0,,Ｃ、メガド占領中の様子,"C, During the occupation of Megado.",ui\00_message\event\st0472\ev005.gmd,\event\st0472\st0472ev005.arc,st0472ev005.arc,149
0,,Ｄ、<NPC 681>とオークの癒着,D. <NPC 681> and the orc's collusion,ui\00_message\event\st0472\ev005.gmd,\event\st0472\st0472ev005.arc,st0472ev005.arc,150
0,,Ｅ、悪事の証拠,E. Evidence of wrongdoing,ui\00_message\event\st0472\ev005.gmd,\event\st0472\st0472ev005.arc,st0472ev005.arc,151
0,,《証拠》を確認する,"Check the ""evidence""",ui\00_message\event\st0472\ev005.gmd,\event\st0472\st0472ev005.arc,st0472ev005.arc,152
0,,――今日はやめる,--I'm not doing this today.,ui\00_message\event\st0472\ev005.gmd,\event\st0472\st0472ev005.arc,st0472ev005.arc,153
0,,もう沢山だ！！,Enough!,ui\00_message\event\st0472\ev005.gmd,\event\st0472\st0472ev005.arc,st0472ev005.arc,154
0,,"このままでは埒が明かない――
強硬手段が効かないか、実際に試させてもらう
覚者、悪いがこれにお前の意思は関係ない","If we continue like this, we'll get nowhere—
If strong measures don't work, 
I'll have to put them to the test myself.
Arisen, sorry, 
but your input isn't required for this.",ui\00_message\event\st0472\ev005.gmd,\event\st0472\st0472ev005.arc,st0472ev005.arc,155
0,,"少しあっちを向いていろ
お前に見せるには
少し刺激が強いからな――","Arisen, look away for a moment.
What I'm about to do is a bit too intense for 
you to see...",ui\00_message\event\st0472\ev005.gmd,\event\st0472\st0472ev005.arc,st0472ev005.arc,156
0,,"まったく、手こずらせやがって
明日はもう少し喋る気になるだろう――","You're a real hassle.
By tomorrow, you'll be more willing to talk.",ui\00_message\event\st0472\ev005.gmd,\event\st0472\st0472ev005.arc,st0472ev005.arc,157
0,,"さて――裏切り者と思わしき人間と
オークが共に居た","Now then—
The supposed traitor was seen with an orc.",ui\00_message\event\st0472\ev005.gmd,\event\st0472\st0472ev005.arc,st0472ev005.arc,158
0,,"これだけで限りなく決定的に
近い状況ではあるが、一応聞いてやる","With this alone, the situation is almost certainly 
conclusive, but I'll ask anyway.",ui\00_message\event\st0472\ev005.gmd,\event\st0472\st0472ev005.arc,st0472ev005.arc,159
0,,一体あの場所で何をしようとしていた？,What the hell were you trying to do in that place?,ui\00_message\event\st0472\ev005.gmd,\event\st0472\st0472ev005.arc,st0472ev005.arc,160
0,,何ヲシテイタカ？,What were you up to?,ui\00_message\event\st0472\ev005.gmd,\event\st0472\st0472ev005.arc,st0472ev005.arc,161
0,,"フン――愚カナ人間メ
アノ死ンダ人間ニデモ、聞イテミロ！","Hmph—Stupid humans. 
Try asking that dead human!",ui\00_message\event\st0472\ev005.gmd,\event\st0472\st0472ev005.arc,st0472ev005.arc,162
0,,"おーくガ、人間ニ降参スルコトナド
火山ガ噴火シヨウガアリエナイ！","There's no chance an orc would ever yield to 
humans, even if a volcano were to erupt!",ui\00_message\event\st0472\ev005.gmd,\event\st0472\st0472ev005.arc,st0472ev005.arc,163
0,,"チッ――
当然だが簡単に答えてはくれないか","Tch—Of course, 
it won't be easy to get answers.",ui\00_message\event\st0472\ev005.gmd,\event\st0472\st0472ev005.arc,st0472ev005.arc,164
0,,"覚者、まずは事件現場を調査して
《証拠》を手に入れよう
それを突きつけ、糸口にするんだ――","Arisen, begin by inspecting the scene
to find ""evidence.""
Use that to press for answers.",ui\00_message\event\st0472\ev005.gmd,\event\st0472\st0472ev005.arc,st0472ev005.arc,165
0,,脅す,Threaten,ui\00_message\event\st0472\ev005.gmd,\event\st0472\st0472ev005.arc,st0472ev005.arc,166
0,,《証拠》を突きつける,Present the evidence,ui\00_message\event\st0472\ev005.gmd,\event\st0472\st0472ev005.arc,st0472ev005.arc,167
0,,――やめる,-- Stop,ui\00_message\event\st0472\ev005.gmd,\event\st0472\st0472ev005.arc,st0472ev005.arc,168
0,,"どのような手を使ってでも協力してもらうぞ
まずは――この文書についてだ","No matter what methods I have to use, 
you'll cooperate. 

First, let's talk about this document.",ui\00_message\event\st0472\ev005.gmd,\event\st0472\st0472ev005.arc,st0472ev005.arc,169
0,,――！,――！,ui\00_message\event\st0472\ev005.gmd,\event\st0472\st0472ev005.arc,st0472ev005.arc,170
0,,顔色が変わったな,I see your expression has shifted.,ui\00_message\event\st0472\ev005.gmd,\event\st0472\st0472ev005.arc,st0472ev005.arc,171
0,,"お前がメガドに訪れたのは
これを届けるためだな？","You came to Megado
to deliver this, right?",ui\00_message\event\st0472\ev005.gmd,\event\st0472\st0472ev005.arc,st0472ev005.arc,172
0,,"――
――――","――
――――",ui\00_message\event\st0472\ev005.gmd,\event\st0472\st0472ev005.arc,st0472ev005.arc,173
0,,――――まぁいい,"---- Well, okay.",ui\00_message\event\st0472\ev005.gmd,\event\st0472\st0472ev005.arc,st0472ev005.arc,174
0,,"この文書――オーク軍の暗号か何かだな
なんと書いてあるか、読み上げろ","This document--
it's some kind of Orc military code or something.

What does it say? Read it out loud.",ui\00_message\event\st0472\ev005.gmd,\event\st0472\st0472ev005.arc,st0472ev005.arc,175
0,,――グハハ！,--guhaha!,ui\00_message\event\st0472\ev005.gmd,\event\st0472\st0472ev005.arc,st0472ev005.arc,176
0,,！,！,ui\00_message\event\st0472\ev005.gmd,\event\st0472\st0472ev005.arc,st0472ev005.arc,177
0,,――オ前タチ、読メナインダロウ？,"--You can't read, can you?",ui\00_message\event\st0472\ev005.gmd,\event\st0472\st0472ev005.arc,st0472ev005.arc,178
0,,"読ンデヤル――ワケナイダロウガ！
愚カダナ！　貴様ラ、愚カダナ！","Read it — why would I!
Stupid fool! You're an idiot!",ui\00_message\event\st0472\ev005.gmd,\event\st0472\st0472ev005.arc,st0472ev005.arc,179
0,,"驚いたな――
俺たち、オークにコケにされてるぞ！","Unbelievable— 
we're getting ridiculed by an orc!",ui\00_message\event\st0472\ev005.gmd,\event\st0472\st0472ev005.arc,st0472ev005.arc,180
0,,"おい、いずれ分かることなんだ――
時間を稼いでも無駄だぞ","Hey, we'll find out sooner or later--
You're wasting your time.",ui\00_message\event\st0472\ev005.gmd,\event\st0472\st0472ev005.arc,st0472ev005.arc,181
0,,グハハ！　面白イ人間ドモダ,Guhaha!　You're a funny human.,ui\00_message\event\st0472\ev005.gmd,\event\st0472\st0472ev005.arc,st0472ev005.arc,182
0,,"クソ、完全に舐められちまったようだな
――すまない","Shit, we've clearly been overcome. 
I apologize.",ui\00_message\event\st0472\ev005.gmd,\event\st0472\st0472ev005.arc,st0472ev005.arc,183
0,,"オークを動揺させるには
もっと決定的な証拠が必要だ
やはりこの文書を翻訳するしかないか――","To unsettle the orc, 
more decisive evidence is needed. 
Seems we must translate this document after all.",ui\00_message\event\st0472\ev005.gmd,\event\st0472\st0472ev005.arc,st0472ev005.arc,184
0,,"覚者、＜オーク軍の密通文書＞を翻訳する手段を
メガドで探してみよう
内容さえ分かったら、あとは突きつけてやるだけだ","Arisen, look for a method to translate the 
""Orc Army Secret Documents"" in Megado. 

Once we know its contents, 
we can present it and take action.",ui\00_message\event\st0472\ev005.gmd,\event\st0472\st0472ev005.arc,st0472ev005.arc,185
0,,脅す,Threaten,ui\00_message\event\st0472\ev005.gmd,\event\st0472\st0472ev005.arc,st0472ev005.arc,186
0,,《証拠》を突きつける,Present the evidence,ui\00_message\event\st0472\ev005.gmd,\event\st0472\st0472ev005.arc,st0472ev005.arc,187
0,,――やめる,-- Stop,ui\00_message\event\st0472\ev005.gmd,\event\st0472\st0472ev005.arc,st0472ev005.arc,188
0,,"バジットの時に世話になった<NPC 698>なら
何か知っているかもしれないな","If anyone might know something, 
it would be <NPC 698>, 
who helped us during the Basit situation.",ui\00_message\event\st0472\ev005.gmd,\event\st0472\st0472ev005.arc,st0472ev005.arc,189
0,,待たせたな,Sorry to keep you waiting.,ui\00_message\event\st0472\ev005.gmd,\event\st0472\st0472ev005.arc,st0472ev005.arc,190
0,,"手紙の内容は
""オーク軍は要請に応え、メガドに援軍を手配した""
という旨だった――間違いないな？","The content of the letter was to the effect that 
""The Orc army responded to the request and 
arranged reinforcements for Megado""

— there's no doubt about that?",ui\00_message\event\st0472\ev005.gmd,\event\st0472\st0472ev005.arc,st0472ev005.arc,191
0,,グゥ―――！,Gu---!,ui\00_message\event\st0472\ev005.gmd,\event\st0472\st0472ev005.arc,st0472ev005.arc,192
0,,"問題は――
一体誰がオークの援軍を要請したか","The question is--
who on earth called for orc reinforcements?",ui\00_message\event\st0472\ev005.gmd,\event\st0472\st0472ev005.arc,st0472ev005.arc,193
0,,"その手がかりは、ナヴィドの執事である
エニスが握っていた――はずだったんだがな","The clue was - or should have been - 
held by Navido's butler,
Ennis.",ui\00_message\event\st0472\ev005.gmd,\event\st0472\st0472ev005.arc,st0472ev005.arc,194
0,,なぜ取引相手であるエニスを殺したんだ？,"Why did you kill Ennis, your business partner?",ui\00_message\event\st0472\ev005.gmd,\event\st0472\st0472ev005.arc,st0472ev005.arc,195
0,,ウグググ――,Ugu Gu Gu...,ui\00_message\event\st0472\ev005.gmd,\event\st0472\st0472ev005.arc,st0472ev005.arc,196
0,,――ウガァァ！,--Ugaa!,ui\00_message\event\st0472\ev005.gmd,\event\st0472\st0472ev005.arc,st0472ev005.arc,197
0,,"アノ人間来タアト――
覚者、オ前ノ臭イガシタ！","After that human came—
Arisen, I smelled your stink!",ui\00_message\event\st0472\ev005.gmd,\event\st0472\st0472ev005.arc,st0472ev005.arc,198
0,,！！,！！,ui\00_message\event\st0472\ev005.gmd,\event\st0472\st0472ev005.arc,st0472ev005.arc,199
0,,"アノ人間ガ、おーく軍ヲ裏切リ、覚者ト組ンデ
俺ヲ殺ソウトシタ――ダカラ殺シタ","That human betrayed the orc army and teamed up 
with the Arisen to kill me—so I killed them.",ui\00_message\event\st0472\ev005.gmd,\event\st0472\st0472ev005.arc,st0472ev005.arc,200
0,,それは――,That is...,ui\00_message\event\st0472\ev005.gmd,\event\st0472\st0472ev005.arc,st0472ev005.arc,201
0,,"グルル！
おーくハ！　裏切リヲ！　許サナイ！","Grrr! 
Orcs! Never! Forgive traitors!",ui\00_message\event\st0472\ev005.gmd,\event\st0472\st0472ev005.arc,st0472ev005.arc,202
0,,"誤解だった――と言っても今更意味はない
それよりも、この証言を
何かに活かせないか考えよう","There's no point in 
saying it was a misunderstanding —

Rather than that,
let's think about whether this testimony 
can be used in something",ui\00_message\event\st0472\ev005.gmd,\event\st0472\st0472ev005.arc,st0472ev005.arc,203
0,,オークは裏切りを許さない――か,"Orcs are unforgiving when it 
comes to betrayal, huh...",ui\00_message\event\st0472\ev005.gmd,\event\st0472\st0472ev005.arc,st0472ev005.arc,204
0,,"取引相手すら手にかけるほど
激昂するとはな
その特性――何かに利用できるかもな","He was so enraged, he killed his own ally. 
That kind of temper... 
it might be something we can exploit.",ui\00_message\event\st0472\ev005.gmd,\event\st0472\st0472ev005.arc,st0472ev005.arc,205
0,,"現場を調べたら見つかったこの密通文書――
メガドの通称 ""ガクシャ"" に訳してもらったら
こんなことが書いてあった","The clandestine document found during 
the investigation—
when translated by the ""Scholar"" of Megado, 
it turned out to say this.",ui\00_message\event\st0472\ev005.gmd,\event\st0472\st0472ev005.arc,st0472ev005.arc,206
0,,"""オーク軍はメガドに援軍を手配した""
要請したのは、一体誰なのか――","""The Orc Army has arranged 
reinforcements for Megado""
Who exactly requested it ――",ui\00_message\event\st0472\ev005.gmd,\event\st0472\st0472ev005.arc,st0472ev005.arc,207
0,,"だが、それを知っている<NPC 586>は殺された
""覚者の臭いがしたから、裏切られたと思った""
――という動機らしい","The person who knew about it, 
<NPC 586>, was killed. 
The motive appears to be that 
""they smelled the scent of the Arisen and 
thought they had been betrayed.""",ui\00_message\event\st0472\ev005.gmd,\event\st0472\st0472ev005.arc,st0472ev005.arc,208
0,,"オークは裏切りを絶対に許さない――
この特性は利用できるかもしれないぞ
覚えておこう","Orcs never forgive betrayal --
You might be able to use this characteristic.
Let's keep that in mind.",ui\00_message\event\st0472\ev005.gmd,\event\st0472\st0472ev005.arc,st0472ev005.arc,209
0,,お前自身のことを聞かせてもらおうか,Let's hear about you.,ui\00_message\event\st0472\ev005.gmd,\event\st0472\st0472ev005.arc,st0472ev005.arc,210
0,,いつ頃からオーク軍に所属しているんだ？,Since when have you been part of the Orc Army?,ui\00_message\event\st0472\ev005.gmd,\event\st0472\st0472ev005.arc,st0472ev005.arc,211
