0,,"――だ、そうだ
なんとかこの話を覆せる《証拠》はないものか――","--So.
Is there any way to counter this with 
some evidence?",ui\00_message\event\st0472\ev000.gmd,\event\st0472\st0472ev000.arc,st0472ev000.arc,166
0,,"諸悪の根源である侯爵――
<NPC 681>を打ち倒してこそ真の平和が訪れる
そうは思わないか","True peace will come only when the root of all evil, the Marquis--
<NPC 681> is defeated.
Don't you think so?",ui\00_message\event\st0472\ev000.gmd,\event\st0472\st0472ev000.arc,st0472ev000.arc,273
0,,"――何と言われようと無理なものは無理だ
投獄だろうと処刑だろうと甘んじて受け入れる","No matter what they say, the impossible is impossible.
I'll accept whatever it is - be it prison or execution.",ui\00_message\event\st0472\ev000.gmd,\event\st0472\st0472ev000.arc,st0472ev000.arc,274
0,,――――,――――,ui\00_message\event\st0472\ev000.gmd,\event\st0472\st0472ev000.arc,st0472ev000.arc,275
0,,"くそ！
一体何が、ヤツをここまで頑なにさせる！？","Damn!
What the hell is making him so stubborn?",ui\00_message\event\st0472\ev000.gmd,\event\st0472\st0472ev000.arc,st0472ev000.arc,276
0,,"コイツは間もなく堕ちる――
あと一押し、何か《証拠》は無いのか！","This guy is going to give up shortly...
One more push, is there any more evidence we can use?",ui\00_message\event\st0472\ev000.gmd,\event\st0472\st0472ev000.arc,st0472ev000.arc,277
0,,脅す,Threaten,ui\00_message\event\st0472\ev000.gmd,\event\st0472\st0472ev000.arc,st0472ev000.arc,278
0,,《証拠》を突きつける,Present the evidence,ui\00_message\event\st0472\ev000.gmd,\event\st0472\st0472ev000.arc,st0472ev000.arc,279
0,,もどる,Back,ui\00_message\event\st0472\ev000.gmd,\event\st0472\st0472ev000.arc,st0472ev000.arc,280
0,,それは――！,That's...!,ui\00_message\event\st0472\ev000.gmd,\event\st0472\st0472ev000.arc,st0472ev000.arc,281
0,,"ある老人から預かったものだ
彼は息子を亡くしたと話していた","I got this from an old man;
he told me he lost his son.",ui\00_message\event\st0472\ev000.gmd,\event\st0472\st0472ev000.arc,st0472ev000.arc,282
0,,"男手一つで育てた息子を憲兵隊に送り出した後
連絡が取れなくなったため、殉職したものと","After sending out his son, who he raised himself, to the military police;
he lost contact and assumed his son was killed in the line of duty.",ui\00_message\event\st0472\ev000.gmd,\event\st0472\st0472ev000.arc,st0472ev000.arc,283
0,,お、親父―――,"Oh, Dad...",ui\00_message\event\st0472\ev000.gmd,\event\st0472\st0472ev000.arc,st0472ev000.arc,284
0,,"ほう、やはりお前の親父さんか
なぜ連絡してやらない？","I knew it; he's your father.
Why didn't you contact him?",ui\00_message\event\st0472\ev000.gmd,\event\st0472\st0472ev000.arc,st0472ev000.arc,285
0,,"家族と連絡を取れば、危険が及ぶからと――
上官に忠告を受けて――","My superiors told me not to contact my family 
because it might put them in danger...",ui\00_message\event\st0472\ev000.gmd,\event\st0472\st0472ev000.arc,st0472ev000.arc,286
0,,"なるほど、そうやって反乱の芽を
摘みやすい環境を作っている訳だな
繋がりを絶たせておけば、切り捨てるのも容易――","I see, that's how they make it easier to nip rebellion in the bud.
It's easier to eliminate them if you keep them disconnected from others.",ui\00_message\event\st0472\ev000.gmd,\event\st0472\st0472ev000.arc,st0472ev000.arc,287
0,,"<NPC 691>――頼む
親父さん、そしてお前自身のために
レジスタンスに協力してはくれないか？","<NPC 691>--Please
for the sake of you and your father;
Will you help the resistance?",ui\00_message\event\st0472\ev000.gmd,\event\st0472\st0472ev000.arc,st0472ev000.arc,288
0,,"――――
――――――","――――
――――――",ui\00_message\event\st0472\ev000.gmd,\event\st0472\st0472ev000.arc,st0472ev000.arc,289
0,,<NPC 691>！！,<NPC 691>！！,ui\00_message\event\st0472\ev000.gmd,\event\st0472\st0472ev000.arc,st0472ev000.arc,290
0,,"――――わかった、俺の負けだ
あんたらに協力するよ","---- Okay, I give up.
I'll help you guys out.",ui\00_message\event\st0472\ev000.gmd,\event\st0472\st0472ev000.arc,st0472ev000.arc,291
0,,"俺の知っていることを話せばいいんだな
――と言っても俺は下っ端だから、あんたらが
期待するような大したことは知らないと思うぜ","I should just tell you what I know
-- but since I'm a bad person, I don't think you guys know much about what you'd expect from
",ui\00_message\event\st0472\ev000.gmd,\event\st0472\st0472ev000.arc,st0472ev000.arc,292
0,,"あぁ、それで構わない！
ぜひ聞かせてくれ！","Oh, that's fine!
Please let me hear it!",ui\00_message\event\st0472\ev000.gmd,\event\st0472\st0472ev000.arc,st0472ev000.arc,293
0,,"覚者、よくやったな
<NPC 691>は完全に落ちた――尋問成功だ！","Well done, Arisen. 
<NPC 691> has fully broken down—
interrogation successful!",ui\00_message\event\st0472\ev000.gmd,\event\st0472\st0472ev000.arc,st0472ev000.arc,294
0,,"さぁ、コイツの持つ情報を全て聞き出そう
これで<NPC 681>のヤツに大きく近付けるぞ！","Now, 
let's find out all the information this guy has.

With this we'll get a lot closer to <NPC 681>!",ui\00_message\event\st0472\ev000.gmd,\event\st0472\st0472ev000.arc,st0472ev000.arc,295
0,,"さぁ、あとは持っている情報を全て聞き出すだけだ
何から聞こうか？","Next, we need to get all the details. 
What will you start with?",ui\00_message\event\st0472\ev000.gmd,\event\st0472\st0472ev000.arc,st0472ev000.arc,296
0,,Ａ、ナヴィド侯爵とは,"A, Marquis Navido",ui\00_message\event\st0472\ev000.gmd,\event\st0472\st0472ev000.arc,st0472ev000.arc,297
0,,Ｂ、憲兵隊とは,B. What is the Military Police?,ui\00_message\event\st0472\ev000.gmd,\event\st0472\st0472ev000.arc,st0472ev000.arc,298
0,,Ｃ、レジスタンスとは,C. What is the Resistance?,ui\00_message\event\st0472\ev000.gmd,\event\st0472\st0472ev000.arc,st0472ev000.arc,299
0,,Ｄ、<NPC 691>の任務について,"D, About the duties of <NPC 691>",ui\00_message\event\st0472\ev000.gmd,\event\st0472\st0472ev000.arc,st0472ev000.arc,300
0,,――今日はやめる,--I'm not doing this today.,ui\00_message\event\st0472\ev000.gmd,\event\st0472\st0472ev000.arc,st0472ev000.arc,301
0,,"憲兵隊――についてか？
そうだな、改めて説明すると難しいんだが――","The Military Police?
Well, again, it's hard to explain..",ui\00_message\event\st0472\ev000.gmd,\event\st0472\st0472ev000.arc,st0472ev000.arc,302
0,,"侯爵家直属の兵隊だな
オーク撤退後のメガドにおいて
強権統治の実働隊として動いている","It's a soldier directly under the Marquess's family, isn't it
in Megado after the Orc retreat, and
is operating as a working force for powerful rule",ui\00_message\event\st0472\ev000.gmd,\event\st0472\st0472ev000.arc,st0472ev000.arc,303
0,,"あー、つまり――
過激な治安維持部隊ってところだ","Ah, I mean... it's a
radical security maintenance force",ui\00_message\event\st0472\ev000.gmd,\event\st0472\st0472ev000.arc,st0472ev000.arc,304
0,,"正直言うと、市民はみんな憲兵に怯えてる
反抗的な態度や怪しい行動は
取締りの対象になるからな","To be honest, all citizens are afraid of military police
because any rebellious attitudes and suspicious behavior are subject to
enforcement.",ui\00_message\event\st0472\ev000.gmd,\event\st0472\st0472ev000.arc,st0472ev000.arc,305
0,,"そうと分かっていながら
なぜ所属していたんだ？","Knowing that,
why were you a part of it?",ui\00_message\event\st0472\ev000.gmd,\event\st0472\st0472ev000.arc,st0472ev000.arc,306
0,,"実は――
金が良いんだわ、これが","As a matter of fact...
The pay is good - it really is.",ui\00_message\event\st0472\ev000.gmd,\event\st0472\st0472ev000.arc,st0472ev000.arc,307
0,,"まぁ、稀に今回のような息の詰まる
特別任務が与えられることもあるが――","Well, in rare cases, you'll be given a breathtaking
special mission like this one...",ui\00_message\event\st0472\ev000.gmd,\event\st0472\st0472ev000.arc,st0472ev000.arc,308
0,,"良い給料で、市民に大きな顔できる上
オークとも戦わなくて済む
――最高の仕事だろ？","A good salary, a big impression on the citizens
and not having to fight against orcs
— best job ever, right?",ui\00_message\event\st0472\ev000.gmd,\event\st0472\st0472ev000.arc,st0472ev000.arc,309
0,,オークと戦わなくて済む――だと？,You don't have to fight against orcs?,ui\00_message\event\st0472\ev000.gmd,\event\st0472\st0472ev000.arc,st0472ev000.arc,310
0,,"""オークとの戦闘は、王国兵士に任せておけ
  憲兵隊は、人間の相手をするのが仕事""
――ってことらしい","""Leave the orc fighting to the soldiers of the kingdom.
The Military Police are supposed to deal with humans.""
That's what they said.",ui\00_message\event\st0472\ev000.gmd,\event\st0472\st0472ev000.arc,st0472ev000.arc,311
0,,"――
――――","――
――――",ui\00_message\event\st0472\ev000.gmd,\event\st0472\st0472ev000.arc,st0472ev000.arc,312
0,,ま、俺が知っているのはこれくらいかな――,"Well, I think that's all I know.",ui\00_message\event\st0472\ev000.gmd,\event\st0472\st0472ev000.arc,st0472ev000.arc,313
0,,ナヴィド・クルト侯爵ねぇ――,"Kurt Navido, the Marquis, huh...",ui\00_message\event\st0472\ev000.gmd,\event\st0472\st0472ev000.arc,st0472ev000.arc,314
0,,"一応憲兵隊の指揮権を持ってるって話だけど
俺らみたいな下っ端じゃ
そうそうお目にかかれないぜ","He supposedly has command over 
the military police, 
but someone like us low-ranking folks won't get 
to see him very often.",ui\00_message\event\st0472\ev000.gmd,\event\st0472\st0472ev000.arc,st0472ev000.arc,315
0,,"むしろ覚者さん
あんたの方が詳しいんじゃないのかい？","In fact, aren't you more familiar with it, Arisen?",ui\00_message\event\st0472\ev000.gmd,\event\st0472\st0472ev000.arc,st0472ev000.arc,316
0,,――コイツ、昼まで監視してやがった,--This guy kept watch until midday.,ui\00_message\event\st0472\ev000.gmd,\event\st0472\st0472ev000.arc,st0472ev000.arc,317
0,,"へへ――あぁ、そうそう！
憲兵隊を創設したのは<NPC 681>様だったな","Heh—oh, that's right! 
<NPC 681> was the one who 
created the Military Police.",ui\00_message\event\st0472\ev000.gmd,\event\st0472\st0472ev000.arc,st0472ev000.arc,318
0,,"先代侯爵が亡くなって、爵位を継いだ<NPC 681>様が
他にもいろいろ整備したって話だな
詳しくは忘れちまったけど――","After the previous marquis passed away, 
<NPC 681> inherited the title and 
apparently made various improvements. 

I don't remember the details, though—",ui\00_message\event\st0472\ev000.gmd,\event\st0472\st0472ev000.arc,st0472ev000.arc,319
0,,"まぁ、なんだかんだでメガドがここまで
発展してきたのは、<NPC 681>様の功績も
大きいって訳よ","Ultimately, <NPC 681>'s accomplishments are 
a major reason for how far Megado has come.",ui\00_message\event\st0472\ev000.gmd,\event\st0472\st0472ev000.arc,st0472ev000.arc,320
0,,"――
――――","――
――――",ui\00_message\event\st0472\ev000.gmd,\event\st0472\st0472ev000.arc,st0472ev000.arc,321
0,,"おいおい、そんな怖い顔すんなって！
俺が知っているのはこれくらいだな","Hey hey, don't make such a scary face!
That's all I know.",ui\00_message\event\st0472\ev000.gmd,\event\st0472\st0472ev000.arc,st0472ev000.arc,322
0,,"レジスタンスぅ？
そうだなぁ――","The Resistance?
Yeah, well...",ui\00_message\event\st0472\ev000.gmd,\event\st0472\st0472ev000.arc,st0472ev000.arc,323
0,,"メフィスさん、あんたはバッチリ指名手配に
なってるぜ
だが――","Mephis, you're on the wanted list for sure. But—",ui\00_message\event\st0472\ev000.gmd,\event\st0472\st0472ev000.arc,st0472ev000.arc,324
0,,"俺の知る限り、レジスタンスを大々的に
どうこうするって話はまだ聞いてねえなあ","As far as I know, I haven't heard any major 
plans to deal with the resistance yet.",ui\00_message\event\st0472\ev000.gmd,\event\st0472\st0472ev000.arc,st0472ev000.arc,325
0,,"まだ、そこまで危険視は
されていないということか？","So, the resistance isn't 
considered a major threat yet?",ui\00_message\event\st0472\ev000.gmd,\event\st0472\st0472ev000.arc,st0472ev000.arc,326
0,,"だな
まぁそもそも、レジスタンスについて
侯爵側の持っている情報が少なすぎるってのもある","Yes.
Well, to begin with, there is too little 
information about the Resistance 
on the Marquis's side.",ui\00_message\event\st0472\ev000.gmd,\event\st0472\st0472ev000.arc,st0472ev000.arc,327
0,,"――あるいは、全て筒抜けだからこそ
軽んじられているのか――","--Or maybe it's being downplayed precisely 
because everything is leaked?",ui\00_message\event\st0472\ev000.gmd,\event\st0472\st0472ev000.arc,st0472ev000.arc,328
0,,"いずれにせよ、侯爵様のご関心はレジスタンスより
覚者さん――あんたにあるようだぜ","In any case, the Marquis seems to be interested in
the Arisen rather than the Resistance -- you",ui\00_message\event\st0472\ev000.gmd,\event\st0472\st0472ev000.arc,st0472ev000.arc,329
0,,結局、今回お前に与えられていた任務は何なんだ？,"After all, what was the mission you were 
given this time around?",ui\00_message\event\st0472\ev000.gmd,\event\st0472\st0472ev000.arc,st0472ev000.arc,330
0,,"そりゃあもちろん、覚者さんの尾行・行動監視だ
それを逐一メモして、上官に提出する","Well, of course, it's tracking and 
behavior monitoring on the Arisen.
Write it down one by one and submit it.",ui\00_message\event\st0472\ev000.gmd,\event\st0472\st0472ev000.arc,st0472ev000.arc,331
0,,一体指令は誰が出している？,Who issued the directive?,ui\00_message\event\st0472\ev000.gmd,\event\st0472\st0472ev000.arc,st0472ev000.arc,332
0,,"直接の伝令は上官からだよ
で、任務についての詳しい質問や詮索は
許可されていない","The orders are given by the superior officer. 
Detailed questions or probing about the 
mission are not allowed.",ui\00_message\event\st0472\ev000.gmd,\event\st0472\st0472ev000.arc,st0472ev000.arc,333
0,,"だが噂では――指揮しているのは
侯爵家の家令、<NPC 586>さんだとか","But according to rumors, the one in command is 
<NPC 586>, 
the steward of the marquis' household.",ui\00_message\event\st0472\ev000.gmd,\event\st0472\st0472ev000.arc,st0472ev000.arc,334
0,,"<NPC 586>――か
覚者、お前は顔を見たことがあるかもしれんな","<NPC 586>—I see. 
Arisen, you might recognize their face.",ui\00_message\event\st0472\ev000.gmd,\event\st0472\st0472ev000.arc,st0472ev000.arc,335
0,,"まぁ、あくまで噂だぜ
<NPC 586>さんが独断で指揮しているのか
さらに上から命令を受けているのかは定かじゃない","Well, it's just a rumor. 
I'm not sure if <NPC 586> is directing this 
on his own or if he's taking orders from
further up the chain.",ui\00_message\event\st0472\ev000.gmd,\event\st0472\st0472ev000.arc,st0472ev000.arc,336
0,,あぁ、分かっている,"Ah, I know.",ui\00_message\event\st0472\ev000.gmd,\event\st0472\st0472ev000.arc,st0472ev000.arc,337
0,,"とにかくこれは有用な情報だぞ、覚者！
この先は<NPC 586>とかいう侯爵家の家令が
鍵となりそうだな――","In any case, this information is 
quite useful, Arisen! 
The steward of the Marquis, 
<NPC 586>, 
seems to be the key moving forward.",ui\00_message\event\st0472\ev000.gmd,\event\st0472\st0472ev000.arc,st0472ev000.arc,338
0,,"――これで、俺が知っていることは
全て話したぞ","--That's it.
I've told you everything I know.",ui\00_message\event\st0472\ev000.gmd,\event\st0472\st0472ev000.arc,st0472ev000.arc,339
0,,"――覚者、次のターゲットは<NPC 586>だ
次回<NPC 681>の屋敷へ行くときには
それとなく身辺を探ってくれ","Arisen, the next target is <NPC 586>. 
When you head to 
<NPC 681>'s estate next time, 
subtly investigate the surroundings.",ui\00_message\event\st0472\ev000.gmd,\event\st0472\st0472ev000.arc,st0472ev000.arc,340
0,,"なぁ、他に道も無いんだし
最後までレジスタンスに付き合うからさぁ――","Look, there's no turning back now, 
so I'll see this through with the Resistance.",ui\00_message\event\st0472\ev000.gmd,\event\st0472\st0472ev000.arc,st0472ev000.arc,341
0,,そろそろ解いてくれねえか？,Isn't it about time you untied me?,ui\00_message\event\st0472\ev000.gmd,\event\st0472\st0472ev000.arc,st0472ev000.arc,342
0,,"――ヤツもこう言っていることだし
そろそろこの尋問を終えようか","――Given what he's said, 
we should bring this interrogation to a close.",ui\00_message\event\st0472\ev000.gmd,\event\st0472\st0472ev000.arc,st0472ev000.arc,343
0,,"フフ――正直、お前がここまでやるとは予想外だ
よく頑張ったな、覚者","Huh - honestly, 
I didn't expect you to make it this far.
Good job, Arisen!",ui\00_message\event\st0472\ev000.gmd,\event\st0472\st0472ev000.arc,st0472ev000.arc,344
0,,"<NPC 691>を落とせたのはお前の力だ
次もよろしく頼むぞ、相棒――","It was your skill that took down <NPC 691>. 
Let's work together again, partner.",ui\00_message\event\st0472\ev000.gmd,\event\st0472\st0472ev000.arc,st0472ev000.arc,345
0,,"おい！　
自分がどういう状況か分かっているのか！？","Hey! 
Are you aware of the trouble you're in right now!?",ui\00_message\event\st0472\ev000.gmd,\event\st0472\st0472ev000.arc,st0472ev000.arc,346
0,,"おい、急になんだよ！
ただのゴロツキだって言ってるだろ！","Hey, what's going on!? 
I've already said, I'm just a lowlife!",ui\00_message\event\st0472\ev000.gmd,\event\st0472\st0472ev000.arc,st0472ev000.arc,347
0,,"そうか、ならばそれを証明できる
人物はいるんだな？","Well, then there's a
person who can prove it, right?",ui\00_message\event\st0472\ev000.gmd,\event\st0472\st0472ev000.arc,st0472ev000.arc,348
0,,"あ、あぁ――！
もちろんだ！","Oh, ah--!
Of course!",ui\00_message\event\st0472\ev000.gmd,\event\st0472\st0472ev000.arc,st0472ev000.arc,349
0,,"覚者、ゴロツキの身分を証明できるという
人物を探してみよう
あるいは――証明できないという証明でもいい","Arisen, let's try to find someone who can vouch 
for this thug's identity. 
Or perhaps, proof that they 
can't back up his story will suffice.",ui\00_message\event\st0472\ev000.gmd,\event\st0472\st0472ev000.arc,st0472ev000.arc,350
0,,"おい、いい加減にしろ！
一体どういうつもりで尾行した！？","Hey, come on!
What the hell were you thinking following me?",ui\00_message\event\st0472\ev000.gmd,\event\st0472\st0472ev000.arc,st0472ev000.arc,351
0,,"わっ――なんだよ驚かすな
衝動的な追い剥ぎだって言ってるだろ","Hey—what's going on? 
I told you, 
I'm just a spur-of-the-moment bandit!",ui\00_message\event\st0472\ev000.gmd,\event\st0472\st0472ev000.arc,st0472ev000.arc,352
0,,"衝動的な、か――
ならば、衝動的じゃない《証拠》があれば
認めるんだな？","Impulsive, huh--
So if we have ""proof"" that it's not impulsive,
you'll admit it?",ui\00_message\event\st0472\ev000.gmd,\event\st0472\st0472ev000.arc,st0472ev000.arc,353
0,,ハッ、そんなもんある訳ないだろ,"Ha, there's no such thing.",ui\00_message\event\st0472\ev000.gmd,\event\st0472\st0472ev000.arc,st0472ev000.arc,354
0,,"奴が本当に尾行していたなら、付近の地形や
俺たちの行動を事前調査していたはず
――目撃者がいてもおかしくないな","If he was really following us, 
he would have surveyed the nearby terrain and
our movements in advance.
--I wouldn't be surprised if there were witnesses.",ui\00_message\event\st0472\ev000.gmd,\event\st0472\st0472ev000.arc,st0472ev000.arc,355
0,,"俺達の尾行時につけていたメモを出してみろ
だと――？","You want me to hand over the notes I took 
while tailing you—huh?",ui\00_message\event\st0472\ev000.gmd,\event\st0472\st0472ev000.arc,st0472ev000.arc,356
0,,"どこにあるかお前が一番よく知ってんだろうが！
隠したんだろう？
場所を言え！！","You know best where it is!
You hid it, didn't you?
Tell me where it is!",ui\00_message\event\st0472\ev000.gmd,\event\st0472\st0472ev000.arc,st0472ev000.arc,357
0,,"し、知らねえよ！
そもそもあんな、何もない場所で隠しても
すぐに見つかっちまうだろうが！","I-I don't know! 
Hiding something in a place like that, 
it'd be found right away!",ui\00_message\event\st0472\ev000.gmd,\event\st0472\st0472ev000.arc,st0472ev000.arc,358
0,,"――覚者、<NPC 691>は確保されるまで
確実にそのメモを持っていたはずだ
捕まる瞬間に捨てたか隠したか――","Arisen, <NPC 691> must have had that note 
until they were captured. 
They either threw it away or hid it at the 
moment of their capture.",ui\00_message\event\st0472\ev000.gmd,\event\st0472\st0472ev000.arc,st0472ev000.arc,359
0,,"いずれにせよ、現場から離れていないはずだ
奴を捕まえたのは俺たちの集会所にほど近い路地――
覚者、行ってみよう","—In any case, it shouldn't be far from the scene. 
The alley where we captured them is quite close 
to our meeting place. Let's head over, Arisen.",ui\00_message\event\st0472\ev000.gmd,\event\st0472\st0472ev000.arc,st0472ev000.arc,360
0,,"おい、いい加減時間稼ぎは止めろ！
痛めつけられたいのか？","Hey, come on, stop stalling!
You want to get hurt?",ui\00_message\event\st0472\ev000.gmd,\event\st0472\st0472ev000.arc,st0472ev000.arc,361
0,,"な、何か他の《証拠》でもあるってのか！？
不気味なメモ一つで、俺が何か企んでるなんて
あんまりじゃねえか！","—Do you have any other ""evidence"" 
to back this up?! 
It's outrageous to think I'm planning something 
based on just one strange note!",ui\00_message\event\st0472\ev000.gmd,\event\st0472\st0472ev000.arc,st0472ev000.arc,362
0,,"少し外で頭でも冷やしてきたらどうだ？
冷静になって
自分の馬鹿な行いを見つめなおして来いよ！","—Why don't you go outside and cool 
your head a bit? 
Calm down and take a good look 
at your foolish actions!",ui\00_message\event\st0472\ev000.gmd,\event\st0472\st0472ev000.arc,st0472ev000.arc,363
0,,"――コイツの言うことも一理ある
覚者、一度諜報に出て、まだ行ってない場所や
戦ってない敵と戦うのも良いかもしないぞ","—There's some truth to what this guy is saying. 
Arisen, it might be a good idea to go out on a 
reconnaissance mission, explore places you 
haven't been to yet, 
and fight enemies you haven't faced.",ui\00_message\event\st0472\ev000.gmd,\event\st0472\st0472ev000.arc,st0472ev000.arc,364
0,,"そして他の《証拠》を例のメモと
じっくり見比べてみろ
――自ずと答えは見えるはずだぜ","Then, examine the other 
evidence closely against that memo. 
—The answer will come to light.",ui\00_message\event\st0472\ev000.gmd,\event\st0472\st0472ev000.arc,st0472ev000.arc,365
0,,"憲兵めが、自分の状況をわかっているのか？
その気になれば殺せるんだぞ！","The military police—
are they even aware of their predicament? 
I could end them whenever I choose!",ui\00_message\event\st0472\ev000.gmd,\event\st0472\st0472ev000.arc,st0472ev000.arc,366
0,,"フン――今さらそんな脅しが通じるか
捕まった失態は、貴様らの逮捕で
挽回してやるからな","Hmph—
do you really think those threats will 
scare me now? 
I'll redeem myself for getting captured 
by taking you down!",ui\00_message\event\st0472\ev000.gmd,\event\st0472\st0472ev000.arc,st0472ev000.arc,367
0,,"――あの無慈悲な侯爵が、こんな大失敗を
その程度の手柄で許すと思うか？","――Do you think the unforgiving marquis will 
let a failure this big slide for a simple 
accomplishment like that?",ui\00_message\event\st0472\ev000.gmd,\event\st0472\st0472ev000.arc,st0472ev000.arc,368
0,,――！,――！,ui\00_message\event\st0472\ev000.gmd,\event\st0472\st0472ev000.arc,st0472ev000.arc,369
0,,"覚者、憲兵は市民に対し権力を持つ代わりに
非常に厳しく冷酷な戒律で縛られている
コイツにはまだ、その実感が無いんだ――","Arisen, 
the military police hold power over the citizens,
but they're also bound by cruel and strict rules.
This guy hasn't realized that yet.",ui\00_message\event\st0472\ev000.gmd,\event\st0472\st0472ev000.arc,st0472ev000.arc,370
0,,"その現実を知らしめるような《証拠》は無いか？
昔はよく、メガドの裏路地で
憲兵の悲惨な噂を聞いたもんだったが――","Do we have any kind of proof that could open his 
eyes to this reality? 
I recall hearing many dreadful tales about the 
military police in the alleys of Megado...",ui\00_message\event\st0472\ev000.gmd,\event\st0472\st0472ev000.arc,st0472ev000.arc,371
