0,,"――だ、そうだ
なんとかこの話を覆せる《証拠》はないものか――","--So.
Is there any way to counter this with 
some evidence?",ui\00_message\event\st0472\ev000.gmd,\event\st0472\st0472ev000.arc,st0472ev000.arc,166
0,,"おい！
憲兵たちのやり方に何とも思わないのか！？","Hey!
Do you really have no problem with the way 
the military police operate!?",ui\00_message\event\st0472\ev000.gmd,\event\st0472\st0472ev000.arc,st0472ev000.arc,372
0,,"思わない――というより
思いたくても、思ってはいけないんだ
所属している限りはな","It's not that I don't care—
I'm not allowed to care, even if I wanted to.
As long as I'm one of them.",ui\00_message\event\st0472\ev000.gmd,\event\st0472\st0472ev000.arc,st0472ev000.arc,373
0,,"思ってしまえば、行動や見た目に滲み出る
脱走兵なんて――
そうなれば、手が及ぶのは俺だけでは済まない","If you let yourself think about it, 
it seeps into your actions and appearance. 
Once that happens, the repercussions won't be 
limited to just me.",ui\00_message\event\st0472\ev000.gmd,\event\st0472\st0472ev000.arc,st0472ev000.arc,374
0,,"ヤツは揺らいでいる――
誰かを心配しているのか？","He's wavering—
might he be anxious about someone?",ui\00_message\event\st0472\ev000.gmd,\event\st0472\st0472ev000.arc,st0472ev000.arc,375
0,,"覚者――メガドに思い当る人物はいないか？
誰かは分からんが
きっとその人物が鍵となるはずだ","Arisen—does anyone in Megado come to mind? 
I'm not sure who, 
but that person is likely the key.",ui\00_message\event\st0472\ev000.gmd,\event\st0472\st0472ev000.arc,st0472ev000.arc,376
0,,デバッグするか？,Do you want to debug it?,ui\00_message\event\st0472\ev005.gmd,\event\st0472\st0472ev005.arc,st0472ev005.arc,0
0,,尋問する,interrogate,ui\00_message\event\st0472\ev005.gmd,\event\st0472\st0472ev005.arc,st0472ev005.arc,1
0,,デバッグする,Debugging,ui\00_message\event\st0472\ev005.gmd,\event\st0472\st0472ev005.arc,st0472ev005.arc,2
0,,どっちのモーションを見る？,Which motion do you see?,ui\00_message\event\st0472\ev005.gmd,\event\st0472\st0472ev005.arc,st0472ev005.arc,3
0,,680 メフィス,680 Mephis,ui\00_message\event\st0472\ev005.gmd,\event\st0472\st0472ev005.arc,st0472ev005.arc,4
0,,682 ドワーフオーク,682 Dwarf Orc,ui\00_message\event\st0472\ev005.gmd,\event\st0472\st0472ev005.arc,st0472ev005.arc,5
0,,連携テスト,Cooperation test,ui\00_message\event\st0472\ev005.gmd,\event\st0472\st0472ev005.arc,st0472ev005.arc,6
0,,【戻る】,[Back],ui\00_message\event\st0472\ev005.gmd,\event\st0472\st0472ev005.arc,st0472ev005.arc,7
0,,どのモーションを見る？,Which motion would you like to see?,ui\00_message\event\st0472\ev005.gmd,\event\st0472\st0472ev005.arc,st0472ev005.arc,8
0,,000 ナイトウォーカー待機LOOP,000 Nightwalker Waiting LOOP,ui\00_message\event\st0472\ev005.gmd,\event\st0472\st0472ev005.arc,st0472ev005.arc,9
0,,001 おかず おかず１,"001 Extra
Extra 1",ui\00_message\event\st0472\ev005.gmd,\event\st0472\st0472ev005.arc,st0472ev005.arc,10
0,,002 おかず おかず２,"002 Extra
Extra 2",ui\00_message\event\st0472\ev005.gmd,\event\st0472\st0472ev005.arc,st0472ev005.arc,11
0,,003 尋問対象に語りかける,003 Talking to the interrogation subject,ui\00_message\event\st0472\ev005.gmd,\event\st0472\st0472ev005.arc,st0472ev005.arc,12
0,,005 脅す A,005 Threatening A,ui\00_message\event\st0472\ev005.gmd,\event\st0472\st0472ev005.arc,st0472ev005.arc,13
0,,006 脅す B,006 Threatening B,ui\00_message\event\st0472\ev005.gmd,\event\st0472\st0472ev005.arc,st0472ev005.arc,14
0,,007 脅す C,007: Threatening C,ui\00_message\event\st0472\ev005.gmd,\event\st0472\st0472ev005.arc,st0472ev005.arc,15
0,,010 突きつける（荒）開始～LOOP,010 Assaulting (rough) starts ～ LOOP,ui\00_message\event\st0472\ev005.gmd,\event\st0472\st0472ev005.arc,st0472ev005.arc,16
0,,011 LOOPからの戻り,011 Return from LOOP,ui\00_message\event\st0472\ev005.gmd,\event\st0472\st0472ev005.arc,st0472ev005.arc,17
0,,012 突きつける（静）開始～LOOP,012 Assaulting (static) start ～ LOOP,ui\00_message\event\st0472\ev005.gmd,\event\st0472\st0472ev005.arc,st0472ev005.arc,18
0,,013 LOOPからの戻り,013 Return from LOOP,ui\00_message\event\st0472\ev005.gmd,\event\st0472\st0472ev005.arc,st0472ev005.arc,19
0,,015 PL側を向く～選択待ち待機LOOP,"015 Facing the PL side – 
Awaiting selection, standby LOOP",ui\00_message\event\st0472\ev005.gmd,\event\st0472\st0472ev005.arc,st0472ev005.arc,20
0,,016 うなずく,016 nod,ui\00_message\event\st0472\ev005.gmd,\event\st0472\st0472ev005.arc,st0472ev005.arc,21
0,,017 首を振る,017 Shake your head,ui\00_message\event\st0472\ev005.gmd,\event\st0472\st0472ev005.arc,st0472ev005.arc,22
0,,018 会話,018 conversation,ui\00_message\event\st0472\ev005.gmd,\event\st0472\st0472ev005.arc,st0472ev005.arc,23
0,,019 イライラ開始～LOOP,019 Frustration start - LOOP,ui\00_message\event\st0472\ev005.gmd,\event\st0472\st0472ev005.arc,st0472ev005.arc,24
0,,020 イライラ終了,020 End of frustration,ui\00_message\event\st0472\ev005.gmd,\event\st0472\st0472ev005.arc,st0472ev005.arc,25
0,,022 LOOPからの戻り,022 Return from LOOP,ui\00_message\event\st0472\ev005.gmd,\event\st0472\st0472ev005.arc,st0472ev005.arc,26
0,,025 PLの視点を変える（尋問失敗）,025 Changing PL's Perspective (Interrogation Failure),ui\00_message\event\st0472\ev005.gmd,\event\st0472\st0472ev005.arc,st0472ev005.arc,27
0,,026 突きつける（荒）開始～LOOP,026 Assaulting (rough) start ～ LOOP,ui\00_message\event\st0472\ev005.gmd,\event\st0472\st0472ev005.arc,st0472ev005.arc,28
0,,027 LOOPからの戻り,027 Return from LOOP,ui\00_message\event\st0472\ev005.gmd,\event\st0472\st0472ev005.arc,st0472ev005.arc,29
0,,028 突きつける（静）開始～LOOP,028 Assaulting (static) start ～ LOOP,ui\00_message\event\st0472\ev005.gmd,\event\st0472\st0472ev005.arc,st0472ev005.arc,30
0,,029 LOOPからの戻り,029 Return from LOOP,ui\00_message\event\st0472\ev005.gmd,\event\st0472\st0472ev005.arc,st0472ev005.arc,31
0,,【戻る】,[Back],ui\00_message\event\st0472\ev005.gmd,\event\st0472\st0472ev005.arc,st0472ev005.arc,32
0,,ドノ「もーしょん」ヲミル？,"Do you want to see ""Dono's motion""?",ui\00_message\event\st0472\ev005.gmd,\event\st0472\st0472ev005.arc,st0472ev005.arc,33
0,,000 通常座り：待機,000 Normal sitting：Waiting,ui\00_message\event\st0472\ev005.gmd,\event\st0472\st0472ev005.arc,st0472ev005.arc,34
0,,001 座通常り：会話,001 Normal sitting：conversation,ui\00_message\event\st0472\ev005.gmd,\event\st0472\st0472ev005.arc,st0472ev005.arc,35
0,,002 通常座り：うなずく,002 Normal sitting：nodding,ui\00_message\event\st0472\ev005.gmd,\event\st0472\st0472ev005.arc,st0472ev005.arc,36
0,,003 通常座り：びっくり,003 normal sitting：surprised,ui\00_message\event\st0472\ev005.gmd,\event\st0472\st0472ev005.arc,st0472ev005.arc,37
0,,004 通常座り：嫌々,004 Normal Sitting：Dislike,ui\00_message\event\st0472\ev005.gmd,\event\st0472\st0472ev005.arc,st0472ev005.arc,38
0,,005 通常座り：図星,005 Normal Sitting: Bull's-eye,ui\00_message\event\st0472\ev005.gmd,\event\st0472\st0472ev005.arc,st0472ev005.arc,39
0,,006 通常座り：ムカムカ,006 Normal Sitting：eating,ui\00_message\event\st0472\ev005.gmd,\event\st0472\st0472ev005.arc,st0472ev005.arc,40
0,,009 通常座り　→　座りピンチ,009 normal sitting → sitting nervous? crossed legs?,ui\00_message\event\st0472\ev005.gmd,\event\st0472\st0472ev005.arc,st0472ev005.arc,41
0,,010 ピンチ座り：待機,010 pinch sit：wait,ui\00_message\event\st0472\ev005.gmd,\event\st0472\st0472ev005.arc,st0472ev005.arc,42
0,,011 ピンチ座り：会話,011 Pinch Sitting：Conversation,ui\00_message\event\st0472\ev005.gmd,\event\st0472\st0472ev005.arc,st0472ev005.arc,43
0,,012 ピンチ座り：うなずく,012 pinch sitting：nodding,ui\00_message\event\st0472\ev005.gmd,\event\st0472\st0472ev005.arc,st0472ev005.arc,44
0,,013 ピンチ座り：びっくり,013 pinch sitting：surprised,ui\00_message\event\st0472\ev005.gmd,\event\st0472\st0472ev005.arc,st0472ev005.arc,45
0,,014 ピンチ座り：嫌々,014 pinch sitting：Dislike,ui\00_message\event\st0472\ev005.gmd,\event\st0472\st0472ev005.arc,st0472ev005.arc,46
0,,015 ピンチ座り：図星,015 pinch sitting：Bull's-eye,ui\00_message\event\st0472\ev005.gmd,\event\st0472\st0472ev005.arc,st0472ev005.arc,47
0,,016 ピンチ座り：ムカムカ,016 Pinch Sitting：eating,ui\00_message\event\st0472\ev005.gmd,\event\st0472\st0472ev005.arc,st0472ev005.arc,48
0,,017 ピンチ座り:自白移行,017 Pinch Sit: Confession Transition,ui\00_message\event\st0472\ev005.gmd,\event\st0472\st0472ev005.arc,st0472ev005.arc,49
0,,020 気絶,020 Stunned,ui\00_message\event\st0472\ev005.gmd,\event\st0472\st0472ev005.arc,st0472ev005.arc,50
0,,【戻る】,[Back],ui\00_message\event\st0472\ev005.gmd,\event\st0472\st0472ev005.arc,st0472ev005.arc,51
0,,"今まで何度も尋問は行ってきたが
さすがにオークは初めてだぜ","I've conducted interrogations many times before, 
but this is the first time with an orc.",ui\00_message\event\st0472\ev005.gmd,\event\st0472\st0472ev005.arc,st0472ev005.arc,52
0,,"とはいえ――やり方は今までと同じだ
今さら説明はいらないな？","Nonetheless — the method is the same as before
You don't need further explanation now, right?",ui\00_message\event\st0472\ev005.gmd,\event\st0472\st0472ev005.arc,st0472ev005.arc,53
0,,"それじゃ、早速始めるか
手始めに基本的な《話題》から聞いてみよう","Well, let's get started:
Let's start with a basic ""topic"" for starters.",ui\00_message\event\st0472\ev005.gmd,\event\st0472\st0472ev005.arc,st0472ev005.arc,54
0,,Ａ、メガドに来た目的,A. Purpose of coming to Megado,ui\00_message\event\st0472\ev005.gmd,\event\st0472\st0472ev005.arc,st0472ev005.arc,55
0,,Ｂ、オーク自身について,B. About the orc themselves.,ui\00_message\event\st0472\ev005.gmd,\event\st0472\st0472ev005.arc,st0472ev005.arc,56
0,,《証拠》を確認する,"Check the ""evidence""",ui\00_message\event\st0472\ev005.gmd,\event\st0472\st0472ev005.arc,st0472ev005.arc,57
0,,――今日はやめる,--I'm not doing this today.,ui\00_message\event\st0472\ev005.gmd,\event\st0472\st0472ev005.arc,st0472ev005.arc,58
0,,"裏切り者と思わしき人間とオークが共に居た
――これだけで限りなく決定的に近い
状況ではあるが、一応聞いてやる","The fact that a suspected traitor and an orc were 
together is almost conclusive, 
but I'll still give you a chance to explain.",ui\00_message\event\st0472\ev005.gmd,\event\st0472\st0472ev005.arc,st0472ev005.arc,59
0,,一体あの場所で何をしていた？,What the hell were you doing in that place?,ui\00_message\event\st0472\ev005.gmd,\event\st0472\st0472ev005.arc,st0472ev005.arc,60
0,,何ヲシテイタカ？,What were you up to?,ui\00_message\event\st0472\ev005.gmd,\event\st0472\st0472ev005.arc,st0472ev005.arc,61
0,,"フン――愚カナ人間メ
アノ死ンダ人間ニデモ、聞イテミロ！","Hmph—Stupid humans. 
Try asking that dead human!",ui\00_message\event\st0472\ev005.gmd,\event\st0472\st0472ev005.arc,st0472ev005.arc,62
0,,"おーくガ、人間ニ協力スルコトナド
火山ガ噴火シヨウガ、アリエナイ！","There's no way an orc would help humans, 
not even if a volcano erupted!",ui\00_message\event\st0472\ev005.gmd,\event\st0472\st0472ev005.arc,st0472ev005.arc,63
0,,"チッ――当然だが
簡単に答えてはくれないか","Tch—Of course, 
it won't be easy to get answers.",ui\00_message\event\st0472\ev005.gmd,\event\st0472\st0472ev005.arc,st0472ev005.arc,64
0,,"やはり、まずは証拠を手に入れてから
糸口を見つけていくしかないようだな――","It seems we'll need to gather evidence first 
and find a clue from there.",ui\00_message\event\st0472\ev005.gmd,\event\st0472\st0472ev005.arc,st0472ev005.arc,65
0,,"覚者、現場は調べてみたか？
証拠を見つけられるとしたら
最も可能性が高いのはあの場所だ","Arisen, have you investigated the scene? 
If we're going to find evidence, 
that place is the most likely spot.",ui\00_message\event\st0472\ev005.gmd,\event\st0472\st0472ev005.arc,st0472ev005.arc,66
0,,"もしまだ調べていないのなら
まずはこの事件が発生した現場を調べてみよう","If you haven't already checked it out,
let's try the site where this incident occurred.",ui\00_message\event\st0472\ev005.gmd,\event\st0472\st0472ev005.arc,st0472ev005.arc,67
0,,"おいおい――怖気づいたのか？
始まったばかりだぞ","Whoa now — are you scared?
We're just getting started.",ui\00_message\event\st0472\ev005.gmd,\event\st0472\st0472ev005.arc,st0472ev005.arc,68
0,,"ゲハハッ！　俺ガ怖イノカ？
オ前、本当ニアノ覚者カ？","Gehaha!　Are you afraid of me?
Are you really an Arisen?",ui\00_message\event\st0472\ev005.gmd,\event\st0472\st0472ev005.arc,st0472ev005.arc,69
0,,"ほら、オークにまで言われてるぞ
悔しくないのか？","Look, even an orc is saying it. 
Aren't you frustrated?",ui\00_message\event\st0472\ev005.gmd,\event\st0472\st0472ev005.arc,st0472ev005.arc,70
0,,"ここで安全に尋問できる時間は限られている――
出来る時に出来ることをやっておこう","We have a limited amount of time to safely 
interrogate them here--
Let's do what we can.",ui\00_message\event\st0472\ev005.gmd,\event\st0472\st0472ev005.arc,st0472ev005.arc,71
0,,お前自身のことを聞かせてもらおうか,Let's hear about you.,ui\00_message\event\st0472\ev005.gmd,\event\st0472\st0472ev005.arc,st0472ev005.arc,72
0,,"俺ノコトダト？
フン――貴様ラ人間ニ、関係アルノカ？","You want to know about me? 
Hmph—what concern is that to you humans?",ui\00_message\event\st0472\ev005.gmd,\event\st0472\st0472ev005.arc,st0472ev005.arc,73
0,,それは、聞いてから俺たちが決めることだ,That's for us to decide after we hear it.,ui\00_message\event\st0472\ev005.gmd,\event\st0472\st0472ev005.arc,st0472ev005.arc,74
0,,いつ頃からオーク軍に所属しているんだ？,Since when have you been part of the Orc Army?,ui\00_message\event\st0472\ev005.gmd,\event\st0472\st0472ev005.arc,st0472ev005.arc,75
0,,"フン――貴様ラノ間抜ケナ王子ヲ
捻リ潰ス、ズット前カラサ","Hmph—
I've wanted to crush that useless prince 
of yours since long ago.",ui\00_message\event\st0472\ev005.gmd,\event\st0472\st0472ev005.arc,st0472ev005.arc,76
0,,"残念だったな、ネド王子は
貴様らオークを出し抜いてご健在なんだ","Too bad Prince Nedo is still alive and well after
outfoxing you orcs.",ui\00_message\event\st0472\ev005.gmd,\event\st0472\st0472ev005.arc,st0472ev005.arc,77
0,,"――ウガァァ！
今、生キテイヨウガ、死ンデイヨウガ
ソレハ小サナ違イダ！","—Ughhh! 
Alive or dead, 
it's a minor difference!",ui\00_message\event\st0472\ev005.gmd,\event\st0472\st0472ev005.arc,st0472ev005.arc,78
0,,"勝ツノハ、俺タチ！
人間ナド皆殺シダ！","We will win! 
We'll slaughter all humans!",ui\00_message\event\st0472\ev005.gmd,\event\st0472\st0472ev005.arc,st0472ev005.arc,79
0,,"そうかそうか――ところで、さっきより
ずいぶんと饒舌になったな？","Ok, ok - by the way, you're a lot more
talkative than you used to be, aren't you?",ui\00_message\event\st0472\ev005.gmd,\event\st0472\st0472ev005.arc,st0472ev005.arc,80
0,,逃げるのも諦めて観念したのか？,"Have you given up on escaping 
and resigned yourself?",ui\00_message\event\st0472\ev005.gmd,\event\st0472\st0472ev005.arc,st0472ev005.arc,81
0,,"観念ダト？　馬鹿メ！
おーくハ、絶対ニ！　人間ナドニ屈シナイ！","Resigned? Idiot! 
An orc never bows to humans!",ui\00_message\event\st0472\ev005.gmd,\event\st0472\st0472ev005.arc,st0472ev005.arc,82
0,,"ソシテ、今ニ貴様ラハ
後悔スルコトニナルダロウ！","Soon,, you will regret it!",ui\00_message\event\st0472\ev005.gmd,\event\st0472\st0472ev005.arc,st0472ev005.arc,83
0,,"おーくノ軍ハ、スグニチカラヲ溜メテ戻ッテクル
ソシテ俺ヲ助ケ出シ、チッポケナ人間ドモヲ
マタ奴隷ニスルノダ","The orc army will gather its strength and return. 
They will rescue me and wipe out 
all you insignificant humans.",ui\00_message\event\st0472\ev005.gmd,\event\st0472\st0472ev005.arc,st0472ev005.arc,84
0,,――随分と自信たっぷりだな,-- You have a lot of confidence.,ui\00_message\event\st0472\ev005.gmd,\event\st0472\st0472ev005.arc,st0472ev005.arc,85
0,,フン――命乞イシテモ遅イ,Hah— it's too late to beg for your life now.,ui\00_message\event\st0472\ev005.gmd,\event\st0472\st0472ev005.arc,st0472ev005.arc,86
0,,"かなり自信満々のようだが――
オーク1匹を助けるために満身創痍の
オーク軍が来ると、本当に思うか？","You seem quite confident, 
but do you really believe that the already 
beaten orc army would come all this way just 
to save a single orc?",ui\00_message\event\st0472\ev005.gmd,\event\st0472\st0472ev005.arc,st0472ev005.arc,87
0,,"オーク軍の情報を引き出すには
この鼻っ柱をへし折ってやるか――","To get the orc army's information, 
we might need to crush this arrogance.",ui\00_message\event\st0472\ev005.gmd,\event\st0472\st0472ev005.arc,st0472ev005.arc,88
0,,"あるいは、口を滑らしてしまうような
上機嫌にさせる《証拠》があると良いんだが――","Alternatively, it would be ideal to have some 
evidence that puts them in such a good mood 
that they might slip up.",ui\00_message\event\st0472\ev005.gmd,\event\st0472\st0472ev005.arc,st0472ev005.arc,89
0,,"フゥ――なるほど
オークとまともに対話するのは初めてだが
やはりスムーズにはいかないな","Huh--I see.
This is the first time I've had a 
proper conversation with an orc.

It's not exactly going smoothly.",ui\00_message\event\st0472\ev005.gmd,\event\st0472\st0472ev005.arc,st0472ev005.arc,90
0,,"しかも――どうやらコイツ
長い事オーク軍にいたらしいが","What's more... apparently this guy
has been in the Orc Army for a long time.",ui\00_message\event\st0472\ev005.gmd,\event\st0472\st0472ev005.arc,st0472ev005.arc,91
0,,"今まで戦死もせず、出世も
できていないところを見ると
口だけは立派な雑魚オークのようだな","Seeing as how he hasn't died in battle and hasn't 
been able to rise to the top,
he seems to be a small fry orc with a big mouth.",ui\00_message\event\st0472\ev005.gmd,\event\st0472\st0472ev005.arc,st0472ev005.arc,92
0,,――――！！,――――!!,ui\00_message\event\st0472\ev005.gmd,\event\st0472\st0472ev005.arc,st0472ev005.arc,93
0,,"おい覚者、コイツどうしようか
始末するか？","Hey Arisen, what should we do with this guy? 
Should we get rid of him?",ui\00_message\event\st0472\ev005.gmd,\event\st0472\st0472ev005.arc,st0472ev005.arc,94
0,,"ウガァァァァァ！！
人間メ――コレ以上ノ侮辱ハ、許サンゾ！","Ugaaaaaa!! 
Humans— 
I won't tolerate any more of this humiliation!",ui\00_message\event\st0472\ev005.gmd,\event\st0472\st0472ev005.arc,st0472ev005.arc,95
0,,"なんだ、気に障ったか？ 
だが事実だろう","What, you don't like it? 
But it's true.",ui\00_message\event\st0472\ev005.gmd,\event\st0472\st0472ev005.arc,st0472ev005.arc,96
0,,"ウガァァァァ！！
伝令兵ハ生キ残リ
手紙ヲ届ケルコトガ仕事ダ！","Guhgaaaaaa!! 
The messenger is to stay alive 
and deliver the letter!",ui\00_message\event\st0472\ev005.gmd,\event\st0472\st0472ev005.arc,st0472ev005.arc,97
0,,"生キ長ラエ、軍ニ貢献シ続ケルコト
優秀デアル証ナノダ！
無知ナ人間メ、捻リ潰シテヤル！","Surviving and contributing to the army is 
evidence of superiority! 

I'll crush ignorant humans!",ui\00_message\event\st0472\ev005.gmd,\event\st0472\st0472ev005.arc,st0472ev005.arc,98
0,,"ほう――思いがけず重要な情報を
二つ得られたな","Ho—
We unexpectedly got two important pieces 
of information.",ui\00_message\event\st0472\ev005.gmd,\event\st0472\st0472ev005.arc,st0472ev005.arc,99
0,,"一つ目――どうやらオークはあえて怒らせたり
おだてたりするとよく喋るようだな
これからの尋問に役立ちそうだ","One, it seems that orcs tend to talk more when 
they are deliberately provoked or flattered. 
This might be useful for future interrogations.",ui\00_message\event\st0472\ev005.gmd,\event\st0472\st0472ev005.arc,st0472ev005.arc,100
0,,"それからもう一つ――
このオークは伝令兵として
メガドまではるばる文書を届けに来たんだ","Two; this orc came all the way to Megado 
as a messenger to deliver a document.",ui\00_message\event\st0472\ev005.gmd,\event\st0472\st0472ev005.arc,st0472ev005.arc,101
0,,"となると
<COL ff2600>届けに来たオークの文書が
事件現場のどこかにまだある可能性が高い</COL>","Then it's likely that the document delivered by 
the orc is 
<COL ff2600>still somewhere at the scene of the incident.</COL>",ui\00_message\event\st0472\ev005.gmd,\event\st0472\st0472ev005.arc,st0472ev005.arc,102
0,,"覚者、まずはそれを足がかりとして
諜報活動を始めていこう","Arisen, let's use that as a starting point and 
begin our intelligence activities.",ui\00_message\event\st0472\ev005.gmd,\event\st0472\st0472ev005.arc,st0472ev005.arc,103
0,,"来たな
さぁ、今日も始めようか","You're here.
OK, let's start today too.",ui\00_message\event\st0472\ev005.gmd,\event\st0472\st0472ev005.arc,st0472ev005.arc,104
0,,本当に、今日の尋問はこれで終了にしていいんだな？,Are you sure you want to call it quits on today's interrogation?,ui\00_message\event\st0472\ev005.gmd,\event\st0472\st0472ev005.arc,st0472ev005.arc,105
0,,はい,Yes,ui\00_message\event\st0472\ev005.gmd,\event\st0472\st0472ev005.arc,st0472ev005.arc,106
0,,いいえ,No,ui\00_message\event\st0472\ev005.gmd,\event\st0472\st0472ev005.arc,st0472ev005.arc,107
0,,――今日はこのくらいにしてやるか,"Well, that's enough for today.",ui\00_message\event\st0472\ev005.gmd,\event\st0472\st0472ev005.arc,st0472ev005.arc,108
0,,"――ゲハハハッ！
愚カナ人間、頭オカシクナッタカ","-- Gehahaha!
Foolish humans, have you gone mad?",ui\00_message\event\st0472\ev005.gmd,\event\st0472\st0472ev005.arc,st0472ev005.arc,109
0,,"――その《証拠》を突きつけるのは
ここではなさそうだな","It seems that presenting that evidence isn't 
the right approach here.",ui\00_message\event\st0472\ev005.gmd,\event\st0472\st0472ev005.arc,st0472ev005.arc,110
0,,"脅してさらなる情報を引き出したり
諜報で新たな《証拠》を探すのもいい
――もう一度よく考えてみるんだ","You can threaten them to extract more information 
or search for new evidence using intelligence
— think about it again.",ui\00_message\event\st0472\ev005.gmd,\event\st0472\st0472ev005.arc,st0472ev005.arc,111
0,,"――本当にそう思うか？
もう一度、よく考え直してみたらどうだ？","--do you really think so?
Why don't you think again?",ui\00_message\event\st0472\ev005.gmd,\event\st0472\st0472ev005.arc,st0472ev005.arc,112
0,,"――グハハ！　愚カナ人間メ！
恐怖デ、頭オカシクナッタカ","-- Hahaha! You foolish humans! 
Have you gone mad from fear?",ui\00_message\event\st0472\ev005.gmd,\event\st0472\st0472ev005.arc,st0472ev005.arc,113
0,,"チッ、オークに舐められちまったみたいだな
――二度目はしっかりな？","Tch, it looks like the orc is 
treating us with contempt. 

-- Make sure not to let it happen a second time.",ui\00_message\event\st0472\ev005.gmd,\event\st0472\st0472ev005.arc,st0472ev005.arc,114
0,,手始めに、基本的なことでも聞いてみるか,Let's ask some basic questions for starters.,ui\00_message\event\st0472\ev005.gmd,\event\st0472\st0472ev005.arc,st0472ev005.arc,115
0,,Ａ、メガドに来た目的,A. Purpose of coming to Megado,ui\00_message\event\st0472\ev005.gmd,\event\st0472\st0472ev005.arc,st0472ev005.arc,116
0,,Ｂ、オーク自身について,B. About the orc themselves.,ui\00_message\event\st0472\ev005.gmd,\event\st0472\st0472ev005.arc,st0472ev005.arc,117
0,,《証拠》を確認する,"Check the ""evidence""",ui\00_message\event\st0472\ev005.gmd,\event\st0472\st0472ev005.arc,st0472ev005.arc,118
0,,――今日はやめる,--I'm not doing this today.,ui\00_message\event\st0472\ev005.gmd,\event\st0472\st0472ev005.arc,st0472ev005.arc,119
0,,"良い調子だな――
さて、何を聞く？","You're in good shape—
Well, what to ask?",ui\00_message\event\st0472\ev005.gmd,\event\st0472\st0472ev005.arc,st0472ev005.arc,120
0,,Ａ、メガドに来た目的,A. Purpose of coming to Megado,ui\00_message\event\st0472\ev005.gmd,\event\st0472\st0472ev005.arc,st0472ev005.arc,121
0,,Ｂ、オーク自身について,B. About the orc themselves.,ui\00_message\event\st0472\ev005.gmd,\event\st0472\st0472ev005.arc,st0472ev005.arc,122
0,,Ｃ、メガド占領中の様子,"C, During the occupation of Megado.",ui\00_message\event\st0472\ev005.gmd,\event\st0472\st0472ev005.arc,st0472ev005.arc,123
0,,《証拠》を確認する,"Check the ""evidence""",ui\00_message\event\st0472\ev005.gmd,\event\st0472\st0472ev005.arc,st0472ev005.arc,124
0,,――今日はやめる,--I'm not doing this today.,ui\00_message\event\st0472\ev005.gmd,\event\st0472\st0472ev005.arc,st0472ev005.arc,125
