0,,"――ぐすっ
ああ、すみません","- Sniff
Oh, I'm sorry.",ui\00_message\npc\base\n2805.gmd,\npc\n2805.arc,n2805.arc,4
0,,家族のことが頭をよぎって――,Thoughts of my family crossed my mind...,ui\00_message\npc\base\n2805.gmd,\npc\n2805.arc,n2805.arc,5
0,,"――私も解放軍の一員なのですから
皆さんのために、何かするべきでしょうね","――Since I'm also a member of the Liberation Army,
I should do something for everyone's sake.",ui\00_message\npc\base\n2805.gmd,\npc\n2805.arc,n2805.arc,6
0,,"はぁ――
もう少しだけ、一人でいても良いでしょうか","Sigh――
Is it alright if I stay alone for a little longer?",ui\00_message\npc\base\n2805.gmd,\npc\n2805.arc,n2805.arc,7
0,,"ごめんなさい
話をするのが億劫で――","I'm sorry.
It's too much of a hassle to talk...",ui\00_message\npc\base\n2805.gmd,\npc\n2805.arc,n2805.arc,8
0,,"あ――
な、なんでしょう――","Ah...
W-what is it...",ui\00_message\npc\base\n2806.gmd,\npc\n2806.arc,n2806.arc,0
0,,"ここに匿ってもらえて、心底感謝しとります
もう、帰る家も無くなったものですから――","I am deeply grateful for being able to hide here.
I no longer have a home to return to...",ui\00_message\npc\base\n2806.gmd,\npc\n2806.arc,n2806.arc,1
0,,"家も、家畜も、今頃全部灰になっているでしょう
――大変な思いをして手に入れてきた財産でした","The house, the livestock, they must all be turned
to ashes by now.
It was a fortune that we obtained after going
through great hardships.",ui\00_message\npc\base\n2806.gmd,\npc\n2806.arc,n2806.arc,2
0,,"何よりも気がかりなのは
離ればなれになった妻のことでして――
ここに一緒にいられたら、それだけで
どんなに気が楽だったか","The most worrisome thing is the separation from
my wife – it would have been so much more
reassuring if we could have been together here.",ui\00_message\npc\base\n2806.gmd,\npc\n2806.arc,n2806.arc,3
0,,――何か？,—What is it?,ui\00_message\npc\base\n2807.gmd,\npc\n2807.arc,n2807.arc,0
0,,"ここにもきっとすぐにオークたちが来る――
こんな貧弱な拠点、一たまりも無いわ","The orcs will surely come here soon... This weak
base is worth nothing.",ui\00_message\npc\base\n2807.gmd,\npc\n2807.arc,n2807.arc,1
0,,"オークが攻めてきたら
こんなテントで寝起きしてる私たちなんて
真っ先に殺されるでしょうね
せめて小屋に入れてもらえないかしら――","If the Orcs were to attack, we, who are sleeping
in such a tent, would surely be killed first,
wouldn't we?
I wonder if they could at least let us into a
cabin...",ui\00_message\npc\base\n2807.gmd,\npc\n2807.arc,n2807.arc,2
0,,"もっとしっかりした拠点、どこかに無いかしら
良いところがあれば、そっちに移りたい――","I wonder if there's a more solid base somewhere.
If there's a good place, I'd like to move there...",ui\00_message\npc\base\n2807.gmd,\npc\n2807.arc,n2807.arc,3
0,,よう、元気してる？,"Hey, are you doing well?",ui\00_message\npc\base\n2850.gmd,\npc\n2850.arc,n2850.arc,0
0,,"休んでいくなら<VAL PRICE_INN>だ
見ての通り、ここって色んな店があるから
ちょっと騒がしいけど――耳栓も貸し出すからさ
それでもいいかい？","If you want to rest, it's <VAL PRICE_INN>.
As you can see, there are various shops here, so
it might get noisy, but we can provide earplugs if
you'd like.",ui\00_message\npc\base\n2850.gmd,\npc\n2850.arc,n2850.arc,1
0,,はい,OK,ui\00_message\npc\base\n2850.gmd,\npc\n2850.arc,n2850.arc,2
0,,いいえ,Cancel,ui\00_message\npc\base\n2850.gmd,\npc\n2850.arc,n2850.arc,3
0,,"ああ、休みたいのか
えーっと、ベッドは空いてるな――
サービスしとくぜ、好きに使ってってくれ","Ah, do you want to take a break?
Um, the bed is available...
I'll provide the service, so use it however you
like.",ui\00_message\npc\base\n2850.gmd,\npc\n2850.arc,n2850.arc,4
0,,はい,OK,ui\00_message\npc\base\n2850.gmd,\npc\n2850.arc,n2850.arc,5
0,,いいえ,Cancel,ui\00_message\npc\base\n2850.gmd,\npc\n2850.arc,n2850.arc,6
0,,"《弱化の治療》かい？
よしきた、気合入れて治療するよ
<VAL PRICE_WEAK>だけど、いいかな","""Treat Weakness,"" huh?
Alright, I'll put my fighting spirit into the
treatment.
It's <VAL PRICE_WEAK>, but is that okay?",ui\00_message\npc\base\n2850.gmd,\npc\n2850.arc,n2850.arc,7
0,,はい,OK,ui\00_message\npc\base\n2850.gmd,\npc\n2850.arc,n2850.arc,8
0,,いいえ,Cancel,ui\00_message\npc\base\n2850.gmd,\npc\n2850.arc,n2850.arc,9
0,,"んー、弱化してないけどな
ほら、気持ちの問題じゃないか？
ちょっとそこら辺で好みの子に
声かけてこれば気も晴れるよ、きっと","Well, you haven't weakened, you know. It's all
about the state of mind, isn't it?
Just try talking to someone you like around here,
and your spirits will lift for sure.",ui\00_message\npc\base\n2850.gmd,\npc\n2850.arc,n2850.arc,10
0,,"どっかに可愛い子いたら教えてくれよ
こんな時だからこそ、楽しみが必要さ！","If you find a cute girl somewhere, let me know.
Especially at times like this, we need something
to look forward to!",ui\00_message\npc\base\n2850.gmd,\npc\n2850.arc,n2850.arc,11
0,,"ちょっと微笑んでくれる可愛い子が
いるってだけで毎日頑張れるってもんだろ？　
ホント、それだけでいいんだよな～","Just having a cute girl who smiles at me makes me
able to do my best every day.
Really, that's all I need～",ui\00_message\npc\base\n2850.gmd,\npc\n2850.arc,n2850.arc,12
0,,"まぁ、どんなに可愛い子がいても
俺のフィアンセには適わないだろうけど――","Well, no matter how cute of a girl, she wouldn't
be suitable as my fiancee--",ui\00_message\npc\base\n2850.gmd,\npc\n2850.arc,n2850.arc,13
0,,"嫌がってたけど、村に残してきたんだよな
だって、こんなとこに連れてくるのも危ないだろ
あいつからは少しの危険だって
遠ざけておきたかったんだ","I know they didn't want to, but they left me
behind in the village.
Because it's dangerous to bring me to a place
like this, right?
I just wanted to keep a little distance from
them, even if it meant a small danger.",ui\00_message\npc\base\n2850.gmd,\npc\n2850.arc,n2850.arc,14
0,,"いらっしゃいませ
幅広く取り揃えてますよ","Welcome.
We have a wide variety of items.",ui\00_message\npc\base\n2851.gmd,\npc\n2851.arc,n2851.arc,0
0,,"いや、恐ろしいことになりましたね――
ティネス砦を奪還できたのは嬉しいことですが
ここもまたいつ魔軍に攻め込まれるか","No, it's become quite terrifying――
While it's good that we were able to retake Fort
Thines,
we never know when the Demon Army will attack
here again.",ui\00_message\npc\base\n2851.gmd,\npc\n2851.arc,n2851.arc,1
0,,"まぁ、私には昔からやってる
商売くらいしかできませんから
やれることをやるだけです","Well, since I've been doing business for as long
as I can remember, I can't do anything else but
that.
I'll just do what I can.",ui\00_message\npc\base\n2851.gmd,\npc\n2851.arc,n2851.arc,2
0,,"先祖代々、商いをやってきとります
こうしてやれることをやることが
今私らに一番大切なことじゃないですかね","Throughout generations, we have been engaged in
business.
Isn't it the most important thing for us now to
do what we can do?",ui\00_message\npc\base\n2851.gmd,\npc\n2851.arc,n2851.arc,3
0,,"あら、覚者様
新しい武具がご入用でしょうか","Oh, Ser Arisen.
Do you need new equipment?",ui\00_message\npc\base\n2852.gmd,\npc\n2852.arc,n2852.arc,0
0,,"ティネス砦を取り戻せたのも
覚者様のお力あってのことと聞いております
ありがとうございます","We've heard that Fort Thines was retaken, thanks
to the power of the Arisen. Thank you.",ui\00_message\npc\base\n2852.gmd,\npc\n2852.arc,n2852.arc,1
0,,"今まで良いニュースなんて一つもありませんでした
覚者様が来てくださってから、何だか
希望が見えてきたような気がします","Until now, there hasn't been a single piece of
good news.
But ever since the Arisen arrived, it feels like
we've glimpsed some hope.",ui\00_message\npc\base\n2852.gmd,\npc\n2852.arc,n2852.arc,2
0,,"色々取り揃えております
どうぞ見ていってくださいね","We have a variety of items available. Please take
a look.",ui\00_message\npc\base\n2852.gmd,\npc\n2852.arc,n2852.arc,3
0,,"あっ、ハイ！
同行者をお探しでしょうか、覚者様","Ah, yes! Are you looking for a companion, Ser
Arisen?",ui\00_message\npc\base\n2853.gmd,\npc\n2853.arc,n2853.arc,0
0,,同行者をお探しでしたら、僕がお役に立てますよ！,"If you're looking for a companion, I can be of
help!",ui\00_message\npc\base\n2853.gmd,\npc\n2853.arc,n2853.arc,1
0,,"足の速さにはちょっと自信があるんです
人探しなんかも得意なんですよ","I have a little confidence in my speed, you know.
I'm also good at searching for people.",ui\00_message\npc\base\n2853.gmd,\npc\n2853.arc,n2853.arc,2
0,,"覚者様に話しかけていただけるなんて
この任務について良かったです！","Arisen, please talk to me about the matter of
""Blood Orbs"" whenever you need to exchange them.",ui\00_message\npc\base\n2853.gmd,\npc\n2853.arc,n2853.arc,3
0,,"あ、覚者様じゃないですか
何のご用でしょうか","Oh, it's the Arisen, isn't it? How may I assist
you?",ui\00_message\npc\base\n2854.gmd,\npc\n2854.arc,n2854.arc,0
0,,"――ハァ
い、いえ、何でもありません！
申し訳ございません","- *Sigh*
N-No, it's nothing! I apologize.",ui\00_message\npc\base\n2854.gmd,\npc\n2854.arc,n2854.arc,1
0,,"ちょっと――最近眠れなくて
ハッ、も、申し訳ございません
覚者様にお話するようなことではありませんでした","Just a moment... I've been having trouble
sleeping lately.
Uh, I'm sorry, that's not something to discuss
with someone like you, Arisen.",ui\00_message\npc\base\n2854.gmd,\npc\n2854.arc,n2854.arc,2
0,,"い、今までずっと先輩と一緒だったんですが
任地が分かれてしまいまして――
オレ一人では、何とも――","Well, I've always been with my senior until now,
but our assignments were separated.
I'm not sure if I can manage by myself.",ui\00_message\npc\base\n2854.gmd,\npc\n2854.arc,n2854.arc,3
0,,ああ、覚者さまじゃないか！,"Oh, it's the Arisen!",ui\00_message\npc\base\n2855.gmd,\npc\n2855.arc,n2855.arc,0
0,,"ティネス砦は覚者さまのお陰で
奪還できたようなところだからね！
また奪われないように、こうして見張ってるよ","Fort Thines was retaken thanks to your help,
Arisen! We're here to prevent it from being taken
again.",ui\00_message\npc\base\n2855.gmd,\npc\n2855.arc,n2855.arc,1
0,,"リキャルドのヤツ、顔真っ青だろ
まぁ仕方ないよねぇ
戦に向いてないんだろうね、可哀想なもんだよ","Ricardo looks pale, doesn't he? Well, it can't be
helped.
He's not cut out for battle, poor guy.",ui\00_message\npc\base\n2855.gmd,\npc\n2855.arc,n2855.arc,2
0,,"もし敵が攻めてきたらさ、アタシがまず
ここで少しでも時間を稼いで――
その間にリキャルドに門を閉めるように
言ってあるんだ","If the enemy attacks, I'll try to buy some time
here, and during that time, I've told Ricardo to
close the gate.",ui\00_message\npc\base\n2855.gmd,\npc\n2855.arc,n2855.arc,3
0,,"ああ、覚者さん
どうかしたか？","Ah, Arisen, is there something you need?",ui\00_message\npc\base\n2856.gmd,\npc\n2856.arc,n2856.arc,0
0,,"俺の調子？
まぁまぁだな
絶好調でも、特に悪いわけでもない
見たところ覚者さんもそうだろ","How am I doing?
I'm doing okay.
I'm not in perfect condition, but I'm not
particularly bad either.
It seems like you're the same, Arisen.",ui\00_message\npc\base\n2856.gmd,\npc\n2856.arc,n2856.arc,1
0,,"色々あったし、これからもあるだろうけど
悩んだところで仕方ないからな――","There have been various things, and there will be
more in the future, but there's no use in worrying
about it ――",ui\00_message\npc\base\n2856.gmd,\npc\n2856.arc,n2856.arc,2
0,,"覚者さんも色々あると思うけど
あんまり思い悩むより
割り切っていった方がいいぜ","Arisen, I think there are various things that
even those who have awakened go through.
Instead of worrying too much, it's better to
accept and move on.",ui\00_message\npc\base\n2856.gmd,\npc\n2856.arc,n2856.arc,3
0,,"ああ、覚者さまですか
いえ、避難してきた人たちが可哀想でね――
私に何かできれば良いのですが","Ah, are you an Arisen, my Lord?
No, it's just that the people who have taken
refuge here are so pitiful...
If there's anything I can do to help, please let
me know.",ui\00_message\npc\base\n2857.gmd,\npc\n2857.arc,n2857.arc,0
0,,"家を焼け出され、財産を全て失い
家族すら亡くしてここに駆け込んでくる人が
いるんですよ――気の毒としか言いようがない","They have lost their homes, all their
possessions, and even their families, and yet they
come running here... There's no other way to
describe it but unfortunate.",ui\00_message\npc\base\n2857.gmd,\npc\n2857.arc,n2857.arc,1
0,,"どうにか避難してきた人たちの力に
なりたいんですが、この砦はまだまだ物資も
人手も不足していますからな
ままならないものです","I want to be of help to the people who managed to
take shelter here, but this fort is still lacking
in supplies and manpower.
It's not in a good state.",ui\00_message\npc\base\n2857.gmd,\npc\n2857.arc,n2857.arc,2
0,,"広場にいるミカエラなど
あの幼さで親も兄弟も亡くしているのですよ
家族の話をすると、目に涙をいっぱい溜めて――","People like Michaela in the plaza, she lost her
parents and siblings at such a young age.
When she talks about her family, tears fill her
eyes...",ui\00_message\npc\base\n2857.gmd,\npc\n2857.arc,n2857.arc,3
0,,"どうかなさいましたか、覚者様
こちらは特に問題ありませんが――","What's wrong, Lord? We don't have any particular
problems here...",ui\00_message\npc\base\n2858.gmd,\npc\n2858.arc,n2858.arc,0
0,,"魔軍に占領されていた間に
この砦もかなり傷んでしまいました
まだ完全に復旧していないところも
あるようですね","While occupied by the Demon Army, this fortress
has also sustained considerable damage.
There are still parts that have not been
completely restored it seems.",ui\00_message\npc\base\n2858.gmd,\npc\n2858.arc,n2858.arc,1
0,,"私も工事を手伝っていますが
この砦が完全にかつての姿に戻るまでは
時間がかかるでしょう――","I'm also assisting with the construction, but it
will take time for this fortress to fully return
to its former glory.",ui\00_message\npc\base\n2858.gmd,\npc\n2858.arc,n2858.arc,2
0,,"仮組の足場には手すりがありません
足を滑らせないよう気を付けてくださいね
いくら覚者様でも、この高さですから","Be careful as there are no handrails on the
temporary scaffolding.
It's a long way down, even for the Arisen.",ui\00_message\npc\base\n2858.gmd,\npc\n2858.arc,n2858.arc,3
0,,"はいはい、何でしょうか
自分でお役に立てることならお手伝いします","Alright, alright, what can I help you with? If
there's anything I can assist with, I'll be happy
to.",ui\00_message\npc\base\n2859.gmd,\npc\n2859.arc,n2859.arc,0
0,,,,ui\00_message\npc\base\n2859.gmd,\npc\n2859.arc,n2859.arc,1
0,,"自分は家も家具も、丸ごと
全部焼かれちまいましたから
また一つ一つ揃えるところからですよ","I lost everything in the fire – my house,
furniture, everything. I'll have to start
gathering things one by one.",ui\00_message\npc\base\n2859.gmd,\npc\n2859.arc,n2859.arc,2
0,,"何の取り柄もないんでね、こうやって
兵士の皆さんの雑用でもやって
ちょっとずつ生きてく道を探っとかないとね","I don't have any particular talents, so I'm
helping out with various odd jobs for the
soldiers, slowly finding a way to live.",ui\00_message\npc\base\n2859.gmd,\npc\n2859.arc,n2859.arc,3
0,,"まだまだ故郷に帰れる状況じゃありませんけど
いつかまた、生まれ育った村に家を建てたいんです
それだけが自分の夢ですよ、ははは","It's still not a situation where I can return to
my hometown.
But someday, I want to build a house in the
village where I was born and raised.
That's the only dream I have, hahaha.",ui\00_message\npc\base\n2859.gmd,\npc\n2859.arc,n2859.arc,4
0,,"こんにちは、覚者さま
えっと、ミカエラです","Hello, Ser Arisen.
Um, I'm Michaela.",ui\00_message\npc\base\n2860.gmd,\npc\n2860.arc,n2860.arc,0
0,,"あのお歌を教えてくれたのが
王子さまだったなんて、知らなかったの","I didn't know that the prince was the one who
taught me that song.
",ui\00_message\npc\base\n2860.gmd,\npc\n2860.arc,n2860.arc,1
0,,"王子さまはとっても優しかったよ
わたしが泣いてたから
ずっとそばにいてくれた","The prince was very kind.
He stayed by my side the whole time I was crying.",ui\00_message\npc\base\n2860.gmd,\npc\n2860.arc,n2860.arc,2
0,,"ほんとはね、今も、ひとりでさみしい――
でも、助けてもらったんだから
わたしも頑張ります","Honestly, I still feel lonely now – but since
you've helped me, I'll do my best.",ui\00_message\npc\base\n2860.gmd,\npc\n2860.arc,n2860.arc,3
