0,,"ここまで来るのに疲れたって？
一眠りすれば楽になるんじゃない
ここに泊まるなら<VAL PRICE_INN>だけど
泊まっていくの？","You're tired from coming all this way?
Maybe you'll feel better after a nap.
If you're staying here, it's <VAL PRICE_INN>. Are
you going to stay?",ui\00_message\npc\base\n2701.gmd,\npc\n2701.arc,n2701.arc,1
0,,はい,OK,ui\00_message\npc\base\n2701.gmd,\npc\n2701.arc,n2701.arc,2
0,,いいえ,Cancel,ui\00_message\npc\base\n2701.gmd,\npc\n2701.arc,n2701.arc,3
0,,"疲れてるんなら
ホラ、寝床好きに使っていいから――
で、休んでいくの？","If you're tired, well, you can use my bed if you
want――
So, are you going to rest?",ui\00_message\npc\base\n2701.gmd,\npc\n2701.arc,n2701.arc,4
0,,はい,OK,ui\00_message\npc\base\n2701.gmd,\npc\n2701.arc,n2701.arc,5
0,,いいえ,Cancel,ui\00_message\npc\base\n2701.gmd,\npc\n2701.arc,n2701.arc,6
0,,"――《弱化の治療》なら
<VAL PRICE_WEAK>よ
まぁ、どうするかは自分次第ね
治療していく？","If it's Treat Weakness, it's <VAL PRICE_WEAK>.
Well, it's up to you what to do.
Shall we proceed with the treatment?",ui\00_message\npc\base\n2701.gmd,\npc\n2701.arc,n2701.arc,7
0,,はい,OK,ui\00_message\npc\base\n2701.gmd,\npc\n2701.arc,n2701.arc,8
0,,いいえ,Cancel,ui\00_message\npc\base\n2701.gmd,\npc\n2701.arc,n2701.arc,9
0,,"なんだ、弱化してないじゃない
眠いんなら泊まっていきなさいよ
腹が減ってるならシェナの料理を
食べていくといい","What, you haven't weakened, have you?
If you're tired, why don't you stay the night?
And if you're hungry, it's best to eat Shena's
cuisine.",ui\00_message\npc\base\n2701.gmd,\npc\n2701.arc,n2701.arc,10
0,,"あたしはココを切り盛りしてるだけよ
エリアの情報はキアランに聞くのね","I'm just managing this place.
If you want information about the area, ask
Ciarán.",ui\00_message\npc\base\n2701.gmd,\npc\n2701.arc,n2701.arc,11
0,,"キアランはやたら考えこむクセがあるわ
聞きたいことがあるなら要点を絞って聞くことね
じゃないと、話が長くなるから","Ciarán has a habit of overthinking.
If you have something you want to ask, make it
concise.
Otherwise, the conversation will drag on.",ui\00_message\npc\base\n2701.gmd,\npc\n2701.arc,n2701.arc,12
0,,"ん？
キアランはあたしのダンナよ","Huh?
Ciarán is my husband.",ui\00_message\npc\base\n2701.gmd,\npc\n2701.arc,n2701.arc,13
0,,"考え込むのが好きで、素早く物事を決めないから
拠点の中のことはあたしが回した方が
効率がいいの","Because I enjoy pondering and don't make quick
decisions, it's more efficient for me to handle
matters within the base.",ui\00_message\npc\base\n2701.gmd,\npc\n2701.arc,n2701.arc,14
0,,"少し休んでいく？
疲れた顔のままではここから出せないわね","Are you going to take a little rest?
You can't go out from here with such a tired face.",ui\00_message\npc\base\n2701.gmd,\npc\n2701.arc,n2701.arc,15
0,,"キアランはやたら考え込むでしょう
だから、今は立ち止まって考えるのをやめて
村の皆がいつも通り暮らせるようにってことにだけ
集中するように言ったのよ","Ciarán tends to ponder a lot, doesn't he?
That's why I told him to stop and not think too
much for now.
Just concentrate on ensuring that everyone in the
village can live as usual.",ui\00_message\npc\base\n2701.gmd,\npc\n2701.arc,n2701.arc,16
0,,"それぞれが怯えて
妙なことをし始めないようにね","So that each person does not start doing strange
things out of fear.",ui\00_message\npc\base\n2701.gmd,\npc\n2701.arc,n2701.arc,17
0,,"怖くないといえば嘘になる
でも、眠っているとはいえ精霊竜セシリーがいて
こうして異国の人たちも来てくれてる","To say that it's not scary would be a lie.
But even though she's asleep, Spirit Dragon
Cecily is here.
And we also have people from foreign lands like
this who have come.",ui\00_message\npc\base\n2701.gmd,\npc\n2701.arc,n2701.arc,18
0,,"それに、あたしにはキアランがいる
キアランにはあたしが付いてる
――きっと、それほど悪くないわ","And, I have Ciarán, and Ciarán has me. Surely,
it's not that bad.",ui\00_message\npc\base\n2701.gmd,\npc\n2701.arc,n2701.arc,19
0,,"ダナが戦士を出してくれたって聞いてるわ
きっとあたしたち、""前の騒動""の時よりかは
結束できているのよね","I heard Dana has sent out warriors. I'm sure
we're more united than during the ""previous
incident.""",ui\00_message\npc\base\n2701.gmd,\npc\n2701.arc,n2701.arc,20
0,,よっ、色々見ていってくれ,"Hey, go ahead and take a look at various things.",ui\00_message\npc\base\n2702.gmd,\npc\n2702.arc,n2702.arc,0
0,,"何で""大人""って怖がりなんだろうな","I wonder why ""adults"" are always afraid.",ui\00_message\npc\base\n2702.gmd,\npc\n2702.arc,n2702.arc,1
0,,"あのさ、この村で建設的な話ができるのは
マヴェイル兄貴だけだぜ！
――俺はそう思ってる！","Listen, there's no one else in this village I can
have a constructive conversation with except for
my big brother Mavail. That's what I think.",ui\00_message\npc\base\n2702.gmd,\npc\n2702.arc,n2702.arc,2
0,,"""立派な大人""たちは、ほら――
頭が固いんだよな
ああはなりたくないよ","""Respected adults"" are often quite stubborn. I
hope I don't become like that.",ui\00_message\npc\base\n2702.gmd,\npc\n2702.arc,n2702.arc,3
0,,"あ、ああ
覚者さんか、いらっしゃい","Oh, you're an Arisen! Welcome.",ui\00_message\npc\base\n2702.gmd,\npc\n2702.arc,n2702.arc,4
0,,"キアランが普段通り店を開けろっていうから
こうしてるけどさぁ――","Because Ciarán told me to open the shop as usual,
I'm doing it like this, you know...",ui\00_message\npc\base\n2702.gmd,\npc\n2702.arc,n2702.arc,5
0,,"大変なことになったって、頭ではわかってるんだけど
いまいち実感が無いんだ――悪い冗談みたいでさ
かと思えば、急にものすごく怖くなる
どうしたらいいのかな","I know in my head that things have become really
difficult, but I can't quite grasp the reality of
it—it feels like a bad joke.
And then suddenly, I become incredibly scared.
What should I do?",ui\00_message\npc\base\n2702.gmd,\npc\n2702.arc,n2702.arc,6
0,,"あのさ――これで終わりなんかじゃないよな
フィンダムは――まだ、なんとかなるよな
頼むよ、そうだって言ってくれ","Hey, you know... this can't be the end, right?
Phindym... there has to be a way. Please, tell me
it's true.",ui\00_message\npc\base\n2702.gmd,\npc\n2702.arc,n2702.arc,7
0,,"呼んだかい！
さっ、何が食べたい？","Have you called for me?
Well then, what would you like to eat?",ui\00_message\npc\base\n2703.gmd,\npc\n2703.arc,n2703.arc,0
0,,"さぁさぁ、お腹いっぱい食べとくれ！
覚者さんも体が資本でしょ
食べて力付けなきゃ！","Come on, come on, eat until your belly is full!
Even the Arisen relies on their body.
You have to eat and gain strength!",ui\00_message\npc\base\n2703.gmd,\npc\n2703.arc,n2703.arc,1
0,,何だい、好き嫌いしちゃダメだよ！,What's wrong? You can't be picky!,ui\00_message\npc\base\n2703.gmd,\npc\n2703.arc,n2703.arc,2
0,,"ガッカリきた時、活力が出ない時――
そんな時は美味しいものを食べるのが一番だよ！
さ、何が食べたい？","When you're disappointed, when you lack vitality――
The best thing to do is eat something delicious!
So, what do you want to eat?",ui\00_message\npc\base\n2703.gmd,\npc\n2703.arc,n2703.arc,3
0,,"覚者さん、お腹いっぱい食べてっとくれ！
こんな時だからこそ、食べるのを
おろそかにしちゃいけないんだから！","Arisen, please eat until you're full!
Especially at times like this, you shouldn't
neglect to eat
!",ui\00_message\npc\base\n2703.gmd,\npc\n2703.arc,n2703.arc,4
0,,"明日この世が終わるってわけでもないんだろう？
だったら、今日食べて、明日も食べなきゃ
毎日美味しいものを作るからさ――","This world isn't ending tomorrow, is it?
So, let's eat today and tomorrow too, I'll make
something delicious every day――",ui\00_message\npc\base\n2703.gmd,\npc\n2703.arc,n2703.arc,5
0,,"空を見たかって？
――見たくないから、見てないよ
変に見ちゃったら怖くなるかもしれないからね","You want to look at the sky?
Well, I haven't looked because I might get scared
if I see something strange.",ui\00_message\npc\base\n2703.gmd,\npc\n2703.arc,n2703.arc,6
0,,"みんな、お腹いっぱい食べれば
少しは落ち着くと思うんだけど
緊張しちゃって食べる気にならないみたい","Everyone might feel a bit calmer if they eat
their fill, but it seems they're too nervous to
eat.",ui\00_message\npc\base\n2703.gmd,\npc\n2703.arc,n2703.arc,7
0,,同行者を探したいなら手を貸そう,"If you want to find a companion, let me help you.",ui\00_message\npc\base\n2704.gmd,\npc\n2704.arc,n2704.arc,0
0,,"遺跡には近寄るなよ
村の者にはよく言い聞かせてある
異国の覚者とて例外ではない","Don't approach the ruins. I've made it clear to
the villagers. Even foreign Arisen are not
exceptions.",ui\00_message\npc\base\n2704.gmd,\npc\n2704.arc,n2704.arc,1
0,,"自分が異国から来たからといって
ここの掟を軽んじないことだ","Just because you're from a foreign land doesn't
mean you should disregard the rules here.",ui\00_message\npc\base\n2704.gmd,\npc\n2704.arc,n2704.arc,2
0,,"遺跡に近づく者あらば災いが起こる――
そう言い伝えられているのだ","Trouble is said to befall those who approach the
ruins. This is a well-established belief.",ui\00_message\npc\base\n2704.gmd,\npc\n2704.arc,n2704.arc,3
0,,"先人の知恵を無視して
村の平穏は無い","Ignoring the wisdom of our ancestors, the village
knows no peace.",ui\00_message\npc\base\n2704.gmd,\npc\n2704.arc,n2704.arc,4
0,,ううむ――,Hmm...,ui\00_message\npc\base\n2704.gmd,\npc\n2704.arc,n2704.arc,5
0,,"あの渦、まるでこの世の災いという災いを
かき集めたかのような禍禍しさだ","That vortex, it exudes a calamitous intent, as if
gathering all the misfortunes of this world.",ui\00_message\npc\base\n2704.gmd,\npc\n2704.arc,n2704.arc,6
0,,"用が無いなら話しかけるな
今は気軽に話していられる状況ではない","If you have no business, do not talk to me.
It is not a situation where we can speak casually
right now.",ui\00_message\npc\base\n2704.gmd,\npc\n2704.arc,n2704.arc,7
0,,"フィンダムは災い続きだ
やはり、言い伝えを――先人の知恵を
無視したからこうなっているのでは――
そう考えるのも当然のことだと思わないか","Phindym has been plagued by disasters.
It's natural to think that it's because they
ignored traditions and wisdom passed down by their
ancestors.",ui\00_message\npc\base\n2704.gmd,\npc\n2704.arc,n2704.arc,8
0,,――何か用でも？,"Yes, may I help you with something?",ui\00_message\npc\base\n2705.gmd,\npc\n2705.arc,n2705.arc,0
0,,"遺跡には近付くことなかれ――
これは昔からこの村に伝わる掟だ
近付いたら、村に一体どんな災いが起こるか――","Do not approach the ruins――
This is a rule that has been passed down in this
village since ancient times.
If you approach, what kind of disaster will
befall the village――",ui\00_message\npc\base\n2705.gmd,\npc\n2705.arc,n2705.arc,1
0,,"その昔、神殿に足を踏み入れた者がいたそうな――
無事に神殿を出ることはできたんだが
安心して後ろを振り返った瞬間――","In the old days, it is said that someone set foot
in the temple.
They managed to get out safely, but the moment
they relaxed and looked back—",ui\00_message\npc\base\n2705.gmd,\npc\n2705.arc,n2705.arc,2
0,,"神殿の入り口から伸びた巨大な腕に
ズバーッと頭から切り裂かれた！！","A massive arm extended from the temple entrance
and slashed them right through, from the head
first!!",ui\00_message\npc\base\n2705.gmd,\npc\n2705.arc,n2705.arc,3
0,,"――という話もあるんだぞ
古い場所には近寄らないことだ","There's a saying that you shouldn't approach the
old places.",ui\00_message\npc\base\n2705.gmd,\npc\n2705.arc,n2705.arc,4
0,,"――お前さん
自分だけは強いから
遺跡の災いも怖くないと思ってるんじゃないか？
思い上がりだぞ、それは","You think you're invincible because you believe
that the danger of the ruins doesn't scare you?
That's just arrogance.",ui\00_message\npc\base\n2705.gmd,\npc\n2705.arc,n2705.arc,5
0,,"あの渦を見ろ！
はやくどうにかしてくれ！","Look at that vortex! Please, do something about
it soon!",ui\00_message\npc\base\n2705.gmd,\npc\n2705.arc,n2705.arc,6
0,,"こんな空は見たことがない
ああ、一生見たくなかった！","I've never seen a sky like this. Oh, I wish I'd
never seen it!",ui\00_message\npc\base\n2705.gmd,\npc\n2705.arc,n2705.arc,7
0,,"とんでもないことになるぞ――
災いだ、きっとこれこそが遺跡の災いだ！","This is going to be a major disaster, I'm sure of
it! A calamity! It must be the disaster of the
ruins!",ui\00_message\npc\base\n2705.gmd,\npc\n2705.arc,n2705.arc,8
0,,"どこかに逃げないといけないんじゃないか？
キアランは落ち着くべきだと言っていたが
本当は自分たちだけ逃げるつもりなんじゃ――？
く、口ではなんとでも言えるぞ","Do we need to escape somewhere?
Ciarán said we should calm down, but are we
really planning to escape on our own?
Hah, you can say anything with your mouth, can't
you?",ui\00_message\npc\base\n2705.gmd,\npc\n2705.arc,n2705.arc,9
0,,ああ、異国の覚者さんか,"Ah, an Arisen from a foreign land.",ui\00_message\npc\base\n2706.gmd,\npc\n2706.arc,n2706.arc,0
0,,"もっと遠くに採掘に行けたらなぁ――
村も潤うし、いいこと尽くめなのにな――","If only we could go mining further away—
The village would prosper, and it would be all
good.—",ui\00_message\npc\base\n2706.gmd,\npc\n2706.arc,n2706.arc,1
0,,"この村では遠出は禁じられているんだ
俺の脚なら遠出しても
その日のうちに帰ってこられるのに――","In this village, going far is prohibited.
Even if it's a long journey, with my legs, I can
return home within the same day--",ui\00_message\npc\base\n2706.gmd,\npc\n2706.arc,n2706.arc,2
0,,覚者さんも何か言われなかったかい,"Did the Arisen not say something as well, my Lord?",ui\00_message\npc\base\n2706.gmd,\npc\n2706.arc,n2706.arc,3
0,,"遺跡に近寄るなー、災いがふりかかるぞー
――とかさ","Don't get too close to the ruins, disaster will
strike.
Or so they say...",ui\00_message\npc\base\n2706.gmd,\npc\n2706.arc,n2706.arc,4
0,,"来てくれたのか！
覚者さんの顔を見たら、何だかほっとしたよ","You came! When I saw the face of the Arisen I
felt relieved for some reason.",ui\00_message\npc\base\n2706.gmd,\npc\n2706.arc,n2706.arc,5
0,,"ダナが精鋭の戦士を出してくれたらしい
あの渦の真下の辺りに向かったんだろう
偉そうな奴らが多い村だと思ってたけど
意外と頼りになるんだな","It seems that Dana sent out elite soldiers.
They must have headed towards the area right
below that vortex.
I thought this village was full of arrogant
people, but they unexpectedly turned out to be
dependable.",ui\00_message\npc\base\n2706.gmd,\npc\n2706.arc,n2706.arc,6
0,,,,ui\00_message\npc\base\n2706.gmd,\npc\n2706.arc,n2706.arc,7
0,,"今は遠出する気にならないよ
できるだけ家族の近くにいたい
万が一の時に、傍にいたいからさ","Right now, I don't feel like going far away.
I want to be close to my family as much as
possible.
In case something happens, I want to be by their
side.",ui\00_message\npc\base\n2706.gmd,\npc\n2706.arc,n2706.arc,8
0,,"アデリンは――
こんな時でも物見台か
後で迎えに行ってやらないと","Adelin, even in times like these, you're still at
the observatory, huh? I'll have to go pick you up
later.",ui\00_message\npc\base\n2706.gmd,\npc\n2706.arc,n2706.arc,9
0,,――なんでしょう？,...What is it?,ui\00_message\npc\base\n2707.gmd,\npc\n2707.arc,n2707.arc,0
0,,"遺跡に近づこうなんて思わないでくださいね
あなただけじゃなく、村に災いが
降りかかったらどうするんです","Please refrain from approaching the ruins.
Not only you, but if the village were to suffer a
disaster, what would you do?",ui\00_message\npc\base\n2707.gmd,\npc\n2707.arc,n2707.arc,1
0,,"わたしはね、ビックリするようなことは
何一つ望んでないんですよ
良いことも悪いこともね","You know, I don't wish for anything surprising at
all, whether it's something good or something bad.",ui\00_message\npc\base\n2707.gmd,\npc\n2707.arc,n2707.arc,2
0,,"何事も無いのが一番――
だから、外から何かを持ちこまないでくださいね","Nothing happening is the best of all.
So, please don't bring anything from the outside.",ui\00_message\npc\base\n2707.gmd,\npc\n2707.arc,n2707.arc,3
0,,"若い時は刺激を欲しがりますけどね
何かが変わるのが良いか悪いかなんて
誰も正確に予測できませんよ","When you're young, you often seek excitement, but
whether it's for better or worse, no one can
predict what will change.",ui\00_message\npc\base\n2707.gmd,\npc\n2707.arc,n2707.arc,4
0,,"悪い方にいったらどうするんです
今のままで十分――","What if it goes wrong? Things are fine as they
are now.",ui\00_message\npc\base\n2707.gmd,\npc\n2707.arc,n2707.arc,5
0,,"ああ、怖い、どうしましょう
この気味が悪い空の色――","Ah, this is scary. What should we do about this
eerie sky color?",ui\00_message\npc\base\n2707.gmd,\npc\n2707.arc,n2707.arc,6
0,,"精霊竜セシリーはどうしてまだ目覚めないのかしら
フィンダムが大変なのよ！
どんな理由があったって、眠っている場合じゃないわ","Why hasn't Spirit Dragon Cecily awakened yet?
Phindym is in great trouble!
No matter what the reason is, it's not the time
to be sleeping.",ui\00_message\npc\base\n2707.gmd,\npc\n2707.arc,n2707.arc,7
0,,"ただ平和に暮らしていきたいだけなのに――
どうしてこんなことになるの","We just want to live in peace, yet...
Why did this happen?",ui\00_message\npc\base\n2707.gmd,\npc\n2707.arc,n2707.arc,8
0,,"ねぇ、前みたいに
フィンダムを助けに来てくれたんでしょう？
それとも、わたしたちをどこかへ逃がすために
来てくれたんですか？","Hey, did you come to help us like you did before?
Or did you come to take us somewhere and help us
escape?",ui\00_message\npc\base\n2707.gmd,\npc\n2707.arc,n2707.arc,9
0,,えっと、なぁに？,"Um, what is it?",ui\00_message\npc\base\n2708.gmd,\npc\n2708.arc,n2708.arc,0
0,,ママがあんまりよその人と話しちゃダメって――,Mom said I shouldn't talk to strangers...,ui\00_message\npc\base\n2708.gmd,\npc\n2708.arc,n2708.arc,1
0,,"ほんとは、村の外の話を
聞かせて欲しいんだけど――","I actually want you to tell me stories
from outside the village, but...",ui\00_message\npc\base\n2708.gmd,\npc\n2708.arc,n2708.arc,2
0,,"ねぇ、色んな村を見てきたんでしょう？
""芯なる樹""を近くで見たことはある？","Hey, have you seen many villages?
Have you ever seen the Core Tree up close?",ui\00_message\npc\base\n2708.gmd,\npc\n2708.arc,n2708.arc,3
0,,"村から出ちゃいけないって言われるけど
いつか色んなところに行ってみたいの","Although I'm told not to leave the village, I
still have a strong desire to explore different
places someday.",ui\00_message\npc\base\n2708.gmd,\npc\n2708.arc,n2708.arc,4
0,,"大人になったら
もっと近くで""芯なる樹""を見にいけるかな――","When I become an adult, I wonder if I can go see
the ""Core Tree"" up close...",ui\00_message\npc\base\n2708.gmd,\npc\n2708.arc,n2708.arc,5
0,,"空の色が――
この色、きらい","The color of the sky...
I don't like this color.",ui\00_message\npc\base\n2708.gmd,\npc\n2708.arc,n2708.arc,6
0,,"""芯なる樹""はいつだってきれいだって
思ってたけど――この空の色だと
あんまりきれいに見えない――","I always thought the ""Core Tree"" was beautiful,
but the sky's color doesn't make it look as
pretty.",ui\00_message\npc\base\n2708.gmd,\npc\n2708.arc,n2708.arc,7
0,,"空の渦、怖いのに
一度見始めるとずっと見ちゃうの
それでもっと怖くなるから――
もう見たくない","I'm scared of the swirling vortex, but once I
start watching, I can't stop.
And that makes it even scarier – I don't want to
see it anymore.",ui\00_message\npc\base\n2708.gmd,\npc\n2708.arc,n2708.arc,8
0,,"空はまた元に戻る？
はやく戻ってくれないと、怖い夢を見そう","Will the sky return to normal? It needs to come
back soon, or I'll have nightmares.",ui\00_message\npc\base\n2708.gmd,\npc\n2708.arc,n2708.arc,9
0,,"塔の外からお越しとは――
用があるならお聞きしましょう","You've come from outside the tower? If you have
business, I'll be happy to listen.",ui\00_message\npc\base\n2750.gmd,\npc\n2750.arc,n2750.arc,0
0,,"宿泊をご希望なら<VAL PRICE_INN>です
ここは資源が限られていることもあり
旅人に大盤振る舞いというのはできないのです
それでも、よろしいですか？","If you're looking for accommodation, it's <VAL PRICE_INN>
. We have limited resources here, so we
can't afford to be extravagant with travelers. Is
that acceptable to you?",ui\00_message\npc\base\n2750.gmd,\npc\n2750.arc,n2750.arc,1
0,,はい,OK,ui\00_message\npc\base\n2750.gmd,\npc\n2750.arc,n2750.arc,2
0,,いいえ,Cancel,ui\00_message\npc\base\n2750.gmd,\npc\n2750.arc,n2750.arc,3
0,,"今は寝床に余裕があります
休みたいなら案内しましょうか？","There's plenty of room for a bed now. If you want
to rest, shall I show you the way?",ui\00_message\npc\base\n2750.gmd,\npc\n2750.arc,n2750.arc,4
0,,はい,OK,ui\00_message\npc\base\n2750.gmd,\npc\n2750.arc,n2750.arc,5
0,,いいえ,Cancel,ui\00_message\npc\base\n2750.gmd,\npc\n2750.arc,n2750.arc,6
0,,"《弱化の治療》には
<VAL PRICE_WEAK>いただきますよ
なにぶん、物資も限られていますからね
治療をお望みですか？","For the ""Treat Weakness,"" the cost is <VAL PRICE_WEAK>
. We have limited supplies, you see. Do
you wish to receive treatment?",ui\00_message\npc\base\n2750.gmd,\npc\n2750.arc,n2750.arc,7
0,,はい,OK,ui\00_message\npc\base\n2750.gmd,\npc\n2750.arc,n2750.arc,8
0,,いいえ,Cancel,ui\00_message\npc\base\n2750.gmd,\npc\n2750.arc,n2750.arc,9
0,,"弱化にはなっていませんよ
気のせい、ということです
よろしいですね","You haven't been weakened, you know.
It's just your imagination. Alright then,
understood?",ui\00_message\npc\base\n2750.gmd,\npc\n2750.arc,n2750.arc,10
0,,"どうして塔に住んでいるのか、ですか？
我らは守っているのです
この塔に住むことで――","Why do we live in the tower?
We are here to protect it.
By living in this tower...",ui\00_message\npc\base\n2750.gmd,\npc\n2750.arc,n2750.arc,11
0,,"何を守っているのかは――
長老のベレナスにでもお聞きください
我らは祖先より代々、この塔にて""守る""ために
ここにいると聞かされています","What we are protecting, you should ask Elder
Berenas about it.
We have been told that we are here, generation
after generation, to ""protect"" this tower.",ui\00_message\npc\base\n2750.gmd,\npc\n2750.arc,n2750.arc,12
0,,"きっとダナの住人たちは
彼らの武勇が村を守っていると
思っているでしょうね","I'm sure the people of Dana think their bravery
is protecting the village.",ui\00_message\npc\base\n2750.gmd,\npc\n2750.arc,n2750.arc,13
0,,"私に言わせれば、ダナの侵食が
比較的ゆるやかなのは
村の位置が関係しているだけです","In my opinion, the relatively slow spread of
corruption in Dana is solely due to the village's
location.",ui\00_message\npc\base\n2750.gmd,\npc\n2750.arc,n2750.arc,14
0,,"この場は私が取りまとめていますが
この《イヴァノスの塔》の成り立ちについては
長老のベレナスに聞いてください","I'm managing this place, but please ask Elder
Berenas about the history of the Tower of Ivannos.",ui\00_message\npc\base\n2750.gmd,\npc\n2750.arc,n2750.arc,15
0,,"彼が素直に話すとは思えませんが――
私たちですら、いつも煙に巻かれるのです","I don't think he'll speak candidly, but even we
often get confused.",ui\00_message\npc\base\n2750.gmd,\npc\n2750.arc,n2750.arc,16
0,,よぉ、買い物か？,"Hey, are you here for shopping?",ui\00_message\npc\base\n2751.gmd,\npc\n2751.arc,n2751.arc,0
0,,"ここの売り物も、皆で必死に集めてきたものだ
無駄遣いはするなよ","The things being sold here are also items that
we've desperately gathered together.
Don't waste them, okay?",ui\00_message\npc\base\n2751.gmd,\npc\n2751.arc,n2751.arc,1
