0,,"これはこれは、新しき覚者さま
お待ち申しておりました
ここは我らポーンの民が集いし《ポーン郷》","Greetings, greetings, esteemed new Arisen.
We have been eagerly awaiting your arrival.
This is the gathering place of our Pawn 
community, the ""Pawn Cathedral"".",ui\00_message\quest\q00000004.gmd,\quest\q00000004.arc,q00000004.arc,32,Thomason
0,,"里長アルヴァーさまは聖堂の奥におられます
――が、まずは左手にある《拠点の礎》を開放し
登録なさいませ","Master Alvar is located deep within the cathedral.
- First, unlock the Portcrystal on your left hand 
side and register it.",ui\00_message\quest\q00000004.gmd,\quest\q00000004.arc,q00000004.arc,33,Thomason
0,,"契約の試練に行かれるにも準備をなさるにも
覚者さまの拠点としてきっとお役に立つでしょう","Whether you are going to the 
Trial of the Contract 
or preparing for it, I'm sure it will be useful 
as the base of the Arisen.",ui\00_message\quest\q00000004.gmd,\quest\q00000004.arc,q00000004.arc,34,Thomason
0,,"《ポーン郷》へようこそ
わたしはここの管理人アルヴァー","Welcome to the Pawn Cathedral.
I am the caretaker of this place, Alvar.",ui\00_message\quest\q00000004.gmd,\quest\q00000004.arc,q00000004.arc,35,Alvar
0,,"さて、覚者よ
貴君はまだポーンについて何も知るまい","Now, O Arisen, you may not yet know 
anything about Pawns.",ui\00_message\quest\q00000004.gmd,\quest\q00000004.arc,q00000004.arc,36,Alvar
0,,"――気にするな
最初は誰でも同じだ
そんなことで我々ポーンは貴君を
見限ったりはしない","Don't worry about it.
At first, everyone is the same.
We Pawns won't abandon you just
because of something like that.",ui\00_message\quest\q00000004.gmd,\quest\q00000004.arc,q00000004.arc,37,Alvar
0,,"――いや、見限るなど、できないのだ
ポーンには己の意志や感情がない
欲望、野望――何もなく、ただ覚者の
意志に従うのみ","No, it's impossible to abandon them.
Pawns have no will or emotions of their own.
No desires, ambitions—nothing,
they simply follow the will of the Arisen.",ui\00_message\quest\q00000004.gmd,\quest\q00000004.arc,q00000004.arc,38,Alvar
0,,ポーンは異界から来た不倒の戦士だ,"Pawns are unyielding warriors who have 
come from a different realm.",ui\00_message\quest\q00000004.gmd,\quest\q00000004.arc,q00000004.arc,39,Alvar
0,,"けして死ぬことはなく――
ただ、異界に帰り、また復活する
その特性から我らを""異界渡り""と呼ぶ者もいる","There is no such thing as dying.
Instead, we return to the other world and revive.
Some even call us ""otherworld travelers"" 
because of this characteristic.",ui\00_message\quest\q00000004.gmd,\quest\q00000004.arc,q00000004.arc,40,Alvar
0,,"そして、ポーンの能力が発揮されるのは
戦場だけではない","And it's not just on the battlefield that
the pawn's abilities come into play.",ui\00_message\quest\q00000004.gmd,\quest\q00000004.arc,q00000004.arc,41,Alvar
0,,"《クラフト》の能力で貴君ら覚者のために
様々な装具を生み出すだろう","They will use their ability of ""Craft"" to create 
various equipment for you, noble Arisen.",ui\00_message\quest\q00000004.gmd,\quest\q00000004.arc,q00000004.arc,42,Alvar
0,,"ポーンとの契約を望む者は
《異界の狭間》へ行かねばならぬが
それが許されるのは一時にただひとりだけ","Those who wish to make a contract with
Pawns must go to ""The Rift"".
But only one person is allowed to do so 
at a time.",ui\00_message\quest\q00000004.gmd,\quest\q00000004.arc,q00000004.arc,43,Alvar
0,,"準備と覚悟ができているのなら
あらためて声をかけてくれ","If you are prepared and ready,
please reach out to me again.",ui\00_message\quest\q00000004.gmd,\quest\q00000004.arc,q00000004.arc,44,Alvar
0,,"ん？　準備できたら教えてね
君に足りないのは経験だけだよ","Hmm? Let me know when you're ready.
All you're missing is experience.",ui\00_message\quest\q00000004.gmd,\quest\q00000004.arc,q00000004.arc,45,Iris
0,,"クラウスが帰還を渋るかもしれん
その時は――","Klaus may be reluctant to return.
If that happens--",ui\00_message\quest\q00000005.gmd,\quest\q00000005.arc,q00000005.arc,0,Joseph
0,,"すぐに第二次調査団を派遣すると
伝えてくれんか","Can you inform them to dispatch
the second investigation team immediately?",ui\00_message\quest\q00000005.gmd,\quest\q00000005.arc,q00000005.arc,1,Joseph
0,,"嫌な予感がしてな――
ウソも方便だ","I have a bad feeling about this-- 
But sometimes, a lie can be a useful tool.",ui\00_message\quest\q00000005.gmd,\quest\q00000005.arc,q00000005.arc,2,Joseph
0,,"ここで何をしている
調査団はまだ戻らないのか？","What are you doing here? 
Hasn't the investigation team returned yet?",ui\00_message\quest\q00000005.gmd,\quest\q00000005.arc,q00000005.arc,3,Leo
0,,皆さんが無事に帰還しますように――,May everyone return safely -,ui\00_message\quest\q00000005.gmd,\quest\q00000005.arc,q00000005.arc,4,Mysial
0,,お――あんたが来たのか――,Oh... you're here...,ui\00_message\quest\q00000005.gmd,\quest\q00000005.arc,q00000005.arc,5,Fabio
0,,くそっ――不覚だ――,Damn it... I underestimated it...,ui\00_message\quest\q00000005.gmd,\quest\q00000005.arc,q00000005.arc,6,Fabio
0,,"見たことのない敵がいるぞ――
気をつけろ――","There's an enemy I've never seen before--
Watch out--",ui\00_message\quest\q00000005.gmd,\quest\q00000005.arc,q00000005.arc,7,Fabio
0,,"クラウスたちは――奥だ――
もっと奥に――","Klaus and the others--back there--
further in--",ui\00_message\quest\q00000005.gmd,\quest\q00000005.arc,q00000005.arc,8,Fabio
0,,――急いで,--Hurry.,ui\00_message\quest\q00000005.gmd,\quest\q00000005.arc,q00000005.arc,9,Iris
0,,気をつけて――,Be careful...,ui\00_message\quest\q00000005.gmd,\quest\q00000005.arc,q00000005.arc,10,Iris
0,,ほら、集中して,"Come on, focus.",ui\00_message\quest\q00000005.gmd,\quest\q00000005.arc,q00000005.arc,11,Iris
0,,調査が――,The investigation--,ui\00_message\quest\q00000005.gmd,\quest\q00000005.arc,q00000005.arc,12,Klaus
0,,うう――まだまだ,Ugh--there's more.,ui\00_message\quest\q00000005.gmd,\quest\q00000005.arc,q00000005.arc,13,Klaus
0,,ここに――残ろう――,Let's—stop here—,ui\00_message\quest\q00000005.gmd,\quest\q00000005.arc,q00000005.arc,14,Klaus
0,,"世話になったな
実はアークの中に一歩入った瞬間から
嫌な予感がしていたんだ","You've been a great help.
Actually, I've had a bad feeling
since I stepped into the Ark.",ui\00_message\quest\q00000005.gmd,\quest\q00000005.arc,q00000005.arc,15,Fabio
0,,"しかし、好奇心に負けた
イリスが引き返すべきだと言い出した時も
俺はクラウスに加勢してな","But I succumbed to my curiosity. 
Even when Iris told us to turn back, 
I sided with Klaus.",ui\00_message\quest\q00000005.gmd,\quest\q00000005.arc,q00000005.arc,16,Fabio
0,,"だから、もしクラウスが責任を問われるなら
俺も同罪だ","So, if Klaus is held accountable, 
I am also guilty.",ui\00_message\quest\q00000005.gmd,\quest\q00000005.arc,q00000005.arc,17,Fabio
0,,"ご苦労さまでした
オークの臭いを強く感じたのは
ほんの一瞬――","Thank you for your hard work.
I only briefly sensed the smell of Orc—",ui\00_message\quest\q00000005.gmd,\quest\q00000005.arc,q00000005.arc,18,Mysial
0,,こちらは何事もなくホッとしていたところです,"We were just relieved that 
everything was alright here.",ui\00_message\quest\q00000005.gmd,\quest\q00000005.arc,q00000005.arc,19,Mysial
0,,"調査報告をまとめないと――
ジョゼフ様にすごく急かされてるんだ","I need to summarize the research report... 
Joseph is really rushing me.",ui\00_message\quest\q00000005.gmd,\quest\q00000005.arc,q00000005.arc,20,Klaus
0,,"深刻な傷を負った者はいないと聞いている
良かった――と言うべきなのだろうな","I heard that no one has suffered serious wounds.
I guess it's a relief.",ui\00_message\quest\q00000005.gmd,\quest\q00000005.arc,q00000005.arc,21,Joseph
0,,調査団は先程、神殿に帰還したところだ,The survey team just returned to the temple.,ui\00_message\quest\q00000005.gmd,\quest\q00000005.arc,q00000005.arc,22,Leo
0,,"アークでの出来事については
この後、ジョゼフと相談してみよう","Regarding the events at the Ark,
let's consult with Joseph afterwards.",ui\00_message\quest\q00000005.gmd,\quest\q00000005.arc,q00000005.arc,23,Leo
0,,準備できたら声を掛けてくれ,Give me a shout when you're ready.,ui\00_message\quest\q00000005.gmd,\quest\q00000005.arc,q00000005.arc,24,Leo
0,,"一緒にやりたいこと、相談したいこと――
頼みたいことが山ほどある","There are so many things I want to do with you, 
things I want to talk to you about-- 
so much I want to ask you for help with.",ui\00_message\quest\q00000005.gmd,\quest\q00000005.arc,q00000005.arc,25,Leo
0,,【ヒント：アークへの調査について】,[Hint: Regarding the investigation into the Ark],ui\00_message\quest\q00000005.gmd,\quest\q00000005.arc,q00000005.arc,26,Leo
0,,アーク内部の敵は非常に強敵です,Enemies inside The Ark are very formidable.,ui\00_message\quest\q00000005.gmd,\quest\q00000005.arc,q00000005.arc,27,Leo
0,,リムストーンでサポートポーンを追加雇用するか他の覚者と共に4人で挑みましょう,"You can hire additional Support Pawns at the 
Riftstone or challenge it together with other 
Arisen in a group of four.",ui\00_message\quest\q00000005.gmd,\quest\q00000005.arc,q00000005.arc,28,Leo
0,,ひとつ――頼まれてくれないか？,One thing - would you do me a favor?,ui\00_message\quest\q00000006.gmd,\quest\q00000006.arc,q00000006.arc,0,Joseph
0,,"今朝からメイリーフの姿が
見えないんだ",I haven't seen Mayleaf since this morning.,ui\00_message\quest\q00000006.gmd,\quest\q00000006.arc,q00000006.arc,1,Joseph
0,,"メイリーフはわかるだろう？
すばしっこい小さな女の子だ","You know Mayleaf, don't you?
She's a quick little girl.",ui\00_message\quest\q00000006.gmd,\quest\q00000006.arc,q00000006.arc,2,Joseph
0,,あの子の両親が古い知り合いでな――,Her parents are old acquaintances of mine--,ui\00_message\quest\q00000006.gmd,\quest\q00000006.arc,q00000006.arc,3,Joseph
0,,"その死の間際に
メイリーフを託されたんだ","At the moment of their death,
I was entrusted with Mayleaf.",ui\00_message\quest\q00000006.gmd,\quest\q00000006.arc,q00000006.arc,4,Joseph
0,,"あの子にもしものことがあったら
申し訳が立たない","If something were to happen to that child,
I would feel extremely sorry.",ui\00_message\quest\q00000006.gmd,\quest\q00000006.arc,q00000006.arc,5,Joseph
0,,ああ――,Ah—,ui\00_message\quest\q00000006.gmd,\quest\q00000006.arc,q00000006.arc,6,Joseph
0,,行き先はおそらく《ミスリウの森》――,"The destination is probably ""Mysree Forest"" -",ui\00_message\quest\q00000006.gmd,\quest\q00000006.arc,q00000006.arc,7,Joseph
0,,"〝森の精〟が呼んでいる――
そう呟いているのを聞いたことがある","The spirit of the forest is calling--
I've heard it muttered.",ui\00_message\quest\q00000006.gmd,\quest\q00000006.arc,q00000006.arc,8,Joseph
0,,"少々変わった子だ
それもあって心配なんだ","She's a bit of a strange one.
That's part of what worries me.",ui\00_message\quest\q00000006.gmd,\quest\q00000006.arc,q00000006.arc,9,Joseph
0,,"頼む――
メイリーフを保護してくれ","Please, I beg you――
Please protect Mayleaf for me.",ui\00_message\quest\q00000006.gmd,\quest\q00000006.arc,q00000006.arc,10,Joseph
0,,"メイリーフは《ミスリウの森》だと思う
頼んだぞ","I think Mayleaf is in Mysree Forest.
I'm counting on you.",ui\00_message\quest\q00000006.gmd,\quest\q00000006.arc,q00000006.arc,11,Joseph
0,,"メイリーフは特別な子です
どうか連れ戻してください","Mayleaf is a special child.
Please bring her back!",ui\00_message\quest\q00000006.gmd,\quest\q00000006.arc,q00000006.arc,12,Mysial
0,,"メイリーフのことになると
ジョゼフ様は人が変わるんだ
冷静じゃいられないというか――","When it comes to Mayleaf,
Master Joseph becomes a different person.
Or rather, he can't stay calm...",ui\00_message\quest\q00000006.gmd,\quest\q00000006.arc,q00000006.arc,13,Klaus
0,,"あら！？
あなたもメイリーフを探してくださるの？
それは心強いです！","Oh!?
Are you also searching for Mayleaf?
That's reassuring!",ui\00_message\quest\q00000006.gmd,\quest\q00000006.arc,q00000006.arc,14,Pamela
0,,"あのね――あきらめようと思ったけど
こんなことになっちゃったから
思い切ってお願いしちゃいますね","You know... I thought about giving up,
but since it turned out like this,
I'll muster up the courage and make a request.",ui\00_message\quest\q00000006.gmd,\quest\q00000006.arc,q00000006.arc,15,Mayleaf
0,,"この森にはわたしの大切な場所があって
どうしてもそこに寄って行きたいんです","There is a precious place for me in this forest,
and I really want to go there no matter what.",ui\00_message\quest\q00000006.gmd,\quest\q00000006.arc,q00000006.arc,16,Mayleaf
0,,洞窟を出て、滝の流れる川の近く――,"After leaving the cave, 
near a river where a waterfall flows...",ui\00_message\quest\q00000006.gmd,\quest\q00000006.arc,q00000006.arc,17,Mayleaf
0,,"ひとりでも行けるけど、きっとダメですよね？
だから覚者さんも来てください――
そこで待っていますから","I can go alone, but I guess it's no good, right?
So please, Ser Arisen, come as well —
I'll be waiting for you there.",ui\00_message\quest\q00000006.gmd,\quest\q00000006.arc,q00000006.arc,18,Mayleaf
0,,"察するに――
メイリーフ嬢は貴殿と話したいようだ","From what I gather...
It seems that Mayleaf wants to speak to you, sir.",ui\00_message\quest\q00000006.gmd,\quest\q00000006.arc,q00000006.arc,19,Gerd
0,,"わたしへの遠慮は無用――
さらに言えば、願ったり叶ったり――だな","Don't hold back on me-- 
in fact, this is exactly what I've been hoping for!",ui\00_message\quest\q00000006.gmd,\quest\q00000006.arc,q00000006.arc,20,Gerd
0,,"わたし、先に行ってます！
外の、滝の近くですよ？","I'm going ahead! 
Near the waterfall outside, right?",ui\00_message\quest\q00000006.gmd,\quest\q00000006.arc,q00000006.arc,21,Mayleaf
0,,"ふむ――
メイリーフ嬢の、我々への信頼に応えて
ここでの見聞は他言無用としようではないか","Hmm...

In order to meet Mayleaf's trust in us,
let's keep what we see and hear here a secret.",ui\00_message\quest\q00000006.gmd,\quest\q00000006.arc,q00000006.arc,22,Gerd
0,,"ジョゼフ様はご立腹だよね
心配かけちゃったからね――","Master Joseph seems to be angry, right?
Because we made him worry...",ui\00_message\quest\q00000006.gmd,\quest\q00000006.arc,q00000006.arc,23,Mayleaf
0,,ああ、キースヒルトのことは内緒にしてね？,"Ah, please keep Kieshildt a secret, okay?",ui\00_message\quest\q00000006.gmd,\quest\q00000006.arc,q00000006.arc,24,Mayleaf
0,,"あの子を連れ帰ったことは
覚者の手柄になるのかね
まあ、どうでもいいが","Is it considered an achievement
for an Arisen to bring back that child?
Well, it doesn't really matter.",ui\00_message\quest\q00000006.gmd,\quest\q00000006.arc,q00000006.arc,25,Gash
0,,"またお世話になりましたね
メイリーフもあなたに心を開いているようです","Thank you again for your help. 
It seems that Mayleaf has also opened up to you.",ui\00_message\quest\q00000006.gmd,\quest\q00000006.arc,q00000006.arc,26,Pamela
0,,"もし良ければこれからも
親しくしてやってくださいね","If it's alright, please continue to
be a friend for her from now on.",ui\00_message\quest\q00000006.gmd,\quest\q00000006.arc,q00000006.arc,27,Pamela
0,,"メイリーフ――
とてもよく似た子をガキの頃に
見たことがあるが――
親戚か何かかもな","Mayleaf... 
I feel like I've seen a girl who looks very 
similar when I was a child... 
Maybe she was a relative or something.",ui\00_message\quest\q00000006.gmd,\quest\q00000006.arc,q00000006.arc,28,Heinz
0,,"今回はお役目を果たすことができたが――
次はどうなることやら","This time, I was able to fulfill my duty, but... 
who knows what will happen next?",ui\00_message\quest\q00000006.gmd,\quest\q00000006.arc,q00000006.arc,29,Logan
0,,"メイリーフが戻ったようですね
ご苦労さまでした","It seems Mayleaf has returned.
Thank you for your hard work.",ui\00_message\quest\q00000006.gmd,\quest\q00000006.arc,q00000006.arc,30,Mysial
0,,"え？　ああ、メイリーフが戻ったんだ
良かった良かった","Huh? Oh, Mayleaf has returned. 
I'm glad, I'm glad.",ui\00_message\quest\q00000006.gmd,\quest\q00000006.arc,q00000006.arc,31,Klaus
0,,"ごめん、報告書のことを考えていて――
最近寝ても覚めてもそればかりで――","I'm sorry, I've been thinking about the report--
Lately, 
it's all I can think about, even when I sleep--",ui\00_message\quest\q00000006.gmd,\quest\q00000006.arc,q00000006.arc,32,Klaus
0,,"ご苦労だった
これでメイリーフの件は一件落着だ","It was hard work.
With this, the matter of Mayleaf is finally resolved.",ui\00_message\quest\q00000006.gmd,\quest\q00000006.arc,q00000006.arc,33,Joseph
0,,"ところで――
何も言わずに聞いて欲しい","By the way,
I want you to listen without saying anything.",ui\00_message\quest\q00000006.gmd,\quest\q00000006.arc,q00000006.arc,34,Joseph
0,,"おまえはあの子に慕われているようだ
だから、メイリーフから、自分の生い立ち
あるいは、来歴めいたことを聞いたかもしれない","It seems that child is fond of you. 
So, you might have heard from Mayleaf about my 
background or some kind of history.",ui\00_message\quest\q00000006.gmd,\quest\q00000006.arc,q00000006.arc,35,Joseph
0,,しかし、何を知っていようと他言しないでくれ,"But whatever you know, don't tell anyone else.",ui\00_message\quest\q00000006.gmd,\quest\q00000006.arc,q00000006.arc,36,Joseph
0,,"誰が知っていて
誰が知らないのか――",Who knows and who doesn't--,ui\00_message\quest\q00000006.gmd,\quest\q00000006.arc,q00000006.arc,37,Joseph
0,,その詮索もしてはならない,You must not pry into such matters.,ui\00_message\quest\q00000006.gmd,\quest\q00000006.arc,q00000006.arc,38,Joseph
0,,"いいな？　それがメイリーフのためだ
わかってくれるな？","Okay?　It's for Mayleaf's sake.
Do you understand?",ui\00_message\quest\q00000006.gmd,\quest\q00000006.arc,q00000006.arc,39,Joseph
0,,"頑張りはいつか報われ
道は自ずと姿を現す
常に前向きにな","Hard work will be rewarded someday.
The path will reveal itself naturally.
Always stay positive.",ui\00_message\quest\q00000006.gmd,\quest\q00000006.arc,q00000006.arc,40,Joseph
0,,"【ヒント：メイリーフの行方調査について】
調査で出向く《ミスリウ森林》エリアへは長旅となる可能性があります
最寄りのショップで装備を見直し、ポーン郷を拠点に向かいましょう","【Hint: Investigating Mayleaf's whereabouts】
There is a possibility that the journey to 
the ""Mysree Forest"" area, 
where the investigation is conducted, 
will be a long one.

Review your equipment at the nearest store 
and head to your base in Pawn Cathedral.",ui\00_message\quest\q00000006.gmd,\quest\q00000006.arc,q00000006.arc,41,Leo
0,,"【ヒント：ミスリウ森林について】
メイリーフが行方不明になったミスリウ森林は
リンウッドの村を拠点にルートが複数あるので有効活用しましょう","【Hint: About the Mysree Forest】
The Mysree Forest, where Mayleaf went missing, 
has multiple routes converging in Lynwood village,
 so let's make good use of them.",ui\00_message\quest\q00000006.gmd,\quest\q00000006.arc,q00000006.arc,42,Leo
0,,イリスを見かけなかったか？,Have you seen Iris?,ui\00_message\quest\q00000007.gmd,\quest\q00000007.arc,q00000007.arc,0,Leo
0,,"アークでの失敗を気にしていたようだが
まったく――らしくない話だ","It seems like they were worried 
about the failure at the Ark, 
but this is completely unlike them.",ui\00_message\quest\q00000007.gmd,\quest\q00000007.arc,q00000007.arc,1,Leo
0,,"もし会ったら、おれのところに顔を出すように
伝えてくれ
おれは何も気にしていないとな","If you meet them, 
please let them know to come visit me. 
I'm not concerned about anything.",ui\00_message\quest\q00000007.gmd,\quest\q00000007.arc,q00000007.arc,2,Leo
0,,イリスはどこにいるのでしょう,Where could Iris be?,ui\00_message\quest\q00000007.gmd,\quest\q00000007.arc,q00000007.arc,3,Mysial
0,,"どのような生き方を選ぶも自由ですが
たまには顔を見せて欲しいですね","You are free to choose any way of life, but 
I would like to see your face every now and then.",ui\00_message\quest\q00000007.gmd,\quest\q00000007.arc,q00000007.arc,4,Mysial
0,,あの笑顔は皆の心を明るくしますからね,That smile brightens everyone's heart.,ui\00_message\quest\q00000007.gmd,\quest\q00000007.arc,q00000007.arc,5,Mysial
0,,"報告書がまだだというのにクラウスめ
ここで何をしている――","Klaus, you still haven't finished the report. 
What are you doing here?",ui\00_message\quest\q00000007.gmd,\quest\q00000007.arc,q00000007.arc,6,Joseph
0,,"君は――キノザの村って
知ってるかな？",Do you know about Kinoza Village?,ui\00_message\quest\q00000007.gmd,\quest\q00000007.arc,q00000007.arc,7,Klaus
0,,"ここから、ずっとずっと
東へ行ったところなんだけど――","From here, if you keep going east...",ui\00_message\quest\q00000007.gmd,\quest\q00000007.arc,q00000007.arc,8,Klaus
0,,"そこに心身ともに癒やしてくれる
温泉があるんだ","There's a hot spring there
that heals both body and soul.",ui\00_message\quest\q00000007.gmd,\quest\q00000007.arc,q00000007.arc,9,Klaus
0,,"イリスはそこにいるんじゃないかと思う
前にさ、落ち込んだりした時はそこへ行くって
言ってたのを覚えてるんだ","I think Iris might be there,
she said before that she would go there when she 
was feeling down.",ui\00_message\quest\q00000007.gmd,\quest\q00000007.arc,q00000007.arc,10,Klaus
0,,"ねえ、迎えに行ってくれないかな？
報告書の完成にはイリスの協力が
必要なんだ","Hey, could you pick her up? 
I need Iris's help to finish the report.",ui\00_message\quest\q00000007.gmd,\quest\q00000007.arc,q00000007.arc,11,Klaus
0,,"いや、本当は、報告書はどうでもよくて
――よくはないけど、関係はなくて
ただ、あの弾けるような笑顔を
また見たいっていうか――","No, actually, the report doesn't really matter -
well, it's not good, but it's unrelated.
I just... want to see that radiant smile again.",ui\00_message\quest\q00000007.gmd,\quest\q00000007.arc,q00000007.arc,12,Klaus
0,,"調査団があんなことになったのは
僕のせいであってイリスは悪くない
そう、伝えたいんだ","The reason the investigation team 
ended up like that is my fault, not Iris's.
Yes, I want to convey that.",ui\00_message\quest\q00000007.gmd,\quest\q00000007.arc,q00000007.arc,13,Klaus
0,,"本当なら僕が行くべきだろうけど
ここを離れるわけにはいかないから――
ねえ、イリスを説得して連れ戻してよ","I should be the one to go, 
but I can't leave here, so...
Hey, convince Iris and bring her back.",ui\00_message\quest\q00000007.gmd,\quest\q00000007.arc,q00000007.arc,14,Klaus
0,,"頼むよ――
キノザの温泉からイリスを連れ戻してほしい
そろそろ復帰すべきだと君も思うだろ？","Please, I beg you――
Bring back Iris from the Kinoza hot springs.
You must also think 
that it's time for her to return, right?",ui\00_message\quest\q00000007.gmd,\quest\q00000007.arc,q00000007.arc,15,Klaus
0,,イリスはキノザ村にいるらしいな,It seems that Iris is in the village of Kinoza.,ui\00_message\quest\q00000007.gmd,\quest\q00000007.arc,q00000007.arc,16,Leo
0,,"キノザと言えば温泉だ
――まったく、のんきな奴だ","Kinoza is a hot spring town.
--How carefree.",ui\00_message\quest\q00000007.gmd,\quest\q00000007.arc,q00000007.arc,17,Leo
0,,"おぉ、覚者さん！　ようこそキノザへ！
どうぞ当鉱泉でごゆるりと――え？
ふむふむ、人探しですと？","Oh, welcome, Ser Arisen! Welcome to Kinoza! 
Feel free to relax at our hot springs... 
Oh? Hmm, you're looking for someone?",ui\00_message\quest\q00000007.gmd,\quest\q00000007.arc,q00000007.arc,18,Roy
0,,"女性の覚者？　よく見りゃ美人――
ああ、イリスさんですな！
確かにいらっしゃってますとも","A female Arisen? 
And you look closely, she's quite beautiful... 
Oh, it's Iris! She's definitely here.",ui\00_message\quest\q00000007.gmd,\quest\q00000007.arc,q00000007.arc,19,Roy
