0,,"これは太古の昔から竜とともに戦ってきた
白衛騎士団を否定するものではないのだが
面白くないと思っている騎士もおり――","This is not to deny the White Guard Knights, 
who have fought alongside dragons since ancient 
times, but some knights find it boring――",ui\00_message\quest\q00000003.gmd,\quest\q00000003.arc,q00000003.arc,15,Joseph
0,,おまけに思い上がった覚者も少なくはない,"Moreover, 
there are also quite a few arrogant Arisen.",ui\00_message\quest\q00000003.gmd,\quest\q00000003.arc,q00000003.arc,16,Joseph
0,,"わたしから見ると実にくだらない反目だが
だからといって鼻で笑うわけにもいかない
厄介な問題――というわけだ","From my perspective, it's a truly trivial rivalry,
but that doesn't mean I can just laugh it off.
It's a troublesome issue—that's the gist of it.",ui\00_message\quest\q00000003.gmd,\quest\q00000003.arc,q00000003.arc,17,Joseph
0,,ふふふ――,Hmmm--,ui\00_message\quest\q00000003.gmd,\quest\q00000003.arc,q00000003.arc,18,Klaus
0,,"大きな仕事を任せてもらえそうなんだ
正式に決まったら話すよ","I feel like I might be entrusted with a big job.
I'll talk about it once it's officially decided.",ui\00_message\quest\q00000003.gmd,\quest\q00000003.arc,q00000003.arc,19,Klaus
0,,ガルドリンのところへ行くんだって？,I heard you're going to Gurdolin's place?,ui\00_message\quest\q00000003.gmd,\quest\q00000003.arc,q00000003.arc,20,Iris
0,,"あのおっさん、言われるほど面倒な人じゃ
ないと思うんだよね
かばう気は全然ないけどさ","I don't think that old man is as 
troublesome as people say. 
I don't have any intent of defending him though.",ui\00_message\quest\q00000003.gmd,\quest\q00000003.arc,q00000003.arc,21,Iris
0,,こんにちは,Greetings.,ui\00_message\quest\q00000003.gmd,\quest\q00000003.arc,q00000003.arc,22,Mayleaf
0,,"あら？　さっき、そこに優しそうな顔の
青年がいませんでしたか？","Oh? Didn't I see a young man with a kind face 
over there just now?",ui\00_message\quest\q00000003.gmd,\quest\q00000003.arc,q00000003.arc,23,Pamela
0,,"優先権を主張するなら
さっさと終わらせてみやがれ","If you're claiming priority,
finish it quickly!",ui\00_message\quest\q00000003.gmd,\quest\q00000003.arc,q00000003.arc,24,Gurdolin
0,,俺たちに任せればすぐに終わりだ,"If you let us handle it, it'll be over soon.",ui\00_message\quest\q00000003.gmd,\quest\q00000003.arc,q00000003.arc,25,Arisen Corps Regimental Soldier
0,,"まずは調査を終えてからだ
それくらいわからんのか！？","First, finish the investigation.
Do you not understand that much!?",ui\00_message\quest\q00000003.gmd,\quest\q00000003.arc,q00000003.arc,26,Heinz
0,,順序、秩序は貴殿らにはないのか！？,Do you not have order or discipline?!,ui\00_message\quest\q00000003.gmd,\quest\q00000003.arc,q00000003.arc,27,White Knight
0,,"時間の無駄だ！
おまえらの相手をしているひまなどない！","What a waste of time! 
I don't have time to deal with you!",ui\00_message\quest\q00000003.gmd,\quest\q00000003.arc,q00000003.arc,28,Travers
0,,覚者はなめられたら終わりだぞ、新入り,"Underestimating the Arisen will be your downfall, 
newcomer.",ui\00_message\quest\q00000003.gmd,\quest\q00000003.arc,q00000003.arc,29,Gurdolin
0,,こっちに任せればすぐに終わるってのによ！,"If you leave it to me, it'll be over soon!",ui\00_message\quest\q00000003.gmd,\quest\q00000003.arc,q00000003.arc,30,Arisen Corps Regimental Soldier
0,,"くそっ――
なに？　詳しい事情が知りたい？","Damn it--
What?　You want to know what's going on?",ui\00_message\quest\q00000003.gmd,\quest\q00000003.arc,q00000003.arc,31,Heinz
0,,"だったらこの村の黒ブドウ亭にいる
アルフレドから聞くんだな","In that case, 
ask Alfred at the Black Grape Inn in this village.",ui\00_message\quest\q00000003.gmd,\quest\q00000003.arc,q00000003.arc,32,Heinz
0,,どうしてあんな奴が覚者なんだ！？,Why is someone like that an Arisen?!,ui\00_message\quest\q00000003.gmd,\quest\q00000003.arc,q00000003.arc,33,White Knight
0,,おまえ、余計なことはするなよ,"You, don't do anything you don't have to.",ui\00_message\quest\q00000003.gmd,\quest\q00000003.arc,q00000003.arc,34,Travers
0,,"貴君はレオの使者だな？
わたしからも状況を説明しておこう","You are Leo's messenger, aren't you?
Let me explain the situation to you.",ui\00_message\quest\q00000003.gmd,\quest\q00000003.arc,q00000003.arc,35,Alfred
0,,"村に魔物が出没するという問題に関連して
村はずれの廃屋から気味の悪い物音が
聞こえるという訴えがあった","Related to the issue 
of monsters appearing in the village,
there have been reports of eerie sounds coming 
from an abandoned house 
on the outskirts of the village.",ui\00_message\quest\q00000003.gmd,\quest\q00000003.arc,q00000003.arc,36,Alfred
0,,"棲みついた魔物がたてる音だろうと
我々は考えている",We think it's the sound of demons.,ui\00_message\quest\q00000003.gmd,\quest\q00000003.arc,q00000003.arc,37,Alfred
0,,"すでにガルドリンには伝えてあるが
あの覚者は動こうとはしない","I have already informed Gurdolin,
but that Arisen has no intention of moving.",ui\00_message\quest\q00000003.gmd,\quest\q00000003.arc,q00000003.arc,38,Alfred
0,,"口汚く騎士たちを侮辱するだけだ
いったい何を考えているのか――","He just insults the knights with his foul mouth.
What in the world does he think he's doing--?",ui\00_message\quest\q00000003.gmd,\quest\q00000003.arc,q00000003.arc,39,Alfred
0,,"ともあれ、レオからの指示があるのだな？
それを尊重して、問題の解決を図ってくれ
差配は貴君に任せよう","Anyway, Leo has given you instructions, right?
Respect them and try to solve the problem.
I'll leave it to you to make the difference.",ui\00_message\quest\q00000003.gmd,\quest\q00000003.arc,q00000003.arc,40,Alfred
0,,"ところで、廃屋へゆく前に村の
《拠点の礎》に触れて解放しておいてくれ
礎を解放しリム転移が使えるようになれば
神殿とテルの往来も楽になるだろう","By the way, before you go to the abandoned house, 
please touch the village's Portcrystal and unlock it. 
Once you unlock the Portcrystal and 
gain the ability to use Rift Teleport, 
it will be easier to travel between the temple and Tel.",ui\00_message\quest\q00000003.gmd,\quest\q00000003.arc,q00000003.arc,41,Alfred
0,,"怪しい物音のする廃屋はハイデル教会の
司祭が、代々使っていた家だ","The abandoned house with strange noises used to 
be the home of the priests of Hidell Church, 
passed down through generations.",ui\00_message\quest\q00000003.gmd,\quest\q00000003.arc,q00000003.arc,42,Alfred
0,,"時代とともに教会の教えは廃れてしまい
やがて司祭も姿を消した","Over time, the Church's teachings fell into disuse
and eventually the priests disappeared.",ui\00_message\quest\q00000003.gmd,\quest\q00000003.arc,q00000003.arc,43,Alfred
0,,"しかも、最後の司祭が村を出るところを見た者が
誰もいなくてな――","Moreover, there was nobody who saw the last 
priest leaving the village...",ui\00_message\quest\q00000003.gmd,\quest\q00000003.arc,q00000003.arc,44,Alfred
0,,"気味の悪さと後ろめたさから
廃屋に近づく者はほとんどいない","Due to the eerie feeling and guilt, 
very few people approach the abandoned house.",ui\00_message\quest\q00000003.gmd,\quest\q00000003.arc,q00000003.arc,45,Alfred
0,,"今は魔物の巣窟となっていても不思議ではないと
わたしは思っている","It is not strange that it has now become 
a den of monsters, I think.",ui\00_message\quest\q00000003.gmd,\quest\q00000003.arc,q00000003.arc,46,Alfred
0,,"《廃屋の地下室》はどっちかって？
それなら村の西、そこにある《エテルナ装具屋》
の裏をまっすぐさ","""Which way to the Abandoned House Cellar?""
If that's the case, 
go straight behind Eterna's Outfitter,
located in the west of the village.",ui\00_message\quest\q00000003.gmd,\quest\q00000003.arc,q00000003.arc,47,Myra
0,,しかし、あんな場所に何の用だい？,But what do you want in a place like that?,ui\00_message\quest\q00000003.gmd,\quest\q00000003.arc,q00000003.arc,48,Myra
0,,"ほう――
魔物は貴君が退治したのか
さすが、レオが見込んだ覚者だ","Oh—
So you're the one who vanquished the monsters.
As expected, 
you're the Arisen Leo placed his trust in.",ui\00_message\quest\q00000003.gmd,\quest\q00000003.arc,q00000003.arc,49,Alfred
0,,"あらためて自己紹介させてくれ
職はハイデル平原のエリアマスター
名はアルフレドだ","Let me introduce myself again. 
My occupation is as an 
Area Master of Hidell Plains. 
My name is Alfred.",ui\00_message\quest\q00000003.gmd,\quest\q00000003.arc,q00000003.arc,50,Alfred
0,,"長い付き合いになるだろう
よろしく頼む","It will be a long-term relationship.
I'm counting on you.",ui\00_message\quest\q00000003.gmd,\quest\q00000003.arc,q00000003.arc,51,Alfred
0,,"世話になったな
ガルドリンを連れて、神殿へ戻るがいい
後のことはわたしに任せてくれ","I am grateful for your help.
Take Gurdolin and return to the temple.
Leave the rest to me.",ui\00_message\quest\q00000003.gmd,\quest\q00000003.arc,q00000003.arc,52,Alfred
0,,おい、テル村の連中の話を聞いたか？,"Hey, have you heard about the 
folks from Tel Village?",ui\00_message\quest\q00000003.gmd,\quest\q00000003.arc,q00000003.arc,53,Heinz
0,,"あいつら、賭けをしていやがったんだ
魔物を倒すのは覚者か騎士団か――でな","They made a bet that the one who would defeat the 
demon would be the Arisen or 
the Knights of the Order.",ui\00_message\quest\q00000003.gmd,\quest\q00000003.arc,q00000003.arc,54,Heinz
0,,"騎士団に賭けていたのはたったひとり
――村の若い女だ","There was only one person who 
bet on the knight order
- a young woman from the village.",ui\00_message\quest\q00000003.gmd,\quest\q00000003.arc,q00000003.arc,55,Heinz
0,,"魔物を倒したのは公式には騎士団
つまり、その女が金を全部受け取った","The one who defeated the enemy was 
officially the Knight Order.
In other words, the woman received all the money.",ui\00_message\quest\q00000003.gmd,\quest\q00000003.arc,q00000003.arc,56,Heinz
0,,"おれの想像だがガルドリンは女から
金をむしり取ったに違いない
となれば、まったく、悪党だよ、あいつは","My guess is that Gurdolin has been extorting 
money from women.
 If that's the case, he's a real scoundrel.",ui\00_message\quest\q00000003.gmd,\quest\q00000003.arc,q00000003.arc,57,Heinz
0,,"もっとも、この話は騎士団にとっても
恥ずべきことだから誰にも言えない
せめて、おまえに話すことで
うさを晴らさせてもらうぞ","However, this story is a disgrace
even for the Knights, so I can't tell anyone.
But at least I will confide in you
to relieve my burden.",ui\00_message\quest\q00000003.gmd,\quest\q00000003.arc,q00000003.arc,58,Heinz
0,,"手柄をそんなことに利用されて
腹を立てているんだろう？","Are you upset that your accomplishments are being 
used for such a thing?",ui\00_message\quest\q00000003.gmd,\quest\q00000003.arc,q00000003.arc,59,Heinz
0,,おかえりなさい,Welcome back.,ui\00_message\quest\q00000003.gmd,\quest\q00000003.arc,q00000003.arc,60,Mysial
0,,"ガルドリンと一緒だったらしいね
ぼくはあの人が苦手でね――わかるだろ？","I heard you were with Gurdolin.
I'm not very good with him - you know what I mean?",ui\00_message\quest\q00000003.gmd,\quest\q00000003.arc,q00000003.arc,61,Klaus
0,,ある日突然出現した巨大建造物――,"One day, a gigantic structure suddenly appeared -",ui\00_message\quest\q00000003.gmd,\quest\q00000003.arc,q00000003.arc,62,Joseph
0,,"まだ正体は不明だが、あれを大石塊（アーク）と
呼ぶことにした、おまえも、覚えておくといい","Although its true nature is still unknown, 
we have decided to call it the ""The Ark"". 
It would be wise for you to remember that as well.",ui\00_message\quest\q00000003.gmd,\quest\q00000003.arc,q00000003.arc,63,Joseph
0,,ガルドリン、どうだった？,How was Gurdolin?,ui\00_message\quest\q00000003.gmd,\quest\q00000003.arc,q00000003.arc,64,Iris
0,,"ちょーっと押しが強いけれど
戦場じゃその方が頼りになるんだよね
仲良くしとくといいよ","They might be a bit pushy,
but on the battlefield, they're reliable.
It's better to get along with them.",ui\00_message\quest\q00000003.gmd,\quest\q00000003.arc,q00000003.arc,65,Iris
0,,はぁ――たいくつたいくつ,"Sigh—boring, so boring.",ui\00_message\quest\q00000003.gmd,\quest\q00000003.arc,q00000003.arc,66,Mayleaf
0,,"嫌な予感がします――
メイリーフがたいくつすると
事件が起こるんです――","I have a bad premonition...
When Mayleaf gets bored,
an incident will occur...",ui\00_message\quest\q00000003.gmd,\quest\q00000003.arc,q00000003.arc,67,Pamela
0,,"おお、戻ったか
ご苦労だったな","Oh, you're back.
Thanks for your help.",ui\00_message\quest\q00000003.gmd,\quest\q00000003.arc,q00000003.arc,68,Leo
0,,"テル村での事の次第は
ガルドリンから報告を受けたところだ","I just got a report from
Gurdolin on what happened in Tel Village.",ui\00_message\quest\q00000003.gmd,\quest\q00000003.arc,q00000003.arc,69,Leo
0,,"魔物を倒したのに騎士団の顔を立てようと
手柄を譲った――","Even though you defeated the monster, 
you let the knights take credit to save face.",ui\00_message\quest\q00000003.gmd,\quest\q00000003.arc,q00000003.arc,70,Leo
0,,"まあ、わからないでもない
命令とは全然違うことをしたわけだからな","Well, I can see why you feel that way. 
After all, you did something completely different 
from what you were ordered to do.",ui\00_message\quest\q00000003.gmd,\quest\q00000003.arc,q00000003.arc,71,Leo
0,,"いや、もう何も言うな
この件は忘れよう
悪いことをしたわけじゃない","No, please don't say anything anymore. 
Let's forget about this matter. 
You didn't do anything wrong.",ui\00_message\quest\q00000003.gmd,\quest\q00000003.arc,q00000003.arc,72,Leo
0,,"さて――おまえの留守中、考えていたのだが
覚者としてもうひと皮むけるために
ポーンとの契約に挑んでみないか？","Now, while you were away, I was thinking
that in order to further evolve as an Arisen,
why don't you try entering into a 
contract with a Pawn?",ui\00_message\quest\q00000003.gmd,\quest\q00000003.arc,q00000003.arc,73,Leo
0,,"彼らは主人となる覚者に絶対の忠誠を誓う
怖れ知らずの戦人（いくさびと）だ","They pledge absolute loyalty to the Arisen 
who becomes their master.
They are fearless warriors.",ui\00_message\quest\q00000003.gmd,\quest\q00000003.arc,q00000003.arc,74,Leo
0,,"加えて、彼らの物作りの能力は
鋭い剣、強固な鎧――
おまえに様々な装具をもたらすだろう","In addition, their craftsmanship abilities will
bring you sharp swords, solid armor--
a variety of accoutrements!",ui\00_message\quest\q00000003.gmd,\quest\q00000003.arc,q00000003.arc,75,Leo
0,,もちろん、そう簡単に親しくなれるわけじゃない,"Of course, it's not easy to become close friends.",ui\00_message\quest\q00000003.gmd,\quest\q00000003.arc,q00000003.arc,76,Leo
0,,"契約の手順など具体的なことは
イリスに聞いてくれ","As for specific details such as the procedure for 
the contract, please ask Iris.",ui\00_message\quest\q00000003.gmd,\quest\q00000003.arc,q00000003.arc,77,Leo
0,,"ああ――
この謁見の間を出た大階段の下の広場で
ファビオやキャメロンが、お前を待っていたぞ","Ah――
In the plaza beneath the grand staircase, 
after leaving the Audience Chamber,
Fabio and Cameron were waiting for you.",ui\00_message\quest\q00000003.gmd,\quest\q00000003.arc,q00000003.arc,78,Leo
0,,"奴らの用事が済んだら
また俺のところに顔を出してくれ","Once your business is done,
please come and visit me again.",ui\00_message\quest\q00000003.gmd,\quest\q00000003.arc,q00000003.arc,79,Leo
0,,【ヒント：遠方への冒険準備】,【Hint: Preparation for Distant Adventures】,ui\00_message\quest\q00000004.gmd,\quest\q00000004.arc,q00000004.arc,0,Leo
0,,"遠方へ向かう前は、保管ボックスや商店で
装備を整えましょう
※保管ボックスの《報酬受け取り》から
　LV.5用武器を入手し、装備しましょう","Before heading off into the distance, let's 
prepare equipment at the Storage Box and shops.
※Obtain a LV.5 weapon from the ""Rewards Received"" 
in the Storage Box and equip it.",ui\00_message\quest\q00000004.gmd,\quest\q00000004.arc,q00000004.arc,1,Leo
0,,"テル村へはリム転移を使えばすぐに行けるよ
そこでエリアマスターのアルフレドと会う","You can quickly go to Tel Village 
using Rift Teleport.
There, you will meet the Area Master, Alfred.",ui\00_message\quest\q00000004.gmd,\quest\q00000004.arc,q00000004.arc,2,Iris
0,,"そして《ポーン郷》へ行く
まずは、そこからだね","And then you'll go to the《Pawn Cathedral.》
That's a good place to start.",ui\00_message\quest\q00000004.gmd,\quest\q00000004.arc,q00000004.arc,3,Iris
0,,"あなたはどんなポーンと出会うのでしょうね
わたしも楽しみです","What kind of Pawns will you encounter, I wonder? 
I'm looking forward to it as well.",ui\00_message\quest\q00000004.gmd,\quest\q00000004.arc,q00000004.arc,4,Mysial
0,,"ほう、ポーンと契約する気になったのか
ふむ、それでこそ覚者だ","Oh, so you've decided 
to make a contract with the Pawns. 
Well, that's what it truly means to be an Arisen.",ui\00_message\quest\q00000004.gmd,\quest\q00000004.arc,q00000004.arc,5,Joseph
0,,"ふふふ――
どうやら本決まりになりそうなんだ
例の話――","Hehehe—
Looks like it's going to be official.
That thing we talked about—",ui\00_message\quest\q00000004.gmd,\quest\q00000004.arc,q00000004.arc,6,Klaus
0,,ああ、話したい！　しゃべってしまいたい！,"Oh, I want to talk! I want to speak!",ui\00_message\quest\q00000004.gmd,\quest\q00000004.arc,q00000004.arc,7,Klaus
0,,この先は行き止まりだ,It's a dead end.,ui\00_message\quest\q00000004.gmd,\quest\q00000004.arc,q00000004.arc,8,Donnell
0,,"前の大水で橋が流されてな
復旧の目処はまったく立っていない
――どこへ行くつもりなんだ？","The bridge was washed away in the previous flood,
and there is no prospect of restoration at all.
Where do you intend to go?",ui\00_message\quest\q00000004.gmd,\quest\q00000004.arc,q00000004.arc,9,Donnell
0,,"なるほど、《ポーン郷》か
ならば一度、引き返すことをすすめるよ","I see... Pawn Cathedral.
Then I suggest you turn around and go back.",ui\00_message\quest\q00000004.gmd,\quest\q00000004.arc,q00000004.arc,10,Donnell
0,,"テル村へ行ってアルフレドに相談するといい
確か、村から森の方へ抜けられる道が
あったはずだ","It would be a good idea to go to Tel Village and 
consult with Alfred. 
I remember there was a path that leads 
from the village to the forest.",ui\00_message\quest\q00000004.gmd,\quest\q00000004.arc,q00000004.arc,11,Donnell
0,,橋はいつ直るのかって？,When will the bridge be repaired?,ui\00_message\quest\q00000004.gmd,\quest\q00000004.arc,q00000004.arc,12,Donnell
0,,"さあな――ミスリウの森の材木があれば
良いのだろうが――
ここまで木を運ぶのはかなり大変だ","I don't know--
Well, I suppose it would be good to have lumber 
from the Mysree Forest. 
But it's quite difficult to 
transport it all the way here.",ui\00_message\quest\q00000004.gmd,\quest\q00000004.arc,q00000004.arc,13,Donnell
0,,"《ポーン郷》方面はしばらくのあいだ
テル村経由で行くしかないだろうな","The area around the Pawn Cathedral will probably 
have to be reached through Tel Village for a while.",ui\00_message\quest\q00000004.gmd,\quest\q00000004.arc,q00000004.arc,14,Donnell
0,,"おお、貴君は――
いつぞやはご苦労だったな","Oh, you--
I'm sorry to hear about your 
troubles the other day.",ui\00_message\quest\q00000004.gmd,\quest\q00000004.arc,q00000004.arc,15,Alfred
0,,"あらためて挨拶をさせてもらおう
わたしはハイデル平原のエリアマスター
覚者のアルフレドだ","Let me greet you again.
I am the Area Master of the Hidell Plains,
Alfredo the Arisen.",ui\00_message\quest\q00000004.gmd,\quest\q00000004.arc,q00000004.arc,16,Alfred
0,,"知っていると思うがエリアマスターとは
担当地区を取り仕切る監督官のことだ","I think you already know, but an Area Master is 
the supervisor who oversees a designated area.",ui\00_message\quest\q00000004.gmd,\quest\q00000004.arc,q00000004.arc,17,Alfred
0,,"さて――
我々エリアマスターは、エリアを訪れる覚者に対し
情報の提供や、アイテムの支給を行っている","Now then―― 
As Area Masters, we provide information and 
supply items to the Arisen who visit our areas.",ui\00_message\quest\q00000004.gmd,\quest\q00000004.arc,q00000004.arc,18,Alfred
0,,"また、エリアの名声度
――つまり、《エリアランク》が高い者に対しては
封鎖された場所への立入許可を
与えることもできるのだ","Furthermore, for individuals with high area fame,
in other words, a high ""Area Rank"",
access permits to sealed areas 
can also be granted.",ui\00_message\quest\q00000004.gmd,\quest\q00000004.arc,q00000004.arc,19,Alfred
0,,"貴君は今、《ポーン郷》へ行きたいのだろう？
ならば、丁度良い","Do you want to go to Pawn Cathedral now?
In that case, it's just perfect.",ui\00_message\quest\q00000004.gmd,\quest\q00000004.arc,q00000004.arc,20,Alfred
0,,"以前レオの使者として貴君がここに来た時の
活躍は十分評価に値する","The achievements you made when you came here 
before as an envoy of Leo are highly commendable.",ui\00_message\quest\q00000004.gmd,\quest\q00000004.arc,q00000004.arc,21,Alfred
0,,"その礼として、封鎖エリアの一つを
開放しようではないか","As a token of gratitude, how about we
open up one of the sealed areas?",ui\00_message\quest\q00000004.gmd,\quest\q00000004.arc,q00000004.arc,22,Alfred
0,,"《ポーン郷》へと続く《狩人の抜け穴》を
貴君が通れるようにしておこう
やや危険だが、貴君なら問題ないだろう","I will ensure that you can pass through the 
Hunters' Secret Passage 
that leads to the Pawn Cathedral. 

It may be somewhat dangerous, 
but I'm sure you will be able to handle it.",ui\00_message\quest\q00000004.gmd,\quest\q00000004.arc,q00000004.arc,23,Alfred
0,,"では、わたしに話しかけ直して
《エリア情報》を選び
エリアランクとその内容を確認してくれ","Then, please speak to me again and choose 
""Area Information."" 
Confirm the Area Rank and its contents for me.",ui\00_message\quest\q00000004.gmd,\quest\q00000004.arc,q00000004.arc,24,Alfred
0,,"さあ――、わたしに話しかけ直して
《エリア情報》を選び
エリアランクとその内容を確認してくれ","Come on-- please speak to me again and choose 
""Area Information."" 
Confirm the Area Rank and its contents for me.",ui\00_message\quest\q00000004.gmd,\quest\q00000004.arc,q00000004.arc,25,Alfred
0,,"これで《狩人の抜け穴》は開放された
魔物が多いから気をつけてくれ","With this, 
the Hunters' Secret Passage has been opened.
Be careful, as there are many enemies.",ui\00_message\quest\q00000004.gmd,\quest\q00000004.arc,q00000004.arc,26,Alfred
0,,"《狩人の抜け穴》に出る魔物やアイテムの
情報は、《エリア情報》の《スポット情報》
で確認していくといいだろう","It is recommended to check the information on the 
monsters and items that appear in 
Hunters' Secret Passage in the ""Area Information"" 
and ""Spot Information.""",ui\00_message\quest\q00000004.gmd,\quest\q00000004.arc,q00000004.arc,27,Alfred
0,,"それから――
エリアポイントを貯めたら、また足を運んでくれ
話しかけてくれれば、ポイントを精査して
相応しい恩賞を与えよう","And then――
When you accumulate area points, 
please come back again.

If you talk to me, 
I will carefully examine the points
and give you a suitable reward.",ui\00_message\quest\q00000004.gmd,\quest\q00000004.arc,q00000004.arc,28,Alfred
0,,"ああ――
恩賞はエリアの開放だけではない
ポイントの多寡によって様々な恩賞を考えている
励みになるだろう？","Ah-...
The reward is not only the opening of the area.
I am considering various rewards based on the 
number of points.
It will be encouraging, won't it?",ui\00_message\quest\q00000004.gmd,\quest\q00000004.arc,q00000004.arc,29,Alfred
0,,狩人の抜け穴は開放してもらえた？,Was the Hunter's Secret Passage opened up for use?,ui\00_message\quest\q00000004.gmd,\quest\q00000004.arc,q00000004.arc,30,Iris
0,,だったらポーン郷へ行っちゃおう！,"In that case, let's go to Pawn Cathedral!",ui\00_message\quest\q00000004.gmd,\quest\q00000004.arc,q00000004.arc,31,Iris
