0,,"あの方なら、ほら、正面の奥――
《豊穣の泉》にいらっしゃいますよ
そういえば少し思いつめた顔を
していたような――","If it's her, look straight ahead—
they're at the ""Spring of Abundance.""
Come to think of it, she seemed a bit
troubled earlier.",ui\00_message\quest\q00000007.gmd,\quest\q00000007.arc,q00000007.arc,20,Roy
0,,"普段はカウンターで入浴鍵を
購入頂くんですが
今回は特別に入浴をサービスしましょう
浴場へ探しに行ってあげて下さいな","Normally, 
you would purchase a bath key at the counter.
But this time, let's make an exception and 
provide the bath as a service.
Please go to the bathing area and look for her.",ui\00_message\quest\q00000007.gmd,\quest\q00000007.arc,q00000007.arc,21,Roy
0,,"イリスさんは見つかりましたんで？
《豊穣の泉》は正面の奥です
探しに行ってあげて下さいな","Did you find Iris, ser?
The Spring of Abundance is straight ahead.
Please go and search for her.",ui\00_message\quest\q00000007.gmd,\quest\q00000007.arc,q00000007.arc,22,Roy
0,,"しかし、今日は覚者さんが
たくさんお見えですなぁ！","However, there are many Arisen
here today, aren't there!",ui\00_message\quest\q00000007.gmd,\quest\q00000007.arc,q00000007.arc,23,Roy
0,,俺はもう少しゆっくりしていくよ,I will take it a bit slower from now on.,ui\00_message\quest\q00000007.gmd,\quest\q00000007.arc,q00000007.arc,24,Fabio
0,,"イリスさんと会えましたか！
探し人が見つかって何よりですな","Did you meet Iris? 
It's really great that you found 
the person you were looking for.",ui\00_message\quest\q00000007.gmd,\quest\q00000007.arc,q00000007.arc,25,Roy
0,,"ところで、いいお湯だったでしょう？
ボルドの諸問題の方も
ぜひお力添えお願いしますよ！
今後ともごひいきに！","By the way, 
the hot springs were nice, weren't they? 

We'd love to have your help with 
the various issues in Bordo. 

We kindly ask for your continued favor 
in the future!",ui\00_message\quest\q00000007.gmd,\quest\q00000007.arc,q00000007.arc,26,Roy
0,,"イリスが戻ったらしいな
――ふやけていなければいいが","It seems like Iris has returned.
I hope she's not all soaked.",ui\00_message\quest\q00000007.gmd,\quest\q00000007.arc,q00000007.arc,27,Leo
0,,イリスはどうしたんだ？,What happened to Iris?,ui\00_message\quest\q00000007.gmd,\quest\q00000007.arc,q00000007.arc,28,Joseph
0,,"深刻な顔をしているから声をかけたら
取り繕うように笑った
何か危うい感じがしたが――","Because she had a serious expression on her face,
I approached and she forced a smile.
I felt a sense of unease, as if something was off...",ui\00_message\quest\q00000007.gmd,\quest\q00000007.arc,q00000007.arc,29,Joseph
0,,"イリスを見かけたので話そうとしたら――
目を合わせてくれませんでした――","I saw Iris and tried to talk to her--
and she wouldn't make eye contact with me-- 
I was so worried.",ui\00_message\quest\q00000007.gmd,\quest\q00000007.arc,q00000007.arc,30,Mysial
0,,初めてのことで――とても寂しいです,"It's very lonely to experience something for 
the first time.",ui\00_message\quest\q00000007.gmd,\quest\q00000007.arc,q00000007.arc,31,Mysial
0,,イリスを連れ戻してくれたって！？,You brought Iris back for me!?,ui\00_message\quest\q00000007.gmd,\quest\q00000007.arc,q00000007.arc,32,Klaus
0,,準備できたら声を掛けてくれ,Give me a shout when you're ready.,ui\00_message\quest\q00000007.gmd,\quest\q00000007.arc,q00000007.arc,33,Leo
0,,"一緒にやりたいこと、相談したいこと――
頼みたいことが山ほどある","There are so many things I want to do with you, 
things I want to talk to you about-- 
so much I want to ask you for help with.",ui\00_message\quest\q00000007.gmd,\quest\q00000007.arc,q00000007.arc,34,Leo
0,,"【ヒント：キノザ鉱泉について】
キノザ鉱泉は様々な人が集まる拠点です
新たな拠点としてマイ拠点に登録したり、ラウル武具工房などで装備を整えましょう","【Hint: About Kinoza Mineral Springs】
Kinoza Mineral Springs is a gathering place for 
people from various walks of life.

Register it as your favorite location and equip 
yourself at Raul's Arms and Armor Workshop, 
among other things.",ui\00_message\quest\q00000007.gmd,\quest\q00000007.arc,q00000007.arc,35,Iris
0,,"こんにちは、覚者さん
あの――ええと――","Hello, Ser Arisen.
Um... well...",ui\00_message\quest\q00000008.gmd,\quest\q00000008.arc,q00000008.arc,0,Mayleaf
0,,"ここじゃジョゼフおじさまの
目が光っていて――","Here, Joseph's eyes are shining...",ui\00_message\quest\q00000008.gmd,\quest\q00000008.arc,q00000008.arc,1,Mayleaf
0,,"《テラス》に来てください！
お願いします！","Please come to the Terrace! 
If you would be so kind!",ui\00_message\quest\q00000008.gmd,\quest\q00000008.arc,q00000008.arc,2,Mayleaf
0,,"《テラス》でお話ししたいんです
お願いします！",I'd like to talk to you on 《Terrace》please!,ui\00_message\quest\q00000008.gmd,\quest\q00000008.arc,q00000008.arc,3,Mayleaf
0,,"メイリーフがすっかりなついたようだな
まあ、よろしく頼む","Mayleaf seems to have taken a liking, huh.
Well, I'm counting on you.",ui\00_message\quest\q00000008.gmd,\quest\q00000008.arc,q00000008.arc,4,Joseph
0,,"すっかりレオさんの片腕だね
いろんな情報が入ると思うけど――
僕にも流してくれるとうれしいよ","You've become Ser Leo's right hand, huh?
I think a lot of information will come in, but...
I'd be happy if you could share it with me too.",ui\00_message\quest\q00000008.gmd,\quest\q00000008.arc,q00000008.arc,5,Klaus
0,,"白竜様の眠りは今日もお深く――
竜力の回復、さぞ進むことでしょう","Lord White Dragon's slumber is once again 
deep today - 
Surely the recovery of Dragon Force progresses.",ui\00_message\quest\q00000008.gmd,\quest\q00000008.arc,q00000008.arc,6,Mysial
0,,"ええと――
わたし、また森へ行きたくて――",Um... I want to go back to the forest again...,ui\00_message\quest\q00000008.gmd,\quest\q00000008.arc,q00000008.arc,7,Mayleaf
0,,"ミスリウの森の奥深くに
大切な場所があるの","Deep within the forest of Mysree,
there is a precious place.",ui\00_message\quest\q00000008.gmd,\quest\q00000008.arc,q00000008.arc,8,Mayleaf
0,,"でも、ちょっと怖いから
見張りをお願いしたくて――","But, because I'm a little scared,
I want to ask for someone to stand guard...",ui\00_message\quest\q00000008.gmd,\quest\q00000008.arc,q00000008.arc,9,Mayleaf
0,,"ううん、送ってくれなくてもいいの
きっとわたしの方が早く着くから
ミスリウの森の奥の、お墓で待ってるね","No, you don't have to escort me.
I'm sure I'll get there faster on my own.
I'll wait at the tomb deep in the Mysree Forest.",ui\00_message\quest\q00000008.gmd,\quest\q00000008.arc,q00000008.arc,10,Mayleaf
0,,"メイリーフがソワソワしているんです
また何か企んでいるのかも――","Mayleaf seems restless.
Perhaps she is plotting something again...",ui\00_message\quest\q00000008.gmd,\quest\q00000008.arc,q00000008.arc,11,Pamela
0,,"メイリーフ！？
メイリーフをお見かけしませんでしたか？","Mayleaf!?
Have you seen Mayleaf around?",ui\00_message\quest\q00000008.gmd,\quest\q00000008.arc,q00000008.arc,12,Pamela
0,,"あのね――
お友達に贈る、お花が欲しいんだ
覚者さん、探してくれる？","You know...
I want a flower to give to my friend.
Will you help me find one, Ser Arisen?",ui\00_message\quest\q00000008.gmd,\quest\q00000008.arc,q00000008.arc,13,Mayleaf
0,,"わたしったら、お花を忘れてくるなんて――
覚者さん、どこに咲いてるかな？","Oh, I forgot to bring the flowers... 
Do you know where they're blooming, Ser Arisen?",ui\00_message\quest\q00000008.gmd,\quest\q00000008.arc,q00000008.arc,14,Mayleaf
0,,"わあ、ありがとう！
あなたにお願いして良かった！","Wow, thank you!
I'm glad I asked you!",ui\00_message\quest\q00000008.gmd,\quest\q00000008.arc,q00000008.arc,15,Mayleaf
0,,ジョゼフおじさまにバレてないよね？,"Uncle Joseph doesn't know, does he?",ui\00_message\quest\q00000008.gmd,\quest\q00000008.arc,q00000008.arc,16,Mayleaf
0,,"もう、メイリーフったら――
姿が見えないと、叱られるのはわたしなのに――","Oh, Mayleaf! 
If she's not around, 
I'm the one who gets in trouble.",ui\00_message\quest\q00000008.gmd,\quest\q00000008.arc,q00000008.arc,17,Pamela
0,,"メイリーフがいなくなったとパメラが――
ああ、戻ったのですね？　安心しました","Mayleaf is gone and Pamela... 
Ah, you've returned? I'm relieved.",ui\00_message\quest\q00000008.gmd,\quest\q00000008.arc,q00000008.arc,18,Mysial
0,,"メイリーフはどこかに閉じ込めた方が
いいんじゃないかな
あ、冗談だよ、冗談！","I think Mayleaf should be locked up somewhere...

Oh, I'm kidding, I'm kidding!",ui\00_message\quest\q00000008.gmd,\quest\q00000008.arc,q00000008.arc,19,Klaus
0,,メイリーフが世話になったな,Mayleaf took care of you.,ui\00_message\quest\q00000008.gmd,\quest\q00000008.arc,q00000008.arc,20,Joseph
0,,"おそらくすでに
知っているだろうが――","You probably already know this, but...",ui\00_message\quest\q00000008.gmd,\quest\q00000008.arc,q00000008.arc,21,Joseph
0,,"あの子の正体は
他言しないでくれ","The true identity of that child.
Please don't speak about it to others.",ui\00_message\quest\q00000008.gmd,\quest\q00000008.arc,q00000008.arc,22,Joseph
0,,"誰が知っていて
誰が知らないのか――",Who knows and who doesn't--,ui\00_message\quest\q00000008.gmd,\quest\q00000008.arc,q00000008.arc,23,Joseph
0,,その詮索もしてはならない,You must not pry into such matters.,ui\00_message\quest\q00000008.gmd,\quest\q00000008.arc,q00000008.arc,24,Joseph
0,,"いいな
メイリーフのためだ","Good. 
It's for Mayleaf.",ui\00_message\quest\q00000008.gmd,\quest\q00000008.arc,q00000008.arc,25,Joseph
0,,頼んだぞ,I'm asking you.,ui\00_message\quest\q00000008.gmd,\quest\q00000008.arc,q00000008.arc,26,Joseph
0,,"おまえはもちろん最前線を楽しんでくれ
準備でき次第グリッテン砦へ急げ","Of course, enjoy the front lines.
Hurry to Fort Gritten as soon as you're ready.",ui\00_message\quest\q00000009.gmd,\quest\q00000009.arc,q00000009.arc,0,Leo
0,,"どうやらグリッテン砦とは縁が深いようだな
存分に戦ってくれ","Looks like you've got a strong 
connection to Fort Gritten.
Fight as hard as you can.",ui\00_message\quest\q00000009.gmd,\quest\q00000009.arc,q00000009.arc,1,Vanessa
0,,"ヴァネッサ殿の公平さは
すべての覚者が見習ってほしいものだ――","Vanessa's fairness is something that all 
Arisen should emulate.",ui\00_message\quest\q00000009.gmd,\quest\q00000009.arc,q00000009.arc,2,Gerd
0,,"ご武運をお祈りします
皆さん、ご無事で帰ってくださいね","I pray for your fortunes of war. 
Everyone, please return safely.",ui\00_message\quest\q00000009.gmd,\quest\q00000009.arc,q00000009.arc,3,Mysial
0,,"留守は居残り部隊にまかせて
心おきなく戦ってくるんだな","Leave it to the remaining troops to hold the fort,
and fight without worry.",ui\00_message\quest\q00000009.gmd,\quest\q00000009.arc,q00000009.arc,4,Joseph
0,,一匹でも多く敵をぶっ倒して――,-Defeat as many enemies as possible--,ui\00_message\quest\q00000009.gmd,\quest\q00000009.arc,q00000009.arc,5,Klaus
0,,"と言いたいところだけど
無事に帰ってくることが一番大事だからね
とにかく、気をつけて！","I want to say it, but the most important thing 
is to come back safely.
Anyway, take care!",ui\00_message\quest\q00000009.gmd,\quest\q00000009.arc,q00000009.arc,6,Klaus
0,,遠征か――腕が鳴るな,"An expedition, huh—my skills are itching for action.",ui\00_message\quest\q00000009.gmd,\quest\q00000009.arc,q00000009.arc,7,Heinz
0,,オークども！　かかってこい！,Orcs!　Come and get it!,ui\00_message\quest\q00000009.gmd,\quest\q00000009.arc,q00000009.arc,8,Vanessa
0,,来い！　こっちだ！,Come on!　This way!,ui\00_message\quest\q00000009.gmd,\quest\q00000009.arc,q00000009.arc,9,Vanessa
0,,どうした！　怖じ気づいたか！,"What's wrong! 
Are you scared!",ui\00_message\quest\q00000009.gmd,\quest\q00000009.arc,q00000009.arc,10,Vanessa
0,,おりゃあああああ！,Oryaaaaaah!,ui\00_message\quest\q00000009.gmd,\quest\q00000009.arc,q00000009.arc,11,Dikka
0,,覚者はどんどん行ってくれ！,"Keep going, Arisen!",ui\00_message\quest\q00000009.gmd,\quest\q00000009.arc,q00000009.arc,12,Dikka
0,,オーク、くせええ！,Stinking Orcs!,ui\00_message\quest\q00000009.gmd,\quest\q00000009.arc,q00000009.arc,13,Scherzo
0,,さっさと倒さないと臭いが染みつくぞ！,"Need to defeat it quickly, or the smell will seep in!",ui\00_message\quest\q00000009.gmd,\quest\q00000009.arc,q00000009.arc,14,Scherzo
0,,ここはいいから！,Leave this to me!,ui\00_message\quest\q00000009.gmd,\quest\q00000009.arc,q00000009.arc,15,Heston
0,,最前線はもっと先だ！,The front line is further ahead!,ui\00_message\quest\q00000009.gmd,\quest\q00000009.arc,q00000009.arc,16,Heston
0,,ヴァネッサさん、見ててください！,"Vanessa, witness me!",ui\00_message\quest\q00000009.gmd,\quest\q00000009.arc,q00000009.arc,17,Arisen Corps Regimental Soldier
0,,ヴァネッサさん！　おれ、ここですよ！,Vanessa! I'm here!,ui\00_message\quest\q00000009.gmd,\quest\q00000009.arc,q00000009.arc,18,Arisen Corps Regimental Soldier
0,,統率のお気に入りめ――調子のるなよ！,"The commander's favorite, huh—
don't get too cocky!",ui\00_message\quest\q00000009.gmd,\quest\q00000009.arc,q00000009.arc,19,Arisen Corps Regimental Soldier
0,,おまえになんか負けるか！,I'm not going to let you beat me!,ui\00_message\quest\q00000009.gmd,\quest\q00000009.arc,q00000009.arc,20,Arisen Corps Regimental Soldier
0,,"ここはもう大丈夫だ
救援に感謝する
引き続き、白竜を頼んだぞ","We're good to go here.
Thanks for the rescue.
Keep up the good work, for the White Dragon!",ui\00_message\quest\q00000009.gmd,\quest\q00000009.arc,q00000009.arc,21,Vanessa
0,,"ふう――結構厳しかったよ――
ありがとう","Whew--that was pretty tough--
Thanks!",ui\00_message\quest\q00000009.gmd,\quest\q00000009.arc,q00000009.arc,22,Dikka
0,,"さーて、激戦の後は恒例の大掃除だ
オーク臭を洗い流さないとな！","Well, after the fierce battle, 
it's time for the usual big cleanup.
Got to wash away that Orc smell!",ui\00_message\quest\q00000009.gmd,\quest\q00000009.arc,q00000009.arc,23,Scherzo
0,,"さすが覚者さんだ
あんた、大活躍だったな！","As expected, it's the Arisen. 
You really made a great contribution!",ui\00_message\quest\q00000009.gmd,\quest\q00000009.arc,q00000009.arc,24,Heston
0,,ヴァネッサさん、見ていてくれたかなぁ――,"Vanessa, I hope you've been watching--",ui\00_message\quest\q00000009.gmd,\quest\q00000009.arc,q00000009.arc,25,Arisen Corps Regimental Soldier
0,,"くぅ――やっぱり、おまえは強いな
目標にさせてもらうよ","Damn--I knew you were strong.
I'll have to aim for you.",ui\00_message\quest\q00000009.gmd,\quest\q00000009.arc,q00000009.arc,26,Arisen Corps Regimental Soldier
0,,"身体と武具を洗わないと――
少々臭うな","I need to wash my body and equipment...
It's starting to smell a bit.",ui\00_message\quest\q00000009.gmd,\quest\q00000009.arc,q00000009.arc,27,Heinz
0,,"華々しい戦果――何よりだ
ご苦労だった","A splendid achievement――
above all else, well done.",ui\00_message\quest\q00000009.gmd,\quest\q00000009.arc,q00000009.arc,28,Gerd
0,,"オークとの戦いは果てが見えない――
終結のための知恵を出さねばな","The battle with the Orcs seems endless--
We must come up with a plan for its end.",ui\00_message\quest\q00000009.gmd,\quest\q00000009.arc,q00000009.arc,29,Joseph
0,,"心なしかレオが沈んでいるようですね
戦いは大勝利と聞きましたが――","It seems like Leo is a bit down.
I heard that the battle was a great victory, but...",ui\00_message\quest\q00000009.gmd,\quest\q00000009.arc,q00000009.arc,30,Mysial
0,,"いや、ご苦労さま
ゆっくり休むといいよ","No, thank you for your hard work. 
Take your time to rest.",ui\00_message\quest\q00000009.gmd,\quest\q00000009.arc,q00000009.arc,31,Klaus
0,,"ご苦労だった
後でいい――少し顔を貸してくれ","You've worked hard.
Later—could you lend me your ear for a moment?",ui\00_message\quest\q00000009.gmd,\quest\q00000009.arc,q00000009.arc,32,Leo
0,,準備できたら声を掛けてくれ,Give me a shout when you're ready.,ui\00_message\quest\q00000009.gmd,\quest\q00000009.arc,q00000009.arc,33,Leo
0,,"一緒にやりたいこと、相談したいこと――
頼みたいことが山ほどある","There are so many things I want to do with you, 
things I want to talk to you about-- 
so much I want to ask you for help with.",ui\00_message\quest\q00000009.gmd,\quest\q00000009.arc,q00000009.arc,34,Leo
0,,【ヒント：エリア封鎖解放】,[Hint: Area Blockade Released],ui\00_message\quest\q00000010.gmd,\quest\q00000010.arc,q00000010.arc,0,Leo
0,,ハイデル関所が開放され、ダウ渓谷とハイデル平原の往来が可能になりました,"The Hidell Checkpoint has been opened, allowing 
passage between the Dowe Valley and the 
Hidell Plains.",ui\00_message\quest\q00000010.gmd,\quest\q00000010.arc,q00000010.arc,1,Leo
0,,"ドリード城内部は複雑だ
先行している騎士をマーカーで追い、情報を得ていくといい！命の器は地下にあるようだ","The interior of Dreed Castle is complex. 
It would be good to follow the knights who are 
ahead of you with markers and gather information! 
The Vessel of Life seems to be located underground.",ui\00_message\quest\q00000010.gmd,\quest\q00000010.arc,q00000010.arc,2,White Knight
0,,一瞬でいい――,Just for a moment—,ui\00_message\quest\q00000010.gmd,\quest\q00000010.arc,q00000010.arc,3,Leo
0,,"俺たちが白竜の力を
継承できる程度でかまわない――","It's okay if we can inherit
just a fraction of the White Dragon's power—",ui\00_message\quest\q00000010.gmd,\quest\q00000010.arc,q00000010.arc,4,Leo
0,,"それほどに白竜を目覚めさせるには
どうしたらよいのか――","What should we do to awaken the White Dragon
to such an extent?",ui\00_message\quest\q00000010.gmd,\quest\q00000010.arc,q00000010.arc,5,Leo
0,,"ジョゼフはアークのことで頭がいっぱいだ
相談したら《ブラッドオーブ》を探せと言われた
おれが抱える焦りが伝わらないんだ","Joseph is preoccupied with the Ark.
When I consulted him, 
he told me to find the ""Blood Orb.""
He doesn't seem to sense the urgency I feel.",ui\00_message\quest\q00000010.gmd,\quest\q00000010.arc,q00000010.arc,6,Leo
0,,"竜の覚醒――
方法は自分たちで探すしかないのか","Awakening the Dragon--
We'll just have to find a way to do it ourselves.",ui\00_message\quest\q00000010.gmd,\quest\q00000010.arc,q00000010.arc,7,Leo
0,,"レオが深刻な顔をして
わたしを見ているのです",Leo is looking at me with a serious expression.,ui\00_message\quest\q00000010.gmd,\quest\q00000010.arc,q00000010.arc,8,Mysial
0,,何かありましたか？,Did something happen?,ui\00_message\quest\q00000010.gmd,\quest\q00000010.arc,q00000010.arc,9,Mysial
