0,,"心臓を捧げた俺たちと
その心臓を預かる白竜は一心同体だ","We who dedicated our hearts, and the
White Dragon whom safeguards the heart,
are all of one mind.",ui\00_message\quest\q00000002.gmd,\quest\q00000002.arc,q00000002.arc,18,Leo
0,,"白竜が力を取り戻せば、俺たち覚者の
力も増す――もちろん、その逆もしかり","If the White Dragon regains their strength, so
too shall our strength increase, and of
course, the reverse is also true.",ui\00_message\quest\q00000002.gmd,\quest\q00000002.arc,q00000002.arc,19,Leo
0,,"加えて――
白竜はこのレスタニアの大地とも
深くつながっている","Additionally, the White Dragon is also deeply
connected to this land of Lestania.",ui\00_message\quest\q00000002.gmd,\quest\q00000002.arc,q00000002.arc,20,Leo
0,,"つまり、レスタニアと、人々の未来は
我々の双肩にかかっているというわけだ","In other words, Lestania and the people's
future, rests upon our shoulders.",ui\00_message\quest\q00000002.gmd,\quest\q00000002.arc,q00000002.arc,21,Leo
0,,"もうひとつの務めは
白竜の砦となり、盾として戦うこと","Another duty of ours is to become a bulwark of
the White Dragon, to fight as their shield.",ui\00_message\quest\q00000002.gmd,\quest\q00000002.arc,q00000002.arc,22,Leo
0,,"このところ、オークどもの勢いが増している
防衛隊はあちこちの小競り合いで敗走を重ね
グリッテン砦への侵入まで許してしまった","Recently, the Orc's offensive momentum has
increased, and the Defense Corps have been
repeatedly driven to defeat in skirmishes against
them. We've allowed this to continue, that is,
until the invasion of Gritten Fort.",ui\00_message\quest\q00000002.gmd,\quest\q00000002.arc,q00000002.arc,23,Leo
0,,"このきびしい季節の到来に合わせるように
覚者になった意味を考えてくれ
そうすれば、生き方が見えてくるだろう","As this harsh season arrives,
consider the meaning of becoming an Arisen.
Then, you'll see a way to live.",ui\00_message\quest\q00000002.gmd,\quest\q00000002.arc,q00000002.arc,24,Leo
0,,"もちろん、苦難に背を向ける生き方もある
だが、おまえは誇り高き道を選ぶ――","Of course, there are ways to live that keep one
away from suffering, but you chose a way to
live proudly...",ui\00_message\quest\q00000002.gmd,\quest\q00000002.arc,q00000002.arc,25,Leo
0,,ああ、俺の目にくるいはない,Ah... there's nothing in my eye.,ui\00_message\quest\q00000002.gmd,\quest\q00000002.arc,q00000002.arc,26,Leo
0,,（白竜は半ば石になっている――）,(The White Dragon is partially turned to stone--),ui\00_message\quest\q00000002.gmd,\quest\q00000002.arc,q00000002.arc,27,The White Dragon
0,,"グリッテン砦からのお帰りですね？
初陣、お疲れさまでした","I see you are back from Fort Gritten?
Good job on your first mission!",ui\00_message\quest\q00000002.gmd,\quest\q00000002.arc,q00000002.arc,28,Mysial
0,,ここであらためてお話ししたいことがあります,"There is something I would like to 
talk about again here.",ui\00_message\quest\q00000002.gmd,\quest\q00000002.arc,q00000002.arc,29,Mysial
0,,"白竜様がここにいらっしゃる経緯と
現在の状況は知っていますね？","Do you know the background and current situation 
of Lord White Dragon being here?",ui\00_message\quest\q00000002.gmd,\quest\q00000002.arc,q00000002.arc,30,Mysial
0,,"白竜様は３００年前に竜力の大部分を使い果たし
残されていたのは
あなたたち覚者を生み出す力だけでした","Lord White Dragon exhausted the majority of his 
Dragon Force 300 years ago. 

What remained was only 
the power to create you Arisen.",ui\00_message\quest\q00000002.gmd,\quest\q00000002.arc,q00000002.arc,31,Mysial
0,,"白竜様は最後の力を振り絞って
幾人もの――異例なことですが――幾人もの
覚者を誕生させたのです","Lord White Dragon exerted his last 
remaining strength, and remarkably, 
he gave birth to numerous Arisen,
despite it being an unusual occurrence.",ui\00_message\quest\q00000002.gmd,\quest\q00000002.arc,q00000002.arc,32,Mysial
0,,"全身の石化が始まったのはその後のことで
今では時折目覚めては覚者を生み出すくらい――","The petrification of the whole body began 
afterwards, and now he only occasionally 
wakes up and produces an Arisen--",ui\00_message\quest\q00000002.gmd,\quest\q00000002.arc,q00000002.arc,33,Mysial
0,,"竜力の減退で野山の活力までもが弱まり
それに乗じてオークや魔物が力をつけています","With the decline of Dragon Force, 
even the vigor of the 
fields and mountains has weakened. 
Taking advantage of this, 
the Orcs and enemies have grown stronger.",ui\00_message\quest\q00000002.gmd,\quest\q00000002.arc,q00000002.arc,34,Mysial
0,,"白竜様に心臓を預けたあなたたちは
時の流れから解放され、老いることはありません","Those of you who have entrusted your hearts 
to Lord White Dragon are liberated from the flow 
of time and do not age.",ui\00_message\quest\q00000002.gmd,\quest\q00000002.arc,q00000002.arc,35,Mysial
0,,"でも、忘れないでください
レスタニアの大地、そこに暮らす人々――
その上を、時は変わらず流れているのです","But don't forget the land of Lestania, 
or the people who live there--
over which time flows unchanged!",ui\00_message\quest\q00000002.gmd,\quest\q00000002.arc,q00000002.arc,36,Mysial
0,,"白竜様の復活がどうか間に合いますように
わたしはそう願わずにはいられません
あなたの力を、ぜひ、貸してください","I hope that the resurrection of 
Lord White Dragon will be in time.
I cannot help but wish for it.
Please, lend me your power.",ui\00_message\quest\q00000002.gmd,\quest\q00000002.arc,q00000002.arc,37,Mysial
0,,わたしは神官のジョゼフだ,"I am Joseph, a priest.",ui\00_message\quest\q00000002.gmd,\quest\q00000002.arc,q00000002.arc,38,Joseph
0,,"神官と言ってもぴんと来ないだろうが
この神殿を中心とする政（まつりごと）の
取りまとめが主な仕事だ","Even if I say ""priest"", 
you probably won't understand, 
but the main job is to manage the ceremonies 
centered around this temple.",ui\00_message\quest\q00000002.gmd,\quest\q00000002.arc,q00000002.arc,39,Joseph
0,,"オークどもとの戦争に加えて
味方同士である覚者と騎士団の反目もあってな――","In addition to the war with the orcs,
there is also tension between the Arisen and 
the Knight's Order, who are allies...",ui\00_message\quest\q00000002.gmd,\quest\q00000002.arc,q00000002.arc,40,Joseph
0,,"部隊編成やら任務の分担、あらゆる事に
口を出すことにしている","I make it a point to involve myself
in everything, from forming squads
to assigning missions.",ui\00_message\quest\q00000002.gmd,\quest\q00000002.arc,q00000002.arc,41,Joseph
0,,ところで、この神殿の歴史は知っているか？,"By the way, 
do you know the history of this temple?",ui\00_message\quest\q00000002.gmd,\quest\q00000002.arc,q00000002.arc,42,Joseph
0,,"ふむ――簡単に説明しておこう
かれこれ、３００年前のことだ――","Hmm―― let me explain it briefly. 
This happened about 300 years ago――",ui\00_message\quest\q00000002.gmd,\quest\q00000002.arc,q00000002.arc,43,Joseph
0,,"この地に墜落し、身動きもならない白竜――
その身を案じたレスタニアの民が力を合わせ
長い時間をかけて造りあげたのがこの神殿だ","The people of Lestania, 
concerned about the white dragon that crashed here
and was unable to move, joined forces
and built this temple over a long period of time.",ui\00_message\quest\q00000002.gmd,\quest\q00000002.arc,q00000002.arc,44,Joseph
0,,"堅牢な神殿、覚者、騎士団――
そして戦えない者たちが捧げる祈り――
すべてが白竜を守る力となるのだ","A solid temple, the Arisen, the Knight Order――
And the prayers offered by those who cannot fight―
All become the power to protect the White Dragon.",ui\00_message\quest\q00000002.gmd,\quest\q00000002.arc,q00000002.arc,45,Joseph
0,,"どれひとつとして、欠けてはいけない
――いいな？
すべてを尊重し、慈しむのだ","None of them should be missing.
-- alright?
Respect and care for all of them.",ui\00_message\quest\q00000002.gmd,\quest\q00000002.arc,q00000002.arc,46,Joseph
0,,"僕はクラウス
ジョゼフ様の助手さ
まあ、使いっ走りみたいなものだね","I am Klaus,
the assistant of Master Joseph.
Well, I suppose I'm more like a errand boy.",ui\00_message\quest\q00000002.gmd,\quest\q00000002.arc,q00000002.arc,47,Klaus
0,,"え？　
いやいや、僕は覚者じゃないんだ","Huh? No, no, I'm not an Arisen.",ui\00_message\quest\q00000002.gmd,\quest\q00000002.arc,q00000002.arc,48,Klaus
0,,"覚者たちのほとんどは神殿の外――
レスタニアのあちこちを駆け巡っているよ","Most of the Arisen are outside the temple - 
running around Lestania.",ui\00_message\quest\q00000002.gmd,\quest\q00000002.arc,q00000002.arc,49,Klaus
0,,"もちろん、レオが一声かければ
大勢の覚者が集まるわけだけど","Of course, if Leo were to call out,
many Arisen would gather together.",ui\00_message\quest\q00000002.gmd,\quest\q00000002.arc,q00000002.arc,50,Klaus
0,,"ところで君は《ブラッドオーブ》を知ってるかい？
白竜様に捧げると石化の進行を
食い止めることができるんだ","By the way, do you know about the ""Blood Orb""? 
If you offer it to Lord White Dragon, 
you can halt the progression of petrification.",ui\00_message\quest\q00000002.gmd,\quest\q00000002.arc,q00000002.arc,51,Klaus
0,,"でも、なかなか手に入らなくてさ
《ブラッドオーブ》のことは
いつでも頭の片隅で気にしておくといい","But, it's quite hard to get, you know.
It's good to always keep the thought 
of the 《Blood Orb》
in the back of your mind.",ui\00_message\quest\q00000002.gmd,\quest\q00000002.arc,q00000002.arc,52,Klaus
0,,"わたしは白衛騎士団――通称白騎団の
団長を拝命しているゲルトだ","I am Gerd, 
the Commander of the White Guard Knights, 
also known as the White Knights.",ui\00_message\quest\q00000002.gmd,\quest\q00000002.arc,q00000002.arc,53,Gerd
0,,見たところ、貴殿は覚者になって日も浅いようだ,"From what I can see, 
t seems that you have recently become an Arisen.",ui\00_message\quest\q00000002.gmd,\quest\q00000002.arc,q00000002.arc,54,Gerd
0,,"これから見聞を広げるのだろうが、
先輩たち――特に覚者から、くだらない偏見を
吹き込まれないようにな","You're about to broaden your horizons,
but make sure not to let the seniors,
especially among the Arisen, instill
foolish prejudices in you.",ui\00_message\quest\q00000002.gmd,\quest\q00000002.arc,q00000002.arc,55,Gerd
0,,"残念なことに覚者の中には
我々騎士団を下に見る者もいる
例えば、こんな陰口をきいたことはないか？","Unfortunately, among the Arisen, there are 
those who look down upon our knight order. 
Have you ever heard such slander such as this?",ui\00_message\quest\q00000002.gmd,\quest\q00000002.arc,q00000002.arc,56,Gerd
0,,"ミミズのフンほどのわずかな報酬のために
騎士になった者がいる――","There are those who become knights 
for the sake of a reward as meager as worm dung.",ui\00_message\quest\q00000002.gmd,\quest\q00000002.arc,q00000002.arc,57,Gerd
0,,違うぞ！　断じて違う！,That's not true! Absolutely not true!,ui\00_message\quest\q00000002.gmd,\quest\q00000002.arc,q00000002.arc,58,Gerd
0,,"我々は全て、白竜様のために
レスタニアのために！
そこに生きる人々のために剣と命を捧げたのだ","For the sake of the White Dragon,
and for the sake of Lestania!
We have devoted our swords and lives
for the people who live there.",ui\00_message\quest\q00000002.gmd,\quest\q00000002.arc,q00000002.arc,59,Gerd
0,,貴殿たち覚者のように、運命でも使命でもなく――,"Like you, noble Arisen, not bound by fate or purpose--",ui\00_message\quest\q00000002.gmd,\quest\q00000002.arc,q00000002.arc,60,Gerd
0,,"戦いに背を向けることもできたのに
それをいさぎよしとせず、騎士になる道を選んだ
意志と奉仕の塊が、我々白衛騎士団なのだ","Even though we could have turned 
our backs on the fight,
we chose the path to become knights.
The embodiment of will and service, 
we are the White Guard Knights.",ui\00_message\quest\q00000002.gmd,\quest\q00000002.arc,q00000002.arc,61,Gerd
0,,"もし、貴殿の態度にナめた様子があれば
容赦なく思い知らせてやるからな","If I see any nonsense in your attitude,
I will show you no mercy.",ui\00_message\quest\q00000002.gmd,\quest\q00000002.arc,q00000002.arc,62,Gerd
0,,"ええと――
自己紹介はしたんだっけ？　まだだっけ？
ま、いいか――わたしはイリス","Um... Did I introduce myself? Or not yet?
Well, it's okay... I'm Iris.",ui\00_message\quest\q00000002.gmd,\quest\q00000002.arc,q00000002.arc,63,Iris
0,,"たいていはレオとつるんでいて
あちこち走り回っているの","I usually hang out with Leo and 
run around here and there.",ui\00_message\quest\q00000002.gmd,\quest\q00000002.arc,q00000002.arc,64,Iris
0,,"覚者の連絡係みたいなものだね
結構大変な仕事だから頼りになりそうなら
仕事、譲ってもいいよ","It's like I'm the Arisen's liaison.
It's quite a demanding job,
so if you seem reliable,
I might pass it on to you.",ui\00_message\quest\q00000002.gmd,\quest\q00000002.arc,q00000002.arc,65,Iris
0,,"覚者ってさ、みんな基本的に、バラバラに
生きているんだよね","The Arisen, you know, everyone basically lives
their own lives, scattered all over the place.",ui\00_message\quest\q00000002.gmd,\quest\q00000002.arc,q00000002.arc,66,Iris
0,,"心臓が時を刻まないから、時間が幾らでも
あるでしょ？
だからさ、いろんなこと考えちゃうんだ","Since your heart doesn't beat time, 
you have all the time in the world, right?
That's why you think about all sorts of things.",ui\00_message\quest\q00000002.gmd,\quest\q00000002.arc,q00000002.arc,67,Iris
0,,覚者とは？人生とは？自分って何？とかさ,"What is an Arisen? 
What is life? 
What is self? 
I wonder.",ui\00_message\quest\q00000002.gmd,\quest\q00000002.arc,q00000002.arc,68,Iris
0,,"もちろん、白竜を守るのが本業だけど
その守り方も、ただ戦うだけじゃなくて
覚者ならではの方法を探すべき――とか
いろいろな考え方があるわけよ","Of course, 
protecting the White Dragon is our main duty,
but our approach to protecting it isn't just about 
fighting.

As Arisen, 
we should seek out methods unique to us――
there are various ways of thinking, you know.",ui\00_message\quest\q00000002.gmd,\quest\q00000002.arc,q00000002.arc,69,Iris
0,,"覚者も騎士団みたいにビシッと組織にした方が
いいって意見もあるけど――
どうなんだろうね","There are also opinions that it would be better 
to organize the Arisen like a knight order and 
be more organized.
I wonder how that would be.",ui\00_message\quest\q00000002.gmd,\quest\q00000002.arc,q00000002.arc,70,Iris
0,,あ、わたしは深く考えない派なので、よろしく！,"Ah, I'm not the type to think deeply, so, 
nice to meet you!",ui\00_message\quest\q00000002.gmd,\quest\q00000002.arc,q00000002.arc,71,Iris
0,,"白竜様が力を取り戻すまで
わたしたちが世の理を守らねばなりません","Until Lord White Dragon regains his power,
we must protect the order of the world.",ui\00_message\quest\q00000002.gmd,\quest\q00000002.arc,q00000002.arc,72,Mysial
0,,"特に、覚者の皆さんの責任は重大です
白竜様のご期待をゆめゆめお忘れなく","In particular, the responsibility of 
all the Arisen is significant. 
Please never forget the 
expectations of Lord White Dragon.",ui\00_message\quest\q00000002.gmd,\quest\q00000002.arc,q00000002.arc,73,Mysial
0,,"他の連中とも話して
顔を覚えてもらうんだな","I'll talk to the others
and make sure they remember your face.",ui\00_message\quest\q00000002.gmd,\quest\q00000002.arc,q00000002.arc,74,Leo
0,,"レオがこんなに世話をやくなんて
どういう風の吹き回しだろうね
よっぽどあんたが気に入ったらしいよ","Leo is really taking care of you.
I wonder what's got into him.
Seems like he really likes you.",ui\00_message\quest\q00000002.gmd,\quest\q00000002.arc,q00000002.arc,75,Iris
0,,あのさぁ――,"Hey, you know...",ui\00_message\quest\q00000002.gmd,\quest\q00000002.arc,q00000002.arc,76,Klaus
0,,"神殿以外にも《拠点》があるのは
知っているよね？","Did you know that there are 
other locations outside of the temple?",ui\00_message\quest\q00000002.gmd,\quest\q00000002.arc,q00000002.arc,77,Klaus
0,,"村だったり、特別な施設があったり――
そこの住人が助けを求めていたり――","It could be a village, or a special facility,
where the residents are looking for help--",ui\00_message\quest\q00000002.gmd,\quest\q00000002.arc,q00000002.arc,78,Klaus
0,,"いろいろあるから、時間があるなら
あちこち行ってみた方がいいよ","There's a lot going on, so if you have the time,
you should go all over the place.",ui\00_message\quest\q00000002.gmd,\quest\q00000002.arc,q00000002.arc,79,Klaus
0,,"ここんところジョゼフ様が老け込んじゃって
結構重要な仕事を任せてもらえるようになったんだ","Master Joseph has been getting old these days,
so I've been entrusted with quite important tasks.",ui\00_message\quest\q00000002.gmd,\quest\q00000002.arc,q00000002.arc,80,Klaus
0,,"うれしいけど――重圧もあってさ――
時々、話しを聞いてくれるとうれしいな","I'm glad you're here -- 
but I'm also under a lot of pressure.
I'd love it if you'd talk to me from time to time.",ui\00_message\quest\q00000002.gmd,\quest\q00000002.arc,q00000002.arc,81,Klaus
0,,"レオに期待されるということは――
危険な場所に行く機会が多いということだ
精進と用心を忘れなさんな","What Leo expects is that you have a lot 
of opportunities to go to dangerous places.
Do not forget diligence and caution.",ui\00_message\quest\q00000002.gmd,\quest\q00000002.arc,q00000002.arc,82,Joseph
0,,"オークどもとの戦争が続く限り
背中を預け合って戦う機会がすぐに来る
貴殿の力はその時に見せてもらおう","As long as the war with the Orcs continues,
the opportunity to fight 
shoulder to shoulder will come soon.
I look forward to seeing your strength 
at that time.",ui\00_message\quest\q00000002.gmd,\quest\q00000002.arc,q00000002.arc,83,Gerd
0,,"白竜様は一日の多くを眠って過ごしますが
ごくわずかながらお目覚めの時もあります
そんな時は、お話だってできますよ","Lord White Dragon spends much of the day sleeping,
but there are also moments when he wakes up,
and during those times, 
he can have a conversation with you.",ui\00_message\quest\q00000002.gmd,\quest\q00000002.arc,q00000002.arc,84,Mysial
0,,"まあ、最初のうちは言われるがままに
戦っていればいいさ","Well, in the beginning, 
just do as you're told and fight.",ui\00_message\quest\q00000002.gmd,\quest\q00000002.arc,q00000002.arc,85,Leo
0,,"そのうち、自分なりの生き方が
見えてくるはずだ","Eventually, 
you should be able to see your own way of living.",ui\00_message\quest\q00000002.gmd,\quest\q00000002.arc,q00000002.arc,86,Leo
0,,どれどれどれ？,"Hmm, I wonder...",ui\00_message\quest\q00000002.gmd,\quest\q00000002.arc,q00000002.arc,87,Iris
0,,"レオはあんたのどこが気に入ったのかな？
それともただの気まぐれか――なんてね","What does Leo like about you?
Or is it just a whim?",ui\00_message\quest\q00000002.gmd,\quest\q00000002.arc,q00000002.arc,88,Iris
0,,君はどんな覚者人生を歩むんだろうね,"I wonder what kind of life as an 
Arisen you will lead.",ui\00_message\quest\q00000002.gmd,\quest\q00000002.arc,q00000002.arc,89,Klaus
0,,"冒険者みたいな生き方もいいけど
僕としては神殿のために尽力して欲しい――","You can live like an adventurer,
but for my part, 
I want you to do your best for the temple--",ui\00_message\quest\q00000002.gmd,\quest\q00000002.arc,q00000002.arc,90,Klaus
0,,いや、最近、少ないんだよね、そういう覚者,"No, there aren't many of those Arisen these days.",ui\00_message\quest\q00000002.gmd,\quest\q00000002.arc,q00000002.arc,91,Klaus
0,,"ここで見聞したことを外で話す時は
その判断を慎重に行うようにな","Be careful about your judgment when 
talking about what you have seen here outside.",ui\00_message\quest\q00000002.gmd,\quest\q00000002.arc,q00000002.arc,92,Joseph
0,,"秘密は可能な限り少なくしたいが
内容によってはそうもいかん","I want to minimize the secretkeeping 
as much as possible, 
but depending on the subject, 
it may not be possible.",ui\00_message\quest\q00000002.gmd,\quest\q00000002.arc,q00000002.arc,93,Joseph
0,,"どうした？　時間を持て余しているのなら
オークの一匹でも倒してくるがいい","What's wrong? If you're just wasting time, 
go ahead and defeat even one Orc.",ui\00_message\quest\q00000002.gmd,\quest\q00000002.arc,q00000002.arc,94,Gerd
0,,"戦士に大切なことは
百の無駄口より剣のひと振り――忘れるな","The important thing for a warrior is 
the swing of a sword, not empty words――
don't forget.",ui\00_message\quest\q00000002.gmd,\quest\q00000002.arc,q00000002.arc,95,Gerd
0,,【ヒント：マイ拠点の登録方法】,【Hint: How to Register a Favorite】,ui\00_message\quest\q00000003.gmd,\quest\q00000003.arc,q00000003.arc,0,Alfred
0,,①各拠点に設置された《拠点の礎》に触れて解放,"Touch the ""Portcrystal"" placed at 
each location to unlock it.",ui\00_message\quest\q00000003.gmd,\quest\q00000003.arc,q00000003.arc,1,Alfred
0,,"②タッチアクションから《マイ拠点に登録》を選択
※以降《リム転移》でいつでも瞬間移動できます","Select ""Register to My Favorites"" 
from the touch action.
※ Afterwards, you can teleport 
instantly using ""Rift Teleport"" at any time.",ui\00_message\quest\q00000003.gmd,\quest\q00000003.arc,q00000003.arc,2,Alfred
0,,帰還、遠距離移動には《リム転移》が便利です,"Rift Teleport, or ""Rift Teleportation,"" 
is useful for returning and long-distance travel.",ui\00_message\quest\q00000003.gmd,\quest\q00000003.arc,q00000003.arc,3,Alfred
0,,【ヒント：リム転移の使い方】,【Hint: How to use Rift Teleport】,ui\00_message\quest\q00000003.gmd,\quest\q00000003.arc,q00000003.arc,4,Alfred
0,,①ゲームメニューのワールドで《リム転移》を選択,"Select ""Rift Teleport"" in the Game Menu's World.",ui\00_message\quest\q00000003.gmd,\quest\q00000003.arc,q00000003.arc,5,Alfred
0,,"②移動したい場所を選択
※白竜神殿への帰還はノーコストです","Select the location you want to move to.
※Returning to the White Dragon Temple is free of cost.",ui\00_message\quest\q00000003.gmd,\quest\q00000003.arc,q00000003.arc,6,Alfred
0,,【ヒント：スポット情報の見方】,【Hint: How to read spot information】,ui\00_message\quest\q00000003.gmd,\quest\q00000003.arc,q00000003.arc,7,Alfred
0,,"採取アイテムや討伐対象の魔物を探すには、
エリアマスターの《スポット情報》が便利です","To search for items and 
target monsters for suppression,
the Area Master's ""Spot Info"" is convenient.",ui\00_message\quest\q00000003.gmd,\quest\q00000003.arc,q00000003.arc,8,Alfred
0,,①《エリア情報》から《スポット情報》を選択,"Select ""Spot Info"" from ""Area Information"".",ui\00_message\quest\q00000003.gmd,\quest\q00000003.arc,q00000003.arc,9,Alfred
0,,"②スポット情報で、「入手可能アイテム」と
　「魔物情報」を確認","In the spot information, 
check the ""Available Items"" and ""Enemies"".",ui\00_message\quest\q00000003.gmd,\quest\q00000003.arc,q00000003.arc,10,Alfred
0,,テル村の場所は地図で確認してくれ,"Please check the location 
of Tel Village on the map.",ui\00_message\quest\q00000003.gmd,\quest\q00000003.arc,q00000003.arc,11,Leo
0,,"白竜様はまどろみの中――
お変わりはありません","Lord White Dragon is in a slumber―― 
No changes have occurred.",ui\00_message\quest\q00000003.gmd,\quest\q00000003.arc,q00000003.arc,12,Mysial
0,,"白竜は自らを守るために
大勢の覚者を生み出した――","The White Dragon, in order to protect itself, 
gave birth to a multitude of Arisen――",ui\00_message\quest\q00000003.gmd,\quest\q00000003.arc,q00000003.arc,13,Joseph
0,,"白竜自身の言葉だから
異論を唱えるものは誰もいない","Because it is the White Dragon's own words,
there is no one who voices dissent.",ui\00_message\quest\q00000003.gmd,\quest\q00000003.arc,q00000003.arc,14,Joseph
