#Index,Key,MsgJp,MsgEn,GmdPath,ArcPath,ArcName,ReadIndex
0,,"君がこうして訪ねてくれることで
僕らも人との接し方を思い出せるんだ","Your visits like this help us remember how to
interact with people.",ui\00_message\npc\base\n4508.gmd,\npc\n4508.arc,n4508.arc,9
0,,"お客さん、遠いところ、せっかく来てくれたし
これを受け取ってくれ
またときおり訪ねてくれたら嬉しいな","Hey there traveler, you've made quite the
journey!
Take this as a token of appreciation.
I'd be happy to see you drop by occasionally.",ui\00_message\npc\base\n4508.gmd,\npc\n4508.arc,n4508.arc,10
0,,"僕はロンドジール
このディナンの森でエリアマスターを
しているんだ","I am Rondejeel, working as an Area Master in this
forest of Deenan.",ui\00_message\npc\base\n4508.gmd,\npc\n4508.arc,n4508.arc,11
0,,"どうだい？　ここは静かな所だろう
木々の声に耳を傾けながら
僕とリングディールは二人でエルフの
残した知識と技術を探し続けているのさ","How about this? It's a quiet place, isn't it?
While listening to the voices of the trees,
Ringdeel and I are searching for the knowledge and
techniques left behind by the elves.",ui\00_message\npc\base\n4508.gmd,\npc\n4508.arc,n4508.arc,12
0,,"エルフがどう生き、何を考え、そして
生き続けていたのか――
彼らに少しでも近づきたくて、僕ら二人は
ここに移り住んだんだ","How the elves lived, what they thought, and what
kept them alive--
We both moved here to be a little closer to them.",ui\00_message\npc\base\n4508.gmd,\npc\n4508.arc,n4508.arc,13
0,,"おかしいかい？
――いいさ、気にしないよ","Does it seem strange to you?
It's good, doesn't bother me.",ui\00_message\npc\base\n4508.gmd,\npc\n4508.arc,n4508.arc,14
0,,"とにかく、覚者の君が来てくれて嬉しいよ
最近は以前より魔物が増えてね","Anyway, I'm glad you, the Arisen, are here.
Lately, there have been more monsters than before.",ui\00_message\npc\base\n4508.gmd,\npc\n4508.arc,n4508.arc,15
0,,"僕らだけだと、手が足りなかったんだ
君が力を貸してくれるなら、僕らも相応の
礼はさせてもらうよ","It was just us, and we didn't have enough hands.
If you lend us your strength, we'll be glad to
thank you well.",ui\00_message\npc\base\n4508.gmd,\npc\n4508.arc,n4508.arc,16
0,,"いくつか僕らの仕事を片付けておいて
もらえたみたいだね、助かるよ","It seems like you were able to take care of some
of our work for us.
I really appreciate it.",ui\00_message\npc\base\n4508.gmd,\npc\n4508.arc,n4508.arc,17
0,,"お返しに、君に渡せそうなものを
考えてみたんだ
少しは喜んでもらえるといいんだけどね","In return for your assistance, I've been thinking
well on what I might offer you.
I hope it brings you some joy.",ui\00_message\npc\base\n4508.gmd,\npc\n4508.arc,n4508.arc,18
0,,"そうそう、君にも伝えておこう
《グローン・ノス》――森の東にある淵辺は
エルフの言葉で""森の淀み""と呼ばれる
ところなんだけどね","Oh, by the way, I should also tell you; ""Groan
Nos"" is what the eastern edge of the forest is
called in the language of the elves.
It means ""still forest.""",ui\00_message\npc\base\n4508.gmd,\npc\n4508.arc,n4508.arc,19
0,,"そこに、淀みが原因で生まれた魔物が
たまに湧くんだよ","Occasionally, monsters borne from stagnation
emerge there.",ui\00_message\npc\base\n4508.gmd,\npc\n4508.arc,n4508.arc,20
0,,"僕らも気が付いたら倒すようにしてるけど
最近増えてきたみたいなんだ
できれば君も手伝ってくれないかな","We've been trying to defeat them, but it seems
like they've been increasing lately.
If possible, could you lend your aid?",ui\00_message\npc\base\n4508.gmd,\npc\n4508.arc,n4508.arc,21
0,,"この間は遺跡の件、本当に助かったよ
ずいぶんこの森に慣れてきた君に
僕ら兄妹から提案があるんだ","I really appreciate your help with the ruins
incident the other day.
You've become quite accustomed to this forest,
haven't you?
My siblings and I have a proposal for you.",ui\00_message\npc\base\n4508.gmd,\npc\n4508.arc,n4508.arc,22
0,,"君もリングディールと共に
《エレメントアーチャ―》として
研究を深めてみないかい？
失われつつあるエルフの戦闘術についてさ","Would you like to deepen your research on the
combat techniques of the dwindling elven warriors,
as an ""Element Archer,"" along with Ringdeel?",ui\00_message\npc\base\n4508.gmd,\npc\n4508.arc,n4508.arc,23
0,,"試す気になったら、リングディールに
声を掛けてくれ","If you feel like trying, please talk to Ringdeel
and let them know.",ui\00_message\npc\base\n4508.gmd,\npc\n4508.arc,n4508.arc,24
0,,"きっと君と研鑽しあった方が
妹も得るものが大きいと思うんだ","I believe that surely, by mutually sharpening our
skills together, both you and my sister will gain
something great.",ui\00_message\npc\base\n4508.gmd,\npc\n4508.arc,n4508.arc,25
0,,"そうだ、君にも伝えておこうかな
エルテ・ディナンへ続く路の脇に
《森民の地下道》っていう古い自然洞窟が
あるんだ","I suppose I should tell you too.
Beside the road leading to Erte Deenan, there is
an old natural cave called the ""Forest People's
Tunnel"".",ui\00_message\npc\base\n4508.gmd,\npc\n4508.arc,n4508.arc,26
0,,"かつて、エルフがミスリウ森林深部とディナンを
行き来するのに使っていた道さ","Once, the elves used it as a path to travel
between the deep parts of Mysree Grove and Deenan.",ui\00_message\npc\base\n4508.gmd,\npc\n4508.arc,n4508.arc,27
0,,"だけど、彼らの都が滅んだ時かな――
昔のエリアマスターによって、その地下道は
ずっと封鎖され続けていたんだ
多分敵に道を利用されないためだろうね","That underground passage was permanently sealed
by an Area Master of old.
Perhaps it was around the time their city fell.
Likely, it was to prevent enemies from exploiting
the path.",ui\00_message\npc\base\n4508.gmd,\npc\n4508.arc,n4508.arc,28
0,,"最近、その封鎖の解き方が分かってね
一応通れるようになったから、必要なら使うといい","I recently figured out how to break that blockade.
I've got a way through, so you can use it if you
need to.",ui\00_message\npc\base\n4508.gmd,\npc\n4508.arc,n4508.arc,29
0,,もう、今は完全にただの洞窟だけど,"Now, it's just a mere cave.",ui\00_message\npc\base\n4508.gmd,\npc\n4508.arc,n4508.arc,30
0,,"ああ、君にはずいぶん色々と任せてしまったね
それに手際もなかなかのものじゃないか
妹も喜んでいるよ","I've assigned you many responsibilities, haven't
I?
And you handle them with efficiency.
My sister is happy about it too.",ui\00_message\npc\base\n4508.gmd,\npc\n4508.arc,n4508.arc,31
0,,"さすがに言葉だけというわけにはいかないから
またお返しを用意したよ
次からはもっと良い物を渡すから
楽しみにしててよ","Naturally, just words won't do, so I've prepared
a little something for you.
I hope you'll enjoy it.",ui\00_message\npc\base\n4508.gmd,\npc\n4508.arc,n4508.arc,32
0,,"そう言えば、森の南西に聖なる泉が
あるのは知ってるかい？
《エルネア・スプリング》という生命力を
強める泉さ","By the way, did you know that there is a sacred
spring in the southwest of the forest?
It's called the ""Elnea Spring"" and it invigorates
one's life force.",ui\00_message\npc\base\n4508.gmd,\npc\n4508.arc,n4508.arc,33
0,,"その周囲に、白い人影が彷徨っている
ことがあるんだ
泉の生命力に魔が宿ったものなのか
それともエルフの亡霊なのか――","There are times when white shadows wander around
its surroundings.
Could it be that some kind of magic has taken
hold of the vitality of the spring, or are they
the spirits of the elves?",ui\00_message\npc\base\n4508.gmd,\npc\n4508.arc,n4508.arc,34
0,,"あれが""白い災厄""の正体じゃ
ないとは思うんだけど","I don't think that is the true identity of the
""White Scourge,"" but...",ui\00_message\npc\base\n4508.gmd,\npc\n4508.arc,n4508.arc,35
0,,"彼らは手強いし、意思疎通もできない
もし遭遇したらすぐその場を
離れたほうがいい","They are strong opponents and we cannot
communicate with them.
If you encounter them, you should make yourself
scarce!",ui\00_message\npc\base\n4508.gmd,\npc\n4508.arc,n4508.arc,36
0,,"そうだ、もし君がこの森やエルフの文化と
もう少し関わるつもりなら
ひとつ頼みを聞いてくれないかな？","You know, if you're planning to get more involved
with this forest and the culture of the elves,
could I ask you for a favor?",ui\00_message\npc\base\n4508.gmd,\npc\n4508.arc,n4508.arc,37
0,,"エルフ達の遺跡の一つ
《神花のテラス》という遺跡にいる
魔物退治をしてほしいんだ","My request is this.
There's a place called the Divine Blossom
Terrace, one of the elven ruins.
It seems to be overrun with monsters.
Could you clear them out?",ui\00_message\npc\base\n4508.gmd,\npc\n4508.arc,n4508.arc,38
0,,"僕はそれほど戦えないし
リングディール一人だとあそこの魔物は
手に余るものでね
どうかな？","I'm not much of a fighter, and dealing with the
monsters there, especially alone, is quite
overwhelming for me.
What do you think?",ui\00_message\npc\base\n4508.gmd,\npc\n4508.arc,n4508.arc,39
0,,"やってくれるというなら
きちんと依頼したいんだ","If you're willing take this on, I'd like to make
a proper request.",ui\00_message\npc\base\n4508.gmd,\npc\n4508.arc,n4508.arc,40
0,,"まったく、君には世話になりっぱなしだな
ここまで手助けしてもらったら
なんだか申し訳なくなってくる","Honestly, I've been relying on you for help all
this time.
It's starting to make me feel a little guilty.",ui\00_message\npc\base\n4508.gmd,\npc\n4508.arc,n4508.arc,41
0,,"僕ら兄妹から、心を込めて礼をさせてもらう
君がこの森に来てくれて本当に良かった
ありがとう","We, as siblings, sincerely express our gratitude
to you.
It is truly wonderful that you came to this
forest.
Thank you.",ui\00_message\npc\base\n4508.gmd,\npc\n4508.arc,n4508.arc,42
0,,"この件は、君にも伝えておいた
ほうがよさそうだな","It seems like it would be a good idea to inform
you about this matter as well.",ui\00_message\npc\base\n4508.gmd,\npc\n4508.arc,n4508.arc,43
0,,"ディナンの森の最奥――
《サーズ・ディナン》付近で
妹が銀毛の鬼人に襲われたんだ","My sister was attacked by a silver-haired demon
near Sazu Deenan, deep within the depths of Deenan
Forest.",ui\00_message\npc\base\n4508.gmd,\npc\n4508.arc,n4508.arc,44
0,,"シルバーロアという危険な魔物なんだけど
どうやらあの辺りを縄張りにするつもりらしい","It's a dangerous demon called Silver Roar.
Apparently, it's marking that area as their
territory.",ui\00_message\npc\base\n4508.gmd,\npc\n4508.arc,n4508.arc,45
0,,"用心に越したことはない
川辺の方へ行くのなら十分警戒してくれ","It's better to be safe than sorry.
If you're heading towards the riverside, please
be extra cautious.",ui\00_message\npc\base\n4508.gmd,\npc\n4508.arc,n4508.arc,46
0,,一つ君に相談があるんだ,--I need to talk to you about something.,ui\00_message\npc\base\n4508.gmd,\npc\n4508.arc,n4508.arc,47
0,,"エルフの都、エルテ・ディナンに
《レ・カルバス・アーマ》という区画があるのは
知ってるかい？","Do you know that in the elven city of Erte
Deenan, there is a district called ""Le Karvas
Arma""?",ui\00_message\npc\base\n4508.gmd,\npc\n4508.arc,n4508.arc,48
0,,"今度頼みたいのは
その区画の探索なんだ","What I want to ask for this time is an
exploration of that area.",ui\00_message\npc\base\n4508.gmd,\npc\n4508.arc,n4508.arc,49
0,,"前に話しただろう？
エルフを脅かし続けてきた""白い災厄""の話
その答えがどうもアーマ区画にあるらしい","Did I talk about this before?
The story of the ""White Scourge"" that was
threatening the elves.
It seems that the answer lies in the Arma section.",ui\00_message\npc\base\n4508.gmd,\npc\n4508.arc,n4508.arc,50
0,,"どうかな、無理にとはいわないよ
もし協力してくれるなら
あらためて話し掛けてくれ","What do you think? I won't force you.
If you're willing to help, just talk to me again.",ui\00_message\npc\base\n4508.gmd,\npc\n4508.arc,n4508.arc,51
0,,"できることならぜひ――
いや、君に頼まなければならない
そんな気がするんだ","If possible, please―
No, I feel like I have to ask for your help.
That's just how I feel.",ui\00_message\npc\base\n4508.gmd,\npc\n4508.arc,n4508.arc,52
0,,"この森にはね、エルフ達が特別な意味を込めて
残した地名がいくつかあるんだ","In this forest, there are several places with
names that the elves left behind that have special
meanings.",ui\00_message\npc\base\n4508.gmd,\npc\n4508.arc,n4508.arc,53
0,,"《グローン・ノス》、《エルネア・スプリング》
なんかだね","Groan Nos, Elnea Spring, and so on.",ui\00_message\npc\base\n4508.gmd,\npc\n4508.arc,n4508.arc,54
0,,"それぞれの場所には言葉の由来となる
魔物や現象があるから、そういう所に
足を踏み入れるなら注意するといい","In each location, old history and language ring
about.
Monsters and strange phenomena are there too, so
if you endeavor to enter such places, it is
advisable to be cautious.",ui\00_message\npc\base\n4508.gmd,\npc\n4508.arc,n4508.arc,55
0,,"ディナンの森にようこそ
大したもてなしはできないけどね","Welcome to the Forest of Deenan.
We may not be able to offer much hospitality,
though.",ui\00_message\npc\base\n4508.gmd,\npc\n4508.arc,n4508.arc,56
0,,"そこのボードに、僕らの《やることリスト》を
貼ってある
暇なら手伝ってもらえると助かるな","I've posted our 《To Do List》 on the board there.
If you're not busy, I'd appreciate it if you
could help.",ui\00_message\npc\base\n4508.gmd,\npc\n4508.arc,n4508.arc,57
0,,"――たまに、身に覚えのない紙も
あるんだけどね","--Sometimes, there are also papers that I don't
remember.",ui\00_message\npc\base\n4508.gmd,\npc\n4508.arc,n4508.arc,58
0,,"この森に居付いて何年――いや、もっとか
あまりそんな気はしないんだが","How many years have I been here in this forest?
...No, it must be more than that.
Yet, it feels like just yesterday.",ui\00_message\npc\base\n4508.gmd,\npc\n4508.arc,n4508.arc,59
0,,"ここは時の流れが少し違うのかもしれないな
――それとも、時の流れが違うのは
身体の方なのかな","Perhaps the passage of time here is different.
Or perhaps... it is my own body that is out of
sync with time.",ui\00_message\npc\base\n4508.gmd,\npc\n4508.arc,n4508.arc,60
0,,"エルフの民はもうここにはいない
だけど――夢かもしれないが
一度僕は森で、不思議な光を見たことがある","The elven people are no longer here, But...
It might be a dream.
I saw a mysterious light in the woods once.",ui\00_message\npc\base\n4508.gmd,\npc\n4508.arc,n4508.arc,61
0,,"リングディールの魔矢よりまばゆく輝く
美しい光を","Shining more dazzlingly than the magic arrows of
Ringdeel.
A beautiful light.",ui\00_message\npc\base\n4508.gmd,\npc\n4508.arc,n4508.arc,62
0,,あれは何だったのかな,I wonder what that was.,ui\00_message\npc\base\n4508.gmd,\npc\n4508.arc,n4508.arc,63
0,,"君に伝えたいことがあったんだ
ディナン深層林にある《辺境の礎》の全てが
使えるようになったそうだよ","I just wanted to let you know that it seems that
all of the Sub Portcrystals in the Deenan Woods
have become functional.",ui\00_message\npc\base\n4508.gmd,\npc\n4508.arc,n4508.arc,64
0,,"何でも、君のこの辺りでの働きを
神殿がねぎらってのことだとか","It is the temple's way of praising your efforts
around here.",ui\00_message\npc\base\n4508.gmd,\npc\n4508.arc,n4508.arc,65
0,,"きっと便利になるだろうから
ぜひ使ってみてくれ","I'm sure it'll come in handy.
I'd love to see you use it.",ui\00_message\npc\base\n4508.gmd,\npc\n4508.arc,n4508.arc,66
0,,"このところ、《大樹の広場》の辺りに
えらく攻撃的なエントがうろついているんだ","Lately, there have been extremely aggressive Ents
lurking around the vicinity of the ""Big Tree
Dell.""",ui\00_message\npc\base\n4508.gmd,\npc\n4508.arc,n4508.arc,67
0,,"ここからもそう遠くないし
あの調子で暴れられると
少しまずいことになりそうでね","It's not too far from here, and if they continue
to rampage like that, it could turn into a bit of
a problem.",ui\00_message\npc\base\n4508.gmd,\npc\n4508.arc,n4508.arc,68
0,,"討伐を頼みたいんだけど、どうかな
もし引き受けてくれるなら
詳しく説明するから、あらためて声をかけてくれ","I want to request a dispatch, but I wonder if you
would be willing to accept it.
If you do, please let me know again, and I will
explain the details.",ui\00_message\npc\base\n4508.gmd,\npc\n4508.arc,n4508.arc,69
0,,"そうだ、《飛天のテラス》のことは
もう知っていたかな",Did you already know about the Heavenly Terrace?,ui\00_message\npc\base\n4508.gmd,\npc\n4508.arc,n4508.arc,70
0,,"ここから東の方に行ったところにあるんだけど
つい最近、入口の封印を解くことができたんだ","It's just east of here.
I was able to unseal the entrance just recently.",ui\00_message\npc\base\n4508.gmd,\npc\n4508.arc,n4508.arc,71
0,,"少しだけ入ってみたら
羽ばたきの音がひっきりなしに聞こえていたよ
中で鳥たちが巣を作ってるんじゃないかな","I went in for a bit and I could hear the constant
flapping of wings.
I think there are birds nesting inside.",ui\00_message\npc\base\n4508.gmd,\npc\n4508.arc,n4508.arc,72
0,,"あの辺りは今までも鳥の巣が多かったからね
君も興味があれば行ってみるといい","That area has always had a lot of bird nests, so
if you're interested, it's a good idea to go and
check it out.",ui\00_message\npc\base\n4508.gmd,\npc\n4508.arc,n4508.arc,73
0,,"ちょうどよかった
君に話があってね","Just in time.
I wanted to talk to you.",ui\00_message\npc\base\n4508.gmd,\npc\n4508.arc,n4508.arc,74
0,,"実は、《飛天のテラス》内を探索していた妹が
氷竜に襲われたらしいんだ","It seems that my sister, who was exploring the
""Heavenly Terrace,"" was attacked by an Ice Dragon.",ui\00_message\npc\base\n4508.gmd,\npc\n4508.arc,n4508.arc,75
0,,"妹は腕に覚えがあるから逃げてこられたけど
もしも氷竜が《飛天のテラス》から
出てくるようなことがあると事だろう","My sister managed to escape thanks to her combat
prowess, but if the Ice Dragon were to emerge from
the Heavenly Terrace, it might be a different
story.",ui\00_message\npc\base\n4508.gmd,\npc\n4508.arc,n4508.arc,76
0,,"そこで君に討伐を頼みたいんだが、どうかな
引き受けてくれるなら
あらためて説明させてくれ","So, I want to ask you to undertake a subjugation.
What do you think?
If you're willing to accept, allow me to fill you
in.",ui\00_message\npc\base\n4508.gmd,\npc\n4508.arc,n4508.arc,77
0,,"妹ともども、君には本当に世話になっているね
本当に助かってるよ","My sister and I are truly indebted to you.
We are really grateful for your help.",ui\00_message\npc\base\n4508.gmd,\npc\n4508.arc,n4508.arc,78
0,,"少しでも君の力になればと思って
渡せそうなものを色々探してみたんだ
役に立つといいんだが","I searched for various things that I could give
you, hoping to be of even a little help.
I pray they find use.",ui\00_message\npc\base\n4508.gmd,\npc\n4508.arc,n4508.arc,79
0,,"君がこの森に来てくれるようになって良かった
心からそう思うよ
これからも、いつでも訪ねてきてくれ","I'm glad that you started coming to this forest.
I truly feel that way from the bottom of my heart.
Please visit anytime.",ui\00_message\npc\base\n4508.gmd,\npc\n4508.arc,n4508.arc,80
0,,"ようこそ、《守り人の庵》へ
エラン水林について、何か？","Welcome to the Protector's Retreat.
Regarding Elan Water Grove, is there something
you would like to know?",ui\00_message\npc\base\n4509.gmd,\npc\n4509.arc,n4509.arc,0
0,,"所持品に不足があったり
休息が必要であれば、そこにいる
ディリスが手配いたしますわ","If there are any shortages in your supplies or if
you need rest, Dirith will make the necessary
arrangements.",ui\00_message\npc\base\n4509.gmd,\npc\n4509.arc,n4509.arc,1
0,,"わたしも元はモルフォールにて
勉学を修めるつもりだったのです","I, too, was originally planning to study at
Morfaul.",ui\00_message\npc\base\n4509.gmd,\npc\n4509.arc,n4509.arc,2
0,,"ですが、この庵を守る者の座が空いてしまい――
先代に恩があることもあって
この森の復興をお手伝いしています","However, the seat of guardian of this hermitage
has become vacant--
We are deeply indebted to the previous guardian's
efforts.
Now, I shall assist in the restoration of this
forest.",ui\00_message\npc\base\n4509.gmd,\npc\n4509.arc,n4509.arc,3
0,,"うふふ――
あ、ごめんなさい
ちょっと考え事をしていました","Hehehe... Oh, I'm sorry.
I was just lost in thought.",ui\00_message\npc\base\n4509.gmd,\npc\n4509.arc,n4509.arc,4
0,,"えっと――
そうそう、自己紹介をしておかないとですね
わたしはエラン水林のエリアマスター
ミューセルと申します","Um... Oh, right. I should introduce myself,
shouldn't I?
I am Musel, the Area Master of Elan Water Grove.",ui\00_message\npc\base\n4509.gmd,\npc\n4509.arc,n4509.arc,5
0,,"このエラン水林は
フィンダムの中でも特に美しい光景に
恵まれた場所なのです","This Elan Water Grove is a place blessed with
particularly beautiful scenery in Phindym.",ui\00_message\npc\base\n4509.gmd,\npc\n4509.arc,n4509.arc,6
0,,"その自然に敬意を表し、そして守るために
人の定住を制限された区域でもあります","In order to show respect for that nature, and to
protect it, this is also an area where settlement
is restricted.",ui\00_message\npc\base\n4509.gmd,\npc\n4509.arc,n4509.arc,7
0,,"特に「全ての水はエランより湧き出る」とまで
言われる、豊富で清らかな水はこの森無くしては
ありえないものですわ","This forest is said to be the source of all water
in the land.
As the saying goes, ""All water springs from
Elan.""
Its abundance and purity are truly irreplaceable.",ui\00_message\npc\base\n4509.gmd,\npc\n4509.arc,n4509.arc,8
0,,"他の村に森の魔物が降りないよう
また、エラン水林の環境が荒れぬよう
見守るのがわたしの役目ですね","My role is to watch over and ensure that the
forest monsters do not descend upon other
villages, and that the environment of Elan Water
Grove is well kept.",ui\00_message\npc\base\n4509.gmd,\npc\n4509.arc,n4509.arc,9
0,,"この美しい水林を探索する上で
何かわからないことがあれば
いつでも、この守り人の庵にいらしてくださいませ","If you have any questions while exploring this
beautiful water forest, please feel free to visit
this Protector's Retreat at any time.",ui\00_message\npc\base\n4509.gmd,\npc\n4509.arc,n4509.arc,10
0,,"これ、よかったらお持ちください
何かの足しになれば","I would be honored if you would accept this small
token.
It is my hope that it might prove useful to you
in some way.",ui\00_message\npc\base\n4509.gmd,\npc\n4509.arc,n4509.arc,11
0,,"ふふ、エラン水林を気にかけてくださって
ありがとうございます
これ、お役にたちますように――","Ah, thank you for caring for the Elan Water
Grove.
I appreciate it.
I hope this will be of help to you--",ui\00_message\npc\base\n4509.gmd,\npc\n4509.arc,n4509.arc,12
0,,"そうそう、これをあなたにお渡ししなきゃ――
ディリスがあなたのためにって
わざわざ取っておいたものなんですよ、ふふ
日頃の感謝の気持ちです","Oh, right, I have to give this to you――
Dirith prepared this specifically for you, you
know, hehe.
It's a token of gratitude for your everyday
support.",ui\00_message\npc\base\n4509.gmd,\npc\n4509.arc,n4509.arc,13
0,,"以前にもご説明したかと思いますが
このエラン水林は美しい環境を守るため
人々の立ち入りを制限しております","As I mentioned before, the Elan Water Grove
restricts people's access in order to protect the
beautiful environment.",ui\00_message\npc\base\n4509.gmd,\npc\n4509.arc,n4509.arc,14
0,,"ですが、過去には人々が小さな村を作り
森林に配慮しながら生活していたこともあるのです
文献を手繰るに、上手くいっていたようですわ","However, in the past, there were also times when
people created small villages and lived while
respecting the forest. According to the
literature, it seems that it worked well.",ui\00_message\npc\base\n4509.gmd,\npc\n4509.arc,n4509.arc,15
