7,q60000005_00_1148,最奥の敵にしがみついて乱斬りせよ,"Cling to the enemy in the inner sanctum,
and attack it with Scarlet Slashes",ui\00_message\quest_info\q60000005_00.gmd,\quest\q60000005.arc,q60000005.arc,7
8,q60000005_00_1149,サイクロプスを倒せ,Defeat the Cyclops,ui\00_message\quest_info\q60000005_00.gmd,\quest\q60000005.arc,q60000005.arc,8
9,q60000005_00_1180,最奥にある＜旋風の証＞を入手する,Collect the proof of completing the trial,ui\00_message\quest_info\q60000005_00.gmd,\quest\q60000005.arc,q60000005.arc,9
6,q60000005_00_1248,敵にロープ投げを成功せよ,Successfully hit an enemy with Rope Throw,ui\00_message\quest_info\q60000005_00.gmd,\quest\q60000005.arc,q60000005.arc,6
0,q60000006_00_23,魔盾の証　シールドセージ戦術試練,Shield Sage Tactics Trial: A Magick Shield,ui\00_message\quest_info\q60000006_00.gmd,\quest\q60000006.arc,q60000006.arc,0
1,q60000006_00_23,"シールドセージの基本戦術を学ぶため
修練の祠にて試練に挑む","In order to learn the basics of Shield Sage,
challenge the trial of the Training Chapel",ui\00_message\quest_info\q60000006_00.gmd,\quest\q60000006.arc,q60000006.arc,1
2,q60000006_00_1093,修練の祠前の崖下にいる白衛騎士団員と話す,"Speak with the White Knight at the base
of the cliff before the Training Chapel",ui\00_message\quest_info\q60000006_00.gmd,\quest\q60000006.arc,q60000006.arc,2
3,q60000006_00_1094,修練の祠内のウィルソンと話す,Speak with Wilson in the Training Chapel,ui\00_message\quest_info\q60000006_00.gmd,\quest\q60000006.arc,q60000006.arc,3
4,q60000006_00_1095,シールドブロウで敵を攻撃せよ,Attack an enemy with Shield Blow,ui\00_message\quest_info\q60000006_00.gmd,\quest\q60000006.arc,q60000006.arc,4
5,q60000006_00_1150,エレメントチェンジで属性を変えよ,Change your current Elemental Attribute,ui\00_message\quest_info\q60000006_00.gmd,\quest\q60000006.arc,q60000006.arc,5
6,q60000006_00_1151,アトラクトで敵をひきつけよ,"Use the ""Attract"" skill to get
the enemy's attention",ui\00_message\quest_info\q60000006_00.gmd,\quest\q60000006.arc,q60000006.arc,6
7,q60000006_00_1152,オートガード《抜刀状態》でフォースゲージを溜めろ,Auto-block with your Greatshield,ui\00_message\quest_info\q60000006_00.gmd,\quest\q60000006.arc,q60000006.arc,7
8,q60000006_00_1153,シールドロックでフォースゲージを溜めろ,Block an enemy attack to charge your Force Gauge,ui\00_message\quest_info\q60000006_00.gmd,\quest\q60000006.arc,q60000006.arc,8
9,q60000006_00_1154,ゲージを溜め、フォースバーストで敵を攻撃せよ,"Fill your Force Gauge,
then attack an enemy with Force Burst",ui\00_message\quest_info\q60000006_00.gmd,\quest\q60000006.arc,q60000006.arc,9
12,q60000006_00_1155,最奥にある＜魔盾の証＞を入手する,Collect the proof of completing the trial,ui\00_message\quest_info\q60000006_00.gmd,\quest\q60000006.arc,q60000006.arc,12
13,q60000006_00_1179,白竜神殿のレンテンに経緯を報告する,Report back to Renton in the White Dragon Temple,ui\00_message\quest_info\q60000006_00.gmd,\quest\q60000006.arc,q60000006.arc,13
10,q60000006_00_1249,ゲージを溜め、仲間にフォースエンチャントせよ,Fill in your Force Gauge and Enchant,ui\00_message\quest_info\q60000006_00.gmd,\quest\q60000006.arc,q60000006.arc,10
11,q60000006_00_1250,最深部のゴブリンを全滅せよ,Defeat the remaining Goblins in the inner sanctum,ui\00_message\quest_info\q60000006_00.gmd,\quest\q60000006.arc,q60000006.arc,11
0,q60000007_00_24,狙弓の証　ハンター戦術試練,Hunter Tactics Trial: An Ambushing Bow,ui\00_message\quest_info\q60000007_00.gmd,\quest\q60000007.arc,q60000007.arc,0
1,q60000007_00_24,"ハンターの基本戦術を学ぶため
修練の祠にて試練に挑む","In order to learn the basic tactics of Hunter,
challenge the trial of the Training Chapel",ui\00_message\quest_info\q60000007_00.gmd,\quest\q60000007.arc,q60000007.arc,1
2,q60000007_00_1097,修練の祠前の崖下にいる白衛騎士団員と話す,"Speak with the White Knight at the base
of the cliff before the Training Chapel",ui\00_message\quest_info\q60000007_00.gmd,\quest\q60000007.arc,q60000007.arc,2
3,q60000007_00_1098,修練の祠内のウィルソンと話す,Speak with Wilson in the Training Chapel,ui\00_message\quest_info\q60000007_00.gmd,\quest\q60000007.arc,q60000007.arc,3
4,q60000007_00_1099,弓射ちで敵を攻撃せよ,Attack an enemy with Loose,ui\00_message\quest_info\q60000007_00.gmd,\quest\q60000007.arc,q60000007.arc,4
5,q60000007_00_1156,射撃の最適距離から弓射ちで敵を攻撃せよ,"Attack an enemy with Loose
from the optimum distance",ui\00_message\quest_info\q60000007_00.gmd,\quest\q60000007.arc,q60000007.arc,5
6,q60000007_00_1157,爆矢射ちで敵を攻撃せよ,Attack an enemy with Explosive Arrow,ui\00_message\quest_info\q60000007_00.gmd,\quest\q60000007.arc,q60000007.arc,6
7,q60000007_00_1158,爆矢射ちで仕込んだ矢を起爆させよ,Attack the enemy by detonating the explosive arrow,ui\00_message\quest_info\q60000007_00.gmd,\quest\q60000007.arc,q60000007.arc,7
11,q60000007_00_1159,最奥にある＜狙弓の証＞を入手する,Collect the proof of completing the trial,ui\00_message\quest_info\q60000007_00.gmd,\quest\q60000007.arc,q60000007.arc,11
12,q60000007_00_1178,白竜神殿のレンテンに経緯を報告する,Report back to Renton in the White Dragon Temple,ui\00_message\quest_info\q60000007_00.gmd,\quest\q60000007.arc,q60000007.arc,12
8,q60000007_00_1251,前蹴りで敵を攻撃せよ,Attack an enemy with Front Kick,ui\00_message\quest_info\q60000007_00.gmd,\quest\q60000007.arc,q60000007.arc,8
9,q60000007_00_1252,矢の装填を成功させよ,Reload arrows successfully,ui\00_message\quest_info\q60000007_00.gmd,\quest\q60000007.arc,q60000007.arc,9
10,q60000007_00_1253,最深部のゴブリンを全滅せよ,Defeat the remaining Goblins in the inner sanctum,ui\00_message\quest_info\q60000007_00.gmd,\quest\q60000007.arc,q60000007.arc,10
0,q60000008_00_25,魔攻の証　ソーサラー戦術試練,Sorcer Tactics Trial: A Magick Attack,ui\00_message\quest_info\q60000008_00.gmd,\quest\q60000008.arc,q60000008.arc,0
1,q60000008_00_25,"ソーサラーの基本戦術を学ぶため
修練の祠にて試練に挑む","In order to learn the basic tactics of Sorcerer,
challenge the trial of the Training Chapel",ui\00_message\quest_info\q60000008_00.gmd,\quest\q60000008.arc,q60000008.arc,1
2,q60000008_00_1102,修練の祠内のウィルソンと話す,Speak with Wilson in the Training Chapel,ui\00_message\quest_info\q60000008_00.gmd,\quest\q60000008.arc,q60000008.arc,2
8,q60000008_00_1103,最奥の敵にしがみつきマジッククラッカーで攻撃せよ,"Cling to the enemy in the deeper chamber
and use Magic Cracker",ui\00_message\quest_info\q60000008_00.gmd,\quest\q60000008.arc,q60000008.arc,8
11,q60000008_00_1104,白竜神殿のレンテンに経緯を報告する,Report back to Renton in the White Dragon Temple,ui\00_message\quest_info\q60000008_00.gmd,\quest\q60000008.arc,q60000008.arc,11
3,q60000008_00_1160,敵にマジックボールを3回当てよ,Attack the enemy 3 times with your Magick Ball,ui\00_message\quest_info\q60000008_00.gmd,\quest\q60000008.arc,q60000008.arc,3
4,q60000008_00_1161,敵にマジックトラップを3回成功せよ,Attack the enemy 3 times with Magick Trap,ui\00_message\quest_info\q60000008_00.gmd,\quest\q60000008.arc,q60000008.arc,4
9,q60000008_00_1162,サイクロプスを倒せ,Defeat the Cyclops,ui\00_message\quest_info\q60000008_00.gmd,\quest\q60000008.arc,q60000008.arc,9
10,q60000008_00_1163,最奥にある＜魔攻の証＞を入手する,Collect the proof of completing the trial,ui\00_message\quest_info\q60000008_00.gmd,\quest\q60000008.arc,q60000008.arc,10
6,q60000008_00_1254,魔法を詠唱しロックオフ状態で魔法を放て,Charge a spell with lock-on switched off,ui\00_message\quest_info\q60000008_00.gmd,\quest\q60000008.arc,q60000008.arc,6
5,q60000008_00_1255,詠唱完了状態で移動せよ,"Charge a spell and reposition yourself
when it is fully charged",ui\00_message\quest_info\q60000008_00.gmd,\quest\q60000008.arc,q60000008.arc,5
7,q60000008_00_1278,スペリングで魔法威力を上昇させよ,Increase spell power while chanting,ui\00_message\quest_info\q60000008_00.gmd,\quest\q60000008.arc,q60000008.arc,7
0,q60000009_00_26,魔弓の証　エレメントアーチャー戦術試練,Element Archer Tactics Trial: A Magick Bow,ui\00_message\quest_info\q60000009_00.gmd,\quest\q60000009.arc,q60000009.arc,0
1,q60000009_00_26,"エレメントアーチャーの基本戦術を学ぶため
修練の祠にて試練に挑む","In order to learn the basic tactics
of Element Archer, challenge the trial
of the Training Chapel",ui\00_message\quest_info\q60000009_00.gmd,\quest\q60000009.arc,q60000009.arc,1
2,q60000009_00_1106,修練の祠内のウィルソンと話す,Speak with Wilson in the Training Chapel,ui\00_message\quest_info\q60000009_00.gmd,\quest\q60000009.arc,q60000009.arc,2
3,q60000009_00_1107,闘波の魔眼で敵２体を捉えよ,Capture 2 enemies within Magick Eye: Seeker,ui\00_message\quest_info\q60000009_00.gmd,\quest\q60000009.arc,q60000009.arc,3
15,q60000009_00_1108,白竜神殿のレンテンに経緯を報告する,Report back to Renton in the White Dragon Temple,ui\00_message\quest_info\q60000009_00.gmd,\quest\q60000009.arc,q60000009.arc,15
4,q60000009_00_1164,闘波の矢で敵を攻撃せよ,Attack an enemy with Seeker Arrow,ui\00_message\quest_info\q60000009_00.gmd,\quest\q60000009.arc,q60000009.arc,4
5,q60000009_00_1165,最適距離から闘波の魔眼で敵を３秒以上捉え攻撃せよ,"Get to the optimum distance away
from enemies while using Magick Eye: Seeker,
and attack them for more than 3 seconds.",ui\00_message\quest_info\q60000009_00.gmd,\quest\q60000009.arc,q60000009.arc,5
7,q60000009_00_1166,仲間に助真の魔眼を成功せよ,Lock onto an ally with Magick Eye: True Aid.,ui\00_message\quest_info\q60000009_00.gmd,\quest\q60000009.arc,q60000009.arc,7
8,q60000009_00_1167,仲間の体力を助真の矢で回復せよ,Recover an ally's health with True Aid arrows.,ui\00_message\quest_info\q60000009_00.gmd,\quest\q60000009.arc,q60000009.arc,8
11,q60000009_00_1168,最奥の敵にしがみつき奮わせ直魔矢をせよ,"Cling to the enemy in the deeper chamber
and use Invigorating Magick Arrow.",ui\00_message\quest_info\q60000009_00.gmd,\quest\q60000009.arc,q60000009.arc,11
12,q60000009_00_1169,敵怒り中に助真の構えでシークレットコアを発見せよ,"While the enemy is enraged, reveal its secret core
with Magick Eye: True Aid",ui\00_message\quest_info\q60000009_00.gmd,\quest\q60000009.arc,q60000009.arc,12
13,q60000009_00_1170,サイクロプスを倒せ,Defeat the Cyclops,ui\00_message\quest_info\q60000009_00.gmd,\quest\q60000009.arc,q60000009.arc,13
14,q60000009_00_1177,最奥にある＜魔弓の証＞を入手する,Collect the proof of completing the trial,ui\00_message\quest_info\q60000009_00.gmd,\quest\q60000009.arc,q60000009.arc,14
9,q60000009_00_1256,癒しの装で自分の体力を回復せよ,Recover your health with Healing Shroud.,ui\00_message\quest_info\q60000009_00.gmd,\quest\q60000009.arc,q60000009.arc,9
10,q60000009_00_1257,前蹴りで敵に攻撃せよ,Attack an enemy with Front Kick.,ui\00_message\quest_info\q60000009_00.gmd,\quest\q60000009.arc,q60000009.arc,10
6,q60000009_00_1536,闘波の魔眼の集中力を最大まで溜めて攻撃せよ,"Fully charge a Seeker arrow,
and loose it at an enemy.",ui\00_message\quest_info\q60000009_00.gmd,\quest\q60000009.arc,q60000009.arc,6
0,q60000010_00_27,剛剣の証　ウォリアー戦術試練,Warrior Tactics Trial: A Strong Sword,ui\00_message\quest_info\q60000010_00.gmd,\quest\q60000010.arc,q60000010.arc,0
1,q60000010_00_27,"ウォリアーの基本戦術を学ぶため
修練の祠にて試練に挑む","In order to learn the basic tactics of Warrior,
challenge the trial of the Training Chapel",ui\00_message\quest_info\q60000010_00.gmd,\quest\q60000010.arc,q60000010.arc,1
2,q60000010_00_1110,修練の祠内のウィルソンと話す,Speak with Wilson in the Training Chapel,ui\00_message\quest_info\q60000010_00.gmd,\quest\q60000010.arc,q60000010.arc,2
3,q60000010_00_1111,破斬で敵を攻撃せよ,Attack an enemy with Hack,ui\00_message\quest_info\q60000010_00.gmd,\quest\q60000010.arc,q60000010.arc,3
4,q60000010_00_1171,空破斬で敵を攻撃せよ,Attack an enemy with Aerial Hack,ui\00_message\quest_info\q60000010_00.gmd,\quest\q60000010.arc,q60000010.arc,4
5,q60000010_00_1172,魔人斬りで敵を攻撃せよ,Attack an enemy with Savage Lash,ui\00_message\quest_info\q60000010_00.gmd,\quest\q60000010.arc,q60000010.arc,5
9,q60000010_00_1174,サイクロプスを倒せ,Defeat the Cyclops,ui\00_message\quest_info\q60000010_00.gmd,\quest\q60000010.arc,q60000010.arc,9
10,q60000010_00_1175,最奥にある＜剛剣の証＞を入手する,Collect the proof of completing the trial,ui\00_message\quest_info\q60000010_00.gmd,\quest\q60000010.arc,q60000010.arc,10
11,q60000010_00_1176,白竜神殿のレンテンに経緯を報告する,Report back to Renton in the White Dragon Temple,ui\00_message\quest_info\q60000010_00.gmd,\quest\q60000010.arc,q60000010.arc,11
6,q60000010_00_1258,耐魔の身構えでリベンジゲージを貯めろ,Charge the revenge gauge with Brace.,ui\00_message\quest_info\q60000010_00.gmd,\quest\q60000010.arc,q60000010.arc,6
7,q60000010_00_1259,リベンジゲージ最大の魔人斬りで敵を攻撃せよ,"Attack an enemy with Savage Lash
with a full Revenge Gauge",ui\00_message\quest_info\q60000010_00.gmd,\quest\q60000010.arc,q60000010.arc,7
8,q60000010_00_1260,最奥のサイクロプスにしがみつき魔倒斬りせよ,"Cling to the Cyclops in the deeper chamber
and use Inverse Slash.",ui\00_message\quest_info\q60000010_00.gmd,\quest\q60000010.arc,q60000010.arc,8
0,q60000011_00_77,錬金の証　アルケミスト戦術試練,Alchemist Tactics Trial: Alchemy,ui\00_message\quest_info\q60000011_00.gmd,\quest\q60000011.arc,q60000011.arc,0
1,q60000011_00_77,"アルケミストの基本戦術を学ぶため
修練の祠にて試練に挑む","In order to learn the basic tactics of Alchemist,
challenge the trial of the Training Chapel",ui\00_message\quest_info\q60000011_00.gmd,\quest\q60000011.arc,q60000011.arc,1
2,q60000011_00_1516,修練の祠内のウィルソンと話す,Speak with Wilson in the Training Chapel,ui\00_message\quest_info\q60000011_00.gmd,\quest\q60000011.arc,q60000011.arc,2
3,q60000011_00_1517,アルケムで錬成物質を付着させ、敵の注意を引け,"Attach alchemical stakes to an enemy
with Alchemy, and draw their attention.",ui\00_message\quest_info\q60000011_00.gmd,\quest\q60000011.arc,q60000011.arc,3
4,q60000011_00_1518,クラスターで錬成物質を付着させ、敵の注意を引け,"Attach alchemical stakes to an enemy
using Cluster, and draw their attention.",ui\00_message\quest_info\q60000011_00.gmd,\quest\q60000011.arc,q60000011.arc,4
5,q60000011_00_1519,錬成物質をさらに付着させ、より敵の注意を引け,"Amplify the alchemical stakes by attacking them,
and draw more enemy attention.",ui\00_message\quest_info\q60000011_00.gmd,\quest\q60000011.arc,q60000011.arc,5
6,q60000011_00_1520,アルケム・フーガで敵の攻撃を避けろ,Avoid an enemy attack with Alchemical Fuga,ui\00_message\quest_info\q60000011_00.gmd,\quest\q60000011.arc,q60000011.arc,6
7,q60000011_00_1521,錬成物質を敵に2体以上付着させよ,"Attach two masses of alchemical stakes
to the enemy.",ui\00_message\quest_info\q60000011_00.gmd,\quest\q60000011.arc,q60000011.arc,7
8,q60000011_00_1522,敵に付着した錬成物質をエリクシルで解放せよ,"Unleash the power of the alchemical stakes
on the enemy with Elixir.",ui\00_message\quest_info\q60000011_00.gmd,\quest\q60000011.arc,q60000011.arc,8
10,q60000011_00_1523,サイクロプスを倒せ,Defeat the Cyclops,ui\00_message\quest_info\q60000011_00.gmd,\quest\q60000011.arc,q60000011.arc,10
11,q60000011_00_1524,最奥にある＜錬金の証＞を入手する,Collect the proof of completing the trial,ui\00_message\quest_info\q60000011_00.gmd,\quest\q60000011.arc,q60000011.arc,11
12,q60000011_00_1525,白竜神殿のレンテンに経緯を報告する,Report back to Renton in the White Dragon Temple,ui\00_message\quest_info\q60000011_00.gmd,\quest\q60000011.arc,q60000011.arc,12
9,q60000011_00_1526,最奥の敵にしがみつきコンクラスターで攻撃せよ,"Cling to the enemy in the deeper chamber
and attack them with Concluster.",ui\00_message\quest_info\q60000011_00.gmd,\quest\q60000011.arc,q60000011.arc,9
0,q60000012_00_15,覚者の甲斐性,The Arisen's Abilities,ui\00_message\quest_info\q60000012_00.gmd,\quest\q60000012.arc,q60000012.arc,0
1,q60000012_00_15,"覚者ファビオの教示に応えるため
宿場区にいるアーチボルトに挨拶に行く","Go speak to Archibald in the Relay District
to further Fabio's training.",ui\00_message\quest_info\q60000012_00.gmd,\quest\q60000012.arc,q60000012.arc,1
7,q60000012_00_1113,クエストボードの依頼を1つ受注する,Accept a quest from the Quest Board,ui\00_message\quest_info\q60000012_00.gmd,\quest\q60000012.arc,q60000012.arc,7
11,q60000012_00_1114,ファビオに経緯を報告する,Report back to Fabio,ui\00_message\quest_info\q60000012_00.gmd,\quest\q60000012.arc,q60000012.arc,11
6,q60000012_00_1203,ファビオに報告をする,Report back to Fabio,ui\00_message\quest_info\q60000012_00.gmd,\quest\q60000012.arc,q60000012.arc,6
3,q60000012_00_1204,宿場区にいるアーチボルトに挨拶する,"Introduce yourself to Archibald
at the Relay Station District",ui\00_message\quest_info\q60000012_00.gmd,\quest\q60000012.arc,q60000012.arc,3
10,q60000012_00_1279,保管ボックスの《報酬受け取り》を確認する,"Check the ""Rewards"" of the Storage Box",ui\00_message\quest_info\q60000012_00.gmd,\quest\q60000012.arc,q60000012.arc,10
9,q60000012_00_1292,ファビオに依頼クリアの報告をする,Report the quest clear to Fabio,ui\00_message\quest_info\q60000012_00.gmd,\quest\q60000012.arc,q60000012.arc,9
4,q60000012_00_1528,転職／戦技の付替えでカスタムスキルをセットする,"Equip a Skill via the Change Vocation/Skills
menu at Archibald",ui\00_message\quest_info\q60000012_00.gmd,\quest\q60000012.arc,q60000012.arc,4
5,q60000012_00_1529,もう一度アーチボルトに話しかける,Speak with Archibald again,ui\00_message\quest_info\q60000012_00.gmd,\quest\q60000012.arc,q60000012.arc,5
8,q60000012_00_1530,受注したボードクエストを１つクリアする,Complete a quest from the Quest Board,ui\00_message\quest_info\q60000012_00.gmd,\quest\q60000012.arc,q60000012.arc,8
2,q60000012_00_1531,ファビオのもとへ向かう,Seek out Fabio,ui\00_message\quest_info\q60000012_00.gmd,\quest\q60000012.arc,q60000012.arc,2
12,q60000012_00_1538,オンラインショップで指定の商品を無料購入する,"Purchase the designated item
from the Online Shop for free.",ui\00_message\quest_info\q60000012_00.gmd,\quest\q60000012.arc,q60000012.arc,12
13,q60000012_00_2794,ファビオに報告をする,Report back to Fabio,ui\00_message\quest_info\q60000012_00.gmd,\quest\q60000012.arc,q60000012.arc,13
0,q60000013_00_16,神殿の商い人,The Temple's Tradespeople,ui\00_message\quest_info\q60000013_00.gmd,\quest\q60000013.arc,q60000013.arc,0
1,q60000013_00_16,"キャメロンの頼みを聞き入れ
神殿内の仕入れ作業についての相談に乗る","Listen to Cameron's request and assist
with the procurement work inside the temple.",ui\00_message\quest_info\q60000013_00.gmd,\quest\q60000013.arc,q60000013.arc,1
2,q60000013_00_1115,商店区のファーガソンに話を聞く,Listen to Ferguson in the Shopping District,ui\00_message\quest_info\q60000013_00.gmd,\quest\q60000013.arc,q60000013.arc,2
3,q60000013_00_1116,商店区のキトリッジに話を聞く,Listen to Kittridge in the Shopping District,ui\00_message\quest_info\q60000013_00.gmd,\quest\q60000013.arc,q60000013.arc,3
4,q60000013_00_1117,中央広場のオフィリアに話を聞く,Listen to Ophelia in the Temple Square,ui\00_message\quest_info\q60000013_00.gmd,\quest\q60000013.arc,q60000013.arc,4
8,q60000013_00_1118,バートンに＜ケモノ生肉＞1個を渡す,Deliver the Beast-Steak to Barton,ui\00_message\quest_info\q60000013_00.gmd,\quest\q60000013.arc,q60000013.arc,8
9,q60000013_00_1286,キャメロンに経緯を報告する,Report back to Cameron,ui\00_message\quest_info\q60000013_00.gmd,\quest\q60000013.arc,q60000013.arc,9
5,q60000013_00_1381,宿場区のバートンに話を聞く,Listen to Barton in the Relay Station District,ui\00_message\quest_info\q60000013_00.gmd,\quest\q60000013.arc,q60000013.arc,5
6,q60000013_00_1501,宿場区のメルから情報を得る,"Obtain information from Mel
in the Relay Station District",ui\00_message\quest_info\q60000013_00.gmd,\quest\q60000013.arc,q60000013.arc,6
7,q60000013_00_1502,素材屋を探し＜ケモノ生肉＞1個を入手する,Purchase a Beast-Steak from the Material Shop,ui\00_message\quest_info\q60000013_00.gmd,\quest\q60000013.arc,q60000013.arc,7
0,q60000014_00_17,確かな情報源,Reliable Source of Information,ui\00_message\quest_info\q60000014_00.gmd,\quest\q60000014.arc,q60000014.arc,0
1,q60000014_00_17,"イリスからの紹介を受けて
レスタニアニュースを伝えるセネカの
ニュース内容が正しいものであることを確認する","Check that the news provided by Seneka,
through Iris's introduction, about Lestania is true",ui\00_message\quest_info\q60000014_00.gmd,\quest\q60000014.arc,q60000014.arc,1
7,q60000014_00_1119,ハイデル平原のワールドクエストを１回クリアする,Complete a World Quest in Hidell Plains,ui\00_message\quest_info\q60000014_00.gmd,\quest\q60000014.arc,q60000014.arc,7
9,q60000014_00_1120,セネカに経緯を報告する,Report back to Seneka,ui\00_message\quest_info\q60000014_00.gmd,\quest\q60000014.arc,q60000014.arc,9
4,q60000014_00_1210,テル村のアルフレドに話を聞く,Go to Tel and hear what Alfred has to say,ui\00_message\quest_info\q60000014_00.gmd,\quest\q60000014.arc,q60000014.arc,4
5,q60000014_00_1498,エリア情報の＜ワールドクエスト情報＞を確認する,"Check the available World Quests
in Area Information",ui\00_message\quest_info\q60000014_00.gmd,\quest\q60000014.arc,q60000014.arc,5
6,q60000014_00_1499,再度、アルフレドに話をする,Speak to Alfred again,ui\00_message\quest_info\q60000014_00.gmd,\quest\q60000014.arc,q60000014.arc,6
8,q60000014_00_1500,アルフレドに問題解決を伝える,Report back to Alfred,ui\00_message\quest_info\q60000014_00.gmd,\quest\q60000014.arc,q60000014.arc,8
2,q60000014_00_1532,＜レスタニアニュース＞を確認する,Check Lestania News,ui\00_message\quest_info\q60000014_00.gmd,\quest\q60000014.arc,q60000014.arc,2
3,q60000014_00_1533,もう一度セネカに話しかける,Speak with Seneka again,ui\00_message\quest_info\q60000014_00.gmd,\quest\q60000014.arc,q60000014.arc,3
10,q60000014_00_1541,謁見の間に行き、再びイリスに会う,Go back to the Audience Chamber and report to Iris,ui\00_message\quest_info\q60000014_00.gmd,\quest\q60000014.arc,q60000014.arc,10
0,q60000015_00_48,レスタニアの着飾り美人,Lestania's Best Dressed,ui\00_message\quest_info\q60000015_00.gmd,\quest\q60000015.arc,q60000015.arc,0
1,q60000015_00_48,"オフィリアの依頼を聞き入れ
最近、街でよく見かけるようになった
お洒落でハイセンスな着こなし上手の
覚者が増えた理由を探る","Accept Ophelia's request and investigate 
the reason for the increase in fashion-savvy
and stylish Arisen that have been
frequently seen in the city lately.",ui\00_message\quest_info\q60000015_00.gmd,\quest\q60000015.arc,q60000015.arc,1
2,q60000015_00_1280,宿場区にいるメルに話を聞く,Talk to Mel in the Relay Station District,ui\00_message\quest_info\q60000015_00.gmd,\quest\q60000015.arc,q60000015.arc,2
4,q60000015_00_1281,商店区にいるコーネリアに話を聞く,Talk to Cornelia in the shopping district,ui\00_message\quest_info\q60000015_00.gmd,\quest\q60000015.arc,q60000015.arc,4
3,q60000015_00_1282,クラフトルームにいるソニアに話を聞く,Speak with Sonia in the Craft Room,ui\00_message\quest_info\q60000015_00.gmd,\quest\q60000015.arc,q60000015.arc,3
5,q60000015_00_1283,森林の一軒家のエメラダに話を聞く,"Talk to Emerada, the woman living in
the Lone House in the Forest",ui\00_message\quest_info\q60000015_00.gmd,\quest\q60000015.arc,q60000015.arc,5
6,q60000015_00_1284,＜魔力のスクロール＞を5個集める,Collect 5 Scrolls of Sorcery,ui\00_message\quest_info\q60000015_00.gmd,\quest\q60000015.arc,q60000015.arc,6
7,q60000015_00_1285,エメラダに＜魔力のスクロール＞を5個渡す,Hand over 5 Scrolls of Sorcery to Emerada,ui\00_message\quest_info\q60000015_00.gmd,\quest\q60000015.arc,q60000015.arc,7
0,q60000016_00_18,クラフトで伝える心,Crafted Token of the Heart,ui\00_message\quest_info\q60000016_00.gmd,\quest\q60000016.arc,q60000016.arc,0
1,q60000016_00_18,"イリスの依頼を聞き入れ
ポーンのクラフト能力を用いアイテムを生産する","Accepting Iris's request, use the crafting abilities
of Pawns to produce items.",ui\00_message\quest_info\q60000016_00.gmd,\quest\q60000016.arc,q60000016.arc,1
5,q60000016_00_1121,ソニアに話して＜そよかぜのリング＞を作成する,"Speak to Sonia and craft a ""Zephyr Ring""",ui\00_message\quest_info\q60000016_00.gmd,\quest\q60000016.arc,q60000016.arc,5
