0,TUTORIAL_STEP_354,"<COL ffdc78>ポーンと旅をする上で、特に戦闘時
とても重要になるのが《ポーン命令》です</COL>
回復の要請、エンチャントの要請、
追従指示、待機指示、特定スキルの発動など
プレイヤーが必要に応じた命令をくだす
ことで、よりポーンとの共闘を
有利に運ぶことができます","<COL ffdc78>When traveling with a Pawn, it is
particularly important in combat to give Pawn
orders. </COL>
Requesting recovery, requesting enchantments,
giving follow commands, standby commands,
activating specific skills, etc.
By giving orders that respond to the player's
needs, you can effectively cooperate with Pawns
and gain an advantage in battle.",ui\00_message\tutorial_guide\steps\tutorial_guide_step224.gmd,\tguide\tutorial_guide_224.arc,tutorial_guide_224.arc,0
1,TUTORIAL_STEP_355,"ポーン命令は【<KC UI_GAME_MENU>】ゲームメニュー
《キャラクター》の<COL ffdc78>《ポーン命令》</COL>から
行えます
ただし、戦闘時とっさに命令を下すには
【<KC UI_SC_COMMU>】簡易コミュニケーションに
ショートカット登録しておくことをおすすめします","Pawn orders can be performed from <COL
ffdc78>Pawn orders</COL> in the game menu<KC
UI_GAME_MENU> of the character tab.
However, it is recommended to register them in
the <KC UI_SC_COMMU>Shortcut Bar for quick command
during combat.",ui\00_message\tutorial_guide\steps\tutorial_guide_step224.gmd,\tguide\tutorial_guide_224.arc,tutorial_guide_224.arc,1
0,TUTORIAL_STEP_356,"他の覚者とパーティーを組んで
冒険している場合
<COL ffdc78>パーティーリーダーがリム転移を行うと
他のメンバーも転移先へ同行できます</COL>
転移勧誘のお知らせがきたら
行き先が同じ場合、ゲームメニューの
<COL ffdc78>《リム転移》から《パーティー同行リム転移》</COL>
を選びましょう","If you are adventuring with other Arisen, when
the <COL ffdc78>party leader performs a Rift
Teleport, the other members can also accompany
them to the destination.</COL>
When you receive a <COL ffdc78>Rift Teleport
invitation, if the destination is the same, select
""Rift Teleport with Party"" from the ""Rift
Teleport"" option in the game menu.</COL>",ui\00_message\tutorial_guide\steps\tutorial_guide_step226.gmd,\tguide\tutorial_guide_226.arc,tutorial_guide_226.arc,0
1,TUTORIAL_STEP_357,"さらに特定の<OPCS>発動中は
<COL ffdc78>解放した礎すべてがゲームメニューの
《リム転移》で選べるようになるほか、
「マイ拠点」へのリムは無料となり
その他の礎へ行く時も大幅に割り引きされます</COL>","Furthermore, while the specific <OPCS> are
active, <COL ffdc78>all released Rift Crystals can
be selected in the Game Menu's ""Rift Teleport"" and
going to ""Favorites"" becomes free. Additionally,
there is a significant discount when going to
other locations.</COL>",ui\00_message\tutorial_guide\steps\tutorial_guide_step226.gmd,\tguide\tutorial_guide_226.arc,tutorial_guide_226.arc,1
0,TUTORIAL_STEP_360,"エクストリームミッションなど特定コンテンツを
なんらかの事情でやむなく途中離脱したい場合、
ゲームメニュー《クエスト》の<COL ffdc78>《コンテンツ中断》</COL>
から参加しているパーティーメンバーに
コンテンツ途中離脱の提案が行えます
<COL ffdc78>メンバーから提案があった時は
《ワールドアナウンス》で通知が届きます</COL>","If you want to withdraw from specific content,
such as Extreme Missions, for some reason, you can
propose to <COL ffdc78>Exit Content</COL> to the
party members participating from ""Quest"" in the
game menu.
<COL ffdc78>When a proposal is made by a member,
you will receive a notification via ""World
Announcement"".</COL>",ui\00_message\tutorial_guide\steps\tutorial_guide_step227.gmd,\tguide\tutorial_guide_227.arc,tutorial_guide_227.arc,0
1,TUTORIAL_STEP_361,"<COL ffdc78>途中離脱するかしないかは
パーティーメンバーの投票で決まり
投票者中、過半数を占めた方が採用されます</COL>
離脱の提案アナウンスが届いた場合は
【<KC UI_GAME_MENU>】ゲームメニューで【<KC UI_X>】
を押し、投票画面を呼び出して投票してください","<COL ffdc78>Whether to withdraw or not depends on
the votes of the party members. If you receive a
withdrawal proposal, please press 【<KC
UI_GAME_MENU>】 in the game menu and vote on the
voting screen.</COL>",ui\00_message\tutorial_guide\steps\tutorial_guide_step227.gmd,\tguide\tutorial_guide_227.arc,tutorial_guide_227.arc,1
2,TUTORIAL_STEP_362,"なお、投票は一定時間で締め切られるため
ご注意ください
反対多数で提案が拒否された場合は
一定時間、再提案できなくなりますので
その点もご留意ください","Please note that voting will be closed after a
certain amount of time.
If the proposal is rejected by a majority vote,
it will not be eligible for reconsideration for a
certain period of time. Please also keep this in
mind.",ui\00_message\tutorial_guide\steps\tutorial_guide_step227.gmd,\tguide\tutorial_guide_227.arc,tutorial_guide_227.arc,2
0,TUTORIAL_STEP_363,"ポーンがロストしてポーン郷にある
《異界の狭間》へ送られてしまった場合は
その深部、<COL ffdc78>《囚われし戦徒の間》</COL>へ向かいましょう
<COL ffdc78>そこであなたのポーンは《ポーンクラッシャー》
という敵に襲われています
その敵を倒し救出することで
ポーンは自由を取り戻すことができます</COL>","If your Pawn is lost and sent to the The Rift in
the Pawn Cathedral, make your way to the depths of
the ""The Rift,"" marked as <COL ffdc78>""The Space
between Captives and Myrmidons""</COL>.
<COL ffdc78>There, your Pawn is being attacked by
an enemy called the ""Pawn Crusher."" Defeat this
enemy and rescue your Pawn to regain their
freedom.</COL>",ui\00_message\tutorial_guide\steps\tutorial_guide_step229.gmd,\tguide\tutorial_guide_229.arc,tutorial_guide_229.arc,0
1,TUTORIAL_STEP_364,"救出に成功したポーンは奥の<COL ffdc78>《リムの淵辺》</COL>
で話しかけると復活し、再呼び出し可能になります
救出に失敗した場合や、助けず通り過ぎた場合、
また複数のメインポーンがロストしている時は
ポーン達は呪縛された状態で《リムの淵辺》に
囚われています
<COL ffdc78>呪縛状態でも《復活力》や《黄金石》を与える
ことで復活し、再呼び出し可能になります</COL>","If you successfully rescue the pawn, you can
revive them by talking to them at the <COL
ffdc78>Depths of the Rift.</COL> After that, they
will be available for summoning again.
If you fail to rescue them or pass by without
helping or when multiple main pawns are lost, the
pawns will be trapped at the Depths of the Rift in
a cursed state.
<COL ffdc78>Even in a cursed state, they can be
revived and summoned again by giving them Revival
Force or Golden Gemstones.</COL>",ui\00_message\tutorial_guide\steps\tutorial_guide_step229.gmd,\tguide\tutorial_guide_229.arc,tutorial_guide_229.arc,1
0,TUTORIAL_STEP_365,"マップを使う上でなにかと便利なのが
自由に目印を置ける<COL ffdc78>《フリーマーカー》</COL>機能です
＜フリーマーカー＞　
　【<KC UI_MAP_FREEMARKER>】設置／消去（長押し）
フリーマーカーは拡大時のミニマップのほか、
《詳細マップ》と《フィールドマップ》で
使用できます","One convenient feature when using the map is the
ability to freely place markers. This is the
<COL ffdc78>《Waypoint》</COL>function.
＜Waypoint＞
【<KC UI_MAP_FREEMARKER>】Set / Remove (Long press)
Waypoints can be used on the minimap when zoomed
in, as well as on the
《Local》 and 《Field》maps.",ui\00_message\tutorial_guide\steps\tutorial_guide_step230.gmd,\tguide\tutorial_guide_230.arc,tutorial_guide_230.arc,0
1,TUTORIAL_STEP_366,"エリアマスターのスポット情報を見た時に
向かいたい《魔物警戒スポット》場所に
目印として打ったり
ワールドクエストを発見した時に
場所を忘れないため打っておくなど
使い道はさまざまです
目的に合わせて活用しましょう","When you see the spot information of the Area
Master, you can use it in various ways depending
on your purpose,
such as putting a mark as a sign to the ""Monster
Caution Spot"" you want to go to, or typing it in
to remember the location when you discover a World
Quest.
Let's make use of it according to your needs.",ui\00_message\tutorial_guide\steps\tutorial_guide_step230.gmd,\tguide\tutorial_guide_230.arc,tutorial_guide_230.arc,1
0,TUTORIAL_STEP_367,"レスタニアニュースでまだ公開されていない
<COL ffdc78>《未公開のワールドクエスト》に
ついての情報は、各エリアの《エリアマスター》
に話しかけることで《ワールドクエスト情報》
から購入できます</COL>
推奨レベルを確認し、挑戦したい
ワールドクエストの情報を購入しましょう
また、公開済み情報も同時に確認できます","Information about <COL ffdc78>Hidden World Quests</COL> 
that have not yet been published in
Lestania News can be purchased from 
<COL ffdc78>World Quest Information</COL> by talking 
to the <COL ffdc78>Area Master</COL> in each area.
Check the recommended level and 
purchase information about the World 
Quest you want to try.
You can also check the published 
information at the same time!",ui\00_message\tutorial_guide\steps\tutorial_guide_step231.gmd,\tguide\tutorial_guide_231.arc,tutorial_guide_231.arc,0
1,TUTORIAL_STEP_368,"受注場所、倒すべき魔物といった
クエスト目的、そしてクリア時の報酬など
さまざまな情報が確認できます
ワールドクエスト情報を利用して
多くの未公開クエストに挑戦しましょう","You can check various information such as
the location of the order, the monsters
to defeat, the quest objectives, and the 
rewards upon completion.
Use the World Quest information to 
challenge many undiscovered quests.",ui\00_message\tutorial_guide\steps\tutorial_guide_step231.gmd,\tguide\tutorial_guide_231.arc,tutorial_guide_231.arc,1
0,TUTORIAL_STEP_369,"ワールドクエストは常に起こっている
わけではありません
配信期間が終了すると
自動的にクエストは破棄されます
<COL ffdc78>ただし期間中は何度でも受注・クリア可能です
繰り返し挑むことで、報酬に《繰り返しボーナス》が
つくことがあるため、ぜひ狙ってみましょう<COL ffdc78>","World Quests are not constantly happening. 
They will be automatically discarded when 
the event period ends.
However, you can accept and clear them as 
many times as you want during the period.
By attempting them repeatedly, you may 
receive a <COL ffdc78>Repeat Bonus</COL> as a reward, 
so let's aim for it!",ui\00_message\tutorial_guide\steps\tutorial_guide_step232.gmd,\tguide\tutorial_guide_232.arc,tutorial_guide_232.arc,0
0,TUTORIAL_STEP_370,"エリアランクが上がると、時として新たな
強敵が<COL ffdc78>《魔物警戒スポット》</COL>に登場します
<COL ffdc78>そういった強敵には固有の名前がついており
討伐すると高グレードの装備や珍しいアイテムを
手に入れることができます</COL>","When ""Area Rank"" rises, sometimes a
<COL ffdc78>""Monster Warning Message""</COL>might
appear.
<COL ffdc78>These powerful monsters have unique
names.
And by killing them you can get rare items
or high grade equipment.</COL>",ui\00_message\tutorial_guide\steps\tutorial_guide_step233.gmd,\tguide\tutorial_guide_233.arc,tutorial_guide_233.arc,0
1,TUTORIAL_STEP_371,"それらエリアの強敵は、フィールドの
専用ロケーションや封鎖ダンジョンの奥などで
待ち構えています
時にはエリア試練クエストの討伐対象になる
こともあるため、十分準備して挑みましょう","These Powerful enemies
wait in special areas in the field or in deep
dungeons.
Because it's likely to become the target of a
quest,
Always be well prepared to challenge them!",ui\00_message\tutorial_guide\steps\tutorial_guide_step233.gmd,\tguide\tutorial_guide_233.arc,tutorial_guide_233.arc,1
0,TUTORIAL_STEP_49,"<COL ffdc78>《オーブエネミー》</COL>と呼ばれる魔物を討伐
すると、その敵の強さに応じた数の
《ブラッドオーブ》が入手できます
<COL ffdc78>《オーブエネミー》は通常の敵と異なり
ＨＰゲージが紫色をしています</COL>
周囲の敵と比べてやや強い難敵ですが
発見したら果敢に挑みましょう","Defeat the monsters called <COL ffdc78>""Blood Orb
Enemies""</COL>, and you will obtain a number of
""Blood Orbs"" corresponding to the strength of the
enemy.
<COL ffdc78>Unlike regular enemies, the ""Blood
Orb Enemies"" have a purple HP gauge.</COL>
They are slightly stronger and more challenging
than the surrounding enemies, but let's bravely
face them when we come across them.",ui\00_message\tutorial_guide\steps\tutorial_guide_step234.gmd,\tguide\tutorial_guide_234.arc,tutorial_guide_234.arc,0
1,TUTORIAL_STEP_372,"オーブエネミーは、フィールド上では
滅多に遭遇することがありません
討伐を狙うのであれば
<COL ffdc78>エリアマスターが管理する封鎖ダンジョン</COL>に
多く潜んでいるため、そういったスポットに
足を運ぶとよいでしょう","Blood Orb Enemies are rarely encountered in the
field.
If you are aiming to defeat them, it is
recommended to visit <COL ffdc78>Blocked Dungeons
managed by Area Masters</COL> where they are often
hidden.",ui\00_message\tutorial_guide\steps\tutorial_guide_step234.gmd,\tguide\tutorial_guide_234.arc,tutorial_guide_234.arc,1
1,TUTORIAL_STEP_94,"＜押さえつけ＞
小型の敵がのけぞったりダウンした時に
行うことで、敵を長時間拘束できます
拘束された敵へのダメージは大幅アップします
　　のけぞり／ダウン中の小型敵に　【<KC TOUCH>】
　　　（解除は【<KC JUMP>】）
　　※拘束中はスタミナを消費","<Hold Down>
By performing this action when a small enemy
staggers or is knocked down, you can restrain them
for a long period of time. The damage dealt to
restrained enemies is significantly increased.
Perform 【<KC TOUCH>】 on small enemies while they
are staggered/down
(Release with 【<KC JUMP>】)
※ Stamina is consumed while restraining the enemy",ui\00_message\tutorial_guide\steps\tutorial_guide_step235.gmd,\tguide\tutorial_guide_235.arc,tutorial_guide_235.arc,1
0,TUTORIAL_STEP_373,"２人以上で連係し行うアクション
<COL ffdc78>《連係投げ》</COL>と<COL ffdc78>《押さえつけ》</COL>を覚えることで
パーティープレイの幅が広がります
＜連係投げ＞
近接アタッカーが自らジャンプ台となり
高所や敵の頭上に仲間を跳ね上げます
　　連係投げ体勢：　【<KC CATAPULT>】
　　高所ジャンプ：投げ体勢の味方に　【<KC TOUCH>】","When two or more people work together and
coordinate their actions, they can use the skills
of <COL ffdc78>""Linking Throw""</COL> and <COL
ffdc78>""Hold Down,""</COL> which will expand the
possibilities of party play.
""Linking Throw"" is when a close-range attacker
becomes a jumping platform and launches a teammate
up to high places or above enemies' heads.
- Linking Throw Stance: [<KC CATAPULT>]
- High Jump: [<KC TOUCH>] on a teammate in
throwing stance",ui\00_message\tutorial_guide\steps\tutorial_guide_step235.gmd,\tguide\tutorial_guide_235.arc,tutorial_guide_235.arc,0
0,TUTORIAL_STEP_375,"<COL ffdc78>各エリアマスターの元を訪れると
１週間に１度《支援品》を受け取ることができます</COL>
有用なアイテムを無料で入手できるため
忘れず受け取るようにしましょう
また、白竜神殿内であれば《ゲームメニュー》の
エリアリストから各エリアの支援品を
直接受け取ることができます","<COL ffdc78>When you visit each Area Master, you
can receive《support goods》once a week.</COL>
Make sure to receive them without forgetting, as
you can obtain useful items for free.
Also, if you are in the White Dragon Temple, you
can directly receive the support goods of each
area from the Area List in the Game Menu.",ui\00_message\tutorial_guide\steps\tutorial_guide_step236.gmd,\tguide\tutorial_guide_236.arc,tutorial_guide_236.arc,0
1,TUTORIAL_STEP_376,"<COL ffdc78>また、《支援品》はその週に溜めた
エリアポイントにより、翌週の支援品内容が
良くなったり貰える個数が増加します</COL>
さらにエリアランクが上がることで
支援アイテムはよりグレードアップします
エリア名声度を上げ、週毎のポイントを
溜めて良いアイテム入手を目指しましょう","<COL ffdc78>Also, the ""support goods"" will
improve in quality or the number of items received
will increase based on the accumulated area points
for that week. </COL>
Furthermore, as the area rank increases, the
support items will be upgraded.
Let's increase the area reputation and accumulate
points each week to aim for better item
acquisition.",ui\00_message\tutorial_guide\steps\tutorial_guide_step236.gmd,\tguide\tutorial_guide_236.arc,tutorial_guide_236.arc,1
0,TUTORIAL_STEP_377,"《ウォーミッション》は各コンテンツの
累計取得DPによる<COL ffdc78>ランキング</COL>に対応しています。
参加するとリザルト時に得られる<COL ffdc78>《スコア》</COL>によって
他の覚者と順位を競うことができます
１度でもスコアが獲得できていれば、
本作戦期間中の中間集計時と、戦果分析期間後に
<COL ffdc78>神殿の《ランキングボード》と
《レスタニアニュース》にその名が記され、
自身の順位を確認できます</COL>","""War Missions"" supports a <COL
ffdc78>ranking</COL> based on the cumulative DP
acquired in each content.
By participating, you can compete with other
Arisen for rankings based on the <COL
ffdc78>""Score""</COL> obtained during the result
announcement.
If you have acquired a score even once, your name
will be listed on the <COL ffdc78>Temple's
""Ranking Board"" and in the Lestania News</COL>
during the tally in the mission period and after
the battle analysis period. Look there to check
your ranking.",ui\00_message\tutorial_guide\steps\tutorial_guide_step237.gmd,\tguide\tutorial_guide_237.arc,tutorial_guide_237.arc,0
1,TUTORIAL_STEP_378,"戦果分析期間後に発表されるランキングで
見事上位ランクインを果たした覚者には
<COL ffdc78>特別なアイテム</COL>がDPショップで
購入できるようになります。
ウォーミッションは、本作戦期間中なら
何度でも挑むことができますので
より効率的な攻略や、大物の討伐を狙って
上位ランクインを目指しましょう","After the battle analysis period, the
accomplished Arisen who have achieved a remarkable
rank will be able to purchase a <COL
ffdc78>special item</COL> at the DP Shop.
You can challenge War Missions as many times as
you want during this operation period, so aim for
a higher rank to efficiently conquer and subdue
formidable enemies.",ui\00_message\tutorial_guide\steps\tutorial_guide_step237.gmd,\tguide\tutorial_guide_237.arc,tutorial_guide_237.arc,1
0,TUTORIAL_STEP_379,"ワールドクエストやボードクエストをこなして
地域の問題解決に貢献すると、エリアでの
名声値<COL ffdc78>《エリアポイント》</COL>が溜まります
《エリアポイント》が一定に達すると、地域の
名声度<COL ffdc78>《エリアランク》</COL>が上がります</COL>
<COL ffdc78>エリアランクが上がることで
封鎖区域の開放、支援品の向上、新たな強敵の
登場といった変化が発生します</COL>","By completing World Quests and Board Quests, 
you can contribute to solving regional problems 
and accumulate <COL ffdc78>Area Points.</COL>
When you reach a certain amount of Area Points,
the <COL ffdc78>Area Rank</COL> of the region will increase.
<COL ffdc78>As the Area Rank increases, changes such as 
the opening of blocked areas, improvement 
of support goods, and the appearance of new 
powerful enemies will occur.</COL>",ui\00_message\tutorial_guide\steps\tutorial_guide_step238.gmd,\tguide\tutorial_guide_238.arc,tutorial_guide_238.arc,0
1,TUTORIAL_STEP_380,"各エリアのランクと現在のポイントは
【<KC UI_GAME_MENU>】ゲームメニュー
《ワールド》の<COL ffdc78>《エリアリスト》</COL>から確認できます
ポイントが溜まったらエリアマスターの元を
訪れ、《エリア情報》を選びましょう
そうすることでエリアランクが上がります
各地のクエストをこなしてエリアランクを上げ
冒険の幅を増やしましょう","The rank and current points of each area 
can be checked in the [<KC UI_GAME_MENU>] Game Menu. 
You can find them in the <COL ffdc78>Area List</COL> in the 
<COL ffdc78>World</COL> section.
Once you have accumulated enough points, visit 
the Area Master and choose <COL ffdc78>Area Information</COL>.
This will increase your area rank.
Complete quests in various areas to increase 
your area rank and expand your 
adventure.",ui\00_message\tutorial_guide\steps\tutorial_guide_step238.gmd,\tguide\tutorial_guide_238.arc,tutorial_guide_238.arc,1
2,TUTORIAL_STEP_412,"<COL ffdc78>ただし、エリアランクは自身が
パーティーリーダーの時にしか
ランクアップできません</COL>
また、条件にエリア試練クエスト
のクリアが必要な場合もあります
他プレイヤーのパーティーにゲストとして参加
している場合は、リーダー覚者のエリアランクが
反映されるためご留意ください","<COL ffdc78>However, your Area Rank can only be
increased when you are the party leader. </COL>
In some cases, clearing Area Trial may 
be a requirement.
Please note that if you are joining another
player's party as a guest, the leader's Area 
Rank will be reflected.",ui\00_message\tutorial_guide\steps\tutorial_guide_step238.gmd,\tguide\tutorial_guide_238.arc,tutorial_guide_238.arc,2
0,TUTORIAL_STEP_381,"これらのゲーム説明は【<KC UI_GAME_MENU>】ゲームメニュー
《ワールド》の<COL ffdc78>《チュートリアルガイド》</COL>から
再確認できます
カテゴリー別にゲームの各種情報が
いつでも見られますので
迷った時はまず目を通してみましょう","This game info can be found again in the 
[<KC UI_GAME_MENU>] Game Menu,in the <COL ffdc78>Tutorial Guide</COL> 
under World.
Game info is categorized and viewable 
anytime.
If you get stuck, start by checking there!",ui\00_message\tutorial_guide\steps\tutorial_guide_step239.gmd,\tguide\tutorial_guide_239.arc,tutorial_guide_239.arc,0
0,TUTORIAL_STEP_382,"一定のクラフトレベルに達したメインポーンは
<COL ffdc78>《クラフトレベル昇格試験》</COL>に挑むことが
できます
示された<COL ffdc78>《昇格試験レシピ》</COL>のクラフトに
成功すれば、クラフトレベルの上限が引き上げられ
ポーンのクラフト技術を
より高めることができるようになります","Once your Main Pawn has reached a certain
crafting level, they can challenge the <COL
ffdc78>Crafting Level Test</COL>.
By successfully crafting the given <COL
ffdc78>Promotion Test Recipe</COL>, the upper
limit of their craft level will be raised,
allowing them to further enhance their crafting
abilities.",ui\00_message\tutorial_guide\steps\tutorial_guide_step240.gmd,\tguide\tutorial_guide_240.arc,tutorial_guide_240.arc,0
1,TUTORIAL_STEP_383,"<COL ffdc78>昇格試験をクリアしなければそれ以上に
クラフトレベルは上がらず、クラフト経験値も
入らなくなるため注意しましょう</COL>","<COL ffdc78>If you don't clear the promotion
exam, your Craft Level will not increase, and
Craft EXP will not be obtained. Please be
careful.</COL>",ui\00_message\tutorial_guide\steps\tutorial_guide_step240.gmd,\tguide\tutorial_guide_240.arc,tutorial_guide_240.arc,1
0,TUTORIAL_STEP_384,"名声度《エリアランク》が一定に達すると
地域の問題により深く関わるパーソナルクエスト
<COL ffdc78>《エリア試練クエスト》</COL>が発生します
さらにエリア名声度を上げるには
ポイントの蓄積だけではなく
試練クエストのクリアが必要です
提示された強敵討伐や封鎖ダンジョン攻略に
十分準備して挑みましょう","Once the reputation level ""Area Rank"" reaches a
certain threshold, you will become more deeply
involved in local issues through Personal Quests.
Area Quests, known as <COL ffdc78>""Area
Quests,""</COL> will also arise.
To increase your Area Reputation, it is not just
about accumulating points. Clearing Area Quests is
also necessary.
Prepare adequately and take on challenges such as
defeating powerful enemies and conquering sealed
dungeons.",ui\00_message\tutorial_guide\steps\tutorial_guide_step241.gmd,\tguide\tutorial_guide_241.arc,tutorial_guide_241.arc,0
