1,TUTORIAL_STEP_631,"＜マンドラゴラの育成＞

マンドラゴラの育成を行うと
《ボーナスダンジョンチケット》などの
アイテムを作成することができます

マンドラゴラの育成には
《作るもの》と《肥料》を選ぶ必要があり、
育成完了には18時間かかります","<Mandragora Cultivation>

By cultivating Mandragoras, you can create items
such as ""Bonus Dungeon Tickets"".

To cultivate Mandragoras, you need to choose the
""Crafting item"" and ""Fertilizer"".
It takes 18 hours to complete the cultivation.",ui\00_message\tutorial_guide\steps\tutorial_guide_step364.gmd,\tguide\tutorial_guide_364.arc,tutorial_guide_364.arc,1
2,TUTORIAL_STEP_632,"＜マンドラゴラの進化＞

マンドラゴラを育成する際に
選択する《肥料》の内容によって
マンドラゴラが進化し、姿を変えることがあります

また、現在のマンドラゴラの種類を
一度発見した種類に任意で変更することもできます
ただし、""何の種類から育成するか""というのは
進化に影響するため、育成の際には注意しましょう","<Mandragora Evolution>

When nurturing a Mandragora, the type of
fertilizer selected can cause the Mandragora to
evolve and change its appearance.

Additionally, the current type of Mandragora can
be changed to any previously discovered type.
However, the choice of ""which type to nurture
from"" can affect its evolution, so please be
cautious when nurturing.",ui\00_message\tutorial_guide\steps\tutorial_guide_step364.gmd,\tguide\tutorial_guide_364.arc,tutorial_guide_364.arc,2
3,TUTORIAL_STEP_633,"＜マンドラゴラ生態図鑑＞

新種を発見した場合は
《マンドラゴラ図鑑》に情報が収められていきます
中にはマンドラゴラの専門家、エイダス教授も
発見していない高レアリティの種類も存在します
<COL ffdc78>レアリティRまたはMRの種類が発見された場合
第一発見者のプレイヤーキャラクター名が
図鑑に記録されます</COL>

様々な肥料を試し、新種を発見していきましょう","<Mandragora Observation Journal>

When a new species is discovered, the information
will be recorded in the ""Mandragora Journal"".
There are also rare types that even Professor
Aidas, an expert on Mandragoras, has not
discovered.
<COL ffdc78>If a rarity R or MR type is found,
the player character's name will be recorded in
the journal.</COL>

Let's try various fertilizers and discover new
species.",ui\00_message\tutorial_guide\steps\tutorial_guide_step364.gmd,\tguide\tutorial_guide_364.arc,tutorial_guide_364.arc,3
0,TUTORIAL_STEP_634,"《ボーナスダンジョン》とは、
特別なチケットを使用することで
入れるようになるダンジョンです

使用したチケットの種類によって
得られる報酬と挑むダンジョンが変わります

チケットは《マンドラゴラ・ガーデニング》を
行うことで入手できます","""The 'Bonus Dungeon' is a dungeon that can be
entered by using special tickets.
The rewards and dungeons that can be challenged
vary depending on the type of ticket used.
Tickets can be obtained by engaging in
'Mandragora Gardening'.",ui\00_message\tutorial_guide\steps\tutorial_guide_step365.gmd,\tguide\tutorial_guide_365.arc,tutorial_guide_365.arc,0
0,TUTORIAL_STEP_635,"アッカーシェランが抱える
様々な問題を解決し、
王家による治世の再興を目指しましょう

その全てのアチーブメント解放を
達成したあかつきには、
アッカー王家からの特別な贈り物を
手にすることができます","Solve the various problems faced by Acre Selund
and aim to restore the reign of the royal family.
Once you achieve all these achievements, you will
receive a special gift from the Acre royal family.",ui\00_message\tutorial_guide\steps\tutorial_guide_step366.gmd,\tguide\tutorial_guide_366.arc,tutorial_guide_366.arc,0
0,TUTORIAL_STEP_636,"<COL ffdc78>《エンブレムストーン》</COL>は
《プレイポイント》を使って成長させることが
できる、各ジョブ専用の装備です

エンブレムレベルが上がることで
《エンブレムポイント》を入手できます

エンブレムポイントを各パラメーターに
割り振り、お気に入りのジョブを
さらに強化していきましょう","<COL ffdc78>""Emblem Stones""</COL> is equipment
exclusive to each job that can be grown using
""Play Points"".

By increasing the Emblem Level, you can obtain
""Emblem Points"".

Allocate Emblem Points to each status and further
strengthen your favorite job.",ui\00_message\tutorial_guide\steps\tutorial_guide_step367.gmd,\tguide\tutorial_guide_367.arc,tutorial_guide_367.arc,0
1,TUTORIAL_STEP_637,"＜クレスト継承＞
エンブレムレベルが上がると
ジュエリーにはめ込まれたクレストを
エンブレムに継承することができます

※サポートポーンが装備しているエンブレムの性能は
　<COL ffdc78>プレイヤーが所持しているエンブレムの性能となります</COL>
　また、解放していないジョブのものだった場合
　<COL ffdc78>効果を発揮することはできません</COL>","<Crest Inheritance>
When the Emblem level increases, the Crest
embedded in the jewelry can be inherited into the
Emblem.

* <COL ffdc78>The performance of the Emblem
equipped by the Support Pawn will be based on the
performance of the Emblem owned by the
player.</COL>
<COL ffdc78>Also, if it belongs to a job that has
not been unlocked, it cannot exert its
effects.</COL>",ui\00_message\tutorial_guide\steps\tutorial_guide_step367.gmd,\tguide\tutorial_guide_367.arc,tutorial_guide_367.arc,1
2,TUTORIAL_STEP_653,"クレスト継承には成功率があり、
成功した場合でも失敗した場合でも、
材料にしたジュエリーは破壊されます

アイテムを使用することで
クレスト継承の成功率を上げることができます

また、黄金石を使用すると
失敗してもジュエリーを破壊せず
残すことが可能です","For crest inheritance, there is a success rate,
and whether successful or not, the jewelry used as
materials will be destroyed.

By using an item, you can increase the success
rate of crest inheritance.

Also, by using a Golden Gemstone, even if it
fails, the jewelry won't be destroyed and can be
preserved.",ui\00_message\tutorial_guide\steps\tutorial_guide_step367.gmd,\tguide\tutorial_guide_367.arc,tutorial_guide_367.arc,2
0,TUTORIAL_STEP_638,"<COL 78f5ff>クラン拠点に家具を設置できるようになりました！</COL>

イベントなどで入手したクラン拠点専用家具は
クラン執務官に話しかけて
CPを消費することで設置できるようになります

クラン拠点を華やかに彩り、思い出を作りましょう","<COL 78f5ff>Furniture can now be installed in
clan bases!</COL>

Furniture obtained from events can be installed
by talking to the Clan Steward and spending CP.

Make your clan base more colorful and memorable!",ui\00_message\tutorial_guide\steps\tutorial_guide_step368.gmd,\tguide\tutorial_guide_368.arc,tutorial_guide_368.arc,0
0,TUTORIAL_STEP_639,"アッカーシェラン大陸では、<COL ffdc78>《戦甲》</COL>という
自己修復機能を持った特殊な鎧で
武装した魔物が出現します

戦甲は、悪しき竜の加護を元に
ドワーフオークが作成した鎧であり、
体に多く装着するほどその性能が向上します

戦甲を装着した魔物<COL ffdc78>《戦甲種》</COL>との戦闘では
戦甲を破壊してゆくことがカギとなります","In the Acre Selund continent, special monsters
armed with a unique armor called <COL ffdc78>War
Ready</COL> with self-repairing abilities appear.

War Ready Armor is armor created by Orcs using
the protection of the evil dragon.
The more it is worn on the body, the better its
performance becomes.

In battles against the monsters wearing War Ready
Armor called <COL ffdc78>War Ready Species</COL>,
the key is to destroy their armor.",ui\00_message\tutorial_guide\steps\tutorial_guide_step369.gmd,\tguide\tutorial_guide_369.arc,tutorial_guide_369.arc,0
1,TUTORIAL_STEP_647,"戦甲に攻撃すると表面に<COL ffdc78>赤いヒビ</COL>が入ります
この状態では<COL ffdc78>吹き飛ばし力により
戦甲にダメージを与えることができます</COL>が
高い防御性能に阻まれ、<COL ffdc78>体力を削ることはできません</COL>
<COL ffdc78>※吹き飛ばし力によるダメージは紫色で表示されます</COL>

また、戦甲には自己修復能力があるため
時間が経過することで修復されてしまいます

<COL ffdc78>赤いヒビは自己修復能力と高い防御性能を
有した状態を示します</COL>","When attacking the war-ready armor, <COL
ffdc78>red cracks will appear on the
surface</COL>.
In this state, you can <COL ffdc78>damage the
war-ready armor with the force of impact</COL>,
but its high defense prevents you from depleting
its health. <COL ffdc78>Note that damage from
impact force will be displayed in purple.</COL>

Additionally, the war-ready armor has self-repair
capabilities, so it will be repaired over time.

<COL ffdc78>Red cracks indicate a state with both
self-repair capabilities and high defense.</COL>",ui\00_message\tutorial_guide\steps\tutorial_guide_step369.gmd,\tguide\tutorial_guide_369.arc,tutorial_guide_369.arc,1
2,TUTORIAL_STEP_648,"赤いヒビが入った戦甲が自己修復する前に
攻撃を重ねることで、自己修復能力を失った
<COL ffdc78>白いヒビ</COL>へと拡大させることができます

また、白いヒビの状態では防御性能が低下するため
<COL ffdc78>戦甲と戦甲種自身の体力を削ることが可能となります</COL>

<COL ffdc78>白いヒビは自己修復能力を失い
防御性能が低下した状態を示します</COL>","Before the red crack in the combat armor can
self-repair, by repeating attacks, you can expand
it into a <COL ffdc78>white crack</COL> that has
lost its self-repair ability.

Furthermore, in the state of the white crack,
<COL ffdc78>the defensive performance decreases,
making it possible to reduce the health of the
combat armor and War Ready species
themselves.</COL>

<COL ffdc78>The white crack represents a state
where the self-repair ability is lost and the
defensive performance is decreased.</COL>",ui\00_message\tutorial_guide\steps\tutorial_guide_step369.gmd,\tguide\tutorial_guide_369.arc,tutorial_guide_369.arc,2
3,TUTORIAL_STEP_649,"白いヒビが入った戦甲は、さらに攻撃を加え続けると
戦甲を完全に破壊することができます。

戦甲へは<COL ffdc78>吹き飛ばし力が高い攻撃</COL>が特に有効です
その他、<COL ffdc78>仲間と協力して集中攻撃</COL>を仕掛けることも
有効な戦法となるでしょう

戦甲を破壊することで鎧の下に隠された弱点が
露出されるなど、様々なメリットが得られるので
積極的に戦甲の破壊を狙いましょう","The war armor with white cracks can be completely
destroyed if you continue to attack it.

<COL ffdc78>Attacks with high blow power are
particularly effective</COL> against the war
armor.
In addition,<COL ffdc78>launching concentrated
attacks with allies</COL> can also be an effective
strategy.

By destroying the war armor, you can expose the
weakness hidden under the armor and gain various
benefits.
Let's actively aim to destroy the war armor.",ui\00_message\tutorial_guide\steps\tutorial_guide_step369.gmd,\tguide\tutorial_guide_369.arc,tutorial_guide_369.arc,3
0,TUTORIAL_STEP_640,"大型の戦甲種との戦いでは
まず、<COL ffdc78>体に装着しているすべての戦甲を
破壊することが重要</COL>です

小型の戦甲種と同じく、戦甲は体に多く装着するほど
その性能が向上します

大型の戦甲種は、小型の戦甲種に比べて
戦甲による戦闘力の向上度が大きいことも
特徴のひとつです","In battles against large war-ready types, it is
important first to <COL ffdc78>destroy all the war
armor worn on the body. </COL>
Similar to small war-ready types, the more war
armor attached to the body, the greater the
increase in combat power through war armor.",ui\00_message\tutorial_guide\steps\tutorial_guide_step370.gmd,\tguide\tutorial_guide_370.arc,tutorial_guide_370.arc,0
1,TUTORIAL_STEP_650,"戦甲に有効となる主な攻撃方法は以下の２通りです

　１．吹き飛ばし力が高い攻撃
											
　２．仲間と協力して集中攻撃
											
仲間との集中攻撃に成功すると
一定時間、赤いヒビがさらに赤く光り
戦甲をより破壊しやすい状態になります","The main attack methods effective against the War
Ready are as follows:

1. Attacks with high Blow Power
2. Concentrated attacks with teammates

If a concentrated attack with teammates is
successful, the red cracks will shine even
brighter, making it easier to destroy the War
Ready for a certain period of time.",ui\00_message\tutorial_guide\steps\tutorial_guide_step370.gmd,\tguide\tutorial_guide_370.arc,tutorial_guide_370.arc,1
2,TUTORIAL_STEP_651,"さらに赤く光った状態の戦甲に
<COL ffdc78>癒し効果を持つスキルを接触</COL>させたり
<COL ffdc78>エレメントアーチャーの助真の魔眼で捕捉</COL>すると
戦甲の修復能力を打ち消すと共に、
集中攻撃による破壊がさらにしやすくなります

また、ヒーラーは<COL ffdc78>白いヒビが入った戦甲へ
ダメージを与えやすいという特徴も持っています</COL>
ヒーラーの役割を把握し、協力することも
戦甲種との戦いで重要な立ち回りと言えるでしょう","Furthermore, when a skill with a <COL
ffdc78>healing effect</COL> comes into contact
with the war ready armor that is glowing red, or
when captured by <COL ffdc78>Element Archer's
Magick Eye: True Aid</COL>, the armor's repair
ability is disabled, making it even easier to
destroy through concentrated attacks.

Additionally, <COL ffdc78>healers also have the
characteristic of being able to inflict damage on
the war ready armor with white cracks.
</COL>Understanding the role of healers and
cooperating with them can be said to be an
important approach in battles against war ready
armor types.",ui\00_message\tutorial_guide\steps\tutorial_guide_step370.gmd,\tguide\tutorial_guide_370.arc,tutorial_guide_370.arc,2
3,TUTORIAL_STEP_676,"戦甲を破壊することで、小型の戦甲種と同じく
鎧の下に隠された弱点が露出したり、
敵の体力を大きく奪えたりといった
様々なメリットを得ることができます

さらに、すべての戦甲を完全破壊すると
<COL ffdc78>最大の攻撃チャンスとなる
ダウンを奪うことができます</COL>

このように、戦甲種との戦いでは
戦甲の破壊を優先することが勝利の鍵となります","By destroying the war-ready armor, you can expose
the weak points hidden underneath the armor, just
like in the case of smaller types of war-ready
armor, and greatly deplete the enemy's health.

Furthermore, by completely destroying all the
war-ready armor, you can seize the maximum
opportunity for attack and take the enemy down.
<COL ffdc78>In battles against war-ready armor
types, prioritizing the destruction of the armor
becomes the key to victory.</COL>",ui\00_message\tutorial_guide\steps\tutorial_guide_step370.gmd,\tguide\tutorial_guide_370.arc,tutorial_guide_370.arc,3
0,TUTORIAL_STEP_645,"《フォトモード》は、ゲーム画面を
撮影できる機能です

ズームイン・アウトや様々なフレームを使って
冒険の思い出を写真に残しましょう","""Photo Mode"" is a feature that allows you to take
photos of the game screen.

Use zoom in and out and various frames to capture
memories of your adventures in photos.",ui\00_message\tutorial_guide\steps\tutorial_guide_step371.gmd,\tguide\tutorial_guide_371.arc,tutorial_guide_371.arc,0
1,TUTORIAL_STEP_646,"パートナーポーンとの絆が深まると
フォトモード使用時に
「注目」コマンドを使用できるようになります

「注目」コマンドとは
画面に映るポーンたちを
カメラ側へ向かせることができるコマンドです","When the bond with Partner Pawn deepens, you will
be able to use the ""Focus"" command during Photo
Mode.

The ""Focus"" command allows you to direct the
Pawns on the screen towards the camera.",ui\00_message\tutorial_guide\steps\tutorial_guide_step371.gmd,\tguide\tutorial_guide_371.arc,tutorial_guide_371.arc,1
0,TUTORIAL_STEP_658,"ドワーフオークは鍛冶の技術に長けた
アッカーシェラン大陸固有のオーク種です

金属の鎧を着こんでいるため
防御の固い正面側よりも
背面からの攻撃が有効です","The Dwarf Orc, a unique species native to the
Acre Selund continent, excels in the art of
blacksmithing.

Wearing metal armor, it is more effective to
attack from the back rather than from the heavily
defended front.",ui\00_message\tutorial_guide\steps\tutorial_guide_step372.gmd,\tguide\tutorial_guide_372.arc,tutorial_guide_372.arc,0
1,TUTORIAL_STEP_659,"ドワーフオークには、
兵種により鎧や武器が異なるという特徴があります
鎧の違いにより、攻撃の有効部位が大きく異なります

＜打兵ドワーフオーク＞
　兜を被っていないため、頭部への攻撃も有効

＜重兵ドワーフオーク・隊将ドワーフオーク＞
　身に付けている盾へは攻撃が通りにくい

など","Dwarf Orcs have a characteristic that their armor
and weapons differ depending on the type of
soldier.
The difference in armor results in significantly
different effective attack points.

<Blunt Soldier Dwarf Orc>
Since they don't wear helmets, attacks to the
head are also effective.

<Heavy Soldier Dwarf Orc and Squad Leader Dwarf
Orc>
Attacks are less effective against the shields
they wear.

And so on.",ui\00_message\tutorial_guide\steps\tutorial_guide_step372.gmd,\tguide\tutorial_guide_372.arc,tutorial_guide_372.arc,1
2,TUTORIAL_STEP_660,"持っている武器の種類によって
戦闘中の動きも大きく異なります

それぞれのタイプにあった立ち回りを
こころがけましょう","Depending on the type of weapon you have, your
movements in battle will differ greatly.

Let's try to find the right strategy for each
type of weapon.",ui\00_message\tutorial_guide\steps\tutorial_guide_step372.gmd,\tguide\tutorial_guide_372.arc,tutorial_guide_372.arc,2
3,TUTORIAL_STEP_661,"また、ドワーフオーク兵たちは
彼らをまとめるリーダー的存在である
《隊将ドワーフオーク》に鼓舞されることで
士気が上がり、一時的に戦闘力が上昇します

逆に、隊将ドワーフオークを優先的に倒すことで
その配下に動揺を与え、
攻撃の手を緩めることができます

ドワーフオークの習性を利用し、有利に
戦いを進めましょう","Furthermore, the Dwarf Orc soldiers are inspired
by their leader, the Squad Leader Dwarf Orc.
This boosts their morale and temporarily
increases their combat power.

On the other hand, by prioritizing the defeat of
the Squad Leader Dwarf Orc, you can disrupt their
subordinates and weaken their attacks.

Let's take advantage of the Dwarf Orc's
characteristics and proceed with the battle
advantageously.",ui\00_message\tutorial_guide\steps\tutorial_guide_step372.gmd,\tguide\tutorial_guide_372.arc,tutorial_guide_372.arc,3
0,TUTORIAL_STEP_662,"展望城でのサブストーリーでは、軍師ソネルとの
<COL ffdc78>潜入任務</COL>が基本となります

敵に見つからないようにするために
<COL ffdc78>いつもと違った行動</COL>が必要になるので
ソネルの指示をしっかりと聞きながら進みましょう","In the substory at Lookout Castle, the main focus
will be on the <COL ffdc78>infiltration
mission</COL> with military strategist Sonel.

In order to avoid being discovered by the enemy,
we will need to take different actions than usual,
so let's <COL ffdc78>proceed while clearly
listening to Sonel's instructions.</COL>",ui\00_message\tutorial_guide\steps\tutorial_guide_step373.gmd,\tguide\tutorial_guide_373.arc,tutorial_guide_373.arc,0
1,TUTORIAL_STEP_702,"また、潜入任務中はソネルの<COL ffdc78>《ごきげんゲージ》</COL>にも
気を配る必要があります

《ごきげんゲージ》はソネルの頭上と
画面右のクエスト名の上に表示される<COL ffdc78>黄色のゲージ</COL>で
ソネルのごきげんの状態を示します","Furthermore, during the infiltration mission, you
must also pay attention to Sonel's <COL
ffdc78>Mood Gauge</COL>.

The ""Mood Gauge"" is a <COL ffdc78>yellow
gauge</COL> that is displayed above Sonel's head
and above the quest name on the right side of the
screen.
It indicates Sonel's level of happiness.",ui\00_message\tutorial_guide\steps\tutorial_guide_step373.gmd,\tguide\tutorial_guide_373.arc,tutorial_guide_373.arc,1
2,TUTORIAL_STEP_703,"敵に見つかるなど
<COL ffdc78>潜入任務がうまくいかない時</COL>に減少します

万が一戦闘になった場合、敵の攻撃でダメージを
受けることでも減少します","It is reduced on<COL ffdc78>when an infiltration
mission goes wrong</COL>, such as being spotted by
the enemy

It is also reduced by taking damage from enemy
attacks in the unlikely event of a battle",ui\00_message\tutorial_guide\steps\tutorial_guide_step373.gmd,\tguide\tutorial_guide_373.arc,tutorial_guide_373.arc,2
3,TUTORIAL_STEP_704,"<COL ffdc78>《ごきげんゲージ》が０になる</COL>と
ソネルは任務遂行をあきらめてしまい
そのクエストは失敗となります

失敗すると、<COL ffdc78>もう一度展望城から出直す</COL>
ことになりますが、クリアまで何度でも挑戦できます","When the <COL ffdc78>Mood Gauge</COL> reaches 0,
Sonel will give up on the mission, and the quest
will fail.

If you fail, you'll have to <COL ffdc78>go back
to Lookout Castle</COL>, but you can attempt to
clear it multiple times.",ui\00_message\tutorial_guide\steps\tutorial_guide_step373.gmd,\tguide\tutorial_guide_373.arc,tutorial_guide_373.arc,3
4,TUTORIAL_STEP_705,"<COL ffdc78>リム転移で別の場所へ移動</COL>しても
失敗となるため注意しましょう","<COL ffdc78>Note that moving to a different
location</COL>with Rift Teleport will result in a
failure!",ui\00_message\tutorial_guide\steps\tutorial_guide_step373.gmd,\tguide\tutorial_guide_373.arc,tutorial_guide_373.arc,4
0,TUTORIAL_STEP_663,"潜入任務中は
<COL ffdc78>障害物の影に隠れながら進む</COL>ことが
基本となりますが、時には<COL ffdc78>見張りをやり過ごさないと
進めない場所</COL>もあるでしょう

その際、ソネルが同行していると
<COL ffdc78>移動のタイミングの合図</COL>を出すようにと
指示がある場合があります","During infiltration missions, <COL ffdc78>it is
essential to move while hiding in the shadows of
obstacles</COL>.

However, there are also places where you <COL
ffdc78>cannot proceed without bypassing the
lookouts</COL>.

In such cases, there may be instructions to have
Sonel accompany you and <COL ffdc78>give signals
for movement.</COL>",ui\00_message\tutorial_guide\steps\tutorial_guide_step374.gmd,\tguide\tutorial_guide_374.arc,tutorial_guide_374.arc,0
1,TUTORIAL_STEP_706,"＜移動タイミングの合図を出す＞

　①まず、先にあなたが指定された位置まで
　　<COL ffdc78>敵に見つからないように</COL>進みます

　　見張りの動きをよく観察し、
　　<COL ffdc78>十分距離が離れた状態で背を向けたら</COL>
　　すばやく移動します
　　（離れた位置で背を向けて
　　　<COL ffdc78>立ち止まっている時</COL>がチャンスです）","<Signal the timing of movement>

1. First, proceed to the specified location <COL
ffdc78>without being spotted by the enemy</COL>.

Carefully observe the movements of the guards and
<COL ffdc78>quickly move</COL> when they have <COL
ffdc78>turned their backs and are at a sufficient
distance</COL>.
(The opportunity arises when they have <COL
ffdc78>stopped and are facing away</COL> at a
distant location).",ui\00_message\tutorial_guide\steps\tutorial_guide_step374.gmd,\tguide\tutorial_guide_374.arc,tutorial_guide_374.arc,1
2,TUTORIAL_STEP_707,"　②指定された位置まで移動したら
　　<COL ffdc78>《手招き》のエモートでソネルに合図</COL>を出します

　　合図を確認すると<COL ffdc78>ソネルが移動を開始</COL>します

　　敵に見つからずに要所を渡り切ることが
　　できれば成功です","Once you have moved to the specified location,
issue a <COL ffdc78>beckon emote to Sonel</COL>.

Once Sonel confirms the signal, <COL ffdc78>Sonel
will start moving</COL>.

If you can cross the crucial points without being
noticed by the enemy, it will be a success.",ui\00_message\tutorial_guide\steps\tutorial_guide_step374.gmd,\tguide\tutorial_guide_374.arc,tutorial_guide_374.arc,2
