"old","new"
"メルガン技師の研究室
技師の中にも、竜を排すという異端思想に傾倒
した者が少なからずいた。そういった思想の信徒が
使っていた研究室は封鎖、監視対象となっている
ここも、何らかの研究のため使われていたようだ","Laboratory of Engineer Mergan.
Here, there were some who were inclined towards the heretical idea of rejecting dragons. 
The research facility used by those who believed in such ideas has been shut down and placed under surveillance. 
It seems that this place was also used for some kind of research."
"護政区の研究者であった錬金術師の家
すでに主は不在だが、研究成果や遺物は
遺されているかもしれない
それが、どういった内容であるかは不明","The home of an alchemist who was a researcher in the Security District.
 The master is already absent, but there may be alchemized research results and artifacts left behind. 
It is unclear what the contents are."
"白竜により、かつて大地から切り離された都
レスタニアとは隔てられた異界に漂い、時の流れも
異なっている。現在は地上で見られなくなった
錬金技術が随所にほどこされ、秘術で生み出された
錬魔は今も亡都を守護している","The city once cut off from the earth by The White Dragon.
Now drifts in a different realm, no longer seen in Lestania.
Time flows differently here.
Alchemized technology, which has disappeared from the surface, is still present throughout, and the city is protected by guardian spirits created through secret spells."
