"old","new"
"フィンダム随一の森林地帯
樹木や草花、多様な獣といった森の恩恵を
受けられるこの地の特性は、反面侵食の影響が
最も色濃く発現する悲劇を招いた。生命力に
溢れていた森は今や赤く立ち枯れている箇所が目立つ","The premier woodland region of Phindym, where one can enjoy the benefits of the forest, including trees, flowers, and a variety of animals.
However, the characteristic of this land also brings about the tragic manifestation of the most intense corruption and infection.
The once vibrant forest now stands with prominent red decay."
"モロー樹林にある、木々に囲まれた村
代々精霊竜の守りをしてきた一族が住まう
そのせいか理知的な者が多く、学者を多数
輩出してきた。威厳ある族長・ガラダに
よって統治されている","In the Morrow Forest, there is a village surrounded by trees, where a clan that has been guarding the Spirit Dragon for generations resides.
Perhaps because of this, there are many intellectual individuals, and they have produced numerous scholars. 
They are ruled by the dignified chieftain, Gearóid."
"《ノーザナス侵林》入口のある崖の下に
広がる平地。封鎖されている侵林に
引き寄せられているのか、侵食が進んだ
有翼の魔物たちがしきりにこの辺りを
さまよう姿が確認されている","A flat area of land spreading out under the cliff where the entrance to the Northerners Infected Woods is
located. 
It is confirmed that winged beasts, infected by corruption, are frequently wandering around this area."
"モロー樹林北部、特に侵食が進んだ一帯にある
封鎖された森林。侵食前より森の強者が棲むとされ、
人が迷いこむことが無いようにと封鎖されていた場所
奥を確かめた者はいないが、凶暴な魔物が侵食された
状態にあることは確実であり、危険度は高い","The sealed forest located in the northern part of Morrow Forest, where corruption has particularly advanced.
It is said to be inhabited by powerful beings of the forest, and it was sealed off to prevent people from getting lost. 
No one has ventured deep inside, but it is certain that ferocious monsters have been infected. The level of danger is high."
