key,old,new
NORMAL_SKILL_INFO_06_92,"魔法弾を放つ
空中でも発動可能","Release a magickal bolt.
Can be activated even while in the air."
NORMAL_SKILL_INFO_06_93,"魔法の罠を敵の足元に展開する
空中でも発動可能","Summon a Magickal Trap at an enemy's feet.
Can be activated even while in the air."
NORMAL_SKILL_INFO_06_94,"マジックボールの弾数と
マジックトラップの範囲を上昇させる
空中でも発動可能","Increases the number of Magick Bolts released and
extends the range of Magick Traps.
Can be activated even while in the air."
NORMAL_SKILL_INFO_06_95,"魔法詠唱中スペルサークルに示される順序で
<PADM>スティック入力<KEYM>マウス移動</KEYM>を行い、魔法の威力を増加させる","Move the <PADM> Right Stick;KEYM>Mouse</KEYM> in
the order shown in the magic circle while casting a spell to increase its power."
NORMAL_SKILL_INFO_06_96,後方にすばやく移動する,Quickly dodge backwards.
NORMAL_SKILL_INFO_06_101,"ジャンプ中の落下速度を抑制し
滞空時間を延長する","Slow your descent while falling, and
extend the duration you stay in the air."
NORMAL_SKILL_INFO_06_102,"しがみついた状態から、敵の体に魔印を刻む
魔印に攻撃を加えると魔法波で敵を攻撃する","While climbing an enemy, place a magickal orb on them
that when attacked, will explode into waves of powerful magick."
