"key","old","new"
"HISTORY_STEP_105","　フィンダムの状況は深刻だ。芯なる樹が侵食され、
次いで、樹を浄化しようとした竜までもが侵食されて
しまった。竜がセシリーを襲ったのは、悲しいかな、
侵食で正気を失ってしまったことが原因らしい

　竜力を巡らせる樹――、浄化する竜の両方が侵食さ
れたことで、フィンダムを巡る竜力は毒になり果て
た。毒を体内に取り入れた動物は魔物化し、魔物ども
は侵食魔となった

　なんとも壮絶な話だ。元来、フィンダムの人々は、
耐え難い苦難でさえ運命として受け入れることを潔し
とする人々らしい。しかし、今回ばかりは、立ち向か
うことにしたそうだ。その活動の中心にいるのがセシ
リーの父親であるガラダだ

　彼らの戦いは、故郷を救うためであると同時に、自
分たちの生き方を変えようとする闘争でもある","The situation in Phindym is dire. The core of the tree has been corrupted, and then the dragon, who tried to cleanse the tree, was also corrupted. Unfortunately, it seems that the dragon attacked Cecily because they lost their sanity due to the corruption.

The corruption of both the tree that channels the power of the dragons and the dragon themself has turned the dragon power surrounding Phindym into poison. Animals that have ingested the poison have turned into monsters, known as the infected monsters.

It is a truly tragic story. The people of Phindym have always been known to accept even unbearable hardships as their fate. However, this time they have decided to confront the situation. At the center of their efforts is Cecily's father, Gearóid.

Their fight is not only to save their homeland but also a struggle to change their way of life."
