0,,全員で《命の器》を探そう,"Let's all look for the ""Vessel of Life"" together.",ui\00_message\event\st0403\ev000.gmd,\event\st0403\st0403ev000.arc,st0403ev000.arc,13,
0,,"壷か杯のような
かたちをしているはずだ",It should be shaped like a vase or a chalice.,ui\00_message\event\st0403\ev000.gmd,\event\st0403\st0403ev000.arc,st0403ev000.arc,14,
0,,さあ、急いだ方がいい,We'd better hurry.,ui\00_message\event\st0403\ev000.gmd,\event\st0403\st0403ev000.arc,st0403ev000.arc,15,
0,,長く放置されたこの城は――,This long-abandoned castle...,ui\00_message\event\st0403\ev000.gmd,\event\st0403\st0403ev000.arc,st0403ev000.arc,16,
0,,"どちらかというと敵の支配下だ
手分けして《命の器》を見つけよう！","Is more like under the enemy's control.
We need to divide and find the ""Vessel of Life""!",ui\00_message\event\st0403\ev000.gmd,\event\st0403\st0403ev000.arc,st0403ev000.arc,17,
0,,あれだ！　あれが《命の器》！,"There it is! That's the ""Vessel of Life""!",ui\00_message\event\st0403\ev005.gmd,\event\st0403\st0403ev005.arc,st0403ev005.arc,0,
0,,図版で見たとおり！,Just like in the drawing!,ui\00_message\event\st0403\ev005.gmd,\event\st0403\st0403ev005.arc,st0403ev005.arc,1,
0,,オマイがアルケミーの継承者とな？,Are you going to become the inheritor of alchemy?,ui\00_message\event\st0403\ev005.gmd,\event\st0403\st0403ev005.arc,st0403ev005.arc,2,
0,,世継ぎなど,No need for heirs...,ui\00_message\event\st0403\ev005.gmd,\event\st0403\st0403ev005.arc,st0403ev005.arc,3,
0,,いらん！,...No need!,ui\00_message\event\st0403\ev005.gmd,\event\st0403\st0403ev005.arc,st0403ev005.arc,4,
0,,誰が誰やら――,Now who's who...,ui\00_message\event\st0403\ev005.gmd,\event\st0403\st0403ev005.arc,st0403ev005.arc,5,
0,,"覚者たちよ！
","Arisen, all of you!",ui\00_message\event\st0403\ev005.gmd,\event\st0403\st0403ev005.arc,st0403ev005.arc,6,
0,,まず我ら騎士団に任せよ！,"First, leave it to our knight order!",ui\00_message\event\st0403\ev005.gmd,\event\st0403\st0403ev005.arc,st0403ev005.arc,7,
0,,"この新手の敵の戦いぶり――
しかと検分されたし！","We have thoroughly examined
this new enemy's fighting style!",ui\00_message\event\st0403\ev005.gmd,\event\st0403\st0403ev005.arc,st0403ev005.arc,8,
0,,（息遣い）,(Breathing),ui\00_message\event\st0403\ev005.gmd,\event\st0403\st0403ev005.arc,st0403ev005.arc,9,
0,,（息遣い）,(Breathing),ui\00_message\event\st0403\ev005.gmd,\event\st0403\st0403ev005.arc,st0403ev005.arc,10,
0,,ウオオオオオォォォォッッ！,Uwaaaaaah!,ui\00_message\event\st0403\ev005.gmd,\event\st0403\st0403ev005.arc,st0403ev005.arc,11,
0,,あっ！,Ah!,ui\00_message\event\st0403\ev015.gmd,\event\st0403\st0403ev015.arc,st0403ev015.arc,0,
0,,帰ろう,Let's go back.,ui\00_message\event\st0403\ev015.gmd,\event\st0403\st0403ev015.arc,st0403ev015.arc,1,
0,,弔い――,Pay respects—,ui\00_message\event\st0403\ev015.gmd,\event\st0403\st0403ev015.arc,st0403ev015.arc,2,
0,,そして新たなる敵への対策――,And prepare for the new enemy—,ui\00_message\event\st0403\ev015.gmd,\event\st0403\st0403ev015.arc,st0403ev015.arc,3,
0,,急ぎ、神殿へ戻らねば,We need to hurry back to the temple.,ui\00_message\event\st0403\ev015.gmd,\event\st0403\st0403ev015.arc,st0403ev015.arc,4,
0,,（悔しがる）,(Regret),ui\00_message\event\st0403\ev015.gmd,\event\st0403\st0403ev015.arc,st0403ev015.arc,5,
0,,（息遣い）,(Breathing),ui\00_message\event\st0403\ev015.gmd,\event\st0403\st0403ev015.arc,st0403ev015.arc,6,
0,,,,ui\00_message\event\st0403\ev020.gmd,\event\st0403\st0403ev020.arc,st0403ev020.arc,0,
0,,"全隊、待機
これより生死の検分に入る！","All units, standby. We're about to check for signs of life!",ui\00_message\event\st0403\ev025.gmd,\event\st0403\st0403ev025.arc,st0403ev025.arc,0,
0,,貴殿も一緒に来てくれ,"You, come with us.",ui\00_message\event\st0403\ev025.gmd,\event\st0403\st0403ev025.arc,st0403ev025.arc,1,
0,,ぐおっ？！,Gwah?!,ui\00_message\event\st0403\ev025.gmd,\event\st0403\st0403ev025.arc,st0403ev025.arc,2,
0,,うわっ？！,Whoa?!,ui\00_message\event\st0403\ev025.gmd,\event\st0403\st0403ev025.arc,st0403ev025.arc,3,
0,,うわっ？！,Whoa?!,ui\00_message\event\st0403\ev025.gmd,\event\st0403\st0403ev025.arc,st0403ev025.arc,4,
0,,うわっ？！,Whoa?!,ui\00_message\event\st0403\ev025.gmd,\event\st0403\st0403ev025.arc,st0403ev025.arc,5,
0,,はっ！！,Hah!!,ui\00_message\event\st0403\ev025.gmd,\event\st0403\st0403ev025.arc,st0403ev025.arc,6,
0,,いくら腕をあげようとも油断は命取りだ,"No matter how much you improve your skills,
complacency can be fatal.",ui\00_message\event\st0403\ev025.gmd,\event\st0403\st0403ev025.arc,st0403ev025.arc,7,
0,,"レオよ――久しいな
いったい、どこにいた","Leo... It's been a while.
Where were you?",ui\00_message\event\st0403\ev025.gmd,\event\st0403\st0403ev025.arc,st0403ev025.arc,8,
0,,さあ――なんとも答えにくい質問だ,Well... That's a hard question to answer.,ui\00_message\event\st0403\ev025.gmd,\event\st0403\st0403ev025.arc,st0403ev025.arc,9,
0,,放浪は、いまだ誰も知らない力を求めてのこと――,"Wandering in pursuit of a power
that no one yet knows...",ui\00_message\event\st0403\ev025.gmd,\event\st0403\st0403ev025.arc,st0403ev025.arc,10,
0,,"しかし、それは何かと問われても
まだ答えを知らない上に――","But even if I were asked what it is,
I still do not know.",ui\00_message\event\st0403\ev025.gmd,\event\st0403\st0403ev025.arc,st0403ev025.arc,11,
0,,"目下、オレの興味は、フィンダムと呼ばれる
まだ見ぬ大陸にある","Currently, my interest brings me to
a yet-unseen continent called Phindym.",ui\00_message\event\st0403\ev025.gmd,\event\st0403\st0403ev025.arc,st0403ev025.arc,12,
0,,てめえ、どうしてフィンダムを知っていやがる？,Why do you know about Phindym?,ui\00_message\event\st0403\ev025.gmd,\event\st0403\st0403ev025.arc,st0403ev025.arc,13,
0,,"友人から聞いた
フィンダムから来た、ロイグという男だ","I heard from a friend about a man named Loeg
who came from Phindym.",ui\00_message\event\st0403\ev025.gmd,\event\st0403\st0403ev025.arc,st0403ev025.arc,14,
0,,セシリーだな？,Is it Cecily?,ui\00_message\event\st0403\ev025.gmd,\event\st0403\st0403ev025.arc,st0403ev025.arc,15,
0,,"一緒に""飛ばされた""若い娘がいることは
ロイグから聞いている","There's a young girl who was ""sent""
together with him, right?",ui\00_message\event\st0403\ev025.gmd,\event\st0403\st0403ev025.arc,st0403ev025.arc,16,
0,,セシリー、ロイグって知ってる？,"Cecily, do you know Loeg?",ui\00_message\event\st0403\ev025.gmd,\event\st0403\st0403ev025.arc,st0403ev025.arc,17,
0,,その、ロイグに会わせてください,I want to meet Loeg.,ui\00_message\event\st0403\ev025.gmd,\event\st0403\st0403ev025.arc,st0403ev025.arc,18,
0,,今は無理だと答えておこう,"For now, let's answer that it's impossible.",ui\00_message\event\st0403\ev025.gmd,\event\st0403\st0403ev025.arc,st0403ev025.arc,19,
0,,"わたしには果たすべき役割があるはずです
その人が、知っているかもしれません","There should be a role for me to fulfill.
That person might know about it.",ui\00_message\event\st0403\ev025.gmd,\event\st0403\st0403ev025.arc,st0403ev025.arc,20,
0,,"記憶を取り戻すきっかけを
くれるかもしれません！","They might give me the opportunity
to regain my memories!",ui\00_message\event\st0403\ev025.gmd,\event\st0403\st0403ev025.arc,st0403ev025.arc,21,
0,,少し時間をおこう,Let's wait a bit.,ui\00_message\event\st0403\ev025.gmd,\event\st0403\st0403ev025.arc,st0403ev025.arc,22,
0,,"おまえの目には、ある種の輝きが宿っている
いや、熱で潤んでいるとでも言えばいいのか――","Your eyes hold a certain kind of radiance,
or should I say they're filled with passion...",ui\00_message\event\st0403\ev025.gmd,\event\st0403\st0403ev025.arc,st0403ev025.arc,23,
0,,"かつて、ふたりの女の目に
同じ輝きを見たことがある","I've seen the same radiance
in the eyes of two women.",ui\00_message\event\st0403\ev025.gmd,\event\st0403\st0403ev025.arc,st0403ev025.arc,24,
0,,イリス――ミシアル――,"Iris... 
Mysial...",ui\00_message\event\st0403\ev025.gmd,\event\st0403\st0403ev025.arc,st0403ev025.arc,25,
0,,ふん！,Hmph!,ui\00_message\event\st0403\ev025.gmd,\event\st0403\st0403ev025.arc,st0403ev025.arc,26,
0,,ふたりとも、運命に殉じるかのように、死んでいった,"Both of them died...
As if they were sacrificed to fate.",ui\00_message\event\st0403\ev025.gmd,\event\st0403\st0403ev025.arc,st0403ev025.arc,27,
0,,わたしには関係のないことです！,This has nothing to do with me!,ui\00_message\event\st0403\ev025.gmd,\event\st0403\st0403ev025.arc,st0403ev025.arc,28,
0,,"頭を冷やして出直して来い――
今はそう言うしかない","Calm down and come back later.
That's all I can say for now.",ui\00_message\event\st0403\ev025.gmd,\event\st0403\st0403ev025.arc,st0403ev025.arc,29,
0,,あれを見ろ！,Look there!,ui\00_message\event\st0404\ev000.gmd,\event\st0404\st0404ev000.arc,st0404ev000.arc,0,
0,,くそっ！　優男を死なせるな！,Damn it! Don't let him die!,ui\00_message\event\st0404\ev000.gmd,\event\st0404\st0404ev000.arc,st0404ev000.arc,1,
0,,逃がすな！　　捕まえろ！,Don't let him escape! Catch him!,ui\00_message\event\st0404\ev000.gmd,\event\st0404\st0404ev000.arc,st0404ev000.arc,2,
0,,おい、頼んだぞ！,"Hey, I'm counting on you!",ui\00_message\event\st0404\ev000.gmd,\event\st0404\st0404ev000.arc,st0404ev000.arc,3,
0,,（息遣い）,(Breathing),ui\00_message\event\st0404\ev000.gmd,\event\st0404\st0404ev000.arc,st0404ev000.arc,4,
0,,――覚者さんたち、やるね,"...Arisen, you've done well.",ui\00_message\event\st0404\ev005.gmd,\event\st0404\st0404ev005.arc,st0404ev005.arc,0,
0,,"もう、メイリーフは
――任せるよ","Mayleaf's protection...
I'll leave it to you.",ui\00_message\event\st0404\ev005.gmd,\event\st0404\st0404ev005.arc,st0404ev005.arc,1,
0,,ひとつ、頼みがある――,I have... one request...,ui\00_message\event\st0404\ev005.gmd,\event\st0404\st0404ev005.arc,st0404ev005.arc,2,
0,,まもなく尽きる――,I'm running out of time...,ui\00_message\event\st0404\ev005.gmd,\event\st0404\st0404ev005.arc,st0404ev005.arc,3,
0,,僕の命――,My life...,ui\00_message\event\st0404\ev005.gmd,\event\st0404\st0404ev005.arc,st0404ev005.arc,4,
0,,"あの器に入れて――
白竜に捧げて欲しい――","Please put it in that vessel...
Dedicate it to the White Dragon...",ui\00_message\event\st0404\ev005.gmd,\event\st0404\st0404ev005.arc,st0404ev005.arc,5,
0,,きっときみたちの――,I'm sure it'll...,ui\00_message\event\st0404\ev005.gmd,\event\st0404\st0404ev005.arc,st0404ev005.arc,6,
0,,役に立つはず――,Be useful to you all...,ui\00_message\event\st0404\ev005.gmd,\event\st0404\st0404ev005.arc,st0404ev005.arc,7,
0,,ああ――,Ah...,ui\00_message\event\st0404\ev005.gmd,\event\st0404\st0404ev005.arc,st0404ev005.arc,8,
0,,看取られて死ねるなんて――,Passing on with someone by your side...,ui\00_message\event\st0404\ev005.gmd,\event\st0404\st0404ev005.arc,st0404ev005.arc,9,
0,,考えたこともなかった――,I had never even thought about it...,ui\00_message\event\st0404\ev005.gmd,\event\st0404\st0404ev005.arc,st0404ev005.arc,10,
0,,これはいただくぞ！,I'll gladly accept this!,ui\00_message\event\st0404\ev005.gmd,\event\st0404\st0404ev005.arc,st0404ev005.arc,11,
0,,（高笑い）,(High laughter),ui\00_message\event\st0404\ev005.gmd,\event\st0404\st0404ev005.arc,st0404ev005.arc,12,
0,,おまえ――覚えているぞ,You...! I remember you!,ui\00_message\event\st0404\ev010.gmd,\event\st0404\st0404ev010.arc,st0404ev010.arc,0,
0,,ハンッ、レオの後釜と目されているらしいな,"Hmph, it seems like I'm being considered
to become Leo's successor.",ui\00_message\event\st0404\ev010.gmd,\event\st0404\st0404ev010.arc,st0404ev010.arc,1,
0,,オークの狩場になんの用だ！,What are you doing on Orc hunting ground!?,ui\00_message\event\st0404\ev010.gmd,\event\st0404\st0404ev010.arc,st0404ev010.arc,2,
0,,"オークの狩場？
バカなこと言わないでよ、ここは――","Orc hunting ground?
Don't say ridiculous things; this is...",ui\00_message\event\st0404\ev010.gmd,\event\st0404\st0404ev010.arc,st0404ev010.arc,3,
0,,"図に乗るな人間ども――
レスタニアはオークの大陸だ！","Don't get carried away, you humans!
Lestania is the Orc's continent!",ui\00_message\event\st0404\ev010.gmd,\event\st0404\st0404ev010.arc,st0404ev010.arc,4,
0,,何を言ってるの！,What are you talking about!,ui\00_message\event\st0404\ev010.gmd,\event\st0404\st0404ev010.arc,st0404ev010.arc,5,
0,,"仮に１００歩ゆずってそうだとしたら――
森をもっと大事にしなさいよ！","Even if you were to give up 100 steps...
Take better care of the forest!",ui\00_message\event\st0404\ev010.gmd,\event\st0404\st0404ev010.arc,st0404ev010.arc,6,
0,,"おまえらのせいでおれたちオークは
ずいぶん痛手を負った","Thanks to you people,
we orcs have taken quite a hit.",ui\00_message\event\st0404\ev010.gmd,\event\st0404\st0404ev010.arc,st0404ev010.arc,7,
0,,"かつての勢いを取り戻すには
多くの食料が必要だ","To regain our former glory,
we need plenty of food.",ui\00_message\event\st0404\ev010.gmd,\event\st0404\st0404ev010.arc,st0404ev010.arc,8,
0,,食糧って――動物たち？,Is the food... these animals?,ui\00_message\event\st0404\ev010.gmd,\event\st0404\st0404ev010.arc,st0404ev010.arc,9,
0,,"ハッハッハッハッハ
邪魔なおまえらも喰らってやるわ！","Hahaha...
I'll gobble up you meddling folks too!",ui\00_message\event\st0404\ev010.gmd,\event\st0404\st0404ev010.arc,st0404ev010.arc,10,
0,,隊長、コイツ話にならない！,"Captain, this guy is impossible to reason with!",ui\00_message\event\st0404\ev010.gmd,\event\st0404\st0404ev010.arc,st0404ev010.arc,11,
0,,ガハッ――調子に乗りやがって！　人間どもめ！,"Gahh, get on with it! You humans!",ui\00_message\event\st0404\ev015.gmd,\event\st0404\st0404ev015.arc,st0404ev015.arc,0,
0,,レスタニアがどちらのものか――,The one that truly owns Lestania―,ui\00_message\event\st0404\ev015.gmd,\event\st0404\st0404ev015.arc,st0404ev015.arc,1,
0,,いずれ思い知らせてやるわ！,I'll make you realize that one day!,ui\00_message\event\st0404\ev015.gmd,\event\st0404\st0404ev015.arc,st0404ev015.arc,2,
0,,"動物たちがおびえていた原因は
オークだったのか！","The reason the animals were frightened
was because of the Orcs!",ui\00_message\event\st0404\ev015.gmd,\event\st0404\st0404ev015.arc,st0404ev015.arc,3,
0,,"ありがとう、君たち
森の危機は去ったようだね","Thank you, all of you.
It seems the crisis in the forest has passed.",ui\00_message\event\st0404\ev015.gmd,\event\st0404\st0404ev015.arc,st0404ev015.arc,4,
0,,ゲルト団長！？　メイリーフ！？,Captain Gerd!? Mayleaf!?,ui\00_message\event\st0404\ev015.gmd,\event\st0404\st0404ev015.arc,st0404ev015.arc,5,
0,,メイリーフがどうしてもと言って聞かないのでな,"Mayleaf won't listen, so...",ui\00_message\event\st0404\ev015.gmd,\event\st0404\st0404ev015.arc,st0404ev015.arc,6,
0,,隊長さん、ここ――,"Captain, this place...",ui\00_message\event\st0404\ev015.gmd,\event\st0404\st0404ev015.arc,st0404ev015.arc,7,