0,,"あ、ごめんなさい
わたしじゃなくて、まず、白竜様だよね？","Oh, I'm sorry. It's not me, but The White Dragon
first, right?",ui\00_message\npc\base\n0014.gmd,\npc\n0014.arc,n0014.arc,46,Mayleaf
0,,白竜様も、早く元気になるといいね,I hope The White Dragon gets well soon.,ui\00_message\npc\base\n0014.gmd,\npc\n0014.arc,n0014.arc,47,Mayleaf
0,,"黒騎士はどこへ行ったの？
行方がわからないなんてこわい！","Where did The Black Knight go? It's scary not
knowing their whereabouts!",ui\00_message\npc\base\n0014.gmd,\npc\n0014.arc,n0014.arc,48,Mayleaf
0,,リズ、もう聞こえていないみたい――,"Lise, I don't think he can hear me anymore—",ui\00_message\npc\base\n0014.gmd,\npc\n0014.arc,n0014.arc,49,Mayleaf
0,,隊長さん、気をつけてね,"Captain, be careful.",ui\00_message\npc\base\n0014.gmd,\npc\n0014.arc,n0014.arc,50,Mayleaf
0,,全部終わったんだよね？,Is it all finished?,ui\00_message\npc\base\n0014.gmd,\npc\n0014.arc,n0014.arc,51,Mayleaf
0,,"こわいことや悲しいことは
もう起こらないんだよね？","Scary and sad things won't happen anymore, right?",ui\00_message\npc\base\n0014.gmd,\npc\n0014.arc,n0014.arc,52,Mayleaf
0,,"いまは戦いに備える時
語り合うのは、またの機会だ","Now is the time to prepare for battle.
We'll talk about it another time.",ui\00_message\npc\base\n0015.gmd,\npc\n0015.arc,n0015.arc,0,Kieshildt
0,,覚者――白竜の力を預かる者か,"Arisen - the one who holds the power of The White
Dragon.",ui\00_message\npc\base\n0015.gmd,\npc\n0015.arc,n0015.arc,1,Kieshildt
0,,"――？　ああ、失礼
考え事を少々、ね","――? Ah, excuse me.
Just thinking about something for a moment, hmm.",ui\00_message\npc\base\n0015.gmd,\npc\n0015.arc,n0015.arc,2,Kieshildt
0,,"そういうえば覚者と話したことは
あまりなかったな――
今度ゆっくり話そうか","Come to think of it, I didn't have many
conversations with the Arisen—
Shall we talk in detail next time?",ui\00_message\npc\base\n0015.gmd,\npc\n0015.arc,n0015.arc,3,Kieshildt
0,,"聞きたいことが山ほどある
そんな顔だね","There are so many things I want to ask. That's
the kind of expression you have.",ui\00_message\npc\base\n0015.gmd,\npc\n0015.arc,n0015.arc,4,Kieshildt
0,,"僕はどんなふうに見えるんだい？
生を楽しんでいるように見えるかい？","How do I look?
Do I look like I'm enjoying life?",ui\00_message\npc\base\n0015.gmd,\npc\n0015.arc,n0015.arc,5,Kieshildt
0,,"気づかなかったが――
きみはいい目をしているな",I hadn't noticed— you have a good eye.,ui\00_message\npc\base\n0015.gmd,\npc\n0015.arc,n0015.arc,6,Kieshildt
0,,"覚えていてほしい
取るに足りない――なんでもない――
そういうことが実は大きな意味を持っている
それに気づくのはね、大いなる喜びだよ","Remember, insignificant—nothing—such things
actually mean a great deal. It's a great joy to
realize that, you know?",ui\00_message\npc\base\n0015.gmd,\npc\n0015.arc,n0015.arc,7,Kieshildt
0,,"つくづく思うよ
世界はね、複雑なんだ
白と黒、善と悪――
そんな単純な区分けはできないのさ","I really think the world is, you know,
complicated black and white, good and evil--
there's no such simple division.",ui\00_message\npc\base\n0015.gmd,\npc\n0015.arc,n0015.arc,8,Kieshildt
0,,"人間は興味深いけど
時に、難解すぎる存在だよ","Humans are interesting but sometimes, they are
too difficult to understand.",ui\00_message\npc\base\n0015.gmd,\npc\n0015.arc,n0015.arc,9,Kieshildt
0,,"信じる力はとても大切だ
僕も信じているんだ
帰るべき場所――仲間の無事をね","The power of belief is very important. I believe
in it too. The place I should return to - the
safety of my comrades.",ui\00_message\npc\base\n0015.gmd,\npc\n0015.arc,n0015.arc,10,Kieshildt
0,,"朝が好きなんだ
幼いころに感じた、あの風の匂いがするからね","I like mornings, because it reminds me of the
scent of that wind when I was a child.",ui\00_message\npc\base\n0015.gmd,\npc\n0015.arc,n0015.arc,11,Kieshildt
0,,ああ、君か,"Ah, it's you.",ui\00_message\npc\base\n0015.gmd,\npc\n0015.arc,n0015.arc,12,Kieshildt
0,,死に急ぐか、若造が,"Do you want to hurry up and die, you brat?",ui\00_message\npc\base\n0016.gmd,\npc\n0016.arc,n0016.arc,0,Mogok
0,,慈悲などやらん、死ね,"No mercy, just death.",ui\00_message\npc\base\n0016.gmd,\npc\n0016.arc,n0016.arc,1,Mogok
0,,木偶どもにはもう飽きたわ,I'm tired of these puppets already.,ui\00_message\npc\base\n0016.gmd,\npc\n0016.arc,n0016.arc,2,Mogok
0,,"わからんな――
お前に勝ち目などない",I don't understand— you don't stand a chance.,ui\00_message\npc\base\n0016.gmd,\npc\n0016.arc,n0016.arc,3,Mogok
0,,"殺し合いの最中に――
笑わせてくれるわ","In the midst of the killing, You make me laugh.",ui\00_message\npc\base\n0016.gmd,\npc\n0016.arc,n0016.arc,4,Mogok
0,,"帰れ――殺すぞ？
おまえは好かん",Go home... or I'll kill you. I don't like you.,ui\00_message\npc\base\n0016.gmd,\npc\n0016.arc,n0016.arc,5,Mogok
0,,まだ盾突くか――ならば、死をくれてやる,"If you still dare to thrust your shield――then
allow me to give you death",ui\00_message\npc\base\n0016.gmd,\npc\n0016.arc,n0016.arc,6,Mogok
0,,"殺す、ただ殺す
それが世界だ","Kill, just kill. That's how the world works.",ui\00_message\npc\base\n0016.gmd,\npc\n0016.arc,n0016.arc,7,Mogok
0,,"気づいているだろうが――
おまえらの死は無駄にはならん
ふははは！","You may have noticed, but...
Your deaths will not be in vain.
Hahaha!",ui\00_message\npc\base\n0016.gmd,\npc\n0016.arc,n0016.arc,8,Mogok
0,,"その命、よこせ
さあ、よこせ！","Give me that life. Come on, give it to me!",ui\00_message\npc\base\n0016.gmd,\npc\n0016.arc,n0016.arc,9,Mogok
0,,ほう――身の程知らずめ,"You fool, know your place.",ui\00_message\npc\base\n0016.gmd,\npc\n0016.arc,n0016.arc,10,Mogok
0,,なんだ？　うまい話でもあるのか？,What's that? You got a better offer?,ui\00_message\npc\base\n0017.gmd,\npc\n0017.arc,n0017.arc,0,Zuhl
0,,"オマイと話だと？
ガハハハ、笑わせる！","Talking to me? Gahahahaha, you make me laugh!",ui\00_message\npc\base\n0017.gmd,\npc\n0017.arc,n0017.arc,1,Zuhl
0,,遊びたいが、またな,"I'd love to play, but see ya.",ui\00_message\npc\base\n0017.gmd,\npc\n0017.arc,n0017.arc,2,Zuhl
0,,"俺サマとトモダチになろうってか？
悪くないな、でも、まあヤメとくよ","You want to become friends with me? Not bad, but
well, I'll pass.",ui\00_message\npc\base\n0017.gmd,\npc\n0017.arc,n0017.arc,3,Zuhl
0,,"オマイ、強いんだろ？
ちょいと、試してやろうか？","You, are you strong? Shall I test you a little?",ui\00_message\npc\base\n0017.gmd,\npc\n0017.arc,n0017.arc,4,Zuhl
0,,オマイら、まとめてブッ壊すからな,I'll destroy all of you at once!,ui\00_message\npc\base\n0017.gmd,\npc\n0017.arc,n0017.arc,5,Zuhl
0,,"あ？　目的だと？
楽しみは秘密にする主義でな","What?　You said you wanted to do this?
I like to keep my pleasures a secret.",ui\00_message\npc\base\n0017.gmd,\npc\n0017.arc,n0017.arc,6,Zuhl
0,,"暴れたいトキに暴れる
それが人生ってヤツだ","When you want to go wild, just go wild.
That's what life is all about.",ui\00_message\npc\base\n0017.gmd,\npc\n0017.arc,n0017.arc,7,Zuhl
0,,"つまんねえな
ここいらにゃ、弱いヤツらしかいねえのか","Boring.
Are there only weak people around here?",ui\00_message\npc\base\n0017.gmd,\npc\n0017.arc,n0017.arc,8,Zuhl
0,,"アレを、アレして――こうなる！
グフ、グフフフフフ！","Doing that, it becomes like this! Gufu,
gufufufufu!",ui\00_message\npc\base\n0017.gmd,\npc\n0017.arc,n0017.arc,9,Zuhl
0,,なんだよ――オマイ、なんだよ！,"What is it - you, what is it!",ui\00_message\npc\base\n0017.gmd,\npc\n0017.arc,n0017.arc,10,Zuhl
0,,"巡る竜力を感じます――
やっぱり、心地良いものですね","I feel the Dragon Force circulating around— After
all, it's a pleasant sensation.",ui\00_message\npc\base\n0020.gmd,\npc\n0020.arc,n0020.arc,0,Cecily
0,,黒騎士のことを考えていました――,I was thinking about The Black Knight...,ui\00_message\npc\base\n0020.gmd,\npc\n0020.arc,n0020.arc,1,Cecily
0,,"こう見えて、結構戦えるつもりです
必要とあればなんなりと","Despite my appearance, I am prepared to fight
rather well. If necessary, I am willing to do
whatever it takes.",ui\00_message\npc\base\n0020.gmd,\npc\n0020.arc,n0020.arc,2,Cecily
0,,"みなさんの戦い方はとても洗練されていますね
勉強させてもらいます","Everyone's way of fighting is very refined, isn't
it? I will learn from it.",ui\00_message\npc\base\n0020.gmd,\npc\n0020.arc,n0020.arc,3,Cecily
0,,みなさんとご一緒できて光栄です,It's an honor to be here with you all.,ui\00_message\npc\base\n0020.gmd,\npc\n0020.arc,n0020.arc,4,Cecily
0,,ご恩はいつかお返しさせていただきます,"Yes, I will return the favor someday.",ui\00_message\npc\base\n0020.gmd,\npc\n0020.arc,n0020.arc,5,Cecily
0,,"覚者が一目置かれるのは
みなさんの普段の行いが素晴らしいからですよね","Arisen are respected because of everyone's
wonderful daily conduct, aren't they?",ui\00_message\npc\base\n0020.gmd,\npc\n0020.arc,n0020.arc,6,Cecily
0,,お疲れじゃないですか？,Are you tired?,ui\00_message\npc\base\n0020.gmd,\npc\n0020.arc,n0020.arc,7,Cecily
0,,"面倒をかけているわたしが言うのも変ですけど――
時々休んでくださいね","It's strange for someone like me who is causing
trouble to say it, but please take occasional
rests.",ui\00_message\npc\base\n0020.gmd,\npc\n0020.arc,n0020.arc,8,Cecily
0,,はい、なんでしょう,"Yes, what is it?",ui\00_message\npc\base\n0020.gmd,\npc\n0020.arc,n0020.arc,9,Cecily
0,,"本当に何から何までお世話になってしまって
お礼の言葉もありません","I really can't thank you enough for everything
you've done for me.",ui\00_message\npc\base\n0020.gmd,\npc\n0020.arc,n0020.arc,10,Cecily
0,,"わたしにできることがあれば言ってください
戦場でも少しはお役に立てると思います","Let me know if there is anything I can do for you.
I'm sure I can be of some help on the battlefield.",ui\00_message\npc\base\n0020.gmd,\npc\n0020.arc,n0020.arc,11,Cecily
0,,"わかっています
少し――いいえ、かなり焦っています","I understand I'm a little bit - no, I'm quite
anxious.",ui\00_message\npc\base\n0020.gmd,\npc\n0020.arc,n0020.arc,12,Cecily
0,,"これ以上、ご迷惑をおかけするのが
心苦しくって――",It pains me to cause you any more trouble.,ui\00_message\npc\base\n0020.gmd,\npc\n0020.arc,n0020.arc,13,Cecily
0,,"ロイグ――
あの人はわたしを知っていましたけど
わたしは――
いくら記憶を探ってもロイグが登場しません","Loeg ――
That person knew me.
But I ――
No matter how much I search my memory, Loeg does
not appear.",ui\00_message\npc\base\n0020.gmd,\npc\n0020.arc,n0020.arc,14,Cecily
0,,"それほど交わりの薄い人なのでしょうか――
もう一度会えれば――話せれば――","Is he such a distant person to me - If I could
see him again - If I could talk to him -",ui\00_message\npc\base\n0020.gmd,\npc\n0020.arc,n0020.arc,15,Cecily
0,,"不思議です
不安だし、焦りもあるんですけど","It's strange and I feel uneasy and anxious, but.",ui\00_message\npc\base\n0020.gmd,\npc\n0020.arc,n0020.arc,16,Cecily
0,,"以前とは違って――
みなさんと一緒なら、なんとかなる
そんな風に思えるようになりました","Unlike before - I feel like I can manage with
everyone.",ui\00_message\npc\base\n0020.gmd,\npc\n0020.arc,n0020.arc,17,Cecily
0,,"ロイグと話せればわたしの記憶は
きっと戻ると思います","If I can talk to Loeg, I'm sure my memories will
come back.",ui\00_message\npc\base\n0020.gmd,\npc\n0020.arc,n0020.arc,18,Cecily
0,,"待っていてくださいね
きっと――
きっと全部思い出しますから","Please wait for me. I'm sure—I'll definitely
remember everything.",ui\00_message\npc\base\n0020.gmd,\npc\n0020.arc,n0020.arc,19,Cecily
0,,"もっともっとロイグと話すべきですよね？
それはわかっているんです
でも、もどかしくて――","I should talk to Loeg more often, right? I know
that but it's frustrating.",ui\00_message\npc\base\n0020.gmd,\npc\n0020.arc,n0020.arc,20,Cecily
0,,"わたしたちは勝利に向かって
確実に進んでいるはずですよね",We are definitely on the road to victory.,ui\00_message\npc\base\n0020.gmd,\npc\n0020.arc,n0020.arc,21,Cecily
0,,"もちろん勝利が全てではありませんけど
未来への道しるべになりますよね？","Of course, winning isn't everything. But it's a
signpost for the future, right?",ui\00_message\npc\base\n0020.gmd,\npc\n0020.arc,n0020.arc,22,Cecily
0,,"ゲートのことはわたしに任せてください
どんなに時間がかかっても
皆さんを必ずフィンダムにご招待します","Let me take care of the gate. No matter how long
it takes, I promise to bring you all to Phindym!",ui\00_message\npc\base\n0020.gmd,\npc\n0020.arc,n0020.arc,23,Cecily
0,,"早く集落を目指しましょう
何より、森の中は安全とは言えません","Let's get to the village as soon as possible.
Above all, it is not safe in the forest!",ui\00_message\npc\base\n0020.gmd,\npc\n0020.arc,n0020.arc,24,Cecily
0,,"隊長、急ぎましょう
ガルドリンさんがいい人なのは知っていますが
誤解を招きやすい性格ですから――
胸騒ぎがします！","Captain, let's hurry. I know Gurdolin is a good
person, but they have a personality that is easily
misunderstood. I have a feeling of unease!",ui\00_message\npc\base\n0020.gmd,\npc\n0020.arc,n0020.arc,25,Cecily
0,,"状況に流されるだけではなく、抵抗を試みる――
フィンダムではまだ新しい考え方です","Don't just be swept away by the situation, try to
resist-- It's still a new idea in Phindym!",ui\00_message\npc\base\n0020.gmd,\npc\n0020.arc,n0020.arc,26,Cecily
0,,"協力してくれる人はまだまだ少ないので
わたしが父を探してあげないと――","Since there are still very few people who are
willing to help, I have to find my father
myself...",ui\00_message\npc\base\n0020.gmd,\npc\n0020.arc,n0020.arc,27,Cecily
0,,"隊長――
父に――父にもしものことがあれば
わたしは――","Captain -- If something were to happen to my
father -- I...",ui\00_message\npc\base\n0020.gmd,\npc\n0020.arc,n0020.arc,28,Cecily
0,,"すいません、今はこんな個人的な思いは
しまっておくべきですよね","Sorry, I should probably put these personal
thoughts away for now.",ui\00_message\npc\base\n0020.gmd,\npc\n0020.arc,n0020.arc,29,Cecily
0,,"隊長、父は元気になりますよね？
父の傷は、致命傷ではありませんよね？","Captain, is Father going to be okay? His wounds
are not fatal, right?",ui\00_message\npc\base\n0020.gmd,\npc\n0020.arc,n0020.arc,30,Cecily
0,,"あと少しですよ、隊長
《原始の雫》が芯なる樹を――
ひいてはこのフィンダムを浄化してくれます","Left: just a little more, Captain. The ""Primeval
Drops"" will cleanse the core tree- and in turn,
cleanse Phindym for us.",ui\00_message\npc\base\n0020.gmd,\npc\n0020.arc,n0020.arc,31,Cecily
0,,"その後の美しいフィンダムを
皆さん、ご案内しますからね","I will show everyone the beautiful Phindym that
comes after that.",ui\00_message\npc\base\n0020.gmd,\npc\n0020.arc,n0020.arc,32,Cecily
0,,"《原始の雫》はわたしの命に替えても守ります
隊長たちは魔物退治に専念してください","I will protect the《Primeval Drops》 with my life.
Captain, please focus on defeating the enemies.",ui\00_message\npc\base\n0020.gmd,\npc\n0020.arc,n0020.arc,33,Cecily
0,,"このあたりの侵食魔を一掃すれば
次はいよいよ浄化です
もう少し、よろしくお願いします","If we completely eliminate these corrupting
demons in this area, then it will finally be time
for the purification. A little while longer,
please.",ui\00_message\npc\base\n0020.gmd,\npc\n0020.arc,n0020.arc,34,Cecily
0,,"明るい未来――
夢見ても大丈夫ですよね？","Bright future-- It's okay to dream, right?",ui\00_message\npc\base\n0020.gmd,\npc\n0020.arc,n0020.arc,35,Cecily
0,,隊長――あと少しだけ、よろしくお願いしますね,"Captain--I'll be counting on you for a few more
minutes.",ui\00_message\npc\base\n0020.gmd,\npc\n0020.arc,n0020.arc,36,Cecily
0,,"おつかれさまです、隊長
俺のやる気、爆発しそうですよ！","Captain--I'll be counting on you for a few more
minutes.",ui\00_message\npc\base\n0021.gmd,\npc\n0021.arc,n0021.arc,0,Elliot
0,,"隊長、俺を忙しくしてください
ジョゼフ様のところへは戻りたくないんです","Captain, please keep me busy I don't want to go
back to Master Joseph.",ui\00_message\npc\base\n0021.gmd,\npc\n0021.arc,n0021.arc,1,Elliot
0,,"レスタニアはまた大変なことになりましたけど――
そのおかげで隊長と一緒に働けて――","Lestania is in trouble again, but— that allowed
me to work with the captain and—",ui\00_message\npc\base\n0021.gmd,\npc\n0021.arc,n0021.arc,2,Elliot
0,,不謹慎だけど――俺、うれしいです,I know it's inappropriate—but I'm glad I'm here.,ui\00_message\npc\base\n0021.gmd,\npc\n0021.arc,n0021.arc,3,Elliot
0,,"隊長がレオ統率の右腕なら――
俺は隊長の右腕になります！","If Captain is Leo's right-hand man, I will be
Captain's right-hand man!",ui\00_message\npc\base\n0021.gmd,\npc\n0021.arc,n0021.arc,4,Elliot
0,,"リズと俺――ある意味、敵同士ですよね
どっちが隊長の信頼を勝ち取るか――みたいな","Lise and me—In a way, we are enemies, aren't we?
It's like, who will earn the captain's trust?",ui\00_message\npc\base\n0021.gmd,\npc\n0021.arc,n0021.arc,5,Elliot
0,,"セシリーはちょっと固いというか――
真面目すぎるんですよね",Cecily is a bit stiff or-- too serious.,ui\00_message\npc\base\n0021.gmd,\npc\n0021.arc,n0021.arc,6,Elliot
0,,"オーク戦争の頃、リズはレスタニアを巡って
お宝とか探してたらしいですね
なんだか、遅れを取った気分です","I heard that during the orc wars, Lise was
cruising around Lestania looking for treasures and
stuff.
I feel like I'm falling behind!",ui\00_message\npc\base\n0021.gmd,\npc\n0021.arc,n0021.arc,7,Elliot
0,,"侵食魔のせいかな――
少し空気が濁った感じ、しませんか？","Maybe it's the Corruption?
The air seems a little muddy, don't you think?",ui\00_message\npc\base\n0021.gmd,\npc\n0021.arc,n0021.arc,8,Elliot
0,,"隊長――
やっぱり覚者というのは戦ってこそ、ですよね
つくづく、そう思いますよ","Captain-- Indeed, it is through battle that an
Arisen truly shows their worth. I am deeply
convinced of this.",ui\00_message\npc\base\n0021.gmd,\npc\n0021.arc,n0021.arc,9,Elliot
0,,"ガルドリンが細々と賭けを持ちかけてくるんですよね
おかげで――いえ、なんでもありません！","Gurdolin keeps coming up with small bets, you
know. Thanks to that... Well, never mind!",ui\00_message\npc\base\n0021.gmd,\npc\n0021.arc,n0021.arc,10,Elliot
0,,"戦いに慣れてから、時々ですけど、もっと刺激が
ほしいなんて、考えちゃうんですよ","After getting used to battles, sometimes, I can't
help but think that I want more excitement.",ui\00_message\npc\base\n0021.gmd,\npc\n0021.arc,n0021.arc,11,Elliot
0,,ダメですよね、こういうこと考えちゃ,"It's not good, thinking about things like that.",ui\00_message\npc\base\n0021.gmd,\npc\n0021.arc,n0021.arc,12,Elliot
0,,"ガルドリンのこと、いろんな人から聞くんですけど
どうやら最近は丸くなったというか
落ち着いたというか――","I hear about Gurdolin from various people, and it
seems that recently, they have become more
well-rounded, or rather, calmer.",ui\00_message\npc\base\n0021.gmd,\npc\n0021.arc,n0021.arc,13,Elliot
0,,"最近のことしか知らない俺にしてみれば
これで！？　って感じですけどね","From my perspective, as someone who only knows
recent things, I have to say... is this it!? But
well, that's how I feel.",ui\00_message\npc\base\n0021.gmd,\npc\n0021.arc,n0021.arc,14,Elliot
0,,"ジョゼフ様から聞く話に隊長が登場するようになって
どれくらい経つか忘れましたけど――","It has been some time since Captain made their
debut, or so it feels, as I heard from Ser Joseph.
But I can't exactly remember how long ago it was.",ui\00_message\npc\base\n0021.gmd,\npc\n0021.arc,n0021.arc,15,Elliot
0,,思うに、隊長って、全然変わってないですよね,"In my opinion, the captain hasn't changed at all,
right?",ui\00_message\npc\base\n0021.gmd,\npc\n0021.arc,n0021.arc,16,Elliot
0,,"リズって、ああ見えて、意外と世の中を
見てるんですよね
自分のことは見えていないようだけど","Lise looks like that, but she sees the world
surprisingly well.
She doesn't seem to see herself, though.",ui\00_message\npc\base\n0021.gmd,\npc\n0021.arc,n0021.arc,17,Elliot
0,,なんでしょうか、隊長！,"What is it, Captain!",ui\00_message\npc\base\n0021.gmd,\npc\n0021.arc,n0021.arc,18,Elliot
0,,"セシリーはいい子ですよねえ
力になってあげたいなあ","Cecily is a good girl, isn't she? I want to be
supportive.",ui\00_message\npc\base\n0021.gmd,\npc\n0021.arc,n0021.arc,19,Elliot
0,,"隊長、急ぎましょう
何もかも、急ぎましょう","Captain, let's hurry! with everything, I mean",ui\00_message\npc\base\n0021.gmd,\npc\n0021.arc,n0021.arc,20,Elliot
0,,"早くセシリーを楽にしてあげないと
こっちまで息が詰まりそうです","We need to make Cecily feel better soon. I'm
choking up too!",ui\00_message\npc\base\n0021.gmd,\npc\n0021.arc,n0021.arc,21,Elliot
0,,"まあ、楽にすると言っても
どうしたらいいかなんて
わからないんですけどね","Well, even if I say I want to make it easier, I
don't know what to do, you know?",ui\00_message\npc\base\n0021.gmd,\npc\n0021.arc,n0021.arc,22,Elliot
0,,"騎士団には売れるだけ恩を売っておけなんていう
覚者もいますけど、俺に言わせれば
持ちつ持たれつですよ","Some Arisen believe in gaining favor with the
knight order as much as possible, but in my
opinion, it's all about mutual support.",ui\00_message\npc\base\n0021.gmd,\npc\n0021.arc,n0021.arc,23,Elliot
0,,"売ったとか買ったとか、借りた貸したなんて
どうでもいいことです――
って、考えられる人になりたいんです、俺","Selling, buying, borrowing, lending... It's all
trivial stuff. I want to become someone who can
think about more important things—me.",ui\00_message\npc\base\n0021.gmd,\npc\n0021.arc,n0021.arc,24,Elliot
0,,"時々、セシリーが思い詰めた顔をしていますよ？
なんとかしてあげられませんかねえ
もう、見ていられませんよ","Sometimes, Cecily has a troubled look on her
face, you know? Can't we do something to help her?
I can't bear to watch anymore.",ui\00_message\npc\base\n0021.gmd,\npc\n0021.arc,n0021.arc,25,Elliot
0,,"隊長、レスタニアは広いですね
今回ばかりは痛感しています","Captain, Lestania is far, isn't it? I am feeling
this particularly keenly this time.",ui\00_message\npc\base\n0021.gmd,\npc\n0021.arc,n0021.arc,26,Elliot
0,,"走っても、戦っても、尽きない敵
ええ、やりがいがありますよ！","Running, fighting, and endless enemies. Yes, it's
challenging!",ui\00_message\npc\base\n0021.gmd,\npc\n0021.arc,n0021.arc,27,Elliot
0,,俺、連戦でちょっと疲れちゃって――,I'm a little tired from the consecutive battles...,ui\00_message\npc\base\n0021.gmd,\npc\n0021.arc,n0021.arc,28,Elliot
0,,"もちろん、何かあれば動きますから
それ以外はここでジッとさせてください","Of course, if you need me to move, I'll move.
Otherwise, please let me stay put here.",ui\00_message\npc\base\n0021.gmd,\npc\n0021.arc,n0021.arc,29,Elliot
0,,"俺は隊長の右腕を自認してますから
誰が戻ろうと、去ろうと、そこだけは
変わりませんからね","I consider myself the captain's right-hand man;
No matter who comes back or leaves,
That will never change.",ui\00_message\npc\base\n0021.gmd,\npc\n0021.arc,n0021.arc,30,Elliot
0,,もちろん、ものすごく期待はしていますけど――,"Of course, I have really high expectations, but -",ui\00_message\npc\base\n0021.gmd,\npc\n0021.arc,n0021.arc,31,Elliot
0,,"セシリーの記憶が戻っても問題が
解決するわけじゃないんですよね
鍛錬して、腕を磨いておこうかな","Even if Cecily's memory returns, it doesn't mean
the problem will be solved, right? Maybe I should
train and sharpen my skills.",ui\00_message\npc\base\n0021.gmd,\npc\n0021.arc,n0021.arc,32,Elliot
0,,黒騎士対策が急務ってところですかね,"Is countermeasures against the Black Knight the
urgent matter here?",ui\00_message\npc\base\n0021.gmd,\npc\n0021.arc,n0021.arc,33,Elliot
